author,content,filename,org_name,original_rating,pdf_link,publish_time,rating_adjust_mark_type,rating_changes,report_id,save_path,stock_code,stock_name,title
刘岗,"事件：公司发布2018年三季报，2018年前三个季度营业收入761.7亿，同比增长22.9%；归母净利润33.5亿，同比增长51.4%;实现归属于上市公司股东的扣非净利润32.3亿元，同比增长98.6%。其中，2018Q3，公司实现营业收入263.6亿元，环比下降2.2%；归母净利8.26亿元，环比下滑42.7%，略低于市场预期。
公司Q3业绩低于预期，我们认为主要有三方面原因。（1）国内黄金、铜、锌金属价格环比下滑3.6%、4.6%和10%左右，对公司主要产品的销售价格产生一定的影响；（2）公司Q3利息费用为3.93亿元，导致财务费用环比增加了1.06亿元；（3）公司Q3资产减值损失环比提升65.9%，增加至4.28亿元，对Q3归母净利的影响为2.58亿元。
公司矿产铜、矿产锌量价同比增长，毛利率同比提升。公司18年前三季度矿产铜、矿产锌产量同比增长19.44%、7.76%，矿产铜、矿产锌销售单价分别同比增长7.50%、6.7%。前三季度矿山企业的综合毛利率为48.68%，同比增加2.62个百分点。
公司继续扩展铜资源版图，以及多个优质项目产能待释放，未来业绩可期。2018年公司以13.9亿美元（95.3亿元）要约收购Nevsun全部股权，获得Bisha铜矿100%、Timok上带100%、Timok下带46%的股权。公司2018年以3.5亿美元收购RTBBor公司63%股权，且将在交易完成后6年内累计投入12.6亿美元（含增资款3.5亿美元）用于旗下4个矿山和1个冶炼厂技改扩建或新建。
公司2018、2019年陆续有产能逐步释放：多宝山二期扩建项目有望今年年底开始投产，并释放部分产能。2019年该项目预期可全面达产，带来5-6万吨新增产能释放。此外，公司目前正在启动科卢韦齐二期建设，预期二期建设明年投产，建成后科卢韦齐铜产量可达10万吨/年，钴2400吨/年。公司未来最大的利润增长点是卡莫阿铜矿，预期2020-2021年投产，实现铜产量30-40万吨/年。
盈利预测与评级。预计2018-2020年EPS分别为0.20元、0.26元、0.30元，对应PE分别为18倍、14倍和12倍，维持“买入”评级。
风险提示：铜、锌、金金属价格或大幅波动，矿山项目投产或不达预期，汇率风险。",,西南证券,买入,[None],2018-10-30,,买入,2254871,pdf_downloads/2018/2018-10-30/601899-紫金矿业（601899）：矿山利润增长稳健，铜矿资源版图再扩展.pdf,601899,紫金矿业,紫金矿业（601899）：矿山利润增长稳健，铜矿资源版图再扩展
"任志强,王保庆","事项： 10月26日晚，公司发布2018年三季度报告，前三季度公司实现营业收入761.73亿元，同比增长22.9%；归属净利润33.52亿元，同比增长51.4%。2018年第三季度，公司实现营业收入263.59亿元，环比下降2.19%；归属净利润8.26亿元，环比下降42.68%。 评论： 锌量价齐跌致毛利下滑。2018年第三季度，公司毛利31.38（-4.5）亿元，其中锌矿业务大幅下滑3.13亿元为主因。受市场影响公司矿产金、矿产铜和矿产锌销售价格均不同程度的下跌，分别为245.78（-5.31）元/克、33,671（-2,822）元/吨和12,252（-3,370）元/吨。矿产金：产量9.26吨与第二季度持平，但销量增加0.87吨，同时克金成本进步下降，带动该板块毛利增厚0.52亿元至7.94亿元。矿产铜：产量环比增0.3万吨至6.31万吨，吨成本下降，但因价格下跌，毛利下降0.26亿元至11.01亿元。矿产锌：产量下滑0.28万吨至7.11万吨，但销量下滑1.35万吨至6.21万吨，虽吨成本有所降低，但无法对冲量价齐跌的风险，毛利下滑3.13亿元。 “三费”和减值等增加进一步拖累公司业绩。2018年第三季度公司，人民币汇率波动导致公司财务成本大幅增加1.06亿元至1.45亿元。管理费用（含研发费用）增加0.76亿至7.68亿元。同时，资产减值损失大幅增加1.7亿元至4.28亿元进一步影响公司业绩，主要为环闽矿业和连城紫金矿业因采矿权和探矿权存在减值迹象，分别计提无形资产减值准备1.95亿元和1.34亿元。 未来业绩的核心为铜矿产量增加和金价上涨。2018年，假设铜/金/银/锌价格分别为5/275/3,919/2.4(铜锌钴：万元/吨；金：元/克；银：元/千克)，公司计划生产铜矿/金矿/银矿/锌矿产量分别为24.4万吨/37吨/213吨/27.41万吨，同比增加3.6万吨/-0.48吨/25吨/0.41万吨。根据实际情况预计黄金产量较计划低1.5吨。毛利增厚5亿元至137亿。2019年，假设铜/金/银/锌/钴价格分别为5/285/3,919/2.25/63(铜锌钴：万元/吨；金：元/克；银：元/千克)，我们预测铜矿产量增加4.2万吨至28.6万吨，钴产量增加1,000吨，其余产量保持不变，则公司毛利将进一步增加8亿至145亿元。2020年，假设产品价格与2019年持平，卡莫阿铜矿20万吨/年年中投产，则公司铜矿权益产量增加4.23万吨至32.83万吨，其余产量保持不变，则公司毛利将增加5亿元至150亿元。 盈利预测、估值及投资评级：根据市场，我们将2018年矿产金产量预期下调1.5吨至36.5吨，2019年和2020年铜价下调至5万元/吨，金价上调至285元/克，其他假设不变，则预计公司归属净利润分别为42.51/49.60/55.75(亿元)，此前预测值分别为44.97/56.2/63.4(亿元)，对应的EPS分别为0.18/0.22/0.24(元/股)。对应10月26日收盘价3.55元，PE分别为19/16/15(倍)。基于未来两年金价仍望保持上涨和公司的铜矿产量持续增加的预期，维持“推荐”评级。 风险提示：贸易战持续升级、产量不及预期、汇兑损失超预期、刚果（金）政治局势风险、减值超预期。",,华创证券,推荐,[None],2018-10-29,,增持,2254402,pdf_downloads/2018/2018-10-29/601899-紫金矿业（601899）：2018年三季报点评：三费及减值拖累业绩、铜矿增量及金价为业绩核心变量.pdf,601899,紫金矿业,紫金矿业（601899）：2018年三季报点评：三费及减值拖累业绩、铜矿增量及金价为业绩核心变量
谢鸿鹤,"事件：2018年10月26日，紫金矿业披露公司三季报，Q1-3公司实现营业收入761.73亿元，同比增长22.9%；实现归属于上市公司股东的净利润33.52亿元，同比增长51.4%；实现扣非净利润32.27亿元，同比大幅增长98.67%。从单季数据看，Q3公司实现营业收入263.59亿元，同比增长16.53%，环比下滑2.2%；实现归属于上市公司股东的净利润8.26亿元，同比增长188.35%，环比下滑42.7%；实现归属于上市公司股东的扣非净利润8.50亿元，同比增长13.2%，环比下滑35.8%。
价升+量增，驱动公司业绩高增长。1）价格上涨，为公司业绩高增长提供基础。2018年前三季度，在美元走强、中美贸易摩擦以及国内经济不确定性增大共同作用下，黄金以及铜、锌价格承压运行，虽环比有所下降，但同比仍呈大幅上涨态势，具体来看，2018Q1-3，伦敦金均价为1285.7美元/盎司，同比上涨约2.5%；LME3M铜、锌均价分别为6675美元/吨、3007美元/吨，同比分别上涨约12%和8%。2）量的增长，又进一步强化公司业绩弹性。三季报数据显示，2018Q1-3，黄金产量162,794千克，同比增长约14%，其中，矿产金受波格拉金矿影响（2月地震，6月已恢复生产），产量同比下降约7.6%至16,880千克（降幅较2018H1收窄）；铜产量51.0万吨，同比增长9.4%，其中，矿产铜在科卢韦齐矿浮选系统迅速达产带动下，同比大幅增长19%至18.2万吨；锌产量34.9万吨，同比小幅上涨0.5%，其中，矿产锌同比增长7.8%至21.9万吨。3）销售成本同比虽有所上涨，但涨幅低于售价。三季报数据显示，公司矿产金、铜、锌销售成本分别为168.3元/克、17061元/吨、5001元/吨，同比分别上涨2.7%、3.6%和-0.9%，而销售单价分别为250.96元/克、35,773元/吨、14,860元/吨，同比分别上涨2.0%、7.3%和9.6%。更进一步，报告期内，盈利能力突出的矿山金、矿山铜和矿山锌毛利率分别为32.94%、52.31%和66.35%，同比分别下滑0.4、提升1.7、提升3.6个百分点，矿山企业综合毛利率同比提升2.6个百分点至48.68%。综上，我们认为价升量增，尤其是毛利率高的矿产铜、锌快产量大幅攀升，是支撑公司前三季度业绩高增长的主因。
价格环比下行+期间费用增加+资产减值计提，拖累Q3单季业绩表现。具体来看，1）Q3公司矿产金、矿产铜以及矿产金销售价格分别为245.8元/克、33671元/吨、12252元/吨，环比分别下滑约2%、8%和22%，导致板块毛利分别增0.5亿元、减0.2亿元、减3.1亿元。2）期间费用环比增长20%至11.3亿元，其中，销售费用、管理费用以及财务费用环比分别增长约7%、5%和269%。3）公司对部分存在减值迹象的资产计提减值，对Q3归属于母公司净利润造成减利2.58亿元。
海外并购持续发力，极具成长性的国际矿业巨头，业绩继续可期。1）公司海外资源并购又迈出重要一步。①9月6日发布公告，以现金方式（约合13.9亿美元）要约收购NevsunResourcesLtd.全部股权，收购标的旗下拥有Bisha铜锌矿项目60%权益，以及Timok铜金矿项目（上带拥有100%权益；下带目前拥有60.4%权益，最终权益可能稀释至46%）两个旗舰项目，合计在塞尔维亚、厄立特里亚、马其顿拥有27个探矿权；②9月18日发布公告，以增资扩股方式获取RTBBOR集团63%股权（约合3.5亿美元），RTBBOR拥有塞尔维亚唯一在产铜矿及冶炼厂，控制+推断级铜金属量达786万吨。2）与此同时，公司卡莫阿-卡库拉项目预计于2020年投产，该铜矿为世界最大的未开采高品位铜矿，项目一期产能为600万吨/年（矿石量），前5年平均产量约为25万吨/年，再考虑到克鲁维奇项目爬产放量以及国内黑龙江多宝山项目改扩建工程，公司已然发展成为极具成长性的国际矿业巨头。3）而从价格走势方面看，供需紧平衡依然是铜板块主线逻辑，再考虑到海外扰动增加、国内基建发力，铜价有望步入长牛通道；锌板块虽然供需边际改善，但短缺继续，锌价有望高位震荡；而美元持续单边走强概率不大，真实收益率有望伴随后续美国经济边际走弱而下行（具体时点仍需数据验证，2019Q1需重点关注），对金价压制作用弱化，金价具备上攻动能。综上，我们认为公司量价双重弹性有望持续发力，业绩高增长继续可期。
盈利预测与投资建议：我们预计公司2018/2019/2020年归母净利润分别为46.9/58.1/75.8亿元，对应EPS分别为0.20/0.25/0.33元，目前股价对应的PE估值水平则分别为17X/14X/11X，维持“买入”评级。
风险提示事件：宏观经济波动风险，相关项目投产进度不及预期等风险。",,中泰证券,买入,[None],2018-10-29,,买入,2253384,pdf_downloads/2018/2018-10-29/601899-紫金矿业（601899）：成长型矿业巨头，业绩持续稳健！.pdf,601899,紫金矿业,紫金矿业（601899）：成长型矿业巨头，业绩持续稳健！
李斌,"发布18年三季报，三季度单季业绩同比上升
公司于10月26日发布18年三季报：2018年前三季度实现营业收入761.73亿元，同比增长22.90%；实现归母净利润33.52亿元，同比增长51.40%；EPS为0.15元。18年第三季度实现营业收263.59亿元，同比增长7.79%；归母净利润8.26亿元，同比增长16.53%。由于计提资产减值，公司三季报业绩略低我们此前预期，但经营性利润仍符合预期。公司拥有全球领先的铜金多金属矿山资源，铜矿产能中长期持续提升，预测18-20年EPS为0.19、0.24、0.26元，维持公司“增持”评级。
铜锌矿产量同比增长，矿山盈利能力有所改善
根据三季报，得益于主要产品铜、锌等金属产销量及销售价格同比上升，公司效益实现大幅提升。公司前三季度内矿产铜销售单价为3.58万元/吨，同比增长7.50%；矿产锌销售单价为2.07万元/吨，同比增长6.7%。公司18年前三季度生产矿产铜18.25万吨，同比增长19.44%；矿产锌21.94万吨，同比增长7.76%。前三季度内矿山企业的综合毛利率为48.68%，同比增加2.62个百分点。公司矿山盈利水平上升，金属产量符合预期。
计提资产减值影响利润，销售和管理费用有所增加
根据三季报，报告期内销售费用为6.41亿元，同比上升12.36%，主要是2018年前三季度产品销量增加所致；管理费用为20.82亿元，同比上升3.31%，主要是部分子公司由基建期转入生产期，管理费用增加。三季度单季，非经常损益项目对公司净利润的影响为-2.43亿元。根据公司计提资产减值准备的公告，公司1-9月资产减值准备金额为7.74亿元，其中7-9月计提减值准备金额为4.56亿元，对2018年7-9月归母净利润的影响为2.58亿元，对公司盈利产生一定影响。
发布多个矿山收购计划，谋求铜金资源版图扩张
据公告，2018年9月15日，公司向Nevsun全体股东发出《要约收购通函》，正式启动对Nevsun的现金收购；9月17日，公司与塞尔维亚签署《战略合作协议》，拟投资3.5亿美元收购塞尔维亚国有铜业公司（RTBBOR集团）63%的股权。Nevsun和RTBBOR集团经营海外铜金矿山及冶炼，公司是国际化的多金属矿业巨头，在利润改善的背景下，我们认为资源的扩张有望助力公司在长周期波动中保持成长性。
多金属资源版图稳健开拓，维持公司“增持”评级
由于公司计提资产减值，出于谨慎适当下调盈利。预计公司18-20年收入为904.19、917.74、936.37亿元，归母净利润为44.23、54.75、60.76亿元，较此前预测调整幅度分别为-8.80%、-1.42%、-1.84%，对应当前PE分别为18、15、13倍。参考可比公司18年Wind一致预期的PE的平均水平23倍，给予18年PE20-23倍，对应目标价区间3.80-4.37元（原3.99-4.41元）。维持“增持”评级。
风险提示：金铜等价格下跌；矿山采选品位下降；矿山项目进度不及预期。",,华泰证券,增持,[None],2018-10-29,,增持,2253415,pdf_downloads/2018/2018-10-29/601899-紫金矿业（601899）：资产减值计提拖累盈利，矿山利润稳定释放.pdf,601899,紫金矿业,紫金矿业（601899）：资产减值计提拖累盈利，矿山利润稳定释放
李斌,"发布多个矿山收购计划，谋求铜金资源版图扩张
2018年9月15日，公司向Nevsun全体股东发出《要约收购通函》，正式启动对Nevsun的现金收购；9月17日，公司与塞尔维亚签署《战略合作协议》，拟投资3.5亿美元收购塞尔维亚国有铜业公司（RTBBOR集团）63%的股权。Nevsun和RTBBOR集团经营海外铜金矿山及冶炼，公司是国际化的多金属矿业巨头，在现金流和利润改善的背景下，我们认为资源的扩张有望助力公司在长周期波动中保持成长性。我们预测18-20年公司EPS为0.21/0.24/0.27元，维持“增持”评级。
拟收购标的铜金资源丰富，具备较高开发潜力
据公告，RTBBOR集团控制4个低品位斑岩铜（金）矿山和1个冶炼厂，项目保有资源储量和技改扩产潜力较大；截至2014年底的最新统计，控制+推断资源量19.99亿吨，铜品位0.39%，铜金属量786万吨；金品位0.15克/吨，金金属量297吨。Nevsun旗下Bisha铜锌矿截止17年底铜锌推断+探明资源量分别为34.7和149.4万吨，Nevsun在Timok铜金矿的权益铜金属量786万吨、金219吨。我们认为两个拟收购的标的公司均有较为丰富的铜金等金属资源，具备较好的中长期发展潜力。
金属景气提升带动利润改善，铜业务贡献主要业绩
15-18年上半年，由于供给侧收缩及下游需求回暖，铜锌行业供需格局出现改善，价格自底部涨至高位，带动公司产品的盈利水平提升。据半年报，18年上半年公司归母净利润25.26亿，同比上升67.82%；经营性现金流49.81亿元，同比增长50.66%。
由于我们判断铜行业供需处于紧平衡状态，我们预计18-20年内铜价有望维持历史高位，或助力公司盈利水平的稳定，现金流的改善同时也为资源扩张提供较好的基础。
铜项目产能接力释放，远期卡莫阿矿山有望续航
据18年半年报，公司上半年生产矿产铜11.94万吨，矿产锌14.83万吨，矿产金16.88吨。据公司公告，科卢韦齐铜矿项目预计18-20年逐步达到满产，后续产能有望增至10万吨；多宝山铜矿2020年二期达产后产能有望扩至9万吨。公司目前正与艾芬豪共同推进大型项目刚果（金）卡莫阿矿山的建设，计划一期年矿石产能600万吨、铜30-40万吨，公司预计2020-2021年有望初步投产。我们认为公司中长期项目产能有望接力释放，具备较为充分的资源续航能力。
多金属资源版图稳健开拓，维持公司“增持”评级
预计公司18-20年收入为888.30、903.53、925.28亿元，归母净利润为48.50、55.09、62.15亿元，较此前预测调整幅度分别为-3.14%、-4.13%、-10.55%，对应当前PE分别为17、15、13倍。参考可比公司18年Wind一致预期的PE的平均水平19倍，由于公司持续进行资源扩张，作为铜金行业龙头，中长期储量和产能具备较大提升空间，给予公司一定估值溢价，给予18年PE19-21倍，对应目标价区间3.99-4.41元（原3.74-4.18元）。
维持“增持”评级。
风险提示：金铜等价格下跌；矿山采选品位下降；矿山项目进度不及预期。",,华泰证券,增持,[None],2018-09-20,,增持,2226833,pdf_downloads/2018/2018-09-20/601899-紫金矿业（601899）：再议紫金龙头价值，“资”“产”版图持续谋划.pdf,601899,紫金矿业,紫金矿业（601899）：再议紫金龙头价值，“资”“产”版图持续谋划
程文祥,"事件:
    公司于9月6日公告:拟以现金方式要约收购NevsunResoucesLtd全部已发行股份,交易金额约13.9亿美元(约合人名币95.3亿元)。每股收购价格较9月4日的收盘价溢价21%。被收购方Nevsun为一家以铜、锌、金为主的矿产资源勘查、开发公司,旗下拥有非洲厄立特里亚在产矿山Bisha铜锌矿项目及中东欧塞尔维亚的Timok铜金矿项目(分上、下矿带,上矿带已完成预科可研,下矿带尚处于勘探阶段)两个旗舰项目,合计在塞尔维亚、厄立特里亚、马其顿拥有27个探矿权。
    投资要点:
    收购将大幅增加公司锌、铜和金的储量及资源量:收购完成后,公司将持有Bisha铜锌矿60%权益,持有Timok铜金矿上矿带100%权益以及Timok铜金矿下矿带46%权益(下矿带为按照公司与自由港公司的协议稀释后的权益份额)。按权益计算,两矿合计将为公司带来的新增金属储量分别为锌53.0万吨、铜97.5万吨、金57.0吨和银220.0吨;新增金属资源量分别为锌187.7万吨、铜825.1万吨、金222.3吨和银1204.2吨。其中,锌和银的储量和资源量全部来自于Bisha,而铜和金的储量和资源量主要来源于Timok。权益储量中,来自Timok的铜占94%,金占93%(Timok的储量均来自上矿带,下矿带尚处于勘探阶段)。权益资源量中,来自Timok的铜占95%,金占90%(与储量相反,Timok的资源量主要来源于下矿带)。
    Timok上矿带8.6万吨铜项目2022年建成投产,内部收益率高达80%:收购完成后,公司将拥有Timok上矿带100%权益。整个Timok铜金矿目前尚未开发,其中的上带矿已于2018年3月完成预可研,预计2019年完成可研。根据Hatch等三家机构编制的预可研,Timok上带矿项目计划从2020年开始建设,预计2022年建成试产,项目初始资本开支5.74亿美元,项目服务年限为10年,服务期内年均铜产量8.6万吨,其中达产的前三年年均产铜可达14.8万吨。以铜价3.15美元/磅、贴现率8%计算,Timok上带矿预计净现值为18.2亿美元,内部收益率为80%;由于前期强劲的现金流,预计建成投产1年内既能回收建设投资。吸收Bisha在产矿山产能,公司铜、锌产量提升:收购完成后,公司持有Bisha60%权益。Bisha铜锌矿采剥能力为2000万吨/年,选矿设计产能为240万吨/年,最终产品为锌精矿和铜精矿,规划服务年限至2022年。2017年度生产锌金属产量约9.5万吨,铜金属产量约0.8万吨。收购完成后,公司持有Bisha60%权益。对应新增的权益产量预计为锌金属约5.7万吨,铜金属约0.48万吨。
    盈利预测与投资建议:预计公司2018-2019年EPS为0.23元和0.27元,结合2018年8月27日收盘价3.35,对应的PE为14.57和12.41倍,公司当前估值较低,近期和远期产销量增长确定性强,看好公司的成长性,维持“增持”评级。
    风险因素:有色金属价格大幅下跌;矿山产量释放不及预期",,万联证券,增持,[None],2018-09-12,,增持,2222818,"pdf_downloads/2018/2018-09-12/601899-紫金矿业(601899)点评报告：拟收购加拿大Nevsun,国际化战略持续推进.pdf",601899,紫金矿业,"紫金矿业(601899)点评报告：拟收购加拿大Nevsun,国际化战略持续推进"
叶洋,"事件：
公司发布中期业绩报告称，2018年上半年归属于母公司所有者的净利润为25.26亿元，较上年同期增67.82%；营业收入为498.14亿元，较上年同期增32.75%；基本每股收益为0.11元，较上年同期增59.42%。
投资要点：
矿产铜有望持续增加，矿产金产量维持
销量方面，矿产铜、锌的销量增幅分别达到25.6%和5.7%，矿产铜的增量主要来自于科卢韦齐项目的投产以及国内其他项目的产量增加。未来科卢韦齐二期和多宝山二期的建成投产将持续提升公司的矿产铜规模，而远期则仍将依赖于卡莫阿铜矿的建成投产。总体来看，公司的各个矿产铜项目正有条不紊地推进，2-3年内成为全球大型矿产铜生产企业。
矿产金的销量略有下降，矿产金主要是由于波格拉金矿停产及诺顿金田、紫金山产量略有下降，而半年报来看奥同克项目产量开始释放。公司的矿产金规模有望维持在40吨左右。
价格同比有显著上涨，长期保持乐观
从半年度销售均价来看，矿产金售价同比上涨6.1%，矿产铜售价同比上涨13.4%，矿产锌售价同比上涨21.9%。6月初以来金属产品均从高位回落，主要受到贸易战带来的经济悲观预期和美元强势的影响。长期来看我们仍然维持对全球经济复苏的乐观预期，叠加部分金属供给增速放缓，对于公司的产品售价保持乐观。
盈利预测及投资建议
预计公司2018-2020年归母净利分别为44.9亿、51.4亿和57.4亿元，EPS分别为0.20、0.22和0.25元，对应PE17.0X、14.8X和13.3X，看好公司的持续成长，维持“推荐”评级。
风险提示
全球经济增速不及预期；金属价格下跌；",,国联民生证券,推荐,[None],2018-08-29,,增持,2216521,pdf_downloads/2018/2018-08-29/601899-紫金矿业（601899）：产销规模持续扩大，业绩料持续增长.pdf,601899,紫金矿业,紫金矿业（601899）：产销规模持续扩大，业绩料持续增长
