author,content,filename,org_name,original_rating,pdf_link,publish_time,rating_adjust_mark_type,rating_changes,report_id,save_path,stock_code,stock_name,title
丁士涛,"业绩简评公司发布20年业绩预告修正公告，预计全年实现归母净利润27-30亿元，同比增长512.04%-580.05%，基本EPS1.60-1.78元。经营分析“一体两翼”战略推进，业绩持续超预期：19年公司提出一体两翼战略后，公司战略持续推进，石膏板主业全球扩产、轻钢龙骨配套率提升、防水业务增长释放业绩。公司已在20年半年度和三季度两次上调业绩预测，20年四季度以来，主要产品销售情况良好，公司再次上调业绩预告。?石膏板产能持续扩张，主业基石愈发稳固：公司于20年12月底发布公告，在山东惠民和邹平投资建设1条年产6,000万平米（配套年产1万吨轻钢龙骨产线）和2条年产5,000万平米纸面石膏板产线，联合重组新疆三家企业，新增石膏板产能5,700万平米。2019年，公司石膏板产能为27.52亿平米，上述三个项目若顺利完成，公司将新增产能8%，向“全球50亿平方米石膏板产业布局”目标更进一步。护面纸提价可传导，盈利能力将提升：受疫情及固废进口管控政策影响，废纸供应有所承压，近期多家纸业公司上调护面纸价格。在上游护面纸涨价的背景下，公司凭借60%的市占率，享有较高的定价权，可有效将成本向下游传导。目前公司部分产品已开始提价，且提价幅度高于成本上涨幅度。防水扩产预期强烈，未来充满想象空间：根据公司12月底公告，拟受让苏州防水研究院100%股权，进一步完善防水业务产业链，以期从技术研发和装备方面提升防水业务竞争力。根据公告，公司规划在“十四五”期间建设30个防水基地，而19年底公司防水基地仅为10个。深化与上游合作，抢占原料资源：工业副产石膏是石膏板生产的主流原料，通过与魏桥集团合作，可以锁定脱硫石膏资源，保证原料的稳定供应。盈利调整与投资建议我们上调2020-2022年石膏板价格和防水收入预测，预计公司2020-2022年归母净利润分别为28.65/36.88/44.96亿元（上调4/14/17%），对应PE29/23/19X。鉴于公司石膏板龙头地位和防水业务增长，给予公司21年30X估值，上调目标价至65.49元，维持“买入”评级。风险提示地产投资下滑；原料价格变动；国内外疫情反复。",,国金证券,买入,[None],2021-01-14,,买入,4419011,pdf_downloads/2021/2021-01-14/000786-北新建材（000786）：石膏板稳健前行，防水打开成长空间.pdf,000786,北新建材,北新建材（000786）：石膏板稳健前行，防水打开成长空间
王彬鹏,事项：北新建材发布2020年业绩修正预告：公司上修2020年预计归母净利润至27亿~30亿，同比+512%~580%，修正前业绩预告为24.6亿~27亿，同比+458%~+512%。评论：再次上修业绩预告，防水贡献主要增量利润：公司上修2020年预计归母净利润至27亿~30亿，同比+512%~580%，修正前业绩预告为24.6亿~27亿，同比+458%~+512%。公司2019年因美国诉讼案支出致业绩基数较低，扣除该因素后，业绩预计增长13.54%~26.16%，我们估计增量利润主要由防水板块贡献，石膏板预计与去年持平或略增。我们认为，公司在一季度疫情影响以及全年竣工不及预期的情况下，主业石膏板量价均保持了一定韧性，体现了龙头较强的抗风险能力，预计市占率仍在稳步提升。另外，根据官方公众号，前三季度公司防水业务实现利润4亿，新业务拓展顺利。Q3扣非业绩大幅增长，盈利提升现金流改善：公司20Q1-Q3实现营业收入120.77亿，同比+23.02%，实现归母净利润20.06亿，同比增长186倍，扣非净利润19.68亿，同比+6.84%。分季度看，公司Q1-Q3营收增速各为-14.29%、+34.06%、+36.42%，扣非净利增速各为-90.75%、+10.09%、+45.96%，Q3利润增长大幅提速，且单季度净利率超20%。前三季度公司期间费率为12.38%，同比-0.08pp，经营性现金流净额0.78亿，同比-13.08亿。一体两翼，2021年有望多点开花：1）石膏板：原材料供给偏紧+高端化趋势持续，石膏板均价有望抬升。脱硫石膏是火电厂的副产物，产量基本稳定，由于石膏在抹灰石膏及装配式领域的应用增加，需求增长或将大于供给增长；另外，行业高端化趋势也将抬升均价。我们认为2020年受疫情影响的竣工需求有望在2021年延后释放，若需求向好，公司作为市占率60%的龙头企业，具备较强的成本转嫁能力；2）龙骨：市占率仅5%，远低于主业石膏板的60%。按1亿平石膏板配套16万吨轻钢龙骨测算，公司龙骨需求量超300万吨，而目前产量仅二十多万吨，配套率约为8%，市占率仅5%，增长空间广阔；3）防水：优质赛道，格局优异。防水行业集中度明显低于石膏板，CR1仅10%左右，公司当前防水业务体量已位居行业前三，预计未来将持续享受行业集中度提升的红利，保持较快增长。2020年12月30日公司发布公告称以6921.32万元受让中建材苏州防水院100%股权，料未来将助力公司多元化业务整合。盈利预测及评级：我们预计2021年石膏板需求端有望受益于竣工需求的恢复。价格端，由于原材料涨价可能存在提价机遇，龙骨、防水也将贡献新的利润增长点，我们调整公司2020-2022年EPS预测至1.75/2.23/2.50元/股（原值为1.75/2.12/2.53元/股），对应PE各为28x/22x/20x，上调2021年估值至25x（原值为20x），目标价55.87元/股，维持“强推”评级。风险提示：房地产调控超预期收紧，疫情扩散超预期，协同效应不达预期。,,华创证券,强推,[None],2021-01-13,,买入,4418980,pdf_downloads/2021/2021-01-13/000786-北新建材（000786）2020年业绩预告点评：优质白马，千亿市值可期.pdf,000786,北新建材,北新建材（000786）2020年业绩预告点评：优质白马，千亿市值可期
"孙颖,朱晋潇","投资要点：事件：1月12日晚公司发布业绩预告修正公告，将20年归母净利润上调至27~30亿元（上调前为24.6~27.0亿元），全年同增512%~580%（上调前为同增458%~512 %）。对应20Q4单季归母净利润为6.94~9.94亿元，同增54%~120%。我们认为公司Q4业绩表现亮眼主要系主营石膏板及龙骨、防水等业务均有较好表现。石膏板Q4竣工反弹力度较强，单月竣工面积增速由Q3的同比负增长转为Q4的正增长。且考虑到部分实际竣工面积未纳入到竣工核算口径，预计Q4竣工回暖程度超预期，显著拉动石膏板需求。我们预计Q4石膏板单月销量同比保持大双位数增长；单价环比或维持稳定。21年起美废限制进口，导致近期护面纸价格上涨较多。据测算，单平石膏板约消耗护面纸360g（参考泰山石膏数据），护面纸涨价300元/吨增加公司原材料成本约0.11元/平（保守估计，因公司有部分自有护面纸产能，实际成本上升幅度低于前值）。成本压力下，部分石膏板企业已开始上调价格。当前时点正处于消费淡季，我们预计待旺季到来后，公司中、低端产品或均存在较大价格弹性。叠加21年新开工-竣工剪刀差持续修复为销量提供支撑。预计公司21年石膏板量价均有较好支撑。假设公司产品均价上调0.3元/平，21年全年销量保守估计为20亿平（2019年公司实际销量19.66亿平），其他条件不变情况下，保守估计公司营业利润将增厚3.8亿元，21年利润弹性充足。防水公司防水业务20H收入占比约20%，防水业务收入端受益于新开工的较强韧性与龙头公司市占率的快速提升；成本端受益于沥青价格维持低位（20Q4同比约有20%降幅），双重利好下预计防水贡献较多利润。考虑到公司在产能、渠道、资金等方面具备的显著优势，预计长期看市占率仍有较大提升空间。龙骨公司龙骨业务20H收入占比12%，19年增速37%，公司当前正大力发展该业务，预计Q4配套率进一步提升。考虑到当前龙骨配套率仍较低，后续仍有较大渗透空间。现金流持续表现优异：公司18和19年经营性现金流量净额为28和20亿，20Q1-3为0.8亿元，主要系防水行业影响，但一般Q4是重要的回款期，我们预计20年现金流情况也将维持在较好水平。投资建议：竣工修复+原材料涨价+石膏板本身价格低位背景下，21年石膏板或迎来量、价齐升。长期看石膏板绝对龙头结构进一步中高端化，定价能力进
一步体现；第二增长曲线明晰（防水、龙骨、建涂等）；现金流好于预期。",,中泰证券,增持,[None],2021-01-13,,增持,4418289,pdf_downloads/2021/2021-01-13/000786-北新建材（000786）：业绩上修符合预期，21年石膏板表现值得期待.pdf,000786,北新建材,北新建材（000786）：业绩上修符合预期，21年石膏板表现值得期待
"余斯杰,陈浩武",公司发布业绩预告，原先预告2020年归母净利24.6-27.0亿元上调为27.0-30.0亿元。同增512.0%-580.0%，EPS1.60-1.78。支撑评级的要点2020Q4继续保持利润50%以上增长，本次上调能进一步反映公司经营情况：按照业绩预告，公司2020Q4归母净利为6.9-9.9亿元，同增53.6-120.0%。公司自2020Q2以来营收与利润增速便双双保持高速增长(收入30%以上，利润50%以上)。参照2020Q3的收入体量，我们认为公司全年业绩27亿元是较低水平，此次上调较能进一步反映公司经营情况。公司各项业务向好：2020年公司经营持续向好，石膏板销量保持大双位数增长，预计全年销量超20亿平，平均单价随着高端品龙牌渗透率提升也有所提升，全年收入预计为109亿元。龙骨随着配套率提升步入快速增长通道，预计销量超过24万吨，贡献收入超15亿元；防水业务受益于行业集中度快速提升，也将有较好表现，预计全年收入贡献超32亿元。石膏板与防水业务加速布局，护面纸涨价产品提价预期提升：近期公司收购新疆佰昌建材、北建建材、北泰建材70%股份，中建材苏州防水研究院100%股份。同时设立滨州分公司建设年产6000万平石膏板产能，万吨龙骨产能；泰山石膏拟建设两条年产5000万平石膏板产能。公司进一步加速各项业务条线布局。近期强伟纸业等上调护面纸300元/吨，对应公司单方原料成本提升0.1元。考虑部分同行已调价，公司作为行业龙头，议价能力较强，未来石膏板调价预期提升，产品毛利率有望提升。估值参考公司业绩预告调整情况，我们调升原有预期。预计 2020-2022 年，公司 营收分别为169.7、197.1、233.0亿元；净利润29.6、34.6、40.5亿元；EPS1.75、2.05、2.40元。维持公司买入评级。评级面临的主要风险竣工不及预期，原料价格波动，龙骨业务开展不佳，防水增速不及预期。,,中银国际,买入,[None],2021-01-13,,买入,4418310,pdf_downloads/2021/2021-01-13/000786-北新建材（000786）：全年经营稳健业绩向好，一体两翼布局加速.pdf,000786,北新建材,北新建材（000786）：全年经营稳健业绩向好，一体两翼布局加速
"张艺露,方晏荷,武慧东",石膏板龙头优势凸显，上调20年业绩预告公司12日发布20年业绩预告修正公告，预计20年实现归母净利润27.0-30.0亿元，同比增长512%-580%（修正前为458%-512%），对应Q4单季度净利润7.0-10.0亿元，同比增长54.9%-121.2%。我们预计主要受益于石膏板主业量价齐升。近期原材料护面纸涨价幅度较大，公司通过提价传导成本上涨压力，龙头优势凸显，未来随着高端产品占比上涨，石膏板盈利能力有望再加强，且防水产业链进一步完善，“一体两翼”布局加快，看好公司成长性。上调20-22年归母净利润预测至28.3/38.3/48.1亿元，目标价68.10元，维持“买入”评级。Q4石膏板主业量价齐升，全国布局加快公司Q4归母净利润同比增长54.9%-121.2%，我们预计主要受益于石膏板主业量价齐升，因Q4竣工好转带动销量增长，我们测算泰山牌石膏板单季度销量同比增15%，且公司产品结构调整，单平均价进一步上升。近期石膏板主要原材料护面纸（占原材料成本60%以上）价格上涨300元/吨，且21年将全面禁止美废进口，原材料端价格或持续承压，而公司护面纸自供比例近70%，21年将达80%，且高市占率有利于通过提价传导原材料涨价压力，成本端受影响更小，高端产品占比提升有望带来单平毛利进一步提升。公司30日公告拟收购新疆三家公司，全国布局进一步加快。防水产业链进一步完善，未来有望进入高质量快速增长期公司30日公告收购中建材苏州防水研究院100%股权，苏州防水院是防水行业唯一一家国家级科研机构，此次收购完成后，北新防水产业链将进一步完善，研发实力增强，通过产研结合提升公司防水业务竞争力。公司19年通过联合重组进入防水领域以来，已迅速成长为防水行业收入规模第三的企业，目前已具备十大防水产业基地，且规划在十四五期间建设30个防水材料产业基地。我们认为借助苏州防水院研发优势，结合石膏板主业的资金优势及客户协同效应，防水业务有望迎高质量快速增长期。看好公司长期成长性，维持“买入”评级公司系石膏板绝对龙头，成本护城河强，在原材料涨价趋势下，通过提价转移成本上涨压力。我们认为下游需求将延续恢复，长期随着高端产品占比提升，盈利能力有望提升，龙骨、防水、涂料等业务打造新增长点，看好公司长期成长性。考虑到公司Q4量价齐升，长期高端产品占比提升空间较大，我们上调20-22年归母净利润预测至28.3/38.3/48.1亿元（前值27.0/35.0/38.9亿元）当前可比公司对应21年Wind一致预期平均23xPE，考虑到公司龙头地位，且未来市占率仍有望持续提升，我们给予公司21年30xPE，目标价68.10元（前值：51.75元），维持“买入”评级。风险提示：下游需求大幅下滑，防水业务整合效益不及预期。,,华泰证券,买入,[None],2021-01-13,,买入,4418297,pdf_downloads/2021/2021-01-13/000786-北新建材（000786）：业绩预测上调，龙头优势凸显.pdf,000786,北新建材,北新建材（000786）：业绩预测上调，龙头优势凸显
"江剑,黄骥",核心观点20年业绩上修，H2石膏板销售改善以及防水并表增厚业绩。1月13日公司发布2020年度业绩预告修正公告，从之前的24.6-27亿上修至27-30亿，YOY+512%-580%，剔除19年诉讼的影响，预计扣非净利润YoY+13.83%-26.48%。推算Q4单季度实现净利润6.94-9.94亿元，YOY+53.54%-119.91%，继续保持三季度的高速增长（YoY+62%），我们认为主要由于1）下游进入赶工旺季拉动石膏板需求持续改善，销售情况好于预期；2）防水业务19Q4由于刚并表，并未贡献正常净利润，基数较低。护面纸进入涨价通道，石膏板有望提价。1月7日强伟纸业、华润纸业对护面纸提价300元/吨（8%左右），其上游的废纸价格在海外进口的限制下连续上涨。1月8日国废价格较20年4月的低点涨幅超过30%。按护面纸单耗0.345kg/平米计，这一轮提价将石膏板成本增加约0.1元/平米（考虑到公司40万吨新建护面纸近期投产，实际成本提升应小于0.1元/平米），我们认为未来大概率公司石膏板将涨价。假设20/21年石膏板均价5.45/5.75元/平米，即21年提价0.3元/平米，剔除销量上的影响，提价将增厚净利润4-5亿元。公开信息显示，泰山石膏板20年销量15.49亿平米，YoY+1.02%，我们预计20年公司石膏板总销量接近21亿平，21年有望继续个位数增长。防水竞争力有望逐步增强，龙骨成长空间大。通过集团重组后苏州防水研究院将成为公司的全资子公司，作为防水行业唯一的国家级研究院和标准制定单位，苏州院将增强公司产品研发实力、防水产业链进一步完善，未来有望获得更强的市场竞争力。龙骨业务与石膏板共享销售渠道，由于配套率较低，依然有较大发展空间，按照公司80%的配套率长期目标，我们预计20/21年配套率达到9.9%/12.9%，对应销量35.36/52.17万吨，YOY+44%/48%。财务预测与投资建议预计20/21/22年EPS 为1.67/2.10/2.47元（原EPS 为1.65/2.03/2.40元），主要调增石膏板销量及价格。可比公司21年平均PE 27X，给予公司27X PE，对应目标价56.70元，维持“买入”评级。风险提示：地产宏观调控政策、新建产能释放不及预期、防水整合不及预期,,东方证券,买入,[None],2021-01-13,,买入,4418982,pdf_downloads/2021/2021-01-13/000786-北新建材（000786）：业绩上修，石膏板近期有望提价.pdf,000786,北新建材,北新建材（000786）：业绩上修，石膏板近期有望提价
"孙颖,朱晋潇",投资要点：事件：1月7号强伟纸业、华润纸业等几家纸业公司同时发布涨价函，将护面纸价格上调300元/吨。部分石膏板企业已上调产品价格。点评：石膏板主业价：21年起美废限制进口，导致近期护面纸价格上涨较多。据测算，单平石膏板约消耗护面纸360g（参考泰山石膏数据），护面纸涨价300元/吨增加公司原材料成本约0.11元/平（保守估计，因公司有部分自有护面纸产能，实际成本上升幅度低于前值）。成本压力下，部分石膏板企业已开始上调价格。当前时点正处于消费淡季，我们预计待旺季到来后，公司中、低端产品或均存在较大价格弹性。假设公司产品均价上调0.3元/平，21年全年销量保守估计为20亿平（2019年公司实际销量19.66亿平），其他条件不变情况下，保守估计公司营业利润将增厚3.8亿元，利润弹性充足。量：预计公司20年四季度单月销量保持大双位数增长，21年竣工回暖为销量提供支撑。中期：公司石膏板产品59%高市占率下具备较强定价权，中期看好公司产品结构中高端化带来的价格和盈利中枢提升；成本优势构筑较深护城河。防水+龙骨贡献增量：公司第二增长曲线明晰，防水20H收入占比约20%，考虑到公司产能、渠道、资金具备优势，未来市占率逻辑清晰。龙骨20H收入占比12%，19年增速37%，公司当前正大力发展该业务，预计龙骨配套率仍将快速提升。现金流持续表现优异：公司18和19年经营性现金流量净额为28和20亿，20Q1-3为0.8亿元，主要系防水行业影响，但一般Q4是重要的回款期，我们预计20年现金流情况也将维持在较好水平。投资建议：竣工修复+原材料涨价+石膏板本身价格低位背景下，21年石膏板或迎来量、价齐升。长期看石膏板绝对龙头结构进一步中高端化，定价能力进一步体现；第二增长曲线明晰（防水、龙骨、建涂等）；现金流好于预期。考虑到公司原材料提价及石膏板涨价或带来的业绩弹性，我们上调了盈利预测。将产品的均价及成本分别上调0.3/0.1元/平。预计公司21年公司归母净利达到39.44亿元（调整前为36.32亿），同比+39.27%，对应PE为20.2倍，当前时点维持“增持”评级。风险提示：下游行业需求大幅下滑；石膏板价格大幅下跌；海外拓展不及预期；龙骨业务拓展不及预期；防水领域拓展不及预期。业绩弹性测算基于一定假设，存在不及预期风险。,,中泰证券,增持,[None],2021-01-11,,增持,4416788,pdf_downloads/2021/2021-01-11/000786-北新建材（000786）：护面纸涨价，石膏板或迎来量价齐升.pdf,000786,北新建材,北新建材（000786）：护面纸涨价，石膏板或迎来量价齐升
"江剑,黄骥",联合重组苏州防水院，进一步完善防水布局。公告将以6921.32万元的价格收购母公司中建材持有的苏州防水研究院100%股权，作为防水行业唯一的国家级研究院和标准制定单位，未来苏州院将定位为公司防水产业的中央研究院；本次重组将进一步完善公司的防水业务产业链，加强产研结合，从技术研发和装备方面提升公司防水业务竞争力。同时，在目前已有10大防水产业基地基础上，规划十四五期间新建30个防水材料产业基地，依托公司的市场资源和资金实力，防水业务有望取得高质量发展。收购新疆3家石膏板企业，进一步提升市占率。公告将以总价1.4亿收购中新贸易持有的新疆佰昌建材/北建建材/北泰建材三家石膏板企业70%股权，收购完成后，公司石膏板产能将增加5700万平米（占公司总产能2%）。由于石膏板销售存在运输半径限制，新疆地域辽阔且市场较为封闭，而三家标的分别地处乌鲁木齐、和田和阿克苏，基本覆盖北疆和南疆，公司通过技术、渠道和管理的整合优化，有望快速在该地区获得较高的市场份额。山东新建1.6亿平米石膏板生产线，开启十四五50亿平米产业布局。公司及子公司泰山石膏将在山东惠民县/邹平市分别新建1条年产6000万平米/2条年产5000万平米石膏板生产线，预计项目到22年Q3投产，届时产能将达29.67亿平米。公司同时与全球最大的电解铝产业集团魏桥集团签订战略合作协议，依托魏桥集团所属火电厂进行工业副产石膏资源综合利用，采用电厂蒸汽作为能源并利用魏桥集团转型升级腾出的闲置厂房资源，未来有望进一步降低生产成本，并继续丰富产品线，实现从高端到中低端的全覆盖。财务预测与投资建议通过外延内生并举，石膏板领域的成本和规模优势将更加稳固，未来有望掌握较强的定价权；收购苏州院后防水研发实力增强，看好未来的产品综合竞争力。预计20/21/22年EPS 1.65/2.03/2.40元（原EPS 1.56/1.84/2.09元），主要调增石膏板销量及防水收入、调减石膏板成本。可比公司21年平均PE25X，给予公司25X PE，对应目标价50.75元，维持“买入”评级。风险提示：地产宏观调控政策、新建产能释放不及预期、防水整合不及预期,,东方证券,买入,[None],2021-01-03,,买入,4410946,pdf_downloads/2021/2021-01-03/000786-北新建材（000786）：巩固石膏板龙头地位，完善防水布局.pdf,000786,北新建材,北新建材（000786）：巩固石膏板龙头地位，完善防水布局
