author,content,filename,org_name,original_rating,pdf_link,publish_time,rating_adjust_mark_type,rating_changes,report_id,save_path,stock_code,stock_name,title
"黄瑞连,胡杨",事件概述公司发布2024年三季报。分析判断:刻蚀设备快速放量，新接订单/发货持续高增2024Q1-3公司实现营收55.07亿元，同比+36.27%，其中Q3为20.59亿元，同比+35.96%，符合市场预期。Q3收入端保持快速增长，主要系刻蚀设备快速放量推动，2024Q3刻蚀设备实现收入17.15亿元，同比+49.41%。截至2024Q3末，公司存货和合同负债分别为78.22和29.88亿元，分别同比+91.18%和+118.82%，主要系刻蚀设备的产量和发货量以及新接订单大幅增长所致。2024Q1-3公司共生产专用设备1160腔，同比+310%，对应产值约94.19亿元，同比+ 287%；2024Q1-3公司新增订单76.4亿元（Q3单季度新增订单为29.4亿元），同比+52%，其中刻蚀设备新增订单62.5亿元（Q3为23.1亿元），同比+54.7%。在手订单充足，有力支撑公司后续营收端快速增长。Q3盈利水平大幅改善，利润端表现超市场预期2024Q1-3公司实现归母净利润/扣非后归母净利润为9.13/8.13亿元，同比-21.28%/10.88%。2024Q1-3公司净利率和扣非净利率分别为16.56%和14.77%，分别同比-12.11pct和-3.38pct，盈利水平下滑明显主要系非经损益和研发投入强度加大：1）毛利端：2024Q1-3公司销售毛利率为42.22%，同比-3.61pct，主要系上半年会计准则调整，产品质保金计入营业成本，此外我们推测产品验证、客户结构对毛利率也有一定影响；2）费用端：2024Q1-3公司期间费用率为26.98%，同比+2.69pct，其中销售/管理/研发/财务费用率分别同比-2.57/+0.59/+4.16/+0.51pct，研发费用率大幅提升主要系研发投入加大，其中研发支出较去年同期增长7.56 亿元，同比+95.99%，3）2024年公司出售拓荆科技股票获得税后净收益4.06亿元，今年同期并无该项收益，非经常性损益大幅下降，影响利润端表现。Q3单季度实现归母净利润扣非归母净利润为3.96/3.30亿元，同比+152.63%/+53.79%，环比+48.11%/+49.92%，Q3利润端大幅改善，好于市场预期。2024Q3公司净利率/扣非净利率为19.22%/16.04%，同比+8.9/+1.86pct，环比+4.71/+4.08pct，盈利水平大幅提升：1）毛利端：24Q3公司毛利率为43.73%，同比-2.01pct，环比+5.56pct，毛利率持续修复，我们推测与收入结构变化（24Q3刻蚀设备收入占比提升至83%）以及新品不断验证完成有关；2）费用端：24Q3公司期间费用率为27.85%，环比-0.43pct，其中销售/管理/研发/财务费用分别环比+2.14/-0.65/-2.37/+0.45pct，研发费用率有所下降；3）Q3计入非经常性损益的股权投资收益为 0.81 亿元，较上年同期的亏损1.02亿元增长1.83亿元，较大程度增厚利润。加大刻蚀、薄膜沉积设备等产品线研发，平台化布局顺利推进1）刻蚀设备：大力投入先进制程关键刻蚀设备的研发和验证，已经在生产线验证出具有刻蚀≥60:1深宽比结构的量产能力，并积极储备更高深宽比结构（≥90:1）刻蚀技术，多款ICP 设备在先进逻辑芯片、先进DRAM和3D NAND产线验证推进顺利并陆续取得客户批量订单。晶圆边缘Bevel刻蚀设备完成开发，公司的TSV硅通孔刻蚀设备也越来越多地应用在先进封装和MEMS器件生产。2）薄膜沉积设备：完成多家逻辑和存储客户对CVD/HAR/ALD W 钨设备的验证，24年前三季度 LPCVD新增订单3.0亿元（Q3为1.32亿元），新产品开始启动放量，公司近期已规划多款CVD和ALD设备，增加薄膜设备的覆盖率，进一步拓展市场；EPI 设备已顺利进入客户端量产验证阶段，已完成多家先进逻辑器件与 MTM 器件客户的工艺验证。3）MOCVD：积极布局用于碳化硅和氮化镓基功率器件应用的市场，并在 Micro-LED，和其他显示领域的专用 MOCVD 设备开发上取得良好进展，几款已付运和即将付运的 MOCVD 新产品正在陆续进入市场。投资建议我们维持2024-2026年营业收入预测分别为83.19、108.89和140.00亿元，同比增速分别为32.8%、30.9%和28.6%；考虑到研发投入加大，我们下调2024-2026年归母净利润分别为16.84、23.99和32.05亿元（原值为18.29、24.04和32.10亿元），同比增速分别为-5.7%、42.4%和33.6%；同步调整2024-2026年EPS分别为2.71、3.85和5.15元（原值为2.94、3.87和5.17元）。2024/10/29股价180.3元对应PE分别为67、47和35，维持“买入”评级。风险提示半导体行业景气度下滑，新品研发不及预期等。,,华西证券,买入,[None],2024-10-30,,增持,5808244,pdf_downloads/2024/2024-10-30/688012-中微公司（688012）：2024年三季报点评：新接订单实现高增，Q3业绩好于市场预期.pdf,688012,中微公司,中微公司（688012）：2024年三季报点评：新接订单实现高增，Q3业绩好于市场预期
王海,公司发布2024年三季度业绩公告，前三季度实现营业收入55.07亿元，同比+36.27%；归母净利润9.13亿元，同比-21.28%；扣非归母净利润8.13亿元，同比+10.88%；基本每股收益1.48元/股。单季度环比改善明显，竞争力持续增强受益于公司等离子体刻蚀设备获得更多客户的认可，公司营业收入同比实现快速增长。盈利能力来看，前三季度公司毛利率、净利率分别为42.22%、16.56%，同比分别-3.61pct、-12.11pct。单季度来看，公司Q3实现营业收入20.59亿元，同比+35.96%，环比+11.77%；归母净利润3.96亿元，同比+152.63%，环比+48.11%；扣非归母净利润3.30亿元，同比+53.79%，环比+49.92%；毛利率、净利率分别为43.73%、19.22%，同比分别-2.01pct、+8.90pct。环比分别+5.56pct、+4.71pct。刻蚀设备高速成长，新品进展顺利刻蚀设备仍是公司核心产品，同时MOCVD、LPCVD、EPI设备也取得不错进展。2024年前三季度刻蚀设备收入为44.13亿元，同比增长约53.77%。公司在Micro-LED和其他显示领域的专用MOCVD设备开发上取得良好进展，几款已付运和即将付运的MOCVD新产品正在陆续进入市场。此外，前三季度公司新产品LPCVD设备实现首台销售，收入0.28亿元。公司EPI设备已顺利进入客户端量产验证阶段，已完成多家先进逻辑器件与MTM器件客户的工艺验证，并且结果获得客户高度认可。投资建议：持续看好设备长期增长逻辑，维持“买入”评级受投资收益波动影响，我们预计公司2024-2026年营业收入分别为84.16/110.97/142.80亿元，同比分别增长34.36%/31.86%/28.69%；归母净利润分别为18.95/24.15/31.24亿元，同比增速分别为6.12%/27.41%/29.36%，3年CAGR为20.49%；EPS分别为3.05/3.88/5.02元/股，对应PE分别为59x/46x/36x。鉴于公司是国内刻蚀设备龙头且新业务有望延续高增长，维持“增持”评级。风险提示：晶圆厂扩产进度不及预期；新品研发、验证进度不及预期等。,,国联民生证券,买入,[None],2024-10-30,,买入,5808242,pdf_downloads/2024/2024-10-30/688012-中微公司（688012）：单季度改善明显，新品进展顺利.pdf,688012,中微公司,中微公司（688012）：单季度改善明显，新品进展顺利
"倪正洋,谢春生,丁宁",公司公布三季度业绩：公司2024前三季度收入55.07亿/yoy+36.27%；归母净利润9.13亿/yoy-21.28%；扣非后归母净利润8.13亿/yoy+10.88%；其中，24Q3收入20.59亿/yoy+35.9%，归母净利润3.96亿/yoy+152.6%。24年前三季度公司刻蚀设备收入与订单持续高增，但因开发多种新设备的需求急剧增长研发费用大幅提升使得归母净利润同比下滑。24Q3公司收入利润同比双增，刻蚀设备龙头不断向平台化公司迈进，维持“增持”评级。24年前三季度毛利率略有下降，持续加大研发力度24年前三季度公司实现毛利率42.22%，同比下降3.61pct；实现净利率16.56%，同比下降12.11pct，前三季度毛利率略有下降，高研发投入使净利率下滑较大。24Q3公司实现毛利率43.73%，同比下降2.01pct；实现净利率19.22%，同比上升8.9pct，24Q3净利润率增长主要系计入非经常性损益的股权投资收益为0.81亿元，较上年同期的亏损1.02亿元增长1.83亿元。费用率方面，2024公司前三季度销售/管理/研发费用率分别为5.79%/5.65%/16.60%，销售费用率同比下降2.57pct，管理/研发费用率同比上升0.58pct/4.17pct，主要系公司持续进行高水平研发投入。刻蚀设备收入高增，薄膜沉积设备等新产品进展良好公司24M1-9刻蚀设备收入44.13亿元，同比增长约53.77%。公司积极布局用于碳化硅和氮化镓基功率器件应用的MOCVD，并在Micro-LED等显示用MOCVD设备开发上取得良好进展。24M1-9公司新产品LPCVD设备实现首台销售，收入0.28亿元；EPI设备已顺利进入客户量产验证阶段。新增订单/生产产量/合同负债持续向好，支撑本年度出货及收入2024年前三季度公司新增订单76.4亿元，同比增长约52.0%。其中刻蚀设备新增订单62.5亿元，同比增长约54.7%；LPCVD新增订单3.0亿元，新产品开始启动放量。2024年前三季度公司共生产专用设备1160腔，同比增长约310%，为公司后续出货及确认收入打下较好基础。2024年9月末合同负债余额约29.88亿元，较年初余额的7.72亿元增长约22.16亿元。给予公司目标价196.1元，维持“增持”评级我们预计公司2024-2026年EPS分别为3.69/4.56/5.55元（前值2024-2026年3.69/4.51/5.49元），上调25/26年EPS主要系公司订单持续高增。可比公司25年ifind一致预期PE均值为33倍，考虑公司刻蚀设备订单饱满，LPCVD等新产品进展较快，给予公司25年43倍PE，目标价196.1元，维持“增持”评级。风险提示：半导体周期性波动，新产品研发不及预期。,,华泰证券,增持,[None],2024-10-30,,增持,5807585,pdf_downloads/2024/2024-10-30/688012-中微公司（688012）：订单持续高增，加大研发开拓新品.pdf,688012,中微公司,中微公司（688012）：订单持续高增，加大研发开拓新品
张益敏,"事件：中微公司公布2024年Q3季报，2024 年前三季度营业收入为 55.07亿元，同比增长约36.27%；归母净利润9.13亿元，同比下降21.28%；扣非归母净利润8.13亿元，同比增长10.88%。公司刻蚀设备获客户广泛认可，营收贡献高速增长：公司的等离子体刻蚀设备在国内外持续获得更多客户的认可，针对先进逻辑和存储器件制造中关键刻蚀工艺的高端产品新增付运量显著提升，先进逻辑器件中段关键刻蚀工艺和先进存储器件超高深宽比刻蚀工艺实现量产。2024年前三季度刻蚀设备收入为44.13亿元，较上年同期增长约53.77%，是公司的主力产品。研发费用充裕，新产品进展顺利： 2024年前三季度公司研发支出15.44亿元，同比增长约95.99%，研发费率达28.03%。受益于充裕的研发费用，公司多款新设备进展顺利。2024年公司新产品LPCVD设备实现首台销售。公司EPI设备已顺利进入客户端量产验证阶段，已完成多家先进逻辑器件与MTM器件客户的工艺验证，并且结果获得客户高度认可。产品出货量与合同负债迅速增长，有望支撑未来的业绩：2024年前三季度，公司共生产专用设备1,160腔，同比增长约310%，对应产值约94.19亿元，同比增长约287%，为公司后续出货及确认收入打下了较好的基础。2024年9月末发出商品余额约35.07亿元，较年初余额的8.68亿元增长26.40亿元；2024年9月末合同负债余额约29.88亿元，较年初余额的7.72亿元增长约22.16亿元。投资建议：我们预计公司2024-2026年实现营业收入85.79/117.36/145.57亿元，归母净利润17.13/24.86/31.44亿元。对应PE分别为65.47/45.13/35.69倍，维持“增持”评级。风险提示：国内晶圆厂设备采购放缓；新产品研发进度不及预期；行业竞争加剧。",,财通证券,增持,[None],2024-10-29,,增持,5806056,pdf_downloads/2024/2024-10-29/688012-中微公司（688012）：保持高研发投入，新产品进展顺利.pdf,688012,中微公司,中微公司（688012）：保持高研发投入，新产品进展顺利
"张世杰,罗平,李珏晗","事件：公司发布2024年中报，2024H1公司实现营收34.48亿元，同比增长36.46%；实现归母净利润5.17亿元，同比-48%；实现扣非归母净利润4.83亿元，同比-6.88%；剔除股份支付费用影响后的扣非后归母净利润为6.94亿元，同比增长11.65%；单Q2来看，公司实现营收18.43亿元，同比增长41.37%，环比增长14.81%。刻蚀设备快速增长，新增订单增幅明显。公司的等离子体刻蚀设备在国内外持续获得更多客户的认可，针对先进逻辑和存储器件制造中关键刻蚀工艺的高端产品新增付运量显著提升。2024H1，公司刻蚀设备收入26.98亿元，较上年同期增长约56.68%，刻蚀设备占营业收入的比重由上年同期的68.16%提升至本期的78.26%。同时，2024H1公司新增订单47.0亿元，同比增长约40.3%。其中刻蚀设备新增订单39.4亿元，同比增速约50.7%；LPCVD上半年新增订单1.68亿元，新产品开始启动放量。蚀刻、薄膜沉积等产品研发力度不断加码，平台化布局顺利推进。公司的主打产品等离子体刻蚀设备是除光刻机以外最关键的微观加工设备，是制程步骤最多、工艺过程开发难度最高的设备。1.CCP设备：公司CCP刻蚀设备中双反应台中Primo D-RIE、Primo AD-RIE、Primo AD-RIE-e新增付运量保持高速增长,2024年上半年付运量超过2023年全年付运量。单反应台CCP刻蚀设备Primo HD-RIE，Primo HD-RIEe和 Primo UD-RIE 付运势头强劲，2024 年上半年付运量较2023年全年增加约3倍。截至2024年6月，公司累计生产付运超过3600个CCP刻蚀反应台，2024年上半年新增付运设备数量创历史新高。2.ICP蚀刻设备：公司的ICP刻蚀设备在涵盖逻辑、DRAM、3D NAND、功率和电源管理、以及微电机系统等芯片和器件的60多条客户的生产线上量产，并持续进行更多刻蚀应用的验证。ICP刻蚀设备中的Primo Nanova®系列产品在客户端安装腔体数近三年实现&gt;70%的年均复合增长。3. MOCVD设备：公司用于蓝光照明的PRISMO A7®、用于深紫外LED的PRISMO HiT3®、用于Mini-LED 显示的PRISMO UniMax® 等产品持续服务客户。公司累计MOCVD产品出货量超过500腔，持续保持国际氮化镓基MOCVD设备市场领先地位。投资建议公司作为国内领先的半导体设备平台公司，我们预计公司2024-26年分别实现营收82.60、120.36、152.27亿元，实现归母净利润18.86、26.70、33.59亿元，对应PE 61.15、43.20、34.34x，维持“买入”评级。风险提示：供应链风险；国际贸易摩擦加剧风险；新产品研发不及预期风险",,太平洋证券,买入,[None],2024-10-23,,买入,5796460,pdf_downloads/2024/2024-10-23/688012-中微公司（688012）：蚀刻设备带动公司营收增长，新订单充足未来可期.pdf,688012,中微公司,中微公司（688012）：蚀刻设备带动公司营收增长，新订单充足未来可期
"孙远峰,王海维",长江存储加速转向国产设备取代美系设备，中微公司等国产半导体设备厂商有望受益。长存加速转向国产设备，刻蚀设备龙头显著受益2024年9月20日，中微公司发布公告，宣布倪图强先生因个人原因，申请辞去公司副总经理、核心技术人员职务；杨伟先生因个人原因，申请辞去公司核心技术人员职务。辞职后，倪图强先生、杨伟先生仍在公司任职。公司认为，本次核心技术人员的变动不会对公司现有项目研发进展、持续经营能力、核心竞争力产生重大不利影响。中微公司是国产刻蚀设备龙头，同时积极布局薄膜设备、检测设备，平台化建设稳步推进。截至24H1，公司发出商品余额和合同负债余额分别为27.66亿元和25.35亿元，较2023年末分别增长18.98亿元和17.64亿元。公司目前在手订单充足，预计2024年前三季度的累计新增订单超75亿元，同比增长超50%；预计2024年累计新增订单将达110-130亿元，全年付运台数将同比增长200%以上。彭博社援引TechInsights的报道称，在美国于2022年10月限制先进半导体设备对华出口，并于2022年底将中国3DNANDFlash制造商长江存储列入实体清单近两年之后，长江存储仍在稳步发展，并已成功采用中微公司、北方华创等厂商的国产半导体设备取代部分美系半导体设备。目前长江存储已在ZhiTaiTiPlus7100BlackMythSSD中成功应用其Xtacking4.0工艺。刻蚀设备市占率大幅提升，高深宽比技术持续精进24H1刻蚀设备收入为26.98亿元，同比增长56.68%，营收占比提升至78.26%；新增订单39.4亿元，同比增长约50.7%。公司针对先进逻辑和存储器件制造中关键刻蚀工艺的高端产品新增付运量显著提升，CCP和ICP刻蚀设备的销售增长和在国内主要客户芯片生产线上市占率均大幅提升。目前针对逻辑和存储芯片制造中最关键刻蚀工艺的多款设备已在客户产线展开验证。CCP：截至24H1，公司累计生产付运超过3600个CCP刻蚀反应台，24H1新增付运设备数量创历史新高；其中双反应台中PrimoD-RIE/AD-RIE/AD-RIE-e24H1新增付运量超2023年全年付运量，单反应台PrimoHD-RIE/HD-RIEe/UD-RIE24H1付运量较2023年全年增加约3倍。PrimoAD-RIE-e持续付运用于最先进的逻辑芯片生产线，同时取得先进存储生产线的重复订单。PrimoSD-RIE在首家先进逻辑客户端针对金属掩膜一体化大马士革刻蚀工艺的验证进入良率测试阶段，已进入第二家客户开展现场验证；并与多家客户达成评估意向，目前实验室开发进展顺利。PrimoUD-RIE已在生产线验证出具有刻蚀≥60:1深宽比结构的量产能力。此外，公司积极布局超低温刻蚀技术，在超低温静电吸盘和新型刻蚀气体研究上投入大量资源，积极储备更高深宽比结构（≥90:1）刻蚀的前卫技术。ICP：多款ICP设备在先进逻辑芯片、先进DRAM和3DNAND产线验证推进顺利并陆续取得客户批量订单。NanovaVEHP在DRAM制造中的的高深宽比多晶硅掩膜应用上，投入大量产。LUX逐步在多个客户的产线上实现小量产。PrimoTwinStar®则在海内外客户的成熟逻辑芯片、AR眼镜用的超透镜MetaLens等特色器件的产线上实现量产，并取得重复订单。首台Primo-TwinStar®200也付到客户端开展MetaLens的产线上认证。PrimoTSV200E®/300E®在成熟市场继续获得重复订单的同时，在12英寸的3D芯片的硅通孔刻蚀工艺上得到成功验证，并在欧洲客户新建的世界首条12英寸微机电系统芯片产线上获得认证的机会。晶圆边缘Bevel刻蚀设备完成开发，即将进入客户验证。薄膜沉积设备：公司钨系列薄膜沉积产品可覆盖存储器件所有钨应用，并已完成多家逻辑和存储客户对CVD/HAR/ALDW钨设备的验证，取得了客户订单。EPI设备研发团队已形成自主知识产权及创新的预处理和外延反应腔的设计方案；目前EPI设备已顺利进入客户验证阶段。24H1公司新品LPCVD设备实现首台销售，收入0.28亿元；LPCVD新增订单1.68亿元。投资建议：鉴于公司持续维持高研发投入，我们调整此前对公司的利润预测。预计2024年至2026年，公司营收分别为83.68/111.63/145.92亿元，增速分别为33.6%/33.4%/30.7%；归母净利润分别为18.10/23.96/32.35亿元（前值为20.33/26.20/34.14亿元），增速分别为1.4%/32.4%/35.0%；PE分别为41.4/31.2/23.1。中微持续推进平台型设备公司建设，实现了刻蚀设备全面覆盖，薄膜设备领域侧重于导体/半导体层的薄膜沉积设备，投资上海睿励布局检测设备，三大产品线持续注入强劲增长动力。持续推荐，维持“买入-A”评级。风险提示：新技术、新工艺、新产品无法如期产业化风险，市场竞争加剧风险，晶圆厂产能扩充进度不及预期的风险，系统性风险等。,,华金证券,买入-A,[None],2024-09-22,,买入,5771611,pdf_downloads/2024/2024-09-22/688012-中微公司（688012）：长存加速转向国产设备，刻蚀设备龙头显著受益.pdf,688012,中微公司,中微公司（688012）：长存加速转向国产设备，刻蚀设备龙头显著受益
"蒯剑,韩潇锐","核心观点营收和订单快速增长：24H1营收同增36%至34.5亿元，归母净利润同减48%至5.17亿元，主要因为23H1投资收益税后净收益约4.06亿元及24H1研发费用同增2.76亿元。24H1毛利率下滑至41.3%，因公司根据会计准则变化，将预计产品质量保证损失9,478万元计入营业成本。24H1公司新增订单同增40%至47.0亿元，预计前三季超75亿元，同增超50%；全年将达110-130亿元，全年付运台数将增长超200%。公司生产专用设备833腔，同增约420%，对应产值同增约402%至68.7亿元，为全年出货及确认收入打下基础。发出商品余额6月末约27.7亿元，较期初增长19.0亿元；合同负债余额约25.4亿元，较期初增长约17.6亿元。刻蚀设备持续高增长：营收同增57%至27亿元，新增订单同增51%至39.4亿元。针对先进逻辑和存储器件制造中关键刻蚀工艺的高端产品新增付运量显著提升，CCP和ICP刻蚀设备在国内主要客户芯片生产线上市占率大幅提升。公司大力投入先进芯片制造中关键刻蚀设备研发和验证，针对最关键刻蚀工艺的多款设备已在客户产线验证。公司自主开发的PrimoUD-RIE已在生产线验证出具有刻蚀≥60:1深宽比结构的量产能力，公司积极布局超低温刻蚀技术，积极储备更高深宽比结构（≥90:1）刻蚀的前卫技术。多款ICP设备在先进逻辑芯片、先进DRAM和3D NAND产线验证推进顺利并陆续取得批量订单。晶圆边缘Bevel刻蚀设备完成开发，将进入客户验证，TSV硅通孔刻蚀设备更多应用在先进封装和MEMS 器件生产。薄膜沉积设备开始贡献：公司新产品LPCVD设备实现首台销售，上半年收入0.28亿元，新增订单1.68亿元；已有多款新型薄膜沉积设备产品进入市场，其中部分设备已获重复性订单，其他多个关键薄膜沉积设备研发项目正顺利推进。公司钨系列薄膜沉积产品可覆盖存储器件所有钨应用，并已完成多家逻辑和存储客户验证，取得了客户订单。公司近期已规划多款CVD和ALD设备，增加薄膜设备的覆盖率。公司已形成EPI设备自主知识产权及创新的预处理和外延反应腔的设计方案，EPI设备已顺利进入客户验证阶段，以满足先进制程中锗硅外延生长工艺的需求。盈利预测与投资建议我们预测公司24-26年归母净利润分别为14.4、23.1、31.3亿元（原24-25年预测为21.1、26.5亿元，主要调整了毛利率和研发费用率），采用DCF估值法，给予175.25元目标价，维持买入评级。风险提示研发费用增长影响盈利；晶圆厂扩产进度影响后续新增订单增长；业绩不及预期。",,东方证券,买入,[None],2024-09-13,,买入,5765195,pdf_downloads/2024/2024-09-13/688012-中微公司（688012）：刻蚀设备营收和订单高增长，薄膜沉积设备开始贡献.pdf,688012,中微公司,中微公司（688012）：刻蚀设备营收和订单高增长，薄膜沉积设备开始贡献
