author,content,filename,org_name,original_rating,pdf_link,publish_time,rating_adjust_mark_type,rating_changes,report_id,save_path,stock_code,stock_name,title
"刘丽,孙田田","华泰证券(601688)事件描述：公司发布2022年年报，实现营业收入320.32亿元，同比减少15.50%，实现归母净利润110.53亿元，同比减少17.18%，加权平均ROE为7.49%，较上年减少2.35pct。投资要点：财富管理转型升级，代销收入逆市提升。公司2022年实现代买收入70.73亿元，同比下滑10.23%，优于行业下滑幅度。持续推进“涨乐财富通”平台产品及服务创新，沪市股票期权经纪业务成交量市场份额行业排名第一，两融余额1,123.47亿元，市场份额达7.29%，排名第二位；股票及混合公募基金保有规模人民币1,226亿元、非货币市场公募基金保有规模人民币1,367亿元，均排名证券行业第二，全市场排名由18位提升至第9位，代销收入增长24%至9.69亿元。投行业务深耕行业，并购重组排名提升。公司2022年实现投行业务收入40.24亿元同比下滑7.36%。全品种债券主承销金额人民币9,804.02亿元，规模增长5%，行业排名保持第三位；股权主承销金额1,553.69亿元，规模下滑12%，行业排名保持第四位；并购重组交易家数9家、交易金额人民币1,650.67亿元，规模提升154%，行业排名提升1位至第二位。公募规模提升，ABS保持优势。公司实现资管收入合计37.69亿元，同比基本持平，优于行业整体。华泰资管管理规模4,796.14亿元，同比下降8%，其中专项资管和公募管理规模增长5%和26%。旗下基金管理公司规模稳步增长，南方基金管理规模达到1.73万亿，增长9%；华泰柏瑞管理规模3267.89亿元，增长27%。华泰资管ABS发行数量130单，行业排名提升至第二；发行规模人民币1,305.00亿元，行业排名保持第三。国际业务布局深化，营收占比超过20%。华泰国际资产规模近2,000亿港元，综合实力持续提升，2022年完成5单港股IPO保荐项目及1单港股介绍上市项目，港股IPO保荐加权规模位居中资投行第二；GDR领域保持领先地位，参与2022年全市场10单GDR中的6单。ASSETMARK资产规模市场占有率提升0.2pct到11.2%，排名保持第三位。盈利预测、估值分析和投资建议：公司打造以金融科技赋能财富管理和机构服务，综合实力稳居行业头部。预计公司2023年-2025年分别实现归母净利润129.34亿元、146.13亿元和172.52亿元，增长17.02%、12.98%和18.06%；PB分别为0.61/0.55/0.51，维持“增持-A”评级。风险提示：金融市场大幅波动，业务推进不及预期，公司出现较大风险事件。",,山西证券,增持-A,[None],2023-03-31,,增持,5159666,pdf_downloads/2023/2023-03-31/601688-华泰证券（601688）：业绩表现优于行业，国际业务布局深化.pdf,601688,华泰证券,华泰证券（601688）：业绩表现优于行业，国际业务布局深化
"戴丹苗,王剑",华泰证券公布2022年年度报告。2022年，公司实现营业收入320.32亿元，同比下降15.5%；实现归母净利润110.53亿元，同比下降17.18%。2022年公司基本每股收益为1.18元，同比下降19.73%；加权平均净资产收益率为7.49%，同比减少2.35个百分点，跟公司发行永续债相关。股基份额引领行业，零售/海外/机构平台持续迭代。公司基于先进平台的交易服务能力实现份额稳定，全年股基交易量38.76万亿元，市场份额8.66%，位居行业第一。客户账户总资产规模达4.99万亿元，客户数量与资产高积累形成壁垒，后续市场向好体现更高业绩弹性。零售、跨境、机构服务体系延伸，报告期内，“涨乐财富通”平均月活数为926.83万，位居证券公司类APP第一名，同时夯实“涨乐全球通”平台，与投顾服务AssetMark实现协同，拓宽全球投资与配置能力，自上线以来累计下载量198.29万，报告期内平均月活数为18.42万；优化“行之”平台，以此拓展面向机构客户代客与交易做市能力。增强主动投资管理能力，“一个华泰”凸显资管竞争力。公司全年实现资管业务收入37.69亿元，同比持平表明产品结构调整并不冲击业绩表现。截至报告期末，华泰资管公司资产管理总规模近4800亿元，同时投行优势带动专项资管业务，资管公司企业ABS（资产证券化）发行数量130单，行业排名第二；融资规模1305.00亿元，行业排名第三。投行发挥产业专长优势。公司全年实现投行业务收入40.24亿元，同比下降7.37%。公司在新能源、半导体、大健康领域服务龙头客户，完成多单市场标杆项目，集团股权主承销金额为1553.69亿元，行业排名第四。债券业务方面，全品种债券主承销金额为9804.02亿元，行业排名第三。集团并购重组交易家数9家、交易金额为1650.67亿元，均排名行业第二。投资业绩弱于市场。受股债市场下行影响，全年投资业务收入（含公允价值变动）为60.26亿元，同比下降46.54%，收入占比从2021年30%下降到2022年19%；实现信用业务收入26.33亿元，同比下降29.80%。风险提示：市场下跌对券商业绩与估值修复带来不确定性；金融监管趋严；市场竞争加剧；流动性紧张导致融资成本上升；创新推进不及预期等。投资建议：我们预测2023-2025年公司净利润分别为122元、134亿元、170亿元，同比增长10.7%/10.0%/26.8%，当前股价对应的PE为9.3/8.4/6.6x，PB为0.7/0.7/0.6x。公司是科技驱动的中国证券行业转型开拓者，坚持信息技术的高规模资源投入，持续以科技驱动数字化转型，打造了证券行业最具活力的财富管理平台之一。我们维持其“增持”评级。,,国信证券,增持,[None],2023-03-31,,增持,5159115,pdf_downloads/2023/2023-03-31/601688-华泰证券（601688）：平台优势持续，科技驱动转型.pdf,601688,华泰证券,华泰证券（601688）：平台优势持续，科技驱动转型
"吕秀华,魏涛,罗惠洲","事件概述公司发布2022年年报，营业收入320.3亿元、同比-15%，归母净利润110.5亿元、同比-17%；加权平均ROE为7.49%、同比-2.35pct，基本每股收益为1.18元、同比-20%。分析判断:重资产业务降幅较大，轻资产业务具韧性从收入增速来看，股权投资、证券自营和利息净收入降幅最大，分别下降54%、47%和30%，经纪、投行、资管业务净收入分别下降10%、7%和0%。收入结构来看，经纪业务占比最高，达到25%，证券自营业务收入占比21%，投行、资管业务净收入分别占比14%、13%，利息净收入、股权投资业务收入分别占比9%、4%。 公司汇兑收益有较大增长，同时减值损失大幅下滑，对于收入下降形成一定对冲。股基交易市场份额同比提升，保持行业第一经纪业务净收入70.7亿元，同比-10%。报告期股基交易市场份额7.82%，同比+0.17pct，股基交易额继续保持行业第一。公司持续探索展业新模式，不断加强“涨乐财富通”平台与“聊TA”平台的双平台一体化运营优势，构建满足客户多元化需求的投资顾问服务体系。金融产品销售与基金投顾业务方面，据基金业协会数据，22Q4年公司股票及混合公募基金保有规模1226亿元、非货币市场基金保有规模1367亿元，均排名证券行业第二。据公司内部统计数据，基金投资顾问业务授权资产139.1亿元、参与客户数量61.8万户。投行净收入小幅下降，资管净收入同比持平投行业务收入40.2亿元，同比-7%。投行业务以行业聚焦、区域布局和客户深耕为方向，加强境内境外、场内场外跨市场协同。据Wind数据统计（按上市日），报告期公司IPO融资规模323.9亿元，市场份额5.52%，同比-1.18pct；再融资规模415.1亿元，市场份额分别为6.76%，同比-3.09pct；核心债券融资金额2294.9亿元，市场份额4.00%，同比-0.80pct。报告期集团资管业务净收入37.7亿元，同比+0%。期末证券公司资管总规模 4,796亿元、同比-8%。报告期华泰资管公司企业 ABS（资产证券化）发行数量130 单、行业排名第二，发行规模1,305 亿元、行业排名第三。ATOMS 系统释放业务支撑能力，基本形成集团 ABS 分析体系和专业标准，成为国内首个 ABS 产品创设和专业分析及评价平台。投资收益及利息净收入有较大幅度下滑证券投资业务收入60.3亿元，同比-47%。报告期末金融资产投资规模4108亿元，同比+3%，收益率1.84%（含债券类投资利息收入），同比-1.56pct。权益交易全面向交易导向转型，贯彻去方向化战略；推进 FICC 量化交易战略转型，持续构建以客户需求为导向、以交易为核心的 FICC 业务模式；场外衍生品着力构建以客户为导向的场外衍生品业务体系。利息净收入26.3亿元，同比-30%，主要由于融出资金利息收入下降所致。报告期末母公司融资融券余额达到1123.5亿元，市场份额达到7.29%。股权投资业务收入12.2亿元，同比-54%。公司旗下的联营企业南方基金、华泰柏瑞，以及股权投资基金、产业投资基金投资收益均有所下滑。",,华西证券,买入,[None],2023-03-31,,增持,5158883,pdf_downloads/2023/2023-03-31/601688-华泰证券（601688）年报点评：整体业绩好于同业，轻资产业务具韧性.pdf,601688,华泰证券,华泰证券（601688）年报点评：整体业绩好于同业，轻资产业务具韧性
"王剑,戴丹苗",科技赋能数字化转型，综合实力位居行业前列。华泰证券成立于1991年，总部位于南京，是一家科技驱动型综合证券集团，是国内首家在上海、中国香港和伦敦三地上市的证券公司。公司高度重视科技赋能，全面推进数字化转型，打造金融科技核心竞争力。近年来，公司信息技术投入规模保持行业第一。当前公司资产规模和净资产规模、营业收入和归母净利润、杠杆率均位于行业前列。市场化改革持续推进，提升公司经营效率。2018年8月，公司引进阿里巴巴、苏宁易购等六家战略投资者，完善公司治理机制；2019年12月，公司的职业经理人制度正式落地；2021年4月，华泰证券股权激励计划实施完毕，将员工利益与公司利益一体化。以战略投资者丰富股东背景，以市场化方式选聘职业经理人，以股票期权建立激励约束机制，公司组织活力和发展动力得到有效释放，经营效率持续改善。双轮驱动，协同共振：拓宽财富管理护城河，打造机构服务生态圈。公司聚焦客户服务需求，提出科技赋能下的财富管理与机构服务“双轮驱动”发展战略，以平台化、生态化的运营模式打通业务，为客户提供一站式金融服务，有助于业务链条之间协同共振，打开业绩发展空间。一方面，公司将财富管理转型作为“双轮驱动”发展战略之一，以渠道协同、客户规模、产品种类和配套服务为发力点，打造了我国证券行业最具活力的财富管理平台之一。另一方面，公司持续加强机构服务业务布局，推动以并购重组为特色的投行业务与其他业务高效协同，为产业和金融机构客户提供从初创、成长到成熟、衰退的全方位、全生命周期服务。盈利预测与估值：预计公司2022年-2024年营业收入分别为338.97亿元/413.72亿元/523.41亿元，同比增速分别为-11%/22%/27%；归属母公司净利润分别为91.88亿元/113.63亿元/148.24亿元，同比增速分别为-31%/24%/30%。我们采用相对估值法，考虑到华泰证券作为证券行业头部券商有望享受更多发展红利，我们在同类公司市场一致预期估值的均值上给予20%-30%的溢价，对应目标价为14.50-15.72元/股，认为公司股票合理估值区间在14.50-15.72元之间，较当前还有14%-23%的增长空间。基于我们认为2023年权益市场温和上涨的预期，我们对公司盈利预测较前值有所下调，本次覆盖对公司投资评级由“买入”下调至“增持”。风险提示：盈利预测偏差较大的风险；二级市场大幅波动风险；资产管理业务面临监管政策变动风险；资本市场全面深化基础性制度改革推进不及预期的风险；投资收益的大幅波动风险；境外监管风险。,,国信证券,增持,[None],2023-03-10,下调评级,增持,5135355,pdf_downloads/2023/2023-03-10/601688-华泰证券（601688）：科技搭建机构与财富生态.pdf,601688,华泰证券,华泰证券（601688）：科技搭建机构与财富生态
张洋,华泰证券(601688)事件：2022年12月30日，华泰证券发布配股公开发行证券预案，公司拟向全体A+H股东每10股配售3股，募资资金总额不超过人民币280亿元（含人民币280亿元）。华泰证券2022年前三季度经营概况：华泰证券2022年前三季度实现营业收入236.18亿元，同比-12.22%；实现归母净利润78.21亿元，同比-29.21%。基本每股收益0.84元，同比-31.71%；加权平均净资产收益率5.35%，同比-2.96个百分点。本次拟募资投向：1.资本中介业务拟投入不超过100亿元。2.扩大投资交易业务规模，拟投入不超过80亿元。3.增加对子公司的投入，不超过50亿元。4.加强信息技术和内容运营建设，拟投入不超过30亿元。5.补充其他运营资金，拟投入不超过20亿元。投资建议：华泰证券本次配股募资280亿元，将进一步打开两融、包括客需业务在内的投资交易、另类投资业务、私募基金业务等重资产业务的发展空间，有助于公司持续完善国际业务布局，巩固公司在金融科技领域的行业领先地位。在本次配股完成后，虽然短期内将在一定程度上摊薄公司的ROE，但中长期能够夯实资本助力公司转型发展，提升综合竞争力，并进一步提升公司的整体盈利能力，更好的回报股东。2022年前三季度公司自营业务受市场波动影响下滑幅度较大，财富管理业务虽有下滑但与行业保持同步，资管、投行业务同比保持增长。我们预计2023年证券行业整体经营业绩将重拾升势，作为代表性头部券商，公司经营业绩改善的空间较大，目前估值具备较强吸引力。风险提示：1.权益及固收市场环境转弱导致公司业绩出现下滑；2.市场波动风险；3.全面深化资本市场改革的进度及力度不及预期,,中原证券,增持,[None],2023-01-10,,增持,5092110,pdf_downloads/2023/2023-01-10/601688-华泰证券（601688）公司点评：拟配股夯实资本实力，助力公司转型发展.pdf,601688,华泰证券,华泰证券（601688）公司点评：拟配股夯实资本实力，助力公司转型发展
"孙婷,VIvian Xu",(Please see APPENDIX 1 for English summary)事件：华泰证券公告配股预案，公司拟以10股配售3股的比例向全体A股及H股股东配售。本次配售股份数量27.23亿股，其中A股配股股数为22.07亿股，H股配股股数为5.16亿股。预计募集资金规模不超过280亿元。配股有望增强公司核心竞争力。公司经过多年的快速发展，不断提升核心竞争优势，公司的业务和收入规模不断提升，据证券业协会排名，2021年公司净资产、营收及净利润等指标均排名行业第三。随着资本市场改革深化、创新业务试点陆续推出，证券行业盈利的重心逐渐从传统通道业务转向资本中介业务，重资本型业务正在加速消耗资本金。资本对公司快速发展的各块业务体系所形成的制约作用已逐步显现，我们认为此次配股有利于增强公司资本实力，进一步提升公司核心竞争力。配股将主要用于资本中介及自营业务。本次配股具体用途包括5个方面：资本中介业务不超过100亿元，扩大投资交易规模不超过80亿元，增加子公司投入不超过50亿元，加强信息技术和内容运营建设不超过30亿元，补充其他营运资金不超过20亿元。1）资本中介业务：公司融资融券业务坚持以客户需求为中心，截至2022年6月末，母公司两融余额1159亿元，市场份额7.23%；其中，融券余额 170亿元，市场份额18.14%。未来公司资本中介业务将持续加强营销服务体系建设，不断提升业务运营效率，着眼于券源获取能力、客户服务能力和金融科技运用的差异化竞争优势，进一步提升业务发展质量。2）投资交易业务：公司在FICC、场外衍生品方面的投资规模均处于行业前列，公司目前已获得科创板做市交易的资格，同时拥有跨境自营业务资格。通过本次配股资金的投入，公司将继续发挥体系化、平台化的投资交易能力，为客户提供个性化和专业化金融服务，强化公司业务竞争力。3）子公司投入：目前公司拥有6家全资子公司，本次资金投入将进一步强化公司全业务链协作，实现母子公司协同发展，为客户提供多元化、综合化的服务。4）新技术的投入：公司多年来一直保持信息技术的高投入，截至2022年6月末，公司APP涨乐财富通月活数952.39万，位居券商APP第一名。估值仍低，我们维持盈利预测和目标价，以及“优于大市”评级。预计公司2022-2024E年EPS为1.22/1.51/1.63元，BVPS为16.04/17.17/18.33元。考虑到公司各项业务排名居前，给予其22年1.1x P/B，对应目标价17.64元，维持“优于大市”评级。风险提示：市场持续低迷导致业务规模下滑；权益市场波动加剧致投资收益不及预期。,,海通国际证券,优于大市,[None],2023-01-04,,买入,5086135,pdf_downloads/2023/2023-01-04/601688-华泰证券（601688）：拟配股280亿元，进一步增强资本实力.pdf,601688,华泰证券,华泰证券（601688）：拟配股280亿元，进一步增强资本实力
"刘雨辰,曾广荣","业绩总体符合预期，自营拖累总体业绩 事件：公司发布三季报，22年前三季度实现营业收入236亿元，同比-12%；实现归属于上市公司股东净利润78亿元，同比-29%，符合预期。前三季度加权平均ROE为5.35%，较去年同期-2.96pct，年化后达7.13%。22年第三季度分别实现营业收入75亿元和归母净利润24亿元，同比分别-14%和-25%，环比分别-16%和-23%。整体表现符合预期，投行、资管具备韧性1）2022年前三季度，公司业绩表现较为稳健，具体来看经纪、投行、资管、信用、自营业务收入及增速分别为53亿元（-11%）、29亿元（+9%）、26亿元（+11%）、21亿元（-31%）、44亿元（-54%）；2）资管业务持续增长，2022年第三季度资管业务净收入为9亿元，同比+7%，环比+34%，子公司华泰资管2022年三季度末基金净值达817亿，同比+334%；3）投行业务具备韧性，2022年第三季度投行业务净收入为12亿元，同比+45%，环比+54%。权益市场大幅震荡，投资业务承压较重1）2022年前三季度市场日均股基成交额为10421亿元，同比-7%,第三季度日均股基交易额为10061亿元，同比-27%。受权益市场大幅波动影响，第三季度公司经纪业务手续费净收入为18亿元，同比-27%，环比持平；同时受股、债市场影响，公司第三季度自营业务收入同比减少88%至3亿元。盈利预测、估值与评级我们预计公司22/23/24年营收分别为345/384/425亿元，同比-10% /+11%/+11%；归母净利润分别为100/116/132亿元，同比-25%/+16%/+14%；EPS分别为1.10/1.28/1.45元。我们看好公司综合优势及数字化牵引下的商业模式创新与全业务链优势，预计公司未来持续受益资本市场改革红利和行业集中度提升下的格局优化，给予公司22年1倍PB，目标价16.35元。给予“买入”评级。风险提示：市占率提升不及预期，二级市场大幅波动，基金销售竞争激烈，行业监管趋严",,国联民生证券,买入,[None],2022-11-06,,买入,5041467,pdf_downloads/2022/2022-11-06/601688-华泰证券（601688）：业绩总体符合预期，自营拖累总体业绩.pdf,601688,华泰证券,华泰证券（601688）：业绩总体符合预期，自营拖累总体业绩
"孙婷,VIvian Xu",投资要点：公司贯彻科技赋能理念，打造全新竞争优势，多项业务水平领先。目前公司经营状况良好，资管及投行业绩表现稳定。目标价17.64元，维持“优于大市”评级。【事件】华泰证券发布2022前三季度业绩：实现营业收入236.2亿元，同比-12.2%；归母净利润78.2亿元，同比-29.2%；对应ROE 5.4%。经纪、投行、资管、利息、自营占营业收入分别为23%/12%/11%/9%/19%。第三季度实现营业收入74.5亿元，同比 -14.1%，环比-16.5%。归母净利润24.5亿元，同比-25.4%，环比 -22.6%。公司三季度营收及利润同比环比下滑较多主要是由于公司自营投资收益大幅降低，公司投行及资管等业务均增长较多。依托数字化赋能与全业务链优势，搭建全生命周期客户交易与成长体系。2022年前三季度实现经纪业务收入53.3亿元，同比-10.6%，占营业收入比重22.6%。前三季度全市场日均股基交易额10270亿元，同比-7.1%。公司持续推进“涨乐财富通”平台产品及服务创新，重点推出以视频内容为主体的全新内容输出和运营方式。截至2022年6月30日，公司APP涨乐财富通月活数952.39万，位居券商APP第一名。前三季度市场两融余额15382亿元，较年初-16%。把握资本市场深化改革机遇，持续推进全业务链战略，行业排名稳定。公司2022年前三季度投行业务收入29.1亿元，同比+9.4%。股权业务承销规模同比+3.4%，债券业务承销规模同比+10.9%。股权主承销规模1098.8亿元，排名第4；其中IPO22家，募资规模297亿元；再融资35家，承销规模802亿元。债券主承销规模6769亿元，排名第4；其中地方政府债、金融债、公司债承销规模分别为3321亿元、1346亿元、1167亿元。华泰联合IPO储备项目32家，排名第7，其中两市主板12家，北交所1家，创业板16家，科创板3家。聚焦资产管理总规模质量，公募管理规模大幅增长。公司2022年前三季度资管收入26.0亿元，同比+11.2%。截至上半年末，公司资产管理规模5016亿元，同比-3.3%。公募基金方面，公司积极打造针对投资者不同流动性需求的净值化理财解决方案。截至上半年末公募基金管理产品27只，管理规模972.36亿元。推进业务模式全面向交易导向转型，贯彻去方向化战略，三季度投资收益环比下降。公司继续坚定推进业务模式全面向交易导向转型，贯彻去方向化战略，全面升级投资交易能力，积极打造具备核心竞争力、可持续发展的权益投资与交易体系。2022年前三季度投资收益（含公允价值）44.4亿元，同比-54.0%；第三季度投资收益（含公允价值）6.9亿元，同比-72.1%，环比-64.3%。估值仍低，“优于大市”评级。我们预计公司2022-2024E年EPS为1.22/1.51/1.63元，BVPS为16.04/17.17/18.33元。考虑到公司各项业务排名居前，给予其22年1.1x P/B，对应目标价17.64元，维持“优于大市”评级。风险提示：市场持续低迷导致业务规模下滑；权益市场波动加剧致投资收益不及预期。,,海通国际证券,优于大市,[None],2022-11-02,,买入,5034951,pdf_downloads/2022/2022-11-02/601688-华泰证券（601688）2022年三季报点评：IPO规模大增，三季度投行、资管收入增长较多.pdf,601688,华泰证券,华泰证券（601688）2022年三季报点评：IPO规模大增，三季度投行、资管收入增长较多
