author,content,filename,org_name,original_rating,pdf_link,publish_time,rating_adjust_mark_type,rating_changes,report_id,save_path,stock_code,stock_name,title
"邱祖学,张弋清,李挺",事件：公司发布2024年半年报。2024H1公司实现营收1504亿元，同比增长0.1%，归母净利润150.8亿元，同比增长46.4%。单季度看，2024Q2公司实现营收756亿元，同比增长0.3%，环比增长1.2%，实现归母净利润88.2亿元，同比增长81.5%，环比增长40.9%。业绩符合业绩预告。计划实施中期分红26.58亿元，践行“以投资者为本”的上市公司发展理念。2024H1公司归母净利润同比上升，主要原因是毛利上升。公司2024H1实现归母净利润150.8亿元，同比增长46.4%，主要原因是公司主要运营产品量价齐升，尤其是铜、金产品，其中矿山产金、矿山产铜平均售价同比2023年同期分别增加22.4%和14.6%，销量分别同比增长5.2%和6.1%。单季度来看，24Q2公司毛利为164亿元，环比增长40亿元，主要得益于铜金产品售价提升。24Q2公司毛利为164亿元，环比大幅增长40亿元，主要得益于铜金产品量价齐升，矿产金/矿产铜毛利分别环比增长12/18亿元，占毛利增长总额的30%和46%。产量：金产量环比提升，铜产量环比减少。2024Q2，公司生产矿产金/矿产铜/矿产银18.6吨/25.5万吨/108吨，环比分别变化+10.7%/-3.0%/+5.9%，同比分别增长13.5%/2.9%/4.5%。黄金同环比增长主要或得益于大陆黄金和诺顿金田新项目爬坡等。铜产量环比减少或主要由于Q2刚果金电力供应紧张，影响卡莫阿正常生产，以及钴产品放射性超标导致科卢韦齐产量受影响。成本：成本端得到有效控制。2024H1矿产金/铜单位销售成本同比分别增长8.1%/3.5%。2024Q2矿产金/铜单位销售成本环比增长3.46%/0.06%，同比增长4.51%/3.49%。成本环比增长态势有所减缓。细分来看，Q2矿产电解铜成本环比下降6.84%，主要或由于塞紫铜产量增长带来规模效应。Q2矿产铜精矿成本环比基本持平，矿产电积铜成本环比增长6.09%，主要或由于科卢韦齐产量下降导致单位成本抬升。核心看点：①三大铜矿业集群持续绽放，锂钼战略金属板块打造新成长曲线。铜板块，塞尔维亚Timok+Bor、卡莫阿、巨龙，三大世界级铜矿业集群2024-2026年均将持续贡献增量；金板块，多项目齐头并进，海域金矿、Rosebel、萨瓦亚尔顿构成新生增量，黄金产量持续增长。战略金属板块，手握“两湖两矿”优质锂资源，期待资源优势转化为产量优势。同时加码战略矿种钼。②成本上涨趋势得到遏制，期待后续进一步降本增效。③中期分红回馈投资者，彰显公司“以投资者为本”的发展理念。投资建议：公司铜金产量持续增长，考虑到铜金价格上涨，我们预计2024-2026年公司将实现归母净利297亿元、363亿元、414亿元，对应8月23日收盘价的PE为14x、12x和10x，维持“推荐”评级。风险提示：项目进度不及预期，铜金锂等金属价格下跌，地缘政治风险，汇率风险等。,,民生证券,推荐,[None],2024-08-27,,增持,5735936,pdf_downloads/2024/2024-08-27/601899-紫金矿业（601899）：2024年半年报深度点评：降本增效见成效，三大铜矿产业集群齐绽放.pdf,601899,紫金矿业,紫金矿业（601899）：2024年半年报深度点评：降本增效见成效，三大铜矿产业集群齐绽放
"翟堃,谷瑜",事件：公司发布2024年半年度报告。2024H1实现营业收入1504亿元，同比+0.06%；实现归母净利150.8亿元，与2023H1的103.02亿元相比增加46.42%；实现扣非归母净利154.3亿元，与2023H1的96.55亿元相比增加59.84%。主要系①主产品产量实现增长，矿产铜、金产量分别增加5.3%、9.5%；铜、金价格同比均增长。②控本初显成效，2024H1公司铜精矿、金精矿销售成本环比分别下降8.8%、6.7%。2024Q2单季度实现营收756.4亿元，环比+1.2%，同比+0.3%；实现归母净利88.2亿元，同比+81.5%，环比+40.9%。2024H1主要产品产量同比增长，金属价格上行。产量方面，2024H1主要矿产品产量同比增加，公司矿产金产量35.4吨，同比增长9.5%（2023H1为32.3吨）；矿产铜产量约51.9万吨，同比增长5.3%（2023H1为49.2万吨）；矿产银产量约210.3吨，同比增长1.3%（2023H1为207.6吨）。经计算，2024Q2公司矿产金产量18.6吨，环比增加10.7%，同比增加13.5%；矿产铜产量25.6万吨，环比减少2.6%，同比增加3.3%；矿产银产量约108.2吨，环比增加6.1%，同比增加4.7%。价格方面，2024H1伦金均价2203美元/盎司，同比+14.0%；伦铜均价9206美元/吨，同比+5.5%。新一轮找矿取得重大成果。公司旗下西藏巨龙铜矿、黑龙江铜山铜矿合计新增备案铜金属资源量1837.7万吨、铜金属储量577.7万吨。这一新增的铜金属储量约占中国2022年末铜储量的14.2%，标志着公司全面落实国家新一轮找矿突破战略行动取得重大成果。此外，塞尔维亚佩吉铜金矿南部MG勘查有望新探获大型高品位铜金矿床，武里蒂卡金矿、马诺诺锂矿东北部、诺顿金田、山西紫金、湘源锂矿、备战铁矿等勘探均取得积极进展。2024年6月底，公司权益口径资源量较年初增加铜 619.7 万吨，金53.71吨，银3334吨，按控股企业100%口径及联营合营企业权益口径计算，公司保有探明、控制及推断的总资源量为铜10467万吨、金3528吨、锌（铅）1212万吨、银28380吨，锂（LCE）1411万吨；其中，保有证实储量和可信储量：铜4382万吨、金1322吨、锌（铅）506万吨、银2653吨、锂（LCE）505万吨。旗舰矿山蓄势。铜方面，卡莫阿铜矿、巨龙铜矿均见可观增长。卡莫阿铜矿资源量约4266万吨，2023年矿产铜39.4万吨，2024年计划矿产铜50.7万吨；项目一、二期联合改扩能于2023年第一季度建成投产，年产能达到45万吨；三期采选工程于2024年5月26日提前建成投产，年矿石处理总量将达到1420万吨，铜产量将提升至60万吨，晋升为全球第四大铜矿。巨龙铜业拥有资源量铜1927万吨、银1.06万吨、钼120万吨；2023 年矿产铜15.44万吨，2024年计划矿产铜16.6万吨；二期改扩建2024年将全面开工建设，计划2025年底建成投产，达产后年矿产铜将达 30-35万吨。金方面，波格拉金矿、海域金矿为主要增量项目。波格拉金矿为全球十大黄金矿山之一、巴新第二大金矿，拥有资源量金417吨，于2023年12月22日全面复产，复产达产后归属公司权益年矿产金约5吨。海域金矿为中国最大单体金矿，拥有资源量金562吨，计划 2025 年投产，整体投产达产后年矿产黄金约15-20吨，有望晋升为中国最大黄金矿山。盈利预测。我们参考公司产量规划目标及新增矿山投产进度，我们预计2024-2026年矿产金产量分别为74/85/99吨，矿产铜产量分别为111/122/134万吨。受金属价格波动影响，我们调整公司盈利预测，预计2024-2026年归母净利分别为313、375、416亿元，同比增速48.4%、19.8%、10.8%，截至2024年8月26日收盘，2024-2026年对应PE分别为13.8x/11.5x/10.4x，维持“买入”评级。风险提示： 黄金、铜、铅锌、锂等金属价格大幅下跌；改扩建项目不及预期导致产量不及预期；汇率波动风险。,,德邦证券,买入,[None],2024-08-27,,买入,5735900,pdf_downloads/2024/2024-08-27/601899-紫金矿业（601899）：24H1净利增46%，找矿、控本取得阶段性成果.pdf,601899,紫金矿业,紫金矿业（601899）：24H1净利增46%，找矿、控本取得阶段性成果
"黄玺,许勇其",紫金矿业发布2024年半年报公司24H1实现营业收入1504.17亿元，同比微增0.06%；实现归母净利润150.84亿元，同比+46.42%。单Q2实现营业收入756.4亿元，同比23Q2+0.33%，环比24Q1+1.15%；实现归母净利润88.24亿元，同比+81.54%，环比+40.93%。铜金矿山产量释放，五年目标有望提前达成24H1公司矿山产铜收入241.82亿元（同比+21.6%），实现矿山产铜51.86万吨（同比+5.3%）；矿山产金收入163.15亿元（同比+28.8%），产量为35.41吨（同比+9.5%）。公司铜、金矿山产量持续释放，卡莫阿三期提前半年建成投产，塞尔维亚项目、巨龙铜矿改扩建等项目有序推进，据公告公司预计提前2年（至2028年）达成原定至2030年实现的主要经济指标，届时主营矿产品年产量将形成铜150-160万吨、金100-110吨、锌（铅）55-60万吨、银600-700吨、锂（LCE）25-30万吨、钼2.5-3.5万吨规模。矿山技改叠加贵金属价格上行，盈利能力优化24H1公司综合毛利率19.15%，较23H1增加4.5pcts；其中矿山业务毛利率57.3%，同比+5.6pcts。利润率提升主要得益于金属价格上涨以及矿山技改优化成本，上半年金精矿/铜精矿单位成本分别为151.5元/克和1.86万元/吨，同比分别-2.5%和-5.41%。价格方面，24H1上交所黄金均价521元/克（同比+20%），白银价格6790元/千克（同比+28.2%），铜价7.47万元/吨（同比+10%）。根据上海黄金交易所， 2024年8月21日黄金、白银收盘价分别为574.5元/克和7544元/千克，较上半年均价有明显提升，下半年美联储降息预期升温，贵金属价格继续抬升，公司业绩有望持续优化。投资建议公司是国内金属矿业领先企业，铜、金矿产量稳步提升，我们预计公司2024-2026年归母净利润分别为317.14/353.45/382.84亿元（前值为317.7/359.5/393.4亿元），对应PE分别为14/12/11倍，维持“买入”评级。风险提示铜、金等金属价格超预期下降；项目建设进展不及预期；海外矿山经营风险等,,华安证券,买入,[None],2024-08-26,,买入,5736342,pdf_downloads/2024/2024-08-26/601899-紫金矿业（601899）：矿产铜金量价齐增，矿山成本持续优化.pdf,601899,紫金矿业,紫金矿业（601899）：矿产铜金量价齐增，矿山成本持续优化
"刘孟峦,杨耀洪",公司发布半年报：上半年实现营收1504.17亿元，同比+0.06%；实现归母净利润150.84亿元，同比+46.42%。公司24Q1/Q2分别实现营收747.77/756.40亿元，Q2环比+1.15%；24Q1/Q2分别实现归母净利润62.61/88.24亿元，Q2环比+40.93%。Q2业绩表现亮眼，主要得益于金属价格二季度有比较明显的上涨，其中COMEX黄金Q2均价环比+6.37%，LME铜Q2均价环比+7.76%。核心矿产品产量：上半年，公司矿产金产量35.41吨，同比+9.5%；矿产铜产量51.86万吨，同比+5.3%；矿产锌产量20.01万吨；矿产银产量210.3吨。公司已发布2024年核心矿产品的产量指引，全年有望实现目标。核心矿产品成本：上半年，公司矿产金单位成本为227元/克；矿产铜单位成本为22415.74元/吨；矿产锌单位成本为8969元/吨；矿产银单位成本为1.87元/克。综合来看，公司重点领域成本控制取得阶段性成果。新项目建设有序推进，新质生产力不断构建——铜：刚果(金)卡莫阿三期采选工程提前半年建成投产，达产后年产铜将提升至60万吨以上，配套50万吨铜冶炼厂预计2025年2月份竣工投产；塞尔维亚两大铜矿2025年将全面完成改扩建工程，届时铜矿产能有望达到30万吨/年；西藏巨龙铜矿二期改扩建工程获有关部门批准，计划2025年底建成投产，届时年矿产铜将达30-35万吨；西藏朱诺铜矿项目快速推进，未来将形成9.9万吨/年产能铜矿山。金：苏里南罗斯贝尔金矿技改达产后将形成10吨/年产金能力；波格拉金矿于2023年12月22日全面复产，达产后平均年矿产金21吨，归属公司权益年矿产金约5吨；山西紫金智能化采选改扩建工程建成投产，达产后年新增矿产金3-4吨；新疆萨瓦亚尔顿金矿240万吨采选项目如期建成投产。锂：湖南湘源硬岩锂矿二期500万吨采选系统有序推进，计划于2025年底建成投产；阿根廷3Q锂盐湖一期工程年产2万吨碳酸锂项目第一阶段投料试车成功，二期工程年产3万吨碳酸锂项目盐田建设有序推进；西藏拉果错锂盐湖一期将形成2万吨/年氢氧化锂产能。风险提示：项目建设进度不达预期，矿产品销售价格不达预期。投资建议：维持“优于大市”评级。上调公司盈利预测。预计公司2024-2026年营收为3213/3482/3629(原预测3154/3377/3555)亿元，同比增速9.5%/8.4%/4.2%；归母净利润为312.37/348.77/399.43(原预测249.95/311.41/368.53)亿元，同比增速47.9%/11.7%/14.5%；摊薄EPS为1.18/1.31/1.50元，当前股价对应PE为14/12/11X。公司是国内有色上市公司核心标的，矿产资源储量丰富，国际化进程不断加快，战略延伸积极布局新能源新材料产业助力能源转型，核心矿种实现多元化布局，中长期成长路径明确，未来有望跻身全球超一流国际矿业企业，维持“优于大市”评级。,,国信证券,优于大市,[None],2024-08-25,,买入,5733478,pdf_downloads/2024/2024-08-25/601899-紫金矿业（601899）：半年报点评：成本控制卓有成效，量价齐增兑现高利润弹性.pdf,601899,紫金矿业,紫金矿业（601899）：半年报点评：成本控制卓有成效，量价齐增兑现高利润弹性
李怡然,紫金矿业发布2024年半年度报告，归母净利同比增长46.42%公司发布2024年半年度报告，2024H1实现营业收入1504亿元，同比增长0.06%，归母净利润约150.84亿元，同比增加46.42%，实现扣非归母净利润约154.33亿元，同比增长59.84%。其中，受益于核心产品价格上行及公司积极的成本管控措施，2024Q2公司实现营业收入756.40亿元，同比增长0.33%，实现归母净利润88.24亿元，同比增长81.54%，环比增长40.93%。我们看好铜、金价格中枢持续上行及公司产量稳定释放，且持续的成本管控措施有望增厚整体利润，上调2024-2026年盈利预测，预计2024-2026年归母净利润分别为325.6/380.6/433.8亿元（2024-2026年前预测值为319.7/367.7/414.0亿元），EPS分别为1.22/1.43/1.63元，当前股价对应PE分别为13.1/11.2/9.8倍，维持“买入”评级。铜金业务迎量价齐升，成本上升态势得到扼制产量方面，2024H1公司矿产铜产量同比增长5.3%至51.9万吨，，矿产金产量同比增长9.5%至35.4吨，矿产银产量同比小幅增长1.3%至210.3吨。其中，2024Q2矿产铜产量为25.6万吨，同比增长5.5%，矿产金产量18.6万吨，同比增加13.5%。价格方面，受益于铜、金市场价格中枢上移，2024H1公司矿产铜销售单价同比增长14.6%，矿产金单价同比增长22.4%；2024Q2扩产铜单价同比增长29.4%，环比增长9.6%，矿产金单价同比增长25.7%，环比增长5.2%。成本方面，公司积极将“控本”作为年度重点工作，强化国际事业管理委员会、锂产业领导小组、金融委员会等职能，攻坚海外项目等重点领域成本控制并取得阶段性成果，2024H1公司铜精矿、金精矿销售成本环比分别下降8.8%和6.7%。资源为王，持续发挥在自主找矿勘探领域的比较优势2024年上半年，公司旗下巨龙铜矿和铜山铜矿取得重大找矿勘查成果，并获得自然资源主管部门评审通过。公司积极推进自主找矿勘探项目，增厚资源储量水平，塞尔维亚Timok铜金矿南部MG勘查有望探获大型高品位铜金矿床，武里蒂卡金矿、马诺诺锂矿、诺顿金田、山西紫金等勘探均取得积极进展。风险提示：原材料价格波动风险；政策变动风险；项目进展不及预期风险。,,开源证券,买入,[None],2024-08-25,,买入,5733054,pdf_downloads/2024/2024-08-25/601899-紫金矿业（601899）：公司信息更新报告：铜、金量价齐升，盈利规模稳步抬升.pdf,601899,紫金矿业,紫金矿业（601899）：公司信息更新报告：铜、金量价齐升，盈利规模稳步抬升
"李帅华,杨丰源","Q2归母净利润为88.24亿元，环比增40.94%公司于24年8月23日晚发布半年报。2024年上半年实现营收1504亿元，归母净利润151亿元、同比增长46.4%，扣非后归母净利润154.3亿元、同比增长达59.8%。其中，2024年Q2，公司实现归母净利润88.24亿元，环比增40.94%，创造历史最好成绩。产量：铜金继续保持高增速2024年H1，公司产量继续保持了高增速，实现矿产铜51.9万吨（42.5权益万吨）、矿产金35.4吨（29.9权益吨）、矿产锌（铅）22.2万吨（权益18.0万吨）、矿产银210.3吨（140.7权益吨），其中矿产铜、金产量同比增长分别为5.3%、9.5%，继续保持了较高增速，量价齐升背景下贡献公司业绩增量。（24H1，公司铜业务毛利占集团毛利的49.1%，黄金业务毛利占集团毛利的28.3%）。估值提升的底层逻辑，成本控制能力得到持续验证 成本控制是矿山竞争能力的重要体现。2023年以来，紫金矿业加快构建具有紫金特色的全球运营管理体系，攻坚海外项目等重点领域成本控制，“控本”工作逐渐显现出“增效”成果，2024H1，公司铜精矿单位销售成本为18578元/吨，同比下降了5.41%，环比2023H2下降了8.82%；金精矿单位销售成本为151.5元/g，同比下降了2.5%，环比2023H2下降了6.73%。在地缘政治持续扰动，民族资源主义抬头的大背景下，公司积极降本增效，2024年上半年持续控制成本下行，实属难能可贵。我们认为，优秀的成本控制能力可以降低大宗商品价格波动带来的利润波动率，是矿企提升估值的重要力量，紫金矿业成本控制能力得到持续验证，未来有望提升估值水平，详见我们之前发布的《紫金矿业：全球领先的铜金矿石服务提供商，估值有望提升》。持续增储，新一轮找矿取得重大成果2024H1，公司旗下的西藏巨龙铜矿和黑龙江铜山铜矿合计新增备案铜金属资源量1837.7万吨，新增备案的铜金属储量577.7万吨。此外，塞尔维亚佩吉铜金矿南部MG勘查有望新探获大型高品位铜金矿床，武里蒂卡金矿、马诺诺锂矿东北部、诺顿金田、山西紫金、湘源锂矿、备战铁矿等勘探均取得积极进展。优秀的探矿处理矿能力有望继续增强公司资源储备。战略目标清晰，继续向全球铜金矿山领导企业迈进公司战略方向正确，执行高效坚定一以贯之。公司基本面良好，为乘势而上，加快各项指标达成，报告期公司发布《关于未来五年(至2028年)主要矿产品产量规划的公告》，将力争提前2年（至2028年）达成原定至2030年实现的主要经济指标，届时主营矿产品年产量将形成铜150-160万吨、金100-110吨、锌（铅）55-60万吨、银600-700吨、锂（LCE）25-30万吨、钼2.5-3.5万吨规模，主要经济指标有望进入全球前3－5位。盈利预测我们预计 2024-2026 年，随着金铜价格持续强势，紫金矿业各个
项目稳定投产，预计紫金矿业营业收入为 3458.69/3582.82/3721.43
亿元， YOY 为 17.88%/3.59%/3.87% ， 归 母 净 利 润 为
311.34/392.44/460.46 亿元，YOY 47.42%/26.05%/17.33%，对应 PE
为 13.71/10.88/9.27，维持“买入”评级。风险提示铜金价格超预期下跌，公司项目进度不及预期等。",,中邮证券,买入,[None],2024-08-24,,买入,5733590,pdf_downloads/2024/2024-08-24/601899-紫金矿业（601899）：Q2利润历史新高，成本控制能力得到持续验证.pdf,601899,紫金矿业,紫金矿业（601899）：Q2利润历史新高，成本控制能力得到持续验证
"许勇其,黄玺",主要观点：历经三十余年，进入国际矿业领先行列紫金矿业在全球范围内从事铜、金、锌、锂等资源的开发，截至2023年底公司资源量、储量:铜9547万吨、金3465吨、锌（铅）1240万吨、银22773吨。2024年得益于铜金等金属价格上行、公司海外矿山技改优化成本、收购和改扩建矿山产能释放，公司业绩持续提升，据公告2024H1公司预计实现归母净利润约145.5-154.5亿元，同比增加约41%-50%。黄金：降息预期升温，避险情绪带动金价走高2024年年初以来美联储降息预期及央行购金带动黄金价格上行，下半年以来降息预期持续升温，美国6月经济数据不及预期，巴以、俄乌局势加剧全球地缘政治不确定性，黄金配置价值显著提升。公司黄金产量及资源量系亚洲第一、全球前十，2023年公司实现矿山产金67.7吨，同比+20.17%，相当于中国矿山产金总量的23%。后续波格拉复产、罗斯贝尔金矿技改、海域金矿等项目持续贡献黄金增量。铜：全球供应紧张，公司新增产能陆续释放第一量子巴拿马铜矿预期2024年不会重启，矿端干扰延续，需求端24H1国内电网投资额和空调产量同比分别+23.7%和+11.7%，需求韧性凸显，铜价仍具上行空间。2023年公司旗下矿山产铜100.73万吨，列全球铜企前五，2024-2025年公司新建产能有望陆续投产：卡莫阿铜矿三期采选预计24Q2投产后年产能达到60万吨，塞尔维亚铜矿预计2025年完成改扩建工程产能达30万吨。逆周期并购+高效管理模式，成本优势领先行业逆周期并购：公司依托矿业经济思维及专业分析决策能力，铜金矿收购大部分在金属价格相对低点，后续并表+产能释放充分享受价格回升的红利，铜及黄金并购成本显著低于行业。自主勘探：公司是国内第一家拥有自主研制国际先进勘探设备的矿业公司，50%以上铜、金资源和90%以上锌（铅）资源为自主勘探获得，单位勘查成本显著低于全球同行。矿山运营：公司首创“矿石流五环归一”管理模式统筹矿山开发各环节，降低生产运营成本据公告紫金矿业铜C1成本和黄金AISC成本均位于全球前20%分位。投资建议紫金矿业是国内乃至全球多金属矿山开发领先企业，具备先进的勘探技术和高效的矿山管理能力，后续伴随矿山技改+新项目投产，公司业绩有望持续爬坡，我们预计紫金矿业2024-2026年归母净利润分别为317.7/359.5/393.4亿元，对应PE分别为13.87/12.26/11.20倍，首次覆盖给予“买入”评级。风险提示产能释放不及预期；金属价格大幅波动；海外矿山经营风险等。,,华安证券,买入,[None],2024-07-31,,买入,5707076,pdf_downloads/2024/2024-07-31/601899-紫金矿业（601899）：铜金矿山全球领先，新增项目持续释放.pdf,601899,紫金矿业,紫金矿业（601899）：铜金矿山全球领先，新增项目持续释放
