author,content,filename,org_name,original_rating,pdf_link,publish_time,rating_adjust_mark_type,rating_changes,report_id,save_path,stock_code,stock_name,title
刘翔,国内半导体设备龙头厂商，2021H1业绩高增长，维持“买入”评级。2021年8月24日公司发布半年报，2021H1营收13.39亿元，同比+36.82%；归母净利润3.97亿元，同比+233.17%；扣非归母净利润0.62亿元，同比+53.35%。计算得2021Q2单季度营收7.35亿元，同比+29.95%，环比+21.87%；归母净利润2.59亿元，同比+178.87%，环比+87.89%；扣非归母净利润0.51亿元，同比+8.91%，环比+354.67%。公司是国内半导体设备龙头，受益于公司积累的领先技术以及国产替代化的加速，发展潜力较大。我们上调盈利预测，2021-2023年归母净利润预计为5.51（+0.03）/7.90（+0.05）/9.77（+0.05）亿元，EPS预计为0.89（-0.14）/1.28（-0.19）/1.59（-0.23）元，当前股价对应PE为199.8/139.3/112.5倍，维持“买入”评级。内生外延，扩展业务布局，前景可期据 Gartner预测，刻蚀设备市场规模2020-2024年将由123亿美元增长至152亿美元。由于微观器件越做越小，薄膜厚度越来越薄，线宽控制越来越严，ICP刻蚀设备取代以往的CCP刻蚀设备成为市场规模占主导地位的设备，公司是国内唯一具备CCP、ICP两种刻蚀技术的企业。内生方面，公司ICP 刻蚀设备Primonanova®产品已成功进入海内外10余家客户，超过70个工艺在客户的生产线上达标，在领先的逻辑芯片、DRAM 和3D NAND生产线上大规模量产，2021/6公司ICP设备第100台反应腔顺利交付，研发的双反应台ICP刻蚀设备Primo Twin-Star®也在客户端完成认证，收到国内领先客户的订单。公司CCP产品保持竞争优势，5nm以下产线获得重复订单，在64/128层3DNAND广泛应用，2021年6月首台8英寸CCP刻蚀设备顺利付运。用于高性能Mini-LED量产的MOCVD设备已收到来自国内领先客户的批量订单。外延方面，公司已投资沈阳拓荆、睿励仪器、山东天岳等公司，布局薄膜、检测设备、碳化硅衬底材料等领域，内生外延推动平台化建设进程，同时完成对睿励仪器的增资，进一步巩固产业链协同效应。公司7月定增募资82.1亿元，用于扩产及开发新产品线，前景可期。风险提示：行业需求下降风险；行业竞争加剧风险、技术研发不及预期。,,开源证券,买入,[None],2021-08-25,,买入,4598101,pdf_downloads/2021/2021-08-25/688012-中微公司（688012）公司信息更新报告：业绩高速增长，刻蚀与MOCVD设备加速前行.pdf,688012,中微公司,中微公司（688012）公司信息更新报告：业绩高速增长，刻蚀与MOCVD设备加速前行
"杨旭,王芳,赵晗泥",一、事件概述2021/8/24公司发布半年报，实现营收13亿元，同比+37%。二、分析与判断刻蚀设备高增长，静待mini LED放量1）21H1：实现营收13亿元，同比+37%，其中刻蚀设备为8.6亿元，同比+84%，MOCVD设备为2.2亿元，同比-10%。毛利率42%，同比+8.4pct，主要受益于MOCVD设备毛利大幅提升。实现归母净利润4亿元，同比+233%；扣非归母0.62亿元，同比+53%。除营收增长+毛利率提升外，归母净利润较同比变动包括：①公允价值变动损益1.7亿元（持有中芯国际收益0.74亿+其他非上市公司股权投资收益0.98亿），计入非经。②政府补助同增1.44 亿元，计入非经。③本期股份支付费用同增1.45 亿。2）21Q2：实现营收7.4亿元，同比+30%，环比+22%；毛利率44%，同比+9.5pct，环比+2.6pct；归母净利润2.6亿元，同比+179%，环比+88%；扣非归母0.51亿元，同比+9%，环比+355%。刻蚀设备：CCP市占率持续提升，ICP进入量产期1）21H1营收8.6亿元，同比+84%；21Q2营收5.1亿元，环比+46%。21H1毛利率44%。2）CCP刻蚀设备：①逻辑电路上，5nm设备已获得行业领先客户的批量订单；②存储电路上，可应用于3D NAND 64/128层量产，同时根据客户需求正在开发新一代能够涵盖128 层及以上设备和工艺。③市占率持续提升，部分客户市场占有率已进入前三。3）ICP刻蚀设备：①Primo nanova：已进入10 家客户验证，截至2021年6 月交付达100 台，在逻辑IC、3D NAND 64 层已有量产。②Primo Twin-Star：在客户端完成认证，并收到来自国内领先客户的订单。MOCVD：期待Mini-LED起量1）21H1营收2.2亿元，同比-10%；21Q2营收0.9亿元，环比-31%；21H1毛利率31%，同比大幅提升。2）Mini-LED：发布用于高性能Mini-LED量产的MOCVD设备Prismo UniMax，已收到来自国内领先客户的批量订单。三、投资建议预计21-22年公司归母净利润分别为5.6/7.1亿，对应估值分别为202/158倍。参考SW半导体2021/8/25最新PE（2021）70倍，考虑设备环节国产化率低、未来业绩弹性高，我们认为公司低估，维持“推荐”评级。四、风险提示：PCB需求不及预期，募投项目产能扩张不及预期。,,民生证券,推荐,[None],2021-08-25,,增持,4597989,pdf_downloads/2021/2021-08-25/688012-中微公司（688012）：刻蚀设备稳步增长，MOCVD静待mini LED起量.pdf,688012,中微公司,中微公司（688012）：刻蚀设备稳步增长，MOCVD静待mini LED起量
"关东奇来,时彧,肖群稀",半导体设备技术实力持续强化，多维发展战略清晰公司中报：21H1营收13.39亿元，同比+36.82%，实现归母净利3.97亿元，同比+233.17%，扣非后0.62亿元，同比+53.35%。半导体刻蚀设备销售高增长、公允价值变动收益大增（公司投资青岛聚源芯星而间接持有中芯国际科创板股票）是利润同比显著提升的主因。公司三维度布局规划：深耕集成电路关键设备领域、扩展在泛半导体关键设备领域应用、探索其他新兴领域的机会；其中IC设备领域公司考虑扩大刻蚀设备竞争优势，延伸到薄膜、检测等其他关键设备领域。预计21-23年EPS为0.77、1.02、1.38元，可比公司21年PE、PS均值为177、40倍（Wind一致预测），我们认为中微突出的技术及研发实力、海内外市场地位在本土稀缺度高，应有一定估值溢价，给予21年PS 41x，目标价209.46（前值123.53）元。增持评级。受益于下游扩产及设备国产化机遇，公司半导体设备销售及订单高增长公司21H1刻蚀设备收入8.58亿元，同比+83.79%，毛利率达44.29%；MOCVD设备收入2.19亿元，同比-10.08%，但毛利率达30.77%，同比大幅度提升。21H1新签订单达18.89亿元，同比增长超过70%，且有部分Mini-LED MOCVD设备规模订单已进入最后签署阶段。21H1整体毛利率同比+8.42pct至42.34%，归母净利率同比+17.46pct至29.63%。研发投入达2.9亿元，同比+38%，占收入比重达21%。刻蚀设备技术迈向世界先进水平，紧密契合国内外主流晶圆厂前沿工艺主要产品进展：1）CCP：多款产品批量应用于国内外一线客户产线，在部分客户市占率已进入前三；公司推出首台用于8寸的CCP设备，丰富产品线，能满足不同客户8寸加工需求。2）ICP：Primo nanova在10家客户产线进行验证，已有超70个工艺达到客户产线指标要求，Primo Nanova第100台反应腔顺利交付。具有高输出率特点的双反应台ICP设备PrimoTwin-Star也已经在客户端完成认证，并收到来自国内领先客户的订单。潜力深远的半导体设备国产化先锋，维持“增持”评级公司刻蚀设备技术及市场突破高速推进，多维发展路径明晰，考虑到间接持有中芯国际科创板股票的公允价值变动收益，我们上调21~23年盈利预测，预计2021~23年归母净利润为4.8（前值3.8）/6.3（前值5.7）/8.5（前值7.9）亿元，PE 235/178/132倍，PS 36/27/22倍。风险提示：半导体周期性波动；国内芯片技术突破、产业投资不及预期；公司技术突破慢于预期：海外疫情加剧；知识产权争议和海外技术封锁；股东减持引发股价波动的风险。,,华泰证券,增持,[None],2021-08-25,,增持,4597837,pdf_downloads/2021/2021-08-25/688012-中微公司（688012）：装备技术多维突破，新签订单高增长.pdf,688012,中微公司,中微公司（688012）：装备技术多维突破，新签订单高增长
王晔,事件：公司于8月24日发布2021年半年度报告。公司2021年上半年实现营收13.39亿元，同比增长36.81%；实现归母净利润3.97亿元，同比增长233.16%；实现扣非净利润0.62亿元，同比增长53.35%。基本每股收益0.74元/股。投资要点：刻蚀设备收入大幅增加，在手订单充裕公司营收增长主要来自于半导体设备需求旺盛以及国产替代逻辑下刻蚀设备的放量增长，公司2021年上半年刻蚀设备收入为8.58亿元，较去年同期增长约83.79%。MOCVD设备收入为2.19亿元，较去年同期下降约10.08%。毛利率方面由于刻蚀设备的占比提高，毛利率实现较大提升（较上年同期增长8.42个百分点）。公司刻蚀设备毛利率达44.29%，MOCVD毛利率较去年同期也有所提升，达到30.77%。同时，公司上半年新签订单达18.89亿元，同比增长超70%，且有部分Mini-LED MOCVD设备规模订单已进入最后签署阶段，为接下来公司业绩快速发展提供了有利支持。非经常性损益多为股权投资与政府补助公司归母净利润较同期增长约2.78亿元，大幅增长的原因主要有三方面：1）扣非净利润较上年同期增加约0.21亿元；2）中芯国际股权公允价值变动（0.74亿）以及非上市公司股权投资公允价值变动损益（0.98亿元）合计约1.71亿元；3）政府补助较上年同期增加约1.44亿元。盈利预测考虑公司产品结构变化、毛利率提升及公允价值变化，上调公司盈利预测，预计公司2021-2023年归母净利润为6.14、7.27、8.29亿，公司作为半导体核心设备龙头供应商，国产替代下将稳定成长，维持公司“增持”评级。风险提示公司研发不及预期；下游晶圆厂资本支出大幅缩减，扩产不达预期等风险。,,国联民生证券,增持,[None],2021-08-25,,增持,4597586,pdf_downloads/2021/2021-08-25/688012-中微公司（688012）：刻蚀设备收入大幅增长，先进技术铸就核心竞争力.pdf,688012,中微公司,中微公司（688012）：刻蚀设备收入大幅增长，先进技术铸就核心竞争力
"佘凌星,郑震湘,陈永亮",公司发布2021年半年报。报告期内，公司实现营业收入13.39亿元，同比增长37%；实现归母净利润3.97亿元，同比增长233%。其中，刻蚀设备收入8.58亿元，同比增长84%，主要受益于半导体设备需求旺盛及公司产品竞争优势；MOCVD设备收入2.19亿元，同比下降10%，主要受市场需求影响。公司上半年毛利率42%，其中2021Q2毛利率43.5%。公司产品持续迭代，新增订单大幅增长。公司CCP产品保持竞争优势，5nm以下产线获得重复订单，在64/128层3D NAND广泛应用。公司ICP已经在10家客户产线上验证，截止2021/06累计发货100台反应腔。公司用于高性能Mini LED量产的MOCVD设备已经发布，并获得国内领先客户的批量订单。2021H1，公司新签订单金额18.9亿元，同比增长超过70%，且有部分Mini-LED MOCVD设备规模订单进入最后签署阶段，订单需求强劲。持续加强研发投入，打造创新文化研发团队。公司研发投入2.9亿元，同比增长38%；研发费用2.4亿元，同比增长31%。研发投入占营收比重为21%，高于行业均值。截止报告期末，公司研发人员348人，比上年同期增长50人，占员工总数38%。公司创始人和技术人员拥有国际领先半导体设备公司的从业经验，研发团队覆盖多个学科，积累丰富的经验、技术和专利储备，并形成良好的创新文化。公司在研项目涉及众多涵盖先进逻辑、DRAM、3D NAND刻蚀设备、外延设备、薄膜设备等。公司定增加码布局，内生外延共同推进平台化建设。公司定增募集资金总额82.1亿元，其中大基金二期认购25亿元。定增资金拟约31.7%用于扩产及开发新产品线；约37.6%用于刻蚀、MOCVD、热化学CVD等7大类新产品研发产业化；约30.8%科技储备资金用于公司与合作伙伴在新产品的协作开发项目、对外投资并购项目等需求，公司已投资沈阳拓荆、睿励仪器、山东天岳等公司，布局薄膜、检测设备、碳化硅衬底材料等领域，内生外延推动平台化建设进程。半导体刻蚀设备龙头，打造旗舰平台型企业。公司成功打造一支具有创造力和核心竞争力的技术团队，并成功打开商业化空间。公司MOCVD持续升级，CCP产品涵盖国内外一线客户，ICP产品快速迭代并放量，并继续布局半导体设备新产品线，打造半导体设备旗舰企业，并通过外延投资沈阳拓荆、睿励仪器、山东天岳等公司推进平台型建设。预计公司2021~2023年归母净利润6.70/6.67/7.99亿元，维持“买入”评级。风险提示：下游需求不及预期、新产品进展不及预期,,国盛证券,买入,[None],2021-08-25,,买入,4597287,pdf_downloads/2021/2021-08-25/688012-中微公司（688012）：新签订单大幅增长，核心产品持续迭代.pdf,688012,中微公司,中微公司（688012）：新签订单大幅增长，核心产品持续迭代
"孙远峰,熊军,王秀钢","事件概述公司发布2021年半年度报告，上半年实现营业收入13.39亿元，同比增长36.82%，实现归属于上市公司股东的净利润3.97亿元，同比增长233.17%，扣非后净利润0.62亿元，较上年同期增加约0.21亿元，同比增长53.35%。加权平均净资产收益率为8.56%，同比增长5.44个百分点。基本每股收益为0.74元，同比增长236.36%。分析判断:Q2业绩创历史新高，刻蚀设备营收大幅增长2021年上半年公司收入同比增长36.82%，主要受益于半导体设备市场发展及公司产品竞争优势。公司 2021 年上半年刻蚀设备收入为 8.58 亿元，同比增长83.79%，毛利率达到44.29%。上半年 MOCVD 设备收入为2.19 亿元，同比下降约10.08%，毛利率达到 30.77%，较去年同期大幅度提升。公司整体毛利率为 42.34%，同比去年提升了约 8.42 个百分点。上半年度归属于上市公司股东的净利润较上年同期增加约2.78 亿元，增长约233.17%。计入当期损益的政府补助较上年同期增加约 1.44 亿元。分季度看，第二季度公司实现营收7.35亿元，同比增长29.95%。归母净利润为2.59亿元，创单季度历史新高，同比增长178.87%。第二季度毛利率为43.50%，同比提升9.54个百分点，净利率为35.20%，同比提升18.79个百分点。2021 年上半年新签订单金额达 18.89 亿元，同比增长超过 70%，且部分 Mini-LED MOCVD 设备规模订单已进入最后签署阶段。持续加大研发投入，高端产品不断获得认可公司主要为集成电路、LED外延片、功率器件、MEMS等半导体产品的制造企业提供刻蚀设备、MOCVD设备及其他设备。随着下游市场的拓展和政府的大力推动，我国集成电路和泛半导体产业持续成长，中国大陆半导体设备市场规模在全球的占比逐年提升。根据 SEMI 报告，2020 年中国大陆半导体设备市场规模为 187.2 亿美元，同比增长 39%，首次超过中国台湾地区和韩国，成为全球最大的半导体设备区域性市场。公司的等离子体刻蚀设备已应用在国际一线客户从65纳米到14纳米、7纳米和5纳米及其他先进的集成电路加工制造生产线及先进封装生产线。公司MOCVD设备在行业领先客户的生产线上大规模投入量产，已成为世界排名前列的氮化镓基LED设备制造商。上半年公司研发投入达到2.86 亿元，占营业收入的比重为 21.40%，截至2021年6月30日，公司已申请1,870项专利，其中发明专利1,613项；已获授权专利1,106项，其中发明专利945项。",,华西证券,买入,[None],2021-08-24,,增持,4597021,pdf_downloads/2021/2021-08-24/688012-中微公司（688012）：Q2业绩增长强劲，刻蚀设备收入大幅提升.pdf,688012,中微公司,中微公司（688012）：Q2业绩增长强劲，刻蚀设备收入大幅提升
"赵晋,郑弼禹","业绩公布	公司于8月24日发布2021半年报，营收13.39亿，同比增长36.8%符合预期，归母净利润3.97亿，同比增长233%超过预期，扣非净利润6162万。	简评	毛利率持续回升：在一季度环比营收衰退24个点后，公司公布二季度营收达7.35亿，环比增长22%，同比增长30%。归因于MOCVD设备毛利率从2020年的5%,明显改善到今年上半年的31%，公司二季度毛利率持续回升到43.5%（vs.上季度的40.9%，去年同期的34%）。	研发费用降低，公允价值变动收益大增：低于预期的11%研发费用率及高于预期的26.5%公允价值变动收益率（持有中芯国际股价变动所致），让二季度营业利润率从一季度的27%，去年同期的17%，大幅增长到42%。	刻蚀设备快速增长，MOCVD受益miniLED拉动。刻蚀设备方面，根据公司官微，截至2021年6月公司ICP设备已正式交付第100台反应腔，2020年底累计55台腔，2021年上半年快速上量。另外公司正在进行5nm以下逻辑、1XnmDRAM和128层以上3DNAND产品的ICP刻蚀机研发。公司的强项CCP设备也获得5nm产线重复订购单，在国内3DNAND中广泛应用。MOCVD设备方面，公司功率器件设备已在客户芯片产线投入使用，MiniLED设备已收到来自国内领先客户的批量订单，MicroLED设备也在开发中。	盈利调整	归因于毛利率持续回升，研发费用降低，公允价值变动收益大增，我们上调公司2021/2022/2023公司归母每股收益达34%/3%/4%到1.25/1.42/2.07,明显高于Wind分析师预期的0.81/1.07/1.42。	投资建议	刻蚀领域受益晶圆厂扩产及国产化趋势高增长；MOCVD领域受益MiniLED/功率器件放量带来市场增长；布局泛半导体设备领域同样打开长期成长空间。参考公司历史估值，按照2022年150倍PE，给予目标价213元，维持“买入”评级。	风险提示	重点客户长江存储被放到美国实体清单及紫光重整造成长存明年资本开支趋缓的风险，技术落后风险，MOCVD设备需求及价格下跌风险，核心管理团队及关键技术人员流失风险。",,国金证券,买入,[None],2021-08-24,,买入,4597153,pdf_downloads/2021/2021-08-24/688012-中微公司（688012）：核心，非核心获利率改善优于预期.pdf,688012,中微公司,中微公司（688012）：核心，非核心获利率改善优于预期
方竞,"中微公司：半导体设备国产替代先锋。公司成立于 2004 年，创始团队均为出
身应用材料、泛林半导体等国际半导体设备龙头企业的核心技术人员，董事
长尹志尧博士曾任应用材料副总裁、刻蚀事业部总经理、亚洲首席技术官，
是国际等离子体刻蚀技术发展的重要推动者。公司于 2007 年成功研制首台
CCP 刻蚀机，2012 年成功研制首台 MOCVD 设备，2016 年成功研制 ICP 设
备，产品线不断拓宽，如今已成为国际领先的 CPP 和 MOCVD 供应商。
近年来公司业绩稳健增长，半导体业务占比亦持续提高。2017-2020 年，公
司营收从 9.72 亿元增长至 22.73 亿元，三年 CAGR 达 32.73%。其中，刻蚀
设备收入从 2.89 亿元增长至 12.89 亿元，三年 CAGR 达 64.61%，2020 年
收入占公司设备业务比例达 71.65%。
公司 2020 年定增落地，国家大基金二期参与认购。公司定增募集 82 亿元，
加码研发 128 层以上 CCP 刻蚀、大马士革刻蚀、7nm 以下 ICP、3nm 以下
ALE 等项目，大基金参与认购 25 亿元。刻蚀：前道工艺核心，国产替代率先突破。刻蚀是前道工艺的核心环节，
主流的干法刻蚀工艺包括电容性等离子刻蚀（CCP）和电感性等离子刻蚀
（ICP）两种技术路线，是前道工艺中价值量最高的环节。据 SEMI 数据，
2025 年刻蚀设备全球市场规模将达到 150 亿美元。当前市场呈现了巨头
垄断的竞争格局，泛林半导体、东京电子、应用材料合计占据了 91%的市
场份额。2020 年以来全球半导体景气度上行，国内晶圆厂在国产替代和
缺货涨价双重动力下加速建设，为国产设备厂商带来突破机遇，而刻蚀设
备国产化率仍不足 20%，替代空间可观。
中微作为国内刻蚀设备龙头，截止 2020 年，CCP 设备装机量达 1159 台，
保持了 30%的年均增速，而 ICP 设备亦已有 55 个反应腔运行于 10 位客
户的产线。技术自主可控和先进制程能力是公司得以实现国产替代的核心
优势，CCP 设备已切入台积电 5nm 产线，技术达到世界领先水平。逻辑
芯片的大马士革刻蚀、128 层以上 3D NAND 刻蚀、用于 GAA 结构的 ALE
刻蚀等产品也已处于研发中。MOCVD：GaN 外延设备龙头头，化合物半导体空间打开：MOCVD 指金属
有机化学气相沉积，常用于包括 GaN、SiC、GaAs、InP 在内的化合物半
导体外延片制造，面向 LED、射频、功率、VCSELS 等下游应用。得益于
miniLED 渗透带来芯片用量增长，上游 MOCVD 设备迎来需求爆发。中
微蓝光 LED 设备快速成熟，与三安、晶电、兆驰等 LED 巨头保持良好合
作，截止 2018 年 Q4 已在全球 GaN 基 MOCVD 市场占据 70%以上市场
份额。用于 mini/microLED、功率半导体的设备亦在研发中。",,信达证券,买入,[None],2021-07-23,,买入,4570377,pdf_downloads/2021/2021-07-23/688012-中微公司（688012）：国之重器，风禾尽起.pdf,688012,中微公司,中微公司（688012）：国之重器，风禾尽起
"孙远峰,熊军,王秀钢",事件概述公司发布2020年度向特定对象发行A股股票上市公告书，本次发行A股股票总数量为8022.9万股，发行价格为102.29元/股，发行对象共20名，限售期6个月。截至2021年6月22日，已收到认购对象缴付的认购资金净额81.18亿元。已于中国证券登记结算有限责任公司上海分公司办理完成登记托管及限售手续。分析判断:国家大基金二期参与认购，发行后持股3.97%本次定增项目的发行对象中，国家集成电路产业基金二期获配2444.03万股，占本次发行数量的30.46%，获配金额约25亿元，本次发行后持股比例为3.97%。此外，获配的机构还有：工银瑞信基金908.2万股（占11.3%）、新加坡政府投资公司761.6万股（占9.5%）、国泰君安证券538.7万股（占6.7%）、中金公司 396.9万股（占4.9%），高毅资产379.96万股(占4.7%)。定增三大项目，产能规模进一步扩张本次募集资金主要投向公司产业化基地建设项目、中微临港总部和研发中心项目及科技储备资金。中微产业化基地（临港）主要承担现有产品的改进升级、新产品开发生产及产能扩充，包括等离子体刻蚀设备（630腔/年）、MOCVD设备（120腔/年）、热化学CVD设备（220腔/年）、环境保护设备（180腔/年）。南昌产业化基地主要承担较为成熟的大规模量产及部分产品的研发升级。中微临港总部研发中心项目将搭建从研发到投产的全周期研发平台，开展高端半导体、泛半导体领域相关产品与设备制造的研发工作。其中 CCP刻蚀设备方面，主要布局UD-RIE刻蚀设备（主要用于128层及以上的3D NAND极高深宽比CCP刻蚀）以及SD-RIE刻蚀设备（主要用于14nm及以下逻辑器件的大马士革刻蚀）。ICP刻蚀方面，主要布局下一代单台反应器ICP刻蚀设备Nanova+、下一代双台反应器ICP刻蚀设备Twin-Star+以及ALE原子层刻蚀设备的研发。MOCVD设备方面，主要布局碳化硅材料功率器件的外延生长设备和技术的研发 。科技储备资金将用于新产品协作开发项目（包括红黄光MOCVD、大面积平板显示、PECVD等化学薄膜、光学检测设备等）及对外投资并购项目。定增项目的落地将进一步扩充现有集成电路设备及泛半导体设备产品线产能、提高公司产品的科技创新水平，满足公司研发项目发展与业务扩张需求，持续强化公司的科创实力，为公司持续健康发展奠定坚实基础。,,华西证券,买入,[None],2021-07-05,,增持,4549692,pdf_downloads/2021/2021-07-05/688012-中微公司（688012）：定增落地，助力研发投入与产能扩充.pdf,688012,中微公司,中微公司（688012）：定增落地，助力研发投入与产能扩充
