author,content,filename,org_name,original_rating,pdf_link,publish_time,rating_adjust_mark_type,rating_changes,report_id,save_path,stock_code,stock_name,title
"梁凤洁,邱冠华,陈建宇",成都银行24H1利润同比+11%，不良指标保持行业较优水平。数据概览成都银行24H1归母净利润同比增长10.6%，增速较24Q1放缓2.2pc；营收同比增长4.3%，增速较24Q1放缓2.0pc。24Q2末不良率环比Q1持平于0.66%，拨备覆盖率环比下降8pc至496%。盈利略有放缓成都银行24H1归母净利润同比增长10.6%，增速较24Q1放缓2.2pc；营收同比增长4.3%，增速较24Q1放缓2.0pc，基本符合市场预期。驱动因素来看，息差下行是主要拖累项，其他非息高增支撑盈利。①息差：24Q2息差（期初期末口径，下同）环比24Q1下降13bp至1.57%；②其他非息：24H1其他非息同比增长10.5%，增速环比提升14pc，判断是把握住了二季度债市行情。展望全年，息差降幅有望趋缓，带动营收增速企稳、利润增速维持两位数快增。息差环比下行24Q2息差环比下降13bp至1.57%，主要是资产端收益率快速下行影响。（1）资产端收益率环比下降19bp至3.74%，判断主要是LPR降息，叠加城投业务定价行业性走低影响。（2）负债端成本率环比改善7bp至2.25%，得益于前期存款降息红利释放，叠加负债结构改善。①利率来看，24H1存款成本率较23H2改善4bp至2.19%。②结构来看，24H1末存款环比24Q1末增长2.6%，增速较总负债快1pc。展望未来，存款成本有望继续改善，带动成都银行息差下行压力趋缓。资产质量波动24H1末不良率、关注率环比分别持平、+4bp至0.66%、0.45%，资产质量整体保持优异。关注指标的小幅波动，判断是成都以外地区的按揭、建筑业资产质量压力上行影响。①对公方面，24H1末成都银行建筑业贷款不良率3.98%，较年初上行129bp；②零售方面，按揭不良率0.63%，较年初上行18bp；③区域方面，24H1末非成都地区不良率0.75%，较年初上行16bp。盈利预测与估值预计成都银行2024-2026年归母净利润同比增长10.27%/5.35%/5.63%，对应BPS19.55/22.04/24.67元。现价对应PB 0.77/0.68/0.61倍。维持目标价17.60元/股，对应2024年PB估值0.90x，现价空间18%，维持“买入”评级。风险提示：宏观经济失速，不良大幅暴露。,,浙商证券,买入,[None],2024-08-28,,买入,5738124,pdf_downloads/2024/2024-08-28/601838-成都银行（601838）：2024年中报点评：利润较快增长.pdf,601838,成都银行,成都银行（601838）：2024年中报点评：利润较快增长
沈娟,夯实基本盘，深耕高质量基本面稳健+高股息优势凸显，看好成都银行投资机会。成都银行规模增速居前+负债成本有望优化+可转债转股有望补充资本，测算24E股息率位列上市银行第2，高股息特征突出。随成渝经济圈战略地位提升，区域经济空间广阔，成都银行经营行稳致远，基本面扎实。我们预计公司24-26年EPS为3.41/3.81/4.25元，24年BVPS19.50元，对应PB0.78倍。可比公司24年Wind一致预期PB均值为0.60倍，我们认为公司经营质效扎实，基本面稳居同业第一梯队，估值有望对标第一梯队，给予24年目标PB1.05倍，目标价20.48元，维持“买入”评级。区域定位升级，扩表动能强劲成都区域经济空间广阔，支撑本地银行规模增长，成都银行贷款同比增速自2019年以来保持可比同业前4。成渝经济圈战略地位提升，重大建设项目数量和投资额持续大幅提升，项目总投资额从21年的1.57万亿元提升到23年的3.25万亿元，有望持续带动信贷需求。成都银行政务金融特色鲜明、优势突出，已形成专业化、体系化竞争壁垒。当前收盘价距离可转债强赎价格线所需涨幅仅余 14%（6/13），若剩余52 亿元可转债全部转股，据24Q1数据静态测算可提高核充率0.64pct，有力补充资本弹药。负债优势稳固，化债扰动可控夯实基本面，构筑低成本负债为核心的资产负债良性循环。成都银行长期坚守“稳定存款立行”，保持低成本对公存款优势的基础上，凭借广泛网点布局开拓零售存款。23年末对公存款中活期存款占比高达54%，存款平均成本率仅2.23%，负债端成本优势显著。随存款挂牌利率下调红利逐步释放，负债端成本仍有下行空间，缓释资产端定价下行压力。此前市场担忧城投化债导致资产端定价承压，但实际化债秉承市场化原则采取“一户一议”协商模式，对资产端定价的扰动小于预期。双低行稳致远，股息优势凸显资产质量优中向好，兼具稳健基本面及高股息特征。经过多年砥砺耕耘，形成了低成本负债—资产端低风险投放偏好—优异资产质量的畅通链路，资产质量长期位居上市银行第一梯队。2018年以后不良生成率持续下降，23年不良生成率接近于0，不良+关注拨备覆盖率达315%，位列同业第2。地产政策持续发力+城投化债趋势明朗，强化资产质量改善预期。23年现金分红比例30%，假设24年分红比例与23年持平，测算24E股息率位列上市银行第2，高股息优势凸显。风险提示：经济修复力度不及预期，资产质量恶化超预期。,,华泰证券,买入,[None],2024-06-14,,买入,5659883,pdf_downloads/2024/2024-06-14/601838-成都银行（601838）：夯实基本盘，深耕高质量.pdf,601838,成都银行,成都银行（601838）：夯实基本盘，深耕高质量
"Jiali Lin,Nicole Zhou",投资要点：成都银行发布2023年度报告及2024年一季报，公司24Q1仍保持双位数增长，资产质量各项指标表现优异，不良率持续下降至0.66%，资产负债平稳增长，维持公司“优于大市”评级。24Q1仍保持双位数增长。成都银行23Q4营收同比+0.1%，归母净利润同比+6.8%；24Q1营收同比+6.3%，归母净利润同比+12.8%。2023年分红比率为30.05%，与2022年相比略有提升，一直保持在30%以上。24Q1的CET1比率环比上升23bp至8.45%，我们预计可能得益于新版的《商业银行资本管理办法》实施。资产质量各项指标表现优异。2023年和24Q1不良率环比分别下降3bp、2bp至0.68%、0.66%。2023年关注率环比下降2bp至0.41%。尽管拨备覆盖率在2023年（504.3%）和24Q1（503.8%）相较23Q3（516.5%）有所下降，仍然保持在500%以上，位居上市银行前列。截至23Q3，41家上市银行中拨备覆盖率超过500%的仅有5家。资产负债平稳增长。成都银行24Q1资产总额较上年末+8.0%，贷款+10.4%，存款+6.9%。23Q4资产总额同比+18.9%，贷款同比+28.3%，存款同比+19.2%。23Q4存贷比为83.2%，较22Q4提高5.63pct，资产结构持续优化。数字化转型加快。公司坚持“科技+业务”双向融合、有机赋能的数字化转型定位。2023年末手机银行月活客户规模达117.35万户，同比增长约30%，全行数字渠道业务交易量占比约99%。投资建议。我们预测2024-2026年EPS为3.39、3.8、4.25元，归母净利润增速为10.73%、12.00%、11.99%。我们根据DDM模型（见表2）得到合理价值为20.41元；根据PB-ROE模型给予公司2024E PB估值为1.00倍（可比公司为0.62倍），对应合理价值为19.48元。因此给予对应目标价20.41元（对应2024年PE为6.02倍，同业公司对应PE为4.9倍），维持“优于大市”评级。风险提示：企业偿债能力下降，资产质量大幅恶化；金融监管政策出现重大变化。,,海通国际证券,优于大市,[None],2024-05-26,,买入,5641383,pdf_downloads/2024/2024-05-26/601838-成都银行（601838）：2023年、24Q1业绩点评：营收利润增速保持强劲，不良率持续下降.pdf,601838,成都银行,成都银行（601838）：2023年、24Q1业绩点评：营收利润增速保持强劲，不良率持续下降
"戴志锋,邓美君,乔丹",一季报综述：净利润增12.8%，保持稳健增长。2024年1季度在良好的负债端成本管控下成都银行息差有所回升，带动净利息收入实现了8.1%的较高同比增速，不过受其他非息拖累，营收整体累计同比增速较去年四季度下降0.9个百分点至6.3%；公司资产质量进一步提高，在稳健性的考量下拨备计提力度有所加大，净利润实现12.8%的同比增长，增长整体保持稳健。净利息收入：Q1环比+8%，息差环比提升3bp。单季年化息差1.71%，环比微升3bp，主要是负债端贡献。资产端收益率环比下行3bp至3.93%，1季度受重定价因素影响贷款收益率有所下行；投放结构上以对公为主，相对高收益的个人类贷款占比也有所下降。负债端付息率环比下行4bp至2.33%，对息差有一定的支撑，预计是存款利率的调降逐步开始起到作用。资产负债增速及结构：存贷高增，基建类贷款是主要支撑。1）信贷：总量上，成都银行2023全年新增信贷投放1378.6亿，2022年全年新增980.5亿，同比增长40.6%；2024年一季度单季投放规模为651.3亿，去年同期为564.9亿，较去年同期多投15.3%，单季投放规模为历史新高。从投放结构来看，一季度投放以对公端为主，对公/个人贷款分别投放641.3/10亿元，占生息资产比重别变化+2.0%/-0.7%至47.6%和10.5%。结构上，对公信贷新增占比较2022年下降5.7个百分点至89.2%，主要是基建类贷款投放贡献。2023年基建类贷款保持了较高的增长，新增基建类贷款占总新增贷款的比重为55.1%，是对公新增的主要力量。零售方面按揭投放有所回升，带动零售信贷新增占比有所提高。从全年来看，个人按揭贷款新增占比较年初上升2.3pct至3.7%。2）存款：成都银行2023全年新增存款1232.9亿，较2022年增长14.9%，2024年一季度新增533亿，去年同期为588.6亿，较去年同期少增9.5%，占计息负债比重下降1.1个百分点至75.8%。资产质量：不良率持续降低，资产质量进一步提高。1、不良维度——不良率持续降低。1Q24成都银行不良率0.66%，环比下降2bp，累计年化不良净生成率下降43bp至-0.25%，资产质量保持非常优秀的水平。未来不良压力方面，关注类贷款占比0.41%，环比持平，保持在较低水平。2、逾期维度——逾期率继续下降。2023年末逾期率较年初下行1bp至0.80%，继续保持下行态势。3、拨备维度——拨备保持在较高水平。拨备覆盖率环比下降0.54个百分点至503.75%，保持较高水平；拨贷比环比下行9bp至3.33%。投资建议：公司2024E、2025E PB 0.76X/0.67X；PE 4.32X/3.93X，公司经营维持稳健，资产质量优异且持续优化。公司主营区域优势显著，扎根成都，深耕川渝，多重战略加持带来可持续增量市场。公司业务基础扎实，零售公司双轮驱动，基建优势明显，财富管理发力，业务结构持续优化。维持“增持”评级，建议积极关注。注：根据公司年报及相关宏观数据，我们微调贷款收益率、手续费净收入、信用成本等假设，盈利预测微调至2024E/2025E营业收入229.6/243.1亿（原值248.8/289.7亿），净利润130.8/143.8亿（原值142.7/168.0亿）。风险提示：经济下滑超预期、公司经营不及预期、研报信息更新不及时。,,中泰证券,增持,[None],2024-04-26,,增持,5603191,pdf_downloads/2024/2024-04-26/601838-成都银行（601838）：2023年报、2024一季报：净利润保持稳健增长，资产质量进一步提高.pdf,601838,成都银行,成都银行（601838）：2023年报、2024一季报：净利润保持稳健增长，资产质量进一步提高
张一纬,经营业绩维持稳健，拨备持续反哺利润：2023年和2024Q1，公司营业收入同比增长7.22%和6.27%，归母净利润同比增长16.22%和12.84%；业绩增速有所放缓但总体保持较快增长，减值计提下降反哺利润。2023年和2024Q1，公司的信用减值损失同比下降41.54%和12.64%，优异的资产质量预计为拨备释放核心支撑。对公贷款持续高增，存款定期化程度上升：2023年和2024Q1，公司利息净收入同比增长6.87%和8.05%，保持正增长，增速弱于2022年和2023年同期。规模高增是正向驱动，定价下行和负债成本刚性持续带来息差层面压力；2023年NIM为1.81%，同比下降23BP，生息资产收益率和计息负债成本率为4.02%和2.29%，同比变化-22BP和5BP，2024Q1预计持续受重定价和5年期LPR下调影响。资产端信贷投放亮眼，对公业务增长动能强劲。截至2023年末，公司贷款较2022年增长了28.27%，2024Q1增速为10.42%。其中，对公贷款增长32.02%和12.8%；预计持续受益政信业务优势驱动；零售贷款增长15.27%和0.81%，或与房地产市场需求疲软有关。负债端存款定期化程度仍有上升。截至2023年末，公司的存款总额较2022年增长19.22%，2024Q1增速为6.94%。其中，个人定期存款增长35.23%和12.73%，占总存款比重38.92%和41.02%。中间业务收入回暖，投资收益增速下滑：2023年和2024Q1，公司非息收入同比变化8.76%和-1.18%。其中，中间业务收入同比变化-2.22%和15.71%，一季度有所回暖。公司的中间业务收入以理财及资产管理业务实现理财中间业务收入4.05亿元。以投资收益为核心的其他非息收入增投资收益同比增长23.45%和3.93%。资产质量稳中向好，拨备水平领先：截至2024年3月末，公司不良率0.66%，较2023年下降0.02个百分点；关注类贷款占比0.41%，与2023年持平；拨备覆盖率503.81%，维持同业领先水平。投资建议：公司区域优势明显，有望受益成渝双城经济圈国家战略部署，业务发展空间广阔，有助推动业绩持续增长。资产端，对公信贷扩张动能强劲，政信业务护城河明显，资产质量优异。负债端，存款增速快、占比高，成本优势突出。中间业务有望受益财富管理需求扩容，拓展多元化收入渠道。我们看好公司未来发展前景，结合公司基本面和股价弹性，维持“推荐”评级，2024-2026年BVPS 19.48/22.15/25.28元，对应当前股价PB 0.76X/0.67X/0.59X。风险提示：宏观经济增长不及预期导致资产质量恶化的风险。,,银河证券,推荐,[None],2024-04-26,,买入,5602356,pdf_downloads/2024/2024-04-26/601838-成都银行（601838）：对公贷款延续高增，中间业务收入回暖.pdf,601838,成都银行,成都银行（601838）：对公贷款延续高增，中间业务收入回暖
屈俊,核心观点24Q1营收增速韧性较好，净利息收入回升。成都银行23A/24Q1营收、PPOP、归母净利润累计同比增速较23Q3/23A分别-2.3pct/-0.9pct、-1.6pct/-0.1pct、-4.6pct/-3.4pct，营收同比增速绝对水平超6%，利润同比增速有所回落。拆分来看，24Q1净利息收入同比增速较23年末提升1.2pct至8.0%，或来自资产投放强劲、息差较为坚挺的共同支撑；手续费净收入同比增速较23年末大幅回升18.1pct，主要是23年同期的低基数效应所致；汇兑净收益损失较大影响下，净其他非息收入同比增速较23年末下滑15.1pct至-3.9%。扩表动能强劲，把握区域战略机遇。截至24Q1，贷款同比增速较23年末小幅下降1.4pct，保持27.0%的高增速，其中对公贷款同比增速超30%，投向上看，重点支持成渝双城经济圈等重大战略相关项目和产业，政信类贷款增量占比近八成。23年末净息差较23H1下滑11bp至1.81%，贷款收益率下降12bp，个贷收益率降幅相对较大；受存款定期化趋势影响，存款成本率抬升1bp。24Q1息差或较为坚挺。资产质量保持优异，资本充足率边际改善。24Q1不良率较23年末下降2bp至0.66%，创上市以来新低，关注率持平23年末。分领域来看，23年末对公、个贷不良率较23H1分别下降4bp、3bp，资产质量保持稳中向好态势。24Q1测算信用成本率较23年末上行17bp至0.55%，拨备覆盖率小幅下滑0.5pct，保持超过500%的优异水平，反哺利润空间充足。24Q1核心一级资本充足率为8.45%，较23年末改善0.23pct，截至4月24日，成银转债存续约52亿元，若全部转股，基于24Q1数据静态测算，核心一级资本充足率还可提升0.64pct，继续支撑扩表。考虑到今年特殊的信贷需求、定价环境，我们下调息差、中收增速等核心假设，预测公司24/25/26年归母净利润同比增速为13.1%/13.1%/13.8%，EPS为3.46/3.91/4.45元，BVPS 为19.55/22.45/25.76元（24/25年原预测值19.89/23.39元），当前股价对应24/25/26年PB为0.73X/0.63X/0.55X。公司立足成渝经济圈，有望维持信贷投放高增，采用历史估值法， 参考近五年估值均值给予24年1.0倍PB，对应合理价值19.55元/股，维持“买入”评级。风险提示经济复苏不及预期；信贷需求不及预期；资产质量恶化。,,东方证券,买入,[None],2024-04-25,,买入,5601663,pdf_downloads/2024/2024-04-25/601838-成都银行（601838）：23A年报、24Q1季报点评：扩表强劲，资产质量向好.pdf,601838,成都银行,成都银行（601838）：23A年报、24Q1季报点评：扩表强劲，资产质量向好
"余金鑫,王琮雯",事件：4月24日，成都银行发布2023年及24Q1财报。2023、24Q1营收分别为217亿元、56亿元，YoY+7.2%、+6.3%；归母净利润分别为117亿元、29亿元，YoY+16.2%、+12.8%；24Q1末不良率0.66%、拨备覆盖率504%。24Q1净利息收入增速较23年提升。23年，成都银行净利息收入、中收、其他非息收入分别增长6.9%、-2.3%、11.2%。进入24Q1，净利息收入增速向上、中收增速回正，其他非息收入增长略承压，三者分别同比增长8.0%、15.8%、-3.9%。其中，24Q1净利息收入增速较23年有所提升，考虑可能有负债端成本节约的效果，因为24Q1的贷款增速实际略低于23年。23年、24Q1归母净利润保持双位数增速，24Q1利润增速的下降，主要是公司在减值计提的力度上有所调整，但资产质量更为扎实。贷款保持亮眼增速。24Q1成都银行总资产、贷款总额、存款总额同比分别增长19.6%、27.0%、16.8%，增速较23年分别+0.7pct、-1.4pct、-2.4pct。24Q1贷款总额较23年末增长651亿元，其中98%的增量来自对公贷款，主要是公司紧抓区域发展机遇，积极服务地方实体经济。净息差持续收窄，资负两端均有一定拖累。23年净息差1.81%，较23H1下降11BP。资产端，对公、个贷收益率均延续向下趋势。负债端成本相对刚性，一是占比较高的对公活期存款成本有所上升，二是存款定期化趋势仍旧存在，使得存款挂牌价下调的成本节约效果相对不明显。不良率降至0.66%，拨备维持高位。23年末、24Q1末不良率分别为0.68%、0.66%，不良贷款率继续保持下降趋势，同时关注率等前瞻性指标表现也较平稳。24Q1末拨备覆盖率504%，与23年末基本持平，公司风险抵补能力充足，也为利润的持续释放留有充裕空间。分红比例较高。近年公司分红比例持续提升，22年已达30%，23年分红比例继续保持30%的较高水平。以2024年4月25日收盘价计算的股息率达6.1%。22年底公司已将“每年现金分红比例不低于30%”写入公司章程，高分红持续性有保证。投资建议：贷款高增持续，资产质量优异区域内国家重大战略稳步推进，带来旺盛信贷需求，支撑成都银行业绩维持高景气度，近年贷款规模增速保持在25%以上；在资产质量持续向好，减值计提力度有所调整的背景下，后续盈利有望录得亮眼表现；分红比例保持较高水平，股息回报也较为丰厚。预计24-26年EPS分别为3.41、3.82、4.32元，2024年4月25日收盘价对应0.8倍24年PB，维持“推荐”评级。风险提示：宏观经济增速下行；资产质量恶化；行业净息差下行超预期。,,民生证券,推荐,[None],2024-04-25,,增持,5601205,pdf_downloads/2024/2024-04-25/601838-成都银行（601838）：2023年年报、2024年一季报点评：业绩稳增长，不良再向下.pdf,601838,成都银行,成都银行（601838）：2023年年报、2024年一季报点评：业绩稳增长，不良再向下
"陈俊良,王剑,田维韦",盈利能力继续维持同业前列。公司2023年、2024年一季度实现营业收入217亿元、56亿元，同比分别增长7.2%、6.3%；分别实现归母净利润117亿元、29亿元，同比增长16.2%、12.8%。公司2023年加权ROE18.8%，同比下降0.7个百分点，依然维持在同业前列。从业绩增长归因来看，主要特点是净息差拖累营收增长、拨备反哺利润，与行业趋势一致，不过公司维持了明显高于行业平均水平的资产增速。资产维持较快增长。公司2023年、2024年一季度总资产同比增长18.9%、19.6%，2024年一季末总资产接近1.2万亿元，增速基本维持稳定。其中存款同比分别增长19.2%、16.8%，新增以定期存款为主；贷款同比增长28.3%、26.7%，主要是租赁商服等行业的对公贷款快速增长。公司一季末核心一级资本充足率8.45%，2023年分红率维持在30%。净息差同比降低。公司披露的2023年日均净息差1.81%，同比降低23bps，受到生息资产收益率下降和负债成本上升的双重影响。资产端来看，受LPR下行等因素影响，贷款收益率同比降低32bps，生息资产收益率同比下降22bps；负债端来看，受存款定期化影响，存款成本同比上升8bps，计息负债付息率同比上升5bps。资产质量优异，拨备覆盖率仍处于较高水平。我们测算的2023年不良生成率同比上升0.1个百分点至0.15%，仍然处于非常低的水平，资产质量优异。公司不良率、关注率持续降低且保持在较低水平，2023年一季末不良率为0.66%，关注率为0.41%。在资产质量优异的情况下，公司拨备计提压力较轻，2023年信用减值损失同比减少41.5%、2024年一季度同比减少12.6%，成为净利润快速增长的主要推动力。尽管信用减值损失明显少提，但“拨备计提/不良生成”仍达到310%，超额计提明显。公司2024年一季末拨备覆盖率为504%，保持在较高水平。投资建议：我们根据最新数据小幅调整盈利预测将盈利预测前推一年，预计公司2024-2025年归母净利润129/142亿元（上次预测值137/157亿元）、2026年归母净利润159亿元，同比增速10.6%/9.9/11.8%%；摊薄EPS为3.31/3.64/4.08元；当前股价对应的PE为4.3/3.9/3.5x，PB为0.7/0.6/0.6x，公司除资产和利润增速同业领先外，股息率也居同业前列，维持“买入”评级。风险提示：宏观经济形势走弱可能对银行资产质量产生不利影响。,,国信证券,买入,[None],2024-04-25,,买入,5600226,pdf_downloads/2024/2024-04-25/601838-成都银行（601838）：2023年报、2024年一季报点评：规模增长较快，ROE居同业前列.pdf,601838,成都银行,成都银行（601838）：2023年报、2024年一季报点评：规模增长较快，ROE居同业前列
