author,content,filename,org_name,original_rating,pdf_link,publish_time,rating_adjust_mark_type,rating_changes,report_id,save_path,stock_code,stock_name,title
"陶哲航,马祥云",事件：宁波银行发布2020年业绩快报，全年实现营业收入411.11亿元，同比增长17.19%；归属于母公司股东净利润150.50亿元，同比增长9.73%，对应EPS为2.43元/股；期末总资产1.63万亿元，较期初增长23.45%，归属于母公司普通股股东净资产1036.7亿元，较年初增长21.25%，对应BVPS为17.26元/股。投资要点盈利预测与投资评级：宁波银行是规模扩张最迅猛、资产质量最可靠、管理机制最卓越的高成长型银行，2020年逆势环境下依然实现9.73%盈利增速（第四季度高增长25.9%），我们预计全年增速位居上市银行第一。同时，不良率保持0.79%低位，拨备覆盖率维持505.48%高位，反复印证“高成长与高质量”属性。尽管公司今年以来估值突破历史新高，但我们认为高成长是对高估值最好的支撑，预计公司2021、2022年归母净利润增速分别为+23.2%、+20.8%，目前估值14.9 x2021PE、2.03x2021PB，作为核心零售银行继续重点推荐，维持“买入”评级。全年贷款增速30%创近十年新高，信用减值同比回落保证四季度利润强劲反弹。宁波银行2020年全年保持资产规模高速扩盘，总资产增速达到23.5%，其中贷款规模全年超高速增长30%，大幅领先同业，这也是2010年以来贷款增速最高的年份，鲜明体现出公司高成长特色。贷款第四季度环比增长5.0%，尽管业绩快报披露信息有限，但我们预计主要源于下半年零售个人贷款持续回暖，尤其是公司近两年重新高速扩张的按揭贷款。宁波银行的高速扩张模式推动业绩高增长，但同时也快速消耗资本，因此公司近期启动了新一轮配股再融资。反映到盈利层面，公司全年营业收入增速17.2%，在第三季度曾受到投资收益波动的短期影响，单季度收入增速滑落至9.8%，第四季度有所回升。我们预计净息差及非利息收入仍然表现强劲，前者受益于零售贷款的回暖，后者依然受益于代销基金等财富管理业务的发展。利润方面，三季报盈利增速回落至5.2%后，第四季度强劲反弹增长25.9%，全年累计增速达到9.73%，我们预计位居上市银行第一。影响利润增速的关键是减值计提。根据业绩快报推算，全年营业支出246.11亿元，如果假设成本收入比35%（延续三季报趋势，较2019年同比提高），可以估算出全年信用减值计提约98.32亿元，对应第四季度单季计提约28亿元。公司全年四个季度分别计提信用减值27、17、24、28（估算）亿元，信用成本同比明显抬升，但由于一、三季度已经分散计提过，因此四季度单季利润强劲反弹。我们预计部分减值计提针对表外业务，主动提高全面的风险抵补能力。资产质量保持卓越，超低不良率源自管理层优异的“信贷审美”和风控机制。宁波银行2020年末仍保持不良贷款率0.79%低位，环比三季度持平，年末拨备覆盖率保持505.48%高位，不过环比三季度降低10.87pct，预计部分拨备用于核销存量不良贷款。公司不良贷款余额较三季度有所上升至54.32亿元，但我们预计关注类贷款仍可能继续降低，真实资产质量一如既往稳健。公司长期以来在资产高速扩盘情况下，保持全行业最优的资产质量表现，我们认为核心在于精细化的风控体制、分散化的信贷投放策略及独立的审批体系，究其根源是公司显著优于同业的治理机制。当然，公司也充分受益于江浙地区优质的信贷资源和经济发展状况。我们认为公司资产质量方面的上述优势仍将长期保持。中期继续看好“大零售战略”开花结果，财富管理与个人信贷仍是核心增长点。近年来公司“大零售战略”持续取得成效，三季度末零售贷款占比35.4%，自2015年以来重新回升到35%以上。同时从财富管理角度，2020年前三季度手续费及佣金收入同比大幅增长41.8%，主要得益于代销基金等业务，这也是2020年财富管理银行共同的高增长点。我们认为宁波银行中期最值得期待的成长条线，仍然是零售财富管理业务，这也将充分受益于国内居民财富增长以及监管环境更有利于传统银行的趋势,,东吴证券,买入,[None],2021-02-28,,买入,4446711,pdf_downloads/2021/2021-02-28/002142-宁波银行（002142）2020年业绩快报点评：贷款增速十年新高，零售银行成长龙头.pdf,002142,宁波银行,宁波银行（002142）2020年业绩快报点评：贷款增速十年新高，零售银行成长龙头
"陈功,马婷婷",事件：宁波银行发布2020年业绩快报，全年实现营业收入411.1亿，同比增长17.19%，归母净利润150.5亿，同比增长9.73%。2020年末不良率0.79%，相比9月末持平。业绩表现亮眼：Q4单季度利润增速超过25%，全年业绩增速为已披露业绩的上市银行中最高。2020年宁波银行营业收入、归母净利润增速分别为17.19%、9.73%，均为目前已披露相关业绩的上市银行（不含次新股）中的最高水平。其中单季度来看，宁波银行Q4单季度营收、利润增速分别较Q3大幅提升4.1pc、37.3pc至13.87%、25.88%。收入高增长或得益于：1）宁波银行基于自身优秀的议价能力，息差保持优势（Q2、Q3在全行业息差承压的情况下，宁波银行息差逐季提升）；2）2020年宁波银行财富管理、国际业务、银行卡等业务多点开花，前三季度手续费及佣金净收入增速高达42%，Q4或继续维持了高增长。2020年宁波银行全年ROE（加权平均）为14.90%，同比下降2.2pc，部分受到80亿定增落地的一次性摊薄的影响（还原这一因素后为16.18%）。资产负债情况：贷款稳步高增长。2020年末宁波银行总资产规模达到1.63万亿，同比增速达23.5%，相比9月末继续高增5.5%。其中贷款总额6877.2亿，同比增长30%，较9月末继续高增5.0%，存款总额9251.7亿，同比增长19.9%，与9月末基本持平。资产质量稳定较优。2020年末宁波银行不良率为0.79%，与9月末持平，继续保持上市银行中的较低水平，而拨备覆盖率为505.48%，拨贷比为4.01%。宁波银行资产质量一直以来稳定较优，经历了周期的考验（2009年以来不良率从未超过1%），当前拨备覆盖率保持500%以上（预计为上市银行最高），拨贷比4%以上，继续保持着较高的拨备垫。投资建议：宁波银行2020年业绩表现亮眼，预计基本面在城商行中继续保持领先。未来宁波银行将在产品服务的已有优势继续夯实，持续加大拓客、粘客力度，扩大现有优势；且随着人员到位、产品、服务体系的升级，财富管理业务未来发展空间大，我们坚定看好宁波中长期投资价值。预计2020/2021/2022年其归母净利润为150.5亿、172.3亿、205.9亿，BVPS为17.26/19.76/22.34元，对应2020-2022年PB为2.32x、2.03x、1.79x，继续看好，维持 “买入”评级。风险提示：疫情再度恶化，宏观经济恶化，货币政策转向超预期。,,国盛证券,买入,[None],2021-02-26,,买入,4446668,pdf_downloads/2021/2021-02-26/002142-宁波银行（002142）：业绩“高增长”，Q4单季利润增25.9%，资产质量稳定较优.pdf,002142,宁波银行,宁波银行（002142）：业绩“高增长”，Q4单季利润增25.9%，资产质量稳定较优
"林颖颖,熊颖",我们认为宁波银行此次120亿元的配股方案，有助于夯实资本金基础，保障自身的成长性，以及更好应对未来国内系统重要性银行资本金要求提升的可能性。维持买入评级。支撑评级的要点业务快速发展加大资本消耗，资本金要求或将提升从宁波银行的资本金表现来看，3季末核心一级资本充足率为9.37%，虽高于监管的最低要求（7.5%），但可以看到，宁波银行2018年、2019年、2020年3季度的RWA同比增速分别为19.0%、23.2%、28.2%，处于快速成长阶段，对资金本的消耗加大。而在2020年上半年疫情冲击下，监管鼓励金融机构加大实体经济融资支持力度，一定程度上影响行业2020年盈利能力，减弱内源性资本补充实力。此外，近期国内系统重要性银行征求意见稿落地，宁波银行存在被纳入系统重要性银行的可能性，将会对其核心一级资本充足率提升更高的要求。我们认定此次配股方案的出台是宁波银行根据自身业务发展需求，以及未来银行核心一级资本金要求提升的前瞻性判断所作出的决定。短期摊薄ROE，但中长期投资价值不改根据发行预案，此次配股价格约19.97元，较最新股价（37.79元）折价约47%。根据我们静态测算，此次配股将提公司核心一级、一级、资本充足率1.12个百分点至10.49%、11.88%、15.88%。假若配股在2021年完成，根据我们原先对于公司净利润增·速预测（2020/2021年净利润分别同比增5.5%、16.9%），将摊薄2021年EPS0.26元至2.56元/股；摊薄2021年ROE1.6个百分点至13.7%（期初期末口径）；增厚BVPS0.03元至19.64元。按照最新股价计算，配股完成后，2021年PB将从1.93x下降到1.84x。由于配股将增加股本数，短期股价可能存在波动，但公司市场化基因、灵活的机制、稳定的管理层、自身的成长性和优异的基本面深获市场认可，不改中长期投资价值。估值我们维持公司2021/2022年净利润同比增16.9%、18.1%的预测，如果配股在2021年完成，将摊薄2021/2022年市净率至1.84x/1.63x（不考虑配股为1.93x/1.69x），维持买入评级。评级面临的主要风险经济下行导致资产质量恶化超预期、监管管控超预期。,,中银国际,买入,[None],2021-01-25,,买入,4426339,pdf_downloads/2021/2021-01-25/002142-宁波银行（002142）：增厚资本金，助力业务快速发展.pdf,002142,宁波银行,宁波银行（002142）：增厚资本金，助力业务快速发展
"梁凤洁,邱冠华",报告导读配股补充弹药，资本压力缓解。宁波银行是中小银行标杆，继续推荐。投资要点事件概览2021年1月22日，宁波银行发布配股预案，拟按每10股配售不超过1股的比例向全体A股股东配售，对应配售不超过6亿股，拟募集不超过120亿元，测算对应的配股价约20元，对应20Q3 PB约1.2x，21E PB约1.0x。事件点评1、配股补充弹药。按20Q3末数据静态测算，配股将提升资本充足率1.12pc至10.49%，有效补充资本弹药。系统重要性银行监管要求将落地，如宁波银行被纳入系统重要性银行中，资本监管标准将提升。配股如顺利实施也将有效缓解新规造成的资本压力，支撑未来规模增长。同时，相较其他资本补充工具来说，配股也是可行性比较高的方案。2、配股价较合理。测算配股价为20元，对应1月22日收盘价折价47%。最终配股价将遵循公司董事会与保荐机构（主承销商）协商确定的原则，采用市价折扣法确定配股价格。2020年以来实施配股的上市公司，配股价平均折价比例约为47%，宁波银行配股价的折价比例与2020年以来的上市公司平均水平相当，较为合理。过去十年，配股价折价比例40%-50%的上市公司，自发布配股预案到实施落地一年后，股价平均上涨17%。3、城农商行标杆。宁波银行基本面优异，盈利能力和资产质量均行业领先。配股预案后，短期行情不排除情绪面上有扰动，但是宁波银行基本面强、此次配股价低，中长期看好。盈利预测及估值配股补充弹药，短期行情不排除情绪面上有扰动，但是宁波银行基本面强、此次配股价低，中长期看好。预计2020-2022年宁波银行归母净利润同比增速分别为+5.22%/+15.04%/+15.47%，对应EPS 2.42/2.69/2.87元股。现价对应2020-2022年15.60/14.04/13.18倍PE，2.20/1.89/1.66倍PB。目标价45.35元（暂未考虑配股），对应20年2.27倍PB，买入评级。风险提示：宏观经济失速，疫情二次反复，美国制裁风险。,,浙商证券,买入,[None],2021-01-24,,买入,4425933,pdf_downloads/2021/2021-01-24/002142-宁波银行（002142）配股预案点评：配股补充弹药，缓解资本压力.pdf,002142,宁波银行,宁波银行（002142）配股预案点评：配股补充弹药，缓解资本压力
"戴志锋,贾靖,邓美君",投资要点宁波银行配股方案评估：总体规模和配股比例较小。1、公司配股比例不算高，折价比例相对较大，总体融资规模较小，募集资金总额不超过人民币120亿元（配股比例10：1）。2、预计配股数量6亿股，发行价格预计在20元左右，当前市价的5折。宁波银行再融资原因的分析。1、公司在高速增长的通道上，需要核心资本支持，确保其增长的持续性。核心资本未来会是中小银行的核心竞争力。2、存在纳入系统重要性银行的可能性，对核心一级资本充足率要求提高。我们估计可能是0.5-1个点。3、利润补充资本的能力受到监管限制。监管对银行利润释放的有一定影响，从而影响银行资本的内生补充。4、配股是公司目前状况的最优融资方案之一，能最优和较快补充核心一级资本（详细参见我们专题报告《专题！银行核心资本前瞻：补充的规模与方式》）。宁波银行配股对财务指标的影响。1、核心一级资本充足率明显提升。将较3Q20提升1.12个百分点至10.49%，资本大幅夯实。2、对ROE影响：短期ROE将摊薄5.1%，中长期能稳定到15%-16%。3、对其估值的影响：配股后BVPS、EPS较发行前分别变动+0.02、-0.24元/股，当前股价对应2021年PB下降为1.83倍，PE提升为14.77倍。投资建议：继续重点推荐宁波银行，跑着前行的银行。优秀管理层和市场化基因，使得宁波银行一直是跑着拓展业务的银行；资本交予他们，能充分发挥资本的运营效率。配股虽然影响短期财务指标，但能确保公司的持续增长性，我们持续重点推荐。公司2020E、2021E PB 2.18X/1.92X；PE 16.26X/14.03X（城商行 PB 0.94X/0.84X；PE 8.25X/7.41X）。宁波银行深化多元利润中心建设，财富管理是新跑道，未来公司仍能持续保持较快速增长，公司业务结构更为轻资产。风险提示：经济下滑超预期、公司经营不及预期。,,中泰证券,增持,[None],2021-01-24,,增持,4425696,pdf_downloads/2021/2021-01-24/002142-宁波银行（002142）配股点评：核心一级资本充足率升至10.49%，确保其跑步前行.pdf,002142,宁波银行,宁波银行（002142）配股点评：核心一级资本充足率升至10.49%，确保其跑步前行
"陈功,马婷婷","事件：1 月 22 日宁波银行发布配股预案，关键内容包括：1）配售方案：按每10股配售不超过1股的比例向全体A股股东公平配售；2）募集金额、配售股数：不超过120亿元，按2020年9月末61亿股测算，本次配售股数不超过6.1亿股；3）配股价格：根据120亿募资总额估算配股价格约19.97元/股，相比当前股价（37.79元/股）折价47%，配股估值PB约1.19x（对应2020Q3的BVPS）。按当前股价算，配股除权后股价将自然降至36.17元/股。配股补充核心一级资本，利于宁波银行未来持续、更好地 “高增长”、回馈股东。2020年9月末，宁波银行核心一级/一级/资本充足率分别为9.37%、10.75%、14.76%，均高于之前的监管标准（7.5%、8.5%、10.5%）且处于城商行较高水平，但由于：1）“国内系统性重要银行”规定落地，宁波银行2020Q3总资产、表内外资产分别达到了1.54万亿、1.85万亿，或有较大概率入选。各级资本充足率的监管要求或将有所提升（按《商业银行资本管理办法》预计需提升1%，最终实际要求需等待监管要求的正式落地）；2）宁波银行处于持续高成长的阶段，再融资为其打下坚实基础。为“高成长”配套，宁波银行一直保持着较为稳定的再融资节奏，除债权类融资以外，2010年与2014年分别定增44亿与31亿，2017年发行可转债100亿，2020年定增80亿。而自2018年以来为支持实体经济发展，城商行信贷额度较为宽松，过去3年宁波银行的贷款年均复合增速也高达23.7%（基本3年翻倍），对资本金的消耗较大。且宁波银行未来有望持续高增长，除传统贷款类业务以外，大零售战略、财富管理等均有广阔的发展空间，再融资将为其高成长打下坚实的基础。3）再融资到位后，宁波将每一份资本用到了极致，稳定地回报股东。不考虑疫在2020年的冲击，过去3年宁波银行的利润平均增速高达21%，ROE稳定在18.3%左右的水平。而展望未来，宁波银行以财富管理、国际业务等为亮点的中间业务大有发展空间。其2020年Q1-Q3手续费及佣金净收入增速高达42%，占营收比重达26.7%，远高于可比城商行，未来有望持续支撑业绩的高增长。本次配股落地后，测算将静态提升核心一级/一级/资本充足率1.12pc至10.49%、11.87%、15.88%，进一步打开增长空间。配股利好长期投资者。短期来看，配股对业绩指标有一定的摊薄, 粗略按2020Q3数据静态测算，配股后年化EPS摊薄9.1%至2.34元/股，ROE（加权）将摊薄下降1.89pc至14.48%，但BVPS将增厚1.77%至17.02元/股。且对于持股比例已接近10%的投资者而言、或有卖出存量股的仓位调整压力，但我们认为该交易的影响非常有限。而对于长期投资者而言，宁波银行市场化的机制、强大的业务执行力、以及业务快速推进的高成长性是本质，且再融资虽短期小幅摊薄ROE，但也为未来的持续高成长保驾护航，打下坚实的基础。投资建议：宁波银行管理体制市场化程度高，基本面在城商行中较优，一直保持着“高成长、高ROE、最优资产质量”， 2008年以来其不良率从未超过1%，真正实现了“穿越周期”。在现有的成长性基础上，未来财富管理、国际业务、金融市场等中间业务发展空间大，本次配股落地直接补充核心一级资本，进一步打开未来增长空间。预计2020/2021/2022年其BVPS分别17.53/19.91/22.48，对应2020-2022年PB为2.16x、1.90x、1.68x持续推荐，维持“买入”评级。风险提示：海内外疫情发酵超预期，宏观经济下滑，再融资推进不及预期。",,国盛证券,买入,[None],2021-01-24,,买入,4425660,pdf_downloads/2021/2021-01-24/002142-宁波银行（002142）：120亿配股补充核心一级资本，为“高成长”打基础.pdf,002142,宁波银行,宁波银行（002142）：120亿配股补充核心一级资本，为“高成长”打基础
"刘志平,李晴阳","事件概述：1月22日，宁波银行披露配股预案，拟每10股配售不超过1股，配售数量不超过6.01亿股，募资总额不超过120亿元，用于补充公司核心一级资本。分析判断：拟配股比例约10配1，预估价格为市价折半，对应静态PB约1.2倍根据公司配股预案，此次配股面向全体A股股东，以股权登记日收市后总股本为基数，每10股配售不超过1股。相较同业配股、包括江苏银行2020年12月实施的10配3的配股，宁波银行此次整体配售比例不高。若以公司2020年9月30日约60.08亿股总股本为基数测算，本次配股数量不超过6.008亿股。价格方面，配股价格采用市价折扣法，在发行前根据市场情况与保荐机构（主承销商）协商确定，结合公司预计募资不超过120亿元，初步测算配股价约20元/股。相较宁波银行1月22日37.79元/股的收盘价，配股价格接近折半，也低于2020年4月21.07元/股的定增价，但高于2020Q3公司16.72元的每股净资产水平，20元/股的配股价对应2020Q3静态PB仅1.2倍。银行行业配股价格多为市价的60%-80%、高于每股净资产水平（见汇总表），而去年末江苏银行配股是银行首次以低于每股净资产价格配股，相比之下宁波银行此次配股折价较高，略高于其BPS。配股提振核心资本充足率 1.12pct，保障资产稳健扩
增，暂时摊薄 ROE宁波银行此次配股目的在于扩充核心一级资本，以有力支撑其较
高的资产扩表速度。截至 2020 年 9 月 30 日，公司核心一级、一
级资本和总资本充足率分别为 9.37%、10.75%、14.76%，高于监
管要求标准，但接近公司《中长期资本规划（2019-2021）》要求
（目标核心一级、一级资本和资本充足率分别为 9%、10%和
12%）。考虑到公司 2020Q3 加权风险资产同比增幅达 28.16%，尤
其是贷款规模同比增幅高达 30.9%，信贷的高投放、加权风险资
产快速扩增对银行资本形成较大消耗；而疫情以及监管让利要求
影响公司利润释放和未分配利润的留存，对公司核心一级资本充
足率造成压力，因此需要进行补充来保障其高成长、高盈利性。
我们结合公司 2020Q3 数据测算，此次配股若募资 120 亿元，将
提振核心一级资本充足率 1.12 个百分点，虽然股本的增加暂时
摊薄 ROE，但考虑到宁波银行较强的盈利能力和优质资产质量，
资本的补充更有利于其未来战略的执行。",,华西证券,买入,[None],2021-01-24,,增持,4426164,pdf_downloads/2021/2021-01-24/002142-宁波银行（002142）：折价配股融资不超120亿，助跑后续资产扩张.pdf,002142,宁波银行,宁波银行（002142）：折价配股融资不超120亿，助跑后续资产扩张
"林颖颖,熊颖","宁波银行(002142)宁波银行盈利能力保持优异，资产质量优于可比同业，且拨备基础厚实、风险抵御能力强，是城商行的标杆，市场关注度和认可度高。我们认为公司兼备成长性和可持续性，清晰的战略目标、优秀的管理层、稳健的基本面支持估值溢价，维持公司买入评级。支撑评级的要点民营市场化基因，务实深耕本地市场。宁波银行股权结构中民企股东与管理层持股比例明显高于上市银行同业，为公司带来有别于其他银行的市场化基因。公司管理层稳定，作风务实，带领队伍深耕本地市场，区域市占率明显优于同业，为公司业绩的稳健增长奠定了基础。公司坚定聚焦大零售业务和轻资本业务的拓展，业务规模和盈利贡献在不断提升。盈利结构不断优化，盈利能力居同业前列。宁波银行致力于打造多元化的利润中心，公司盈利结构不断优化和多元化，综合化布局带来非息收入的快增。公司设立理财、基金、租赁子公司，丰富收入多元化程度，前 3 季度手续费收入实现 41.8%的同比增长， 收入结构的多元化保障公司盈利的稳定性和可持续发展，公司 2020 前 3 季度 ROE 达16.4%，依然保持行业前列。资产质量保持优异， 拨备水平领先同业。 宁波银行不良认定严格（2020年上半年逾期 90 天以上贷款/不良占比为 86%），前 3 季度不良率为0.79%，环比第 2 季度持平，不良贷款率继续保持行业低位。公司在经营过程中不断强化风控体系，增强风险抵御能力，公司拨备水平远高于行业平均，3 季末拨备覆盖率进一步提升至 516%。估值我们维持公司 2020/2021 年 EPS 为 2.41/2.81 元/股的预测,对应净利润同比增速 5.5%/16.9%，目前公司股价对应 2020/2021 年 PB 为 2.11x/1.86x，维持买入评级。评级面临的主要风险经济下行导致资产质量恶化超预期，疫情反复影响公司业务开展。",,中银国际,买入,[None],2020-12-01,,买入,4390408,pdf_downloads/2020/2020-12-01/002142-宁波银行（002142）：优质城商行，优异基本面支持估值溢价.pdf,002142,宁波银行,宁波银行（002142）：优质城商行，优异基本面支持估值溢价
