author,content,filename,org_name,original_rating,pdf_link,publish_time,rating_adjust_mark_type,rating_changes,report_id,save_path,stock_code,stock_name,title
李兴,事项：公司披露2019年三季报，期内实现营业收入177.50亿元，同比增长41.78%，实现归母净利润64.41亿元，同比增长43.77%，加权平均净资产收益率5.83%，归母净资产1199.46亿元，对应BVPS为13.21元/股。评论：自营投资表现亮眼，股押两融此消彼长三季报公司经纪、投行、资管、信用和自营各项业务收入占比分别为18.12%、6.76%、12.33%、9.32%和33.53%，除自营业务收入占比提升10个百分点以外，其余业务占比均有所下滑。三季报自营投资净收益59.22亿元，同比增长179.47%，其中对联营企业和合营企业的投资收益21.49亿元，同比增长81.35%。公司股票质押业务注意控制风险，规模进一步压缩，截止2019Q3买入返售金融资产176.85亿元，较上一年同期数据下滑63.50%；减值计提充分，三季报信用减值损失5.94亿元，同比增长159.39%。股押规模下降同时公司两融业务市占率不断提升，三季报披露融出资金606.49亿元，同比增长29.41%，占市场两融余额比例为6.39%，较去年同期数据上涨0.69个百分点，市占率整体处于不断提升的趋势。经纪资管稳定增长，投行收入环比改善公司三季报经纪业务收入32.17亿元，同比增长21.86%，维持中报增速。2019年市场交投回暖，前三季度股基累计成交额为106.50万亿，已超过2018全年数据，同比上升34%。2019年前三个季度，市场股基交易额分别为36.06/37.76/32.86万亿，同比增速分别为19.02%、38.65%、49.68，环比增速分别为70.08%、4.74%、-13.45%。公司经纪业务同比增速低于市场交易额增速，主要还是因为佣金率下滑。三季报资管业务收入21.88亿元，同比增长18.78%，与中报增速基本持平，在资管新规导致行业规模持续萎缩的不利情况下继续保持逆势增长。作为科创板首家上市企业保荐券商，华泰证券投行业务深度受益科创板发行，三季报投行收入12亿元，同比下降4.38%，较中报增速（-25%）有所改善，三季度单季度收入6亿元，环比增长68%。国际业务继续加码，GDR占据先发优势华泰证券六月份成功发行总额16.92亿美元的GDR，为2013年以来全球存托凭证市场规模最大的IPO，增厚资本实力同时促进国际业务发展。根据招股说明书本次GDR募集资金的60%将用于支持国际业务发展，拟将华泰国际金融控股有限公司的注册资本由88亿港元增加至不超过108亿港元，用于其境外业务的开展及相关投资。近日华泰证券沪伦通GDR跨转生成，标志着通过跨境转换机制真正实现了两地市场的双向转换，也为华泰证券后续为中资企业GDR发行提供相关服务积累了经验。盈利预测与投资评级预计华泰证券2019-2021年营收分别为200.80、219.99、238.29亿元；归母净利润分别为76.09、83.41、89.47亿元，BVPS分别为13.52、14.43、15.41元。目前市场价格对应2019年市净率1.3x，维持“增持”评级。风险提示境外业务发展不及预期；经纪业务佣金率波动风险；市场大幅波动风险；外围环境变化风险。,,粤开证券,增持,[None],2019-10-31,,增持,3963734,pdf_downloads/2019/2019-10-31/601688-华泰证券（601688）：自营业务大幅增长，GDR占据先发优势.pdf,601688,华泰证券,华泰证券（601688）：自营业务大幅增长，GDR占据先发优势
刘嘉玮,公司披露2019年三季报，报告期内公司实现营业收入177.50亿元，同比增长41.78%；归母净利润64.41亿元，同比增长43.77%。EPS0.75元，同比增长22.95%；ROE（非年化）5.83%，同比提升0.95pct。点评：报告期内公司业绩延续高增长态势，营业收入和归母净利润增速较中报进一步放大。其中第三季度营业收入同比增长54.38%，归母净利润同比增长80.47%。我们看到，三季报利润大增的最大贡献者仍为投资类业务，投资收益和公允价值变动收益之和较2018年同期大增116%，贡献利润增量18亿元。和中报不同的是，除信用业务外，财富管理业务、投行业务、资产管理业务、自营业务全面开花，均实现不同幅度增长。第三季度业绩增速明显加快主要原因有三点：1.权益市场行情影响下，2018年同期基数较低，业绩对比较为强烈；2.在6月GDR发行完毕后，公司资本金得到有效补充，得以在重资本业务上大展身手，更好把握住此轮市场上涨良机，大幅增厚利润；3.科创板带来的业务增量。公司作为国内最早明确提出财富管理转型的券商之一，经过多年持续投入，已在财富管理领域取得巨大进展，进入转型红利收获期。在2016年收购AssetMark后，借鉴其国际领先的业务模式和先进的技术平台，公司覆盖不同风险等级、不同客户需求的财富管理产品线进一步丰富，依托金融科技和全业务链优势，围绕数字化赋能，差异化的资产配置理念成为原有业务的有效补充。公司在投顾团队建设上也下足功夫，采用先进额培训、考核体系，不断提升团队整体素质和专业能力，可以更为有效的为高净值客户提供全球资产配置服务。综合来看，公司现有客户的黏性不断增强，机构客户和高净值客户增量稳定，报告期内股基交易市占率稳定在7%，在激烈的市场竞争下得以继续稳固行业第一的位置。公司在海外的布局也在持续获得回报。收购AssetMark不仅将其作为财务管理业务的补充和提升综合实力的抓手，亦希望通过其打开美国市场，依靠其先进的投资管理能力和完善的技术平台在美国资产管理市场中脱颖而出。此次GDR发行完成后，除资本实力之外，公司的国际影响力也有望显著提升，无论从引入海外长期投资者还是获得欧洲低成本资金角度看对公司中长期发展都大有裨益。投资建议：随着财富管理领域“入局者”的增加，亦考虑到财富管理业务的易复制性和相对较低的门槛，公司财富管理业务整体优势正在缩小；同时投行部门人才流失对项目储备和业务资源造成一定负面影响，此两大因素短期对公司股价形成压制，前期GDR和A股的无风险套利机会也加剧了股价的波动。但从中长期看，公司整体战略仍具前瞻性，业务转型发力较早，拥有优质的客户资源、相对完善的业务体系和较为丰富的经验。未来公司的业务广度和深度都将不断拓展，国际影响力料将不断提升，品牌价值亦将凸显。随着行业马太效应的加剧，公司估值中枢有望缓慢抬升。当前公司估值仅1.35x19PB，预计公司2019-2021年归母净利润分别为75.36亿元、80.64亿元和87.89亿元，对应EPS分别为0.83元、0.89元和0.97元，维持“推荐”评级。风险提示：国内经济下行风险；中美贸易争端加剧的风险；资本市场行情下跌的风险；金融监管严于预期的风险；流动性弱于预期的风险；保费收入不及预期的风险。,,东兴证券,推荐,[None],2019-10-31,,增持,3966655,pdf_downloads/2019/2019-10-31/601688-华泰证券（601688）2019年公司三季报点评：GDR短期股价波动影响消退，关注成长性和配置价值.pdf,601688,华泰证券,华泰证券（601688）2019年公司三季报点评：GDR短期股价波动影响消退，关注成长性和配置价值
方采薇,"市场交投情绪回暖，财富管理转型加速落地。去年同期基数低迷叠加三季度市场交投情绪回暖，三季度公司经纪业务收入保持提升,实现经纪业务收入9.75亿元，同比增长25.00%，公司经纪业务市占率行业领先，“涨乐财富通”APP月活跃数抢眼，引流较为成功，线上线下一体化的客户运营新模式发展强劲。在行业佣金率水平持续下降的背景下，公司在财富管理业务转型发力，致力于打造财富管理和金融科技持续领先的综合金融服务，收效良好。投资收益增长较大。公司前三季度实现投资收益59.22亿元，同比增长179.60%。受益于市场回暖，自营投资业务收入增长明显，对业绩起到了提振作用。在大类资产轮动和估值修复的精准判断下，华泰证券自营投资业务保持稳健增长。国际化布局稳步推进。华泰证券是首家在上交所、港交所和伦交所上市的公司，华泰证券于6月20日发行GDR补充资本金以扩展公司海外布局，提升了公司的资本实力，增强了公司在欧洲市场的影响力。由于沪伦两市存在价差的套利空间，GDR上市120天后可转换成A股卖出获利，对华泰证券短期股价波动造成影响。但随着两市股价价差不断缩小，目前跨市场套利空间不断被压缩。子公司Aseetmark于7月在纽交所完成分拆上市，公司也获得了在美国展开经纪交易商业务的资格，这一系列资本运作使公司在国际化与全球化布局方面获得先机，贡献新的利润增长点。投资建议：公司经纪业务龙头地位稳固，经纪业务科技化融合表现亮眼。通过积极发展互联网大数据、推广APP的受众群体等带来稳定引流，有序推进财富管理转型。同时国际化布局领先，GDR的发行以及Assetmark分拆上市有助于国际业务拓展，公司发展前景和潜力良好。公司作为头部券商，享受国内资本市场深入改革的红利。目前公司PB为1.39倍，预计公司2019、2020年EPS分别为0.83/0.92元，对应PE为21/19倍，维持“推荐”评级。风险提示：宏观经济增速不及预期；股票市场低迷；监管政策重大变化，境外业务发展不及预期。",,爱建证券,推荐,[None],2019-10-30,,增持,3961733,pdf_downloads/2019/2019-10-30/601688-华泰证券（601688）：三季度业绩增长稳定，龙头优势凸显.pdf,601688,华泰证券,华泰证券（601688）：三季度业绩增长稳定，龙头优势凸显
洪锦屏,事项：华泰证券披露2019年第三季度报告，1-9月公司实现营业收入177.50亿元，同比+41.78%；归母净利润63.03亿元，同比+43.77%。加权平均ROE为5.83%，较上年度同期增加0.95个百分点。评论：财富管理转型有优势。2019Q3沪深两市A股日均成交额4567亿元，同比增加57%。公司2019Q3代理买卖证券业务净收入9.75亿元，同比增25%，环比降13%，公司2019Q3经纪业务手续费净收入同比增速低于市场整体交易量，考虑公司的佣金率已经处于行业最低水平，下降空间有限，预计经纪业务市占率可能有所回落。“零佣金”近期从国外蔓延至国内，价格战忧虑再起，中长期来看，通道型经纪业务将向微利或无利趋近，财富管理转型是必然趋势，华泰证券在此方面的优势较为明显。科创板助力投行业务发展。2019Q3公司证券承销业务净收入5.96亿元，同比增33%，环比增68%。今年以来，华泰证券及其子公司华泰联合完成首发5家（去年同期为10家），增发18家（去年同期为23家）。今年上半年IPO项目只有1家，投行项目在第三季度提振明显。金额方面，IPO累计募集43.51亿元，同比降78%；公司债+企业债承销规模512.79亿元，同比增43%，稳健发展。华泰证券子公司华泰联合参与4个科创板IPO项目，出任15家科创板企业的保荐券商，总数在所有券商中居第三位，目前科创板跟投合计浮盈1.32亿元。自营业务大幅增长，股权质押继续收缩。公司2019Q3实现资管业务净收入7.89亿元，同比增19%，环比增15%。自营业务是华泰证券业绩的重要支撑，公司报告期内实现投资净收益（含公允价值变动）33.90亿元，同比大幅增长116%，环比大幅增长153%，其中包含了直投子公司在科创板跟投的投资收益浮盈。公司仍在收缩股权质押业务，对存量业务进行清理以防范风险，三季度继续计提信用减值4.48亿元。投资建议：公司今年6月发行GDR为开展跨国融资并购和拓展国际业务提供便利，提升了资本实力和国际竞争力。但受减持套利预期影响，A股华泰股票近期明显走弱，根据公司公告，截至10月24日GDR因为兑回存续数量为3987万份，不足核准发行数量的50%，两个市场的差价也收敛到1%左右，未来将回归基本面主导。我们上调2019-2021年公司EPS预计为1.02/1.28/1.46元（原预测值为0.98/1.23/1.40元），BPS分别为13.43/13.98/14.78元，对应PB分别为1.33/1.27/1.20，ROE分别为7.61%/9.13%/9.89%。维持给予2019年业绩1.8倍PB估值，目标价25元，维持“推荐”评级。风险提示：中美贸易摩擦反复，经济下行压力加大。,,华创证券,推荐,[None],2019-10-30,,增持,3961676,pdf_downloads/2019/2019-10-30/601688-华泰证券（601688）：加速财富管理转型，科创板助力发展.pdf,601688,华泰证券,华泰证券（601688）：加速财富管理转型，科创板助力发展
王维逸,公司 19 年 1-9 月实现营业收入 177.50 亿元，同比增长 41.78%；实现归母净 利润 64.41 亿元，同比增长 43.77%；19EPS0.92 元，19BVPS13.42 元。业绩增速较 19H1 明显提升，自营收入占比保持 1/3+：1）公司 1-9 月归母净 利润同比增长 43.77%，增速较 19H1（28.43%）明显提升，其中 19Q3 实现归 母净利润 24.31 亿元，同比增长 84.06%。公司前三季度净利润率与年化 ROE 分别为 33.6%与 7.7%，同比 18 年前三季度（35.8%和 6.2%）均有提升。2） 自营、经纪、资管、信用、投行收入占比分别为 34%、18%、12%、9%、7%， 自营占比同比提升 11 个百分点。自营投资保持高增速，资管业务逆势提升： 1）公司 1-9 月实现自营业务收 入 59.53 亿元，同比增长 104%，受益于 8 月以来行情好转，公司自营投资收 益得以保持高增速。截至 2019Q3，公司自营资产规模达 2502.66 亿元，较年 初提升 68%。2）公司实现资管业务收入 21.88 亿元，同比增长 19%。在全行 业资管业务收入受新规影响持续下降的情况下，公司的资管收入实现逆势 增长，财富管理转型初显成效。3）公司实现经纪业务收入 32.17 亿元，同 比增长 22%，增速较上半年（21%）微增，主要得益于前三季度全市场股基 成交额同比增加 34%。投行业务显著改善，管理层连任确保公司经营延续性： 1）公司 1-9 月实现 投行业务收入 12.0 亿元，同比小幅下滑 4%，较上半年（-25%）显著改善。 公司前三季度合计股债承销金额 3358 亿元，市场份额同比小幅提升至 5.3%， 其中 IPO 承销金额 44 亿元，同比下滑 68%，市场份额由 11.8%降至 3.1%。2） 公司 19Q1 实现信用业务收入 16.55 亿元，同比下滑 17%，降幅将上半年扩大 （19H1 降幅 3%）。3）经董事会决议，公司 CEO 周易等高管获连任。当前 管理层在华泰深耕多年，在资本市场剧烈起伏中把握机遇，带领公司地位 不断提升。此次管理层连任打消市场疑虑，确保公司经营战略得以延续， 起到稳定军心的作用，且随着 GDR 兑回已超 50%，估值压制逐渐出清。估值鉴于公司 19Q3 业绩表现靓丽，我们将 19/20/21 年归母净利润预测值由 73/89/103 亿元上调至 83/94/107 亿元，公司作为行业龙头将持续受益于资本 市场改革，维持公司买入评级。风险提示政策出台对行业的影响超预期；市场波动对行业业绩、估值的双重影响。,,中银国际,买入,[None],2019-10-30,,买入,3961108,pdf_downloads/2019/2019-10-30/601688-华泰证券（601688）：GDR兑回已超50%，管理层连任确保经营延续性.pdf,601688,华泰证券,华泰证券（601688）：GDR兑回已超50%，管理层连任确保经营延续性
"朱洁羽,胡翔","事件： 公司发布 2019 年三季报， 前三季度实现营业收入 177.5 亿元，同比增长 41.8%；归母净利润 64.4 亿元，同比增长 43.8%，对应 EPS 为 0.75 元/股；归母净资产 1199 亿元，对应 BVPS 为 13.21 元/股。投资要点自营投资驱动公司 2019 年前三季度业绩同比+43.8%，略超预期。2019Q1~3公司实现归母净利润同比+43.8%至 64.4 亿元，主要系 2019 以来市场回暖，自营投资业务收入实现同比+104.2%至 59.5 亿元， 对业绩提振明显。公司实现投资收益同比+179.5%至 59.2 亿元（其中对联营及合营企业的投资收益同比+81.3%至 21.5 亿元），公允价值变动损益同比+9.9%至 21.8 亿元，公司积极挖掘多样化策略手段， 灵活运用金融工具和衍生品进行风险分散，平滑投资收益。此外，公司高度重视大数据及人工智能等先进技术的研究应用，着力发展数据交易业务，推动交易和盈利的规模化，未来有望通过科技赋能实现业绩稳健增长。财富管理领跑同业， 投行业务显著改善，资管提升主动管理能力逆势增长。1） 受行业佣金率下滑影响， 19Q1~3 实现经纪业务收入同比+21.9%至 32.2亿元（市场交易额同比+34.0%）， 经纪业务市占率始终领跑同业。 2）公司19Q1~3 实现投行业务收入同比-4.4%至 12.0 亿元，较上半年（ -25.2%）显著改善， 系 Q3 新增 IPO 承销规模 40 亿（ H1 为 4 亿元， Q1~3IPO 承销规模同比-68%）、 19Q1~3 债承规模同比+84%。 3） 股票质押规模继续压缩控制风险，截至 2019 年 9 月末买入返售金融资产规模较 2018 年末下滑 59.4%至 177 亿元，信用减值损失同比+159.4%至 5.9 亿元,充分计提减值准备， 保持着较高的履约保障比例（ 19H1 为 267%）。 4）监管趋严背景下，资管业务持续提升主动投资管理能力和产品创设能力， 19Q1~3 实现资管业务收入同比+18.8%至 21.9 亿元，未来公司有望继续强化行业领先地位。资本实力增强， GDR 助力国际化发展延伸影响力。 1） 公司于 2018 年非公开发行股票募集资金净额 141 亿元， 将全部用于补充公司资本金和营运资金，尤其是自营及信用业务。 2） 2016 年公司收购 AssetMark（于 2019 您 7月在美国纽交所成功上市）， 为财富管理转型对接全球资源提供了强大平台，国际化发展布局迈出关键一步。 3） 2019 年 6 月公司 GDR 在伦交所成功上市，募集资金净额 16.5 亿美元， 其中 60%的资金将用于国际业务发展，拟将华泰金控（香港） 的注册资本由 88 亿港元增加至不超过 108 亿港元，进一步加强跨境联动。 GDR 兑回造成公司股价短期扰动， 但从长期角度看，发行 GDR 将助力公司加快国际化布局和增强国际竞争实力。盈利预测与投资评级： 公司 2019 前三季度业绩略超预期，系市场行情回暖致自营投资增长驱动。公司财富管理转型推进迅速，国际业务稳步扩张，看好其长期发展前景。预计 2019、2020 年归母净利润分别为 84.8 亿元、112.1亿元， A 股目前估值约 1.3 倍 2019PB，维持“买入”评级。风险提示： 1）市场成交活跃度下降； 2）股市波动冲击自营投资收益。",,东吴证券,买入,[None],2019-10-30,,买入,3960795,pdf_downloads/2019/2019-10-30/601688-华泰证券（601688）2019年三季报点评：投资驱动，业绩略超预期.pdf,601688,华泰证券,华泰证券（601688）2019年三季报点评：投资驱动，业绩略超预期
洪锦屏,事项：2019年10月17日（伦敦时间），公司在伦敦交易所发行的8251.5万份全球存托凭证（GDR）兑回限制期届满。2019年10月18日（北京时间）起，8251.5万份GDR对应可转换成公司A股股票82515股，占公司目前总股本的9.09%。受减持套利预期影响，A股华泰股票近期明显走弱。评论：跨境转换套利需要注销GDR，实际转换的数量有限。GDR是在某一国家或地区证券市场上发行与交易的代表境外公司有价证券权益的可转让凭证，每份GDR代表一定数量的境外公司发行的基础证券。英国跨境转换机构承担GDR与A股的跨境相互转换，其可根据投资者的指令指示存托人注销GDR的同时委托上交所卖出对应的A股股票（GDR的“兑回”）。华泰证券是首家按照沪伦通业务规则在伦交所上市的A股公司，也是首家同时在上交所、港交所和伦交所上市的公司。两地差价会产生套利行为，GDR的投资者会买入GDR并进行转换套利，但这会导致GDR供给减少，且买盘增加，GDR价格上行，直至两地价格达到汇率均衡。真正去转换的非常少。以美国为例，95%左右的ADR交易是由市场内部交易完成的，其中并不包括存托凭证的发行与注销，说明内部交易市场具备效率。目前两地价差已经大幅收敛，套利担心基本化解。自公司发行GDR至今，GDR与A股的价格差异逐步减小。以10月24日的收盘价计算，公司A股股票收盘价为人民币17.59元/股，对应GDR为24.59美元/份，通过汇率和兑换比例计算，可获套利收益率约为1.24%。而相对于公司发行GDR后的第一个交易日（2019年6月21日），A股与GDR收盘价之间存在的溢价率高达约39%。目前来看，套利的空间几乎完全收敛了。伦交所GDR走势不会成为本土标的股票定价的核心决定因素。2018年底，伦交所有144支GDR，我们看到其中印度的蓝筹股票塔塔钢铁和埃塞克斯银行的GDR溢价率定在0附近。而俄罗斯的外贸银行和苏古特石油天燃气公司的本地股票价格长期折价于GDR。我们认为未来GDR不会成为华泰证券估值的核心决定因素，在溢价率已经接近零之后，基本面逻辑会主导。目前华泰证券PB估值1.4倍，到2020年只有不到1.3倍，相较于中信证券的1.74倍，折价20%，存在修复的空间。投资建议：我们维持预计2019-2021年华泰证券EPS为0.98/1.23/1.40元，BPS分别为13.35/13.90/14.70元，对应PB分别为1.32/1.27/1.20，ROE分别为7.37%/8.85%/9.53%。维持给予2019年业绩1.8倍PB估值，目标价24元，受减持套利预期影响，A 股华泰股票近期明显走弱，维持“推荐”评级。风险提示：中美贸易摩擦反复，经济下行压力加大。,,华创证券,推荐,[None],2019-10-27,,增持,3954652,pdf_downloads/2019/2019-10-27/601688-华泰证券（601688）重大事项点评：套利空间有限，冲击后回归基本面逻辑.pdf,601688,华泰证券,华泰证券（601688）重大事项点评：套利空间有限，冲击后回归基本面逻辑
