author,content,filename,org_name,original_rating,pdf_link,publish_time,rating_adjust_mark_type,rating_changes,report_id,save_path,stock_code,stock_name,title
许勇其,主要观点：事件：公司发布2022年中报。2022年H1分别实现营收/归母净利润为1324.6/126.3亿元，yoy+20.6%/90.0%；2022Q2实现营收/归母净利润为676.9/65.1亿元，yoy+8.6%/57.3%，qoq+4.5%/6.4%。量价齐升助力业绩高增长。量：2022H1公司矿产铜、金、锌的销量分别为35.72万吨、29.13吨、20.08万吨，同比分别增50%、37%、2%；价：核心矿种铜、金、锌2022H1市场均价分别为7.15万元/吨、392.964元/克、2.58万元/吨，铜、金、锌量价齐升助力业绩增长。三大铜金矿产量持续攀升，矿产铜产量41万吨。2022H1实现铜产量41万吨，同比增长71%。2022年随着各重大项目有序推进，2022年铜产量将持续攀升。①卡莫阿铜矿二期提前投产，按100%权益矿产铜14.3万吨，三期计划24Q4投产，配套50万吨冶炼厂持续推进。②巨龙铜矿一期达产、二期加速推进，实现矿产铜4.4万吨。③佩吉矿矿产铜5.3万吨、矿产金2.6吨，跃升为公司盈利能力最强的项目。3Q盐湖、拉果错盐湖、道县硬岩矿构建锂矿资源“两湖一矿”布局。三大项目中：①3Q盐湖资源量763吨LCE，一期2万吨项目预计2023年底建成投产；②西藏拉果错盐湖资源量214万吨LCE，调整后一期2万吨项目正在加速建设；③湖南道县湘源硬岩矿资源量216万吨LCE，率先重启30万吨采选系统，尽快突破1000万吨采选规模，达产后年产云母矿折合6-7万吨LCE。同时，公司的锂电新材料布局也在加速推进，福大紫金氨氢能源工业化提速，磷酸铁锂、电解铜箔、高性能铜合金，以及与亿纬锂能、瑞福锂业拟合资的年产9万吨锂盐项目等有序推进。投资建议：受海外经济复苏以及通胀预期等多因素的影响，铜、金价格继续维持高位。重要铜矿项目提前建成投产，铜产量超出预期，我们预计2022-2024年公司营收分别为2776.5/ 3132.9 / 3237.6亿元，同比增速分别为23.3%/12.8%/3.4%；对应归母净利润分别为273.07/310.8/354.2亿元，同比增速分别为74.2%/13.8%/13.9%，当前股价对应PE分别为9X/8X/7X，维持“买入”评级。风险提示：公司重要在建矿山项目投产不及预期；铜金价格大幅下跌；人民币汇率波动等。,,华安证券,买入,[None],2022-08-16,,买入,4953278,pdf_downloads/2022/2022-08-16/601899-紫金矿业（601899）：业绩持续高增长，“两湖一矿”打造锂矿资源布局.pdf,601899,紫金矿业,紫金矿业（601899）：业绩持续高增长，“两湖一矿”打造锂矿资源布局
王帅,1H22净利同比提升90%，基于铜金产量显著扩张紫金矿业1H22实现归母净利润126.3亿元，同比增长89.95%。2Q22归母净利润65.1亿元，环比增长6.2%，同比增长57.2%。业绩增长主要来自于包括卡莫阿、Timok等在内的主要项目的产量爬坡释放。受益于铜金价格攀升，公司1H22矿山板块毛利率同比提升1.5pct至60%，其中矿山铜毛利率同比微增0.5pct至65.8%，矿产金毛利率同比提升2.9pct至51%。公司于1H22完成“两湖一矿”锂资产的交割并投入建设，建成后将每年带来共约15万吨的碳酸锂产量。维持紫金矿业“买入”评级，基于公司2010年以来平均估值水平（2022-24年EPS对应0.84/0.97/1.04元），给予目标价21元（25.2x22EEPS）/15.3港币（15x22EEPS）（均维持前值）。主力项目增量贡献显著紫金1H22矿产铜产量同比提升70.5%（17万吨）至41万吨，产量增长主要受益于核心矿山投产后的产量释放，包括：1）卡莫阿（二期22年4月达产，1H22产量同比增长5.7万吨）；Timok（上部矿带21年10月投产，1H22产量同比增长5.3万吨）以及3）西藏巨龙（一期于21年末投产，1H22产量同比增长3.6万吨）。1H22矿产金产量同比提升22.8%（5吨）至27吨，增长主要来自Timok矿的产量释放（同比增长2.6吨）以及武里蒂卡矿（技改于21年末投产，1H22产量同比增长0.98吨）。铜金板块中长期仍有较大提升空间除新投产项目产能继续爬坡释放产量之外，公司铜金板块中长期仍有继续增产空间。未来铜矿增量主要来自：博尔VK矿技改项目（预计2H22投产），卡莫阿一二期45万吨/年技改项目（预计2Q23投产）以及三期项目（预计24年底投产，达产后年产铜60万吨）；Timok下带矿一期工程（预计25年底建成）；巨龙二期项目。未来黄金增量主要来自：波格拉金矿复产；山西紫金（预计今年8月底投产，新增矿产金3-4吨/年），诺顿金田Binduli堆浸项目（预计3Q22投产，新增矿产金2.5吨/年）；泽拉夫尚500吨/天加压氧化项目（预计23年底投产，新增矿产金2.3吨/年）（均为公司预计）。新能源布局蓄力在铜金板块持续扩增的同时，紫金矿业积极延伸布局新能源金属领域。目前公司的“两湖一矿”锂资产，即阿根廷3Q盐湖、西藏拉果错盐湖以及湖南道县湘源锂多金属矿，共拥有超1000万吨的锂当量资源，跻身全球前10位、国内前3位。公司碳酸锂产能远景规划15万吨/年，其中阿根廷3Q一期（2万吨/年）和西藏拉果错一期（2万吨/年）公司力争2023年投产。风险提示：产量扩张慢于预期；海外衰退影响下商品价格低于预期。,,华泰证券,买入,[None],2022-08-15,,买入,4952266,pdf_downloads/2022/2022-08-15/601899-紫金矿业（601899）：铜金主力项目放量，1H22净利劲增.pdf,601899,紫金矿业,紫金矿业（601899）：铜金主力项目放量，1H22净利劲增
"邱祖学,张弋清,刘小华",事件：公司发布2022半年报。2022H1，公司实现营收1324.58亿元，同比增长20.6%；归母净利润126.3亿元，同比增长90%；扣非归母净利120.24亿元，同比增长97%。分季度来看，2022Q2，公司实现营收676.87亿元，同比增长8.5%、环比增长4.5%；归母净利润65.06亿元，同比增长57.2%、环比增长6.2%。业绩符合此前业绩预告。2022Q2归母净利润环比、同比均大幅增长的核心在于毛利的增长，而毛利增长主要得益于矿产金板块的贡献。2022Q2公司单季度毛利润同比增30.44%、环比增2.33%至114.79亿元，毛利率同比增2.85pct、环比降0.36pct.至16.96%，其中矿山金毛利29.2亿元，同比增66.31%，环比增20.04%。我们认为，公司2022年上半年毛利润同比大幅增长的核心原因在于产品量价齐升，矿山销量增长、售价提升分别带来毛利增厚49.54亿元、14.29亿元，分别贡献矿山产品毛利增长额的77.6%、22.4%。分季度看，2022Q2毛利润环比增长2.61亿，主要在于矿山企业毛利润环比增长2.43亿元。此外，卡莫阿铜矿二期提前至3月投产带来投资收益环比大幅提升6.7亿元。单季度量、价、本数据：2022Q1，①销量端：矿产金、矿产银、矿产铜、矿产锌、铁精矿环比分别+12.19%、+5.96%、+4.92%、-10.10%、+10.58%。其中黄金销量大于产量的原因或为中塔泽拉夫尚此前积压库存实现销售；②价格端：矿产金、矿产银、矿产铜、矿产锌、铁精矿环比分别+5.29%、0.00%、-0.72%、-3.41%、-10.72%。③成本端：矿产金、矿产银、矿产铜、矿产锌、铁精矿环比分别+3.55%、+6.70%、+6.06%、+10.02%、+37.79%。成本增长或由于辅料价格提升以及入选品位波动影响，铁精矿成本大幅上升的原因是新疆金宝矿山逐渐枯竭，品位下滑带来成本上升。期待三大铜矿业集群的持续绽放和锂资源量向产量的蜕变。铜板块，刚果（金）卡莫阿、西藏巨龙、塞尔维亚Timok三大世界级铜矿2022年均将贡献较大增量，巨龙经过上半年爬坡后下半年环比仍有增量。金板块，多项目技改有望提升年产量，新项目并购打开成长空间。新能源板块，公司接连收购阿根廷3Q盐湖、西藏拉果错盐湖和湖南锂云母矿，大举进军新能源金属领域，目前“两湖一矿”的布局使得公司具备碳酸锂当量资源量超过1000万吨，远景规划年产能有望突破15万吨碳酸锂当量，均将进入全球前10，国内前3的水平。投资建议：公司主要产品铜金锌2022年产量指引相比于2021年的产量均有较大提升，叠加金属价格中枢提升，我们维持公司的盈利预测，预计2022-2024年公司将实现归母净利241亿元、277亿元、307亿元，对应8月12日收盘价的PE为10x、9x和8x，维持“推荐”评级。风险提示：项目进度不及预期，铜金等价格下跌，海外地缘政治风险等。,,民生证券,推荐,[None],2022-08-15,,增持,4951810,pdf_downloads/2022/2022-08-15/601899-紫金矿业（601899）2022年半年度业绩点评：量价齐升业绩创新高，期待“两湖一矿”锂资源放量.pdf,601899,紫金矿业,紫金矿业（601899）2022年半年度业绩点评：量价齐升业绩创新高，期待“两湖一矿”锂资源放量
"刘孟峦,杨耀洪",公司发布半年报：上半年实现营收1324.58亿元，同比+20.57%；实现归母净利润126.30亿元，同比+89.95%；实现扣非归母净利润120.24亿元，同比+96.71%。22Q2实现营收676.87亿元，同比+8.54%；实现归母净利润65.06亿元，同比+57.23%；实现扣非归母净利润59.81亿元，同比+64.50%。公司今年上半年利润同比实现大幅增长，主要是因为：1）公司主营矿产品金、铜等产量同比大幅上升，其中矿产铜产量同比上升约70%，矿产金产量同比上升约23%；2）今年上半年公司矿产金、矿产铜销售价格同比上升约2%、3.6%；3）部分联、合营公司盈利能力提升。从二季度的角度来说，公司利润环比一季度仍有所提升，主要是因为：1）22Q2核心矿产品金、铜等产量环比均有所增加；2）大宗金属商品价格短期虽然出现了明显的调整，但是从二季度均价的角度来说仍维持在高位。核心矿产品产销量方面：公司上半年矿产金产量27.03吨，同比+22.79%，Q1/Q2产量分别为13.10/13.93吨，Q2产量环比+6.34%；矿产铜产量41.02万吨，同比+70.47%，Q1/Q2产量分别为19.36/21.66万吨，Q2产量环比+11.88%；矿产锌产量20.27万吨，同比+3.23%，Q1/Q2产量分别为10.82/9.45万吨，Q2产量环比-12.66%。锂资源布局异军突起，“两湖一矿”格局形成公司于2021年10月收购阿根廷3Q锂盐湖项目，总资源量约763万吨LCE。项目一期年产2万吨电池级碳酸锂项目于今年年初启动建设，预计将于2023年底建成投产；另外项目今年将同步开展二期项目可行性研究，并争取2023年开工，将碳酸锂年产能扩大至4-6万吨。公司于2022年4月收购西藏拉果错锂盐湖70%股权，该盐湖碳酸锂备案资源量约214万吨。拉果错锂盐湖正在进行开采工艺技术路线调整的论证，如果采用新工艺，项目一期产量拟调整为2万吨/年碳酸锂，项目二期建设投产后产量拟提升到5万吨/年碳酸锂。公司于2022年6月收购湖南厚道矿业约71%股权，该公司100%持有湖南道县湘源铷锂多金属矿，拥有氧化锂资源87万吨，折合约216万吨LCE。根据公司初步规划，矿山拟采用大规模露天开采，初步规划按1000万吨/年规模建设矿山，年产锂云母含碳酸锂当量6-7万吨。综上，公司所控制的“两湖一矿”资源量将超过1000万吨LCE，远景规划的年产能有望突破15万吨LCE。风险提示：项目建设进度不达预期，矿产品销售价格不达预期。投资建议：维持“买入”评级。维持公司2022年盈利预测，预计公司2022-2024年营收为2502/2548/2597亿元，同比增速11.1%/1.9%/1.9%，归母净利润为246.6/267.2/297.4亿元，同比增速57.3%/8.4%/11.3%；摊薄EPS为0.94/1.01/1.13元，当前股价对应PE为10/9/8X。考虑到公司是国内有色上市公司核心标的，矿产资源储量丰富，国际化进程不断加快，战略延伸积极布局新能源新材料产业助力能源转型，锂资源布局持续取得突破，中长期成长路径明确，未来有望跻身全球超一流国际矿业企业，维持“买入”评级。,,国信证券,买入,[None],2022-08-15,,买入,4952467,pdf_downloads/2022/2022-08-15/601899-紫金矿业（601899）半年度报告点评：核心业绩指标创历史新高，锂资源“两湖一矿”布局形成.pdf,601899,紫金矿业,紫金矿业（601899）半年度报告点评：核心业绩指标创历史新高，锂资源“两湖一矿”布局形成
"谢鸿鹤,郭中伟,安永超","事件：紫金矿业发布2022年中报。报告期内，公司实现营业收入1,324.58亿，同比增20.57%，归母净利润126.30亿，同比增89.95%，扣非归母净利润120.24亿，同比增96.71%；其中22年Q2实现营业收入676.87亿，同比增8.54%，环比增4.50%，归母净利润65.06亿，同比增57.23%，环比增6.24%。重点项目建设加快推进，主营产品量价齐升带动公司业绩高增长。铜矿方面，刚果（金）卡莫阿铜矿二期于22年3月提前投产；塞尔维亚VK矿采选工程及冶炼厂改扩建项目即将完成；西藏巨龙铜矿一期达产，二期筹建快速推进；黑龙江多宝山铜山矿地采顺利推进。金矿方面，澳大利亚诺顿金田Binduli北低品位堆浸项目实现投料试车，奥罗拉金矿、陇南金山金矿等采选扩建、技改项目有序建设实施。1）铜业务，22年上半年LME铜均价为9,748.98美元/吨（yoy+7.23%），SHFE铜均价为71,526.41元/吨（yoy+7.08%）。公司22年H1矿产铜41.02万吨（yoy+70.47%），销量35.72万吨（yoy+50.19%），冶炼产铜34.63万吨（yoy+9.86%），销量34.75万吨（yoy+10.99%）。2）金业务，22年上半年COMEX黄金均价为1,876.73美元/盎司（yoy+4.01%），SHFE黄金均价为392.64元/克（yoy+3.83%），矿产金27.03吨（yoy+22.79%），销量29.13吨（yoy+37.12%），冶炼产金128.53吨（yoy+0.48%）,销量128.66吨（yoy+0.69%）。3）锌业务，22年上半年LME锌均价为3,799.79美元/吨（yoy+33.31%），SHFE锌均价为25,835.47元/吨（yoy+19.71%），矿产锌20.27万吨（yoy+3.23%），销量20.08万吨（yoy+1.59%），冶炼产锌16.29万吨（yoy+10.33%），销量16.36万吨（yoy+16.10%）。4）其他业务，矿产银产量183.60吨（yoy+10.12%），铁精矿产量174万吨（yoy-25.68%），硫酸产量163万吨（yoy+14%）。公司报告期间费用率有所下降。22年H1公司期间费用率为3.14%，较去年同期减少0.30pcts，具体来看：1）销售费用同比上涨38.96%至3.05亿元，销售费用率由0.20%→0.23%，上升0.03pcts；2）由于本期职工薪酬等人工成本增加，管理费用同比增长16.25%至28.90亿元，管理费用率由2.55%→2.52%，减少0.03pcts；3）财务费用方面，由于本期汇兑损失同比减少，公司22年H1财务费用共计5.18亿元，同比降31.07%，财务费用率由0.68%→0.39%，减少0.29pcts；4）研发费用方面，由于材料费用与人工成本增加，研发费用同比增长39.71%至4.43亿元，研发费用率由0.29%→0.33%。分阶段投资蒙古哈马戈泰铜金矿，收购新疆乌恰县萨瓦亚尔顿金矿，未来持续发展基础不断夯实。1）22年4月，公司与Xanadu Mines签署股权认购协议，拟分阶段投资获得Xanadu Mines合计19.9%股权，以及下属辉腾金属50%股权，进而拥有蒙古哈马戈泰铜金矿项目约45.9%权益，并主导该矿山的开发。截至2021年底，哈马戈泰铜金矿含铜约293万吨，含金约243万吨。2）22年7月，公司通过协议转让方式，收购伟福矿业100%股权。",,中泰证券,买入,[None],2022-08-14,,买入,4951156,pdf_downloads/2022/2022-08-14/601899-紫金矿业（601899）：主营矿产品量价齐升，布局新能源领域拓展增量空间.pdf,601899,紫金矿业,紫金矿业（601899）：主营矿产品量价齐升，布局新能源领域拓展增量空间
施毅,2022H1归母净利润同比大增90%。紫金矿业发布2022年中报，实现营业收入1324.6亿元，同比增长21%，实现归母净利润126.3亿元，同比增长90%，再次历史新高。公司2022Q2单季度归母净利润65.1亿，同比增长57%，环比增长6%。紫金矿业2022H1归母净利润大幅增长，主要原因包括：1、主营矿产品金、铜、锌价格同比大幅上涨；2、公司由“项目建设年”，进入“产量释放期”，量价齐升贡献业绩新高。矿山盈利能力持续提升。分板块看，公司2022H1铜、金、锌产品毛利占比分别为54.6%，22.6%，8.82%，矿产品整体毛利率为60%，同比增加1.47 个百分点。2022H1紫金矿业ROE达16.6%，同比增加5.6个百分点，经营活动现金净流量达156亿元。金属价格系统性风险后复苏，22H2公司重点项目持续放量。紫金矿业二季度矿产铜21.7万吨，同比增长90%；矿产金13.9吨，同比增长29%；矿产锌11.4万吨，同比增长14%。公司成为全球矿产铜增长最多的公司之一，矿产铜进入爆发式增长阶段，旗下几大世界级铜金矿全部建成投产、达产。截至上半年，刚果（金）卡莫阿铜矿二期提前投产，矿产铜约14.3万吨；西藏巨龙铜矿一期达产、二期筹建加快，实现矿产铜4.4万吨；塞尔维亚佩吉铜金矿矿产铜5.3万吨、矿产金2.6吨，为公司盈利能力最强的项目。塞尔维亚紫金铜业VK矿采选工程及冶炼厂改扩建即将完成、JM矿崩落法采矿按期推进。收购道县湘源锂多金属矿，加快开发进度。紫金矿业公告出资18亿元收购湖南省道县湘源锂多金属矿100%权益，计划按1000万吨/年规模建设矿山，年产锂云母含碳酸锂当量6-7万吨。拉果错盐湖：一期正加快实施建设开发工作。西藏拉果错盐湖锂矿一期产量拟调整为2万吨/年碳酸锂，二期建设投产后产量拟提升到5万吨/年碳酸锂。盈利预测与估值。我们认为公司2022-2024年EPS分别为0.91、1.04和1.20元/股，由于我们预计随着公司卡莫阿铜矿和佩吉铜金矿等投产运营，公司净利润将迎来快速增长期，参考可比公司估值水平，给予2022年20倍PE估值，对应合理价值18.20元，维持“优于大市”评级。风险提示。项目建设进度不及预期。,,海通国际证券,优于大市,[None],2022-08-14,,买入,4950822,pdf_downloads/2022/2022-08-14/601899-紫金矿业（601899）：重点项目业绩如期释放，加快布局新能源业务.pdf,601899,紫金矿业,紫金矿业（601899）：重点项目业绩如期释放，加快布局新能源业务
"刘孟峦,杨耀洪",公司发布半年度业绩预增公告：预计上半年实现归母净利润约126亿元，同比增加约91%；实现扣非归母净利润约119亿元，同比增加约95%。公司22Q2单季度预计实现归母净利润约65亿元，同比增加约57%，环比增加约6%；实现扣非归母净利润约59亿元，同比增加约61%，环比减少约3%。公司今年上半年利润同比实现大幅增长，主要是因为：1）公司主营矿产品金、铜等产量同比大幅上升，其中矿产铜产量同比上升约70%，矿产金产量同比上升约22%；2）今年上半年公司矿产金、矿产铜销售价格同比上升约2%、3.6%；3）部分联、合营公司盈利能力提升。从二季度的角度来说，公司利润环比一季度仍有所提升，主要是因为：1）22Q2核心矿产品金、铜等产量环比均有所增加；2）大宗金属商品价格短期虽然出现了明显的调整，但是从二季度均价的角度来说仍维持在高位。总体上，我们认为公司二季度盈利能力还是保持了很高的水准。产销量方面：22Q1矿产金产量13.10吨，上半年合计约26.86吨，所以预计22Q2产量约13.76吨，环比+5.04%；22Q1矿产铜产量19.36万吨，上半年合计约40.90万吨，所以预计22Q2产量约21.54万吨，环比+11.26%。公司战略延伸助力能源转型，锂资源布局持续取得突破公司于2021年10月收购阿根廷3Q锂盐湖项目，总资源量约763万吨LCE。项目一期年产2万吨电池级碳酸锂项目于今年年初启动建设，预计将于2023年底建成投产；另外项目今年将同步开展二期项目可行性研究，并争取2023年开工，将碳酸锂年产能扩大至4-6万吨。公司于2022年4月收购西藏拉果错锂盐湖70%股权，该盐湖碳酸锂备案资源量约214万吨。拉果错锂盐湖正在进行开采工艺技术路线调整的论证，如果采用新工艺，项目一期产量拟调整为2万吨/年碳酸锂，项目二期建设投产后产量拟提升到5万吨/年碳酸锂。公司于2022年6月收购湖南厚道矿业约71%股权，该公司100%持有湖南道县湘源铷锂多金属矿，拥有氧化锂资源87万吨，折合约216万吨LCE。根据公司初步规划，矿山拟采用大规模露天开采，初步规划按1000万吨/年规模建设矿山，年产锂云母含碳酸锂当量6-7万吨。综上，公司所控制的“两湖一矿”资源量将超过1000万吨LCE，远景规划的年产能有望突破15万吨LCE。风险提示：项目建设进度不达预期，矿产品销售价格不达预期。投资建议：维持“买入”评级。小幅上调2022年盈利预测，预计公司2022-2024年营收为2502/2548/2597亿元，同比增速11.1%/1.9%/1.9%，归母净利润为246.6/267.2/297.4亿元，同比增速57.3%/8.4%/11.3%；摊薄EPS为0.94/1.01/1.13元，当前股价对应PE为10/9/8X。考虑到公司是国内有色上市公司核心标的，矿产资源储量丰富，国际化进程不断加快，战略延伸积极布局新能源新材料产业助力能源转型，锂资源布局持续取得突破，中长期成长路径明确，未来有望跻身全球超一流国际矿业企业，维持“买入”评级。,,国信证券,买入,[None],2022-07-11,,买入,4914122,pdf_downloads/2022/2022-07-11/601899-紫金矿业（601899）半年度预增公告点评：核心矿产品放量驱动业绩高增长，锂资源布局持续取得突破.pdf,601899,紫金矿业,紫金矿业（601899）半年度预增公告点评：核心矿产品放量驱动业绩高增长，锂资源布局持续取得突破
李子卓,事件7月8日公司发布2022年半年度业绩预增报告。公司预计2022年半年度实现归母净利润约为126亿元，同比增长约91%；预计实现归母扣非净利润119亿元，同比增长约95%。点评高执行力加快产品量增，铜金高价实现利升。铜金产量方面，2022H1公司矿产金、铜产量分别同比上升约70%、22%。2022年上半年，公司下属塞尔维亚紫金铜业、刚果（金）卡莫阿铜业及西藏巨龙铜业等一批主力矿山如期建成投产、达产，高品位矿石叠加高执行能力，公司实现矿产品快速放量；价格上升方面，2022年上半年矿产金、铜产品售价同比上升约2%、3.6%，铜金高价增厚公司利润。锂板块完成“两湖一矿”布局，扩充新能源上游资源版图。截至2022年6月30日，公司权益锂资源量超1000万吨LCE。首先，阿根廷3Q锂盐湖LCE总资源量约763万吨，一期碳酸锂设计产能2万吨；其次，公司收购西藏阿里拉果错盐湖锂矿70%股权，其保有LCE资源量214万吨，一期碳酸锂产能2万吨，二期拟提升到5万吨；最后，公司收购湖南厚道矿业71%股权，道县湘源锂多金属矿约合碳酸锂216万吨。至此，公司在新能源业务实现“两湖一矿”的战略布局，随着后续公司相关项目的持续扩大，公司锂盐产能或将跃居一线锂盐大厂之列。金价未来有望上行，黄金业务有望享量价齐升。美国通胀水平持续处于高位，叠加地缘政治冲突以及对全球经济衰退的担忧，黄金预期将持续强势。根据美国劳工部数据，2022年5月美国CPI指数同比上涨8.6%，通胀水平创近40余年新高。据产量指引，公司预计2022年实现黄金产量60金属吨，较2021年提升26%。金价未来上行趋势，叠加公司矿产金扩产的情况下，公司业绩有望持续靓丽。投资建议铜金业务扩产贡献稳定现金流，新能源业务有望再添盈利增长极。我们维持之前报告中的盈利预测，预期2022/2023/2024年公司归母净利润分别为228/244/263亿元，EPS分别0.86/0.93/1.00元，对应2022年7月8日股价PE分别为10.49/9.79/9.07倍。维持“强烈推荐”评级。风险提示项目投产进度不及预期、矿业环保政策大幅变动、汇率波动等。,,东亚前海证券,强烈推荐,[None],2022-07-11,,买入,4913556,pdf_downloads/2022/2022-07-11/601899-紫金矿业（601899）：22H1业绩同比增加91%，矿业龙头迎量价齐升.pdf,601899,紫金矿业,紫金矿业（601899）：22H1业绩同比增加91%，矿业龙头迎量价齐升
