author,content,filename,org_name,original_rating,pdf_link,publish_time,rating_adjust_mark_type,rating_changes,report_id,save_path,stock_code,stock_name,title
康敬东,"事件:近期公司发布三季度业绩公告:报告期内,公司实现营业收入 162.71亿元,同比增长 17.73%,归母净利润 5.4亿元,同比增 53.22%,EPS 为0.51元。公司预计 2014年业绩区间:4.76亿元至 5.79亿元,即0.45~0.54元/股。 点评:
    利润增长高于收入增长。今年前三季度公司实现收入同比增长17.73%,主营业务利润同比增长37.25%,归属母公司净利润同比增长53.22%,经营活动现金流量同比增长19.32%。从财务角度看,公司期间费用率逐季下降,经营效率总体提升,负债率下降,财务质量向好。
    新建产能陆续投产。安徽海大配合料项目设计产能24万吨,8条生产线中的3条已经投产。荆州海大配合料项目设计产能20万吨(6条生产线)今年5月投产。设计产能20万吨包括禽畜水产料的洞庭海大我们预计年底投产。阳江20万吨设计产能的以猪料为主的生产线我们预计年底建成,明年初投产。此外年产18万吨的南通海大水产饲料生产线和武汉泽亿的微生态制剂生产线也将陆续投入建设。
    主要品种销售形势理想。尽管虾料一季度销售下滑,但4月份以来销售逐渐恢复,5、6月份均增长2成。鱼料增长形势总体类似近两个月增长2成,上半年预计1成。 去年公司猪料增长形势较好,销量增长3成,我们预计,今年以来猪料增长约2成,禽料去年增长1成,今年以来估计增长2成。
    华南水产养殖形势回暖 业绩增长形势较好。2013年国内对虾养殖疫病在华南地区大规模爆发,对虾疫病及极端天气导致养殖户排塘率达6~7成。下游养殖效益的惨淡及淡水鱼价格的萎靡情况,最终导致上游水产饲料销售量明显收缩。今年华南地区对虾养殖未发生大面积排塘率。公司从2013年开始自上而下地要求进一步加大对养殖户的技术服务的力度,现已得到经销商及养殖户的高度认可度。养殖户及公司的技术服务人员对于恶劣天气、疫病的事前防范及补救措施都有所改进、较以往更加完善。2014年年初以来,公司高端鱼料销量、虾料销量、养殖行情、养殖户的积极性等,都明显优于去年。公司经销商的忠诚度进一步提高:公司的产品线较丰富,苗种及微生态制剂为经销商增利;公司的养殖技术服务较为全面及深入。华南片区市场划分进一步细化,有助于公司聚焦开拓市场:分厂和团队之间市场交叉和内耗的现象有所改善;细分区域内生产和销售之间的协调更为顺畅, 生产和营销资源的调配更加合理。
    海外虾料业务预计增长6成:公司在越南生产基地面向东南亚市场,而东南亚市场规模与国内相当。目前正大、统一、
    全兴和海大是主要的竞争对手。公司自2012起步以来,加速了海外市场的扩充,市场销量亦快速提升,12年3万吨, 13年6万吨,我们预计今年有望达到10万吨。
    盈利预测及评级:我们预计公司14~16年销售收入分别为238/315/406亿元,归属母公司净利润分别为5.09/7.11/10.1亿元,对应公司2014~2016年EPS 为0.48/0.66/0.94元。对应2014年10月31日收盘价(11.41元)的市盈率分别为24倍、17倍、12倍。维持公司“买入”评级。
    风险因素:下游养殖不景气、原料成本压力难以转嫁、突发灾害性天气及疫病等。",,信达证券,增持,[None],2014-11-05,,增持,827643,"pdf_downloads/2014/2014-11-05/002311-海大集团(002311)：盈利明显回升,重回增长轨迹.pdf",002311,海大集团,"海大集团(002311)：盈利明显回升,重回增长轨迹"
林帆,,,中金财富,强烈推荐,[None],2014-10-31,,买入,825936,"pdf_downloads/2014/2014-10-31/002311-海大集团(002311)三季报点评：饲料盈利水平显着回升,参股广东省政府背景产业投融资公司.pdf",002311,海大集团,"海大集团(002311)三季报点评：饲料盈利水平显着回升,参股广东省政府背景产业投融资公司"
,"核心观点

公司3季报符合预期。公司披露2014年3季报，营业收入16271.44百万元，同比增长17.73%，归属净利润539.57百万元，同比增长53.22%，EPS0.50元，符合我们和市场预期。其中3季度单季度营业收入7339.25百万元，同比增长11.06%，归属净利润336.81百万元，同比增长56.11%。

在今年养殖天气欠佳的情况下，公司前3季度业绩仍取得大幅增长，实属难得，也基本印证了我们此前在公司深度报告中“公司业务基本面反转”的判断。在今年下半年的养殖旺季里，华南地区接连受到“威马逊”和“海鸥”等强台风的侵袭，从而导致出现养殖户为规避风险而提前清塘，以及苗种短缺导致价格上涨等负面状况。然而，在今年深耕细分市场等营销举措和强化技术服务的差异化竞争优势等利好因素的驱动之下，公司今年的销售形势明显优于行业平均水平和主要竞争对手。其中，我们预计公司今年前3季度的虾料销量同比增长15%-20%。

今年的养殖旺季有所顺延。今年的台风对华南对虾育苗场造成一定冲击，造成阶段性的对虾苗种供应紧张，同时也有部分养殖户为了避免台风带来损失而提早清塘出虾，从而扰乱了华南片区的水产投苗和养殖节奏。由于养殖户在台风过后才陆续补苗，从而导致华南片区水产养殖的旺季时间有所顺延。根据我们的动态跟踪，我们估计公司今年10月单月虾料销量同比增长20%以上，鱼料为10%-20%。预计今年10月份仍将有一定的水产饲料业绩贡献。

公司未雨绸缪，在最近几个月已经开始加大产品和技术效果的示范及宣传力度，意在提前布局明年的市场拓展。我们期待公司明年的销售继续发力。

财务预测与投资建议

我们预计公司2014-2016年每股收益分别为0.49、0.63、0.78元。根据公司历史及可比公司平均估值水平，给予公司2014年28倍PE，目标价13.72元，维持“买入”的投资评级。我们认为目前股价并没有反应公司今年基本面改善的趋势，预计股价后续存在补涨机会，建议积极关注。

风险提示

财务投资者减持压力；如果爆发养殖疫病，可能对销售产生负面影响。",,东方证券,买入,[None],2014-10-31,,买入,826914,pdf_downloads/2014/2014-10-31/002311-海大集团：3季报高增长，预计全年业绩无忧.pdf,002311,海大集团,海大集团：3季报高增长，预计全年业绩无忧
"谢刚,胡彦超","海大集团公布2014年三季度,净利润高增长符合我们此前预期,全年业绩高增长已经锁定。前三季度实现收入163亿,同比增长18%;实现净利润5.4亿,同比增长53%,ROE=12.9%,EPS=0.50元。其中三季度单季收入73亿,同比增长11%,净利润3.4亿,同比增长56%。公司同时预计全年净利润同比增长40-70%。
    三季度利润同比增长56%,源于收入增长11%,毛利率大幅提升2.3pct。草根数据显示公司三季度各饲料品种同比都出现增长,但增幅略慢于上半年。三季度水产饲料销售受到台风威马逊影响同比增长5%,猪料、禽料增长在10-13%之间。同时由于水产饲料原料豆粕价格的大幅下跌,毛利率同比增长2.3pct至10.9%,拉动净利润率同比上升1.4pct。
    全年业绩高增长已经锁定,前三季度EPS=0.50元,全年实现我们预计EPS=0.52元难度不大。公司四季度一般是淡季,去年四季度微亏,EPS下滑0.01元,但今年台风使第二造对虾投苗偏晚,销售季结束时间也会相应推迟,销售推迟使10月对虾料收入增长20-30%,因此今年Q4收入利润将好于去年水平。
    公司同时公告将以1.1亿元与广东机场管理集团等六方投资者共同投资组建成立广东空港城投资有限公司,公司占广东空港城股份11%。其中广东国资持股49%(广东机场管理35%,广东恒健14%),民间资本持股51%(重庆联合18%、金发12%、海大11%、立白5%、上海东逸5%)。广东空港城投资方向包括股权、基金投资,金融、物流服务等众多领域;公司投资该项目,即能积极参与到地方国有企业混合所有制改革大潮中,获取合理的投资收益;同时还能借助国有企业雄厚的资本实力和正在打造的物流、金融等更多产业平台,进一步完善公司的产业生态。我们预计广东空港城初期投资主要为广州白云机场周边物流、融资、服务综合产业园区。
    我们维持2014-16年盈利预测EPS为0.52、0.68、0.95元,同比增长61%、32%、39%,继续看好海大优秀的管理团队和行业领先的服务营销模式,公司饲料业务海外扩张在加速,从国内红海进入海外新蓝海市场,重申“买入”评级,12月目标价14.2元,对应2014年27xPE。",,中泰证券,买入,[None],2014-10-31,,买入,826273,"pdf_downloads/2014/2014-10-31/002311-海大集团(002311)：业绩高增长符合预期,将参股广东混改投资平台.pdf",002311,海大集团,"海大集团(002311)：业绩高增长符合预期,将参股广东混改投资平台"
,"海大集团(002311)“买入”评级(2014-9-30收盘价11.21元)
    核心推荐理由:1、产品销售逆市增长。上半年全国饲料总产量8,300万吨,同比下降3%。其中猪饲料3,830万吨,同比增长0.3%;蛋禽饲料1,330万吨,同比下降8%;肉禽饲料2,200万吨,同比下降7.0%;水产饲料480万吨,同比下降10%。同期,公司实现饲料销量230万吨,同比增长15.87%;其中畜禽饲料同比增长17.73%,其中猪饲料同比增长约为15%,禽料同比增长约20%;水产饲料同比增长11.94%,其中对虾饲料销量同比增长20%以上,鱼饲料同比增长超过10%,其中高档膨化料同比增长约50%。
    产品盈利能力稳步提升。上半年公司产品毛利率10.19%,同比增长0.82个百点,毛利率增长得益于:公司对原材料供需研究、规模化集中采购和期货套保中有效的风险管理方面的优势;饲料产品升级、结构优化,提升高毛利率产品比重;饲料销量同比增长,公司资产周转、人均效率得到提升,单位成本下降;利用信息系统对内部精细化管理提升运行效率。
    产品升级、服务见效。今年以来公司不断推出新产品及养殖模式,得到养殖户的高度认可,对虾饲料销量同比增长20%以上;如公司推出对虾发酵饲料,能有效提升对虾消化吸收率,减少疾病发生的比例,对虾生长性能得到明显改善;如公司在珠三角地区推广南美白对虾和罗氏对虾混养模式,能大幅提升养殖成活率,使该区域内公司养殖户的盈利比例超过70%,产品和服务口碑进一步提升。公司核心竞争力进一步巩固。
    盈利预测及评级:尽管行业低迷,公司产品服务双优势仍然在区域市场取得迅猛发展,体现了公司不俗的核心竞争力。特别是上半年多点开花,逆市增长的局面,伴随着公司对员工激励的推出,公司产品和服务口碑的进一步深入,公司未来发展前景广阔。我们预计公司2014~2016年每股收益为0.48元、0.66元、0.94元,对应2014年9月30日收盘价(11.21元)的市盈率分别为24倍、17倍、12倍,维持“买入”评级。
    关键假设:行业形势平稳,公司经营正常。
    股价催化因素及时间:业绩符合预期及其它催化事件期间。
    风险提示:养殖业亏损导致饲料企业成本难以转嫁、产能受行业低迷影响难以释放、下游养殖行业恢复迟缓、突发疫情及安全事件等。",,信达证券,,[None],2014-10-10,,,821466,pdf_downloads/2014/2014-10-10/002311-海大集团(002311)：“买入”评级.pdf,002311,海大集团,海大集团(002311)：“买入”评级
,"本期【卓越推】组合:海大集团(002311)。
    海大集团(002311)“买入”评级(2014-9-19收盘价11.47元)
    核心推荐理由:1、产品销售逆市增长。上半年全国饲料总产量8,300万吨,同比下降3%。其中猪饲料3,830万吨,同比增长0.3%;蛋禽饲料1,330万吨,同比下降8%;肉禽饲料2,200万吨,同比下降7.0%;水产饲料480万吨,同比下降10%。同期,公司实现饲料销量230万吨,同比增长15.87%;其中畜禽饲料同比增长17.73%,其中猪饲料同比增长约为15%,禽料同比增长约20%;水产饲料同比增长11.94%,其中对虾饲料销量同比增长20%以上,鱼饲料同比增长超过10%,其中高档膨化料同比增长约50%。
    产品盈利能力稳步提升。上半年公司产品毛利率10.19%,同比增长0.82个百点,毛利率增长得益于:公司对原材料供需研究、规模化集中采购和期货套保中有效的风险管理方面的优势;饲料产品升级、结构优化,提升高毛利率产品比重;饲料销量同比增长,公司资产周转、人均效率得到提升,单位成本下降;利用信息系统对内部精细化管理提升运行效率。
    产品升级、服务见效。今年以来公司不断推出新产品及养殖模式,得到养殖户的高度认可,对虾饲料销量同比增长20%以上;如公司推出对虾发酵饲料,能有效提升对虾消化吸收率,减少疾病发生的比例,对虾生长性能得到明显改善;如公司在珠三角地区推广南美白对虾和罗氏对虾混养模式,能大幅提升养殖成活率,使该区域内公司养殖户的盈利比例超过70%,产品和服务口碑进一步提升。公司核心竞争力进一步巩固。
    盈利预测及评级:尽管行业低迷,公司产品服务双优势仍然在区域市场取得迅猛发展,体现了公司不俗的核心竞争力。特别是上半年多点开花,逆市增长的局面,伴随着公司对员工激励的推出,公司产品和服务口碑的进一步深入,公司未来发展前景广阔。我们预计公司2014~2016年每股收益为0.48元、0.66元、0.94元,对应2014年9月19日收盘价(11.47元)的市盈率分别为24倍、17倍、12倍,维持“买入”评级。
    关键假设:行业形势平稳,公司经营正常。
    股价催化因素及时间:业绩符合预期及其它催化事件期间。
    风险提示:养殖业亏损导致饲料企业成本难以转嫁、产能受行业低迷影响难以释放、下游养殖行业恢复迟缓、突发疫情及安全事件等",,信达证券,,[None],2014-09-22,,,819641,pdf_downloads/2014/2014-09-22/002311-海大集团(002311)点评.pdf,002311,海大集团,海大集团(002311)点评
康敬东,"事件：近日，公司公布2014年中报，上半年公司实现收入89亿元，同比增长24%，实现主营业务利润9亿元，同比增长35%、实现归属母公司净利润2亿元，同比增长49%，实现每股收益0.19元，每股经营活动现金流量0.96元。

点评：

产品销售逆市增长。上半年全国饲料总产量8,300万吨，同比下降3%。其中猪饲料3,830万吨，同比增长0.3%；蛋禽饲料1,330万吨，同比下降8%；肉禽饲料2,200万吨，同比下降7.0%；水产饲料480万吨，同比下降10%。同期，公司实现饲料销量230万吨，同比增长15.87%；其中畜禽饲料同比增长17.73%，其中猪饲料同比增长约为15%，禽料同比增长约20%；水产饲料同比增长11.94%，其中对虾饲料销量同比增长20%以上，鱼饲料同比增长超过10%，其中高档膨化料同比增长约50%。

产品盈利能力稳步提升。上半年公司产品毛利率10.19%，同比增长0.82个百点，毛利率增长得益于：公司对原材料供需研究、规模化集中采购和期货套保中有效的风险管理方面的优势；饲料产品升级、结构优化，提升高毛利率产品比重；饲料销量同比增长，公司资产周转、人均效率得到提升，单位成本下降；利用信息系统对内部精细化管理提升运行效率。

产品升级、服务见效。今年以来公司不断推出新产品及养殖模式，得到养殖户的高度认可，对虾饲料销量同比增长20%以上；如公司推出对虾发酵饲料，能有效提升对虾消化吸收率，减少疾病发生的比例，对虾生长性能得到明显改善；如公司在珠三角地区推广南美白对虾和罗氏对虾混养模式，能大幅提升养殖成活率，使该区域内公司养殖户的盈利比例超过70%，产品和服务口碑进一步提升。公司核心竞争力进一步巩固。

与员工分享发展果实。近日，公司发布了“限制性股票与股票期权激励计划（草案）”。授予激励对象限制性股票共计1450.5万股，占公司总股本1.36%，授予价格5.74元，股票期权共计1061.5万份，占公司总股本0.99%，行权价格11.51元。两个激励计划合计占公司总股本2.35%。两个计划中公司业绩须满足以下条件：以2013年为基准年，2015、2016和2017年收入增速不低于40%、60%和80%，即收入分别达到251亿、287亿和323亿；净利润增速不低于60%、85%和110%，即净利润分别达到5.1亿、5.9亿和6.7亿。两个计划共涵盖466人，包括公司董事、高管和中层管理人员及核心技术人员。今年上半年公司管理费用3.54亿元，同比增长31.55%，高于公司销售收入的增长。其主要原因系公司采用多种激励措施，增加了管理人员的薪酬水平，报告期内员工薪酬和福利同比增长40%以上。从上述两方面来看，公司大股东十分关心员工利益，并与公司利润合理捆绑，体现了其所倡导的一贯原则。

盈利预测及评级：尽管行业低迷，公司产品服务双优势仍然在区域市场取得迅猛发展，体现了公司不俗的核心竞争力。特别是上半年多点开花，逆市增长的局面，伴随着公司对员工激励的推出，公司产品和服务口碑的进一步深入，公司未来发展前景广阔。我们预计公司2014~2016年每股收益为0.48元、0.66元、0.94元，对应2014年9月1日收盘价（11.35元）的市盈率分别为24倍、17倍、12倍，维持“买入”评级。

风险因素：养殖业亏损导致饲料企业成本难以转嫁、产能受行业低迷影响难以释放、下游养殖行业恢复迟缓、突发疫情及安全事件等。",,信达证券,买入,[None],2014-09-02,,买入,816025,pdf_downloads/2014/2014-09-02/002311-海大集团(002311)中报点评：共享发展，逆市增长.pdf,002311,海大集团,海大集团(002311)中报点评：共享发展，逆市增长
程晓东,"事件：公司近日发布2014年中报，实现营业收入89.32亿元，同比增23.84%，归母净利润1.94亿元，同比增47.08%，EPS为0.19元。公司变更部分募集资金投向，将“武汉泽亿微生态项目”变更为“洪湖海大年产22万吨配合饲料项目”及“宿迁海大饲料有限公司年产20万吨配合饲料项目”

饲料业务收入快速增长。上半年，公司饲料业务收入80.26亿元，同比增16.56%。销量方面，禽料、猪料、虾料、鱼料分别增长20%、15%、20%、10%，饲料总销量预计增长16%左右，收入增长主要由销量增长带动。由于全行业景气正在复苏，且公司营销综合服务能力突出，预计下半年饲料销量及收入仍将快速增长。

饲料业务综合毛利率提升明显，下半年或略有回落。上半年，由于养殖业不景气，配合料需求低迷，公司适时灵活调整策略，发力水产预混料及膨化料等高端市场取得成效。上述产品销量增长约50%，增速明显超过其他产品。此外，境外虾料业务毛利率提升了5.37个百分点。高端产品的快速增长带动饲料业务毛利率上升至9.87%，同比增1.52个百分点。下半年，在下游景气复苏背景下，预计公司配合饲料增速将上升，饲料业务综合毛利率或略有回落。

农产品及微生态制剂业务继续增长，但毛利贡献仍比较有限。农产品业务销售收入1.45亿元，同比增17.37%，主要是由于虾苗增长所致。微生态制剂业务收入7781万元，同比增0.17%。农产品及微生态制剂业务基本延续了2010年以来的增长势头，但受下游需求低迷影响，增速放缓。农产品及微生态制剂业务毛利分别是4362万元和3871万元，占同期各项业务毛利之和的比例分别是5.5%和4.88%。

维持“增持”投资评级。由于饲料业务营销综合服务能力突出，且饲料行业景气正在复苏，公司基本面面临拐点。预计随着募投项目变更后饲料产能的扩大，以及13年末定增后财务费用的明显下降，今明两年业绩有望大幅提升。我们预计公司2014-2015年实现EPS为0.50／0.57元，对应8月29日收盘价11.33元，PE分别为22.6倍与19.87倍，我们给予其“增持”评级。

风险提示。养殖及饲料行业景区复苏不及预期；新产能建设进度不及预期。",,太平洋证券,增持,[None],2014-09-02,,增持,816570,pdf_downloads/2014/2014-09-02/002311-海大集团(002311)：饲料业务收入快速增长，毛利率提升明显.pdf,002311,海大集团,海大集团(002311)：饲料业务收入快速增长，毛利率提升明显
,"公司披露2014年中报，2014年上半年实现营业收入8932.19百万元，同比增长23.84%，饲料总销量230万吨，同比增长15.87%，归属净利润202.75百万元，同比增长48.65%，EPS0.19元，略超市场预期。

核心观点

上半年水产饲料业务恢复较为明显。公司2014年上半年对虾饲料销量同比增长20%多，鱼饲料同比增长超过10%，其中高档膨化料同比增长约50%，公司水产饲料在实现量增的同时，产品结构也得到进一步优化。公司水产饲料业务恢复的主要原因在于：（1）2014年年初以来水产品价格同比出现上涨，养殖效益回升，下游养殖积极性明显提高；（2）在经历去年的养殖惨淡行情和经验教训以后，今年养殖户的疫病防治措施显得比去年更加完善和有效；（3）在养殖乱局之下，公司通过加强养殖技术服务和产品升级，使得差异化竞争优势进一步凸显。

前期的台风天气将影响华南地区今年下半年的投苗和养殖节奏，但预计不会改变行业复苏的趋势。今年7月在华南地区登陆的台风对海南对虾育苗场造成一定冲击，造成阶段性的对虾苗种供应紧张，同时也有部分养殖户为了避免台风带来损失而提早清塘出虾，从而扰乱了华南片区的水产投苗和养殖节奏。由于养殖户在台风过后已经陆续开始补苗，我们预计不会改变今年水产业务恢复的趋势，并预计今年华南片区水产养殖的旺季时间将有所顺延。

公司公布了限制性股票和股票期权激励计划。本次激励计划的对象包括董事、中高级管理人员和核心技术（业务）人员共计466人。本次激励计划拟向激励对象授予权益共计2512万分，约占公司总股本的2.35%。我们认为本次股权激励计划覆盖面较广。有助于提高团队的积极性和经营效率。

财务预测与投资建议

我们预计公司2014-2016年每股收益分别为0.49、0.63、0.78元。根据公司历史及可比公司平均估值水平，我们给予公司2014年28倍PE，目标价13.72元，维持“买入”的投资评级。

风险提示

财务投资者减持压力；如果爆发养殖疫病，可能对销售产生负面影响。",,东方证券,买入,[None],2014-08-28,,买入,814492,pdf_downloads/2014/2014-08-28/002311-海大集团：中报业绩略超预期，水产饲料景气回升.pdf,002311,海大集团,海大集团：中报业绩略超预期，水产饲料景气回升
