author,content,filename,org_name,original_rating,pdf_link,publish_time,rating_adjust_mark_type,rating_changes,report_id,save_path,stock_code,stock_name,title
"张明,王月香","事项：宁波银行公布2016年年报，实现营业收入236.45亿元，同比增长21.16%，归属母公司净利润78.1亿元，同比增长19.35%。不良贷款率0.91%，拨备覆盖率351.42%。

主要观点

1、利润增长领先同业，利息净收入贡献主要增长

公司2016年实现净利润同比增长19.35%，2017年一季度同比增长16.2%，虽有所降低，但仍领先同业。利息净收入年报和一季报同比增长分别为9.25%和7.65%，2016年主要由规模增长带动，全年生息资产同比增长32.26%，息差下降43bps，2017年一季度规模增速有所下降，总资产增长3.9%，其中贷款余额环比仅增长3.5%，但投资类增长9.7%，仍处较高水平，息差大幅回升19bps，预计全年量稳价升，利息净收入贡献主要收入增长。

手续费全年增长51.55%，处于较高水平，主要由代理业务增长152%拉动，公司理财全年增长23.4%，增速相对稳健。2017年一季度手续费同比增速仅7.55%，大幅下降，预计2017年受广义信贷约束，增速会下降。

另外，公司2016年实现投资收益9.43亿元，其中，金融资产投资交易差价贡献5.07亿元，显示公司债券交易类投资有所增加。

2、资产负债结构特殊带动息差表现亮眼

2017年一季度，公司息差逆势而上，提升19bps，主要得益于资产负债结构的特殊性和有力调整。从资产端看，公司贷款新增投放集中于小微和个人经营贷，且贷款久期较短，一年以内到期占比高达2/3，同时，投资类占比56%，资产收益率能够较早享受市场利率上行传导；而从负债端看，存款占比62%，虽无明显优势但也非明显短板，2016年末同业存单余额850亿元，规模较半年末压缩15%，同业负债和同业存单合计占总负债的比重将至26%，虽扔处较高水平，但显示出公司在主动负债方面收缩的方向，受同业存单利率上行的影响有所减弱。

3、拨备充足，受益于区位优势不良压力减轻

不良贷款率连续5个季度维持0.91%水的较低水平，同时受益于长三角地区的不良向好趋势，资产质量基本无压。拨备覆盖率2017年1季度提升至372.62%，继续保持同业内高水平。2016年底关注类贷款占比1.33%，持续下降态势。

全年共计提资产减值损失53.21亿，同比增长41%，其中应收款项类投资计提2.4亿，占应收款项余额的0.24%，与同业比处于较高水平，拨备计提较为充足。

4、从资产负债结构调整上看，公司的经营显示出灵活而不失稳健的特点，2017年，虽然受MPA考核影响，增速将有所受限，但随着公司资本补充和资本充足率的提高，能够及时随监管而动，预计公司2017-2018年净利润增长分别为18%、19%，维持“推荐”评级。",,华创证券,推荐,[None],2017-05-04,,增持,1976159,pdf_downloads/2017/2017-05-04/002142-宁波银行(002142)年报暨一季报点评：盈利依旧领先，灵活不失稳健.pdf,002142,宁波银行,宁波银行(002142)年报暨一季报点评：盈利依旧领先，灵活不失稳健
邓茂,"投资要点：

事件：宁波银行（002142）公布2016年报及2017一季报，公司2016年度实现归属于母公司股东的净利润78.10亿元，同比增19.35%；2017年一季度实现净利润23.59亿元，增幅为16.20%。公司拟以2016年末总股本为基数，向全体股东每10股派发现金红利3.5元（含税），并以资本公积转增股本每10股转增3股。

点评：

一季度规模环比增长较慢。一季度末，公司资产总额9,195.83亿元，比年初增长3.91%；各项存款5,410.85亿元，比年初增长5.80%，各项贷款3,136.68亿元，比年初增长3.69%。

公司一季度营收增长5.89%，净息差逆势上市。公司2017年一季度实现营业收入64.33亿元，同比增长5.89%；实现归属于母公司股东的净利润23.59亿元,同比增长16.20%；实现手续费及佣金净收入16.58亿元，同比增长7.55%，在营业收入中占比达25.77%，同比上升0.4个百分点。

宁波银行1季度净息差为2.14%，环比四季度提升18BP，净息差表现亮眼。

不良率有企稳迹象。2016年末公司不良贷款率0.91%，比年初下降0.01个百分点；拨贷比3.21%，比年初提高了0.36个百分点；拨备覆盖率351.42%，比年初提高了42.75个百分点。一季度末公司不良贷款率0.91%，与年初持平；拨贷比3.38%，比年初提高了0.17个百分点；拨备覆盖率372.62%，比年初提高了21.2个百分点，在同业中均继续保持较好水平。

定增预案披露。宁波银行披露定增预案，拟发行不超过7.8亿股，募集资金总额不超过100亿元，此次定增资金全部用于补充一级资本金。截止16年末公司核心一级资本充足率为8.55%，已近监管红线，定增完成后，公司的核心一级资本充足率将提升190BP至10.42%，规模扩张瓶颈得以突破。

投资建议：公司经营较稳健，拨备充足，业绩增速领先同业，定增完成后将进一步扩充资本。当前公司交易于8.03/7.99倍17/18PE、1.15/1.01倍17/18PB，维持推荐评级。",,东莞证券,推荐,[None],2017-05-02,,买入,1974227,pdf_downloads/2017/2017-05-02/002142-宁波银行(002142)2016年报及2017年一季报点评：业绩增速领先同业，维持推荐.pdf,002142,宁波银行,宁波银行(002142)2016年报及2017年一季报点评：业绩增速领先同业，维持推荐
刘志平,"事件

公司公布2016年年报。2016年公司实现归母净利润78.1亿元，同比增长19.35%；实现营收236.45亿元，同比增长21.16%。第四季度公司实现净利润14.67亿元，同比增长19.9%。期末总资产余额8850.2亿元，较年初增长23.53%。2016年加权平均净资产收益率为17.74%，同比提高0.06个百分点。期末不良率和拨备覆盖率分别为0.91%、351.42%，同比分别下降1BP、42.75个百分点。年度分红预案为每股现金分红0.35元(含税)，并以资本公积每10股转增3股。

公司公布2017年一季报。2017一季度年公司实现归母净利润23.59亿元，同比增长16.2%；实现营收64.33亿元，同比增长5.89%。期末总资产余额9195.83亿元，较年初增长3.91%。期末不良率和拨备覆盖率分别为0.91%、372.62%，环比分别持平、提升21.2个百分点。

公司公布非公开发行预案：拟非公开发行发行前公司A股总股本38.9979亿股的20%，即不超过7.87亿股（含）。募集不超过100亿元补充资本金。本次非公开发行的发行对象为不超过10名特定投资者。其中：宁波开发投资（第一大股东，发行前持股20%）认购不超过本次非公开发行股票总数的20%，认购金额不超过20亿元,且发行完成后宁波开发投资持有公司A股股票的比例不得超过20.00%；华侨银行（战略投资者，第二大股东）认购不超过本次非公开发行股票总数的20.00%，认购金额不超过20亿元，且发行完成后华侨银行及其QFII合计持有公司A股股票的比例不得超过20.00%。

点评

上市银行中业绩增速最高；中收高增长，。2016年公司实现归母净利润78.1亿元，同比增长19.35%，增速较前三季度持平，同比提升3个百分点。实现营收同比增长21.16%，营收增速表现较好，主要是一方面受规模扩张较快（资产规模同比增长23.5%）净利息收入表现好于同业（同比增长9%）；另一方面中收入保持较快增长（同比增长69%），其中手续费及佣金净收入同比增长51.55%，在营业收入中占比达25.57%，同比上升5.13个百分点。拨备计提保持审慎，期末拨贷比和拨备覆盖率为3.21%、351.42%，同比分别提升36BP、43个百分点。

全年息差表现低于预期。全年公司的净息差为1.95%，同比下降43BP，降幅高于同业主要是一方面资产端受同业资产大幅提升（同比增长63.6%）的影响收益率下降较多，负债端中同业负债占比较高致成本下降的相对较少。

资产质量表现优异；关注贷款和逾期贷均双降。期末公司的不良率为0.91%，分别较三季度末和年初持平、下降1BP。而且期末不良/90+逾期上升至121%，同比提升了38个百分点，不良确认上更加严格。期末关注类贷款和逾期贷款双降。公司的资产质量在上市银行中是最先出现拐点的，年报的资产质量更加夯实了公司资产质量已经无忧的预期。

一季度业绩超预期，息差环比明显提升。2017一季度公司实现归母净利润23.59亿元，同比增长16.2%，超出我们预期；实现营收同比增长5.89%，增速同比有明显的回落，主要是中收同比仅增长1%（主要受一季度投资收益损失1.5亿的影响）。但净利息收入同比增长7.7%、环比增长15.6%，主要归因于一季度公司的净息差表现较好，环比提升20BP，主要是一季度收缩同业资产和负债的结构调整。期末不良率和拨备覆盖率分别为0.91%、372.62%，环比分别持平、提升21.2个百分点，拨备计提保持审慎。同时关注类贷款较年初下降37BP至0.96%的行业最低水平。

投资建议和盈利预测

整体上公司年报和一季报表现靓丽，超出市场预期。公司经营稳健，MPA监管体制下规模增速将出现下降，但相比其他城商行，公司在零售业务、零售公司业务、中间业务等业务驱动上优势非常明显，盈利来源更加多元。同时公司的资产质量已无忧，拨备非常充足。此次定增补充资本金也为未来的资产扩张打开空间，预计2017年公司业绩同比增长22.3%。目前对应2017年PB为1.28倍（考虑公积金转增后），我们维持公司买入的投资评级。

风险提示

经济长期低迷，信用风险持续高发；公司的经营风险等。",,国金证券,买入,[None],2017-05-02,,买入,1974817,pdf_downloads/2017/2017-05-02/002142-宁波银行(002142)：关注和逾期贷款均双降；定增提升规模扩张空间.pdf,002142,宁波银行,宁波银行(002142)：关注和逾期贷款均双降；定增提升规模扩张空间
李锋,"一、事件概述

宁波银行1月13日发布2016年业绩快报，2016年归母净利润78.1亿元，同比增长19.35%；营业收入234.01亿元，同比增长19.91%；基本每股收益1.95元。

二、分析与判断

业绩稳中有升，战略投入推升成本

2016年归母净利润增速19.35%，全年营业收入同比增速19.91%，符合预期。受战略投入影响，成本收入比提高。2016年宁波银行推行大零售战略，资源投入与业务规模有所扩大，前三季度管理费用增速37.2%。测算全年同比增长约25%，成本收入比较年初提高1.7个百分点。

贷款与投资类共同推动资产扩张

2016年末资产规模同比增长23.4%，三季度资产规模环比仅增0.5%，四季度则环比增长5.5%，资产扩张加速。四季度贷款规模环比增长3.3%、预计贷款与投资类资产共同推动四季度资产扩张。负债端主要依靠存款发力，年末存款同比增长43%，预计占比达65%。

资产质量较好，拨备充实

宁波银行资产质量较好，预计依旧保持同业前列。2016年末不良贷款率0.91%，与前三季度保持统一水平，同比2015年末下降1BP。体现长三角区域风险正逐渐缓释。2016年末拨备覆盖率351.42%，较年初上升42.8个百分点，拨备充实。

三、盈利预测与投资建议

宁波银行资产质量与业绩增长均处于上市银行前列，给予强烈推荐评级。我们预测17-18年BVPS分别为13.47/15.81元，对应PB分别为1.3/1.1。

四、风险提示：经济超预期下行导致资产质量大幅恶化；政策出现重大变化。",,民生证券,强烈推荐,[None],2017-01-18,上调评级,买入,1913009,pdf_downloads/2017/2017-01-18/002142-宁波银行(002142)2016年业绩快报点评：业绩稳中有升，资产质量较优.pdf,002142,宁波银行,宁波银行(002142)2016年业绩快报点评：业绩稳中有升，资产质量较优
戴志锋,"投资要点

快增持续。营收全年同增19.9%，利润同比增19.3%；符合我们之前预测20.9%。1Q16、1H16、1-3Q16营收分别为同比增加38.1%、33.8%、27.1%。1Q16、1H16、1-3Q16利润同比增15.9%、16.5%、19.2%。

负债端存款增速快，资产端贷款增速稳健。1Q16、1H16、1-3Q16、2016贷款同比增速分别为23.9%、21.9%、21.2%、18.3%；存款同比增速分别为28.9%、34.7%、36.%、43.8%；贷存比分别为60.6%、58.5%、60%、59.1%。

资产质量良好，不良净生成平稳。根据宁波银行增速特征，假设2016年拨备前利润与营收增速一致，估算出1Q16、2Q16、3Q16、4Q16单季年化分别为0.82%、1.24%、0.50%、0.86%，全年不良净生成率0.85%。1Q16-4Q2016不良率均为0.91%。

4季度不良核销力度加大。由单季度营收与净利润环比增速差（-26%），可知4季度拨备计提力度加大，而拨备覆盖率环比下降17%至351%，4季度拨备减少1.15亿元；表明4季度核销力度加大并大于拨备计提。

截至2017年1月13日交易价格预测2017PB1.20倍，高于城商行平均水平1.11倍。

投资建议

继续推荐。宁波是我们持续推荐的两只银行股之一（中信+宁波）。持续看好它的逻辑，在于它的独特性：一是真正的民营银行，二是真正经历了周期的考验，支撑其高估值。

风险提示：经济下滑超预期。",,东吴证券,买入,[None],2017-01-17,,买入,1912004,pdf_downloads/2017/2017-01-17/002142-宁波银行(002142)2016年快报点评：快增持续，资产质量良好.pdf,002142,宁波银行,宁波银行(002142)2016年快报点评：快增持续，资产质量良好
李少君,"一、事件概述

宁波银行10月21日晚发布了2016年三季度报告，前三季度归属于母公司所有者的净利润为63.43亿元，较上年同期增19.22%；营业收入为179.4亿元，较上年同期增27.01%；基本每股收益为1.63元。

二、分析与判断

规模扩张与非息收入驱动业绩

前三季度归母净利润同比增长19.22%。规模增长与非息收入分别贡献28.1、16.1个百分点。三季度末生息资产同比增长27.3%。净息差与计提拨备为拖累业绩增长的因子，分别影响17.3和13.2个百分点，但环比来看对盈利的影响略有下降。三季度净息差2.00%，环比下降4BP，息差降幅有所收窄。前三季度计提拨备40亿元，同比增长63.9%；三季度单季信贷成本下降14BP至1.72%。

收入结构优化，轻资本有所成效

前三季度非息收入占比28.1%，与上半年相比基本持平；非息收入继续高增长，同比增速102.4%。其中，受益于投行、托管、资管及信用卡等中间业务盈利能力提升，手续费净收入同比增长61.4%；受益于债券、贵金属业务收入增加，其他非息收入由负转正，同比上升5.6个百分点。三季度末核心一级资本充足率、核心资本充足率继续提高，分别上升4、6BP，轻资本战略有所成效。

资产质量趋稳，拨备水平充足

不良生成继续放缓，资产质量趋稳。三季度末不良率0.91%，同比上升3BP，连续两季度持平；关注贷款率1.41%，环比下降25BP。我们测算前三季度不良净生成率0.83%，环比下降24BP。

拨备水平稳步提升，三季度末拨备覆盖率368.75%，环比上升25个百分点；拨贷比3.35%，环比上升22BP。

三、盈利预测与投资建议

宁波银行资产质量处同业较好水平，我们看好其盈利增长及轻资本战略的进一步推进，维持谨慎推荐评级。我们预测16-18年BVPS分别为11.75/13.42/15.66元，对应PB分别为1.4/1.2/1.0。

四、风险提示：经济超预期下行导致资产质量大幅恶化；政策出现重大变化。",,民生证券,谨慎推荐,[None],2016-10-26,,增持,1874969,"pdf_downloads/2016/2016-10-26/002142-宁波银行(002142)2016年三季报业绩点评：业绩持续增长,资产质量趋稳.pdf",002142,宁波银行,"宁波银行(002142)2016年三季报业绩点评：业绩持续增长,资产质量趋稳"
戴志锋,"靓点：1、不良净生成、关注类贷款环比下降；2、净息差环比持平；不足：企业贷款增速放缓，中间业务未持续超高增长。

我们九月底将宁波银行纳入研究所十月份的十大金股，逻辑是看好其弹性：一是业绩弹性，16年业绩能保持近20%增长，资产质量稳定后，拨备释放能保证17年的利润增长；二是股价弹性，前期宁波和银行板块有所调整，我们看好银行股年底表现，而宁波会是弹性最好的品种。从中长期看，宁波基本面优质体现在它的两个独特性上：一是真正的民营特点的银行；二是真正经历个一个周期验证的。

投资要点

同比来看，规模扩张持续贡献盈利增速，息差同比持续降低；环比来看，规模增速环比降低，息差变动则由负转正。前三季度净利息收入同比增长10.9%，比年中增速微降（13.4%），三季度生息资产同比增长28.5%，扩张速度与年中基本持平，其中，企业贷款增速较年中放缓（30%vs42%），个人贷款增速增大（4.75%vs-9.3%），测算累积年化净息差同比降低40bps，对净利息收入增速负向贡献较年中略微增大；受规模环比增速降低影响，单季净利息收入环比增长6%，较上季度7.4%微降，规模环比增速降低（0.65%vs2.86%），主要是买入返售环比降低64.9.%，贷款环比增速则与年中持平，单季息差环比增加，测算单季年化净息差2.07%，环比增3bps。

中收依然保持较快增速，累计增速较年中略降，单季增速降幅较大。前三季度净非息收入同比增长103%，其中净手续费收入增长61.4%，较年中79.5%的增速略降；单季净非息收入同比增长15%，其中净手续费收入同比增长34%，增速较年中降低约一半（71.4%)。

资产质量持续优秀，不良生成率环比降低。三季度末不良率0.91%，与2季度持平，测算单季不良生成率0.51%，环比降低63bps，关注类贷款占比1.41%，环比降低25bps，拨备非常充足，三季度末拨备覆盖率368.8%，环比增长25个百分点，拨贷比3.35%，环比增长22bps。

通过资本内生性积累提升资本充足率。三季度末核心一级资本充足率8.74%，环比上升6bps，一级资本充足率9.67%，环比上升4bps，资本充足率12.51%，环比上升1bps。

大股东持股变化。与上季度末相比，宁波富邦控股集团有限公司减持598万股，持股比例降低0.16%至3.62%，全国社保基金一零一组合增持965万股，持股比例增加0.25%至1.66%，中央汇金持股0.54亿，占比1.38%，持股比例不变。预计减持为国家队分给各家机构的股份。

投资建议：

现价对应16年P/E8.0，P/B1.36。预测2016/17年净利润增速20.4%/16.2%,EPS与BVPS分别为2.02/2.35与11.8/14.1。宁波是我们一直持续推荐品种，从中长期看，宁波基本面优质体现在它的两个独特性上：一是真正的民营特点的银行；二是真正经历个一个周期验证的。近期好其弹性：一是业绩弹性；二是股价弹性，将宁波银行纳入研究所十月份的十大金股。

风险提示：经济下滑超预期。",,东吴证券,买入,[None],2016-10-25,,买入,1873365,"pdf_downloads/2016/2016-10-25/002142-宁波银行(002142)2016三季报点评：高弹性,十月份的十大金股.pdf",002142,宁波银行,"宁波银行(002142)2016三季报点评：高弹性,十月份的十大金股"
"张明,王月香","事项：宁波银行公布2016年半年报，实现营业收入179.40亿元，同比增长27.0%，归属母公司净利润63.43亿元，同比增长19.2%。不良贷款率0.91%，拨备覆盖率368.75%。

主要观点

1、利润增长提速，结构持续优化

公司1-9月份实现净利润63.43亿，同比增长19.2%，其中，三季度单季度利润增速24.6%，持续高于一二季度，无论是前三季度总体还是三季度单季度，净利润增速都达到近三年最高，显示增长提速。

实现营业收入179.40亿，同比增速27.0%，三季度单季度营收增速15.2%，比二季度降低约15个百分点，营收低增长与利润高增长的差额，一方面体现出营改增对收入增速的影响较大，另一方面显示了信用成本的降低。

利息净收入同比增长10.89%，较二季度有所降低，但仍处同业较高水平。单季度利息净收入增速降低趋缓，预计营改增的影响较大。净息差2.00%，较二季度仅下降4bps，初现稳态。

实现手续费和佣金净收入46.90亿，同比增长61.4%，三季度单季度增速有所下降，但仍处于高位，手续费的高速增长使得公司的利润结构持续优化，手续费收入占比较二季度继续提高26。14%，收入和利润结构持续优化。

2、拨备不断充实，资产质量压力减轻

不良贷款率0.91%，与二季度持平，拨备覆盖率368.75%，继续保持同业内的高水平，拨贷比3.35%，持续上升，拨备继续充实。

关注类贷款占比1.41%，降至14年以来最低水平，从关注类贷款指标看，公司的资产质量压力减轻。

3、资产负债结构不断优化

总资产规模较年初增长16.9%，三季度增速明显放缓，其中贷款规模增长14.1%，证券投资类增长19.6%，同业资产较半年末大幅压缩112亿，仅增长3.6%，结构上看，贷款占比小幅上升，同业下降，投资类基本不变。资产结构的调整有利于提高资产收益率。

总负债较年初增长17.3%，其中存款增长37.4%，同业负债小幅增长4.7%，应付债券规模持续压缩，较年初下降236亿，负债结构中，存款占比的提升有利于降低资金成本。

4、综合考虑公司盈利的高速增长，以及资产质量前瞻性指标的向好，我们预计公司2016-2017年摊薄后EPS分别为1.98元、2.34元，净利润增长分别为18%、19%。我们认为公司合理估值在1.5倍PB左右，维持“推荐”评级，目标价18元。

5、风险提示：宏观经济恶化，资产质量加速恶化。",,华创证券,推荐,[None],2016-10-25,,增持,1873782,"pdf_downloads/2016/2016-10-25/002142-宁波银行(002142)三季报点评：净利润增长提速,资产质量压力减轻.pdf",002142,宁波银行,"宁波银行(002142)三季报点评：净利润增长提速,资产质量压力减轻"
"罗毅,沈娟,郭其伟","业绩高速增长，资产质量边际改善

前三季度归母净利润63.43亿元、拨备前利润总额115.56亿元，营收179.40亿元，分别同比增长19.2%、27.8%、27.0%，增速在上市银行保持领先地位。年化ROA1.09%，年化加权ROE19.72%，盈利增长稳健。在行业增速普遍下滑的环境下，公司归母净利润同比增速较上半年逆市提升2.7个百分点，主要得益于资产质量的边际改善。第三季度信贷成本率和不良生成率为1.76%和0.51%，分别较第二季度下降14bp和51bp。经过过去2-3年的风险集中暴露，江浙地区不良贷款风险已经出现企稳迹象。未来区域风险的持续化解可望成为推升利润增速的主要因素。0.91%的较低不良率和369%的较高拨备覆盖率给予公司充裕的缓冲空间，不良压力小于同业。

大零售战略优势突出，中间业务收入贡献提升

三季度末生息资产同比增长27.3%，较二季度末提升2.7个百分点，继续高增长。净利差、净息差为1.99%和2.00%，分别较二季度末小幅下降6bp和4bp。宁波银行大零售战略已经进入良性发展轨道，小微金融竞争优势突出。宁波自贸区获批、区域经济回暖等因素叠加下，地方中小企业经营情况改善，形成对零售金融的强烈需求，预计宁波银行资产增速将继续领跑上市银行。中间业务收入贡献提升，手续费及佣金净收入同比增长61.4%，占营收比例为28.1%。公司拥有九大利润中心，后续消费金融、资管、直销银行子公司的落地，盈利来源将进一步多元化。

多管齐下补充资本，支撑资产快速增长

三季度末资本充足率、一级资本充足率和核心一级资本充足率分别为12.51%、9.67%、8.74%，满足监管要求。除了内生增长外，公司积极拓宽资本补充渠道，为资产增长形成有力支撑。公司拟发行不超过100亿元可转债、不超过49亿元优先股、不超过100亿元二级资本债和不超过100亿元绿色金融债。可转债于5月获得发审委审核通过。公司正在申请资本计量高级法，验收后资本管理能力将大大增强。

笃行大零售轻资本战略，维持“买入”评

公司笃行大零售轻资本战略，改革步伐加快。预计2016-2018年EPS为2.06/2.53/3.13元，对应PE为7.88/6.41/5.19。参考可比公司估值，给予目标价格区间17.87-20.25元，维持“买入”评级。

风险提示：不良风险超出预期，业绩增速不达预期。",,华泰证券,买入,[None],2016-10-24,,买入,1872556,"pdf_downloads/2016/2016-10-24/002142-宁波银行(002142)：资产质量边际改善,中间业务收入亮眼.pdf",002142,宁波银行,"宁波银行(002142)：资产质量边际改善,中间业务收入亮眼"
