author,content,filename,org_name,original_rating,pdf_link,publish_time,rating_adjust_mark_type,rating_changes,report_id,save_path,stock_code,stock_name,title
杨晖,2024年上半年，公司实现营业收入168.97亿元，同比+29.09%；归母净利润33.05亿元，同比+46.44%；扣非净利润35.16亿元，同比+44.37%；非经常损益-2.1亿元中捐款支出为1.75亿元。其中Q2公司实现营收86.7亿元，同比/环比分别+36.39%/+5.38%；单季度归母净利润18.84亿元，同比/环比分别+75.80%/+32.58%；单季度扣非净利润20.34亿元，同比/环比分别+76.03%/+37.25%。评论：产销数据方面：EVA 二季度产能利用率约86%，贡献业绩增量。Q2公司实现聚乙烯/聚丙烯销量分别为27.97/30.46万吨，环比-5.28%/+13.83%；实现焦炭销量为179.35万吨，环比+2.52%；实现纯苯/改质沥青/MTBE销量分别为1.53/3.73/2.44万吨，环比分别+91.25%/+32.74%/-10.62%。公司25万吨EVA装置于一季度投产，二季度实现EVA销量为5.84万吨，环比+342%，实现产能利用率86%。烯烃板块：烯烃价格上行而原料煤价格回落，价差改善明显。公司Q2外购气化原料煤价格约为523元/吨（基于一季度二季度外购原料煤量相等的假设），环比-77元/吨；Q2得益原油价格上行，公司实现聚烯烃外售价格约为7047元/吨，环比+324元/吨，若按烯烃原料煤单耗5计算，聚烯烃单吨价差上行约709元/吨。2024H1公司烯烃分部总计实现收益26.1亿元，同比+155%。焦化板块：双焦价格同时下滑，静待底部反转。公司Q2外购炼焦精煤价格约为1074元/吨（（基于一季度二季度外购原料煤量相等的假设），环比-82元/吨；Q2实现焦炭外售价格1386元/吨，环比-147元/吨。2024H1公司焦化分部总计实现收益7.9亿元，同比-31.1%。当前公司双焦盈利基本处于历史底部，短期关注冬储前夕钢厂集中补库或推动双焦价格反转，长期关注印度、东南亚地区钢铁需求增长下的焦煤格局重塑。内蒙烯烃项目投资建设按计划顺利推进，新疆项目环评信息首次公示。2024年5月内蒙子公司完成银团贷款业务办理，保障了内蒙项目建设后续资金需求；内蒙项目已完成投资付现70%。项目建设方面，2024年7月1日动力装置1#锅炉顺利点火，首套装置将按计划于10月投入试生产；2024年7月，根据新疆准东国家级经济技术开发区官网，新疆宝丰煤基新材料有限公司煤炭清洁高效转化耦合植入绿氢制低碳化学品和新材料示范项目环境影响评价公众参与第一次公示。建设内容包括4×100万吨/年甲醇制烯烃。新疆作为国内煤价+电价双重洼地，在疆开展煤制烯烃业务具有显著成本优势，看好公司新疆项目贡献业绩增长。投资建议：结合公司内蒙项目的四季度投产预期以及Q1双焦实际盈利情况，我们维持2024-2026年的归母净利润预期为86.31/142.00/142.75亿元，对应当前PE分别13x/8x/8x。参考公司历史估值和未来产能高增预期，我们给予公司2024年17倍目标P/E，对应目标价20.06元，维持“强推”评级。风险提示: 产能释放不及预期，宏观经济复苏不及预期，煤炭政策变动,,华创证券,强推,[None],2024-08-21,,买入,5727757,pdf_downloads/2024/2024-08-21/600989-宝丰能源（600989）：2024年中报点评：原料价格回落，二季度业绩改善明显.pdf,600989,宝丰能源,宝丰能源（600989）：2024年中报点评：原料价格回落，二季度业绩改善明显
"孙颖,聂磊",投资要点事件：8月12日，公司发布2024年半年度报告。2024年上半年，公司实现营收169.0亿元，同比+29.1%；实现归母净利33.0亿元，同比+46.4%；实现扣非归母净利润35.2亿元，同比+44.4%。其中Q2单季度实现营收86.7亿元，同比+36.4%，环比+5.4%；归母净利润18.8亿元，同比+75.8%，环比+32.6%，扣非归母净利润20.3亿元，同比+76.0%，环比+37.3%。烯烃：产品价差扩大，盈利能力持续向好。2024H1公司聚乙烯/聚丙烯实现收入40.9/38.2亿元，同比+69.3%/+75.5%；Q2单季收入20.4/20.7亿元，环比-0.1%/+18.5%。具体来看：产销方面，2024H1聚乙烯/聚丙烯产量为56.9/57.5万吨，同比+69.2%/+81.8%；销量为57.5/57.2万吨，同比+68.4%/+82.3%；2024年Q2单季聚乙烯/聚丙烯产量为28.1/30.1万吨，环比-2.0%/+9.5%；销量分别为28.0/30.5万吨，环比-5.3%/+13.8%，伴随宁东三期烯烃项目23年9月投产，公司烯烃产销量实现大幅度增长。价格方面，报告期内聚烯烃产品价格反弹上行，一季度受原油价格上涨等成本端支撑利好；二季度开始国内聚烯烃装置检修集中，产品供应偏紧，聚烯烃价格上涨。根据wind，2024H1聚乙烯/聚丙烯均价为8340/7482元/吨，同比+3.5%/-0.9%；2024年Q2单季均价为8486/7592元/吨，环比+3.6%/+3.0%。价差方面，2024H1聚乙烯/聚丙烯价差分别为4276/3417元/吨，同比+33.8/+27.2%；2024年Q2单季价差分别为4524/3631元/吨，环比+12.5%/+13.5%，2024H1煤炭价格回落，烯烃盈利能力回升。焦炭：焦炭市场需求承压，价格反弹力度有限。2024上半年公司焦炭板块实现收入51.7亿元，同比-3.4%；2024年Q2单季实现收入24.9亿元，环比-7.3%。具体来看：产销方面，2024年上半年焦炭产量和销量分别为349.6/354.3万吨，同比+2.9%/+3.7%；2024年Q2单季产量和销量分别为177.7/179.4万吨，环比+3.3%/+2.5%。价格方面，根据wind，2024年上半年焦炭2287元/吨，同比-8.4%；2024年Q2单季度2244元/吨，环比-3.7%。价差方面，2024年上半年焦炭价差65元/吨，同比-69.7%；2024年Q2单季回升至132元/吨。24H1房地产新开工面积下行，钢企盈利收缩，焦炭市场下游需求承压。二季度，行业内主动减产现象增加，供给端有所收紧，带动4月焦炭价格反弹，但需求偏弱下，价格整体反弹力度有限，5-6月价格整体处于横盘震荡状态。内蒙项目即将投产，新疆项目有望打开成长空间。公司构筑“煤-焦-烯烃”一体化产业链。烯烃方面，宁东三期投产带来甲醇新增产能150万吨，烯烃新增产能100万吨/年、聚乙烯和聚丙烯新增产能90万吨/年；内蒙古一期260万吨/年煤制烯烃及配套40万吨/年绿氢耦合制烯烃预期2024年10月投产，目前已完成投资付现70%。7月30日新疆宝丰煤基新材料有限公司煤炭清洁高效转化耦合植入绿氢制低碳化学品和新材料示范项目环境影响评价公众参与第一次公示，项目拟投地点为新疆准东经济技术开发区将军庙矿区5号化工产业园区，项目组成包括4*280万吨/年甲醇、4*100万吨/年甲醇制烯烃、4*110万吨/年烯烃分离、3*65万吨/年聚丙烯、3*65万吨/年聚乙烯，1套25万吨/年C4制1-丁烯装置，1套29万吨/年蒸汽裂解装置，1套3万吨/年超高分子量聚乙烯装置，1套25万吨/年EVA装置，1套5万吨/年MMA/PMMA装置及配套的公用工程、辅助工程和储运设施等，有望打开公司成长空间。焦炭方面，公司六套干熄焦项目已全部投产，焦炭产品由湿熄焦全部转产为干熄焦，有望更好地满足下游钢企焦企的需求。其他方面，报告期内25万吨/年EVA项目顺利投产，进一步丰富了公司产品矩阵。公司成长动能充足，未来伴随内蒙一期投产，盈利有望拾级而上。盈利预测与投资建议：公司是国内煤化工龙头企业，煤制烯烃规模全球领先，伴随内蒙一期产能的释放，未来成长性显著。考虑到焦炭需求承压，价格反弹力度有限，我们略微下调公司的盈利预测，调整后预计公司2024-2026年归母净利润为81.7/135.1/142.9亿元（原2024-2026为87.7/139.9/147.6亿元），对应PE分别为13.8/8.3/7.9倍（对应2024/8/19收盘价），维持“买入”评级。风险提示：油价波动；产品价格大幅波动；下游需求不及预期；项目投产不及预期；信息更新不及时等。,,中泰证券,买入,[None],2024-08-21,,买入,5727373,pdf_downloads/2024/2024-08-21/600989-宝丰能源（600989）：烯烃量利齐升，新疆项目望打开成长空间.pdf,600989,宝丰能源,宝丰能源（600989）：烯烃量利齐升，新疆项目望打开成长空间
"wei liu,Weirong Sun,Huaichao Zhuang",宝丰能源公布2024年中期报告。2024年H1公司实现营业收入168.97亿元，同比增长29.09%；实现归母扣非净利润35.16亿元，同比增长44.37%。2024年H1营业收入增长主要原因是公司聚烯烃产能、产销量同比增加。1）分产品看，聚乙烯、聚丙烯、焦炭、纯苯、改制沥青及MTBE销售收入分别变化69.25%、75.48%、-3.40%、-28.90%、-11.41%、6.22%至40.87、38.15、51.67、1.70、2.91、3.17亿元，销售均价（不含税）分别变化0.50%、-2.08%、-6.89%、25.38%、-12.90%、-5.71%至0.71、0.67、0.15、0.73、0.44、0.61万元/吨。EVA销售收入6.31亿元，销售均价（不含税）0.88万元/吨。2）2024年H1公司销售毛利率和销售净利率分别同比变化5.80和2.32个百分点至33.60%和19.56%。3）三项费用率同比增长2.83个百分点至7.53%。其中销售、管理（包括研发）、财务费用率同比增长0.08、1.44、1.31个百分点至0.37%、4.92%、2.24%。4）在建工程期末金额193.73亿元，同比增长22.44%，较2023年年末增幅34.64%，主要是内蒙新建项目投资增加。公司新项目稳步推进，积蓄持续成长动能。1)宁东三期烯烃项目从2023年9月中旬投入试生产，工艺技术指标不断优化，生产运行总体平稳，配套的25万吨/年EVA装置顺利投产。2)内蒙烯烃项目投资建设按计划顺利推进，已完成投资付现70%，2024年7月1日动力装置1#锅炉顺利点火，完成了内蒙项目试车工作的首个重大里程碑节点，首套装置将按计划于10月投入试生产。3)公司合成氨项目、粗苯提取噻吩技术改造项目先后建成投产，针状焦、醋酸乙烯等重点建设项目有序推进，宁东四期烯烃项目前期准备工作全面启动。公司加强精细化管理，深挖降本增效潜能。1)公司综合能耗持续优化，领跑煤制烯烃行业，2024年上半年，MTO级甲醇综合吨能耗较计划下降2.73%，聚烯烃产品综合吨能耗较计划下降4.22%，在煤制烯烃行业中综合能耗达到最低水平。2)公司优化调整煤炭采购区域，降低入炉煤综合成本，2024年上半年，公司采购疆煤占烯烃用煤的比例相比2023年提升近7个百分点。盈利预测与参考评级。我们预计2024-2026年公司EPS分别为1.17、1.46、1.76元（原2024-25预测为1.28、1.57元），参考同行业可比公司估值，我们认为合理的估值为2024年18倍PE（原为2023年10x），对应目标价21.06元，维持“优于大市”评级。风险提示。在建项目进度低于预期，产品和原料价格波动。,,海通国际证券,优于大市,[None],2024-08-19,,买入,5725339,pdf_downloads/2024/2024-08-19/600989-宝丰能源（600989）公司半年报点评：24H1归母扣非净利润同比增长44.37%，看好内蒙新项目投产带来的成长性.pdf,600989,宝丰能源,宝丰能源（600989）公司半年报点评：24H1归母扣非净利润同比增长44.37%，看好内蒙新项目投产带来的成长性
杨伟,事件概述公司发布 2024 年半年度报告。2024 年上半年，公司实现营收 168.97 亿元，同比+29%；实现归母净利润33.05 亿元，同比+46%，EPS为0.45元；其中 Q2 单季度实现营收86.70亿元，同比+36%，环比+5%；归母净利润 18.84亿元，同比+76%，环比+33%；扣非归母净利润20.34亿元，同比+76%，环比+37%。分析判断:油价支撑产品价格，煤价环比下跌，烯烃板块总体量价齐升2024H1，公司主要产品聚烯烃产量 122.27 万吨，同比增长 87%，烯烃产量大幅增长主要原因系宁东三期煤制烯烃项目产能逐步释放。产品价格方面，上半年原油价格整体处于高位，于成本端支撑烯烃价格。据Wind数据，2024H1，布伦特原油均价为84.27美元/桶，同比增长5.64%；二季度油价环比增长，2024Q1/Q2布伦特原油均价为83.39/85.15美元/桶，分别环比增长4.54%/2.11%。2024H1，聚乙烯（以 LLDPE 薄膜料为例）均价为 8417 元/吨，同比+2.6%；聚丙烯（以均聚拉丝料为例）上半年均价7505 元/吨，同比-0.4%；2024Q1/Q2，聚乙烯均价分别为8244/8586元/吨，分别环比+0.2%/+4.1%;聚丙烯均价分别为7387/7622元/吨，分别环比-2.0%/+3.2%。原料端，上半年主要原料煤炭价格出现回落，以鄂尔多斯市场 5500 大卡动力煤为例，上半年市场均价 658 元/吨，同比-1.7%；一季度均价671元/吨，环比-2.7%；二季度均价646元/吨，环比-3.8%。总体来看，上半年油价上升支撑产品价格，煤价下行扩大烯烃价差，公司烯烃板块毛利率为35.63%。焦炭利润承压，EVA产品达产提升附加值2024H1，房地产新开工面积延续下行，钢企盈利收缩，导致焦炭下游需求承压，焦炭行业产销同比下行。全国焦炭产量24182万吨，同比下降0.9%；全国生铁产量43562万吨，同比下降3.6%，粗钢产量53057万吨，同比下降1.1%。2024H1，公司焦炭产量为349.6万吨，同比+3%，价格1458元/吨，同比-7%。公司三期烯烃项目配套的25万吨/年EVA装置已达产，产出合格光伏级EVA产品，上半年共开发新客户58家，涉及光伏胶膜、发泡鞋材、热熔胶等领域，上半年EVA产品产量为7.92万吨，不含税均价为8813元/吨，EVA产品达产有效提升了公司烯烃产品附加值。内蒙一期将于10月试生产，新疆基地即将启动内蒙烯烃项目有望年内投产贡献增量：内蒙一期260万吨/年煤制烯烃及配套40万吨/年绿氢耦合制烯烃项目自2023年启动建设，资金配套方面，2024 年 5 月内蒙子公司完成银团贷款业务办理，保障了内蒙项目建设后续资金需求; 截至2024年8月12日，内蒙项目已完成投资付现70%。项目建设方面，2024年7月1日动力装置1#锅炉顺利点火，首套装置将按计划于10月投入试生产。7月30日，新疆宝丰煤基新材料进行煤化工项目环评公示，项目包括4×280万吨/年甲醇、4×100万吨/年甲醇制烯烃、4×110万吨/年烯烃分离、3×65万吨/年聚丙烯、3×65万吨/年聚乙烯，1套25万吨/年C4制1-丁烯装置，1套29万吨/年蒸汽裂解装置，1套3万吨/年超高分子量聚乙烯装置，1套25万吨/年EVA装置，1套5万吨/年MMA/PMMA装置及配套的公用工程、辅助工程和储运设施等，新疆拥有丰富的煤炭资源，价格低廉，公司就地建设煤化工项目将形成进一步价差优势，增厚利润。投资建议根据2024年中报，我们调整盈利预测，预计公司2024-2026年营业收入分别为376.37/556.04/618.54亿元（原预测2024-2025年为385.67/552.35亿元），归母净利润分别为83.16/134.74/150.41亿元（原预测2024-2025年为95.34/146.83亿元），EPS分别为1.13/1.84/2.05元（原预测2024-2025年为1.30/2.00元），对应8月14日15.09元收盘价，PE分别为13/8/7倍。我们看好公司长期成长，维持 “增持”评级。风险提示油价大幅波动；原材料价格大幅波动；下游需求不及预期；项目投产不及预期等。,,华西证券,增持,[None],2024-08-14,,增持,5720305,pdf_downloads/2024/2024-08-14/600989-宝丰能源（600989）：内蒙一期将于10月试生产，布局新疆再迎成长.pdf,600989,宝丰能源,宝丰能源（600989）：内蒙一期将于10月试生产，布局新疆再迎成长
"倪吉,顾雪莺",业绩同比增长。公司披露2024年中报，报告期内实现营业收入 168.97亿元，同比增长29.09%；实现归母净利润33.05亿元，同比增长46.44%。2024年二季度实现营业收入86.70亿元，同比增长36.39%；实现归母净利润18.84亿元，同比增长75.75%。收入快速增长的主要原因是公司聚烯烃产能释放，使得主要产品产销量提升。利润大幅增长的主要原因除了产品产销量提升以外，作为原料的炼焦煤、气化煤、动力煤等价格均出现明显下跌，使得产品毛利率提升。内蒙项目投产在即。公司内蒙聚烯烃项目共300万吨产能，目前已进入试车工作，计划于10月投入试生产。内蒙项目使用DMTO三代技术，单耗相比早期装置进一步降低。而且内蒙项目所在的鄂尔多斯比银川更靠近华北、华东等主要产品销售区域。因此预计内蒙项目的单位盈利比银川基地更高，投产后有望推动公司营收与利润实现大幅增长。新疆规划打开新空间。近日新疆准东经济技术开发区公开了《新疆宝丰煤基新材料有限公司煤炭清洁高效转化耦合植入绿氢制低碳化学品和新材料示范项目》环评公示，项目包括1120万吨甲醇、400万吨甲醇制烯烃及下游195万吨聚乙烯、195万吨聚丙烯、25万吨1-丁烯、25万吨EVA、5万吨MMA/PMMA等装置。我们在前期深度报告《新疆有望成为煤制烯烃新基地》中分析过，受益于显著低于疆外地区的煤炭价格，准东地区煤制烯烃具有极强的成本优势。如果公司新疆项目落地，有望获得比内蒙基地投产更加显著的成长。盈利预测与投资建议根据2024年上半年行业情况，我们调整了公司产品与原料价格、主要产品的产销量、费用率。我们预测公司 2024-2026 年 EPS 分别为1.11、1.72和1.84元（原预测 1.11、1.77 和 1.93 元），可比公司 24年平均 PE 为 13 倍，考虑到公司未来业绩增速高于可比公司，给予 30%的溢价，对应目标价为 18.76元，维持买入评级。风险提示煤炭价格大幅波动；聚烯烃需求下滑；项目进展不及预期。,,东方证券,买入,[None],2024-08-13,,买入,5719098,pdf_downloads/2024/2024-08-13/600989-宝丰能源（600989）：内蒙项目投产在即，新疆项目有望打开新空间.pdf,600989,宝丰能源,宝丰能源（600989）：内蒙项目投产在即，新疆项目有望打开新空间
张绪成,烯烃产能释放叠加煤价回落，公司业绩稳步提升，维持“买入”评级公司发布2024年中报，2024H1公司实现营业收入169亿元，同比+29.1%；实现归母净利润33亿元，同比+46.4%；实现扣非后归母净利润35.2亿元，同比+44.4%。单Q2来看，公司实现营业收入86.7亿元，环比+5.4%；实现归母净利润18.8亿元，环比+32.5%，实现扣非后归母净利润20.3亿元，环比+37.3%。公司产能稳定释放，我们维持2024-2026年盈利预测，预计2024-2026年归母净利润85.6/123.6/148.5亿元，同比+51.4%/+44.4%/+20.2%；EPS为1.17/1.68/2.03元，对应当前股价PE为13.1/9.1/7.5倍。伴随公司产能稳定释放，成本端亦受益于煤价中枢回落，叠加内蒙烯烃项目有望贡献产量增量，公司未来业绩高成长可期，维持“买入”评级。聚烯烃产销量同比大增，焦炭产量提升叠加成本回落对冲价格下滑影响（1）聚烯烃业务：产销量方面，2024H1公司聚乙烯产/销量56.9/57.5万吨，同比+69.2%/+68.4%，聚丙烯产/销量57.5/57.2万吨，同比+81.8%/+79.2%；单季度来看，2024Q2公司聚乙烯产/销量28.1/28万吨，环比-2%/-5.3%，聚丙烯产/销量30.1/30.5万吨，环比+9.5%/+13.8%。价格方面，2024H1聚乙烯/聚丙烯平均售价为7107.7/6668.1元/吨，同比+0.5%/-2.1%；单季度来看，2024Q2聚乙烯/聚丙烯平均售价为7300.7/6794.5元/吨，环比+5.4%/+4.2%。利润方面，2024H1公司气化原料煤平均采购单价为561.7元/吨，同比-15.5%，在聚烯烃售价相对稳定且成本端下滑明显的情况下，叠加量端高增，上半年聚烯烃业务盈利弹性有所体现。（2）焦炭业务：产销量方面，2024H1公司焦炭产/销量为349.6/354.3万吨，同比+2.9%/+3.7%；单季度来看，2024Q2焦炭产/销量为177.7/179.4万吨，环比+3.3%/+2.5%。价格方面，2024H1焦炭平均价格为1458.2元/吨，同比-6.9%；单季度来看，2024Q2焦炭平均价格为1385.7元/吨，环比-9.6%。利润端方面，生产材料炼焦精煤2024Q1平均采购单价为1115.4元/吨，同比-12.9%，焦炭产量提升及生产成本回落对冲价格下滑影响。宁东三期项目产量稳步释放，内蒙古一期烯烃项目投资建设按计划顺利推进（1）宁东三期项目产量稳步释放：宁东三期100万吨烯烃项目自2023年9月中旬投入试生产以来，生产运行总体平稳，烯烃产量稳步释放；报告期内三期烯烃项目配套的25万吨/年EVA装置顺利投产，已完成从发泡料到光伏料的生产过渡，产出合格光伏级EVA产品，并达到设计生产能力。（2）内蒙古一期260万吨/年煤制烯烃和配套40万吨/年植入绿氢耦合制烯烃项目投资建设按计划顺利推进：2024年5月内蒙子公司完成银团贷款业务办理，内蒙项目已完成投资付现70%，首套装置将按计划于10月投入试生产。（3）宁东四期项目前期准备工作全面启动：目前宁东四期50万吨烯烃项目建设已纳入公司2024年度预算，前期准备工作全面启动，未来公司烯烃产能有望进一步提升。风险提示：产品价格下跌；原材料价格上涨；新建项目不及预期等风险。,,开源证券,买入,[None],2024-08-13,,买入,5718947,pdf_downloads/2024/2024-08-13/600989-宝丰能源（600989）：2024年中报点评报告：烯烃产能释放叠加煤价回落，公司业绩稳步提升.pdf,600989,宝丰能源,宝丰能源（600989）：2024年中报点评报告：烯烃产能释放叠加煤价回落，公司业绩稳步提升
"杨林,余双雨",公司2024年二季度营收及净利同环比提升。公司2024年二季度营收86.7亿元（同比+36%，环比+5%），归母净利润18.8亿元（同比+76%，环比+33%），扣非归母净利润20.3亿元（同比+76%，环比+37%）。盈利提升主要是由于产能扩张后聚烯烃产销量提升，且烯烃价格受油价支撑及二季度供给有所收缩带来的价格提升。2024年二季度销售毛利率/净利率为38%/22%，期间费用率9%，同环比提升。公司主营产品聚烯烃产销量及价格同比提升。宁东三期100万吨烯烃项目贡献产能增量，2024年二季度公司聚烯烃产销量同比提升，同时，聚烯烃价格同环比提升。一季度聚烯烃价格偏强，主要是由于原油价格上涨传导；二季度聚烯烃价格延续上涨趋势，除成本支撑因素之外，还受到国内聚烯烃装置检修集中，产品供应偏紧的影响。焦炭需求继续承压。2024年二季度公司焦炭产销量同比略有下降而环比有所提升。焦炭产销量同比下行，价格环比下跌，主要是由于下游需求承压，房地产新开工面积依然存在下行风险，钢企盈利收缩，部分独立焦化企业出现亏损。原料煤价格下跌助力煤制烯烃盈利能力回升。2024年上半年公司主要原材料气化原料煤/炼焦精煤/动力煤的平均采购单价为561/1115/428元/吨，同比-16%/-13%/-18%。目前夏季高温支撑煤炭需求，后续电力需求下降后动力煤价格或将承压。焦煤下游钢材市场处于淡季，预期短期内仍将偏弱运行。EVA达产提升烯烃附加值。宁东三期烯烃项目配套的25万吨/年EVA装置于今年上半年投产，并完成从发泡料到光伏料的生产过渡，产出合格光伏级EVA产品，达到设计生产能力，有效提升了公司烯烃产品附加值。内蒙烯烃项目顺利推进，新疆项目环评公众参与公示。2024年7月1日内蒙项目动力装置1#锅炉顺利点火，首套装置将按计划于10月投入试生产。2024年7月30日，新疆宝丰煤基新材料有限公司煤炭清洁高效转化耦合植入绿氢制低碳化学品和新材料示范项目环境影响评价公众参与第一次公示，该项目包括甲醇、聚乙烯、聚丙烯、1-丁烯、超高分子量聚乙烯、EVA等。风险提示：项目投产不及预期；原材料价格上涨；下游需求不及预期等。投资建议：公司主营产品聚烯烃产能高速扩张，为未来利润增量的核心来源，同时公司自有煤矿构筑坚固利润底。我们维持公司2024-2026年归母净利润预测为82.91/138.72/141.04亿元，对应EPS为1.13/1.89/1.92元，当前股价对应PE为13.5/8.1/7.9X，维持“优于大市”评级。,,国信证券,优于大市,[None],2024-08-13,,买入,5718853,pdf_downloads/2024/2024-08-13/600989-宝丰能源（600989）：二季度盈利同环比提升，聚烯烃量价齐升.pdf,600989,宝丰能源,宝丰能源（600989）：二季度盈利同环比提升，聚烯烃量价齐升
