author,content,filename,org_name,original_rating,pdf_link,publish_time,rating_adjust_mark_type,rating_changes,report_id,save_path,stock_code,stock_name,title
宫模恒,"北新建材(000786)
事件： 公司 2017 年上半年实现营收 45.62 亿元，同比增长 26.02%；归母净利润 6.82 亿元，同比增长 48.51%； EPS 为 0.38 元/股， 同比增长17.23%。
主要观点：
营收增速走高， 少数股东权益大幅减少
2017H1， 公司主营石膏板销量稳增， 营收增速走高，达到 26.02%。 报告期内由于石膏板原材料价格上涨， 公司毛利率同比下降 3.42 个百分点，录得 31.01%。 上半年公司三费支出占营收比下降， 同比减少 2.25 个百分点，主要是受到报告期内营收规模扩大， 管理费用受会计准则调整影响税金支出被移出，以及财务费用受益于费用化利息支出减少等因素影响。2017H1，公司归属少数股东净利润减少 1.46 亿，归母净利润同比增长 48.51%，主要是公司 16 年 10 月完成对泰山石膏 35%少数股东权益收购，报告期内少数股东权益减少所致。
全资控股泰山石膏实现强化协同，行业龙头开启新一轮产业布局
16 年下半年公司实现对泰山石膏的全资控股，两大石膏巨头间的协同进一步加深，公司在石膏板行业的布局能力得到强化，新一轮产能扩张规划已开启。 此次少数股权收购的完成， 将显着增厚公司归母净利润；此外，通过收购方案， 原泰山石膏股东目前合计持有公司 20.94%股权，有助于北新和泰山两大石膏板巨头业务协同的加强。 报告期内北新建材和泰山石膏完成了对新一轮石膏板产业布局规划的制定， 计划进一步将产能扩大至 30亿平方米，并围绕“一带一路”，推进国际化进程。 我们认为， 公司有望实现强者恒强， 在行业内的龙头地位稳固。
石膏板需求有支撑， 应用场景有望突破
目前三四线城市去库存情况良好，石膏板市场短期需求仍有支撑，考虑到环保趋严及应用场景的突破，未来需求前景向好。 短期内， 石膏板需求端主要受益于地产周期拉长， 以及三四线城市在去库存上的良好态势， 1-7月全国商品房销售面积 86351 万平方米，同比增长 14.0%，市场需求仍有支撑。 长期来看，需求端支撑主要来自于装配式建筑政策持续加码， 新型城镇化及新农村建设提速， 二次装修需求抬升等方面。 此外，与欧美国家比较，国内石膏板市场渗透率较低，应用场景主要分布于公共、商业装修及吊顶装饰， 考虑到“十三五” 环保趋严、绿色建材有望持续受益，以及消费升级、 建材品牌化的预期，石膏板应用在保障房、 墙体装饰等市场有实现突破的可能。 公司 6 月份与当代置业签订战略合作协议，按照协议，当代置业将在墙体吊顶系统 100%采用龙牌石膏板/轻钢龙骨。我们认为，协议的签订开启了房企在墙体装饰系统大规模 100%采用石膏板轻钢龙骨的先例，有助于推动石膏板应用在墙体市场的突破； 而公司作为石膏板龙头， 也有望继续推进与大中型房企的合作。
盈利预测与估值
报告期内， 公司营收增速走高， 三费管控良好， 收购少数股权后， 归母净利润实现大幅提升； 与泰山石膏的协同进一步深化， 目前已完成下一轮产能扩张规划。 短期内,石膏板需求受地产周期拉长，及三四线城市去库存良好的支撑。 长期来看，公司作为石膏板行业龙头， 有望坐享环保节能政策趋严、 家装建材消费升级、装配式建筑推广及石膏板应用场景突破带来的红利， 未来业绩大概率延续增长态势。 我们预测，公司 2017-2019 年EPS 分别为 0.95 元/股、 1.17 元/股、 1.34 元/股，对应的 PE 为 13 倍、10 倍、 9 倍， 维持“增持”评级。",,华安证券,增持,[None],2017-08-29,,增持,3926880,pdf_downloads/2017/2017-08-29/000786-北新建材（000786）：石膏板龙头，业绩增速走高.pdf,000786,北新建材,北新建材（000786）：石膏板龙头，业绩增速走高
"李佳颖,余尊宝","投资要点

事件：公司2017年上半年实现营业收入45.6亿元，同比增长26%；实现归母净利润6.8亿元，同比增长48.5%；基本每股收益0.38元。

2017中报业绩创近三年新高，毛利率有所下降。上半年，受益于地产端的稳定表现，公司产品量价齐升，营业收入同比大增26%，2015、2016年同期增速为负；归母净利润大增48.5%主要是少数股东损益大幅减少，公司2017上半年净利润6.9亿元，同比增13%，少数股东损益由同期1.5亿元下降至489万元。毛利率方面，2017一季度受营业成本大幅上升影响，整体毛利率下降至26%，导致上半年整体毛利率为31%，较2016年同期下降3.4个百分点。

深耕市场，以区域拓展提升市占率。2017上半年，北新建材和泰山石膏开启新一轮产能扩充计划，根据公司2017年中报，公司在建产能包括泰山石膏在湖南长沙（3000万M2/年）、甘肃白银（3000万M2/年）、四川宜宾（3500万M2/年）、重庆綦江（3500万M2/年）四个项目1.3亿M2/年的产能，以及北新建材天津公司（3000万M2/年）、昆明公司（3000万M2/年）、陕西公司（3000万M2/年）、井冈山公司（3000万M2/年）合计产能1.2亿M2/年，如果这些项目全部建成，总产能将上升至30亿M2/年。公司在全国布局上加强了对华中、西北、西南地区的力度，市占率将进一步提升。

乘政策之风，装配式建筑行业迎来大发展，公司或将明显受益。2016年9月，国务院发布《关于大力发展装配式建筑的指导意见》，明确指出，“力争用10年左右的时间，使装配式建筑占新建建筑面积的比例达到30%”，装配式建筑将迎来发展快车道。公司产品石膏板是装配式建筑中理想的墙体材料，公司或将直接受益装配式建筑的推广。

盈利预测与投资建议：预计公司2017-2019年EPS分别为0.85元、1.06元、1.33元，未来三年归母净利润将保持27%的复合增长率，考虑公司在石膏板行业的龙头地位以及潜在受益装配式建筑推广，给予公司2018年18倍估值，对应目标价19.08元，首次覆盖，给予“增持”评级。

风险提示：（1）原材料价格波动的风险；（2）房地产宏观调控的政策风险；（3）装配式建筑推广不达预期的风险。",,西南证券,增持,[None],2017-08-23,,增持,2035257,pdf_downloads/2017/2017-08-23/000786-北新建材(000786)：2017年中报业绩创近三年新高.pdf,000786,北新建材,北新建材(000786)：2017年中报业绩创近三年新高
赵军胜,"事件：

2017年上半年公司实现营业收入45.62亿元，同比增长26.02%；营业利润8.47亿元，同比增长15.46%；归属于上市公司股东的净利润6.82亿元，同比增长48.51%。

观点:

销量提升带动营业收入增长。2017年上半年公司在石膏板销量提升的带动下，石膏板业务营业收入达到40.13亿元，同比提高25.06%，占到总营业收入的比重为88.39%。公司主营业务分区域看，北方地区营业收入为20.41亿元，同比增长28.39%;南方地区营业收入为16.12亿元，同比增长32.50%，增速较快；西部地区营业收入为8.62亿元，同比增长31.68%。2017年1-6月份，商品房销售面积74,662万平方米，同比增长16.1%，受地产调控政策影响房地产销售增速较去年有所下降，但是办公楼的销售增长仍处于较高的态势当中，加上公司的市场拓展，公司产品销量同比增长较好，带动营业收入增长较快。

原材料价格上涨降低毛利率降，三费率下降。2017年上半年公司的综合毛利率为31.01%,较去年同期下降3.42%。主营产品石膏板本期的毛利率为32%，较去年同期下降3.33%,主要由本期原材料价格上涨所致。本期三项期间费用率均有所下降，三费率合计11.54%，同比下降2.26%。

继续布局生产线，推进一带一路。公司2017年上半年公司产能达到21.62亿平方米，稳居世界第_。同时公司继续在全国范围内合适的区域建设布局生产线，年初以来，公司陆续通过了泰山石膏在重庆綦江投资建设综合利用工业副产石膏年产3，500万平米石膏板生产线项目与泰山石膏在江西弋阳投资建设综合利用工业副产石膏年产3，500万平米石膏板生产线项目。公司在建生产线仍有8条，产能总计为2.5亿平方米，未来计划拓展到30亿平方米。同时公司积极响应_带_路政策，规划拓展国际市场。

盈利预测和投资评级：我们预计公司2017到2019年公司的每股收益0.92元、1.06元和1.15元，以收盘价16.90元计算，对应的动态PE为18倍、16倍和15倍，考虑到公司作为石膏板龙头除在全国继续布局产能外，拓展_带_路战略，考虑到公司综合竞争力强，维持公司“强烈推荐”的投资评级。

风险提示：房地产销售增速下降超预期和原材料成本上涨超预期。",,东兴证券,强烈推荐,[None],2017-08-23,,买入,2065194,pdf_downloads/2017/2017-08-23/000786-北新建材2017年半年报点评：石膏板龙头业绩稳增.pdf,000786,北新建材,北新建材2017年半年报点评：石膏板龙头业绩稳增
黄道立,"收入增长26.02%,净利润增长48.51% ,EPS 0.381元/股
    2017H1实现营业收入45.62亿元,同比增长26.02%,实现归属于母公司所有者净利润6.82亿元,同比增长48.51%,实现归属于母公司所有者扣除非经常性损益净利润7.37亿元,同比增长58.37%,EPS为0.381元/股;其中,Q2实现营业收入27.82亿元,同比增长27.4%,实现归属于母公司所有者净利润5.33亿元,同比增长48.51%。
    收入延续高增长,成本压力后续有望转移改善
    量价齐升,收入延续高增长,Q1、Q2同比增速分别达23.93%和27.4%,去年同期分别为1.77%和-1.89%。由于煤炭、美废等主要原材料价格上涨推高成本,且提升幅度大于产品价格提升,石膏板毛利率小幅下滑3.33个百分点至32%;短期或对业绩形成一定压力,但预计成本压力有限,后续有望改善(一方面近期美废#8价格已从7月初的203美元/吨回落至180元/吨,另一方面公司可通过技术提升和区域提价进一步有效消化成本端影响)。
    提质增效成效显著,并购泰山剩余股权大幅增厚业绩
    公司销售、管理和财务费用率分别为3.25%、7.44%和0.86%,同比下降0.25、1.58和0.42个百分点,提质增效成效显著。泰山35%少数股东权益于去年10月并表,大幅增厚业绩(泰山上半年实现净利润4.62亿元,对应35%股东权益为1.62亿元,扣除后可比口径归母净利润增速为13.29%)。
    启动新一轮石膏板产业布局,进一步巩固全球龙头地位
    截至报告期末,公司石膏板产能达21.62亿平方米,继续稳居全球第一。同时公司发布30亿平米石膏板产业规划,并启动全球化产业布局,除在建的8条石膏板生产线,合计2.5亿平米,公司公告拟计划投资1.07亿元在江苏弋阳建设综合利用工业副产石膏年产3500万平米石膏板生产线项目;计划8.46亿元在北京市昌平区建设未来科学城“三新”产业研发中心二期项目,将进一步巩固全球石膏板龙头地位。
    业绩持续增长可期,维持买入评级
    随着石膏板在家装、隔墙以及二次装修领域的突破及装配式建筑的进一步推动,行业潜在增长空间巨大。公司作为石膏板龙头,依托技术、规模和品牌优势,有望继续巩固龙头地位,业绩持续增长可期。预计2017-2019年公司EPS分别为0.90/1.08/1.33元/股,对应PE 18.7/15.7/12.7x,给予“买入”评级。",,国信证券,买入,[None],2017-08-22,,买入,2034658,"pdf_downloads/2017/2017-08-22/000786-北新建材(000786)：收入增长提速,上半年净利增长近5成.pdf",000786,北新建材,"北新建材(000786)：收入增长提速,上半年净利增长近5成"
"黄道立,陈颖","事项：

近日，中国建材集团与中国黄金集团签署战略合作协议，双方将按照资源共享、优势互补、互惠互利原则在雄安新区建设过程中开展装配式建筑领域的全面合作，共同推进装配式建筑在京津冀地区的蓬勃发展。

评论：

河北积极推进装配式建筑发展，未来或成雄安主导模式

随着《京津冀协同发展规划纲要》深化实施，河北装配式建筑迎来极大发展空间，未来装配式建筑或成雄安主导模式。根据“河北省装配式建筑十三五规划”，要构建京津冀装配式建筑协同发展格局，积极承接北京非首都功能疏解，发挥河北装配式建筑示范市（县）的引领作用，规划目标到2020年装配式建筑将占新建建筑比例20%以上，到2025年达到30%以上。同时，据中国建筑设计院装配式建筑工程研究院副院长、总工程师张守峰表示，未来雄安新区80%-90%建筑都将是装配式建筑。

石膏板是最适合工业化装修的材料，未来增长空间大

石膏板具有重量轻、强度高、厚度薄、易加工、隔音、防火等特点，是目前建筑装修领域的一种基础材料，特别适合于现代化建筑群机械化装配使用。据住建部总工程师陈宜明表示，全面采用石膏板复合墙体大约可以提高套内面积8%-12%。由于建筑结构差异，国内人均石膏板使用量长期低于海外国家，目前我国目前人均石膏板用量约1.5㎡，世界平均约2.5㎡，而美国更高达6.9㎡；尤其在隔墙领域，我国应用比例仅占石膏板总量20%，更远低于发达国家（目前美国石膏板隔墙占比约80%）。但随着国家大力推进装配式建筑和消费升级背景下，石膏板的应用比例有望提升，未来增长空间大。

公司作为石膏板龙头，综合竞争实力强

公司上市20年来快速发展，目前市占率约50%，稳居行业龙头地位：①规模优势：截至2016年末，公司石膏板产能达到21.32亿平方米，继续保持全球第一；②品牌优势：公司旗下拥有“龙牌”和“泰山”两个品牌，其中全国70%以上的知名建筑采用了龙牌系列产品；③成本优势：开发脱硫石膏解决原材料供应，率先摆脱天然石膏资源分布集中和物流不便的制约，利用燃煤电厂脱硫副产品占领资源市场制高点；④管理技术优势：公司管理水平优秀，运营效率持续提升，同时持续创新，并依托技术领先优势降低单位能耗，提质增效成效显著。

公司紧靠雄安，未来有望全面受益，给予“买入”评级

公司地处北京、紧靠雄安，未来有望全面受益；同时全资收购泰山石膏，将进一步增厚公司利润。受益装配式建筑推进，公司未来市占率仍有提升空间。预计公司17-19年EPS分别为0.9/1.09/1.33元/股，对应PE为18.1/14.9/12.3x，给予“买入”评级。",,国信证券,买入,[None],2017-07-05,,买入,2007934,pdf_downloads/2017/2017-07-05/000786-北新建材(000786)重大事件快评：受益装配式建筑，给予“买入”评级.pdf,000786,北新建材,北新建材(000786)重大事件快评：受益装配式建筑，给予“买入”评级
赵军胜,"事件：

公司2017年一季度实现营业收入17.79亿元，同比增加23.63%；营业利润2.13亿元，同比增长5.73%；归属于上市公司股东的净利润1.50亿元，同比增长48.52%。实现每股收益为0.084元，同比增加18.31%。

观点：

营业收入稳定增长，归属母公司净利润增幅近五成。公司2017年一季度实现营业收入17.79亿元，同比增加23.63%；近年来公司营收状况不断向好，从2015年第三季度到2017年第一季度，单季营收同比增速基本呈持续上升趋势（2016年二季度营收增速略有下降，主要是销售单价下调影响）。公司品牌优势和全国范围内的生产线布局以及销售网络的下沉完善，使得公司销售收入出现平稳的增长。

成本影响毛利率提升费用率同比下降，泰山股权收购保证利润增长。2017年一季度毛利率27.66%，同比下降1.37个百分点，主要受护面纸和煤炭价格上涨影响所致,以美废11号到岸价为例2017年1季度均价为263.47元/吨，同比提升了52%，成本价格的提升也将在第二季度对于公司的毛利率产生影响，但是影响力度会逐步减弱。

2017年一季度期间费用率同比下降0.10个百分点至14.83%，主要是管理、财务费用率分别同比下降0.45个百分点、0.75个百分点，但销售费用率上升1.09个百分点。管理费用率下降的原因是根据财会[2016]22号规定，原在管理费用下核算的房产税、土地使用税等改在税金及附加项目核算。销售费用率上升，一是所属子公司本期发放销售兑现，二是公司加大了市场的宣传推广。归属于上市公司股东的净利润1.50亿元，同比增长48.52%，和公司2016年收购泰山石膏35%的少数股权，本期不再计提该持股比例的少数股东损益有关。

稳健经营，后力足。近年来，公司资产负债率大体呈现持续下降趋势，自2007年第四季度的62.12%下降到2017年一季度的27.41%，偿债能力不断提高。经营活动现金流比上年同期减少1.61亿元，降低了573.44%，主要是原材料采购量增加及价格上涨以及收到的现金增幅相对较小。公司低杠杆稳健的经营策略为公司未来发展蓄力。

积极发展绿色装配式建筑材料，受益中国绿色经济发展大趋势。公司成功研制免涂装墙体吊顶材料、装配式墙体吊顶并投入应用。公司“超低能耗、零甲醛空间、全生命周期全产业链绿色、装配式建筑、高性能建筑”五大方向研发下一代高性能绿色建筑技术体系，市场潜力巨大。中国经济进入绿色发展阶段，石膏板作为绿色健康的装饰材料已经得到普通百姓认可，为三四线城市的装修使用打开空间。同时环保政策也将会对一些靠污染环境带来的低成本小企业产生影响，使得公司的产品能够进一步的提高市场占有率，销售网路进一步的下沉。

紧跟一带一路，全球龙头国际化战略优势强。公司作为石膏板的全球龙头企业，具备规模化管理的经验和优势，公司建材产品系列丰富，同时品牌和综合竞争力很强，有利于公司国际化战略的推广，特别是一带一路政策下公司作为建材的龙头国企也将受益于战略的落实。为了不放弃美国市场，公司积极应对美国的投诉。通过新兴市场建立新线，成熟市场并购的方式推进国际化战略，国企龙头公司未来将成为跨国的建筑材料公司。

盈利预测与投资评级。预计公司2017年到2019年的每股收益为0.92元、1.05元和1.16元，以收盘价15.21元计算，对应的动态PE为17倍、14倍和13倍，考虑到公司作为石膏板的龙头企业综合竞争力强，受益于中国环保和绿色经济的发展，市占率将进一步提升。同时国际化战略顺应国家一带一路，国企具备跨国企业发展潜力，维持公司“强烈推荐”的投资评级。

风险提示：国内市占率提升和国际化战略低于预期。",,东兴证券,强烈推荐,[None],2017-04-28,,买入,1972732,pdf_downloads/2017/2017-04-28/000786-北新建材(000786)2017年1季报点评：龙头业绩稳增，绿色发展和国际化空间大.pdf,000786,北新建材,北新建材(000786)2017年1季报点评：龙头业绩稳增，绿色发展和国际化空间大
"鲍荣富,王德彬,黄骥,方晏荷","石膏板量价齐升，业绩稳步增长

公司一季度实现营收17.79亿元，YOY+23.9%；归属净利1.50亿元，YOY+48.5%；扣非净利1.75亿元，YOY+55.6%。泰山石膏35%少数股东权益于去年10月并表，带动业绩高速增长，可比口径业绩增速约10%，符合我们前期预期。产业链调研了解公司一季度销量同比增长约15%，石膏板需求一般滞后地产销售3-6个月，同时受益公装大型项目需求旺盛，销量增速较快。一季度石膏板单价同比上涨约8%，价格上涨一方面由于煤炭、美废等原材料价格上涨推高成本，一方面国内石膏板标准从16年下半年开始提升。

成本压力有限，二季度毛利或有改善

公司一季度毛利率为27.7%，较去年同期下降1.4个百分点，环比下降4.3个百分点。去年四季度起公司成本端37#美废和煤炭价格提升，公司价格上涨未能覆盖成本上涨，单季毛利率同比下降1.5个百分点，但近期美废价格已从高位310美元/吨降至290美元/吨，后期高价或难持续，公司毛利二季度或可改善。公司销售费用率同比上升1.1个百分点，主要由于宣传推广费用增加和销售兑现发放所致；管理和财务费用率下降0.5/0.7个百分点，三项费用率同比下降0.1个百分点。

应用扩张地产需求提升，期待维持高速增长

公司是世界级石膏板龙头，国内市占率超50%。后续看石膏板需求增长，一方面来自于应用的增加，当前吊顶领域石膏板需求贡献达70%，隔墙需求占公司的30%，随着隔墙市场继续渗透，行业规模仍有增长空间；另一方面来自于精装修和装配式建筑的放量，当前商业建筑和公用建筑石膏板需求贡献超60%，而公司与万科、绿地、远大等开发商合作，用石膏板进行内隔墙替代；同时完成收购泰山石膏，有助于公司在三四线城市继续拓展，长期看公司业绩增长无忧。

业绩增长空间大，维持买入评级

公司16年业绩维持较快增速，后续受益产品应用扩张、地产精装修和装配式建筑发展，收入增长空间大；市占率高，议价能力强，后续看有能力将成本提升向下传递。根据公司16年业绩情况调整公司17-19年盈利预测，预计公司预计公司17-19年EPS分别为0.95/1.04/1.13元，公司业绩维持较快增速，近期可比公司估值提升，相应调高公司估值水平，认可给予公司16~17倍17年PE，目标价16.2~17.1元，维持买入评级。

风险提示：地产景气度下滑；原材料价格上涨等。",,华泰证券,买入,[None],2017-04-27,,买入,1971539,pdf_downloads/2017/2017-04-27/000786-北新建材(000786)：石膏板量价齐升，成本压力有限.pdf,000786,北新建材,北新建材(000786)：石膏板量价齐升，成本压力有限
