author,content,filename,org_name,original_rating,pdf_link,publish_time,rating_adjust_mark_type,rating_changes,report_id,save_path,stock_code,stock_name,title
乐宇坤,"山东黄金公告13年上半年净利润同比下跌31%至9.68亿人民币，这主要是由于金价同比下跌近8.8%；13年2季度净利润为3.95亿人民币，同比大跌50.2%，环比下降31.3%，这主要是由于金价同比和环比均下降约13%。我们估计公司上半年矿产金的销量近13.8吨，同比增长近4.9%，占我们全年销量预测的48.3%，略低于我们预期，我们将13-15年销量假设分别下调2.1%、2.0%和1.6%。公司的成本继续增加，我们估计上半年公司矿产金的单位克金营业成本（不包括三项费用）为152.5元/克，较2012年上半年上升15.6%，但这要低于12年下半年的182.6元/克。公司在13年7月1日公告计划增发新股收购包括天承公司等近14项黄金资产以及募集资金总额不超过30亿元，我们估计收购完成后公司黄金资源储量将增加130%达到约709吨，由于目前股价远低于计划的增发价格，因此未来项目如何推进还需观察。基于金价在2季度罕见暴跌以及市场信心受挫，我们将2013-15年的金价假设分别下调5.5%、7.9%和8.1%。我们将2013-15年的每股收益预测下调15.2%、18.2%和17.9%（未考虑增发的因素）。我们将目标价格由35.50元下调至27.30元，这是基于约22倍的13年市盈率。我们维持对该股的谨慎买入评级。

支撑评级的要点

公司储量增加潜力极大。

黄金产量稳步上升。

在金价下跌的环境下，公司估计会加强成本控制。

主要风险

收购矿山需要消耗大量资金。

管理费用、人工成本仍可能高于预期。

美联储缩减QE规模可能对金价形成抑制。

估值

山东黄金集团未来的目标是“争全国第一”，建设有国际影响力和竞争力的大型现代化黄金矿业公司。因此公司未来黄金资源储量以及产量有巨大增长的潜力。基于公司基本面在未来2-3年内有望继续改善，我们认为，该股可较同业享有较高的估值。但由于我们下调了13-15年盈利预测，因此目标价格由35.50元下调至27.30元，这是基于约22倍的13年市盈率。我们维持对该股的谨慎买入评级。",,中银国际,谨慎买入,[None],2013-09-03,,买入,611232,pdf_downloads/2013/2013-09-03/600547-山东黄金(600547)：受累于金价下跌13年上半年盈利大幅下降.pdf,600547,山东黄金,山东黄金(600547)：受累于金价下跌13年上半年盈利大幅下降
黄玉,"一、事件概述

山东黄金公布2013年半年报，上半年实现营业收入为280.34亿元，同比增长10.56%；净利为9.67亿元，同比下降31.18%，每股收益为0.68元。

二、分析与判断

国际金价高位回落，行业估值中枢在下行

报告期内，国际金价受国外经济环境影响波动剧烈，6月末价格已经较上年末下跌26%，最低跌破1200美元/盎司，SPDR亦不断减持黄金多头持仓，投资人对黄金上涨信心渐失。从目前的价格走势来看，市场暂时已经忽略了黄金基础消费对价格的作用，金融属性对价格的影响突显，QE退出及国际局势的变化极大的影响金价的脉搏。中期来看，金价难以看到昔日的辉煌，未来将是该行业中枢下移并不断修整的过程。

公司规模化、地理优势犹在，龙头地位不变

近年来，国内各矿山兼并、收购、参股，不断加大地质勘探和结构调整力度，转变粗放的生产增长方式，实现了资源利用水平、产量、效益同步增长。山东黄金作为黄金行业的龙头企业主导着黄金工业发展的格局，在地理位置、规模经营、技术、公司治理和人才等方面均具有较强的优势。

另外，公司发行山东黄金矿业股份有限公司2013年公司债券（第一期），规模为人民币20亿元，一方面偿还原有贷款，一方面补充流动资金，提高了公司的竞争力。

公司定增后资产规模增加，但溢价空间缩小

6月份公司拟按照33.72元/股，总共发行2.96亿股，分别向黄金集团、有色集团、盛大公司、金茂矿业及王志强发行股份购买其所持有的部分黄金生产的企业股权以及黄金矿业权。我们认为，黄金集团所承诺的资产已经大部分注入公司，未来储量的提升空间有限，因此溢价空间缩小。

三、盈利预测与投资建议

金价受国际宏观经济环境影响较大，价格波动不定，由于品位下降及人工成本的提升，黄金成本不断提升，预计公司预计2013到2015年EPS分别为1.22元、1.42元和1.58元，对应的PE为20、17、16倍，给予公司“谨慎推荐”评级。

四、风险提示

叙利亚地区战争争端，QE又出新政策。",,民生证券,谨慎推荐,[None],2013-09-03,下调评级,增持,611059,pdf_downloads/2013/2013-09-03/600547-山东黄金(600547)：金价左右金企，短期关注局部战争.pdf,600547,山东黄金,山东黄金(600547)：金价左右金企，短期关注局部战争
"陆冰然,刘敏达","业绩符合预期。公司于8月30晚公布2013年半年报，上半年，公司实现营业收入280.33亿元，同比增长10.56%，归属上市公司股东净利润9.67亿元，同比下降31.18%；对应每股收益0.68元。其中。二季度实现净利润3.94亿元，环比下滑31.4%。业绩基本符合预期。

黄金价格下跌成为业绩下滑的主要原因。上半年国际金价较年初下降约26%，相比去年同期均价下滑约8%，对公司矿产金业务的利润空间构成较大影响。根据公司披露的黄金整体业务和外购冶炼金的收入、成本水平。估计公司上半年矿产金收入约为56.95亿元，营业成本约为34.57亿元，毛利率39.29%，较去年下滑约14个百分点。根据收入推算上半年矿产金产量约为18吨左右，较年初制定的全年27.9吨的开采目标，明显超出。但在金价下跌的趋势下，产量增长只能部分对冲利润下滑的速度。

金价下行趋势难改，下半年再次成为政策敏感期。中长期来看，美国经济复苏和实际利率的攀升，对金价构成长期抑制。金价振荡下行的趋势较难改变。短期，由于市场较高的QE退出预期的落差，金价较前期有所反弹。但我们判断，在未来一年内美国货币政策回归正常化将是大概率事件。二季度美国GDP增长数据超预期，预计未来几个月内，就业市场的积极变化将会有所体现，由此或将导致金价重回疲弱的状态。

拟注入资产短期业绩贡献相对有限，长期估值中枢预将下移。公司7月公布资产重组和增发预案，从拟注入资的类型来看，尽管资源储量中黄金金属量约有401吨，但能在短期贡献业绩的资产仍然较少。就去年的经营状况来看，注入资产每年能增加矿产金约4.5吨，权益业绩贡献约为2.77亿元。而伴随年初以来金价持续下滑，这些资产今年的权益业绩贡献将会明显缩水。从公司预案公告来看，集团公司所拥有的黄金资产仅剩青海山金部分，未来注入带来的增量较少。可以预见的未来，无法复制06-08年量价齐升的状况。同时，由于金价的长期走势预将趋弱，公司现有资产，以及待开发项目的的盈利能力都将有所下滑。两方面将共同推动公司估值的中枢水平下移。

维持公司中性评级。在2013-2014年国内金价260、250元/克的假设下，预计公司EPS分别为1.05元、0.88元/股（按现有股本计算）。维持公司“中性”评级。

风险提示：金价超预期下滑，公司盈利能力进一步减弱。",,华泰证券,中性,[None],2013-09-02,,中性,609961,pdf_downloads/2013/2013-09-02/600547-山东黄金(600547)：量增价减，盈利持续下滑.pdf,600547,山东黄金,山东黄金(600547)：量增价减，盈利持续下滑
"林阳,李晨辉","事件：公司发布公告，拟分别向黄金集团、有色集团、盛大公司、金茂矿业及王志强发行股份购买上述对象持有的部分从事黄金生产的企业股权以及黄金矿业权等资产。

观点：

1.定增购买黄金资产，储量预计翻倍

公司拟按照33.72元/股，总共发行2.96亿股，分别向黄金集团、有色集团、盛大公司、金茂矿业及王志强发行股份购买其所持有的部分黄金生产的企业股权以及黄金矿业权。另外，公司拟非公开发行0.89亿股，募集资金总额不超过30亿元，作为本次交易的配套资金，配套募集资金将用于发展标的资产主营业务及补充流动资金。

本次交易构成重大资产重组，交易标的资产预估值为99.84亿元，涉及的黄金资源储量约401吨。目前公司黄金权益储量约400吨，如果本次资产重组成功进行，公司黄金储量预计将增加至800吨以上。本次交易完成后，黄金集团、有色集团及盛大公司预计将分别直接持有公司47.81%、3.90%及3.33%的股份，黄金集团仍为公司控股股东，山东省国资委仍为公司实际控制人。

2.公司资产规模大幅增长，估值水平将显著降低

通过本次交易，公司将获得归来庄公司、嵩县山金、海南山金、蓬莱公司、天承公司及鑫源矿投的控制权及六宗黄金矿业权，上述标的均为从事黄金采选及冶炼的成熟矿山及相关矿业权，与公司从事相同的主营业务，将扩大公司在黄金生产领域的经营规模。

通过本次交易，公司将获得大股东山东黄金集团拥有未注入上市公司的大部分黄金资产，未来公司将再难以通过控股股东获得优质黄金资产。过去A股黄金企业主要通过注入控股股东的黄金资产，来提升公司黄金储量和资产规模，由于上市公司储量显著低于大股东，因此整体估值较高。但如果本次交易完成，控股股东大部分优质资产已经注入上市公司，未来储量提升空间不大，公司估值重心将显著降低。

3.收购价格基本合理，金价下跌影响公司业绩

本次资产重组，公司预估资产价格，按照2010年1月至2013年3月三年平均销售价格作为标准，2010年1月至2013年3月SHFE黄金的平均价格为313元/克，而目前SHFE黄金在250元/克~300元/克之间。我们认为按照目前的黄金价格，本次资产收购价格基本合理。但是受美联储退出QE政策影响，黄金价格处于下降通道，我们认为黄金牛市已经结束，金价下跌将显著影响标的资产的价格。

我们总体认为本次收购有利于提升上市公司黄金储量和资产规模，有利于公司中长期发展。并且交易对手已对交易标的作了利润补偿承诺，如果未来标的资产的盈利不足利润预测数，将依据股权比例，对上市公司进行股份补偿或者现金补偿。

结论：

公司此次收购矿权主要以探矿权为主，并且公司尚未公布具体标的资产的业绩预测情况，我们暂不考虑收购资产对公司业绩的贡献和增发摊薄的影响，预计公司2013~2015年EPS分别为1.11、0.94和0.74元，对应PE分别为25、30和38倍，鉴于对未来金价相对谨慎的看法，维持公司“中性”投资评级。

风险提示：

1）金价大幅波动对业绩造成的影响

2）公司资产重组进度低于预期",,东兴证券,中性,[None],2013-07-03,下调评级,中性,771826,pdf_downloads/2013/2013-07-03/600547-山东黄金(600547)事件点评报告：拟定增收购集团资产，黄金储量预计翻倍.pdf,600547,山东黄金,山东黄金(600547)事件点评报告：拟定增收购集团资产，黄金储量预计翻倍
"陆冰然,刘敏达","公司于6月29日公布重大资产重组预案。计划通过向公司向黄金集团、有色集团、盛大公司、金茂矿业、王志强发行股份购买天承公司100%股权、归来庄公司70.65%股权、嵩县山金70%股权、海南山金63%股权、蓬莱公司100%股权、鑫源矿投100%股权、东风探矿权、东风采矿权及相关资产与负债、寺庄探矿权、新城探矿权、马塘采矿权及相关资产与负债、马塘二采矿权及相关资产。同时，拟向除本次发行股份购买资产交易对方之外的不超过十名特定投资者非公开发行股份募集配套资金，募集资金总额不超过30亿元，且不超过本次交易总额的25%。

拟注入资产短期业绩贡献相对有限。从此次拟注入资产的类型来看，尽管资源储量中黄金金属量约有401吨，但能在短期贡献业绩的资产仍然较少。就去年的经营状况来看，注入资产每年能增加矿产金约4.5吨，权益业绩贡献约为2.77亿元。主要来自归来庄公司。但去年黄金价格处于高位，而年初以来金价持续下滑，这些资产今年的权益业绩贡献将会明显缩水，预计在1.3亿左右。

金价下行趋势难改，资产长期盈利堪忧。上半年，国际金价较年初下降约26%，金价快速下滑对公司业绩的影响预计在二季度会有比较明显的体现。中长期来看，美国经济复苏和实际利率的攀升，对金价构成长期抑制。金价振荡下行的趋势较难改变。资产注入和在建扩产，对公司产量有所提升，但仍然难以弥补金价下滑带来负向效应。公司资产注入兑现，和金价下行趋势会对公司估值造成巨大压力。从公司预案公告来看，集团公司所拥有的黄金资产仅剩青海山金部分，未来注入带来的增量较少。业绩贡献也有限。无法复制06-08年量价齐升的状况。同时，由于金价的长期走势预将趋弱，公司现有资产，以及待开发项目的的盈利能力都将有所下滑。两方面将共同推动公司估值的中枢水平下移。

业绩补偿具体细节有待进一步验证。公司此次增发预案提出相关业绩补偿的措施。如果注入资产无法达到计划的盈利预期，则会有股权或现金方式的补偿。但具体的盈利预期和补偿方案还未细化。有待进一步验证。

维持公司中性评级。在2013-2014年国内金价260、250元/克的假设下，预计公司EPS分别为0.8元、0.76元/股（全面摊薄后）。维持公司“中性”评级。

风险提示：金价超预期下滑，公司盈利能力进一步减弱。",,华泰证券,中性,[None],2013-07-03,,中性,771797,pdf_downloads/2013/2013-07-03/600547-山东黄金(600547)：金价下行挫伤资产价值.pdf,600547,山东黄金,山东黄金(600547)：金价下行挫伤资产价值
乐宇坤,"在停牌近3个月后,山东黄金(600547.CH/人民币31.97,谨慎买入)公告了重大资产重组方案,具体为向山东黄金集团(母公司)、山东黄金有色矿业集团(山东黄金集团下属子公司)、山东盛大矿业、金茂矿业和王志强发行29,607.14万股,收购包括天承公司等近14项黄金资产,发行价格为人民币33.72元/股。此外,公司还将向不超过10名投资者发行股份,募集资金总额不超过30亿元,且不超过本次交易总额的25%,发行股份的数量不超过8,896.80万股,发行价格不低于前20个交易日股票交易均价33.72元,募集资金用于发展收购资产的主营业务及补充流动资金。我们计算发行完成后,公司的总股本将达到约180,811.18万股,较目前增加27%。
    收购完成后,公司将获得归来庄公司、嵩县山金、海南山金、蓬莱公司、天承公司及鑫源矿投的控制权及六宗黄金矿业权,相应的矿山分别位于山东、河南及海南。收购资产中,归来庄公司、嵩县山金、海南山金、蓬莱公司及天承公司均为黄金生产企业,鑫源矿投虽尚未开始黄金生产,但其控股子公司莱州鲁地拥有一宗储量丰富的探矿权。六宗黄金矿业权中,寺庄探矿权、新城探矿权等矿业权位于公司现有成熟矿山开采范围周边或深部,因此将有助于公司延伸扩大寺庄金矿的许可开采范围,实现集约化开采并利用现有选矿能力,降低开采成本,增强盈利能力。本次收购完成后,预计将增加公司黄金资源储量约401吨。
    截至2013年3月31日,收购资产的预估值约为99.835亿元。收购资产2012年的矿产金产量约5吨,盈利估计4-5亿元。
    收购完成后,山东黄金集团及其控制的其他企业中仅青海山金矿业有限公司、嵩县天运矿业有限责任公司及山东黄金金创集团有限公司在国内存在少量黄金业务资产。目前山东黄金集团所实际控制的青海山金矿业有限公司52%股权、嵩县天运矿业有限责任公司70%股权已委托山东黄金进行管理。山东黄金集团承诺,将在承诺函出具后的3年内,通过对外出售的方式处置上述与黄金业务相关的资产,山东黄金具有优先购买权。山东黄金集团承诺,未来将不再在境内从事与山东黄金主业相同或相类似的业务,也不再投资境内黄金业务。
    目前相关的审计、评估及盈利预测工作尚未完成,这些工作完成后,公司董事会将再次召开会议审议通过正式方案;此后还需经过:山东省国资委核准并对相关资产评估结果备案或核准;公司股东大会审议批准本次交易事项;中国证监会核准本次交易事项。我们估计收购相应的黄金资产可能会在今年完成。其后再寻找适当时机向不超过10名投资者发行股份募集配套资金。
    由于公司自4月3日停牌以来,黄金价格和A股其他黄金上市公司股价出现较大下跌(股价平均下跌近30%),我们估计公司股票复牌后,股价也会面临较大的下跌压力,由此未来何时完成向不超过10名投资者发行股份募集配套资金,还需看市场时机。",,中银国际,,[None],2013-07-02,,,771696,"pdf_downloads/2013/2013-07-02/600547-山东黄金(600547)：公布重大资产重组方案,收购401吨黄金资产.pdf",600547,山东黄金,"山东黄金(600547)：公布重大资产重组方案,收购401吨黄金资产"
乐宇坤,"山东黄金公告13年1季度净利润同比下降7%至5.74亿人民币（每股收益0.40元）。盈利同比下降主要是由于1季度管理费用同比增加9,200万元，以及去年1季度公司有近5,261万元通过黄金现货和期货产生的投资收益，但今年却出现近58.9万元的投资亏损。1季度国内黄金平均价格同比环比均下跌近4.6%，但公司毛利润却同比增加4%，环比增加了22%，我们估计这一方面是公司可能加大了自产矿产金的销售，另一方面，我们估计公司加强了成本控制，矿产金单位克金生产成本还同比下降，这是过去几年中都未见到的。公司在2013年4月3日公告公司正在筹划重大资产重组事项，我们估计公司的增发方案可能将发生重大调整。基于金价在4月份的罕见暴跌以及市场信心受挫，我们将2013年和14年的金价假设分别下调12.6%和7.7%。并将2013-14年的每股收益预测并分别下调25.9%和22%（未考虑增发的因素）。我们因此将目标价格由43.00元下调至35.50元，并将该股的评级由买入下调为谨慎买入。

支撑评级的要点

公司储量增加潜力极大。

黄金产量稳步上升。

在金价下跌的黄金下，公司估计会加强成本控制。

主要风险

收购矿山需要消耗大量资金。

管理费用、人工成本仍可能高于预期。

美元升值可能对金价形成抑制。

估值

山东黄金的管理团队充满了进取精神，母公司山东黄金集团未来的目标是“争全国第一”，建设有国际影响力和竞争力的大型现代化黄金矿业公司。因此公司未来黄金资源储量以及产量有巨大增长的潜力，而我们对公司即将公布的重大资产重组方案充满期待，相信这将帮助公司迈上一个新的台阶。基于公司基本面在未来2-3年内有望持续改善，我们认为，该股应较同业享有较高的估值。但由于我们下调了13-14年盈利预测，因此目标价格由43.00元下调至35.50元，这是基于约24倍的13年市盈率。由于市场对黄金价格未来的预期下降，同时新目标价格距离目前股价上升空间缩小，因此我们将该股的评级由买入下调为谨慎买入。",,中银国际,谨慎买入,[None],2013-04-25,下调评级,买入,766181,pdf_downloads/2013/2013-04-25/600547-山东黄金(600547)：13年1季度盈利同比下降，但有成本下降迹象.pdf,600547,山东黄金,山东黄金(600547)：13年1季度盈利同比下降，但有成本下降迹象
"徐建花,张新平,马枭","事件:公司发布一季报，报告期实现营业收入133.5亿元，同比增长3.46%%.实现归属于上市公司股东净利润5.74亿元，同比下降6.93%，折合EPS0.40元，同比下降6.98%。

投资要点

业绩略低于预期。一季度国内黄金均价329元/克,同比下降4.6%.我们原预期公司自产金矿产量增长或能抵补价格下跌影响，实现业绩持平或小幅增长，业绩低于预期的一个重要原因可能是成本/费用高于预期，如固定资产折旧费用同比增加，今年一季度固定资产增加显著。

2013年公司层面看点：（1）公司自产金矿产量增加，受益于采选矿能力提升，预计13年公司自产金达30-31吨,同比增长15%以上。（2）重大资产重组进行中。公司4月3日停牌启动重大资产重组,目前仍未复牌.我们在年报点评中曾提示,今年或将启动集团资产注入,包括山东黄金集团12年6月份收购盛大和天承矿业股权（权益黄金储量82吨），承诺1年内启动注入上市公司,以及2011年4月公司公布的定向增发预案，拟注入权益储量300余吨黄金储量.若资产重组成功,公司储量接近翻番.

再次下调金价预测。我们在年报点评中,曾下修今年金价预测9%,至335元/克.但4月以来,受美联储QE退出预期增强，欧洲主权债务国恐抛售黄金的担忧以及投机资金大规模做空,金价遭受近30年未见的断崖式下跌,短短两日暴跌15%.目前看暴跌后反弹力度较弱.我们下修2013-15年国内金价预测,自335元/克下调至310元/克.

财务与估值

根据最新对金价和自产金的预测，我们测算2013-15年EPS分别为1.31/1.38/1.47元（原预测1.69/1.77/1.85元），鉴于4月以来黄金价格大跌，预计后期全市场均会下修黄金股的盈利预测，当前wind可比公司估值参考意义失真。我们参考公司过去近两年PE估值,取均值25倍PE估值，对应目标价32.75元。下调评级至增持。

风险提示

自产金矿低于预期,金价下跌幅度超预期，有色金属估值中枢整体下移。",,东方证券,增持,[None],2013-04-25,下调评级,增持,765797,pdf_downloads/2013/2013-04-25/600547-山东黄金(600547)：金价下跌超预期，下修盈利预测.pdf,600547,山东黄金,山东黄金(600547)：金价下跌超预期，下修盈利预测
