author,content,filename,org_name,original_rating,pdf_link,publish_time,rating_adjust_mark_type,rating_changes,report_id,save_path,stock_code,stock_name,title
"胡世炜,宋琦,闻宏伟",公司为饲料龙头企业，饲料收入占比超80%。海大集团是一家涵盖饲料、种苗、生物制药、智慧养殖、食品流通、金融等全产业链的高新农牧企业，注册资本超15亿元。经过二十余年的高速发展，目前海大集团在海内外拥有600余家分子公司。2006-2021年，公司营业收入从15.3 亿元增长至860.0亿元，CAGR为30.8%，归母净利润从0.6亿元提升至16.0 亿元，CAGR达到25.0%。2022年前三季度，公司营业收入为789.6亿元，同比增长22.8%。2021 年公司饲料业务销售收入698.3亿元，同比增长43.2%，收入占比81.2%；2021年养殖销售收入86.3 亿元，同比增长35.5%，占公司主营业务收入10.0%。饲料行业集中度持续提升，公司将持续受益实现扩量。我国饲料行业商业化于上世纪70年代末启动，内资公司于80年代开始起步。进入2013年后，国家开始进行农牧行业的排查整改，大批饲料企业因为环保不达标和安全隐患问题被责令整改和关停，行业集中度也因此进入提升期并维持至今。公司以水产料起家，且目前水产料销售比例仍然在三成左右。长期来看，公司在产能利用率、产品结构上仍然存在提升空间；同时，公司将在行业集中度持续提升的大背景下，通过兼并、自建产能，依靠自身的规模优势，持续提升销量，达到2025年4000万吨销量目标。生猪行业集中度亟待提升，公司出栏量稳步增加。我国目前生猪养殖市场仍在逐步规模化的进程中。根据农业农村部的数据，我国2021年生猪养殖规模化率（年出栏500头以上规模养殖场户占比）首次达到60%，同比增长7pct。近6年来，公司生猪销售业务实现了稳步增长，从2016年的6.7亿元，增长到2021年的47.0亿元，CAGR高达47.8%。公司预计全年出栏量在320万头左右。假设四季度公司完全成本维持在16.3元/公斤不变，销售单价参考行业平均水平，出栏均重假设为120公斤/头，则单头利润可达700元，因此我们预计单四季度生猪销售净利润有望贡献4亿元左右。投资建议：我们预计公司2022-2024年营收分别为1002/1241/1439亿元，预计2022-2024年归母净利润分别为29/44/56亿元，对应EPS分别为1.77/2.65/3.38元。考虑到公司在行业中的龙头地位，有望在行业集中度提升的大背景下享受更好的成长性，同时依据公司历史估值水平，我们给予公司2023年30倍PE，对应目标价为79元，首次覆盖给予“优于大市”评级。风险提示：饲料价格波动，玉米豆粕再次涨价，猪肉价格波动。,,海通国际证券,优于大市,[None],2023-01-31,,买入,5102676,pdf_downloads/2023/2023-01-31/002311-海大集团（002311）首次覆盖：饲料版图持续扩大，生猪养殖业务稳步推进.pdf,002311,海大集团,海大集团（002311）首次覆盖：饲料版图持续扩大，生猪养殖业务稳步推进
陈梦瑶,"事件：公司发布2022年业绩预告：预计2022年度实现归属于上市公司股东的净利润为28.00-31.00亿元，同比增长75.43%-94.23%。实现归母扣非净利润为27.2-30.2亿元，同比增长79.02%-98.76%，实现基本每股收益1.70元/股-1.88元/股。饲料行业基本面改善，饲料销量再创新高。2022年上半年由于饲料原材料玉米、豆粕等受俄乌冲突、全球气候变化等因素影响，价格持续快速上涨导致公司成本承压。同期，由于畜禽养殖端处于亏损期，饲料需求持续降低，公司上半年饲料业务增速放缓。下半年部分饲料原材料达到高位后呈现了下降趋势，畜禽养殖利润提升从而带动饲料需求，饲料行业的恢复提升了公司饲料业务的营收和利润。公司2022年饲料销售总量达2160万吨，同比增长约10%，市占率进一步提升。猪价于2022年年中上行改善业绩，2023消费复苏有望提升猪价增利。公司2022年全年出栏约320万头，养殖成本持续下降。上半年由于猪价处于低位，公司生猪养殖业务亏损拖累公司业绩。下半年自年中生猪价格快速提升，猪周期进入新上行周期带动公司生猪养殖业务盈利，公司整体净利端提升较为明显。展望未来，2023年一季度猪价出现旺季不旺，有望带动生猪产能出现季度性去化。2022年中期开始，能繁母猪产能增加缓慢，对应未来供给增速较低，叠加疫后消费复苏带动猪肉消费需求提升，我们认为2023年平均猪价或高于2022年猪价，公司生猪养殖业务有望受益。盈利预测、估值与评级我们预计公司2022-24年收入分别为1061.62/1295.11/1586.26亿元，对应增速分别为23.45%/21.99%/22.48%；归母净利润分别为29.88/48.79/64.19亿元（原值27.46/48.72/64.12亿元），对应增速分别为 87.22%/63.29%/31.55% ，EPS分别为 1.80/2.94/3.86元/股（原值1.65/2.93/3.86元/股）。参考公司历史估值中枢与可比公司平均估值，给予公司2023年27xPE,目标价79.38元，维持“买入”评级。风险提示：动物疫情；极端天气；猪价长期低点；消费恢复不及预期",,国联民生证券,买入,[None],2023-01-13,,买入,5094253,pdf_downloads/2023/2023-01-13/002311-海大集团（002311）：营收净利维持高增，猪周期变动提升业绩.pdf,002311,海大集团,海大集团（002311）：营收净利维持高增，猪周期变动提升业绩
"魏红梅,黄冬祎",海大集团(002311)投资要点：公司是饲料行业龙头。 公司成立于2004年， 总部位于广东省广州市， 主营水产和畜禽饲料的研发、 生产和销售， 并向动保、 动物种苗、 畜禽养殖和健康食品等全产业链发展。 经过多年的发展， 公司在海内外拥有600余家分子公司、 超35000名员工， 设立1个中央研究院、 3大研发中心、十余个研发中试基地。 2021年， 公司饲料销量达到1963万吨， 位居全国第二， 已在市场中形成了一定的品牌影响力。我国饲料行业规模位居全球首位， 多因素推动行业上行。 2021年我国饲料工业产量达到2.93亿吨， 在全球饲料行业的占比为21.16%， 稳居全球首位。 近几年我国饲料行业规模化程度持续提升， 但集中度仍较低， 2021年我国饲料行业的CR3和CR5分别为18.20%与21.50%。 从目前我国饲料行业的实际情况来看， 短期受猪周期影响， 有望带动饲料需求增加。 长期来看， 人均肉类消费量、 政策等因素推动我国饲料行业上行。公司多维布局， 提升自身竞争力。 公司全产业链布局， 饲料规模保持领先地位。 分地区看， 公司持续精耕与下沉市场， 积极拓展海外市场。 在经营的同时， 公司注重产品研发， 研发水平保持行业领先。 产能方面，公司持续加大产能布局， 产能有望稳步释放。 人才管理与激励方面， 公司拥有专业的管理团队， 并制定了积极的激励措施， 一定程度上彰显了对公司未来发展的信心。投资策略： 维持对公司的“推荐” 评级。 公司作为我国饲料行业龙头，以饲料为核心业务， 构建全产业链综合核心竞争体系， 饲料规模不断扩大， 产品结构持续优化， 2021年饲料市占率位居市场第二。 根据生猪养殖周期， 预计生猪供给2023年一季度左右将出现回升， 进而带动猪料需求增加。 同时， 家禽饲料需求有望跟随家禽产量回升而回升， 水产、 反刍及宠物饲料有望保持稳增。 从长期来看， 公司具备核心竞争优势， 持续推进全产业链发展， 产能扩张稳步推进， 业绩有进一步增长空间。 预计公司2022/2023年每股收益分别为1.73元和2.70元， 对应PE估值分别为34倍和22倍， 维持对公司的“推荐” 评级。风险提示： 极端天气影响， 新冠疫情反复影响， 疫病大规模爆发， 原材料价格波动风险， 汇率波动风险,,东莞证券,推荐,[None],2022-12-28,,买入,5082376,pdf_downloads/2022/2022-12-28/002311-海大集团（002311）：多维布局，成长可期.pdf,002311,海大集团,海大集团（002311）：多维布局，成长可期
"唐俊男,张蔓梓","海大集团(002311)投资要点：公司业绩符合预告，净利润增速同比转正。2021年前三季度，公司实现营业收入789.55亿元，同比增长22.76%；归母净利润21.01亿元，同比增长20.34%；扣非后归母净利润20.80亿元，同比增长22.09%。受益于生猪养殖行业景气度回升，行业盈利水平显著提高，公司养殖板块扭亏为盈，带动三季度业绩大幅增长。2022年第三季度，公司实现营收326.29亿元，同比增长24.91%；归母净利润11.83亿元，同比增长453.20%；扣非后归母净利润11.75亿元，同比增长467.87%。生猪养殖景气度回升，产能增加带动饲料需求。2022年三季度，市场上生猪出栏量减少，叠加秋冬季节来临消费端回暖，推动猪价加速上行。2022年四季度仍是猪肉消费需求旺季，预计市场上生猪继续处于供需偏紧状态，生猪价格有望继续维持高位运行，养殖户出栏享受较高盈利水平。根据农业农村部发布，2022年三季度末，全国生猪存栏4.44亿头，同比增长1.4%，环比增长3.1%，连续两个季度环比增长，禽养殖方面盈利水平和产能也在回暖。下游产能的持续恢复将对饲料需求形成较强支撑。公司饲料业务逆势增长，养殖板块扭亏为盈。2022年前三季度，公司饲料、动保、种苗、水产养殖和生猪养殖板块收入均稳步增长。尤其是饲料板块在行业整体下降的情况下迎来逆势增长，实现对外销量约1,503万吨，同比增长7%，其中第三季度单季销量588万吨；前三季度共出栏生猪约230万头，同比增长73%，其中第三季度出栏约70万头。受生猪价格上行利好影响，1-9月份公司生猪养殖业务扭亏为盈，预计四季度仍将维持较高盈利水平。根据饲料工业协会数据，2022年前三季度全国饲料工业饲料总产量约2.16亿吨，同比下降1.2%。公司饲料业务增速显著高于行业整体水平，将推动公司市占率进一步提升。公司实控人全额认购定增彰显长期发展信心。2022年4月公司发布定增预案，拟募资不超过15亿元用于补充公司流动资金，此次定增将由公司实控人薛华全额认购。随着公司的经营发展，业务规模不断扩大，公司近年有息债务逐步攀升。截至2022年三季度末，公司的资产负债率为62.26%，较2021年末增长了6.96个百分点，通过此次定增有利于降低公司资产负债率，优化资本结构，提高公司抗风险能力，同时助力公司进一步扩大产能，提高公司在行业中的核心竞争力。公司实控人薛华先生通过海灏投资间接持有公司股份，本次定增发行后薛华先生将另外直接持有公司股份不超过33,370,411股，拟直接持股比例不超过增发后总股本1.97%。公司实控人全额现金认购的方式有利于增强投资者信心，提升公司投资价值，进而实现公司股东利益最大化，切实保障中小股东利益。目前公司定增方案已获得股东大会通过。维持公司“增持”评级。考虑到公司生猪板块回暖和产能扩张情况，上调2022-2024年归母净利润分别为29.41/43.46/53.06亿元，对应EPS分别为1.77/2.62/3.19元每股，对应PE分别为33.31/22.55/18.47倍。根据公司历史PE均值来看，在行业市占率提升和业绩增长下，2023年估值仍有一定的扩张空间，继续维持公司“增持”的评级。风险提示：原材料价格波动，猪价大幅波动及种苗、动保业务推进不及预期的风险。",,中原证券,增持,[None],2022-11-17,,增持,5053727,pdf_downloads/2022/2022-11-17/002311-海大集团（002311）2022年三季报点评：养殖板块扭亏，饲料市占率持续提升.pdf,002311,海大集团,海大集团（002311）2022年三季报点评：养殖板块扭亏，饲料市占率持续提升
"程诗月,孟林",事件：公司披露2022年三季报，公司22前三季度实现营业收入789.55亿元，同比增长22.76%，实现归母净利润21.02亿元，同比增长20.34%；其中单三季度实现营业收入32.63亿元，同比增长24.91%，实现归母净利润11.83亿元，同比增长453.20%。行业低谷复苏，饲料主业逆势增长。2022年三季度，随畜禽价格触底回升，养殖盈利能力明显改善，畜禽料需求改善；水产受前期供应较少影响，终端价格回升，带动投料积极性恢复性增长，饲料行业整体需求触底回升。但整体盈利情况仍然受制于原料高企，玉米豆粕价格创历史新高，给饲料企业成本端带来较大压力。在行业承压的大背景下，公司依然凭借多年积累下来核心竞争优势实现了外销饲料1503万吨的成绩，同比逆势增长7%。短期来看，伴随养殖景气和存栏恢复，饲料板块基本面触底回升，作为养殖后周期有望实现量利齐升。长期来看我们依然看好公司采购管理带来的综合成本优势，公司有望实现市占率和定价权的持续提升。猪价景气上行，养殖业务实现扭亏。公司22年前三季度实现生猪出栏230万头，同比增长73%，其中单三季度出栏70万头左右。三季度猪价22省市生猪均价22.49元/公斤，近期进一步冲高到28元/公斤，显著高于公司养殖成本线，公司Q3养殖业务扭亏为盈。目前能繁母猪存栏恢复较为温和，预计Q4消费旺季猪价有望维持高位，明年养殖仍将具备合理盈利空间，公司养殖业务有望保持合理盈利水平，并持续发挥其战略作用，为公司主营饲料业务核心竞争力的提升提供持续支持。看好公司长期成长。我们认为公司作为饲料行业龙头企业，有望凭借“四位一体”的综合优势，充分发掘养殖需求，提升客户黏性和议价权，持续提升行业竞争力和市占率。苗种、动保和养殖业务作为公司战略板块将持续支撑主业发展，并贡献可观收益，我们看好公司长期成长潜力。公司盈利预测及投资评级：我们看好饲料板块及养殖板块基本面景气回升，公司主营饲料及配套业务的核心竞争力及市占率逐步提升。预计公司22-24年归母净利分别为26.31、41.11和58.60亿元，EPS为1.58、2.47和3.53元，PE为38、24和17倍，维持“强烈推荐”评级。风险提示：公司饲料销售不及预期，生猪价格波动风险等。,,东兴证券,强烈推荐,[None],2022-10-26,,买入,5024116,pdf_downloads/2022/2022-10-26/002311-海大集团（002311）：饲料逆势增长，养殖扭亏为盈.pdf,002311,海大集团,海大集团（002311）：饲料逆势增长，养殖扭亏为盈
汪玲,事件10月21日，公司发布《2022年第三季度报告》，前三季度实现营收789.55亿元，同比增长22.76%；实现归母净利润21.02亿元，同比增长20.34%；实现扣非归母净利润20.80亿元，同比增长22.07%。点评营收净利双增，Q3业绩环比显著增长。公司2022年前三季度营收、归母净利润均呈现同比20%以上的增速增长；分季度来看，公司2022Q3实现营收326.29亿元，同比+24.91%，环比+23.72%；实现归母净利润11.83亿元，同比+453.20%，环比+64.83%。公司业绩稳健增长，Q3盈利能力显著提升主要系：1）Q3下游养殖利润回暖，带动饲料需求提升，公司饲料业务经营改善；2）4月以来猪价持续上涨，公司生猪养殖业务前三季度扭亏为盈。饲料业务量增价升，有望随禽畜养殖盈利回暖持续改善。销量方面，2022年前三季度，公司饲料业务在行业整体下滑的情况下，实现外销量约1503万吨，同比+7%，市占率进一步提升。分季度来看，Q3公司饲料销量约为588万吨，其中水产料约200万吨（同比+8%），猪料120-130万吨（同比+0%），禽料约260万吨（同比+4%）。价格方面，水产料单价Q3环比Q2增加约130元/吨，猪料单价Q3环比Q2增加约150元/吨，禽料单价Q3环比Q2增加70-80元/吨。饲料销量逆势增长叠加饲料单价提升，公司饲料业务经营情况显著改善，销售收入稳步增长。展望Q4，下游禽畜养殖盈利能力有望进一步提振，带动水产和禽畜饲料消费需求增加，饲料业务有望持续改善。Q4猪价预计高位运行，生猪养殖业务利润弹性可期。2022年前三季度，公司共出栏生猪约230万头，同比+73%。2022Q3公司出栏生猪约70万头，实现净利润4亿元左右。根据涌益资讯，Q3生猪均价为22.42元/公斤，环比Q2+48.75%。受益于猪价上涨利好影响，公司前三季度生猪养殖业务实现扭亏为盈，业绩增长符合预期。三季度以来猪价持续走高，10月已突破28元/公斤的高位。受前期产能去化效应显现以及二次育肥影响，四季度生猪供给整体偏紧，叠加市场逐渐步入消费旺季，我们判断Q4猪价有望高位运行。考虑到公司生猪养殖规模扩大，养殖成本逐步改善，公司生猪养殖业务有望受益于行业高景气而持续兑现。投资建议国内饲料龙头，多元化产业链铸造壁垒。考虑到公司核心主业饲料业务预计持续改善，生猪养殖有望贡献利润弹性，公司整体盈利能力有望进一步提升。我们预计2022-2024年，公司营业收入分别为1058.59/1290.78/1532.94亿元，归母净利润分别为26.44/46.18/61.19亿元，对应EPS1.59/2.78/3.68元/股，当前股价对应PE分别为37.74/21.61/16.31倍，维持“推荐”评级。风险提示上游原材料价格大幅波动；动物疫病风险；环保政策。,,东亚前海证券,推荐,[None],2022-10-25,,增持,5023943,pdf_downloads/2022/2022-10-25/002311-海大集团（002311）2022年三季报点评：饲料业务量价齐升，生猪养殖利润弹性可期.pdf,002311,海大集团,海大集团（002311）2022年三季报点评：饲料业务量价齐升，生猪养殖利润弹性可期
程晓东,"季报点评：养殖业务大幅扭亏为盈，饲料业务持续逆势增长 事件：公司近日发布2022年三季报。前3季度，实现营收789.54亿元，同增22.76%；归母净利21.01亿元，同增20.34%；扣非后归母净利20.8亿元，同增22.09%。单3季度，实现营收326.29亿元，同增24.91%；归母净利11.83亿元，同增453.2%；扣非后归母净利11.75亿元，同增467.87%。点评如下：养殖业务量增价涨，单头盈利大幅增长。上半年，公司生猪出栏160万头，同比大幅增长；但受猪价低迷的影响，生猪养殖业务亏损3.68亿元，单头亏损230元。进入3季度，猪价大涨，带动养殖业务大幅扭亏为盈。估计单三季度，公司生猪销售均价约20.8元/公斤，单头盈利约540元，生猪养殖业务盈利3.78亿元。公司持续聚焦生猪养殖团队能力建设和自有育种体系建设，团队管理能力和专业能力进一步提升，叠加饲料端的研发及规模优势，综合养殖成本管控能力进一步增强。估计单三季度，生猪养殖综合成本降至16.3元/公斤，成本管理水平已经领先于大多数同行。截至3季度末，生产性生物资产5.05亿元，同增5.72%。2季度末和1季度末，同比增速分别为10.63%和45.22%。与前期相比，同比增速有所回落。饲料业务持续逆势增长。上半年，饲料外销量915万吨，同增9.1%，增速超过全行业。同期，全国工业饲料总产量同比下降4.3%。单3季度，饲料外销量590万吨，同增5.16%。与上半年相比，3季度增速略有下降，但仍超过全行业水平，市场份额在进一步提升。估计单3季度，饲料业务单吨净利超过100元，处于历史较高水平。动保和种苗业务维持较快增长，预计全年两位数增长。盈利预测与投资建议。进入10月份，猪价突破前期高点继续上涨。我们预计，高猪价有望贯穿整个4季度，带动养殖产业链景气上升。在行业高景气背景下，公司依托自身较强的竞争优势，养殖、饲料等各项业务盈利水平将进一步上升。公司不断加码研发、采购和激励机制建设，产品力和管理水平持续提升，竞争优势明显，市占率有望持续提升。我们看好公司核心竞争优势和长远发展，给予“买入”评级。预计公司22/23年归母净利润32.2/51.3亿元,对应PE为30.65/19.29倍。风险提示：养殖集团压价导致饲料动保产品提价幅度不达预期，业内竞争加剧导致销售不及预期",,太平洋证券,买入,[None],2022-10-23,,买入,5021662,pdf_downloads/2022/2022-10-23/002311-海大集团（002311）季报点评：养殖业务大幅扭亏为盈，饲料业务持续逆势增长.pdf,002311,海大集团,海大集团（002311）季报点评：养殖业务大幅扭亏为盈，饲料业务持续逆势增长
陈雪丽,饲料销量回暖，生猪业务持续改善，维持“买入”评级海大集团发布2022年三季报，前三季度实现营收789.55亿元（+22.76%），归母净利润21.02亿元（+20.34%）。单Q3实现营收326.29亿元（+24.91%），归母净利润11.83亿元（+453.2%）。考虑到饲料原料价格仍处高位，三季度水产料销售承压，我们下调2022-2024年盈利预测，预计公司2022-2024年归母净利润分别为27.1/46.9/52.1亿元（前预测值31.8/45.6/66.7亿元），EPS分别为1.63/2.82/3.13元，当前股价对应PE分别为36.5/21.1/19.0倍。禽畜价格回暖带动补栏及饲料需求上行，公司盈利能力迎来修复，维持“买入”评级。禽畜价格回升带动饲料需求回暖，水产料受异常高温影响销量承压报告期内公司实现饲料外销量1503万吨（+7%），Q2末期全国生猪产能开启上行趋势，猪价快速上涨，当下行业补栏意愿较高，Q4猪禽饲料销量有望加速提升；受7-8月高温影响，水产品生长环境恶劣，养殖户被动减少投苗及饲料用量，水产料需求旺季不旺，销量承压。报告期内，玉米大豆等饲料原料价格较高，公司借助提价、技术转化和采购等优势应对成本压力，饲料营收实现同比增长。Q3生猪盈利大幅改善，动保种苗业务延续增长报告期内公司出栏生猪约230万头（+73%），单Q3生猪出栏约70万头，我们估计单头盈利约为550元，单Q3板块归母净利约3.85亿元，同比扭亏为盈。公司生猪养殖成本优势突出，预计全年完全成本约为16.5元/公斤。报告期内种苗、动保板块营收亦实现同比增长，随着特水对普水品种的替代趋势显现，公司围绕名特优品种升级打造育种体系，报告期内研发投入稳步增长（+23.34%）。募投项目稳步推进，在建工程及财务费用增幅较高报告期内，公司经营规模扩大，借款金额增加，在建工程及财务费用分别同比增长59.38%及50.44%，用于饲料产能提升的2020年可转债募投项目稳步推进，公司饲料年产量有望稳步提升，逐渐向4000万吨年销量目标迈进。风险提示：饲料原料价格下降幅度、生猪养殖行业亏损周期长度等。,,开源证券,买入,[None],2022-10-21,,买入,5020473,pdf_downloads/2022/2022-10-21/002311-海大集团（002311）公司信息更新报告：饲料销量回暖，生猪业务持续改善.pdf,002311,海大集团,海大集团（002311）公司信息更新报告：饲料销量回暖，生猪业务持续改善
