author,content,filename,org_name,original_rating,pdf_link,publish_time,rating_adjust_mark_type,rating_changes,report_id,save_path,stock_code,stock_name,title
"杨翼荥,陈屹","10 月 27 日，公司发布三季报，前三季度实现营收 161.96 亿元，同比增长
43%，归母净利润 53.18,亿元，同比增长 69%，三季度，实现营收 57.29 亿
元，同比增长 52%，归母净利润 15.85 亿元，同比增长 50%。生产基本平稳，原材料价格上行促使产品盈利承压。公司三季度整体生产保
持相对平稳，烯烃产量环比提升 8%，同比提升 12%，生产处于高负荷运行
中，焦炭整体产量有所下行，但由于价格维持较高水平，整体营收仍有上
行。公司作为典型煤化工企业，终端两大方向产品烯烃和焦炭整体运行呈现
较为明显的分化，其中焦炭受到整体产业链价格的调整，原材料及产品都处
于上行周期，而公司还部分配套焦煤产能，充分受益于产品价格的上行；但
烯烃产品整体的运行就受到一定的影响，我国虽然建设了较多的煤制烯烃、
甲醇制烯烃产能，但整体的仍然占比相对较小，石化产业链定价仍然较为坚
固，而三季度聚乙烯、聚丙烯的公司产品销售价格基本维持稳定，产品价格
没有上行，但原材料价格大幅提升，公司的整体盈利能力相对承压，因而整
体毛利率较二季度有明显的下行约 9%，因而影响公司的利润体量。产能建设仍在持续推进，焦化、气化产品分散单一产线风险。目前公司仍在
持续推进焦化、气化双线的产能建设，在现有 400 万吨焦化产能的基础上年
底扩充 300 万吨产能，为明年提供新的增量，同时宁东持续后续煤制烯烃的
产能建设，三期仍在持续推进为公司后年提供新增产能。整体来看，公司采
用焦化、气化双路线建设，将分散单一气化路线的风险，在没有特殊的原材
料波动状态下，提供相对较好的盈利水平。短期由于煤炭价格异常提升，使得公司现阶段煤制烯烃产品大幅提升，盈利
压缩，短期承压，但公司在煤制烯烃产业链竞争力较强，在产品价格回归正
常区间的状态下有望维持较好盈利水平，预测公司 2021-2023 年归母净利润
68.97 亿元、84.59 亿元、105.67 亿元，对应 PE 分别为 16.07、13.10、
10.49 倍，维持“买入”评级。新建项目建设进度不达预期风险；产品价格剧烈波动风险；原材料价格大幅
波动风险；政策变动影响公司未来新建产能风险。",,国金证券,买入,[None],2021-10-28,,买入,4653041,pdf_downloads/2021/2021-10-28/600989-宝丰能源（600989）：煤价提升影响盈利空间，双线布局分散风险.pdf,600989,宝丰能源,宝丰能源（600989）：煤价提升影响盈利空间，双线布局分散风险
谢楠,"投资要点事件：8月9日，公司发布2021年中报：2021H1实现营业收入104.67亿元，同比增长39.18%，实现归属母公司净利润37.33亿元，同比增长78.46%，实现扣非归母净利润38.70亿元，同比增长87.25%。2021Q2单季实现营业收入54.88亿元，同比增长40.32%，环比增长10.21%，实现归属母公司净利润20.06亿元，同比增长57.89%，环比增长16.07%，实现扣非归属净利润20.71亿元，同比增长65.05%，环比增长15.09%。此外，公司拟与中国化学全面建立战略合作关系，此次参与认购其非公开发行股份，认购金额不超过10亿元。点评：产品价格上涨，一体化成本优势显著。2021H1实现归母净利润37.33亿元，同比+78.46%，Q2单季实现归母净利20.06亿元，环比+16.07%。盈利能力方面，2021H1毛利率为51.59%，同比+11.4pct；净利率为35.67%，同比+7.85pct，业绩与盈利能力均更上一台阶。期间费用方面，2021H1公司期间费用率为7.01%，同比-1.23pct。其中，销售费用率为2.38%，同比-1.36pct，管理费用（含研发费用，可比口径）率为3.29%，同比-0.07pct，财务费用率为1.35%，同比+0.19pct，公司延续精细化成本管控，降本增效效果明显。我们认为，产品价格上涨以及一体化的成本优势是业绩增长的原因：（1）主营产品烯烃及焦炭价格大幅上涨；（2）去年甲醇项目、红四煤矿陆续投产，原料自给率大幅提升；（3）精细化管理，强调成本管控，同时通过不断优化工艺，降低产品单耗。烯烃板块以价补量，布局高端化与终端客户开发。产品价格走高：原油价格由年初的51.8美元/桶上涨至75美元/桶，带动化工产品价格上涨，公司2021H1聚乙烯均价为7,159.02元/吨，同比+23.20%；聚丙烯均价为7,594.51元/吨，同比+12.42%，后段纯苯、改质沥青、MTBE等精细化工产品销售价格同比分别上涨62.67%、44.58%、36.36%，驱动营收大幅上涨。检修致产销下滑：2021H1公司实现聚乙烯产量36.69万吨，同比+5.43%,销量36.12万吨，同比+5.55%；聚丙烯产量27.27万吨，同比-19.20%，销量26.67万吨，同比-21.07%。聚丙烯装置在一季度进行的短期检修导致公司2021H1聚烯烃销量同比-7.67%，但产品价格大幅上涨保障了公司烯烃业务仍维持较高的营收增速。一体化抵御原料上涨压力：2021H1煤炭价格大幅上涨，公司原煤，精煤，动力煤平均采购单价同比分别上涨61.27%、32.82%、53.52%，去年甲醇项目、红四煤矿陆续投产，原料自给率大幅提升，抵御原料上涨压力。工艺优化降低产品单耗：公司加大科技攻关力度，不断优化生产
工艺和技术参数，上半年公司甲醇二期煤醇比较上年下降 4.71%，醇烯比低至
2.868t/t，烯烃二厂通过技改将丙烷回收率提高了 68.91%，全年可增产丙烷约 3000
吨。随着工艺技术的持续优化，公司的成本优势将更加明显。产品布局高端化：对
现有牌号不断进行优化，其中 HD55110 产品分子量及分布等参数与国外产品相对，
膜的撕裂性超进口产品。此外，公司 7 月试生产 3 个牌号茂金属聚乙烯，产品盈利
较普通产品大幅提升。未来，公司产品结构将不断向着高端化、高附加值方向发展。
加终端客户开发：公司持续拓宽优化供销渠道，优化客户结构，积极发展优质客户。
上半年公司聚烯烃直销率为 8.8%，较 2020 年提高 5.1 个百分点；焦炭终端厂家销
售占比提升至 90.2%，较 2020 年提高 6.1 个百分点。",,中泰证券,买入,[None],2021-08-11,,买入,4584413,pdf_downloads/2021/2021-08-11/600989-宝丰能源（600989）：降本增效业绩创新高，深化碳中和绿色成长.pdf,600989,宝丰能源,宝丰能源（600989）：降本增效业绩创新高，深化碳中和绿色成长
张绪成,主营产品收入大增，认购中国化学助力战略合作。维持“买入”评级公司发布半年报，2021年上半年实现营收105亿元，同比+39.2%；实现归母净利37.3亿元，同比+78.5%，扣非归母净利润38.7亿元，同比+87.3%；Q2单季实现归母净利润20.1亿元，环比+16.1%。根据产能释放节奏，我们调整盈利预测，预计2021-2023年归母净利润分别为70.7/87.0/139.1（前值65.3/80.6/162.4）亿元，同比增长52.9%/23.1%/59.8%，EPS分别为0.96/1.19/1.90（前值0.89/1.10/2.21）元；对应当前股价PE分别为17.8/14.5/9.0倍，公司预计2023年投产的内蒙烯烃项目分期进行建设，整体节奏符合预期，维持“买入”评级。H1业绩同比大增，价格和成本双受益产品价格大涨和成本降低：聚烯烃产品，PE和PP分别同比上涨23.2%和12.4%，虽然原料煤也出现了大幅增长，但宁东二期烯烃2020H1为外购甲醇，而2021H1变为自产甲醇，导致成本大幅降低。焦炭产品，价格涨幅为60.1%，高于原材料精煤价格32.8%的涨幅，焦炭利润空间也实现明显增厚，同时红四煤矿的投产，提高了炼焦精煤的自给率达到了降成本的目的。技术优化，成本管控精益求精。烯烃二期的煤醇比较同期下降4.71%，醇烯比将至2.868t/t，居于国际领先水平；马莲台煤矿推行沿空留巷技术，回采率提高6.2%，原煤开采成本再一步降低。新项目持续推进，公司业绩增长点可期宁东三期烯烃，50万吨煤制烯烃及50万吨C2-C5综合利用项目稳步推进，甲醇及烯烃预计2022年底建成，25万吨EVA项目预计2023年建成投产。宁东四期，新获得的50万吨煤制烯烃项目已进行环评前公示。内蒙烯烃项目，400万吨煤制烯烃环评报告增加了碳减排专篇已送审环保部，正在按要求积极推进环评事项。宁东焦炭项目，300万吨焦化多联产项目，第一座焦炉预计于2021年8 月底冷态安装完成，全部项目2021年底建成。绿氢项目，年产2.4亿标方“绿氢”，目前已经有10台投入运营，计划2021年年底前全部建成投产，年可减少煤炭资源消耗约38万吨、减少二氧化碳排放约66万吨、减少碳排放总量的5%。拟认购中国化学定增10亿元，加强战略合作公司拟认购定增中国化学，进一步深化双方战略合作，在装备、技术、工艺方面的合作，尽快使宝丰能源从源头治理“碳排放”，早日实现“碳中和”。风险提示：产品价格下跌风险、原材料价格上涨风险、新建项目不及预期风险财务摘要和估值指标,,开源证券,买入,[None],2021-08-11,,买入,4584479,pdf_downloads/2021/2021-08-11/600989-宝丰能源（600989）公司中报点评报告：业绩同比大增，碳中和背景下优势凸显.pdf,600989,宝丰能源,宝丰能源（600989）公司中报点评报告：业绩同比大增，碳中和背景下优势凸显
"任文坡,林相宜",核心观点：事件 公司发布2021年半年度报告，实现营业收入104.67亿元，同比增长39.18%；归母净利润37.33亿元，同比增长78.46%。其中，Q1、Q2营业收入分别为49.79、54.88亿元，分别同比增长37.94%、40.32%；归母净利润分别为17.28、20.06亿元，分别同比增长110.25%、57.89%。主营产品价格同比涨幅较大、抵御煤价上涨，使得公司业绩和盈利能力大幅提升 2021上半年公司烯烃、焦炭业务营业收入分别为54.45、39.35亿元，分别同比增长23.15%、67.52%，主要原因系聚乙烯、聚丙烯、焦炭价格分别同比增加23.30%、12.42%、60.10%。成本方面，烯烃业务成本同比增加17.74亿元，增幅较低主要系上年同期220万吨/年甲醇二期项目未投产，烯烃二期生产所用甲醇全部外购，而本期烯烃二期所用甲醇全部自产；焦炭业务成本同比增加3.06亿元，主要系精煤上半年平均采购单价增加32.82%至805元/吨。2021年公司将原料煤采购范围逐步向陕西、新疆发展，开发新疆地区低价资源作为补充，缓解供应紧张局面，降低采购成本，为后期“疆煤进宁”奠定基础。产能持续扩张，有望实现跨周期、高成长 从煤制烯烃业务布局来看，公司布局烯烃三期100万吨/年项目以及内蒙400万吨/年烯烃项目，其中烯烃三期项目有望于2022年底投产，并具备生产高端产品25万吨/年EVA（预计2023年投产）的能力。同时烯烃四期50万吨/年项目已进行环评前公示。从焦炭业务布局来看，受2021年我国坚决压减钢铁产量影响，焦炭需求将受到一定压制。我们认为，在供给侧改革背景下，焦炭行业集中度将进一步提升，仍将保持较好利润区间。焦炭300万吨/年项目预计于2021年底投产，届时焦炭产能将达到700万吨/年，进一步增厚公司利润。公司主营业务的持续扩张，公司有望实现跨周期、高成长。倾力打造新能源电解制氢项目，实现碳减排、加快碳中和 公司启动国家级太阳能电解制氢储能及应用示范项目，可年产2.4亿标方“绿氢”和1.2亿标方“绿氧”，目前已经有10台投入运营，计划今年年底前全部建成投产。项目可替代原料煤、燃料煤制氢和制氧，年可新增减少煤炭资源消耗约38万吨、年新增减少二氧化碳排放约66万吨、年新增消减化工装置碳排放总量的5%，综合效益显著。公司积极为实现国家“双碳”目标、实现绿色高质量发展贡献力量。投资建议 我们预计2021-2023年公司营收分别为205.72、273.44、361.84亿元，同比变化29.16%、32.92%、32.33%；归母净利润分别为65.77、90.92、115.91亿元，同比变化42.28%、38.24%、27.48%；每股收益（EPS）分别为0.90、1.24、1.58元，对应PE分别为19.13、13.84、10.86倍。看好公司未来高成长性，维持“推荐”评级。,,银河证券,推荐,[None],2021-08-10,,买入,4584373,pdf_downloads/2021/2021-08-10/600989-宝丰能源（600989）：21H1盈利创新高，项目扩张助力成长.pdf,600989,宝丰能源,宝丰能源（600989）：21H1盈利创新高，项目扩张助力成长
"李骥,沈颖洁",投资要点事件：8 月 10 日，公司发布公告，公司 2021 年上半年实现营业收入 104.67 亿元，同比增长 39.18%；实现归母净利润 37.33 亿元，同比增长 78.46%。二季度业绩创新高，利润显著增厚。2021H1，公司实现营收 104.67 亿元，同比增长 39.18%；实现归母净利润 37.33 亿元，同比增长 78.46%，实现销售毛利率51.59%，销售净利率 35.67%。 公司二季度营收业绩创下双重新高，实现营收 54.88亿元，同比增长 40.32%，环比增长 10.22%；实现归母净利 20.06 亿元，同比增长 57.89%，环比增长 16.09%；单季度毛利率和净利率分别实现 51.75%和36.55%，较一季度各自提升 0.34 和 1.85 个百分点。公司综合成本优势显著，盈利护城河较高多渠道精细化管控成本， 持续拓宽终端销售。 上半年公司烯烃、焦炭、精细化工品板块分别实现营收 54.45 亿元、 39.35 亿元和 10.61 亿元，同比增长分别为 23.15%、67.52%和 45.28%。 上半年公司采购端煤炭价格大幅上涨，原煤、精煤和动力煤均价分别为 501.39 元/吨、805.28 元/吨和 356.13 元/吨，同比增幅高达 61.27%、32.82%和 53.52%。在此背景下，公司烯烃板块营业成本增幅较低主要系烯烃二期所用甲醇已实现全部自产，募投项目甲醇二期煤醇比较上年下降 4.71%，醇烯比低至 2.868t/t。此外，公司持续拓宽优化供销渠道，优化客户结构，积极发展优质客户。上半年公司聚烯烃直销率为 8.8%，较 2020 年提高 5.1 个百分点；焦炭终端厂家销售占比提升至 90.2%，较 2020 年提高 6.1 个百分点；开拓 1-丁烯直供合作，精细化工产品终端销量平均占比达 85%。加快推进各项扩产项目，确保梯次投产进度。公司太阳能电解水制氢项目目前已有 10 台投入运营，计划年底建成投产。宁东三期 50 万吨/年煤制烯烃及 50 万吨/年 C2-C5 综合利用制烯烃项目稳步推进，其中甲醇及烯烃项目计划于 2022 年底建成，EVA 装置于 2023 年建成投产；宁东四期煤制烯烃项目已进行环评前公示；内蒙项目环评新增碳减排专篇并已送审；300 万吨/年焦化多联产项目方面，第一座焦炉预计于 2021 年 8 月底冷态安装完成，整个项目力争年底建成。 公司梯次投产计划确保其成长属性，项目稳步投产将带动盈利空间提升。投资建议：考虑公司在高成本背景下的精细化成本管控能力以及项目投产后持续强化的盈利能力， 预计公司 2021-2023 年每股收益分别为 0.99、 1.20 和 2.01 元，对应 PE 分别为 17、14 和 9 倍，维持“买入”评级。风险提示：投产进度不及预期，下游需求不及预期，产品价格波动风险等。,,德邦证券,买入,[None],2021-08-10,,买入,4584308,pdf_downloads/2021/2021-08-10/600989-宝丰能源（600989）：2021H1业绩显著增厚，梯次投产夯实其成长性.pdf,600989,宝丰能源,宝丰能源（600989）：2021H1业绩显著增厚，梯次投产夯实其成长性
沈猛,投资要点事件：公司发布2021年半年度报告，上半年实现营收104.7亿元，同比增长39.2%，实现归母净利润37.3亿元，同比增长78.5%；二季度实现营收54.9亿元，同比增长40.3%，环比增长10.2%，实现归母净利润20.1亿元，同比增长57.9%，环比增长16.1%，业绩高于市场预期。焦炭、烯烃高位持稳，精细化工产品景气上行。二季度公司PE、PP、焦炭、纯苯、改质沥青、MTBE均价分别为7239、7671、1669、6367、3793、5326元/吨，环比变动+2.3%、+2.1%、-2.8%、+46.7%、+23.8%、+19.6%。公司一方面受益于产品高景气度，一方面加紧市场开拓与内部挖潜，经营业绩明显改善。此外，公司2万吨/年茂金属聚乙烯（mPE）7月成功试产，成为国内首家以双环管HDPE工艺生产茂金属产品的企业，差异化产品对公司业绩贡献值得期待。新一轮资本开支启动，烯烃、焦化有序扩产。公司现有多个在建项目，烯烃方面，三期50万吨/年烯烃项目与50万吨/副产物C2-C5制烯烃项目在宁东基地同时动工，20万吨/年苯乙烯及EPS项目正进行环评前公示。公司启动异地扩产计划，计划在鄂尔多斯打造全球最大规模的4×100万吨/年煤制烯烃项目，依托鄂尔多斯丰富的煤炭资源以及更为先进的工艺，内蒙项目将更具成本优势。焦炭方面，公司力争在年底建成300万吨/年煤焦化多联产项目，有望填补焦炭去产能后留下的空白。响应“碳中和”战略，布局“绿氢”减排增收。公司依托宁夏丰沛的日照资源，建设全球最大一体化太阳能电解水制氢项目，采用“新能源发电+电解水制取绿氢绿氧直供煤化工”的模式，年产氢气1.6亿标方/年，氧气0.8亿标方/年，项目一期已于今年2月投入试运行，所产氢气成功用于烯烃生产，目前综合成本控制在1.34元/Nm³，远期有望降至0.70元/Nm³。未来公司还将加大投入，实现由化石能源向新能源转型，为公司发展提供了无限空间。盈利预测与投资建议。预计2021-2023年EPS分别为0.98元、1.15元、1.56元，2021年可比公司平均PE为16倍，考虑到公司煤制烯烃龙头地位及在建项目赋予成长性，我们给予2021年22倍估值，对应目标价为21.56元，首次覆盖给予“买入”评级。风险提示：原材料价格大幅上涨、产品价格下跌、在建项目进度不及预期。,,西南证券,买入,[None],2021-08-10,,买入,4583805,pdf_downloads/2021/2021-08-10/600989-宝丰能源（600989）：Q2业绩超预期，中期成长确定性强.pdf,600989,宝丰能源,宝丰能源（600989）：Q2业绩超预期，中期成长确定性强
"曾杰煌,杨侃",一、事件概述2021年8月9日，公司发布2021年半年度业绩公告，2021年上半年实现营业收入104.7亿元，同比增长39.2%；实现归母净利润37.3亿元，同比增长78.5%；实现扣非归母净利润38.7亿元，同比增长87.3%。二、分析与判断营收快速增长，毛利大幅提升，现金流情况良好收入端：分产品，烯烃产品营收为54.4亿元，增幅为23.15%，焦炭产品营收为39.3亿元，增幅为67.52%，精细化工产品营收达10.6亿元，同比增长45.28%。毛利率：公司上半年综合毛利率为51.6%，较去年同期的40.2%增长了11.4个百分点，主要系甲醇自产后使得成本增幅低于产品价格增幅影响。现金流：2021年上半年实现经营性现金流量净额35.2亿元，同比增长36.9%，现金流情况较好。公司成本优势凸显，产能扩张打开盈利天花板公司成本优势显著：相较于油制烯烃，由于我国煤炭资源丰富，煤制烯烃工艺的原料供应稳定，且国内煤制烯烃装置大部分位于煤矿附近，运输距离较油制烯烃短，运输成本大大缩减。相较于煤制烯烃同行业企业，公司具备工艺技术先进（原料消耗低）、项目投资成本低（折旧低）、运营优势和规模优势，公司聚烯烃2020年的平均成本为3693元/吨，而中煤能源和中国神华的同期成本分别为4985元/吨和4625元/吨，公司成本优势明显。产能扩张打开盈利天花板：烯烃产品方面，截至2021上年度，公司煤制烯烃产能为120万吨/年，占国内总产能的10%。后续随着宁夏三期100万吨/年项目、四期项目和内蒙项目400万吨/年项目的投建，公司未来总产能将超620万吨/年。焦炭方面，公司目前焦炭产能为400万吨，而300 万吨/年煤焦化多联产项目预计 2021 年底完工，届时焦炭产能将达700万吨。新材料与绿氢双轮驱动，产品高端化与低碳化并行新材料方面，公司宁夏现有园区三期项目包含25万吨/年EVA的高端产能，预计在2023年投产，EVA被广泛应用于发泡材料、电线电缆、光伏封装膜等领域，国内该产品的进口依赖度为60%，需求旺盛。绿氢方面，公司于2019年启动电解水制氢储能及综合应用示范项目，该项目采用单台产能1000标方/小时的高效碱性电解槽制氢设备，并配套相应的氢气压缩与储存设备，可年产2.4亿标方“绿氢”和1.2亿标方“绿氧”，目前已经有10台投入运营，计划今年年底前全部建成投产；改项目预计年可新增减少煤炭资源消耗约 38 万吨、年新增减少二氧化碳排放约 66 万吨、年新增消减化工装置碳排放总量的 5%，综合效益显著。三、投资建议预计公司2021-2023年营收为215.4/255.3/347.1亿元，归母净利润为71.4/88.2/121.7亿元，EPS为0.96/1.20/1.66元，对应PE为17.6/14.3/10.3倍。参考可比公司2021年14.2倍的PE，并考虑到公司在煤制烯烃方面的成本优势以及公司未来三年烯烃及焦煤业务产能持续释放带来的业绩快速增长，维持“推荐”评级。四、风险提示：聚乙烯、聚丙烯和焦炭的价格下跌；新增项目推进速度放缓；公司煤矿审批进度放缓。,,民生证券,推荐,[None],2021-08-10,,增持,4583660,pdf_downloads/2021/2021-08-10/600989-宝丰能源（600989）2021年半年度业绩点评：营收高增长，毛利大幅提升.pdf,600989,宝丰能源,宝丰能源（600989）2021年半年度业绩点评：营收高增长，毛利大幅提升
"杨翼荥,陈屹",业绩	2021年8月10日，公司发布半年度报告，上半年实现营收104.67亿元，同比增长39.18%，归母净利润37.33亿元，同比增长78.64%。公司拟参与认购上市公司中国化学非公开发行股份，认购金额不超过10亿元人民币。	分析	多产品价格提升共振，带动公司产品盈利大幅上行。公司二季度实现营收54.88亿元，同比增长40.32%，归母净利润20.06亿元，同比增长57.89%，截止目前公司已经连续3个季度维持单季度毛利率51%以上，而收益公司聚烯烃、纯苯、改质沥青、MTBE等多个产品价格大幅提升的影响，公司的整体二季度归母净利润环比提升约16.07%。二季度公司整体产品销售保持平稳，焦炭产品销量提升约19%，虽然整体二季度焦炭的销售单价略有下行，但量增叠加，原材料部分自给，公司产品依旧表现亮眼。	多维度持续夯实自身的竞争优势，不断强化自身的成本竞争优势。多年来公司结合自身区位优势，合理安排生产环节，实现资源充分利用和成本节约。在此基础上，公司通过自身技术和管理优化，在现有装置的基础上，进一步优化工艺，降低生产成本，上半年公司甲醇二期煤醇比较上年下降4.71%，醇烯比低至2.868t/t，烯烃二厂通过技改丙烷回收率提高了68.91%。公司优化马莲台煤矿开采设计，降低开采成本，提升资源回采率，同时降低洗煤单耗。公司在原有优势的基础上继续优化，降低成本，夯实自身竞争优势。	持续推进产能建设，助力公司获得长期成长空间。上半年公司持续推动项目进程，太阳能电解制氢项目已有10台电解槽制氢设备投入运行，预计到年底能够建成年产2.4亿标方“绿氢”和1.2亿标方“绿氧”产能，为公司降低节约煤炭使用，减低碳排放提供有效助力；同时公司宁东三期项目仍在有序推进，宁东四期煤制烯烃项目已进行环评前公示，内蒙400万吨/年煤制烯烃项目已按审批部门要求，在项目环评报告书中增加了碳减排专篇并已送审，公司持续推进规划及建设项目，为公司长远发展提供成长空间。	投资建议	预测公司2021-2023年归母净利润69.88亿元、84.64亿元、105.73亿元，同比增长51.15%、21.13%、24.91%，现阶段股价对应PE分别为18.01、14.87、11.90倍，维持“买入”评级。	风险提示	新建项目建设进度不达预期风险；产品价格剧烈波动风险；原材料价格大幅波动风险；政策变动影响公司未来新建产能风险。,,国金证券,买入,[None],2021-08-10,,买入,4583426,pdf_downloads/2021/2021-08-10/600989-宝丰能源（600989）：盈利增长，夯实成本优势，持续推进项目进程.pdf,600989,宝丰能源,宝丰能源（600989）：盈利增长，夯实成本优势，持续推进项目进程
