author,content,filename,org_name,original_rating,pdf_link,publish_time,rating_adjust_mark_type,rating_changes,report_id,save_path,stock_code,stock_name,title
"翟堃,张崇欣,康宇豪","事件：公司拟增持银泰黄金12.88-25.76亿元，未来将进一步提升对银泰黄金的控制力度。公司于2023年7月20日完成对银泰黄金20.93%控制权的收购，成为银泰黄金的控股股东，银泰黄金的实际控制人变更为山东省人民政府国有资产监督管理委员会。根据公司第六届董事会第三十八次会议审议通过的《关于增持银泰黄金股份的议案》，2023年4月27日-2023年6月30日，公司于二级市场通过集中竞价方式累计增持银泰黄金60,217,092的股份，增持比例2.169%，公司按照相关规定履行了信息披露义务。截至本次投资计划实施前，公司合计持有银泰黄金641,398,160股股份（含公司从二级市场增持的60,217,092股股份），占银泰黄金总股本的23.099%。基于对银泰黄金未来发展前景的信心和对银泰黄金长期投资价值的认可，同时为促进银泰黄金持续、健康、稳定发展，提升投资者信心，切实维护中小投资者利益，公司计划自2023年11月16日（含本日）起6个月内，通过深圳证券交易所集中竞价系统以自有资金择机增持银泰黄金股份，累计增持金额不低于人民币12.88亿元，不超过人民币25.76亿元，增持价格上限不超过19.04元/股。银泰黄金战略规划远大，十五五末黄金产量、储量规划翻倍。银泰黄金规划 ：十四五末矿产金产量12吨，金资源量及储量达到240吨：2026年末矿产金产量15吨，金资源量及储量达到300吨 ：2028年末矿产金产量22吨，金资源量及储量达到500吨：十五五末矿产金产量28吨，金资源量及储量达到600吨以上。银泰黄金提出五大战略举措，帮助完成产量目标。（一）资源为先，全球布局，实现长期接续，谋求二次飞跃。坚持资源扩张不动摇，持续增强资源保障能力。一是现有在产矿山以矿找矿，实现现有潜力矿区的探矿突破；二是整合周边矿产资源，放大东北、西南区域等的整合并购；三是投资并购“扩张发展”，重点布局海外重要成矿带。（二）项目为基，扩能增产，推进重点工程，保障产能提升：保障稳产的基础上布局重大提产项目，加强重点采区系统建设和安全高效采矿方法转型，着力提速矿山关键工程项目建设。（三）安全为本，筑牢防线，紧盯“双零”目标，坚持绿色发展：以安全稳定为底线，坚定不移强化风险防控。（四）改革创新，优化机制，发挥协同效应，打造体制优势：以改革创新为引擎，持续发挥银泰黄金的固有优势，融合好国有控股股东优势赋能，构建灵活高效的决策机制，加大科技研发投入，持续强化科技创新，对标市场，构建完善薪酬激励体系，形成具有自身特色的发展模式和竞争优势。盈利预测与估值。预测公司2023-2025年营收分别为560.47/ 617.24/682.61亿元，归母净利润分别为23.25 /32.47/43.82亿元，对应PE43.35/31.04/23.00，公司作为全国产量领先企业，叠加集团公司“十四五”产量目标，将充分受益高金价周期带来的盈利，2022-2025年公司归母净利润年复合增速52.07%，维持“买入”评级。风险提示：公司矿产金产量增长不及预期；公司克金成本增长超预期；黄金价格下跌超预期",,德邦证券,买入,[None],2023-11-17,,买入,5391912,pdf_downloads/2023/2023-11-17/600547-山东黄金（600547）：拟再增持银泰黄金，有望充分受益银泰黄金发展.pdf,600547,山东黄金,山东黄金（600547）：拟再增持银泰黄金，有望充分受益银泰黄金发展
"李帅华,张亚桐",公司发布2023年三季报，业绩增长态势良好公司业绩增长态势良好。2023年10月27日晚，山东黄金发布2023年三季报。2023年前三季度，公司实现营收413.23亿元，同比增长3.75%；实现归母净利润13.45亿元，同比增长94.12%；实现扣非归母净利润12.80亿元，同比增长69.21%；其中，第三季度公司实现营业收入138.98亿元，同比增长38.95%；实现归母净利润4.65亿元，同比增长239.59%；实现扣非归母净利润3.98亿元，同比增长172.89%。产销量稳定，预计顺利完成全年生产计划公司前三季度产量约为29.71吨，完成全年生产计划的74.95%；第三季度公司自产金产量稳定，约为10.14吨，与二季度基本持平。公司正在按照年度生产经营计划安排四季度工作。库存方面，截至三季报，公司期末库存余额87.16亿元，较6月底余额增加33.58亿元，增幅达62.68%。主要系三季度银泰黄金并表，公司对银泰黄金的存货进行了评估，存在评估增值是导致山东黄金三季报中存货增加的主要原因。并购与探矿双向发力，资源储量进一步提升1）正式入主银泰黄金，合计持有银泰黄金约23.1%股权，完成财务并表，通过本次收购，公司实现在西南、东北地区的资源布局，提升公司竞争力。2）焦家矿区整合项目：该项目持续推进，公司计划投资约82.73亿元（其中拟73.83亿元为非公开方式募集资金）用于焦家矿区整合及开发，该项目建设期为6年，达产后采矿能力达到660万吨/年，对应矿产金产量约18.85吨。3）焦家金矿、金洲公司、玲珑金矿、三山岛金矿通过探矿分别新增金金属量3.58吨、2.5吨、1.85吨和1.07吨。盈利预测预计公司2023/2024/2025年实现营业收入579.67/637.43/686.77亿元，分别同比增长15.23%/9.96%/7.74%；归母净利润分别为23.65/28.12/34.99亿元，分别同比增长89.86%/18.87%/24.43%，对应EPS分别为0.53/0.63/0.78元。以2023年11月3日收盘价23.47元为基准，对应2023-2025E对应PE分别为44.39/37.34/30.01倍。维持“买入”评级。风险提示：宏观经济不及预期；美联储加息超预期；产能建设不及预期。,,中邮证券,买入,[None],2023-11-06,,买入,5378265,pdf_downloads/2023/2023-11-06/600547-山东黄金（600547）：业绩增长符合预期，增储与并购双向发力.pdf,600547,山东黄金,山东黄金（600547）：业绩增长符合预期，增储与并购双向发力
"谢鸿鹤,郭中伟,陈沁一",事件：山东黄金发布2023年三季报。报告期内，公司实现营收413.23亿元，同比增3.75%，实现归母净利润13.45亿元，同比增94.12%，扣非归母净利润12.80亿元，同比增69.21%。单季度来看，2023年Q3，公司实现营收138.98亿元，同比增38.95%，环比降2.99%，实现归母净利润4.65亿元，同比增239.59%，环比增5.54%。报告期内，受益于金价上行周期，公司业绩显著提升。从量方面来看，公司推进大型化智能化采掘作业模式革新，提高生产作业率，降低采矿损失率和贫化率，报告期内，公司矿产金产量为29.71吨（同比降1.97%，完成2023年计划产量的74.95%），占全国矿产金总产量的13.83%，外购金产量41.40吨（同比降1.27%），小金条产量22.25吨（同比增23.85%）；单季度来看，2023年Q3公司矿产金产量为10.14吨（同比增10.71%，环比降0.44%）。从价方面来看，2023年前三季度，金价同比大幅上涨，SHFE金均价443.19元/克，同比上涨13.68%，单季度来看，2023年Q3的SHFE金均价为459.61元/克，同比增19.42%，环比增2.45%。公司通过加强研究分析团队建设，提升对黄金价格研判能力，报告期内，公司黄金销售价格同比有所上涨。公司持续推进降本增效，费用管控能力提升。2023年前三季度，公司期间费用率为8.04%，较去年同期降0.56pcts，具体来看：1）公司销售费用同比下降34.46%至0.89亿元，销售费用率由0.34%→0.22%，下降0.12pcts；2）管理费用同比降19.57%至17.95亿元，管理费用率由5.60%→4.34%，下降1.26pcts；3）报告期内，公司财务费用为11.17亿元，同比增44.77%，财务费用率由1.94%→2.70%，上升0.77pcts。内增外扩，资源实力持续增强，并加速向经济优势转化。对外积极开展资源并购：1）报告期内，公司完成对银泰黄金控制权收购，合计持有银泰黄金约23.1%股权，通过本次收购，公司实现在西南、东北地区的资源布局，进一步奠定公司在行业的领先地位，截至2022年底，银泰黄金拥有金金属量166.20吨（不包含地表存矿）；2）8月，公司以约4.22亿元现金收购山东黄金金创集团所属的燕山矿区采矿权、磁山矿区探矿权以及土屋金矿探矿权及相关资产，根据2023年半年报，预计新增黄金资源量7.914吨。对内持续发力探矿增储：1）上市公司层面，2023年H1，公司在焦家金矿、金洲公司、玲珑金矿、三山岛金矿通过探矿分别新增金金属量3.58吨、2.5吨、1.85吨和1.07吨，公司资源优势持续增强。2）集团层面，山东黄金集团对所属西岭金矿进行了勘探工作，最终探明金金属量592.186吨，进一步保障公司资源优势。在建项目未来贡献业绩增量：1）卡帝诺项目：截至9月18日，该项目前期准备工作已经完成，正在积极开展选厂建设详细设计工作，长周期设备已全部完成采购，正处于制造阶段；项目原计划将于2024年底投产，公司公告预计将提前投产，投产后预计平均年产金8.9吨。2）焦家矿区整合项目：该项目持续推进，公司计划投资约82.73亿元（其中拟73.83亿元为非公开方式募集资金）用于焦家矿区整合及开发，该项目建设期为6年，达产后采矿能力达到660万吨/年，预计新增黄金约10吨左右。贵金属上行趋势加速。目前美联储已处于加息尾声，中期看随着居民超额储蓄的消耗及高利率的维持，美国经济周期性回落难以避免，贵金属有望进入降息预期驱动的上涨阶段。随着金价β行情的展开，公司作为黄金板块内资源优势突出且具备高成长属性的标的或将充分受益。盈利预测与投资建议：随着募投项目落地及外延整合的推进，公司黄金产量增长有望提速，资源优势加速向经济优势转化。假设公司2023-2025年不含银泰黄金部分黄金产量分别为40/42/47吨，银泰黄金2023-2025年黄金产量为7.6/8.5/12.5吨，调整管理费用率为4.5%/4.4%/4.4%，2023-2025年黄金均价假设分别至440/450/460元/克，假设克金生产成本为230/230/230元/克。银泰黄金并表，预计2023-2025年公司归母净利润分别为21.77/28.29/37.29亿元（之前预计2023-2025年归母净利润分别为23.92/31.83/43.25亿元），目前股价为23.78元，对应PE分别49/38/29倍，维持公司“买入”评级。风险提示：宏观经济风险、黄金价格波动风险、矿山停产风险、安全管理风险、环保管理风险等。,,中泰证券,买入,[None],2023-11-03,,买入,5375368,pdf_downloads/2023/2023-11-03/600547-山东黄金（600547）：金价上涨推升业绩，资源实力加速向经济优势转化.pdf,600547,山东黄金,山东黄金（600547）：金价上涨推升业绩，资源实力加速向经济优势转化
"华立,阎予露",核心观点：投资事件：公司发布2023年三季报，公司2023年前三季度实现营业收入413.23亿元，同比增长3.75%；实现归属于上市公司股东净利润13.45亿元，同比增长94.12%；实现扣非后归属于上市公司股东净利润12.80亿元，同比增长69.21%。公司2023Q3单季度实现归属于上市公司股东净利润4.65亿元，同比增长239.59%，环比增长5.44%；实现扣非后归属于上市公司股东净利润3.98亿元，同比增长172.89%，环比下降9.95%。产量稳定，金价上行拉动单季度业绩上涨：2023年三季度国内黄金现货均价上行至459.33元/克，同比上涨19.52%，环比上涨2.63%。公司前三季度自产金产量29.71吨，同比减少1.97%，已完成产量指引39.64吨的75%，完成度较高。其中三季度自产金产量10.14万吨，同比增长1.7%、环比减少0.45%，单季度产量基本保持稳定。金价上涨拉动公司毛利率同比提升1.7个百分点、环比提升3.96个百分点。三季度末公司存货同比上涨88%，环比上涨113%；商誉同比上涨364%、环比上涨314%，主要是由于新并表银泰黄金所致。公司远期自产金产量和储量增长路径明确：内生方面，打造莱州“世界级黄金生产基地”，焦家金矿资源整合、西岭金矿注入预期、三山岛和玲珑金矿扩界项目持续推进。外延方面，控股银泰黄金资源储备再获提升，竞得甘肃大桥金矿采矿权省外布局再下一城；海外方面，卡蒂诺项目进展顺利，投产时间有望提前。投资建议：美联储加息进入尾声，明年大概率开启降息周期，且逆全球化地缘政治动荡，黄金作为避险金属配置价值提升，金价有望进入新一轮中期上涨周期。公司作为国内黄金行业龙头，多维度通过内生整合和外延收购资源，未来产量有望大幅增长，叠加黄金价格上涨将大幅释放公司业绩。预计公司2023-2025年归属于上市公司股东的净利润为23.00亿元、30.51亿元、49.90亿元，对应2023-2025年EPS为0.51元、0.68元、1.12元，对应2023-2025年PE为48x、36x、22x，维持“推荐”评级。风险提示：美联储加息超出预期的风险；美国经济与通胀强于预期的风险；黄金价格大幅下跌的风险；公司新建项目不及预期的风险。,,银河证券,推荐,[None],2023-11-01,,买入,5371316,pdf_downloads/2023/2023-11-01/600547-山东黄金（600547）：金价上行拉动业绩，远期自产金增量可期.pdf,600547,山东黄金,山东黄金（600547）：金价上行拉动业绩，远期自产金增量可期
"黄腾飞,朱善颖",事件：公司发布2023年三季报，2023年前三季度实现营业收入413.23亿元（同比+3.75%），归母净利润13.45亿元（同比+94.12%），扣非归母净利润为12.80亿元（同比+69.21%）。其中三季度收入实现138.98亿元（同比+38.95%，环比-2.99%），归母净利润为4.65亿元（同比+239.59%，环比+5.54%）。黄金产量符合目标指引。公司前三季度完成矿产金产量29.71吨，同比减少1.97%，外购金产量41.40吨，同比减少1.27%，小金条产量22.25吨，同比增长23.85%。公司2022年年报中指引2023年黄金产量不低于39.64吨，前三季度矿产金生产完成目标74.95%，产量符合预期。公司持续增储扩产，资源优势突出。公司通过整合资源、主动兼并、资源注入、等多种途径，不断增储扩产。焦家金矿资源整合后，有望将年产量从10吨提升至18吨以上；海外卡蒂诺矿山建设稳步推进，预计远期提供8-9吨黄金增量；银泰黄金顺利实现股权变更，目前年产黄金超7吨，山东黄金集团目标2025年实现矿产金产量80吨。公司积极勘探增储，年内西岭金矿探获新增200吨资源量，甘肃大桥金矿扩展陇南黄金资源开发，资源储备增厚公司发展潜力。金价仍处上行周期。美国加息进入尾声，货币周期的切换背景下，长端美债实际收益率和美元指数处于高位，中期向下空间较大。三季度以来全球地缘冲突频发，避险情绪带动金价大幅上涨，央行继续增持黄金，黄金的战略配置地位提升。2023前三季度伦敦金均价1932美元/盎司，相较2022年均价上升7.2%，金交所AU9999均价443元/克，相较2022年均价上涨12.8%，金融属性、货币属性和避险属性有望驱动黄金价格中枢继续上移。盈利预测与投资建议：预计2023-2025年公司实现归母净利润分别为21.5亿元/26.9亿元/35.3亿元，对应PE分别为51/41/31倍，维持“持有”评级。风险提示：黄金价格大幅下跌风险，远期矿山增产不及预期风险，海外运营风险。,,西南证券,持有,[None],2023-10-30,,增持,5365384,pdf_downloads/2023/2023-10-30/600547-山东黄金（600547）：金价维持上行，业绩稳步增长.pdf,600547,山东黄金,山东黄金（600547）：金价维持上行，业绩稳步增长
"翟堃,张崇欣,康宇豪",山东黄金(600547)投资要点事件：公司披露2023年三季报预告，业绩高速增长。公司2023年Q3营业收入138.98亿元，同比+38.95%，环比-2.99%；归母净利润4.65亿元，同比+239.59%，环比+5.54%；扣非归母净利润3.98亿元，同比+172.89%。公司2023年Q1-Q3营业收入413.23亿元，同比+94.12%；归母净利润13.45亿元，同比+94.12%；扣非归母净利润12.80亿元，同比+69.21%。公司三季度业绩同比持续高速增长。公司23年矿产金和外购金产量波动不大，黄金价格维持高位、小金条产量上升拉动公司业绩成长。公司2023年Q1-Q3产量中自产金29710.73千克，同比-1.97%；外购金41402.65千克，同比-1.27%；小金条22245.39千克，同比+23.85%。2023年Q1-Q3单季度国内黄金现货均价分别为420.45、447.71、459.69元/克，且从10月来看金价仍维持高位，对比22年均价392.21元/克有较大幅度上涨。公司矿山众多，成本大幅优化，开展多个矿山副井、建设工程，未来产量有望增长。2022年蓬莱矿业复产，2023年1月东风矿区复产，玲珑矿区预计也可于2023年复工复产，三山岛金矿、焦家金矿、新城金矿等诸多矿山产量回升，2022年黄金总产量38.67吨，同比增加56.06%。矿产金成本回落至222.2元/克，同比下降16.05%。22年三山岛副井工程开工建设、焦家明混合井、朱郭李家主副井工程开工建设，卡蒂诺资源旗下矿山建设稳步推进，公司未来矿产金产量有望增长。盈利预测与估值。预测公司2023-2025年营收分别为560.47/617.24/682.61亿元，归母净利润分别为23.25/32.47/43.82亿元，对应PE47.52/34.03/25.22，公司作为全国产量领先企业，叠加集团公司“十四五”产量目标，将充分受益高金价周期带来的盈利，2022-2025年公司归母净利润年复合增速52.07%，维持“买入”评级风险提示：公司矿产金产量增长不及预期；公司克金成本增长超预期；黄金价格下跌超预期,,德邦证券,买入,[None],2023-10-30,,买入,5364864,pdf_downloads/2023/2023-10-30/600547-山东黄金（600547）：金价维持高位，黄金龙头业绩持续高增.pdf,600547,山东黄金,山东黄金（600547）：金价维持高位，黄金龙头业绩持续高增
"刘孟峦,冯思宇",单季业绩持续增长。2023年前三季度，公司自产金产量29.71吨，同比下降1.97%；实现营业收入413.23亿元，同比增长3.75%；归母净利润13.45亿元，同比增长94.12%。三季度单季，公司自产金产量10.14吨，环比下降0.44%；实现营业收入138.98亿元，环比下降2.99%；归属于上市公司股东的净利润4.65亿元，环比增长5.54%。重点项目稳步推进，黄金产量有望持续提升。十四五期间，山东黄金集团提出“致力全球领先，跻身世界前五”的战略目标，到2025年矿产金产量达到80吨，资源储量达到3300吨以上。配合战略目标，公司开展多项大型建设项目。目前，三山岛副井工程井筒掘进、焦家金矿明混合井工程、朱郭李家主井工程、朱郭李家副井工程进展顺利；加纳卡蒂诺资源公司的纳穆蒂尼矿山选厂建设详细设计工作持续进行。未来，随着扩能改造项目投产达产，公司黄金产量有望持续提升。并购银泰黄金，资源储备提升。银泰黄金拥有4座金矿矿山，1座铅锌银多金属矿山受益高品位，公司黄金生产成本低，盈利能力强，2023年前三季度实现归母净利润11.18亿元。2022年12月，公司与中国银泰投资有限公司、沈国军先生签署了《股份转让协议》，公司拟受让沈国军先生及中国银泰投资有限公司合计持有的银泰黄金20.93%的股份，转让价格127.6亿元。目前已完成对银泰黄金控制权的收购，叠加二级市场增持部分，合计持有银泰黄金6.41亿股股份，占总股本的23.1%。单季期间费用有所增加。公司深入推进“全员、全岗位、全要素、全过程”的系统性降本增效工作，完善降本增效实施方案和考核体系。前三季度，公司销售费用率、管理费用率同比分别下降0.13、1.26个百分点至0.22%、4.34%；研发费用率、财务费用率分别上升0.05、0.77个百分点至0.77%、2.70%。三季度单季，公司借款增加，财务费用增加0.41亿元至4.19亿元；管理费用增加2.78亿元至7.39亿元。风险提示：项目建设进度不及预期；黄金价格大幅回调；安全和环保风险。投资建议：公司聚焦黄金主业，多项扩能改造工程有序推进，未来几年黄金产量有望大幅提升。考虑到成本费用变化，我们下调原业绩预测，预计公司2023/24/25年营业收入542.3/571.5/609.3亿元，年增速分别为7.8%/5.4%/6.6%；归母净利润20.8/27.0/39.6亿元，年增速分别为66.9%/30.0%/46.5%，摊薄EPS分别为0.46/0.60/0.89元。当前股价对应PE为53.1/40.9/27.9x，维持“买入”评级。,,国信证券,买入,[None],2023-10-30,,买入,5364992,pdf_downloads/2023/2023-10-30/600547-山东黄金（600547）：重点项目稳步推进，单季利润持续提升.pdf,600547,山东黄金,山东黄金（600547）：重点项目稳步推进，单季利润持续提升
"李斌,马晓晨","前三季度归母净利润同比94.12%，维持“增持”评级公司前三季度实现营收413.23亿元（yoy+3.75%），归母净利13.45亿元（yoy+94.12%），与公司业绩预告的12-14亿元一致；23Q3实现归母净利润4.65亿元（yoy+239.59%，qoq+5.44%）。我们维持盈利预测，预计23-25年公司EPS分别0.49/0.61/0.97元，BPS分别为7.77/8.28/9.13元，2023年Wind一致预期3.01x PB，考虑公司储量持续扩张，给予公司23年3.76x PB，而公司近2年A/H平均溢价率约为62%，基于2023年10月27日港元兑人民币汇率约0.92，对应A股目标价29.23元（前值29.82元），H股目标价19.61港元（前值20.01港元），维持“增持”评级。产量相对稳定，测算克金毛利环比走扩据公司三季报，23Q3公司自产金产量10.14吨（yoy+10.71%，qoq-0.44%），环比基本持平，前三季度自产金产量29.71吨，完成23年度计划产量不低于39.641吨的74.95%。此外，公司前三季度毛利率15.15%（yoy+1.3pct），其中23Q3毛利率17.46%（yoy+1.67pct,qoq+3.93pct），同环比均有所提升。一方面，金价同环比均有上涨，据上海期货交易所，23Q3黄金均价459.6元/克（yoy+19.42%，qoq+2.45%），另一方面，推测公司23Q3克金成本约为220元/克，较23H1的239元/克有所降低。期间费用同比有所下降，净利率环比+1.2pct据公司三季报，23Q3公司期间费用率9.7%（yoy-1.1pct，qoq+2.9pct），其中管理费用率5.3%（yoy-1.3pct，qoq+2.1pct），财务费用率3.0%（yoy+0.3pct，qoq+0.4pct）。公司资产负债率60.68%，环比下降1.94pct。销售净利率4.7%（yoy+2.7pct，qoq+1.2pct）。通胀不确定性及避险情绪加大金价波动，长期黄金仍有上升空间三季度美国经济韧性依旧较强，“软着陆”预期继续升温，从而加剧了市场对于高利率环境可能维持更长时间的担忧。受此影响，23Q3国际黄金价格呈现震荡下行态势，10月初，伦敦金价最低跌至约1819美元/盎司。此后金价见底反弹，10月底，金价因地缘政治影响持续反弹，避险情绪高涨，同时十年期美债收益率一度突破5%，多种因素交织下，预计金价短期内将波动加大。但长期来看，美国真实利率依旧难以维持过高水平，金价仍具一定上升空间。风险提示：公司在建项目进展不及预期，美联储加息终值和持续性超预期。",,华泰证券,增持,[None],2023-10-29,,增持,5363283,pdf_downloads/2023/2023-10-29/600547-山东黄金（600547）：产量持稳，克金毛利环比走扩.pdf,600547,山东黄金,山东黄金（600547）：产量持稳，克金毛利环比走扩
