author,content,filename,org_name,original_rating,pdf_link,publish_time,rating_adjust_mark_type,rating_changes,report_id,save_path,stock_code,stock_name,title
"陈俊良,王剑,田维韦","成都银行(601838)事项：公司公告：将于3月3日公开发行80亿元可转债，初始转股价格为14.53元/股，债券期限为2022年3月3日至2028年3月2日，转股期限为2022年9月9日至2028年3月2日。国信银行观点：成都银行外部经营环境优异、内生增长能力强、资产质量风险小，主要财务指标居同业前列,而短期来看公司有望受益于稳增长政策,因此公司基本面优异、有能力维持较高的业绩增长。另一方面，公司目前核心一级资本充足率为9.12%，存在一定的资本压力，因此随着可转债发行落地，从市场层面看亦存在转股逻辑，有望催化估值进一步上升。我们预计公司2021~2024年归母净利润为73亿元/89亿元/109亿元/132亿元，同比增长21.9%/21.7%/21.6%/21.3%，对应摊薄EPS为2.03元/2.47元/3.01元/3.65元；当前股价对应的动态PE为7.4x/6.0x/5.0x/4.1x，动态PB为1.18x/1.00x/0.87x/0.75x，维持“买入”评级。评论：公司基本面优异，发展前景良好成都银行基本面优异，发展前景良好。体现在三个方面：1）从外部需求来看，公司所在区域人口流入、经济发展速度快于全国，因此带来更旺盛的金融需求。成都银行近几年资产扩张速度快于行业平均水平，达到15%左右；2）从自身来看，公司有能力以内生增长的方式满足旺盛的金融需求，从而避免摊薄股东收益。成都银行ROE位居同业前列（2020年ROE为上市银行第一），内生增长能力强，可以有效避免“水多了加面、面多了加水”的粗放式资产扩张；3）进一步从自身来看，公司的扩张是健康的、可持续的。成都银行自2016年以来降低风险偏好、调整信贷结构，整体资产质量大为改善，近几年不良生成率持续低于行业平均水平，2021年上半年不良生成率甚至为负。公司之所以能够做到这一点，离不开其负债成本优势，正是对公客户基础优异带来的低成本存款，才使得公司能够将信贷往低风险、低收益资产上调整，同时还能保持高盈利能力。具体分析如下：1、区域经济快速发展带来更加旺盛的金融需求成都银行未来发展面临优异的外部环境。成都银行的主营业务区域位于成都市，而成都市近几年经济快速发展，为公司规模扩张带来新增需求。从GDP增长情况看，近几年成都市经济增长快于全国平均水平，而成都市2022年地区生产总值的增长计划达到7%左右。人口流入情况也能反映出成都的经济发展情况，成都市七普常住人口2094万人，比六普增加582万人，年均增长3.3%，十年人口净流入数量居全国地级市前列。人口流入推动城市建设发展，成都市近几年的固定资产投资增速也快于全国水平。2021年10月份，中共中央、国务院印发了《成渝地区双城经济圈建设规划纲要》，提出“把成渝地区双城经济圈建设成为具有全国影响力的重要经济中心、科技创新中心、改革开放新高地、高品质生活宜居地”，“到2035年，建成实力雄厚、特色鲜明的双城经济圈，重庆、成都进入现代化国际都市行列”，为成都市未来的发展带来新的战略机遇。区域人口流入、经济更快增长，有望为金融机构带来更多的金融服务需求。从近几年的资产增长来看，成都银行保持了较快的增速。2、盈利能力居行业前列，内生增长能力强成都银行盈利能力位居行业前列，从自身来看也有能力把握住区域经济增长带来的发展机会。在资本充足率约束下，银行的ROE决定了银行的内生增长能力。成都银行ROE位居行业前列，内生增长能力强，长期来看可以有效避免股东权益摊薄，避免“水多了加面、面多了加水”的现象。此外，成都银行不仅ROE高，ROA也高，而非单纯依靠加杠杆获得高ROE。内生增长能力强，意味着公司可以更好地把握住区域经济增长带来的发展机会。",,国信证券,买入,[None],2022-03-02,,买入,4759990,pdf_downloads/2022/2022-03-02/601838-成都银行（601838）：可转债发行落地有望推动估值进一步回升.pdf,601838,成都银行,成都银行（601838）：可转债发行落地有望推动估值进一步回升
郭懿,报告关键要素:2021年10月29日，成都银行发布2021年三季度业绩报告。投资要点:营收同比增长26%，归母净利润同比增长22.15%：收入端，利息净收入同比增长22.38%，手续费净收入同比增长45.3%。营收的高增主要受益于净利息收入以及中间业务收入的快速增长。成本端，拨备计提力度仍在高位。三季度手续费净收入仍保持快速增长态势：手续费净收入同比增长45.3%，预计与财富管理相关的理财、资产管理以及代理业务均呈现快速增长态势。此外，由于公允价值以及汇兑收益的快速增长，其他非息收入增速也较快。资产质量持续向好：三季度末，不良率环比下降至1.06%，延续下行趋势，而且处于近年来的最低水平。关注类贷款占比0.56%，环比继续下行。前瞻指标，不良生成率数据，仍处于低位。拨备覆盖率达到387.41%，环比提升16个百分点，风险抵补能力较强。综合看，2021年前三季度整体拨备计提力度仍在高位。盈利预测与投资建议：成渝双城经济圈规划纲要已发布，成都银行的区位优势以及区域内的竞争优势均非常明显，可有效融入地方经济建设与发展，推动对公业务的优化。后续公司可转债的成功发行，将有效补充公司净资本。给予2021/2022/2023年EPS预测2.04元/2.32元/2.57元，按照成都银行A股10月28日收盘价12.93元，对应2021年1.02倍PB，给予增持评级。风险因素：受新冠疫情影响，全球经济恢复不及预期，导致银行资产大幅波动。,,万联证券,增持,[None],2021-10-31,,增持,4655712,pdf_downloads/2021/2021-10-31/601838-成都银行（601838）：业绩持续高速增长.pdf,601838,成都银行,成都银行（601838）：业绩持续高速增长
"梁凤洁,邱冠华",报告导读成都银行营收保持高增，息差环比提升，资产质量向好，转债补充资本。   投资要点数据概览21Q1-3成都银行归母净利润同比+22.2%，增速环比-1.0pc；营收同比+26.0%，增速环比+0.7pc；ROE 16.3%，同比+1.2pc，ROA 0.98%，同比+4bp；不良率1.06%，环比-4bp，拨备覆盖率387%，环比+16.3pc。营收保持高增21Q1-3成都银行归母净利润同比+22.2%，增速环比-1.0pc；营收同比+26.0%，增速环比+0.7pc，主要支撑因素为净息差扩大。具体来看：①21Q3成都银行单季度净息差（期初期末）环比+14bp至2.03%，净息差走阔。②非息收入保持高增，21Q1-3其他非息同比+42.5%，增速环比-7.4pc，中收和其他非息均保持较高增速，中收和其他非息分别同比+45.3%，+42%，增速环比-10.2pc、-6.9pc。息差环比提升21Q3成都银行单季度净息差（期初期末）环比+14bp至2.03%，主要得益于资产端收益率提升。21Q3成都银行资产端收益率环比+14bp至4.07%，归因贷款占比提升，贷款环比+3.9%，增速较总资产快2.5pc。21Q3成都银行负债成本率基本持平，负债成本率环比+1bp至2.24%，值得注意的是今年以来存款占比持续提升，21Q3存款占比较21H1提升3pc至73%。资产质量向好21Q3成都银行不良率环比-4bp至1.06%，前瞻指标关注率环比-8bp至0.56%，均为上市以来最优水平。拨备方面，21Q3成都银行拨备覆盖率环比+16.3pc至387%，风险抵补能力进一步增强。展望未来，资产质量有望继续向好。转债补充资本成都银行于2021年4月29日发布转债预案，计划发行不超过80亿元可转债，目前正在证监会审批阶段。如全部转股，静态测算，可提升核心一级资本充足率1.5pc至9.87%，补充资本弹药，支撑规模扩张。盈利预测及估值成都银行营收保持高增，息差环比提升，转债补充资本。预计21-23年归母净利润增速20.0%/15.0%/18.1%，对应BPS 12.6/14.4/16.4元。上调目标价为16.42元，对应21年PB 1.30x。现价对应21年PB 1.02x，现价空间27%，买入评级。风险提示：宏观经济失速，不良大幅暴露。,,浙商证券,买入,[None],2021-10-31,,买入,4655961,pdf_downloads/2021/2021-10-31/601838-成都银行（601838）：受益成渝经济，经营持续向好.pdf,601838,成都银行,成都银行（601838）：受益成渝经济，经营持续向好
"王剑,田维韦,陈俊良",成都银行披露三季报前三季度营收同比增长26.0%（上半年增长25.3%），净利润同比增长22.2%（上半年增长23.1%），净利润增速略放缓主要是信用减值损失同比增长36.6%，我们预计公司大规模计提了其他资产风险减值损失。预计净息差环比提升，信贷维持较快扩张公司前三季度净利息收入同比增长22.4%，较上半年19.8%的增速有所提升，预计主要是净息差环比上行贡献，三季度信贷扩张略有放缓。由于上半年信贷扩张较快，第三季度贷款扩张3.9%，扩张速度略有放缓，但前三季度合计扩张26.2%，超过前几年全年的扩张幅度。公司净息差提升一方面是优化负债结构，提升活期存款和短期存款比重，其中期末活期存款比重为47.0%，较年初提升了1.5pct。另一方面加大贷款等收益率较高的资产配置比例，期末贷款占总资产比例为47.8%，较年初提升了3.8pct。同时，公司致力于提升经营效率，前三季度成本收入比为21.0%，同比下降了1.2pct。贷款质量优异，拨备覆盖率提升至387%期末不良率为1.06%，关注率为0.56%，较6月末分别下降4bps和8bps。去年公司大规模出清存量不良包袱，今年上半年我们测算的不良生成率为-0.01%，三季度公司不良率继续下行，表明公司存量和增量不良压力都不大，信贷质量优异。但公司继续加大拨备计提力度，期末拨备覆盖率为387%，较6月末提升了16pct。投资建议公司业绩稳健，我们维持2021~2023 年净利润为73.6/89.1/106.6亿元的预测，对应增长22.1%/21.0%/19.7%，EPS为2.04 /2.46/2.95元。当前股价对应的动态 PE 为6.3x/5.2x/4.4x，动态PB 为1.0x/0.9 x/0.8x。考虑到公司估值处在低位，我们维持公司“买入”评级。风险提示宏观经济形势持续走弱可能对银行资产质量产生不利影响,,国信证券,买入,[None],2021-10-31,,买入,4655660,pdf_downloads/2021/2021-10-31/601838-成都银行（601838）：业绩持续靓丽，资产质量优异.pdf,601838,成都银行,成都银行（601838）：业绩持续靓丽，资产质量优异
"刘志平,李晴阳",事件概述成都银行发布2021年三季报：2021Q1-3实现营收131.35亿元(+26.01%，YoY)，营业利润57.00亿元(+21.54%，YoY)，归母净利润51.31亿元(+22.15%，YoY)；Q3单季实现营收同比+27.27%，营业利润+18.70%，归母净利润+20.33%。三季度末总资产7465.30亿元(+16.81%，YoY；+1.41%，QoQ)，存款5454.03亿元(+17.04%，YoY；+5.28%，QoQ)，贷款3571.80亿元(+33.10%，YoY；+3.94%，QoQ)。不良贷款率1.06%(-4bp，QoQ)，拨备覆盖率387.41%(+16.26pct，QoQ)，拨贷比4.12%(+0.03pct，QoQ)；资本充足率12.69%(+0.02pct，QoQ)；Q1-3ROE12.25%(+0.93pct，YoY)。分析判断:核心营收强劲贡献高利润增速成都银行Q1-3累计实现营收和PPOP增速分别为26%/27.8%，较上半年保持稳中有升，Q3单季营收增速27.27%，核心盈利强劲：一方面量价齐升下，Q1-3利息净收入同比+22.4%，较上半年增速提升2.6pct，单季增速27.1%；另一方面，非息净收入累计同比+42.5%，较上半年略放缓7.4pct，Q3单季增速28%虽环比有所放缓，但整体仍处于快速放量阶段，其中手续费净收入同样表现靓丽，累计和单季同比增速分别为45.3%/26.6%。营收端稳健增长下，三季度延续较强减值计提力度，Q1-3计提规模同比+36.6%，较上半年再提升2.7pct，整体实现归母净利润同比+22.2%，较上半年的23.1%保持稳健，单季利润增速也在20%以上，经营效益凸显高成长性。Q3规模增长稳健，贷款增配零售、存款活期率提升成都银行三季度总资产环比增长1.4%，边际趋缓（Q1、Q2季度增幅分别为9.4%、3.1%），但总体实现16.8%的同比稳健增速。稳健扩表的同时资负摆布灵活调整，三季度进一步聚焦存贷业务，在投资资产和同业资产缩量、主动负债大幅压降的同时，三季度贷款和存款规模分别环比增长3.9%、5.3%，带动资负两端贷款和存款占比分别环比提升1.1和3.1个百分点至46%、79.6%。三季度存贷款规模同比增速已经达到17.3%和33.1%。具体投向来看：1）三季度贷款增量的23.8%投向零售，较上半年8.8%的比例有明显提升，符合公司投放节奏的季节性，也有助于年内息差的提振。2）三季度存款增量主要来自对公活期和个人定期存款，环比增幅分别为6.9%和6%，快于存款总体增幅，也促进存款中活期存款占比较中期回升0.3pct至48.5%。总体来看，成都银行三季度资负两端调结构更主动，包括资负聚焦存贷+贷款增配零售+提升活存占比，得益于高效资产的配置，我们测算的公司Q3净息差季度回升13BP，表现优于可比同业。关注类双降、不良率创新低，拨覆率延续提升公司资产质量持续向优：1）Q3不良率环比再降4BP至1.06%，较年初降幅达31BP，目前已降至有可比数据以来最低水平，关注类贷款实现双降，规模较中期压降9.7%的同时，占比降至0.56%（环比-8PB），再创历史新低，存量资产质量包袱已持续出清。2）拨备计提保持较强力度下，Q3拨备覆盖率收录387.41%，在上半年大幅提升77.7pct基础上再提升16.3pct，拨贷比4.12%环比提升0.03pct。,,华西证券,买入,[None],2021-10-29,,增持,4654325,pdf_downloads/2021/2021-10-29/601838-成都银行（601838）：聚焦存贷、核心盈利强劲，息差表现靓丽.pdf,601838,成都银行,成都银行（601838）：聚焦存贷、核心盈利强劲，息差表现靓丽
"戴志锋,贾靖,邓美君",投资要点季报亮点：1、成都银行营收、拨备前利润3季度继续保持高增，1-3Q21累积营收和PPOP同比+26.0%、+27.9%。净利润在信用减值计提同比上升的背景下，仍同比高增22.2%。2、单3季度净利息收入环比增长+9.6%，量价齐升。净息差环比上升14bp主要是由资产端贡献，资产收益率上行14bp至4.08%。资产端预计有利率因素和结构因素两个方面的影响。结构上，贷款占比生息资产环比是提升的，对公和个贷增速均不弱；利率上，预计是成渝经济圈信贷需求旺盛，推升贷款收益率提升。3、存贷占比进一步提升，贷款占比提升1.1个百分点至47.7%，连续5个季度环比提升。存款占比大幅提升3个百分点至80.1%。4、三季度非息收入同比增速+42.5%，由其他非息和手续费收入共同带动。其中：1、净手续费收入同比增45.3%，保持不弱增长。预计仍然是理财业务和代理业务增长较多。2、净其他非息收入同比增速42.0%，同比增速保持平稳（1H21同比增48.8%），主要是公允价值变动和汇兑收益增长较多。5、核心一级资本充足率环比上升。3Q21核心一级资本充足率、一级资本充足率、资本充足率分别为8.34%、9.50%、12.69%，环比+11bp、+8bp、+2bp。风险加权资产环比+2.8%，生息资产规模环比+3.3%。季报不足：负债付息率微升1bp至2.24%。负债端存款增速不弱，存款占比环比上升，预计存款竞争压力增大影响，存款成本上升进而推动负债成本略有提升。投资建议：业绩高增且资产质量出清，高性价比。公司2021E、2022E PB1.02X/0.89X；PE 6.48X/5.63X（城商行 PB 0.83X/0.74X；PE 7.16X/6.36X），公司得益于成渝地区双城经济圈战略规划，融入地方经济建设与发展，积极支持地方重点基础设施建设，存贷业务持续高增，对公业务做深做实，资产质量各项指标持续改善至历史较优水平，建议保持积极跟踪。风险提示：经济下滑超预期、公司经营不及预期。,,中泰证券,增持,[None],2021-10-29,,增持,4654038,pdf_downloads/2021/2021-10-29/601838-成都银行（601838）2021年三季报：量价齐升支撑业绩持续高增、PPOP同比增28%.pdf,601838,成都银行,成都银行（601838）2021年三季报：量价齐升支撑业绩持续高增、PPOP同比增28%
"王剑,田维韦,陈俊良","成都银行披露2021年中报公司上半年归母净利润33.9亿元，同比增长23.1%，增速较一季度回升5.0个百分点，主要是其他非息收入增多。另一方面，公司上半年营业收入同比增长25.3%，收入增长非常快，因此即便资产质量大幅改善，公司仍然加大了拨备计提力度，使得资产减值损失拖累利润增长。而从规模看，公司上半年总资产同比增长19.8%，保持很高的成长性。资产质量优异，继续大幅超额计提拨备公司二季末不良率1.10%，较一季末降低9bps；关注率0.64%，较一季末下降5bps；我们测算的上半年不良生成率-0.01%，同比大幅降低50bps，罕见地出现负值，说明公司资产质量异常优异，而且公司不良偏离度保持稳定，说明不良认定标准并未放松，是资产质量的真实改善。公司二季末拨备覆盖率较一季末提高38个百分点至371%，拨备安全垫大幅增厚。在资产质量改善的情况下，由于公司收入增速很快，因此公司仍然增加了拨备计提力度，贷款减值损失同比仍然增长了45%，不过这也意味着公司未来业绩增长的确定性更强。净息差大致稳定公司上半年净息差2.11%，可比口径同比下降2bps，大致保持稳定。其中存款成本较去年同期略微上升13bps至1.98%，不过其存款成本与同业相比仍然较低；其他资产和负债的利率则受市场利率下降影响而略有降低。投资建议公司表现符合预期，我们保持盈利预测不变，预计2021~2023 年净利润73.6 /89.1/106,6亿元，同比增长22.1%/21.0%/19.7%， EPS 2.04/2.46/2.95元，同比增长22.1%/21.0%/19.7%,对应PE 5.4x/4.5x/3.7x ，维持“买入”评级。风险提示宏观经济形势持续走弱可能对银行资产质量产生不利影响",,国信证券,买入,[None],2021-08-27,,买入,4599940,pdf_downloads/2021/2021-08-27/601838-成都银行（601838）：资产质量优异，收入利润双高增.pdf,601838,成都银行,成都银行（601838）：资产质量优异，收入利润双高增
"刘丽,孙田田",事件描述公司2021年上半年实现营业收入85.41亿元，同比+25.34%；归母净利润33.89亿元，同比+23.11%；加权平均ROE 8.18%，上升0.73个百分点。事件点评盈利能力保持优势，业绩表现优异。公司上半年营业收入、PPOP、净利润分别增长25%/28%/23%，其中，利息净收入增长19.84%，手续费及佣金净收入增长55.50%。二季度单季度营收和净利润增速分别较一季度环比提升10.88pct和10.10pct，营业收入及净利润增速均表现优异，上半年业绩亮眼。从业绩归因来看，手续费及佣金业务净收入为净利润增长贡献绝对力量，其次为规模增长因素。加权平均ROE 8.18%，盈利能力良好。资产规模扩张持续，维持良好势头。公司存贷款增速均优于其他银行，存款规模半年新增818.75亿元，达到历史最好半年业绩，较年末增长18.40%，规模扩张持续；贷款规模较年末增长21.35%，主要是公司贷款投放加速，公司贷款占比提升1.68个百分点至62.20%，投向租赁及环保行业占比提升，房地产行业贷款占比下降。非息收入占比提升，收益结构稳健。手续费及佣金收入实现快速增长，其中理财及资产管理手续费收入增长59.44%，代理业务手续费收入增长131.56%。投资业务中投资收益及公允价值变动损益同比增长19.41%和105.76%。非息收入占比同比提升3.59个百分点至21.92%。资产质量优化，风险抵补能力增强。不良贷款率1.10%，较上年末下降0.27个百分点，关注贷款比例0.64%，较上年末下降0.04个百分点，拨备覆盖率371.15%，较上年末增长77.72个百分点。投资建议公司聚焦成渝经济发展圈，坚持服务小微企业战略，规模稳步扩张，盈利能力表现优异。预计公司2021-2023年的营收分别为174.89亿元、208.18亿元、246.68亿元，归母净利润分别为71.74亿元、80.98亿元、89.54亿元，EPS分别为1.99、2.24、2.48，每股净资产13.35、14.69、15.34，对应PB分别为0.83倍、0.75倍、0.72倍。给予“增持”评级。存在风险宏观经济大幅下滑；公司出现大的风险事件；局部疫情反复。,,山西证券,增持,[None],2021-08-26,,增持,4599539,pdf_downloads/2021/2021-08-26/601838-成都银行（601838）：盈利能力优异，延续高成长性.pdf,601838,成都银行,成都银行（601838）：盈利能力优异，延续高成长性
