author,content,filename,org_name,original_rating,pdf_link,publish_time,rating_adjust_mark_type,rating_changes,report_id,save_path,stock_code,stock_name,title
柴沁虎,事件：8月24日，公司发布半年度业绩报告，2023年上半年公司实现营业收入130亿元，同比下降9%；实现归母净利润23亿元，同比下降44%，扣非后归母净利润24亿元，同比下降43%。23H1业绩同比下降，油煤价差走扩有望致下半年业绩修复2023年Q2公司实现营业收入63.57亿元，同比下降19%，环比下降6%；归母净利润10.72亿元，同比下降53%，环比下降10%。公司业绩承压，一方面是因为下游需求下滑致产品价格下降且超过产能的增加，23H1聚乙烯/聚丙烯/焦炭/纯苯销售均价同比下跌8%/11%/34%/16%；另一方面是因为甲醇三厂和焦化三期项目投产，原料煤用量增加。值得注意的是，5月以来油煤价差持续走高，公司产品价格回升，聚乙烯/聚丙烯/焦炭/纯苯销售均价较年中低点上涨9%/8%/17%/29%，下半年业绩有望修复。在建项目稳步推进保障公司成长23H1公司核增煤炭产能100万吨/年，所属三个在产煤矿煤炭产能达到820万吨/年，同时在建煤矿产能90万吨/年，并已取得《采矿许可证》；20万吨/年苯乙烯项目已于8月初投入试生产并生产出合格产品；宁东三期烯烃项目150万吨/年甲醇装置、40万吨/年聚乙烯装置、50万吨/年聚丙烯装置已经投入试生产，其中甲醇装置已达产。煤氢联动，看好公司中长期空间公司内蒙项目拟投资673亿元，在鄂尔多斯市布局400万吨煤制烯烃产能。项目核心装置DMTO采用大连物化所第三代技术，并通过绿氢耦合在不增加煤炭消耗的情况下增产至300万吨/年。该项目已于2023年3月开工建设，投产后预计将实现年均收入213亿元，净利润增加62亿元，公司中长期具有较大的成长空间。盈利预测、估值与评级我们预计公司2023-2025年营业收入分别为303/395/590亿元（23-24年前值为348/458亿元），同比增速分别为7%/30%/49%，归母净利润分别为65/108/174亿元（23-24年前值为108/140亿元），同比增速分别为3%/67%/61%，EPS分别为0.9/1.5/2.4元/股，3年CAGR为40%。鉴于公司内蒙项目顺利推进，煤化工循环产业布局不断完善，参照可比公司估值，我们给予公司2024年14倍PE，目标价20.68元，维持为“买入”评级。风险提示：产品和原料价格波动风险、项目审批及建设进展不及预期,,国联民生证券,买入,[None],2023-08-26,,买入,5299367,pdf_downloads/2023/2023-08-26/600989-宝丰能源（600989）：需求疲软致业绩承压，看好内蒙项目带动远期成长.pdf,600989,宝丰能源,宝丰能源（600989）：需求疲软致业绩承压，看好内蒙项目带动远期成长
王强峰,主要观点：事件描述2023年08月25日晚，宝丰能源发布公司2023年半年报，上半年实现营收130.89亿元，同比减少9.07%，实现归母净利润22.56亿元，同比下降43.79%；实现扣非净利润24.36亿元，同比下降43.06%，基本每股收益0.31元。其中，公司第二季度实现营收63.57亿元，同比下降19.33%，环比下降5.59%；归母净利10.72亿元，同比下降52.76%，环比下降9.59%；扣非净利润11.56亿元，同比下降51.68%，环比下降9.70%。煤炭及焦炭价格下跌，焦炭板块承压，煤制烯烃盈利改善上半年盈利环比下跌主要原因是需求下滑导致焦炭价格价差大幅收窄。公司上半年毛利率27.80%，同比下降12.18pct；净利率17.24%，同比下降10.65pct。从同行业来看公司的盈利韧性仍然明显。价格价差方面，根据公司经营数据披露，主要产品PE/PP/焦炭/纯苯/改质沥青/MTBE二季度均价（不含税）7039.37/6655.84/1373.09/5795.53/4303.23/6708.37元/吨，环比分别为-0.88%/-3.99%/-23.36%/-0.92%/ -34.59%/6.56%，烯烃价格由于已触及底部，价格环比保持稳定，而焦炭二季度均价下滑明显，主要由于地产需求不及预期导致钢材需求较差，钢价延续弱势，钢厂盈利能力不佳。根据我们对市场价格的跟踪，主要产品价差焦炭-精煤/聚乙烯(HDPE)-乙烯/聚乙烯(LLDPE)-乙烯/聚丙烯-丙烯/ 乙烯/丙烯-甲醇/甲醇-煤炭环比分别-47.92%/+30.57%/+8.46%/+43.75% /-76.03/-21.78%。焦炭盈利承压，煤制烯烃盈利显著改善。量方面，从公司披露的经营数据来看，焦炭的产量/销量环比一季度增加18.79/26.38万吨，聚烯烃的产量/销量环比一季度减少4.05/6.35万吨。其余产品量方面的环比基本持平。年内宁夏三期将为公司带来100万吨聚烯烃产能增量。2022年底至2023年一季度以来，澳煤冲击及需求不振影响下，原料煤炭成本下降较为明显，焦炭板块受损，但随着近期煤焦价格企稳回升，盈利有所回升，同时煤制烯烃板块在高油煤比的情况下成本优势显著。费用控制方面，公司二季度销售费用占比环比上升0.08pct，管理费用占比环比上升0.32pct，财务费用占比环比下降0.40pct，公司费用保持稳定。,,华安证券,买入,[None],2023-08-26,,买入,5299960,pdf_downloads/2023/2023-08-26/600989-宝丰能源（600989）：高油煤比下成本优势显著，内蒙一期成长可期.pdf,600989,宝丰能源,宝丰能源（600989）：高油煤比下成本优势显著，内蒙一期成长可期
"杨翼荥,陈屹",2023年8月25日公司披露半年报，上半年公司实现营收130.90亿元，同比增长3.35%；实现归母净利润22.57亿元，同比下降43.79%，二季度营收63.57亿元，同比下降19.33%，归母净利润10.72亿元，同比下降52.76%。焦炭盈利依然有所承压，焦煤产能扩充缓解焦炭压力。二季度，收到焦炭业务影响，公司的整体业绩表现相对承压，焦炭二季度实现产销179、184万吨，基本实现产能满负荷运行，虽然最大程度上降低固定折旧带来的影响，但行业承压明显，二季度焦炭销售价格环比下降23%，终端下游房地产及基建的恢复相对缓慢，行业新增产能难以有效消化，供给充裕导致产品单环节焦煤-焦炭价差大幅收窄，行业进入亏损状态，公司通过差异化布局及自身的焦煤自供提升来降低焦炭盈利压力，盈利水平高于行业水平。伴随终端需求缓慢恢复，公司的成本优势进一步凸显，烯烃业务盈利持续改善。二季度公司烯烃产品运行获得改善，一方面原材料煤炭价格有所回调，煤头工艺获得正常回归，另一方面，下游需要逐步修复，行业价差获得一定程度改善。公司作为显著的成本管控优秀企业，烯烃单吨净利获得明显改善。二季度公司的烯烃产销量约为30万吨，环比有所下降，但伴随下半年公司的宁夏三期项目的烯烃环节逐步投产，公司的烯烃业务还有进一步提升，带动整体业绩获得改善。新项目逐步进入投产期，产品种类进一步丰富。公司在烯烃产品优化成本扩充产能的同时，丰富自身的产品种类，20万吨/年苯乙烯项目已于8月初投入试生产并生产出合格产品，宁东三期烯烃项目聚烯烃装置已经投入试生产，下半年25万吨EVA产能也将逐步进入投产阶段。在此之上，公司内蒙古300万吨/年烯烃项目建设按照既定计划顺利进行，有望在明年底实现投产，在持续高速成长的基础上进一步构建平台基础。由于焦炭业务盈利相对承压，下调公司2023年盈利13%，预估公司2023-2025年实现营业收入305.97、368.82、590.55亿元，实现归母净利润70.10、89.44、152.31亿元，EPS分别为0.96、1.22、2.08元/股，当前股价对应估值分别为14、11、7倍PE，给与“买入”评级。原料价格剧烈波动；行业竞争加剧；下游需求不达预期风险。,,国金证券,买入,[None],2023-08-26,,买入,5299807,pdf_downloads/2023/2023-08-26/600989-宝丰能源（600989）：焦化产品相对承压，烯烃业务持续改善.pdf,600989,宝丰能源,宝丰能源（600989）：焦化产品相对承压，烯烃业务持续改善
"任文坡,翟启迪",核心观点：事件 公司发布半年度报告，2023年上半年实现营业收入130.9亿元，同比下降9.1%；实现归母净利润22.6亿元，同比下降43.8%。其中，23Q2单季度实现营业收入63.6亿元，同比下降19.3%、环比下降5.6%；实现归母净利润10.7亿元，同比下降52.8%、环比下降9.6%。聚烯烃价差持续改善，焦炭价格、价差环比走弱拖累Q2业绩 2023上半年，公司分别实现聚乙烯、聚丙烯、焦炭销量34.1、31.9、341.5万吨，同比分别变化-8.0%、-6.3%、30.1%。上半年公司聚乙烯、聚丙烯、焦炭价差同比分别下降10.6%、14.9%、285.3%；焦炭价格同比下降33.7%。产品价差收窄及焦炭价格下降叠加聚烯烃销量下滑致上半年公司业绩表现不佳。分季度来看，Q2公司分别实现聚乙烯、聚丙烯、焦炭销量15.7、14.2、183.9万吨，环比分别变化-15.3%、-19.9%、16.7%。公司烯烃所用原料煤价格跌幅较大，煤制烯烃毛利空间明显改善。但聚烯烃销量环比下降叠加焦炭价格、价差环比走弱拖累Q2业绩表现。Q3是国内农膜消费旺季，国内宏观稳增长政策密集性出台，叠加国际油价中高位运行、聚烯烃成本面支撑显著，目前聚烯烃价差环比继续改善、焦炭价格亦逐步止跌企稳。新建、扩建项目逐步投产，公司迎新的利润增长点 一方面，公司不断提高煤炭自给能力。上半年，公司共计核增煤炭产能100万吨/年，其中，马莲台煤矿产能核增40万吨/年至400万吨/年，红四煤矿产能核增60万吨/年至300万吨/年。核增后，公司所属三个在产煤矿煤炭产能820万吨/年，在建丁家梁煤矿产能90万吨/年，所属煤矿煤炭产能合计910万吨/年，公司原料自给能力稳步提升。另一方面，公司化工项目陆续投产。一是20万吨/年苯乙烯项目8月初投入试生产并产出合格品。二是宁东三期烯烃项目（除EVA装置外）建成投产。其中，甲醇装置3月底投入试生产，目前已达到设计生产能力；40万吨/年聚乙烯装置、50万吨/年聚丙烯装置已经投入试生产；25万吨/年EVA装置预计10月底建成投产。积极推进内蒙项目建设，持续巩固煤制烯烃龙头地位 公司全资子公司内蒙宝丰拟投资建设“260 万吨/年煤制烯烃和配套40 万吨/年植入绿氢耦合制烯烃项目（一期）”。该项目包括3×220 万吨/年甲醇、3×100 万吨/年甲醇制烯烃、3×50 万吨/年聚丙烯、3×55 万吨/年聚乙烯等装置，已于今年3月份开工建设。项目建成投产后，含宁东三期烯烃项目在内，公司烯烃总产能将大幅提升至520 万吨/年。内蒙项目有望为公司注入新的成长动能，同时将持续巩固公司煤制烯烃龙头地位。,,银河证券,推荐,[None],2023-08-26,,买入,5299755,pdf_downloads/2023/2023-08-26/600989-宝丰能源（600989）：焦炭走弱拖累Q2业绩，内蒙项目助力成长.pdf,600989,宝丰能源,宝丰能源（600989）：焦炭走弱拖累Q2业绩，内蒙项目助力成长
"陈屹,杨翼荥",公司简介煤化工龙头企业，涵盖煤焦化和煤气化双重路线：焦化方面，700万吨焦炭产能配套40万吨煤焦油深加工及12万吨粗苯加氢产能；气化方面，有烯烃产能120万吨，今年下半年将新增100万吨产能，内蒙烯烃项目投产后，预计2025年有效产能将超过520万吨。投资逻辑烯烃业务具有明显的成本优势，抵御行业风险。公司烯烃业务在稳定运行、规模生产、工艺选择、单耗管控、高效管理等多个方面不断强化，夯实自身的成本优势，相比于煤制烯烃行业竞争对手有约800-1000元以上的成本优势，而在常规状态下，相比于油头和气头，煤制烯烃属于最具有成本优势的工艺，公司的低成本优势明显助力公司抵御行业风险，增厚现有的中枢利润水平。新增产能进一步放大竞争优势，即使竞争加剧，仍保持明显优势。公司宁夏三期100万吨烯烃增加C2-C5综合利用，进一步降低成本；内蒙基地300万吨项目采用最新的大连物化所三代工艺，单耗下降明显，结合和规模和区位优势，成本优势有望进一步提升1000元/吨。烯烃行业规划新增产能超3000万吨，以油头和气头为主，公司低成本扩张，将进一步放大优势，保证盈利空间。碳中和将拉大行业成本差距，绿氢布局将提升长期发展。受碳中和影响，煤制烯烃新增产能受限，未来碳税落地，先进工艺和落后产能一正一负的碳税收益，将明显拉大煤制烯烃内部的成本差距，公司的竞争优势将进一步突出。同时公司在宁夏和内蒙都有规划绿氢项目，短期看绿氢成本相对偏高，但伴随用电单耗和发电成本的下降，绿氢成本有6成的下降空间，公司借助区位优势可以一体化配套，有效管控绿氢成本，获得长期发展空间。煤炭新增产能获批核准，丰富产品种类打造综合平台。公司焦炭业务短期跟随行业承压，但新增100万吨焦煤产能已获审批生产，未来煤炭权益产能将超过1000万吨，自给率将提升至6成以上，极大程度上缓解焦炭压力。同时公司结合自身产业链布局，向下延伸EVA、苯乙烯、针状焦等产品，丰富产品品类，提升附加值。盈利预测、估值和评级预估公司2023-2025年实现营业收入330.77、388.90、609.75亿元，实现归母净利润80.51、95.31、158.10亿元，EPS分别为1.10、1.30、2.16元/股，当前股价对应估值分别为12、10、6倍PE，给与“买入”评级。风险提示原料价格剧烈波动；行业竞争加剧；下游需求不达预期风险。,,国金证券,买入,[None],2023-07-14,,买入,5260883,pdf_downloads/2023/2023-07-14/600989-宝丰能源（600989）：核心问题再梳理：成本优势+成长空间.pdf,600989,宝丰能源,宝丰能源（600989）：核心问题再梳理：成本优势+成长空间
杨林,公司自有煤矿产能核增获批。宁夏回族自治区发展和改革委员会于2023年5月31日发文，同意宝丰能源自有的马莲台煤矿生产能力由360万吨/年核增至400万吨/年，红四煤矿生产能力由240万吨/年核增至300万吨/年，合计增加生产能力100万吨/年。原料自给率提升助力公司成本进一步降低。为应对持续增长的原料煤需求，公司表示将继续加强长协合作，深化与国家能源集团、山东能源集团、中煤集团、晋能控股等大型央企、国企的合作，保持现有供应渠道稳定，充分运用供应商的长协价格政策，降低采购成本；积极开拓新供应渠道，新开发了新疆、内蒙古、陕西等多地煤炭资源供应商，强化物流运输协调，提升原料煤供应能力；公铁联运稳定供应，新增铁路发运，实现公路转铁路；严控供货流程降损失，强化运输过程监控。此次公司两处自有煤矿产能核增成功获批，提升了公司自身原料煤的供应，原料自给率提升助力公司成本进一步降低。原煤价格下降缓解成本端压力。据公司年报，国内聚烯烃行业供需基本平衡并继续呈增长态势，尽管行业利润下降，煤制烯烃表现相对较好。据Wind数据，内蒙古东胜原煤坑口价月均价由2023年1月的970.50元/吨逐月降低至5月的738.75元/吨。预计受煤炭增产保供、进口煤数量增加等因素影响，原煤价格将继续下跌，公司成本端压力进一步缓解，业绩有望改善。焦化业务盈利水平环比回升。5月焦煤期货结算价平均为1329.13元/吨（环比-17.3%），焦炭期货结算价平均为2103.68元/吨（环比-12.2%）。焦煤价格环比跌幅大于焦炭，焦化业务价差环比提升。在建工程进展顺利，产能扩张彰显公司成长性。宁东三期100万吨/年烯烃项目的甲醇装置已于2023Q1末投产，烯烃装置也在加紧建设。内蒙古宝丰煤基新材料有限公司在内蒙古鄂尔多斯市乌审旗苏格里经济开发区图克工业项目区新建260万吨/年煤制烯烃和配套40万吨/年植入绿氢耦合制烯烃工程开工建设中，在建工程项目进度符合预期。风险提示：产品价格下跌风险；原材料价格波动风险；环保政策风险；项目投产不及预期风险。投资建议：考虑公司主营业务盈利水平回升，新建产能逐步落地，我们维持盈利预测，预计公司2023-2025年归母净利润89.7/118.0/158.5亿元，对应EPS为1.22/1.61/2.16元，对应当前股价PE为10.2/7.8/5.8X，维持“买入”评级。,,国信证券,买入,[None],2023-06-04,,买入,5228817,pdf_downloads/2023/2023-06-04/600989-宝丰能源（600989）：有煤矿产能核增获批，原料自给率再提升.pdf,600989,宝丰能源,宝丰能源（600989）：有煤矿产能核增获批，原料自给率再提升
"王亮,王海涛",事件：公司近期发布2022年报及2023年一季报，2022年公司实现营收284.30亿元，同比增长22.0%，实现归母净利润63.03亿元，同比下降10.86%；2023年一季度实现营收67.33亿，同比增长3.35%，实现归母净利润11.85亿，同比减少32.13%，环比增长27.46%。煤炭价格回落，原材料成本下行，烯烃盈利好转。2023年Q1，公司聚乙烯、聚丙烯产品销量分别为18.48万吨、17.73万吨，环比+10%、+13%；内蒙古坑口煤价由2022年Q4均价1019元/吨下降至2023年Q1均价906元/吨，环比-11.1%，原料成本明显降低；2023Q1聚乙烯市场价格8462元/吨，环比+1.1%，聚丙烯市场价格8219元/吨，环比-2.9%；煤制烯烃利润较去年底明显上升。2023Q1实现综合毛利率27.75%，环比上升6.46%，综合净利率17.60%，环比上升4.21%，整三期项目、内蒙项目稳步推进，构筑成长空间。据2022年报披体环比改善明显。露，内蒙古宝丰煤基新材料有限公司一期260万吨/年煤制烯烃和配套40万吨/年植入绿氢耦合制烯烃项目已于2023年3月开工，计划2024年完工。内蒙项目投产后，公司烯烃总产能规模将达到520万吨/年，较目前的 。此外，据年报及公开信息，宁东三期甲醇项目已投产，甲醇总产能规模已达590万吨/年，50万吨/年煤制烯烃、50 万吨/年C2-C5 综合利用制烯烃烯烃产能将于2023年内投产；综合来看，宁夏三期烯烃项目、内蒙项目为公司构筑了明显的成长空间。风险提示：产品价格下跌、项目投产不及预期风险、行业产能过剩风、煤炭价格大幅波动等。投资建议：维持盈利预测，预计公司2023-2025年归母净利润95.4/97.8/138.4亿元，对应EPS为1.03/1.33/1.89元，对应当前股价PE为14.9/11.5/8.1X，维持“买入”评级。,,太平洋证券,买入,[None],2023-04-26,,买入,5190046,pdf_downloads/2023/2023-04-26/600989-宝丰能源（600989）：2023Q1业绩环比改善，内蒙项目构筑成长空间.pdf,600989,宝丰能源,宝丰能源（600989）：2023Q1业绩环比改善，内蒙项目构筑成长空间
"李骥,沈颖洁",投资要点事件：4月21日，公司发布2023年一季度报告，公司实现营收67.33亿，同比增长3.35%；实现归母净利润11.85亿，同比减少32.13%，环比增长27.46%；扣非净利润12.80亿，同比减少32.14%，环比增长31.7%。Q1利润率环比改善明显。2023Q1，公司实现营收营收67.33亿，同比增长3.35%；实现归母净利润11.85亿，同比减少32.13%，环比增长27.46%；扣非净利润12.80亿，同比减少32.14%，环比增长31.7%。利润率方面，实现综合毛利率27.75%，环比上升6.46个pct，综合净利率17.60%，环比上升4.21个pct，整体环比改善明显。煤炭价格有所松动，看好烯烃盈利修复。2023年一季度，公司焦炭板块实现营收28.23亿元，同比增长9.02%，实现销售17.73万吨；烯烃板块实现营收25.41亿元，其中聚乙烯实现销量18.48万吨，单季度均价7102.26元/吨；聚丙烯实现销售17.73万吨，单季度均价6932.39元/吨。原材料端，2023年一季度气化原煤采购价格741.15元/吨，同比增长9.32%；炼焦精煤采购价格1460.14元/吨，同比下降11.20%；动力煤采购价格546.93元/吨，同比增长10.46%；煤焦油采购价格4465.32元/吨，同比增长10.99%。部分原材料价格有所松动，据Wind数据，截至2023年4月23日，秦皇岛动力煤（Q5500）报价为999元/吨，较年初1175元/吨下降约14.98%，我们看好后续煤价进一步会暖和，公司主要烯烃产品盈利空间修复。内蒙项目落地后，公司烯烃产能有望飞跃式提升。内蒙古宝丰煤基新材料有限公司一期260万吨/年煤制烯烃和配套40万吨/年植入绿氢耦合制烯烃项目是目前为止全球单厂规模最大的煤制烯烃项目，也是全球最大规模化用绿氢替代化石能源生产烯烃的项目。项目主要建设660万吨/年甲醇装置、300万吨/年甲醇制烯烃装置、150万吨/年聚丙烯装置、165万吨/年聚乙烯装置。项目已于2023年3月开工建设，完全建成投产后，含届时将投产的宁东三期烯烃项目在内，公司烯烃总产能将大幅提升至520万吨/年。投资建议：考虑原材料因素，我们略微调整了公司盈利，预计公司2023-2025年每股收益分别为1.03、1.38和2.12元，对应PE分别为13、9和6倍，维持“买入”评级。风险提示：下游需求不及预期、产品价格波动风险、扩产项目进度不及预期。,,德邦证券,买入,[None],2023-04-24,,买入,5185990,pdf_downloads/2023/2023-04-24/600989-宝丰能源（600989）：Q1业绩环比有所改善，内蒙项目构筑成长曲线.pdf,600989,宝丰能源,宝丰能源（600989）：Q1业绩环比有所改善，内蒙项目构筑成长曲线
杨晖,事项：公司发布2023年第一季度报告，实现营收67.33亿元，同比+3.35%/环比-3.05%；归母净利润11.85亿元，同比-32.13%/环比+27.42%；扣非归母净利润12.80亿元，同比-32.14%/环比+31.69%；实现毛利率为27.75pct，同比-11.2pct/环比+6.5pct；实现净利率为17.60pct，同比-9.2pct/环比+4.2pct。评论：煤价下行成本压力缓解，业绩环比改善。从销量来看，2023Q1公司共实现主营产品聚乙烯/聚丙烯/焦炭销量分别为18.48/17.73/157.56万吨，同比分别+1.6%/+10.9%/+37.4%，环比分别+9.8%/+12.5%/-8.4%，产销环比变动主要受销售季节特征影响；从价格来看，2023Q1公司聚乙烯/聚丙烯/焦炭单吨售价分别为7102/6932/1792元/吨，同比分别-7.5%/-7.4%/-20.7%，环比分别为-1.2%/-1.7%/-3.1%，主营产品景气度同环比均有所下滑。但受核心原材料煤价下行的积极因素主导，毛利率仍呈现环比改善态势（环比+6.5pct）：2023年Q1公司气化原料煤/炼焦精煤平均采购单价为741/1460元/吨，同比+9.3%/-11.2%，环比去年全年-2.7%/-11.9%。定增预案发布，保障300万吨烯烃项目平稳推进。公司发布2023年度定增预案，拟发布不超过8亿股，募资总额不超过100亿元，用于全资子公司内蒙宝丰投资建设“260万吨/年煤制烯烃和配套40万吨/年植入绿氢耦合制烯烃项目（一期）”。项目一期工程计划投资395亿元，此次定增募集将缓解公司的现金流压力，保障项目顺利落地，投产后含届时将投产的宁东三期烯烃项目在内（据公司2022年年报披露，三期烯烃项目建设进展顺利，甲醇工段已具备投产条件，烯烃工段将于2023 年年内投产），烯烃总产能将大幅提升至520万吨/年，以当前120万吨产能为基数，预计公司烯烃产能增长超过3倍。油价高位支撑烯烃价格企稳，煤价回落价差持续修复。4月2日，欧佩克多个成员国宣布，从5月起到2023年年底将削减原油供应量，总减产幅度超过160万桶/日，减产公告后当周油价重回80美元高点，供给紧缩且自主能力较差的石油价格或将长期维持在相对高位，油头定价的烯烃成本端支撑稳定；油价高企的同时，国内煤炭在保供增产引领下价格逐步从2021~2022年价格高点回落，截至2023年4月14日，内蒙古东胜坑口煤价/ 1/3焦煤价格分别为782/1700元/吨，相比去年同期分别-3.0%/-22.7%，当前煤炭中下游高位库存压制价格弹性，同时各省积极投入产能增长，煤价或将继续下行，公司原料压力有望进一步缓解，价差持续修复。据Wind数据，2023Q1聚乙烯价差（聚乙烯-6*原煤）均值约为4042元/吨，环比2022Q4+6.2%。投资建议：结合公司在建产能进度以及国内煤炭市场情况，我们维持之前对2023-2025年的归母净利润预期，分别为79.20/106.30/164.21亿元。对应当前PE分别为13x/10x/6x。参考公司历史估值，我们给予公司2023年20倍目标P/E，对应目标价21.60元，维持“强推”评级。,,华创证券,强推,[None],2023-04-23,,买入,5183963,pdf_downloads/2023/2023-04-23/600989-宝丰能源（600989）：煤价下行业绩环比改善，定增推进产能增长.pdf,600989,宝丰能源,宝丰能源（600989）：煤价下行业绩环比改善，定增推进产能增长
