author,content,filename,org_name,original_rating,pdf_link,publish_time,rating_adjust_mark_type,rating_changes,report_id,save_path,stock_code,stock_name,title
"何立中,韩杨",事件：公司发布2021年三季报。行业景气持续，公司Q3业绩高增。2021年1-9月公司实现收入15.35亿元，同比+77.95%；归母净利润4.51亿元，同比+117.93%。2021Q3单季度收入6.20亿元，同比+56.03%；归母净利润1.91亿元，同比+86.06%。产品结构优化，毛利率持续提升。2021年1-9月公司毛利率为54.74%，较去年同期增加3.86pct；净利率为29.03%，较去年同期增加5.28pct。期间费用率方面，2021年1-9月公司期间费用率均较去年同期有所减少，销售费用率、管理费用率、财务费用率及研发费用率分别为5.68%、2.92%、-0.19%及17.23%。高水平研发投入，迅速响应市场需求。模拟芯片迭代速度快，市场需求变化多样，产品种类众多。公司自成立以来一直注重研发能力，2021年1-9月公司研发费用达2.64亿元，同比+76.54%，研发费用率为17.23%。上市以来，公司保持每年推出200余款新产品的研发节奏，截至2021年6月30日，公司可供销售产品达3500余款，涵盖25个产品类别。合同负债快速增长，新客户数量进一步增加。截至2021年9月30日，公司合同负债账面余额为1239.69万元，去年同期仅为271.76万元。由于公司产品种类众多，终端客户较为分散，公司主要采取经销模式。对于新建立联系的客户，公司通常采取先交款后发货的销售模式。合同负债快速增加预示公司未来需求持续景气，预计全年收入仍将保持高增速。产品种类丰富，市场份额持续扩充下有望逆周期成长。公司产品广泛应用于消费电子、通讯设备、工业控制、医疗仪器、汽车电子等领域，以及物联网、新能源、智能穿戴、人工智能、智能家居、智能制造、5G通讯等新兴电子产品领域。公司在各细分领域市场份额占比不高，单一行业景气度变化对公司影响较小，伴随公司份额不断扩充有望实现逆周期成长。盈利预测：我们预计公司2021/2022/2023年归母净利润分别为5.47/7.35/9.06亿元，对应11月4日股价PE分别为97/72/59倍，首次覆盖，给予“买入”评级。风险提示：产品研发不及预期、客户拓展不及预期、行业景气不及预期,,首创证券,买入,[None],2021-11-08,,买入,4665017,pdf_downloads/2021/2021-11-08/300661-圣邦股份（300661）公司简评报告：模拟龙头份额不断扩充，有望实现逆周期增长.pdf,300661,圣邦股份,圣邦股份（300661）公司简评报告：模拟龙头份额不断扩充，有望实现逆周期增长
"张良卫,焦鼎",事件：2021年第三季度，公司实现营收6.2亿元，yoy+56.03%，qoq+18.86%，归母净利润1.91亿元，yoy+86.06%，qoq+3.03%，扣非归母净利润1.86亿元，yoy+82.46%，qoq+21.47%，毛利率59.92%，yoy+10.4pct，qoq+6.16pct，净利率30.4%，yoy+4.87pct，qoq-4.73pct。2021年前三季度，公司实现营收15.35亿元，yoy+77.95%，归母净利润4.51亿元，yoy+117.93%，扣非归母净利润4.11亿元，yoy+101.93%，毛利率54.74%，yoy+3.86pct，净利率29.03%，yoy+5.28pct。投资要点产品销量持续增长，业绩高速增长：公司2021Q3营收、归母净利润同比环比均持续提升，业绩符合市场预期，主要得益于公司业务规模稳步扩张，产品销量增加；公司持续加大研发投入，公司2021Q3研发费用1.09亿元，yoy+103.03%。2021年前三季度，非经常性损益对公司净利润的影响金额约为3970万元，主要为股权转让收益、理财收益及政府补助。产品结构不断优化，数量&amp;品质稳步提升：公司在高性能、高品质模拟IC领域产品线丰富，目前可提供25大类3500余种模拟IC产品，可满足不同客户的多元化需求，相关产品广泛应用于消费电子、通讯设备、工业控制、医疗仪器和汽车电子等领域，产品品类优势突出。在传统应用基础上，公司高效推进模拟IC的研发成果转化，紧跟市场需求推进产品升级和新品量产，产品品类不断扩充，2021上半年，公司共推出200余款拥有完全自主知识产权的新产品，其综合性能指标均达到国际同类产品的先进水平，市场份额有望持续提升。公司模拟IC产品在高效率、低功耗、高精度、小尺寸、高可靠性等方面的技术优势明显，产品性能和品质对标世界一流模拟芯片厂商同类产品，部分关键性能指标有所超越，相关产品在客户端的导入品类快速增长，同时，公司积极优化产品结构，高端品类占比稳步提升，有效增强公司盈利能力。受益应用需求广泛和国产替代推进，未来成长空间广阔：公司多样化的产品策略可以有效对接模拟IC市场的广泛需求。同时，公司在电源管理和信号链芯片的本土供应链中优势地位明显，开发并积累了一系列具有国际先进水平的核心技术与产品。此外，公司深耕国内市场，凭借本地优势，紧贴市场需求，快速响应，客户认可度及品牌影响力不断提升，市场份额不断扩大，有望率先受益于模拟IC的国产替代进程，未来的成长空间十分广阔。盈利预测与投资评级：我们预计随着公司各产品在品类和应用市场的持续拓展，公司营收规模和盈利能力有望稳步提升，我们将公司2021-2023年EPS预测上调至2.48(+0.05)/3.46(+0.26)/4.55(+0.5)元，当前市值对应2021-2023年PE为131/94/71倍，维持“买入”评级。风险提示：市场需求不及预期；新品推出不及预期；客户开拓不及预期。,,东吴证券,买入,[None],2021-11-01,,买入,4657342,pdf_downloads/2021/2021-11-01/300661-圣邦股份（300661）：产品结构持续优化，巩固行业龙头地位.pdf,300661,圣邦股份,圣邦股份（300661）：产品结构持续优化，巩固行业龙头地位
张欣,投资要点事件：公司于2021年10月26晚发布2021年三季度：2021年前三季度公司实现营收15.35亿元，同比增长77.95%；实现归母净利润4.51亿元，同比增长117.93%；其中第三季度归母净利1.91亿，同比增长86%。点评如下：在销品类叠加国产导入带来Q3营收和业绩高增长。公司于2021年10月26晚发布2021年三季度：2021年前三季度公司实现营收15.35亿元，同比增长77.95%，其中三季度单季度营收6.20亿，同比增加56%，环比增加18.8%；前三季度实现归母净利润4.51亿元，同比增长117.93%，业绩位于此前业绩预告区间上限；其中第三季度归母净利1.91亿，同比增长86%，环比增加3.24%，营收高增长主要是公司积极拓展业务，且受益缺货少芯背景下公司在销品类和新增品类延续2季度环比增加趋势明显，新产品同时带动Q3毛利率59.92%，环比增加6.16个百分点，另外利润环比增速少于营收主要投资收益受钰泰股权激励费用影响。 展望Q4，根据合同负债同比增加提升310%，主要是下游需求景气及公司下游开拓新客户等。设立封测子公司，加强高端产品储备。公司此前10月20日公告拟与江阴高新技术产业开发区管理委员会签署《投资协议》，并在江阴高新技术产业开发区内投资设立全资子公司江阴圣邦微电子有限公司主要建设集成电路设计及测试项目，我们预计新公司的设立将为公司垂直发展产业链保证封装产能的同时，在汽车电子、工控等高端产品的封装实力有进一步提升。内生与外延协同加快发展。 由于模拟行业大卖场模式以及对工程师经验要求较高，所以并购重组是模拟IC厂商实现跨越式发展的重要跳板，尤其是在品类、人才、应用等协同效应产生对规模和品牌的放大效应。公司此前上市后并购大连阿尔法以及投资钰泰半导实现产品品类和规模的提升，根据此前公告，增资控股及收购资产也将进一步壮大规模和品类护城河。盈利预测：我们预计公司2021、2022年营收分别为20.40、31.99亿，2021-2022年业绩分别为6.02、8.03亿，同比增长108%、33%，对应估值分别为126，95；中短期公司受益模拟需求高景气及缺货带来国产替代导入，长期看好公司作为国内模拟芯片龙头追赶TI等，维持“买入”评级。风险提示：国产替代不及预期，产能扩张不及预期，系统性风险,,中泰证券,买入,[None],2021-11-01,,买入,4656461,pdf_downloads/2021/2021-11-01/300661-圣邦股份（300661）：Q3业绩高增长，预收款佐证需求持续景气.pdf,300661,圣邦股份,圣邦股份（300661）：Q3业绩高增长，预收款佐证需求持续景气
"唐泓翼,胡剑,胡慧,许亮",毛利率持续提高，净利率受投资收益影响环比下滑公司发布2021年三季报，1-3Q21实现营收15.35亿元(YOY 77.95%)、归母净利润4.51亿元(YOY 117.93%，预告值为105.03%-122.35%，处于中值偏上)、扣非后归母净利润4.11亿元(YOY 101.93%)。对应3Q21单季营收6.20亿元(YoY 56.03%，QoQ 18.86%)、归母净利润1.91亿元(YoY 86.06%，QoQ 3.03%)。3Q21单季毛利率59.92%，同比提升10.40pct，环比提升6.16pct；净利率30.40%，同比提升4.87pct，环比下降4.73pct，主要是由于3Q投资净收益相比2Q减少80%。对外投资建设测试产线，完善产业布局公司10月20日发布对外投资公告，拟与江阴高新技术产业开发区管理委员会签署《投资协议》，将在开发区内设立全资子公司作为项目实施主体，建设集成电路设计及测试项目，计划用地面积约30亩，总投资额约3亿元。本次投资符合公司长期发展战略，有利于增强公司的综合实力，扩大团队规模，完善产业布局。如项目顺利推进，将有利于进一步巩固和提升公司的核心竞争力。电子+”和国产替代共振，四象限带来增长电子+”时代的到来推动硅含量提升，为模拟芯片市场带来持续增量。公司的模拟芯片产品可广泛应用于消费类电子、通讯设备、工业控制、医疗仪器、汽车电子及物联网等新兴领域。另一方面，模拟芯片国产化率较低，国产替代有利于公司持续开拓新客户并提高份额。我们认为在“电子+”和国产替代两大趋势共振下，新客户新产品、老客户新产品、新客户老产品、老客户老产品是公司长期成长的四大动力。投资建议：维持“买入”评级我们维持对公司业绩预测，预计2021-2023年归母净利润分别为5.88/8.53/12.43亿元，对应2021年10月26日股价的PE分别为128/88/60x，维持“买入”评级。风险提示：需求不及预期，产品研发不及预期，上游产能紧缺的风险。,,国信证券,买入,[None],2021-10-28,,买入,4653131,pdf_downloads/2021/2021-10-28/300661-圣邦股份（300661）财报点评：3Q毛利率继续提高，对外投资完善产业布局.pdf,300661,圣邦股份,圣邦股份（300661）财报点评：3Q毛利率继续提高，对外投资完善产业布局
刘翔,下游需求高度景气，业绩表现持续优秀2021年10月26日，公司发布2021年三季报，受益于下游需求的高度景气，2021Q3公司营业收入为6.20亿元、同比增长56.03%、环比增长18.86%，2021Q3扣非公司归母净利润为1.86亿元、同比增长82.46%、环比增长21.47%。考虑到下游需求高度景气，我们上调盈利预测，预计公司2021-2023年归母净利润为6.08/8.27/9.34亿元（原值分别为4.06/5.49/7.90亿元），EPS为3.88/5.28/5.97元，当前股价对应PE为82.1/60.4/53.4倍。考虑到公司所处的模拟芯片赛道仍处于国产化替代的快速渗透期，维持“买入”评级。成本转嫁能力突出，预收款项确认真实需求受益于下游需求高度景气，叠加上游供应链持续紧张，2021Q1-2021Q3公司的毛利率水平依次为47.87%、53.76%和59.92%，这体现出公司较强的成本转嫁能力和产品结构调整能力。为了遏制经销商炒货并辨别真实需求，公司提升预收账款幅度，使得合同负债由2021Q2的680.83万元提升至2021Q3的1239.69万元，这预将显著提升公司对下游真实需求的把控能力。积极应对产能危机，主动投资芯片测试产能不同于2018-2020年，公司在各年第三季度才大幅提高预付账款来预定下一年的产能；在2021年，2020Q4-2021Q3公司的预付账款分别为59.97万元、210.86万元、317.42万元和365.11万元，这意味着公司从2021Q1便开始便积极预定产能，且产能的预定幅度呈现出逐步增加趋势，这预将为公司2022年的业绩表现提供较为充足的产能支持。同时，2021年10月20日，公司发出对外投资公告称，拟投资3亿元用于在江阴建设集成电路设计及测试项目，且国产封测龙头长电科技的总部在江阴，这预将进一步提升公司的供应链能力。风险提示：上游产能存在持续趋紧的风险；客户拓展速度存在较大不确定性；新产品研发进度存在不确定性。,,开源证券,买入,[None],2021-10-27,,买入,4650836,pdf_downloads/2021/2021-10-27/300661-圣邦股份（300661）公司信息更新报告：成本转嫁能力突出，产能危机有效应对.pdf,300661,圣邦股份,圣邦股份（300661）公司信息更新报告：成本转嫁能力突出，产能危机有效应对
"佘凌星,郑震湘",事件：圣邦股份发布前三季报业绩预告，2021前三季度归母净利4.24亿元~4.60亿元，同比+105.03%~122.35%；Q3归母净利1.64亿元~2.00亿元，同比+60%~95%。前三季扣非归母净利3.85~4.21亿元，同比增速89~106%，Q3扣非归母净利1.59~1.95亿元，同比56.30%~91.50%，环比4%~27%。前三季度业绩高增主要系公司积极拓展业务，产品销量增加带动营收增长。创新成果转化加速，业绩进一步释放可期。自21年中报我们已追踪到公司创新孵化能力强化。公司近几年每年推出200余款新产品，而2021上半年，公司即推出200余款具完全自主知识产权新产品，与以往全年推出新品数相当，产品集群扩容加速。前三季公司产品销量带动营收，预计归母净利翻倍式高增，验证从研发，到产品，再到业绩的传导。截至2021年中，公司自研的可供销售产品高达3500余款，上半年1700余款产品贡献收入。基于加速扩容的产品集群，我们认为公司业绩进一步释放可期！产品集群持续完善，覆盖广泛应用领域。公司产品涵盖信号链和电源管理两大领域，包括运算放大器、比较器、音/视频放大器、模拟开关、电平转换及接口电路、小逻辑芯片、LDO、DC/DC转换器、OVP、负载开关、LED驱动器、微处理器电源监控电路、马达驱动、MOSFET驱动及电池管理芯片等。公司产品可广泛应用于消费类电子、手机与通讯、工业控制、医疗仪器、汽车电子等领域，以及物联网、新能源、可穿戴设备、人工智能、智能家居、无人机、机器人和共享单车等新兴电子产品领域。当前公司覆盖百余个细分市场领域、几千家客户。模拟IC大赛道，国产替代正当时。在中国模拟电路自产率较低背景下，圣邦作为国产模拟 IC 优质厂商，紧跟市场需求，大力投入研发，推出达到世界先进水平的高性能模拟芯片产品，有望深度受益国产替代大趋势。公司以信号链产品见长，近年来切入消费类产品应用广泛的电源管理业务，增长迅速。盈利预测及投资建议：作为国内模拟IC龙头，公司专注于高性能、高品质模拟集成电路芯片设计及销售，产品结构持续改善，盈利能力持续增强。我们预计公司2021-2023年分别实现营收17.71/25.54/35.57，归母净利润6.01/8.36/12.03亿元，对应PE 126.2/90.8/63.1x，给予“买入”评级。风险提示：新产品研发不及预期，下游需求不确定性。,,国盛证券,买入,[None],2021-10-15,,买入,4637007,pdf_downloads/2021/2021-10-15/300661-圣邦股份（300661）：前三季业绩预告高增，验证研发转化加速.pdf,300661,圣邦股份,圣邦股份（300661）：前三季业绩预告高增，验证研发转化加速
"吴天元,吴昊,李美贤,陈宇哲",圣邦股份(300661)事件：公司21H1实现营业收入9.15亿元，YoY+96.66%；归母净利润2.61亿元，YoY+149.16%。其中，21Q2实现营业收入5.22亿元，YoY+91.27%；归母净利润1.85亿元，YoY+149.33%。产品线&amp;客户规模渗透，业绩高增不断验证国产替代逻辑。公司不断拓宽产品线，以覆盖更多的客户和应用场景。从2018年到2021年上半年，公司贡献收入的产品款数从1000+拓展到1700+。特别是在疫情以来，公司抓住全球芯片紧缺机遇，通过在各个下游领域开拓新客户，同时加强现有客户的品类渗透，做大做强，推动公司上半年业绩大增97%，不断验证国产替代逻辑。研发投入成效显著，高端产品稳步提升毛利率。2021年上半年，公司研发费率高达17%，多年以来保持在15%以上的高水平。持续的高研发投入成果渐显，公司产品竞争力不断提升。2021年上半年，公司共推出200余款拥有完全自主知识产权的新产品，合计形成25大类3500余款可供销售的产品。产品综合性能指标达到国际同类产品的先进水平，部分关键技术指标达到国际领先，推动公司毛利率从2016年上半年的39.84%到2021上半年的51.22%。模拟芯片强者恒强，高研发高毛利良性循环助力公司启航。模拟芯片市场广阔，下游具有高度分散的特点，优秀的模拟芯片公司通过做全品类、做深产品线，不断积累优势。全球龙头TI经过60余年的发展，目前形成了8万多款产品；而次席ADI经过50多年的发展，目前亦拥有超过3万款的产品，二者凭借航母级别的产品线能力，对外形成强大的竞争优势。我们看好公司借力国产替代机遇，凭借优秀的设计能力和高研发效率，不断积累客户群、拓宽产品线，形成高研发高毛利的良性循环，成长为与国际巨头比肩的优秀模拟IC公司。公司盈利预测及投资评级：由于公司产品拓展超预期，我们上调盈利预测。我们预计公司2021-2023年净利润分别为20.41、29.21和40.09亿元，对应EPS分别为2.25、3.22和4.42元。当前股价对应2021-2023年PE值分别为135、94和69倍。看好公司不断拓宽产品线和客户做大做强，维持“强烈推荐”评级。风险提示：产能释放不及预期、下游客户需求不及预期。,,东兴证券,强烈推荐,[None],2021-09-06,,买入,4609554,pdf_downloads/2021/2021-09-06/300661-圣邦股份（300661）：产品线客户群双双增长，滚雪球式发展的模拟芯片龙头.pdf,300661,圣邦股份,圣邦股份（300661）：产品线客户群双双增长，滚雪球式发展的模拟芯片龙头
王谋,投资要点业绩总结：2021H1，公司实现营业收入9.2亿元，同比增长96.7%；实现归母净利润2.6亿元，同比增长约149.2%。公司业绩超预期，两大业务产品线齐头并进。2021H1：1）从营收端来看，电源管理类/信号链类产品分别实现收入6.4/3.5亿元，同比分别增长107.5%/74.8%，营业收入占比分别为69.6%/30.4%。自2020年下半年起 ，集成电路行业出现产能紧张、持续缺芯的状况，叠加下游需求旺盛，公司业绩暴增。2）从利润端来看，公司营收实现了96.7%的大幅同比增长，归母净利润实现了149.2%的大幅同比增长。3）从费用端来看，公司销售费用率为6.1%，同比下降0.6pp；管理费用率为3.2%，同比下降1.0pp；研发费用率为17.0%，同比下降3.7pp。“三费”同比均有所下降，费用控制良好。公司模拟IC产品丰富，下游使用场景广泛。公司产品种类齐全，现已拥有 25大类 1600 余款在售产品，产品覆盖信号链和电源管理两大领域。公司产品已达到对标世界一流模拟芯片厂商同类产品的性能和品质由于模拟芯片的特点，公司产品在消费类电子、通讯设备、工业控制、医疗仪器、汽车电子等领域，以及物联网、新能源、智能穿戴、人工智能、智能家居、智能制造、5G通讯等新兴电子产品领域皆有应用。Fabless模式利于分配资金资源，注重研发投入，国产替代时代有望实现马太效应。圣邦股份采用Fabless的经营模式，将公司的资源集中分配在芯片设计和销售，减少对昂贵生产厂房和设备的支出，便于公司资金资源更好的集中于芯片设计与研发。公司也在研发有行业领先的费用和人员投入，为公司在未来的的继续研发和创新奠定了基础。中国对于模拟IC需求极高，但距离国家指定的芯片国产替代目标还有较大空间。作为在龙头效应显著的芯片行业的国产模拟龙头，公司有望享受国产替代红利。盈利预测与投资建议。预计2021-2023年，公司EPS分别为2.49元、3.34元、4.15元，未来三年归母净利润复合增速有望达到49%以上。我们给予公司2021年150倍PE估值，对应目标价372.83元，首次覆盖，给予“买入”评级。风险提示：全球宏观经济波动的风险；新冠疫情反复导致下游需求不达预期的风险。,,西南证券,买入,[None],2021-09-03,,买入,4607708,pdf_downloads/2021/2021-09-03/300661-圣邦股份（300661）：业绩超预期，两大产品线齐头并进.pdf,300661,圣邦股份,圣邦股份（300661）：业绩超预期，两大产品线齐头并进
王平阳,圣邦股份(300661)事件：2021年上半年，公司实现营业收入9.15亿元，同比增长96.66%，归母净利润2.61亿元，同比增长149.16%。投资要点市场拓展持续推进，盈利能力稳步提升：公司2021H1归母净利润2.61亿元，yoy+149.16%，业绩符合市场预期，对应2021Q2归母净利润1.85亿元，yoy+149.33%，qoq+145.2%，自2020H2至2021H1，半导体集成电路行业持续出现产能紧张、芯片缺货、价格上涨等现象，终端厂商纷纷加大元器件备货力度，在旺盛的市场需求下，公司积极拓展业务，产品销量增加，相应的营业收入同比增长。2021Q2，公司毛利率53.76%，yoy+0.3pct，qoq+5.89pct，期间费率25.37%，yoy-2.75pct，qoq-1.74pct，销售净利率35.13%，yoy+8.13pct，qoq+16.35pct，盈利能力稳步提升。分业务看，2021H1，电源管理产品营收6.37亿元，yoy+107.76%，毛利率48.32%，yoy+1.22pct，信号链产品营收2.78亿元，yoy+75.02%，毛利率57.84%，yoy-3.75pct。产品结构不断优化，持续巩固领先优势：公司在高性能、高品质模拟IC领域产品线丰富，目前可提供25大类3500余种模拟IC产品，可满足不同客户的多元化需求，相关产品广泛应用于消费电子、通讯设备、工业控制、医疗仪器和汽车电子等领域，产品品类优势突出。在传统应用基础上，公司高效推进模拟IC的研发成果转化，紧跟市场需求推进产品升级和新品量产，产品品类不断扩充，2021H1，公司共推出200余款拥有完全自主知识产权的新产品，其综合性能指标均达到国际同类产品的先进水平，市场份额有望持续提升。公司模拟IC产品在高效率、低功耗、高精度、小尺寸、高可靠性等方面的技术优势明显，产品性能和品质对标世界一流模拟芯片厂商同类产品，部分关键性能指标有所超越，相关产品在客户端的导入品类快速增长，同时，公司积极优化产品结构，高端品类占比稳步提升，有效增强公司盈利能力。在当前半导体供需紧张加剧的背景下，公司除了扩大与现有供应商的合作，也增加了新供应商的投入，以期扩充产能，提升产出和缓解交付压力，有望充分受益于各类应用对模拟IC需求的持续提升。受益应用需求广泛和国产替代推进，未来成长空间广阔：公司多样化的产品策略可以有效对接模拟IC市场的广泛需求。同时，公司在电源管理和信号链芯片的本土供应链中优势地位明显，开发并积累了一系列具有国际先进水平的核心技术与产品。此外，公司深耕国内市场，凭借本地优势，紧贴市场需求，快速响应，客户认可度及品牌影响力不断提升，市场份额不断扩大，有望率先受益于模拟IC的国产替代进程，未来的成长空间十分广阔。盈利预测与投资评级：我们维持公司2021-2023年归母净利润预测5.71/7.52/9.52亿元，当前市值对应2021-2023年PE为130/99/78倍，维持“买入”评级。风险提示：市场需求不及预期；新品推出不及预期；客户开拓不及预期。,,东吴证券,买入,[None],2021-09-03,,买入,4607217,pdf_downloads/2021/2021-09-03/300661-圣邦股份（300661）2021年半年报点评：受益模拟IC高景气，持续巩固优势地位.pdf,300661,圣邦股份,圣邦股份（300661）2021年半年报点评：受益模拟IC高景气，持续巩固优势地位
