author,content,filename,org_name,original_rating,pdf_link,publish_time,rating_adjust_mark_type,rating_changes,report_id,save_path,stock_code,stock_name,title
"李斌,黄自迪",2026年3月06日│中国内地/中国香港 贵金属 2026年3月5日紫金矿业出席了我们组织的2026年春季策略会，会上公司就2025年以来的经营情况进行了回顾分析、对未来发展进行了展望。我们看好紫金矿业的价值提升：1）看好铜、金价上行周期。2）公司是铜金、乃至有色龙头，经营稳健、成长性较强，我们预期2026-2027年归母净利增速较高（+57%/+23%）。核心亮点：1、公司2023-2025年经营表现亮眼：根据《紫金矿业集团股份有限公司关于三年（2026-2028年）主要矿产品产量规划和2035年远景目标纲要的公告》（2026-2-9），2023-2025年，面对全球政治经济和社会环境深刻变革，公司坚持“提质、控本、增效”工作总方针，超预期完成目标任务，主要经济指标和铜、金矿产品产量进入全球第3-5 位。2025年相较于2022年，归母净利从200亿元增长至510-520亿元，增长率155-160%；铜资源量及产量分别增长16%/20%，黄金资源量及产量分别增长26%/61%，白银资源量及产量分别增长29%/10%，碳酸锂资源量增长43%、产量实现从0至2.5万吨的增长，钼资源量及产量分别增长15%/115%、只有铅锌资源量及产量有所下滑。截至2025年，公司矿产铜、金、锌、银产量均位居中国第1位；矿产铜、金、锌产量分别位居全球第4、第5、第4位；当量碳酸锂、矿产钼产量分别位居全球第10、第7 位。2、公司2026-2028年继续规划高速发展：根据《紫金矿业集团股份有限公司关于三年（2026-2028年）主要矿产品产量规划和2035年远景目标纲要的公告》（2026-2-9），展望未来，公司坚持以矿业为主导，以“提质、上产、控本、增效”为工作总方针，以“奋发有为、改革创新、高度适配、控制风险”为基本原则，持续深化“简洁、规范、高效”运营管理体系改革，着力破解“日益全球化与局限的国内思维及管理方式”主要矛盾。具体来看，公司规划，到2028年，公司的资源储量、主要矿产品产量、销售收入、资产规模、利润等综合指标排名进一步提升，铜、金矿产品产量进入全球前3位，全面建成高度适配且具有紫金特色的全球化运营管理体系和ESG可持续发展体系；力争到2035年，公司主要指标较2025年实现跨越式增长，部分指标达到全球首位，全面建成“绿色高技术超一流国际矿业集团”。2028年矿产品产量目标：矿产金130-140吨、矿产铜150-160万吨、矿产银600-700吨、矿产铅锌40-45万吨、碳酸锂当量27-32万吨、矿产钼2.5-3.5万吨，2026-2028年CAGR分别为13%-16%/11%-14%/11%-17%/0%-4% /121-134%/31%-47%。维持“买入”评级我们维持盈利预测，测算2025-2027年归母净利为515/808/995亿元。同时，我们维持公司目标估值26年PE 18/23X，对应A/H目标价62.40元/66.03港元。风险提示：铜、金价不及预期；公司扩产项目进展不及预期；成本超预期上升。,,华泰证券,买入,[None],2026-03-06,,买入,8485485,pdf_downloads/2026/2026-03-06/601899-紫金矿业（601899）：2026年春季投资峰会速递：看好紫金矿业的估值提升.pdf,601899,紫金矿业,紫金矿业（601899）：2026年春季投资峰会速递：看好紫金矿业的估值提升
"沈皓俊,何玉静",核心逻辑：紫金矿业是全球黄金+铜资源龙头企业。降息周期+地缘政治风险加剧之下，金铜价格处于主升浪，受益于巨龙铜矿、哈萨克金矿、Allied Gold Corporation等持续投产增量，公司有望实现量价齐升，叠加锂价筑底反弹第三成长曲线有望持续贡献增量，推动业绩显著增长，当前估值水平处于行业低位，未来有望实现估值重塑。黄金板块：收并购实现矿山金业务迅速扩张，金价处于主升浪收并购形成显著量增：2024年：矿产金（金锭）业务毛利率46%（同比+12pct）。产量：2024产金73吨（同比+8%），位居全球前六。价格：2024沪金均价558元/克（同比+24%）。成本：2024矿产金（金锭）单位销售成本约284元/克（同比持平）。 2025H1：矿产金销售收入占比约为49.1%（抵消后），毛利占比38.6%。产量：2025H1产金41吨（同比+16%），权益产金35吨。价格：2025H1沪金均价722元/克（同比增长38.6%）。成本：2025H1矿产金（金锭）单位销售成本约为326元/克（同比增长15%）。2026年：公司预计实现黄金产量约105吨。公司收并购的金矿项目逐步推进，2025年公司实现加纳紫金金矿、哈萨克斯坦Raygorodok金矿（在产6吨，远期约9吨）股权收购，有望在2026年实现放量。2026年1月公司拟收购Allied Gold Corporation 100%股权，2023-2024年在产金矿均超10吨，预计2025年产金11.7~12.4吨，预计2029年产金25吨。金价在主升浪：① 本轮黄金大牛市的核心叙事是美元信用崩塌。在“CPI低+经济发展好”与美元信用危机解决两个条件都满足时黄金价格或出现下跌，其余宏观情境利好黄金。实际利率的下降是本轮黄金中期的重要支撑。② 实际利率往往与黄金价格呈现反向关系，本轮美国通胀黏性，而美联储降息让名义利率下行，实际利率的下行有望为本轮黄金牛市保驾护航。③ 本轮行情处于美债信用不断下行的过程中，黄金作为避险资产，在突发事件频出的情况下具有显著上行的机会。同时，相较于同类具有黄金/铜业务的公司来说，公司目前低于行业平均估值水平，未来存在显著的估值重塑机会。铜板块：巨龙铜矿投产，在手矿山增产空间充足， 铜价处于主升浪在手矿山提产空间充足：2024年：矿产铜（铜精矿）毛利率66%（同比+7pct）。产量：2024产铜107万吨（同比+6%），位居全球前四。价格：2024沪铜均价7.5万元/吨（同比+10%）。成本：2024矿产铜单位销售成本约1.9万元/吨（同比-4%）。2025H1：矿产铜营业收入占比27.8%（抵消后），毛利占比38.5%。产量：2025H1产铜57万吨（同比+9%），权益产铜47万吨。价格：2025H1沪铜均价7.8万元/吨（同比+4%）。成本：2025H1矿产铜（铜精矿）单位销售成本约为2.1万元/吨（同比+14%）。2026年：公司预计矿产铜产量120万吨，权益矿产铜96万吨。2025年公司实现藏格矿业股权收购，根据公司公告，巨龙铜矿二期改扩建工程计划2025年底建成投产，达产后年矿产铜将达30-35万吨，预计投产当年总产量增长约13万吨（按照30万吨保守估算，同比+12%），权益产量增长约7.6万吨（同比+9%）。未来增量：公司2028年规划实现矿产铜150-160万吨。①艾芬豪矿业卡库拉矿山停产如恢复，年产量按照50-54万吨估算，将释放5万吨权益产能；②巨龙铜矿三期工程规划年矿产铜60万吨；③丘卡卢-佩吉铜金矿下部矿带及博尔铜矿正推进年总产铜45万吨改扩建工程，将增加16万吨产能；④朱诺铜矿2025年全面开工建设，计划2026年底建成投产，规划达产后年矿产铜7.6万吨。铜价在主升浪：宏观维度——美联储降息带来的美元走弱降低了以美元计价的铜采购成本，刺激全球买盘入场。同时流动性宽松带动铜矿股重估。降息周期开启全球性资本开支增大亦会刺激基本金属铜价上涨。战略维度——全球地缘政治危机加剧，美欧内部强烈的贫富差距和就业问题正逐步“以邻为壑”，转移矛盾，外溢为地缘政治的摩擦冲突以及资源的强势掠夺，如美国&amp;委内瑞拉危机。资源本身具有价值，在全球格局重塑阶段，欧美重新洗牌之时，无论是军备需求还是货币需求还是科技发展需求，都在资源端体现出了强烈的掠夺性和保护性，资源开启重新定价。供需维度——在国家安全加重、资本开支不足、资源品位下滑以及开采难度增大等长期因素影响下，铜作为核心资源品供给受阻、成本上行已成必然。铜矿供给端频繁减产带动供给端预期持续下滑：① 自由港麦克莫兰公司（Freeport-McMoRan）旗下印度尼西亚格拉斯伯格块状崩落地下矿（Grasberg Block Cave）因湿料涌入堵塞通道，公司表明2025Q4，预计铜销售量减少4.45亿磅（约20万吨），黄金销售量减少34.5万盎司（约10吨）；2026阶段性重启产能，预计减少影响约27万吨铜，16吨黄金，供需平衡表影响达1.2%，强烈冲击供给； ② Teck资源因尾矿坝坝顶加高工程延误问题，下调QB矿山产量，2025年产量预期从最初的21万-23万吨大幅下调至17万-19万吨；2026年产量预期从28万-31万吨下调至20万-23.5万吨，供需平衡表影响约0.3%，进一步加剧全球矿端供应担忧。锂板块：“两湖两矿”成长放量，锂价筑底反弹“两湖两矿”成长放量：2025年：碳酸锂当量（含藏格矿业5-12月产量）约2.5万吨，相较于2024年261吨出现大幅增长，四大核心项目中，西藏拉果措锂盐湖、阿根廷3Q锂盐湖和湖南湘源锂矿已于2025年陆续投产，刚果（金）马诺诺锂矿东北部项目预计2026年投产。2026年：公司计划实现碳酸锂当量12万吨，核心在于：①阿根廷 3Q 盐湖锂矿一期 2 万吨 / 年碳酸锂 项目2025 年第三季度投产，二期 4 万吨 / 年碳酸锂项目建设有序推进。②西藏拉果错盐湖锂矿一期 2 万吨 / 年电池级碳酸锂项目计划 2025 年第一季度末正式投产； 一、二期全部建成投产达产后将形成 6 万吨 / 年当量碳酸锂产能。③湖南湘源硬岩锂矿 500 万吨 / 年采选项目及 配套电池级碳酸锂冶炼厂2025 年三季度同步建成投产，达产后形成 3 万吨 / 年电池级碳酸锂产能。④ 刚果（金）马诺诺锂矿东北部预计2026年投产。锂价筑底反弹2026年是行业供需反转&quot;分水岭&quot;的一年。新能源汽车虽然在政策补贴退坡的背景下，增长可能有限，但电动重卡，轮船等新应用场景，以及技术进步单车带电量提升，我们认为动力电池出货仍有望增长。储能端一方面国内在容量电价政策刺激下有望持续带动投资，海外在AI&quot;电力荒&quot;的背景下，储能电站的投资有望超预期，从而带动储能电芯的采购。我们认为2026之后行业进入供需偏紧状态，锂价易涨难跌，当前锂价已突破15万元/吨。 ❑ 催化剂及跟踪指标：全球降息节奏、全球性地缘政治危机、核心矿山如巨龙铜矿增产放量、金矿并购放量等。可跟踪金价/铜价变化以及投产进度。与市场的观点的差异：市场普遍担忧金铜价格波动对于公司业绩的影响。我们认为仅从价格周期维度去理解公司相对片面，紫金在长期运营管理中已经拥有显著的“呆矿变灵矿”的系统化技术能力，构成公司长期发展的护城河，具有长期重估价值。全球铜矿品位下滑，开采难度超预期增大，减产事故频发，但公司可以通过技术输出和管理优化实现扭亏为盈，快速扩大规模，实现资产增值。一方面，紫金矿业是全球黄金+铜资源龙头企业，善于在行业低谷期低成本收购优质资产，如卡莫阿铜矿、塞尔维亚博尔铜矿等；另一方面，公司自主研发低品位矿石利用、智能化开采等技术，拥有地勘、采矿、选矿全流程自主技术体系，能够有效推动资源回收率提升和成本下降。在资源的重新定价+公司的成长能力双重保证之下，未来潜力巨大。盈利预测与估值假设2026-2027年金价中枢为1100/1300元/克，铜价100000/110000元/吨，我们预计2025~2027年公司营业收入分别为3436/4184/4715亿元，同比增速分别为+13.17%/+21.75%/+12.70 %，归母净利润分别为515/926/1217亿元，同比增速分别为+60.64%/+79.88 %/+31.44 %，对应公司PE分别为22、12、9倍，给予公司2026年18X估值，公司2026年合理市值约为16670亿元，空间+48%，维持“买入”评级。风险提示产销表现不及预期，成本抬升超预期，金属价格上涨不及预期等。,,浙商证券,买入,[None],2026-01-29,,买入,8373076,pdf_downloads/2026/2026-01-29/601899-紫金矿业（601899）：更新报告：金铜主升，估值重塑.pdf,601899,紫金矿业,紫金矿业（601899）：更新报告：金铜主升，估值重塑
"华立,孙雪琪","核心观点事件：1月26日，公司旗下控股上市公司紫金黄金国际拟以55亿加元（约合人民币280亿元）的交易总额，收购加拿大联合黄金（Allied GoldCorporation）全部已发行的普通股，其核心资产为三座非洲大型金矿。联合黄金项目资源储量大、成矿条件好，找矿增储潜力显著。联合黄金核心资产包括在产的马里Sadiola金矿、科特迪瓦金矿综合体（含Bonikro和Agbaou金矿）；以及将于2026年下半年建成投产的埃塞俄比亚Kurmuk金矿。截至2024年底，联合黄金拥有金资源量553吨，平均品位1.48克/吨，金储量337吨，平均品位1.42克/吨。三座项目资源储量大、成矿条件好，基础设施完善，在当前金价已大幅上涨的背景下，通过进一步找矿勘探、经济技术重新评价以及技术升级改造等措施，项目资源储量有进一步提升空间。项目均为在产或即将投产的大型金矿，产量有待释放。2023、2024年联合黄金分别产金10.7吨、11.1吨，预计2025年产金11.7~12.4吨；依托Sadiola项目改扩建及Kurmuk项目建成投产，预计2029年产金将提升至25吨。具体看：（1）马里Sadiola金矿一期选厂技改已基本完成，采选规模由500万吨/年提升至570万吨/年，黄金年产量有望提升至6.2~7.2吨。二期投产后，项目预计前四年平均年产金12.4吨，矿山生命周期内年均产金9.3吨，全维持成本预计将由25Q3的2,067美元/盎司下降至1,200美元/盎司。（2）科特迪瓦金矿综合体（包括Bonikro和Agbaou项目）两座金矿采选规模均约为250万吨/年，拟进一步整合运营，力争实现Bonikro金矿年均产金3.1吨、Agbaou金矿年均产金2.7吨的产量目标。（3）埃塞俄比亚Kurmuk金矿是重要增量项目，计划于2026年下半年投产，设计采选规模为640万吨/年，预计前四年平均年产金9吨，矿山生命周期内年均产金7.5吨，全维持成本预计将低于950美元/盎司。项目收购对价合理，生产运营水平进一步提升空间。联合黄金2024年营收7.3亿美元，净利润-1.2亿美元，25Q1-3营收9.04亿美元，净利润0.17亿美元。本次收购对应单吨黄金资源量对价0.51亿元，单吨黄金储量对价0.83亿元，收购资产黄金储量平均品位1.42克/吨，平均品位高于此前收购的RG金矿，及其主力金矿罗斯贝尔金矿、诺顿金田。成本端，25Q3马里Sadiola、科特迪瓦Bonikro、科特迪瓦Agbaou全维持成本2,067、1,647、2,403美元/盎司，其中马里Sadiola二期投产后全维持成本预计将下降至1200美元/盎司，依托公司强大的全流程自主技术与工程研发创新能力，矿山成本还有进一步下降空间。投资建议：2026年矿产金产量指引同比+15吨至105吨。联合黄金旗下项目均为在产或即将投产的大型露天开采金矿，本次收购将推动公司矿产金产量大幅增长，助力实现2026年105吨产量目标；同时快速补强公司非洲黄金板块布局，有效强化公司在非洲的资源联动体系。预计公司2025-2027年归母净利518、895、940亿元，对应PE为20、12、11x，维持“推荐”评级。",,银河证券,推荐,[None],2026-01-27,,买入,8366180,pdf_downloads/2026/2026-01-27/601899-紫金矿业（601899）：收购AlliedGold，强化黄金板块综合实力.pdf,601899,紫金矿业,紫金矿业（601899）：收购AlliedGold，强化黄金板块综合实力
"李斌,黄自迪",2026年1月22日│中国内地/中国香港 有色金属 我们看好紫金矿业的价值提升，三个逻辑：1）看好铜、金价上行周期。2）公司是铜金、乃至有色龙头，经营稳健、成长性较强，我们预期26-27年归母净利增速较高（+57%/+23%）。3）公司整体估值与铜股相近，黄金价值有望重估。我们维持“买入”评级。稳健有色龙头，成长性较强公司发布25年业绩预告，我们测算25Q4紫金归母净利131-141亿元（Q3 146亿元）、扣非归母净利134-144亿元（Q3 125亿元），扣非归母净利的增长与Q4金属价格上涨事实相符，Q4LME铜均价上涨13%至11047美元、SHFE金均价上涨20%至949元/克。产量方面，公司25年全年实现矿产铜产量109万吨，低于年初指引115万吨或与KK铜矿欠产等有关；矿产金产量90吨，高于年初指引85吨；碳酸锂产量2.5万吨，低于年初指引4万吨，主因市场价格不佳导致投产节奏放缓。我们测算Q4矿产铜、金产量分别为26万吨、25吨，基本环比持平。公司亦发布26年产量指引，计划生产矿产铜120万吨、矿产金105吨、碳酸锂当量12万吨；且24年公司发布五年产量规划，24-28年矿产铜/金产量CAGR均为8-10%。我们看好铜、金价上行周期黄金方面（参考华泰金属《供需改善或成金属行业26年主基调》（25-12-1）），我们认为26年有望涨至$4800/oz。22年之后，全球金融和贸易体系日趋割裂；外汇储备“多元化”需求成为黄金价格上行的长期基石。如果黄金在央行中的储备占比回到34%的历史中位数水平，全球央行增持黄金可能持续到35年。26年美国实际利率或是下行趋势，叠加美元震荡走弱，利于金价进一步上行。铜方面（参考华泰金属《复苏与供给约束共振，有色景气无忧》（26-1-18）），我们预期25-28年铜价有望冲击$15000/t以上。展望26年，我们预期全球电解铜供给仍有限，同比增速2.4%；全球电解铜需求由美国囤库及电网建设驱动，同比增速3.3%；因此供需或从过剩转为短缺，叠加海外通胀、流动性边际宽松等因素，铜价中枢或同比显著抬升。中长期来看，全球技术进步叠加海外制造业复苏，多周期共振下电解铜需求或保持高增；而供给约束性较强（铜矿扰动频繁、资源稀缺、对价格反应滞后）。公司估值与铜股相近，黄金价值有望重估2026年我们测算公司毛利分布：铜及其他（含白银、锂、铅锌、铁矿石等）53%、黄金47%，我们认为可以将公司视为“半金半铜”的公司。而2025年可比A股铜股平均PE（Wind一致预期）为22X（洛阳钼业26X/西部矿业19X/金诚信21X/铜陵有色22X）、可比A股黄金股平均PE（Wind一致预期）为29X（山东黄金36X/山金国际28X/赤峰黄金18X），而紫金矿业A股的估值仅21X，与铜股相近。我们认为公司黄金估值有望重估。维持“买入”评级全球流动性宽松环境下，25年至今铜、金价涨幅超我们先前的预期，因此我们上调25-27年铜、金价假设；考虑KK铜矿影响低于我们先前的预期，我们上调25-27年铜产量；考虑金矿扩产情况超我们先前的预期，上调25-27年矿产金产量，最终上调25-27年归母净利至515/808/995亿元（变化幅度+14%/+57%/+71%）。分部估值：铜及其他/金毛利占比52/48%，可比公司Wind一致预期PE均值18/23X（26E）；A/H股近1个月平均溢价率5%，我们给予公司目标估值26年PE 18/23X，对应A/H目标价62.40元/66.03港元（A/H目标价前值28.80元/32.16港元基于25年PE估值15/19X）。风险提示：铜、金价不及预期；公司扩产项目进展不及预期；成本超预期上升。,,华泰证券,买入,[None],2026-01-22,,买入,8352708,pdf_downloads/2026/2026-01-22/601899-紫金矿业（601899）：有色龙头有望充分受益于铜金价上涨.pdf,601899,紫金矿业,紫金矿业（601899）：有色龙头有望充分受益于铜金价上涨
"梁必果,刘强",事件：2025年12月31日，公司发布2025年业绩预告，报告期内公司实现归母净利润510-520亿元，同比+59%~+62%；扣非净利润475-485亿元，同比+50%~+53%。其中第四季度实现归母净利润131-141亿元，同比+71%~+84%，环比-10%~-3%；扣非净利润134-144亿元，同比+68%~+81%，环比+7%~+15%。矿产金实现超产。2025年公司矿产铜/矿产金/矿产银/碳酸锂产量分别为109万吨、90吨、437吨、2.5万吨，同比分别为+2%/+23%/+0%/+9479%，分别完成全年目标的95%/106%/97%/63%。其中第四季度矿产铜/矿产金/矿产银产量分别为26万吨、25吨、102吨，同比分别为-7%/+34%/-3%，环比分别为-1%/+6%/-9%。公司矿产金实现超产，主要系阿基姆金矿并表、山西紫金、塞尔维亚紫金铜业、波格拉金矿等产量增加所致。矿产金目标超预期。公司2026年矿产铜/矿产金/矿产银/碳酸锂产量目标分别为120万吨、105吨、520吨、12万吨，同比分别+10%/ +17%/+19%/+380%，维持高增长态势。其中矿产金目标提升超预期，根据投产进度，2026年矿产金增量预计来源于阿基姆金矿、Raygorodok金矿、武里蒂卡、罗斯贝尔等项目。矿产铜方面，我们预计卡莫阿铜矿将于2026年逐步恢复至满产状态，主要增量来自于巨龙铜矿。金属价格持续上涨，继续看好长期价格走势。根据生意社等数据，2025年黄金、白银、铜均价分别为798元/克、9.74元/克、8.11万元/吨，同比+43%/+35%/+8%。在美元信用趋弱环境之下，叠加地缘以及金属本身供需趋紧，金属价格持续上涨，当前沪金价格已超1000元/克、沪银价格超20元/克、沪铜价格超10万元/吨，量价齐升将推动公司业绩持续向好。投资建议：我们上调公司2025-2027年盈利预测，预计2025-2027年公司归母净利润分别为515/681/845亿元（前值390/430/467亿元）。我们认为公司作为全球矿业龙头企业，全球化能力突出、成长确定性强、成本控制能力优异，公司金、银、铜、锂产量持续提升，公司有望充分受益于行业高景气度，维持“买入”评级。风险提示：需求不及预期；供给超预期释放；美联储紧缩超预期,,太平洋证券,买入,[None],2026-01-15,,买入,8338942,pdf_downloads/2026/2026-01-15/601899-紫金矿业（601899）：矿产金目标超预期，业绩持续高增.pdf,601899,紫金矿业,紫金矿业（601899）：矿产金目标超预期，业绩持续高增
