author,content,filename,org_name,original_rating,pdf_link,publish_time,rating_adjust_mark_type,rating_changes,report_id,save_path,stock_code,stock_name,title
"戴志锋,邓美君,贾靖",投资要点快报综述：1、2022全年成都银行营收同比增长13.1%，全年增速较1-3Q累积16.1%略放缓3个点，其中资产增速边际放缓2个点，预计主要为今年进行项目储备、投放边际略放缓；资产质量保持优异，拨备释放利润，归母净利润保持高位、增28.2%。1Q22-2022营收、营业利润、归母净利润分别同比增长17.6%/17.0%/16.1%/13.1%；32.1%/36.3%/35.9%/32.9%；28.8%/31.5%/31.6%/28.2%。2、全年总资产增速接近20%。成都银行22年末全行总资产为9177.05亿元，同比增长19.4%，单季增长101.62亿元，离公司设定的2024年末全行总资产规模迈上万亿元大关的目标更近了一步。预计贷款增速也不弱。3、不良率继续保持低位稳定，拨备基础维持高位。1、不良维度——不良率环比下降3bp至0.78%的低位，处在公司历史最优水平。2、拨备维度——风险抵补能力高位小幅上行。四季度拨备覆盖率上升3.4个百分点至501.6%，亦处在公司历史最优水平，拨贷比环比小幅下降12bp至3.91%。投资建议：公司2022E、2023E PB 0.89X/0.75X；PE 4.77X/3.76X（城商行 PB 0.66X/0.59X；PE 5.47X/4.81X），公司经营稳中向好，营收、净利润维持高增速，资产质量优异且持续优化。公司主营区域优势显著，扎根成都，深耕川渝，多重战略加持带来可持续增量市场。公司业务基础扎实，零售公司双轮驱动，基建优势明显，财富管理发力，业务结构持续优化。维持 “增持”评级，建议积极关注。注：根据22年业绩快报，我们微调盈利预测，预计2022-2023年归母净利润为100.42亿和127.12亿（前值为102.64亿和124.65亿）风险提示：宏观经济面临下行压力，业绩经营不及预期。,,中泰证券,增持,[None],2023-02-18,,增持,5118447,pdf_downloads/2023/2023-02-18/601838-成都银行（601838）2022业绩快报：利润高增28.2%，资产质量持续向好.pdf,601838,成都银行,成都银行（601838）2022业绩快报：利润高增28.2%，资产质量持续向好
林媛媛,成都银行业绩持续高增长，2022年归母净利润增速达到28.2%，在已披露业绩快报银行中仅低于江苏、张家港、苏农银行，收入同比增长13.1%，仅低于常熟。高增长带动盈利能力增强，ROAE 19.48%，同比上升1.88个百分点。不良率下降，拨备平稳，资产质量、拨备优势持续。公司或持续受益于成渝双城经济圈基建拉动和区域经济优势，规模扩张支持业绩高增长。公司资本补充动力较强，目前股价13.25元，低于转债强赎价格26.7%，关注转债转股情况。维持对公司增持评级，持续看好。支撑评级的要点盈利持续高增长成都银行全年实现归母净利润100.39亿元，同比增长28.2%，较前三季度增速略降3.4个百分点；四季度单季同比增长21.8%，较三季度增速下降10个百分点。全年营业收入同比增长13.1%，较前三季度增速下降3.0个百分点；四季度单季同比上升5.0%，较三季度增速下降9.3个百分点，公司四季度单季营收增速在所有已披露业绩的上市银行中居前，公司交易类投资占比较低，受债市调整影响有限。全年盈利与收入增速较前三季度均放缓，且下行幅度相近，拨备、税收等贡献或平稳。资产质量和拨备优势持续2022年末不良贷款率0.78%，较三季度末下降0.03个百分点，资产质量优势持续。四季度末拨备覆盖率501.57%，较三季度末略升3.39个百分点；测算拨贷比3.91%，较三季度下降0.12个百分点，拨备基本平稳，优势持续。估值根据公司业绩快报中披露的业绩增速及资产质量情况，我们调整公司盈利预测，2023/2024年EPS调整为3.26/3.91元，目前股价对应2023/2024年PB为0.74x/0.61x，维持增持评级。评级面临的主要风险经济下行、疫情反复导致资产质量恶化超预期。,,中银国际,增持,[None],2023-02-18,,增持,5118437,pdf_downloads/2023/2023-02-18/601838-成都银行（601838）：盈利持续高增长，资产质量、拨备优势持续.pdf,601838,成都银行,成都银行（601838）：盈利持续高增长，资产质量、拨备优势持续
"唐子佩,武凯祥","核心观点成渝战略升级，享政策发展红利。成都银行经营布局集中在成都，截至22Q2，公司72.7%的贷款来自成都地区。作为四川省会，成都优质的区域经济和当地旺盛的需求为公司发展提供了良好的展业环境和成长空间。20年以来，成渝战略加速升级，基建项目不断加码，融资需求持续释放。公司作为本土机构，或将充分参与到成渝经济圈建设中，有望抓住区域经济红利，未来资产扩张有抓手、高成长性可持续。立足政金资源禀赋，基建助力对公强劲发展。依托国资控股背景，公司在近几年发展过程中持续巩固自身在银政业务的优势，业务呈现出对公主导的特征，截至22Q3，对公贷款占比达到77.5%。拆分来看，涉政客户主导的基建类贷款过去几年保持强劲增长，截至22H1，公司基建类贷款规模达到2063亿，同比增长37.2%。展望而言，成渝战略下项目投资加快推进，预计公司基建类业务有望延续高增长。零售转型初具成效，发展潜力值得期待。2018年，公司提出“大零售”战略，工作重点集中在稳存增存、发展财富管理、拓展消费类贷款等方面，近几年零售业务实现稳步发展。一方面，依托政务存款账户，储蓄存款稳定增长；另一方面，按揭投放受阻，但消费类贷款低基数下投放明显加快；此外，理财、基金代销业务收获积极布局。展望而言，立足区域和客户基础优势，公司在零售板块的发力值得关注。资产质量稳健，拨备计提充分。2015年以来公司持续加大风险处置，资产质量改善趋势明显，目前存量资产质量指标已处于同业领先。截至22H1，公司不良+关注类贷款占比仅为1.33%，上市城商行中仅高于宁波和杭州。拨备方面，公司在快速发展的同时，始终保持审慎的计提力度，拨备覆盖率持续提升，截至22Q3，公司拨备覆盖率为498%，充裕的拨备水平下，未来利润增长的稳健性有足够的保障。我们预计公司22-24年EPS为2.83/3.45/4.17元，对应归母净利润增速分别为30.5%/22.0%/20.7%，预计22-24年BVPS分别为14.92/17.56/20.73元。公司根植成都，兼具高成长性与稳健性，长期以来相较同业平均享受着较高的估值溢价，我们采用历史估值法,以公司上市以来的平均值为目标PB倍数，给予23年1.08倍PB预期，对应目标价18.97元，首次覆盖给予买入评级。风险提示区域发展不及预期；疫情反复；贷款增速不及预期；假设条件变化影响测算结果。",,东方证券,买入,[None],2022-12-08,,买入,5069754,pdf_downloads/2022/2022-12-08/601838-成都银行（601838）首次覆盖报告：依托川渝区位优势，打造高成长标杆.pdf,601838,成都银行,成都银行（601838）首次覆盖报告：依托川渝区位优势，打造高成长标杆
"崔晓雁,王德坤",成都银行(601838)事件描述1-3Q22营收152.46亿元、同比+16.1%，PPOP115.70亿元、同比+13.0%，归母净利润67.52亿元、同比+31.6%，加权平均ROE13.88%、同比+1.63pct。利息净收入、手续费及佣金净收入、投资收益收入占比分别80.0%、3.7%、11.8%，同比+16.6%、+44.8%、-8.2%。Q322营收52.52亿元、同比+14.3%、环比+1.8%，归母净利润22.94亿元、同比+31.8%、环比-0.5%。事件点评信贷增长速度快，息差小幅下降。Q322末贷款余额3634亿元、同比+31.6%，其中对公贷款3634亿元、同比+35.6%，零售贷款1054亿元、同比+18.1%。公司对公贷款超过60%投放于租赁和商务服务业、水利环境公共设施、水电热力燃气等大基建行业，总贷款超70%投放于成都地区。在成渝经济圈规划下，成都地区固定资产投资较快增长，基建融资需求较旺盛，推动公司信贷增速高增。1-3Q22净息差1.96%、同比-6BP。公司依托股东及多年来积累的政务资源优势，负债成本率在同业中居较低水平（H122仅2.26%），得益于此，公司净息差降幅小于同业平均水平。资产质量持续改善，风险抵补能力强。Q322末不良贷款率0.81%、较年初-17BP、环比-2BP。拨备覆盖率498.18%、较年初+95.3pct。公司对公贷款以大基建为主，零售贷款以按揭为主，二者不良率均较低。网点下沉进社区，有效触达零售客户，布局财富管理。1-3Q22手续费及佣金净收入增速远超营收，根据公司中报数据，增量主要来自理财及资管收入（H122占比近60%、同比+21.7%）及清算结算业务（H122占比11.2%、同比+475%）。投资建议预计公司2022-24E归母净利润100.72、118.89、138.20亿元、同比+28.62%、+18.04%、+16.24%，ROE在16%左右。公司当前股价对应2022EPE4.98x，PB0.75x，估值亦处于合理区间下限。考虑到公司对公贷款增速快且不良率低、负债成本率较低、受益于成渝经济圈发展及资产质量优，给予公司“买入-A”评级。风险提示信贷增速不及预期，盈利能力下降，负债结构变化致成本率提升等。,,山西证券,买入-A,[None],2022-10-31,,买入,5032822,pdf_downloads/2022/2022-10-31/601838-成都银行（601838）：信贷增速较快，负债成本低，资产质量持续改善.pdf,601838,成都银行,成都银行（601838）：信贷增速较快，负债成本低，资产质量持续改善
"余金鑫,于博文",事件：10月28日，成都银行发布22Q3业绩快报。22Q1-22Q3营收152.5亿元，YoY+16.1%；归母净利润67.5亿元，YoY+31.6%；不良率0.81%，拨备覆盖率498%。中收高增，利润增速高位再向上。截至22Q3，营收累计同比增速（下同）较22H1-0.9pct，主要受净利息收入增速回落的影响，但仍保持在16.1%的较好水平。净手续费收入增长突出，同比增速44.8%，较22H1+8.9pct，或主要受益于理财收入增加；其他非息收入增速由负转正，主要是投资收益发挥拉动作用。归母净利润持续高增，同比增速较22H1再提升0.1pct，或主要来自资产质量持续改善下的信用风险下降。贷款增速延续30%以上，支撑高扩张。截至22Q3，贷款总额同比增速31.3%，或在上市银行中拔得头筹，充分反映了区域发展红利和强劲融资需求。强劲信贷投放支撑总资产增速自年初以来逐季提升。资产质量延续向好，拨备覆盖率大幅提升。截至22Q3，不良率环比-2BP，关注率环比-8BP，资产质量进一步优化，助推拨备覆盖率环比+23.7pct，拨贷比环比+10BP，近500%的拨备水平对于业绩持续增长形成呵护。可转债已进入转股期，资本充足率有所回升。2022年9月上旬，成都银行可转债进入转股期，截至22Q3，转股比例达12.54%，助推核心一级资本充足率环比+26BP，一定程度缓解资本紧缺压力。此外，70亿元二级资本债发行也已提上日程，支撑成都银行持续高扩张。投资建议：信贷投放强劲，资产质量优异营收增长稳健，其中中收表现亮眼，归母净利润增速延续提升；信贷投放保持强劲，反应区域旺盛融资需求；资产质量持续改善，拨备覆盖率大幅提高；受益于可转债转股，资本充足率环比回升，支撑高扩张延续。预计22-24年EPS分别为2.58元、3.32元和4.27元，2022年10月28日收盘价对应1.0倍22年PB，维持“推荐”评级。风险提示：宏观经济增速下行；疫情风险频发；信用风险暴露。,,民生证券,推荐,[None],2022-10-31,,增持,5032812,pdf_downloads/2022/2022-10-31/601838-成都银行（601838）2022年三季度点评：利润增速向上，资本充足率回升.pdf,601838,成都银行,成都银行（601838）2022年三季度点评：利润增速向上，资本充足率回升
赵伟,成都银行(601838)业绩简评2022年前三季度，成都银行营收和归母净利润分别为152.46亿元和67.52亿元，同比分别增长16.07%和31.59%。年化ROE13.88%，同比提升1.63个百分点。Q3单季，营收和归母净利润分别为52.42亿和22.94亿，同比分别为14.3%和31.8%。经营分析存款和贷款均保持高速增长。报告期末，公司贷款总额/对公贷款/零售贷款分别为4701.4亿/3633.9亿/1054.2亿，较去年末分别增长20.66%/27.60%/7.34%。公司存款总额/对公活期/对公定期/零售活期/零售定期分别为6415.5亿/2138.2亿/1372.3亿/488.93亿/2150亿，17.90%/12.13%/10.85%/5.71%/31.3%，资本充足率下降，但二级资本债已经发行。报告期末，资本充足率/一级资本充足率/核心一级资本充足率分别为12.15%/9.37%/8.4%，分别较去年末下降0.75%/0.47%/0.30%。9月17日，公司获获准发行不超过70亿的二级资本债，将计入二级资本。目前公司RWA余额为6222亿元，静态看70亿元二级资本债，将提高资本充足率1.13个百分点，为后续信贷派发夯实基础。资产质量持续优化。报告期末，成都银行不良率0.81%，同比下降0.98个百分点，环比下降0.02个百分点。拨备覆盖率498.18%，较上年末增长95.30%。正常类贷款占比98.77%，较上年末提高0.36个百分点。投资建议预计2022-2024年归母净利润分别为100.45/121.93/146.13亿元，同比增长28.3%/21.4%/19.9%，对应EPS分别为2.70/3.30/3.97元。维持“买入”评级。风险提示宏观经济超预期收缩，国内疫情反复，贷款质量超预期恶化。,,国金证券,买入,[None],2022-10-31,,买入,5032386,pdf_downloads/2022/2022-10-31/601838-成都银行（601838）：存贷高增长，资产质量优化.pdf,601838,成都银行,成都银行（601838）：存贷高增长，资产质量优化
"沈娟,安娜",业绩增速强劲，资产质量优异1-9月归母净利润、营收、PPOP同比+31.6%、+16.1%、+13.0%，较H1+0.1pct、-0.9pct、-2.3pct，业绩增速保持同业前列。1-9月年化ROE、ROA同比+2.17pct、+0.09pct至18.51%、1.07%，ROE位居上市城商行之首。资产增速提升，对公投放强劲；中收持续高增，资本实力提升；资产质量优异，信用成本下行。我们维持22-24年预测EPS为2.80/3.54/4.39元，22年BVPS预测值14.80元，对应PB0.96倍，可比公司22年Wind一致预测PB均值0.64倍，我们认为公司高成长性有望持续，基本面稳居同业第一梯队，估值也有望对标第一梯队，我们维持22年目标PB1.43倍，目标价维持21.16元，维持“买入”评级。资产增速提升，对公投放强劲9月末总资产、贷款、存款同比+21.6%、+31.3%、+15.6%，较6月末+0.1pct、-1.5pct、-6.3pct，资产、信贷保持高增。Q3新增贷款中对公贷款占比87.5%，对公贷款、零售贷款同比+35.6%、+18.1%，预计对公端由基建类贷款+实体类贷款双轮强劲驱动，在区域红利期+自身转型持续突破带动下，有望保持高成长性。存款增速放缓主要由于对公活期存款增速放缓，或由于对公客户活化资金不足等阶段性影响，而储蓄存款在零售转型带动下持续高增，9月末零售存款同比+33.1%，其中零售定期存款同比+39.7%，战略成效突出。我们测算1-9月息差较H1小幅回升，推测受益于资产端收益率企稳。中收持续高增，资本实力提升1-9月中间业务收入同比+44.8%，较H1+8.9pct，增速较为亮眼，推测主要受益于理财等业务收入延续快速增长态势，中收/营收较H1提升0.1pct至3.7%。1-9月其他非息收入同比+8.7%，较H1+1.8pct。9月末资本充足率、核心一级资本充足率分别为12.25%、8.4%，较6月末+0.16pct、+0.26pct；截至9月30日，成银转债仍有69.97亿元未转股，若后续转股成功，我们测算核心一级资本充足率可提升1.12pct至9.52%，有望强化资本实力。资产质量优异，信用成本下行9月末不良率、拨备覆盖率分别较6月末-2bp、+24pct至0.81%、498%，拨备覆盖率居上市城商行第4，资产质量保持优异，风险抵御能力持续巩固。9月末关注率较6月末-8bp至0.42%，达到2010年以来最低水平，潜在风险指标持续优化。我们测算Q3年化不良生成率仅为0.32%，维持较低水平，资产高成长的同时彰显优秀风控能力。Q3年化信用成本1.11%，同比-0.8pct、环比-0.1pct，在资产质量向好的背景下适当减轻拨备计提力度。风险提示：经济下行持续时间超预期，资产质量恶化超预期。,,华泰证券,买入,[None],2022-10-31,,买入,5032229,pdf_downloads/2022/2022-10-31/601838-成都银行（601838）：业绩增速强劲，资产质量优异.pdf,601838,成都银行,成都银行（601838）：业绩增速强劲，资产质量优异
林媛媛,成都银行前三季度业绩同比高增长31.6%，盈利能力带动ROE上升至18.51%，业绩贡献主要来自规模和拨备的贡献。营业收入同比增速16.1%，增速略缓仍高位，其中，规模持续高增长，息收入放缓，手续费收入增长高位提速，投资相关其他非息增长亦提速。公司资产质量持续改善，优势持续，增量拨备同比下降贡献盈利，信贷存量拨备高位提升。受益于成渝双城经济圈基建拉动和区域经济优势，成都银行规模积极扩张支持业绩高增长，且公司风险控制能力提升，资产质量优势强化，拨备高位平稳，风险抵御能力较强。实控人持有转债转股反映对公司增长的信心，亦反映公司高成长阶段资本需求较强，关注转债转股进程。目前公司2022和2023PB估值分别0.96X/0.79X，高成长稀缺标的，核心推荐组合，持续看好。维持增持评级。支撑评级的要点存盈利高增带动ROE上升，未来资本补充需求仍较强成都银行前三季度业绩同比增长31.6%，业绩持续高增带动ROE同比上行2.18个百分点至18.51%，ROA同比上行0.09个百分点至1.07%。3季度末核心一级资本充足率为8.40%，同比提升6bp。公司信贷规模高增长，带动风险加权资产同比增长19.0%。9 月 9 日起公司转债进入转股期，截止3季度末累计转股7215万股，占转股前总股本2.0%，10亿转债转股，补充核心一级资本约0.16个百分点，剔除转债转股的影响，核心一级资本充足率同比降约10bp，资本缓冲需求仍强烈，关注转债转股进程。非息收入增长高位提速，手续费和投资收入均表现积极前三季度非息收入30.53亿元，同比增长13.9%，较中期提速。其中，前三季度手续费增速为44.8%，带动手续费净收入占比同比上升0.73个百分点，3季度单季度手续费净收入同比增长65%，增速继续提升。前三季度其他非息同比增8.7%，其他非息收入占比16.3%，3季度单季度同比增长13%，同比亦提速。,,中银国际,增持,[None],2022-10-30,,增持,5031123,pdf_downloads/2022/2022-10-30/601838-成都银行（601838）：规模持续高增，资产质量优异.pdf,601838,成都银行,成都银行（601838）：规模持续高增，资产质量优异
"戴志锋,邓美君",财报综述：1、营收增长保持稳健，同比增速16.1%。净利息收入同比+16.6%，净非利息收入同比+14%。净利润同比高增31.6%，在高位延续上行趋势，为2012年底来最好增速。2、单季度净利息收入环比增5%，单季年化净息差环比基本持平。生息资产规模环比增1.7%，主要是贷款、债券投资贡献；同业资产规模有所下降。单季年化净息差环比基本持平，小幅下行1bp至1.98%，资产端负向贡献，资产收益率环比下行6bp至4.09%，预计定价是主要拖累因子。受LPR下调以及新发放贷款利率下行影响。资产结构总体维持稳定，信贷占比环比提升0.6%至51.3%。负债端正向贡献，付息率环比下降2bp至2.22%，预计主要是利率贡献，存款定价上限下调对成本压力的缓释。而结构维度看，存款定期化趋势延续。3、资产负债：对公信贷维持高增，存款定期化趋势延续。资产端：Q3新增贷款131亿、同比略少增5亿元，其中对公（含票据）、零售分别新增114亿和16亿，同比+11亿和-16亿。负债端：存款同比增15%（1H22同比+21.8%）。Q3新增存款-18亿，同比少增291亿，主要是对公存款余额有所下降。单季新增对公、个人存款-177亿和+130亿，同比变动-353亿、+40亿。4、资产质量：不良率低位持续改善，拨备达历史新高。不良维度：不良率在低位继续环比下降2bp至0.81%，为2014年来的低位。累积年化不良净生成率0.13%，环比上行12bp，仍然保持非常低的水平。关注类贷款占比，环比下降8bp至0.42%，处于历史较低水平，未来不良压力不大。拨备维度：拨备对不良的覆盖程度环比提升23.8%至498.21%，达到历史最高水平。拨贷比环比上升9bp至4.03%。投资建议：公司2022E、2023E PB 0.96X/0.81X；PE 5.07X/4.13X，公司经营稳中向好，营收、净利润维持高增速，资产质量优异且持续优化。公司主营区域优势显著，扎根成都，深耕川渝，多重战略加持带来可持续增量市场。公司业务基础扎实，零售公司双轮驱动，基建优势明显，财富管理发力，业务结构持续优化。维持增持评级，建议积极关注。风险提示：经济下滑超预期、公司经营不及预期。,,中泰证券,增持,[None],2022-10-30,,增持,5031047,pdf_downloads/2022/2022-10-30/601838-成都银行（601838）2022年3季报：业绩维持高增，净利润同比+31.6%，资产质量优异.pdf,601838,成都银行,成都银行（601838）2022年3季报：业绩维持高增，净利润同比+31.6%，资产质量优异
"胡翔,曹志楠",成都银行(601838)投资要点核心指标： 2022 年前三季度公司实现营业收入 152.46 亿元，同比增长16.07%；归母净利润 67.52 亿元，同比增长 31.59%， 符合预期。盈利增速延续高增， ROE 稳居第一。 2022 年前三季度营业收入 152.46亿元，同比增速 16.07%，较 H1 小幅下降 0.95bp，在上市银行中排名第8；归母净利润 67.52 亿元，同比增速 31.59%，较 H1 小幅上升 8bp，排名第 2； ROE 高达 12.3%， 继续稳居上市银行第 1 位。存贷增速小幅回落，主因高温天气、疫情反复等因素影响。 截至 Q3 成都银行总资产突破 9000 亿大关，同比增速达 21.6%。贷款总额 4701.4亿元，同比增速 31.3%，较 H1 小幅回落 1.3pct。其中，公司贷款同比增速 35.6%，个人贷款同比增速 18.1%，分别较 H1 小幅回落 2.8、 2.5 pct，但整体增速处于高位。存款总额 6414.5 亿元，同比增速 15.4%，较 H1回落 6.4pct，其中活期存款占比 41.7%，较 H1 下行 3.7pct。三季度成都经历了阶段性的高温、疫情等短期冲击，叠加季节性因素，虽然规模扩张指标小幅回落，但不改区域经济强劲发展背景下的增长势头。净息差收窄，幅度可控。 成都银行净息差 1.96%，较上半年延续下降11bp。一方面下半年经济二次探底，稳增长加码， 8 月迎来 MLF 和 LPR降息，尽管各大银行紧跟下调存款利率，但中小银行存款溢价能力不及大行，净息差下行难以避免。另一方面成都银行存款定期比重提升，一定程度上抬高负债端压力。总体来看，成都银行息差下行幅度可控。资产质量稳健，不良率延续下降。 截至 Q3，成都银行不良贷款余额 37.9亿元； 不良率 0.81%，较 H1 下降 2bp； 拨备覆盖率 498%，较 H1 上行24pct。下半年成都连续遭受高温天气和疫情反复的情况下，依然保持较好的资产质量。发力大零售战略， 中收增长强劲。 手续费及佣金净收入 5.61 亿元，同比大幅增长 44.8%，增速较 H1 提高 9pct，有望成为公司未来增长第二级。盈利预测与投资评级： 成都银行坐拥成渝经济圈，基本面向好，作为“基建银行”受益于四季度专项债提前发行，高成长延续； 同时发力大零售战略，增长空间大。我们维持公司盈利预测， 2022-2024 年归母净利润同比保持 23.3%/26.0%/18.0%增速，对应 BPS 为 14.62/17.01/19.83 元，截至 10 月 29 日对应 2022 年 PB 为 0.97 倍， 维持“买入”评级。风险提示： 经济下行，疫情反复，房地产硬着陆,,东吴证券,买入,[None],2022-10-29,,买入,5029721,pdf_downloads/2022/2022-10-29/601838-成都银行（601838）2022年三季报点评：延续高增态势，业绩韧性强.pdf,601838,成都银行,成都银行（601838）2022年三季报点评：延续高增态势，业绩韧性强
