author,content,filename,org_name,original_rating,pdf_link,publish_time,rating_adjust_mark_type,rating_changes,report_id,save_path,stock_code,stock_name,title
"曾朵红,谢哲栋",业绩符合预期、变压器起主要利润贡献。公司发布2023年半年报，H1实现收入28.9亿，同比+47%；归母净利润/扣非净利润1.91/1.87亿元，同比+100%/+108%。Q2收入16.0亿，同比+51%；归母净利润/扣非净利润1.0/1.1亿，同比+94%/+96%。上半年海外变压器需求&amp;国内新能源拉动干变高增，储能初步贡献收入，业绩符合市场预期。原材料降价+数字化工厂赋能+海外占比提升，盈利能力持续改善。2023H1毛利率为21.75%，同比+3.13pct，2023H1归母净利率为6.60%，同比+1.76pct。其中Q2毛利率为20.99%，同比+2.03pct，环比-1.70pct；归母净利率为6.51%，同比+1.43pct，环比-0.21pct。公司盈利能力提升，主要系：1）原材料硅钢价格H1持续下行；2）海口、桂林、武汉数字化工厂陆续落地，人均产出持续提升，降低单位制造成本与管理成本；3）高毛利的海外业务占比H1同比提升1.6pct至18.5%。干变业务国内基本盘受新能源拉动快速增长、海外订单今年起持续超预期。H1干变收入28.0亿元，同比+43%。1）分区域，国内/海外H1收入分别+44%/+61%；海外含税订单10.5亿，同比+157%，其中风电/光伏/工业收入同比+40%/+249%/+259%，且火电、电网、IDC等均完成从0到1的突破。我们预计公司海外订单H2有望维持高增，8月公司已与两大海外客户签订长单、后续长单仍可期待。2）分行业，H1光伏/储能收入分别同比+102%/+945%，非新能源领域工业企业起主要拉动作用，收入同比+55%。3）分产品，干变以外，新开发的植物脂油变已实现海外风电的批量销售，后续有望在其他新能源领域逐步渗透。储能&amp;数字化H1稳健发力、H2订单有望加速。1）储能H1收入0.73亿（去年同期30万，22H2开始起量）。公司已开拓至海南省外，并在山西、湖南、福建加速落地工商业及大储项目，产品端涵盖液冷高压级联、低压工商业储能。2）数字化上半年新增望变电气7000万订单（软件为主），当前接洽订单数量较多。盈利预测与投资评级：我们维持公司2023-2025年归母净利润分别为5.46/9.23/14.48亿元，同比+93%/+69%/+57%，对应PE分别26倍/16倍/10倍，维持“买入”评级。风险提示：海外市场拓展不及预期、竞争加剧、原材料涨价超预期等。,,东吴证券,买入,[None],2023-08-30,,买入,5305890,pdf_downloads/2023/2023-08-30/688676-金盘科技（688676）2023年半年报点评：干变基本盘高增，海外订单确定性强.pdf,688676,金盘科技,金盘科技（688676）2023年半年报点评：干变基本盘高增，海外订单确定性强
"贺朝晖,梁丰铄",事件：公司发布2023年半年报，23H1实现营收28.93亿元，同比+46.54%；实现归母净利润1.91亿元，同比+99.94%；扣非净利润1.87亿元，同比+107.81%。其中23Q2实现营收15.96亿元，同比+51.31%，环比+23.08%；实现归母净利润1.04亿元，同比+93.83%，环比+19.2%。在手订单大幅提升，数字化降本增效推动毛利率提升公司海外业务增长亮眼，23H1实现海外营收5.32亿元，同比+60.63%；外销订单10.48亿元，同比+157.49%。上半年公司整体订单量45.89亿元，同比+53.17%；其中，风电/光伏/工业企业电气配套领域订单分别同比+40.15%/+248.72%/+259.42%。随着数字化降本增效及海外收入占比提升，公司23H1综合毛利率同比+3.13pct至21.75%。随着数字化工厂生产效率进一步提升，海外市场持续开拓，公司业绩有望持续高速增长。签订海外变压器长协，出口逻辑进一步强化8月21日，公司与海外客户A签订2023-2028年总计人民币约10.8亿元-14.4亿元的长单；8月24日，公司与海外客户B签订了关于风能变压器产品长达6年的《供货协议》。欧美新能源配套+老旧变压器改造需求高景气，公司凭借长期耕耘的海外渠道和品牌优势、深厚的技术储备、短于海外厂商的交付周期、以及相较于国内厂商的先发优势，后续海外订单有望持续高增。储能收入快速放量，订单饱满积极扩产公司23H1储能系列产品实现收入0.73亿元，收入体量快速扩大。储能市场开拓顺利，累计在手订单7亿元以上，未来随着桂林和武汉储能工厂全部达产后，储能产品合计年产能可达3.9GWh。公司高压级联储能技术方案具备较高的技术壁垒，更高的充放电效率性能优势或可带来高于行业平均水平的盈利能力；公司海外渠道优势未来有望充分赋能储能产品后续的出海进程。盈利预测、估值与评级我们预计公司23-25年营收分别为74.32/108.15/149.24亿元，同比增速分别为56.62%/45.51%/37.99%，归母净利润分别为5.20/8.22/12.77亿元，同比增速分别为83.44%/58.22%/55.37%，EPS分别为1.22/1.93/2.99元/股，3年CAGR为65.21%；对应PE分别为28/18/11倍。参照可比公司估值，我们给予公司23年35倍PE，目标价42.7元，维持“买入”评级。风险提示：海外拓展不及预期；行业竞争加剧；产能释放不及预期。,,国联民生证券,买入,[None],2023-08-30,,买入,5305004,pdf_downloads/2023/2023-08-30/688676-金盘科技（688676）：23H1业绩大幅增长，出海逻辑进一步强化.pdf,688676,金盘科技,金盘科技（688676）：23H1业绩大幅增长，出海逻辑进一步强化
"王蔚祺,王晓声",评论：海外变压器长单持续落地，海上风电产品继续引领行业公司是干式变压器龙头企业，聚焦风电行业二十余载；2021年随着公司数字化改造的快速推进，变压器产能得到有效释放，公司在光伏、储能、数据中心、高端装备、节能环保、新型基础设施等领域快速开拓。凭借风电干式变压器优异的产品性能和较高的性价比，公司与维斯塔斯、西门子歌美飒、GE、东芝三菱等海外大型客户建立了长期稳定的合作关系，2021年以来公司复用原有客户渠道，在欧洲、美国等高端市场向其他下游行业快速布局。此前公司与海外客户签订合同已年度框架协议为主要模式，今年以来受海外新能源、电网改造需求快速释放和公司海外渠道深化布局影响，近期公司连续签订两项长期供货协议。其中，公司与海外客户B在2020-2022年签订订单金额超8亿元，年均合同金额超2.6亿元。根据GWEC数据，2020-2022年受疫情、原材料涨价、运费上涨都因素影响海外风电年度新增装机保持地位；根据GWEC预测，2022-2027年海外风电新增装机容量在陆风装机复苏和海风装机放量带动下有望保持较高景气度，新增装机CAGR高达15.4%。,,国信证券,买入,[None],2023-08-28,,买入,5301818,pdf_downloads/2023/2023-08-28/688676-金盘科技（688676）：两大海外长单落地，变压器出口确定性夯实.pdf,688676,金盘科技,金盘科技（688676）：两大海外长单落地，变压器出口确定性夯实
"曾朵红,谢哲栋",事件：与海外两大客户签订变压器中长期供货协议。1）8月24日发布公告，公司与海外客户B签订关于风能变压器的《供货协议》，有效期为6年，本协议未约定具体履约金额，但该客户在2020-2022年期间与公司签订订单金额累计超过8亿元。因全球风电装机持续增长，我们根据过去3年订单保守预估，客户B在未来6年订单额至少16亿元（8亿元×2）。2）8月21日公司发布公告，与海外客户A签署2023-2028年总计10.8-14.4亿元订单（以8月18日7.20美元兑人民币汇率计），年均约2.2-2.9亿元。金盘变压器出海逻辑持续演绎，海外供需的紧张以及海外客户对金盘的认可，已经初步用两大长单给出了证明：1）欧美变压器需求高景气：欧美需求来自三点，第一是转型新能源带动风光储配套变压器需求，中长期时间节点明确；第二是美国制造业回流（尤其是半导体、计算机等行业）、新增厂房拉动变压器需求；第三是电网老旧变压器改造需求。三大需求非偶发因素带来的，持续性强。2）供给持续紧缺，交期不断延长。欧美本土变压器企业自给率不高，以全球变压器巨头ABB、西门子、SGB等大厂为主，当前ABB、西门子等扩产意愿偏弱（业务利润率低、成长性不足、决策链长等），导致订单交期延长，变压器处于卖方市场——根据美国能源部（DOE）， 22年公用事业单位反馈配电变压器的交期平均时间增加了4倍，从3个月延长到1-2年。而国内变压器企业出海面临渠道（主要矛盾）、产品认证等多道门槛，历史上以国际贸易商间接出口为主，仅金盘直接对接终端，且其海口、桂林等工厂持续扩产能以承接海外订单。3）公司在海外积淀深厚，充分受益于供需紧缺下的订单外溢。海外变压器巨头交期长+涨价，下游客户转向质量可靠、交期短、性价比高的中国供应商，金盘有望充分受益。公司1998年在纳斯达克IPO，前期和西门子歌美飒、GE等国际巨头合作，上市初已是风电干变全球龙一（2020年风电干变全球装机量份额达21%）。各项布局齐全，渠道团队“local for local”、本地人员比例高，墨西哥也有产能布局以降低关税。在当前供需紧张情况下，金盘干变、油变产品性价比高于ABB、西门子等巨头，交期也更快。我们预计公司海外订单后续有望维持高增长，8月的两大长单给出了需求持续性的初步证明，后续长单仍可期待。储能&amp;数字化订单H2有望加速。1）当前时点，市场对储能行业供给放量带来的竞争压力早已有预期，近年来公司储能项目早已开拓至海南省外，并在山西、湖南、福建加速落地工商业及大储项目，产品端涵盖液冷高压级联、低压储能。我们认为H2公司在省外有望持续斩获新订单。2）数字化H1新增望变电气7000万订单（专机设备、软件等），后续有望向电力装备其他企业，乃至生物医药、物流仓储等行业延伸。盈利预测与投资评级：我们维持公司2023-2025年归母净利润分别为5.46/9.23/14.48，同比+93%/+69%/+57%，对应PE分别25倍/15倍/10倍，维持“买入”评级。风险提示：宏观经济下行、竞争加剧、原材料涨价超预期等。,,东吴证券,买入,[None],2023-08-25,,买入,5297977,pdf_downloads/2023/2023-08-25/688676-金盘科技（688676）：出海浪潮大幕拉开，AB长单奏响序曲.pdf,688676,金盘科技,金盘科技（688676）：出海浪潮大幕拉开，AB长单奏响序曲
"贺朝晖,梁丰铄",传统干变、储能扩张、数字化改造共塑公司新发展曲线。渗透率提升+新产能释放+出海加速有望促进公司干变业务高速增长。储能高中低压产品全覆盖，在手订单充足，未来有望通过干变渠道复用打入海外市场。数据化改造对内赋能降本增效，对外输出打造新增长曲线。干式变压器出货有望高速增长21年公司风电干变全球市占率约26%，竞争优势明显。22年至23年6月，我国风电招标规模累计144GW以上，奠定装机高增的基础。能源局明确布置在风机内的变压器应采用干式变压器，内置干变的方案兼具经济、安全、方便运维等优势，渗透率有望快速提升。随新产能释放，我们预计公司在海内外光伏、轨交、工业和电器配套等领域出货亦有望高速增长。高压储能性能优势有望充分显现公司储能产线自22年下半年投产以来，市场开拓顺利，累计订单已达7亿元以上。高压级联储能技术壁垒更高，较低压方案的充放电循环效率高5pct，省去变压器和20%占地面积降低成本，减少簇间环流提升安全性。我们认为，此前新能源强配项目中上述性能优势对业主的价值较弱，但随着大容量独立储能已成市场主流，电网对储能实际调用频率日趋提升，高压方案性能优势有望充分显现，下游接受度有望进一步提升。制造业数字化改造有望打造新增长曲线公司在海外与国际头部厂商的多年竞争中，较早意识到数字化转型的必要性，并积淀了大量技术know-how，对内完成了7座数字化工厂的改造和建设，降本增效；对外凭借在制造业深耕多年的经验，更敏锐捕捉客户痛点，21年8月以来，已累计承接 3 亿元左右数字化工厂改造订单，有望构成新增长曲线。盈利预测、估值与评级我们预计公司2023-2025年收入分别为74.32/108.15/149.24亿元，对应增速分别为56.62%/45.51%/37.99%，归母净利润分别为5.20/8.22/12.77亿元，对应增速分别为83.44%/58.22%/55.37%，3年CAGR为65.21%。EPS分别为1.22/1.93/2.99元/股，对应PE分别为28/18/11倍。绝对估值法测得公司每股价值为41.81元，可比公司2023年平均估值33倍，鉴于公司变压器业务受益于海外和风电需求高增有望高速增长，高压级联储能技术壁垒较高，下游业主接受度有望日渐提升，数字化转型赋能新成长，综合绝对估值法和相对估值法，我们给予公司23年35倍PE，目标价42.70元，给予为“买入”评级。,,国联民生证券,买入,[None],2023-07-24,,买入,5266941,pdf_downloads/2023/2023-07-24/688676-金盘科技（688676）：干变龙头赋能新业务，储能数字化引领新成长.pdf,688676,金盘科技,金盘科技（688676）：干变龙头赋能新业务，储能数字化引领新成长
"武浩,曾一赟",2023年7月3日本期内容提要:全球干式变压器龙头企业，积极布局数字化、储能业务。公司创立之初，产品主要为干式变压器，随后产品逐步丰富成包括变压器系列、成套电气系列等产品，近两年公司积极布局数字化工厂整体解决方案、储能系列产品等新业务，有望成为公司强劲的成长动力。业绩体量来看，公司2020-2022年实现营业收入24.23、33.03、47.46亿元，同比增长7.95%、36.32%、43.96%；实现归母净利2.32、2.35、2.83亿元，同比增长10.29%、1.31%、20.74%。拆分来看，公司2022年的高成长主要来自新能源领域的干变、成套系列产品，其中2022 年公司新能源领域业务实现营业收入 14.77 亿元（YOY+34.12%）。另外，2022年是公司储能与数字化的元年，储能实现收入0.64亿，数字化实现1.36亿，未来有望快速起量。公司干变中高端市场持续发力，助力干式变压器龙头扬帆起航。空间上看，根据Modor Intelligence数据，全球2024年干变市场规模有望达到45.7亿美元，2017-2024年CAGR为6%。公司来看，公司的干式变压器产品主要面向风能、轨道交通、高效节能等中高端市场，我们认为公司聚焦的干变领域成长动力仍然强劲。1）海内外风电需求共振，干变龙头乘风而起。行业层面，2022年全球风电新装增机容量77.6GW，2026年有望达到128.8GW。另外，风机大型化趋势下干式变压器上置方案优势逐步凸显，因此干式变压器渗透率有望提升。我们测算得到全球风电带来的干变空间 2026 年有望达到 63 亿，22-26 年 CAGR 为 21%。公司层面，公司客户结构优质，是全球前五大制造商的主要供货商；公司技术优势显著，完成多个“最大”、“首个”项目案例。2）光伏市场空间广阔，公司技术应用多种光伏领域。2022中国新增光伏装机容量87.41GW， 2030年全球新增光伏装机量有望超500GW，公司干式变压器应用多种光伏领域场景比如硅料生产环节、光伏组件、光伏电站生产等，因此有望随光伏行业发展起量。3）城轨建设持续带动干变市场，公司产品覆盖轨道交通全系列。我国城市化进程的不断推进，轨道交通建设投资整体呈上升趋势，我们测算得到轨道交通领域带来的干式变压器市场规模 2026 年有望达到 15.68 亿元。公司产品种类丰富，覆盖轨道交通领域全系列的干式变压器产品；公司市占率领先，2019-2021 年我国城市轨道交通供电系统变压器/整流器招投标项目中，公司中标金额均排名第 2。4）高耗能工业需求迫切驱动市场上行，公司干变产品具有竞争力。高效节能需求日益增长，带动高压变频器需求上行， 2026 年我国高压变频器市场规模有望达 221亿元，2021-2026 年均复合增长率达 8.79%。干式变压器中的移相整流变压器是高压变频器的重要部件，2026 年需求有望达到 42 亿元。公司移相整流变压器产品为头部变频器厂商供应商，比如西门子、施耐德、东芝三菱电机等。储能行业前景广阔，公司高压级联方案行业领先。新能源占比不断提高带来电力系统问题，储能具有刚性需求，我们测算得到我国2023年储能新增装机有望达39GWh，22-25年CAGR有望达92%。高压级联方案相对传统方案有诸多优势如减少占地面积、减少成本、没有木桶效应、缩短响应时间、提升系统效率等，随着技术更迭，高压级联方案渗透率有望得到快速提升。,,信达证券,买入,[None],2023-07-04,,买入,5251350,pdf_downloads/2023/2023-07-04/688676-金盘科技（688676）：干式变压器龙头，储能、数字化成长动能十足.pdf,688676,金盘科技,金盘科技（688676）：干式变压器龙头，储能、数字化成长动能十足
"武浩,曾一赟",金盘科技(688676)本期内容提要:全球干式变压器龙头企业，积极布局数字化、储能业务。公司创立之初，产品主要为干式变压器，随后产品逐步丰富成包括变压器系列、成套电气系列等产品，近两年公司积极布局数字化工厂整体解决方案、储能系列产品等新业务，有望成为公司强劲的成长动力。业绩体量来看，公司2020-2022年实现营业收入24.23、33.03、47.46亿元，同比增长7.95%、36.32%、43.96%；实现归母净利2.32、2.35、2.83亿元，同比增长10.29%、1.31%、20.74%。拆分来看，公司2022年的高成长主要来自新能源领域的干变、成套系列产品，其中2022年公司新能源领域业务实现营业收入14.77亿元（YOY+34.12%）。另外，2022年是公司储能与数字化的元年，储能实现收入0.64亿，数字化实现1.36亿，未来有望快速起量。公司干变中高端市场持续发力，助力干式变压器龙头扬帆起航。空间上看，根据Modor Intelligence数据，全球2024年干变市场规模有望达到45.7亿美元，2017-2024年CAGR为6%。公司来看，公司的干式变压器产品主要面向风能、轨道交通、高效节能等中高端市场，我们认为公司聚焦的干变领域成长动力仍然强劲。1）海内外风电需求共振，干变龙头乘风而起。行业层面，2022年全球风电新装增机容量77.6GW，2026年有望达到128.8GW。另外，风机大型化趋势下干式变压器上置方案优势逐步凸显，因此干式变压器渗透率有望提升。我们测算得到全球风电带来的干变空间2026年有望达到63亿，22-26年CAGR为21%。公司层面，公司客户结构优质，是全球前五大制造商的主要供货商；公司技术优势显著，完成多个“最大”、“首个”项目案例。2）光伏市场空间广阔，公司技术应用多种光伏领域。2022中国新增光伏装机容量87.41GW，2030年全球新增光伏装机量有望超500GW，公司干式变压器应用多种光伏领域场景比如硅料生产环节、光伏组件、光伏电站生产等，因此有望随光伏行业发展起量。3）城轨建设持续带动干变市场，公司产品覆盖轨道交通全系列。我国城市化进程的不断推进，轨道交通建设投资整体呈上升趋势，我们测算得到轨道交通领域带来的干式变压器市场规模2026年有望达到15.68亿元。公司产品种类丰富，覆盖轨道交通领域全系列的干式变压器产品；公司市占率领先，2019-2021年我国城市轨道交通供电系统变压器/整流器招投标项目中，公司中标金额均排名第2。4）高耗能工业需求迫切驱动市场上行，公司干变产品具有竞争力。高效节能需求日益增长，带动高压变频器需求上行，2026年我国高压变频器市场规模有望达221亿元，2021-2026年均复合增长率达8.79%。干式变压器中的移相整流变压器是高压变频器的重要部件，2026年需求有望达到42亿元。公司移相整流变压器产品为头部变频器厂商供应商，比如西门子、施耐德、东芝三菱电机等。储能行业前景广阔，公司高压级联方案行业领先。新能源占比不断提高带来电力系统问题，储能具有刚性需求，我们测算得到我国2023年储能新增装机有望达39GWh，22-25年CAGR有望达92%。高压级联方案相对传统方案有诸多优势如减少占地面积、减少成本、没有木桶效应、缩短响应时间、提升系统效率等，随着技术更迭，高压级联方案渗透率有望得到快速提升。公司储能系统关键部件自研自制，具有成本优势；公司中高压级联储能系统全球首次采用全液冷技术，大部分性能指标优于国内主要竞争对手或与国内主要竞争对手最优指标持平，技术优势显著。公司储能订单高增，其中3月份签订储能订单高达3.4亿，23年或为储能放量一年。数字化转型大势所趋，数字化业务再添成长动力。政策推动数字经济发展，各行业数字化转型势在必行，中国2022-2026年数字化转型总支出有望达到2.38万亿美元。公司数字化工厂获得德国认证，公司已完成4个数字化工厂建设，进而拓展数字化解决方案业务。截止2022年第三季度公司已累计承接超3亿元数字化工厂整体解决方案业务订单，未来随着订单落地，数字化业务体量有望快速提升。盈利预测与投资评级：公司整体有望受益于干变中高端市场的稳步成长，储能行业、数字化行业的高速发展，我们测算得到2023-2025年营收为80.35、113.24、155.17亿元，同比增长69.3%、40.9%、37.0%；归母净利润为5.19、8.31、12.63亿元，同比增长83.3%、59.9%、52.0%。首次覆盖，我们给予“买入”评级风险因素：原材料价格波动风险，高压级联方案渗透率不及预期，市场竞争加剧。,,信达证券,买入,[None],2023-07-03,,买入,5251393,pdf_downloads/2023/2023-07-03/688676-金盘科技（688676）：干式变压器龙头，储能、数字化成长动能十足.pdf,688676,金盘科技,金盘科技（688676）：干式变压器龙头，储能、数字化成长动能十足
