author,content,filename,org_name,original_rating,pdf_link,publish_time,rating_adjust_mark_type,rating_changes,report_id,save_path,stock_code,stock_name,title
宋颖,"事件:

公司发布公告，拟投资进行成都市污水处理三、四、五、八厂扩能改造工程，预计投资约11亿元；为实施公司“一主多元”发展战略，公司拟投资、建设和运营彭州隆丰环保发电项目，预计投资总额8.67亿元。同时，公司发布了三季报。

投资要点:

解决污水处理产能瓶颈，提升出水水质：成都市中心城区第二、三、四、五、八及新建污水处理厂（一期）均已满负荷或超负荷运行，预计到2020年六个厂服务区域污水量约为200万立方米/日，需新增污水处理能力60万立方米/日。由此，公司拟对成都市第三、四、五、八污水处理厂进行扩能改造，合计扩建35万立方米/日的处理能力，预计总投资额约为11亿元，改造时间1年，投资回报率10%。公司将运用MP-MBR工艺实施扩能改造工程，出水水质从一级A标提升至地表水Ⅳ类标准。

实施一主多元战略，布局垃圾发电项目：彭州隆丰环保发电项目设计日处理城市生活垃圾1500吨，年处理垃圾量约为50万吨，预计年均上网电量17815万度。预计投资8.7亿元，总收入来自于售电收入和垃圾处理费补贴收入，因都江堰、彭州两市垃圾填埋场剩余使用年限较短，未来垃圾处理量有保障，税后的内部收益率为7.5%。

3季报业绩平稳增长：公司前三季度实现营业收入18.76亿元，同比增长4.48%，实现归属于母公司净利润6.73亿元，同比增长7.69%，费用方面财务费用因汇兑损失增加同比增长103.96%，资产减值损失因计提坏账准备增加同比增长153.69%拖累业绩增长。其中，三季度单季实现归属于母公司净利润2.78亿元，同比增长28.49%，主要是新建污水处理厂（一期）的试运行收入等非经营性损益贡献较大。

盈利预测与投资评级：兴蓉投资大股东是成都市国资局，以成都的供水、污水处理为主营业务，近年积极拓展成都以外市场，以西部地区为重点面向全国，同时实施一主多元战略，积极布局垃圾渗滤液、污泥处置及垃圾处理等环保产业。此次公告的两个项目，利好公司未来发展，污水处理的产能扩张和垃圾处置等环保项目的落地开花成为公司未来的主要看点。根据公司现有产能及项目情况，预测14-15年EPS0.28元、0.33元，对应市盈率20、17倍，给于增持评级。

风险提示：项目拓展及进度低于预期",,万联证券,增持,[None],2014-10-24,,增持,823438,pdf_downloads/2014/2014-10-24/000598-兴蓉投资(000598)公告点评报告：污水产能扩建，环保项目布局.pdf,000598,兴蓉投资,兴蓉投资(000598)公告点评报告：污水产能扩建，环保项目布局
"冯大军,邹序元","投资要点：

1．事件

兴蓉投资公布2014年3季报及重大投资意向：（1）前3季度营业收入18.76亿，同比增长4.48%，归属净利润6.72亿元，同比增长7.69%；第3单季度营业收入6.62亿元，同比增长3.53%，归属净利润2.78亿元，同比增长28.49%，扣非净利润2.3亿元，同比增长5.85%。（2）公司拟对成都市第三、四、五、八污水处理厂进行扩能改造，第三、五、八厂每厂分别扩建10万吨/日的处理能力，第四污水厂扩建5万立方米/日的处理能力，合计扩建35万吨/日的处理能力，预计总投资额约为11亿元，改造时间1年。（3）公司拟投资、建设和运营彭州隆丰环保发电项目，总投资估算为86703.12万元。设计日处理城市生活垃圾1500吨，年处理垃圾量约为50万吨，预计年均上网电量17815万度，预计3年建成。

2．我们的分析与判断

公司主营业务收入保持稳定增长，第3季度归属净利润快速增长，主要来自于营业外收入：新建污水处理厂（一期）于2014年6月进入试运行，取得的试运行以及原污水处理二厂的运行净收益，以及自来水公司收到的水桩维护费。

公司主营的水务环保业务2015-2016年展望：（1）自来水供应业务，2013年底产能215万吨/天，利用率87.1%，收入12.1亿元，占总收入比例50.8%，预计到2016年底产能将达到285万吨/天，未来该业务增长率在5%-10%之间。（2）污水处理业务，2013年底产能195万吨/天，利用率80.4%，收入7.7亿元，占总收入比例32.4%，预计到2016年底产能将达到310万吨/天，未来该业务年均增长率在15%左右。（3）管道安装业务，2013年收入3.4亿元，占总收入比例13.8%，该业务具有周期性特点，2014年将可能同比下滑，在新建水厂配套投资下，2015-2016年有望快速增长。（4）垃圾渗滤液处理业务，2013年底产能1300吨/天，利用率85.9%，收入4994万元，占总收入比例2.1%，该业务今年新增产能1000吨/天，处理价格上涨23.7%，预计该业务今年将大幅增长，2015-2016年增长率在15%左右。（5）污泥处理业务，今年开始正式运行，产能400吨/天，初始利用率在60%左右，预计2015-2016年增长率在15%左右。（6）生活垃圾焚烧发电业务，目前还没有营业收入，万兴垃圾发电厂预计2016年投产运营，产能2400吨/天，正式运营后将年均贡献2亿左右的收入。

3．投资建议

我们预测公司2014-2016年营业收入分别为25.5亿、28.0亿、33.2亿元，EPS分别为0.28元、0.30元、0.36元，对应动态PE分别为19X、18X、15X。我们看好公司“一主多元”的发展战略，收购兼并及资产注入是催化剂，维持公司“推荐”投资评级。",,银河证券,推荐,[None],2014-10-23,,增持,822923,pdf_downloads/2014/2014-10-23/000598-兴蓉投资：水务环保业务同步快速发展.pdf,000598,兴蓉投资,兴蓉投资：水务环保业务同步快速发展
"王恭哲,王颖婷","投资要点

业绩总结：2014年1-9月，公司实现营业收入18.76亿元，同比增长4.48%；营业利润7.28亿元，同比下降0.99%；归属于母公司的净利润为6.73亿元，同比增长7.69%；每股收益为0.23元。其中Q3每股收益为0.10元。

业绩稳定增长，盈利能力保持较高水平。营业收入和净利润同比增速分别达约4.48%和7.69%，第三季度实现营业收入6.62亿元（+3.53%），净利润2.79亿元（+28.49%），单季度净利润增速创历史新高，我们认为公司营业利润略有下降主要是财务费用（汇兑损益影响）和资产减值损失增大所致。净利润增速较大主要是因为排水公司污水处理厂二厂拆迁期间的运行收益及新建污水处理厂的试运行收益导致营业外收入（6959万元，+2401%，占净利润比重约10%）增幅较大所致。前三季度公司综合毛利率51.30%，同比基本持平，第三季度毛利率52.53%，环比小幅提升，盈利能力维持强劲。

多个项目将陆续投产释放产能，投资近20亿元加码环保业务。目前公司的成都自来水七厂一期、新建污水处理厂一期工程、银川第六污水处理厂、西安第一污水处理厂二期均投入商业试运行。巴中经开区、新建污水处理厂二期、高新区中和污水厂等多个项目也将陆续投产释放产能，将促进公司收入规模提升及业绩增长。另一方面，公司拟投资进行成都市污水处理三、四、五、八厂扩能改造（合计扩建35万立方米/日的处理能力，预计投资11亿元，改造时间1年）；拟投资、建设和运营彭州隆丰环保发电项目（总投资约8.67亿元，1500吨/日处理能力），投资近20亿元加码环保业务的布局。

持续加大水务环保市场的开拓力度。与新加坡联合环境展开技术合作，提升污水深度处理水平。公司联合控股股东拟收购都江堰市水务资产，还与天府新区成都直管区展开供水合作，持续开拓水务市场，扩大供排水的业务规模。另一方面，公司与新加坡联合国际签署框架协议，拟成立合资公司。合资公司将引入联合环境的多相组合膜生物反应器（MP-MBR）专利技术，开展污水深度处理项目的设计、技术集成、膜组件供应和安装业务。公司与跨国企业展开合作将有利于融合先进的膜法水处理技术，提升公司在污水深度处理的实力和竞争力，满足未来污水处理提标改造需求。

成都区域龙头，持续进行外延式扩张。公司的实际控制人为成都市国资委，区位优势显著。目前供排水规模超过500万吨/日，居西部最大。公司还拥有污泥处理（400吨/日）、垃圾渗滤液处理（2300吨/日）项目，圾焚烧发电项目（2400吨/日）预计年底开工，业务也已垃拓展至兰州、银川等地。长期来看，公司内生及外延式增长将持续推进，受益于成都经济的快速增长及水价的改革，公司将迎来新的增长机遇，从水务运营商转向为环保综合服务商。

盈利预测及投资评级：我们预计公司2014-2016年EPS分别为0.29元、0.32元和0.34元，对应最新收盘价5.53元计算，动态市盈率分别为19倍、17倍和16倍，维持公司“增持”的投资评级。

风险提示：供排水项目进展低于预期；管理层变动风险。",,西南证券,增持,[None],2014-10-23,,增持,823029,pdf_downloads/2014/2014-10-23/000598-兴蓉投资2014年三季报点评：业绩持续增长，投资力度增大布局环保业务.pdf,000598,兴蓉投资,兴蓉投资2014年三季报点评：业绩持续增长，投资力度增大布局环保业务
黄秀瑜,"投资要点：

事件：兴蓉投资（601139）公布的2014年三季报显示，公司实现营业收入18.76亿元，同比增长4.48%，实现归属于上市公司股东的净利润6.73亿元，同比增长7.69%，实现EPS为0.23元。

点评：

营业收入小幅增长，营业外收入成主要的利润增长来源。公司前三季度的营业收入和归属于上市公司股东的净利润均实现小幅增长。营业收入的增长主要来源于自来水售水量和污水处理量保持增长趋势，毛利率水平保持稳定。费用方面，销售费用和管理费用小幅增长，而财务费用则大幅增长104%，主要系报告期内日元贷款因日元汇率波动产生的汇兑损失增加所致。营业外收入获得6959万元，同比增加6681万元，对净利润增长的贡献很大，主要系排水公司污水处理二厂拆迁期间的运行收益及新建污水处理厂的试运行收益。

“一主多元”发展，向综合环境服务商转型。近年来，公司定位于城市综合环境服务商的目标，实施“一主多元”的发展战略，即以水务业务为主，以垃圾焚烧发电、垃圾渗滤液处理和污泥处理等新兴环保产业进行多元化发展。目前公司的自来水制售收入占比为2/3，污水处理收入占比为1/3，污泥处理、垃圾渗滤液处理等其他环保业务收入的占比很少。

污水处理业务的量和质均将得以提升。目前公司运营及在建的供排水规模超过500万吨/日，已经投入运营的自来水规模为235万吨/日、污水处理规模为198万吨/日，在建的污水处理项目规模约有100万吨/日。近期，公司拟对成都市第三、四、五、八污水处理厂进行扩能改造，合计扩建35万吨/日的处理能力，改造期为1年。10月份，公司与新加坡联合环境技术公司设立合资公司，依托联合环境的的膜技术优势，进军膜法水处理领域，由此公司污水处理的技术将得以升级，有利于其进一步向全国范围内拓展污水处理项目。

环保业务加速发展。1）成都市第一污泥处理厂今年正式投运，污泥处理规模400吨/日，污泥处理服务按696.81元/吨计算。2）今年垃圾渗滤液处理规模扩容至2300吨/日，服务费单价为127.36元/吨。3）万兴环保发电厂垃圾焚烧发电项目规模为2400吨/日，为成都市日处理规模最大的垃圾焚烧发电项目，预计今年底前开工。原生垃圾处理服务费单价46元/吨，陈腐垃圾处理单价104元/吨（当400吨以上时为126元/吨）。近期，公司拟投资建设彭州隆丰垃圾发电项目，设计日处理垃圾1500吨，年处理垃圾量约50万吨，预计年均上网电量17815万度，预计3年建成。

投资建议：维持谨慎推荐的投资评级。公司目前的水务主业平稳增长，实施一主多元的发展战略，逐步实现水务与环保双轮驱动，外延拓展打开公司可持续增长的空间。预计公司2014-2016年EPS分别为0.27元、0.31元、0.35元，对应PE分别为21倍、18倍、16倍，维持“谨慎推荐”的投资评级。

风险提示。异地扩张或环保项目拓展缓慢。",,东莞证券,谨慎推荐,[None],2014-10-23,,增持,823127,pdf_downloads/2014/2014-10-23/000598-兴蓉投资(000598)2014年三季报点评：一主多元发展，向综合环境服务商迈进.pdf,000598,兴蓉投资,兴蓉投资(000598)2014年三季报点评：一主多元发展，向综合环境服务商迈进
,"1．事件
    兴蓉投资公布2014年3季报及重大投资意向：（1）前3季度营业收入18.76亿，同比增长4.48%，归属净利润6.72亿元，同比增长7.69%；第3单季度营业收入6.62亿元，同比增长3.53%，归属净利润2.78亿元，同比增长28.49%，扣非净利润2.3亿元，同比增长5.85%。（2）公司拟对成都市第三、四、五、八污水处理厂进行扩能改造，第三、五、八厂每厂分别扩建10万吨/日的处理能力，第四污水厂扩建5万立方米/日的处理能力，合计扩建35万吨/日的处理能力，预计总投资额约为11亿元，改造时间1年。（3）公司拟投资、建设和运营彭州隆丰环保发电项目，总投资估算为86703.12万元。设计日处理城市生活垃圾1500吨，年处理垃圾量约为50万吨，预计年均上网电量17815万度，预计3年建成。
    2．我们的分析与判断
    公司主营业务收入保持稳定增长，第3季度归属净利润快速增长，主要来自于营业外收入：新建污水处理厂（一期）于2014年6月进入试运行，取得的试运行以及原污水处理二厂的运行净收益，以及自来水公司收到的水桩维护费。
    公司主营的水务环保业务2015-2016年展望：（1）自来水供应业务，2013年底产能215万吨/天，利用率87.1%，收入12.1亿元，占总收入比例50.8%，预计到2016年底产能将达到285万吨/天，未来该业务增长率在5%-10%之间。（2）污水处理业务，2013年底产能195万吨/天，利用率80.4%，收入7.7亿元，占总收入比例32.4%，预计到2016年底产能将达到310万吨/天，未来该业务年均增长率在15%左右。（3）管道安装业务，2013年收入3.4亿元，占总收入比例13.8%，该业务具有周期性特点，2014年将可能同比下滑，在新建水厂配套投资下，2015-2016年有望快速增长。（4）垃圾渗滤液处理业务，2013年底产能1300吨/天，利用率85.9%，收入4994万元，占总收入比例2.1%，该业务今年新增产能1000吨/天，处理价格上涨23.7%，预计该业务今年将大幅增长，2015-2016年增长率在15%左右。（5）污泥处理业务，今年开始正式运行，产能400吨/天，初始利用率在60%左右，预计2015-2016年增长率在15%左右。（6）生活垃圾焚烧发电业务，目前还没有营业收入，万兴垃圾发电厂预计2016年投产运营，产能2400吨/天，正式运营后将年均贡献2亿左右的收入。
    3．投资建议
    我们预测公司2014-2016年营业收入分别为25.5亿、28.0亿、33.2亿元，EPS分别为0.28元、0.30元、0.36元，对应动态PE分别为19X、18X、15X。我们看好公司“一主多元”的发展战略，收购兼并及资产注入是催化剂，维持公司“推荐”投资评级。",,银河证券,,[None],2014-10-22,,,822907,pdf_downloads/2014/2014-10-22/000598-兴蓉投资(000598)三季报点评：水务环保业务同步快速发展.pdf,000598,兴蓉环境,兴蓉投资(000598)三季报点评：水务环保业务同步快速发展
,"投资要点

业绩总结：2014年1-6月，公司实现营业收入12.14亿元，同比增长5.00%；营业利润4.48亿元，同比下降6.67%；归属于母公司的净利润为3.94亿元，同比下降3.37%；每股收益0.13元。

营业收入稳定增长，汇兑损益对净利润造成较大影响。上半年公司收入增幅为5.00%，维持稳定增长，综合毛利率小幅下降0.53个百分点至50.63%，盈利能力稳健。日元贷款产生的汇兑损失致使公司净利润出现小幅下滑，剔除汇兑影响，上半年公司净利润同比增长12.38％。

自来水及污水业务稳定增长，垃圾渗滤液增长三倍。分业务来看，上半年公司自来水制售（6.58亿元）和污水处理业务（3.92亿元）收入增速分别为10.82%和7.23%，合计收入占比达到87%左右。垃圾渗滤液业务由于规模扩容以及处理服务费从122.48元/立方米上调至151.56元/立方米（+24%），上半年收入大幅增长308.80%，达到0.80亿元。管道安装业务收入则大幅下滑54.15%，仅实现0.76亿元收入，拉低了公司上半年收入增速。

项目建设进度加快，下半年多个项目集中投产释放产能。上半年成都自来水七厂一期（50万吨/天）、新建污水处理厂一期工程（70万立方米/日）已投入试运行。新建污水处理厂二期、高新区中和污水厂等多个项目正加快建设进度。下半年巴中市经开区污水处理厂、西安第一污水处理厂二期、银川第六污水处理厂等合计18万吨/日的项目将有望完工进入试运营，多个项目的集中投产将释放部分产能，将促进公司收入规模进一步提升及业绩增长。

持续加大水务环保市场的开拓力度。近期公司联合控股股东收购都江堰市水务资产，还与天府新区成都直管区展开供水合作。此外，公司还拥有污泥处理（400吨/日）、垃圾渗滤液处理（2300吨/日）的项目，垃圾焚烧发电项目（2400吨/日）预计年底也开始建设，公司在供排水及环保等业务的持续拓展将进一步壮大主营业务，拓宽业务领域，促进业绩增长。

成都区域龙头，享受特许经营政策优势，持续进行外延式扩张。公司的实际控制人为成都国资委，拥有成都市中心区等地污水、污泥、垃圾渗滤液处理20-30年的特许经营权，在成都地区的区位优势显著。2013年底供排水规模超过500万吨/日，居西部最大。公司实施“一主多元”战略，业务已拓展至兰州、银川、西安等地。长期来看，公司内生及外延式增长将持续推进，受益于成都经济的快速增长及水价改革的实施，公司将迎来新的增长机遇，实现从水务运营商向环保综合服务商的转变。

盈利预测及投资评级：我们预计公司2014-2016年EPS分别为0.28元、0.31元和0.34元，对应最新收盘价4.72元计算，动态市盈率分别为17倍、15倍和14倍，维持公司“增持”的投资评级。

风险提示：供排水项目进展低于预期，成本上升导致毛利率下滑风险。

股价催化剂：“水十条”出台，成都阶梯水价推进。",,西南证券,增持,[None],2014-07-28,,增持,804567,pdf_downloads/2014/2014-07-28/000598-兴蓉投资2014年中报点评：汇兑损失影响利润增长，多项目产能将集中释放.pdf,000598,兴蓉投资,兴蓉投资2014年中报点评：汇兑损失影响利润增长，多项目产能将集中释放
,"动态事项 
    公司发布 2014 年中期报告。2014 年上半年,公司实现营业收入为 12.14 亿元,较上年同期增长 5%;归属于母公司所有者的净利润为 3.94 亿元,较上年同期下降 3.37%;基本每股收益为 0.13 元。
    主要观点 
    汇兑损失致净利润下降 
    公司主营业务为自来水供应、污水处理及垃圾渗滤液处理业务。公司自来水售水量和污水处理量继续保持增长趋势,垃圾渗滤液扩容项目投入商业运行,成都市第一污水污泥处理厂正式投运,垃圾渗滤液处理及污泥处理行业增速较快。2014 年上半年,公司实现营业收入 12.14 亿元,较上年同期增长 5.0%;其中:自来水供应行业营业收入为 7.33 亿元,同比下降 3.31%;污水处理行业营业收入为 3.92 亿元,同比增长 7.23%;垃圾渗滤液处理及污泥处理行业营业收入为7957.86 万元,同比增长 308.80%。
    公司主营业务成本 5.99 亿元,同比上升 6.14%,其中:自来水行业营业成本为 3.67 亿元,同比下降 6.02%;污水处理行业营业成本为1.72 亿元,同比增长 11.81%;垃圾渗滤液处理及污泥处理行业营业成本为 5740.27 万元,同比增长 329.64%。
    上半年,归属于母公司所有者的净利润为 3.94 亿元,较上年同期下降 3.37%,主要是由于公司全资子公司自来水公司日元贷款因日元相对于人民币升值产生了汇兑损失,去年同期产生的是汇兑收益。上半年公司汇兑损失为 1242.75 万元,上年同期汇兑净收益为 4586.71万元,剔除汇兑影响,上半年归属于上市公司的净利润同比增长12.38%。
    拓展水务环保业务
    公司与巴中市水务局签署《巴中经开区污水处理厂配套干管工程及厂外道路建设合同》,巴中市水务局委托公司对巴中经开区污水处理厂配套干管工程及厂外道路项目进行投资建设,负责完成项目的勘察、设计、施工及完工交验工作,并将采取 BT+EPC 建设模式实施此次项目,项目估算建设总投资额约为 1.45 亿元。
    公司及兴蓉集团与四川省都江堰市人民政府签署有关开展都江堰市水务资产合作的《合作意向书》,公司以货币资金作为支付对价收购都江堰市国有自来水水厂、都江堰市国有供水干管和都江堰市国有污水处理厂。
    公司于 6 月 27 日收到天府新区成都党工委管委会《办公会议纪要》,公司将与天府新区成都直管区就天府新区成都直管区范围内的供水工作开展合作,并将供水特许经营权授予公司全资子公司成都市自来水有限责任公司。
    公司积极开拓水务、环保业务,促进公司业务进一步发展。",,上海证券,,[None],2014-07-28,,,804564,pdf_downloads/2014/2014-07-28/000598-兴蓉投资(000598)公司动态：汇兑损失致净利润下降.pdf,000598,兴蓉环境,兴蓉投资(000598)公司动态：汇兑损失致净利润下降
