author,content,filename,org_name,original_rating,pdf_link,publish_time,rating_adjust_mark_type,rating_changes,report_id,save_path,stock_code,stock_name,title
"陈宁玉,王逢节,佘雨晴",公告摘要：全资子公司厦门科华数能科技有限公司近日与特变电工新疆新能源股份有限公司签署了储能设备采购合同，合同总价含税2.307亿元。国内电网侧储能快速发展，欧洲户用光储需求旺盛。国内加强电网侧储能系统建设，提升电力系统的稳定性和消纳能力，对风光项目逐步提出明确的配储比例要求，短期上游原材料成本压力有望逐步减缓，国内大型储能项目有望加快推动。根据《2022储能产业应用研究报告》，2021年中国电化学储能装机1.84GW，其中新能源+储能、电源侧辅助服务、电网侧储能、分布式及微网、用户侧削峰填谷等各类场景功率装机规模分别为837.5/532.3/401/28/45.8MW，预计到2025年，电化学储能年装机增量预计将达到12GW，累计装机将达到约40GW。海外方面，受俄乌战争和全球能源价格大涨等因素影响，海外尤其是欧洲用电成本快速提升，欧美积极谋求能源结构转型，推出相关税收减免政策，提升了光储的经济性。在户用市场，家用光伏配套电池储能系统需求旺盛，结合当前户用光伏累积和新增装机量，我们预计户用储能仍处于起步阶段，未来有望高速增长。根据BNEF数据，2021年全球新增储能装机容量达到10GW/22GWh，预计2030年将达到58GW/178GWh，年均增速将保持在30%以上。储能增长引擎启动，数据中心稳步向上。公司坚持“IDC+新能源”双子星经营战略。数据中心业务稳步增长，公司聚焦京津冀、长三角、粤港澳等一线城市区域项目，截止2021年底，公司已在北、上、广等地建成8个大型数据中心，机柜数约3万余个，同时积极提升运营管理能力和经营质量，深化与互联网客户的合作以及大客户定制模式。新能源业务快速增长，公司致力打造高可靠的光储专家，将UPS领域技术优势赋能光伏+储能领域，2021年成立科华数能并由公司拟董事长亲自挂帅，彰显公司战略地位。储能产品包括储能变流器（PCS）、户用光储一体机及储能微网系统等，广泛应用于发电侧、电网侧、用电侧以及微网储能等领域，在火电调频、可再生能源并网、电网级输配电、工商业园区、智能家用光储等领域拥有丰富的实践经验。根据CNESA数据，科华数能在储能PCS领域新增投运装机量位于全球第2，在储能系统集成领域，国内新增投运装机量位于全球第3、国内储能系统出货量位于全球第5、海外储能系统出货量位居全球第9。当前储能需求持续向好，公司大型储能+户用储能两手布局，在手订单充足，同时加强IGBT等原材料国产化应对供应风险，有望提升整体盈利能力。高管和核心人才增持，彰显长期发展信心。公司发布董监高人员增持股份计划及第一期员工持股计划，其中公司董监高拟增持金额合计不低于1900万元，员工持股计划购买和持有的标的股票总数量不超过321万股。董监高增持主体为陈四雄先生、陈皓先生等9位董事、监事、高级管理人员，后续将以自有资金通过二级市场集中竞价方式增持公司股份。员工持股计划的参与对象为公司及子公司的核心技术/业务/管理骨干，总人数预计不超过170人，拟筹集资金总额上限为8000万元，对应股份数量不超过321万股，约占公司股本总额的0.70%。解锁期为最后一笔标的股票的购买完成之日起12个月后。公司以技术为发展之本，本次推出的董监高及员工持股计划充分彰显了公司对未来发展前景的信心，进一步激发公司管理团队和员工的责任感、使命感，提高职工的凝聚力和公司竞争力，充分调动高管及核心技术业务人员的积极性和创造性，为公司长期稳健发展做铺垫。投资建议：科华数据是国内UPS龙头厂商，坚持IDC+新能源双子星战略，持续发力数据中心、新能源和智慧电能业务。考虑到短期上游成本端压力，我们调整盈利预测，预计公司2022-2024年净利润分别为5.1/7.11/8.5亿元（2022-2023年原预测：6.15亿/7.98亿），EPS分别为1.11元/1.54元/1.84元，维持“买入”评级。,,中泰证券,买入,[None],2022-07-26,,买入,4931589,pdf_downloads/2022/2022-07-26/002335-科华数据（002335）：获得大型储能订单，海外户用储能打开新市场.pdf,002335,科华数据,科华数据（002335）：获得大型储能订单，海外户用储能打开新市场
张涵,"深耕数据中心行业，一季度业绩受疫情影响承压公司在数据中心行业已深耕十余年，在手运营的数据中心机柜3万多个，上架率达到76%。公司数据中心客户包括金融、政企、运营商、互联网、智能驾驶企业等，能够为公司提供稳定的现金流。2022Q1公司实现营收9.93亿元，同增2.38%，归母净利润0.98亿元，同增2.71%，厦门疫情对公司的物流以及发货产生一定影响，预计随着六月份疫情逐渐解封改善，公司业绩有望抬升。数据中心需求稳定增长，欧美户用储能爆发数据中心行业方面，2020年中国IDC业务市场总体规模达到2,238.7亿元，同比增长43.3%，预计到2023年，中国IDC业务市场规模将达到4,868亿元，三年复合增长率或将达到30%。新能源行业方面，欧美等国家为了应对全球能源危机，急需实现快速能源转型。2022年5月18日，欧盟委员会宣布了其“REPowerEU”战略计划指导。2022年6月6日，美国有望宣布对东南亚四国生产的太阳能组件免征24个月关税来支持国内的太阳能业务发展。在此背景下，储能需求高速发展，2021年，全球新增投运电力储能项目装机规模18.3GW，同比增长185%，其中，新型储能的新增投运规模最大，并且首次突破10GW，达到10.2GW，是2020年新增投运规模的2.2倍，同比增长117%。海外户用储能有望带来新的增长动力公司自2021年以来将新能源与储能作为公司重点发展方向，在美国以及欧洲等重点欧洲区域均有所布局。预计今年将充分受益于海外户储需求爆发迎来快速增长。盈利预测我们看好公司在海外户用储能业务高景气下高速发展，预测公司2022-2024年收入分别为57.76、72.74、92.12亿元，EPS分别为1.06、1.30、1.58元，当前股价对应PE分别为24、19、16倍，首次覆盖，给予“推荐”投资评级。风险提示海外储能业务发展不及预期；数据中心业务发展不及预期；",,华鑫证券,推荐,[None],2022-06-07,,买入,4870392,pdf_downloads/2022/2022-06-07/002335-科华数据（002335）：数据中心业绩稳定，海外户储带来新动力.pdf,002335,科华数据,科华数据（002335）：数据中心业绩稳定，海外户储带来新动力
罗露,业绩简评4月29日晚公司发布21年年报与22年一季报，21年营收48.66亿元，Y/Y 16.75%；归母净利润4.39亿元，Y/Y 14.87%；扣非3.23亿元，Y/Y -3.8%。略低于市场预期。经营分析新能源和智慧电能营收高速增长，受疫情与供应链等因素毛利率短期承压。其中智慧电能全年营收10.88亿元，Y/Y 24.36%，毛利率27.93%，Y/Y1.87PP；新能源产品营收6.63亿元，Y/Y 48.50%，毛利率23.87%，Y/Y -6.57PP；数据中心营收30.47亿元，Y/Y 9.10%，毛利率30.02%，Y/Y -3.13PP。海外市场加大营销与渠道力度，收入同比增长35.07%。经营活动现金流量净额8.18亿元，Y/Y 42.87%，主要系公司加强应收账款管理，销售增加及会计准则变更。积极传导成本增幅，1季度毛利率环比提升3PP。坚持产品技术优势与“双子星”战略布局，IDC和智慧电源稳健增长。IDC业务仍坚持核心城市布局，截至21年底自有机柜2.5万个，当前上架率78%，津京冀与大湾区在建项目稳步推进；与腾讯云等大厂合建，并挖掘金融、政企等客户需求，保持每年约1万个运营机柜增量。智慧电能业务在国企与工商业客户领域均取得稳健增长，据CCW Research报告显示， 2021年度中国UPS整体市场占有率排名第一。全球首发全新一代1500V 350kW组串式逆变器解决方案，新能源业务中标捷报频传，在手订单充沛。积极应对短期挑战，看好IDC与新能源长期成长空间。疫情短期影响工厂制造、物流运输与项目交付，公司加大与上游原材料厂商合作、加速国产化替代、内部柔性调整产线以保障供应链稳定，短期挑战不影响IDC与新能源行业景气度。公司新能源解决方案将赋能数据中心业务，打造“源、网、荷、储”一体化系统，有效降低数据中心PUE，打造绿色数据中心。预计公司未来三年收入复合增速25%+，毛利率提升至30%。盈利调整与投资建议我们根据最新财报调整盈利预测，预计22-24年收入63.61（-8.8%）/80.20（-10.7%）/98.13亿元，归母净利润4.62（-10.0%）/6.06（-13.7%）/7.50亿元，对应PE分别20/15/12倍，维持“买入”评级。风险提示IDC上架率不及预期、新能源业务拓展不及预期、供应链安全、商誉减值,,国金证券,买入,[None],2022-04-30,,买入,4835691,pdf_downloads/2022/2022-04-30/002335-科华数据（002335）：毛利率短期承压，看好IDC+新能源长期前景.pdf,002335,科华数据,科华数据（002335）：毛利率短期承压，看好IDC+新能源长期前景
"罗露,姚遥",投资逻辑业务转型成功，产品创新、供应链管理与解决方案构成核心优势。公司通过内生增长+外生并购的方式整合资源，UPS业务起家，逐步向IDC服务与逆变器、变流器等新业务延伸，技术同源且客户重叠度高，可复用技术能力与销售能力。创新驱动，产品发布迭代速度快，成本管理能力强，能为客户提供完整、多样的解决方案是核心优势。公司提供的硬件产品原材料成本占比高达90%+，但公司通过供应链管理，前五大供应商采购金额占比从2013年30%下降到2020年12%；通过产品结构、工艺改进稳定毛利率。数据中心定位准确，绑定大客户，“双碳”政策核心受益。公司定位清晰，针对数据中心业务提出规模中等、技术领先、效益优先。核心区域坚持自建，有节奏扩张，维持70%以上高上架率水平（行业平均约60%），平衡收益与折旧成本；与腾讯等大客户合作，联合开发T-block等创新数据中心，发挥电源管理和制造优势，提供先进产品和高质量运维服务，PUE&lt;1.3，满足客户高能效、易扩展等需求，也符合政府对数据中心的绿色、低碳要求。智慧电源产品优势稳固，高端产品和制造工艺稳定毛利率。UPS是公司的传统优势业务，市场地位领先，当前产品功率范围覆盖0.5kVA-1200kVA，覆盖大量工商业应用场景，注重自主创新，是我国首家掌握自主知识产权的核级UPS企业。高端产品研发积淀深厚，产品结构与制造工艺稳定盈利水平，毛利率高于其他友商5 Pct左右。新能源业务市场空间广阔，出海与小机型产品拓展计划提供业绩增长弹性。“双碳”背景下各地政府颁布推动新能源产业发展政策，全球光伏渗透率仅3%，市场空间广阔。经测算未来10年市场空间CAGR 20%+。公司出海计划与分布式机型拓展计划有利于改善客户和产品结构，未来增长弹性大。预计未来三年公司新能源业务收入增速60%+，净利润增速50%+。投资建议与估值我们采用市盈率法对公司进行估值。预计公司2021-2023年净利润为4.24/5.13/7.02亿元，对应EPS为0.89/1.11/1.52元。给予2022年50倍PE，目标价55.6元，首次覆盖给予“买入”评级。风险下游客户上架不及预期、新能源海外业务拓展不及预期、供应链风险、市场竞争激烈、商誉减值风险,,国金证券,买入,[None],2021-12-07,,买入,4691002,pdf_downloads/2021/2021-12-07/002335-科华数据（002335）：IDC+新能源，双子星战略前景广阔.pdf,002335,科华数据,科华数据（002335）：IDC+新能源，双子星战略前景广阔
"佘雨晴,王逢节,陈宁玉",投资要点公告摘要：公司发布2021年三季报，前三季度公司实现营收34.4亿元，同比增长19.03%；实现归母净利润2.84亿元，同比增长10.76%；实现扣非归母净利润2.63亿元，同比增长19.39%。EPS为0.62元。前三季度业绩符合预期，三大业务均实现稳步增长。前三季度受上游原材料涨价以及海运成本增加等因素，毛利率同比下滑1.79个pct，为29.91%。费用端，公司保持精细化运营，费用管控良好，前三季度费用率为19.5%，同比下滑1.75个pct，其中销售/管理/研发/财务费用率分别为8.62%/4%/2.5%/2.34%，同比分别下滑-0.42/-0.16/-0.92/+0.28个pct。经营质量持续提升，前三季度经营活动产生的现金流量净额为1.30亿元，同比增长201.49%。三季度厦门疫情影响公司排产发货，Q3单季度实现营收12.17亿元，同比增长2.34%，环比减少2.64%，实现归母净利润0.99亿元，同比减少33.59%，环比增长10%。公司始终深耕电力电子行业，目前已经形成以IDC业务为基本盘，在智慧电能和新能源领域发力的业务布局。与此同时，公司营销转型、研发效率、供应链管理、平台管理均取得良好的成效。持续提升事业部、供应链及平台管理部门的精细化管理能力，优化组织效率，公司的经营效益逐步体现。致力打造高可靠的光储专家，新能源业务快速增长。公司高度重视新能源及储能业务，成立科华数能集团，在研发、市场、供应链、人力等方面均加大投入，推动新能源及储能业务快速发展。上半年新能源业务同比增速达到85.39%，显著高于公司增速。公司新能源业务主要包括光伏逆变器和储能变流器等。光伏逆变器在技术上与UPS同源，产品具备一定市场领先性，根据IHS Markit报告，公司在2020年全球并网光伏逆变器（&gt;501kW）供应商市场份额位列前十，亚洲市场份额排名第六。储能方面，公司已在发电侧、电网侧、用电侧以及微网储能等领域进行布局。客户方面，公司携手国投新能源有限公司、东方集团国际合作有限公司、国网综合能源服务集团有限公司等战略客户共同深耕国内外新能源市场。此外，公司储能业务也在持续赋能绿色IDC发展，自主研发的“数据中心后备储能管理系统”项目入选国家工信部《绿色数据中心先进适用技术产品（2020）》，推进数据中心等细分场景的低碳优化建设与运营，有助于公司获取能耗指标，打造绿色数据中心。IDC业务深度绑定腾讯，智慧电能业务多点开花。公司依托33年信息化系统电力安全与节能领先的研发、制造、服务能力，将公司设备级品质管控能力延展到工程级品质管控，实现快速部署高品质数据中心，客户涵盖三大运营商、腾讯等大型互联网企业以及金融等领域，目前在北、上、广等地拥有7个大型自建数据中心，运营机柜数约3万个。公司IDC业务从UPS产品起家，尔后向上下游进行延伸，目前已具备产品开发、EPC建设运维等IDC全生命周期服务能力。与腾讯等大客户粘性逐步增强，7月份公司再次斩获腾讯新的数据中心订单，总金额约为2.7亿。根据计世资讯数据，科华数据在2020-2021年中国微模块数据中心市场份额排名第一。公司智慧电能业务已经在金融、轨交、工业、核电等领域得到应用，业务主要包括UPS电源、EPS电源等产品和解决方案，产品方案在国内居于领先地位，能满足不同行业电源系统个性化需求。以核电领域为例，公司研发的自主可控核级UPS已全面进入中核、国核、中广核工程项目。投资建议：科华数据是国内UPS龙头厂商，在中国高端UPS国产品牌市场占有率领先，持续发力数据中心、新能源和智慧电能业务。短期由于疫情影响，我们调整盈利预测，预计公司2021-2023年净利润分别为4.44亿/6.15亿/7.98亿（原预测为5.13亿/6.52亿/8.25亿），EPS分别为0.96元/1.33元/1.73元，维持“买入”评级。,,中泰证券,买入,[None],2021-11-01,,买入,4657616,pdf_downloads/2021/2021-11-01/002335-科华数据（002335）：业绩符合预期，成立数能集团拓宽新能源业务.pdf,002335,科华数据,科华数据（002335）：业绩符合预期，成立数能集团拓宽新能源业务
"易景明,王逢节,陈宁玉","投资要点公告摘要：公司发布业绩预告，预计2021年半年度归属于上市公司股东的净利润17828.1万元-21609.82万元，同比增长65%-100%。上半年业绩稳步增长，战略转型成效显著。公司2021H1净利润中值为1.97 亿元，同比增长 82.41%，Q2 单季度净利润1.02亿，同比增长29.11%。上半年公司数据中心、新能源及智慧电能业务稳健增长，获得了腾讯新的数据中心运营订单，在“双碳”目标及数字经济背景下，积极探索绿色数据中心的智能电能综合解决方案。公司从2020Q3业绩实现大幅增长，主要原因是公司明确了聚焦数据中心业务和智慧电能业务战略方向，开展精细化运营，费用管控良好，实现降本增效。公司是国内UPS龙头厂商，从产品型向方案型与平台型转变，公司IDC服务收入和数据中心集成收入同比增长且毛利率提升。UPS业务与IDC业务协同发展，IDC建设运营及其配套高端电源业务提升对大客户的综合服务能力。与此同时，公司营销转型、研发效率、供应链管理、平台管理均取得良好的成效。持续提升事业部、供应链及平台管理部门的精细化管理能力，优化组织效率，公司的经营效益逐步体现。获得腾讯新的数据中心订单，从产品到IDC运营与腾讯深入战略合作。7月6日，公司公告与腾讯云计算（北京）有限责任公司双方达成一致，基于广东清远清城2.2栋数据中心的建设签订了年度框架协议，科华根据协议建设并交付机房，服务期内预估总金额约2.7亿元，IDC机房服务期十年。此前与腾讯云签署合作协议，根据其业务发展需要，将在全国等地建设自有园区数据中心，数据中心采用腾讯T-block技术建设,公司作为IDC综合服务提供商，提供全国范围的数据中心服务。此次订单，是继2020年与腾讯签订11.7亿元大订单后的又一重大突破。公司于2014年起从UPS转型延伸到数据中心运营，先后分期投资建设了北京科华、上海科众、广东科云、广东科华等子公司运营的IDC数据中心项目，已在北上广及周边城市建设7大数据中心，在全国10多个城市运营20多个数据中心，拥有机柜数量超过2.8万架，数据中心总建筑面积超过23万平方米，形成华北、华东、华南、西南四大数据中心集群。，客户覆盖互联网、云计算、政府、金融等各个领域。公司在数据中心产品和技术方面具有竞争力，拥有一线城市IDC核心资源，同时与腾讯深度合作，业务有较大的成长空间。碳中和背景下，依靠技术优势探索绿色节能数据中心应用。据国网能源研究院预测，20年我国数据中心整体用电量将突破2000亿千瓦时，占全社会用电量的比重2.7%，到2030年用电量将突破4000亿千瓦时，占全社会用电量的比重将升至3.7%。公司依托33年信息化系统电力安全与节能领先的研发、制造、服务能力，将公司设备级品质管控能力延展到工程级品质管控，实现快速部署高品质数据中心；同时公司深度融合数据中心智能运维技术，打造了AI⁺ IDC运维管理平台，构建智能化、集约化、无人化的黑灯数据中心运维模式，为客户提供数据中心全生命周期服务。此外，公司的储能解决方案将赋能数据中心业务，通过储能及综合智慧能源管理，打造“源、网、荷、储”一体化系统，推进数据中心的低碳优化建设与运营，有助于公司获取能耗指标，打造绿色数据中心。IDC建设运营及其配套高端电源业务将提升对大客户的综合服务能力。投资建议：科华恒盛是国内UPS龙头厂商，在中国高端UPS国产品牌市场占有率领先。战略明确聚焦数据中心，与腾讯签订新的园区数据中心战略合作协议，从产品到IDC运营深入合作，有较大的发展空间。我们预计公司2021-2023年净利润分别为5.13亿/6.52亿/8.25亿（原预测2021-2022年净利润5.13亿/6.36亿），EPS分别为1.11元/1.41元/1.79元，维持“买入”评级。",,中泰证券,买入,[None],2021-07-14,,买入,4557896,pdf_downloads/2021/2021-07-14/002335-科华数据（002335）：中报预告符合预期，获得腾讯IDC新订单.pdf,002335,科华数据,科华数据（002335）：中报预告符合预期，获得腾讯IDC新订单
赵良毕,UPS龙头助力哈密光热项目，新能源业务持续突破，维持对公司“买入”评级近日，新疆哈密50兆瓦熔盐塔式光热发电站完成地面14500面定日镜安装调试，进入稳定发电期，科华数据工业级高可靠电源解决方案助力该项目实现24小时不间断发电，显示了公司在新能源及智慧电能领域的充分技术储备。根据ICTResearch数据显示，公司在中国UPS金融行业市场份额位居首，公司龙头地位使得公司具备相对客户认可优势，同时公司与腾讯等大型互联网公司合作，IDC业务稳中有升。预计公司业绩随新基建逐步布局，以及“双碳”目标的支撑，业绩有望超预期。据此我们维持预测公司2021/2022/2023年可实现归母净利润4.97/6.57/8.91亿元，同增30.0%/32.4%/35.6%，EPS为1.08/1.42/1.93元，当前股价对应PE分别为23.0/17.3/12.8倍，相对可比公司存在一定估值优势，维持对公司的“买入”评级。公司多业务齐头并进，强技术储备领跑光储应用，估值与业绩有望双升公司长期高速增长具备充分基本面支撑。业绩方面，公司以传统业务为主，于2020年明确了聚焦数据中心的发展战略，集中资源大力发展数据中心业务，公司2020年数据中心产品及集成产品收入占比38.24%，毛利率36.09%，自2017年以来呈现持续上升趋势，目前已在北上广投建7座大数据中心，形成华北、华东、华南、西南四大数据中心集群；同时，公司具备强技术储备，2017-2020年研发费用合计达7.37亿元，使得公司光伏逆变器产品功率范围达1kW-6.8MW，是为数不多的拥有全系列产品和全场景解决方案的企业之一，支撑公司在储能微网领域快速发展。根据中国储能网数据显示，公司储能全球累计装机量超过1.1GW，其项目涉及多个重点储能项目，领跑光储应用。我们认为公司凭借近20GW项目经验和核级高可靠性质控，正迅速拓宽新能源业务领域，为光伏及储能行业带来更多新的解决方案，在“双碳”经济背景下为公司营收快速增长提供新动能，公司发展有望再上一个新台阶。风险提示：5G及IDC建设不及预期；市场竞争加速带来利润下降,,开源证券,买入,[None],2021-07-11,,买入,4555192,pdf_downloads/2021/2021-07-11/002335-科华数据（002335）：IDC稳中有升、新能源放量在即，估值与业绩双升.pdf,002335,科华数据,科华数据（002335）：IDC稳中有升、新能源放量在即，估值与业绩双升
