author,content,filename,org_name,original_rating,pdf_link,publish_time,rating_adjust_mark_type,rating_changes,report_id,save_path,stock_code,stock_name,title
"王强,胡昂,裘孝锋","1．事件

鲁西化工发布2012年度业绩预告，2012年公司实现营业收入102.47亿元，同比增长9.99%，归属于上市公司股东净利润3.41亿元，同比减少19.43%，对应每股收益0.23元。

同时公司发布2013年1季度业绩预增公告，预计实现净利润1.27亿元—1.45亿元，比上年同期增长40-60%，对应每股收益0.087元—0.099元。

2．我们的分析与判断

（一）、2012年业绩下滑，1Q2013盈利大幅提升

2012年，受制冷剂景气下滑的影响，甲烷氯化物需求低迷，价格持续下滑，是公司利润同比减少19.43%的主要因素。

而2013年1季度业绩同比大幅提升，一方面在于，煤炭价格低于同期，合成气成本得以降低，尿素盈利扩大；其次，甲酸、甲酸钠等产品乃12年下半年投产，且一直保持着较高盈利水平；最后，公司园区建设日益成熟，电、蒸汽、公用工程配套逐渐完善，生产装置负荷得到提升。

（二）、丁辛醇享受高盈利，2Q有望延续强劲增长

25万吨丁辛醇于3月中下旬实现安全投运，经过进一步的工艺优化，目前运行质量和产量上都有大幅提升。丁辛醇主要原料是丙烯和合成气，当前正丁醇出厂价10800元/吨，辛醇出厂价11100元/吨，静态测算单吨盈利约2000元。丁辛醇对2季度业绩边际贡献巨大。

国内低温、干旱等恶劣气候直接影响国内春耕市场用肥，导致尿素价格未如期上调，目前价格比较平稳。后市关注出口集港进展以及夏季高氮肥市场启动情况。

甲烷氯化物等化工品的价格较1季度有上调，环比盈利有望提升。",,银河证券,推荐,[None],2013-04-15,,增持,582836,"pdf_downloads/2013/2013-04-15/000830-鲁西化工(000830)：正丁醇享受高盈利,2季度业绩有保证.pdf",000830,鲁西化工,"鲁西化工(000830)：正丁醇享受高盈利,2季度业绩有保证"
杨伟,"事件：

近期赴公司调研，了解公司经营情况。

观点：

1．园区一体化优势明显，产品柔性生产弹性大

公司围绕一体化、集约化、园区化的理念建设了化工园区，已形成煤化工、盐化工、氟硅化工、新材料化工为主要结构的产品网络，主要产品包括尿素、DMF、三聚氰胺、烧碱、甲烷氯化物、有机硅、甲酸、甲酸钠，以及13年3月陆续投产的丁辛醇；10万吨己内酰胺项目也将于今年中期投产。园区一体化模式优势明显，可充分利用水电气等公用工程及工艺副产品，降低物料运距，发展循环经济；同时可以根据产品需求与市场价格波动走势合理规划各产品产能，降低化工品的强周期风险，并实现盈利最大化。

2.航天炉成本优势明显，尿素价格可能将小幅走高

公司目前尿素产能包括：一套包括两个18万吨合成氨-30万吨尿素的航天炉，一部分合成气做其它产品，共50万吨尿素产能；三套固定床炉子：一厂50万吨产能，12年产量约48万吨，二厂45万吨产能，12年产量约41.5万吨，园区50万吨产能，共195万吨尿素产能。

航天炉尿素生产成本：吨合成氨耗电400度，0.5元/度，烟煤1.35-1.4吨，目前到厂价不到700元/吨，入炉价750元/吨，蒸汽3.5吨，130元/吨（外购150-160元/吨）；生产一吨尿素需不到0.6吨合成氨，80度电，2吨蒸汽，材料+人工费用等共300元，设备按14年折旧，共1600-1650元/吨。固定床尿素成本：园区1850元/吨，一厂1950元/吨，二厂1900元/吨。尿素将不是公司未来发展的重点。

尿素装臵目前满产，出厂价2150元/吨左右，今年气候变化大导致春耕行情推后。未来尿素市场变数很多，但出口行情比去年好，气头尿素开工率下降，以及成本高的小产能会被淘汰，所以13年、14年尿素供需面乐观。

结论：

公司园区一体化优势明显，可合理规划柔性生产实现效益最大化；航天炉制尿素成本优势明显，较固定床至少降低200元/吨，13年以来煤炭价格持续走低，公司尿素毛利率提升；丁辛醇与己内酰胺投产将成为13年重要的利润增长点；己内酰胺项目也即将于中期投产，新材料业务后续将大有可为。我们预计公司2012-2014年的每股收益分别为0.24元、0.44元、0.58元，对应2012-2014年PE为18倍、10倍、7倍。给予公司13年15倍PE，未来12个月目标价6.45元，首次给予“推荐”评级。

风险提示:

原料价格上涨的风险；尿素及复合肥价格大幅波动的风险；化工安全事故的风险；",,东兴证券,推荐,[None],2013-04-03,,增持,581976,pdf_downloads/2013/2013-04-03/000830-鲁西化工(000830)调研快报：航天炉成本优势明显，新材料业务大有可为.pdf,000830,鲁西化工,鲁西化工(000830)调研快报：航天炉成本优势明显，新材料业务大有可为
"王强,胡昂,裘孝锋","1．事件

鲁西化工投资建设的25万吨丁辛醇项目，近期经过单机试车、联动试车及化工投料试运行，顺利打通丁醇单元流程，实现了安全投运，一次生产出丁醇优等品。辛醇单元也将于近期进行化工投料运行。

2．我们的分析与判断

（一）、正丁醇如期投产享受高盈利

丁辛醇即正丁醇和辛醇，是重要的基本有机化工原料。正丁醇主要用于生产醋酸丁酯、丙烯酸丁酯等；辛醇主要用来生产增塑剂。

正丁醇（产能25万吨/年，其中正丁醇10万吨，辛醇12.5万吨，异辛醇2.5万吨）的顺利投产反映出公司项目建设一贯的高效，从之前的氯甲烷、航天炉项目就可见一斑，这种高效性主要体现在项目建设进度快，且达产快。一般来说，新建的化工项目，开车到最后的达产少则2个月，多则半年甚至更长，鲁西1个月左右负荷就能开起来。

丁辛醇的主要原料是丙烯和合成气，其中正丁醇单耗丙烯约0.62，我们测算当前正丁醇的生产成本在8000元/吨左右，而当前华东市场报价11300元/吨，正丁醇单吨净利接近2000元/吨。公司正丁醇的顺利投产能享受较高的盈利。

（二）、齐鲁石化4月份检修，丁辛醇有望维持强势

齐鲁石化将在2013年4月份进行四年一度的大修，为期约1个月。目前齐鲁石化拥有丁辛醇产能40万吨，约占国内总产能的20%，1个月的停产检修势必会减少市场的供应量，丁辛醇的价格有望继续维持强势。

据我们统计，国内大部分丁辛醇产能将在13年下半年至14年投产，对市场的冲击至少要在13年年底才显现。因此，我们认为13年丁辛醇的盈利有保证。

（三）、己内酰胺、新型粉煤煤气化项目值得期待正丁醇的顺利开车坚定了我们对公司推进项目的信心，后续的己内酰胺、新型粉煤煤气化项目值得期待。公司己内酰胺工艺采用的是环己烯法，较主流环己烷法相比，废水少、安全性高，可变成本要低15-25%。按照当前己内酰胺价格测算，预计单吨毛利接近2000元，盈利好于市场预期。合成气是公司产业链中最重要的原料，在很大程度上决定了后续产品的成本。原先公司采用的是固定床装置，而从航天炉运行的情况，合成气成本要降低20%左右，后续新型粉煤煤气化项目装置的陆续投产，合成气成本有望系统性降低。3.投资建议公司积极探索园区一体化建设、管理和运营模式，正逐步走向收获的季节。随着新增项目丁辛醇、己内酰胺以及航天炉的不断投产，盈利拐点到来，我们预计公司2012-2014年EPS分别为0.23元、0.42元和0.52元，对应目前股价PE为19.8x、10.8x和8.8x，维持“推荐”的投资评级。",,银河证券,推荐,[None],2013-03-13,,增持,573188,"pdf_downloads/2013/2013-03-13/000830-鲁西化工(000830)：正丁醇如期投产享受高盈利,后续项目值得期待.pdf",000830,鲁西化工,"鲁西化工(000830)：正丁醇如期投产享受高盈利,后续项目值得期待"
李璇,"事件:1月28日,鲁西化工股价大幅上涨5.62%,收盘价4.51元,盘中最高上涨近7%。
    背景:2013年中央一号文件或于本周公布,以及春耕行业带来农化板块预期整体向好。板块上涨逐渐分化,业绩确定增长品种强者恒强。化肥(以尿素与复合肥为主)与农药(以除草剂为主)的相应标的均录得5%以上的涨幅。其中,华鲁恒升+4.03%、史丹利+7.78%、金正大+4.68%、利尔化学+9.97%,新安股份+6.15%、江山股份+5.34%。除草剂预计产量和利润双增长的趋势有望延续相应标的上涨。
    除行业短期季节性利好,2013年公司业绩将大幅增长:1、丁辛醇项目投产业绩增厚40%;2、短期春耕行情与出口关税调整带来尿素盈利的同比回升与股价的安全边际;3、下半年化工品涨价的业绩弹性。
    转型深化在业绩中兑现,化工产业园的规模成本优势与中高端产品的放量将加速盈利增长。2008年公司在聊城化工产业园的基础上开始转型,至2012年一系列初级化工项目投产标志着由传统单一的化肥业务转型化工公司的初步成功。2013-2015年投产的丁辛醇、己内酰胺、聚甲醛等中高端精细化工品项目将推动公司产品结构向高端高毛利率品种的转变,业绩具备更强的爆发力。
    财务指标稳健,2013年再看化工品复苏弹性。公司每股净资产与经营活动现金流净额为3.58元(PB=1.26)与0.64元。在建工程与投资活动现金流净额分别为32亿与18.6亿,2013-2014年投产项目保证未来盈利的增长。2013年预计投产的丁辛醇与己内酰胺项目均具备较强的盈利(毛利率超过30%),化工品收入将超过40亿元占公司整体收入1/3,未来化工品价格复苏的弹性将成为未来公司的主要增长极。
    预计公司2012-2014年EPS分别为0.23、0.38与0.51元。未来高盈利化工项目的投产与化工品整体复苏为业绩带来更多弹性,给予目标价区间5.7~6.1元,对应13xPE为15~16倍,维持“买入”评级。
    风险因素:募投项目低于预期;宏观经济继续下滑;化工品需求萎靡;产品价格大幅下降。",,中泰证券,买入,[None],2013-01-30,,买入,539905,"pdf_downloads/2013/2013-01-30/000830-鲁西化工(000830)：深化转型逐步兑现业绩,改变认识正在发现价值.pdf",000830,鲁西化工,"鲁西化工(000830)：深化转型逐步兑现业绩,改变认识正在发现价值"
"王强,胡昂,裘孝锋","投资要点：

探索园区一体化模式，迈向化企新标杆

公司是国内少有的拥有独立化工园区的企业，集研发、设计、制造安装及化工开车于一体，园区占地4平方公里，配套有完善的水、电、汽供应网络。化工项目设备自给率高达90%，项目投资额较市场要低近1/3，并且建设快，质量有保证。公司积极探索园区一体化建设、管理和运营模式，正逐步走向收获的季节，有望成为化工标杆性企业之一。

新型粉煤煤气化装置陆续投产将系统性降低合成气成本

合成气是公司产业链中最重要的原料之一，在很大程度上决定了后续产品的成本。原先公司采用的是固定床装置，而从航天炉运行的情况，合成气成本要降低20%左右，后续新型粉煤煤气化项目装置的陆续投产，合成气成本还有望系统性降低。

看好尿素春耕行情，公司弹性大

2013年和2012年尿素春耕社会供应量基本持平，今年的节气比去年要早，化肥有望提前使用，实际的资源量就会少于去年；当前备肥多数区域明显不如晚年，加上关税政策调整有利于出口，春耕期间尿素的供需形势较好。公司尿素产能195万吨，尿素盈利每上涨100元/吨，增厚EPS0.09元。

丁辛醇先投产，13年盈利有保证

国内大部分丁辛醇产能将在13年下半年至14年投产，对市场的冲击至少要在13年年底才显现。公司25万吨丁辛醇装置有望在1季度试车投产，率先投产有望享受到13年盈利景气。按照目前丁辛醇的价格来测算，公司单吨净利约1200元/吨。

己内酰胺采用环己烯法，成本优势明显

公司己内酰胺工艺采用的是环己烯法，较主流环己烷法相比，废水少、安全性高，可变成本要低15-25%。按照当前己内酰胺价格测算，单吨毛利接近2000元，盈利好于市场预期。

公司业绩即将迎来转折点，我们预计公司2012-2014年EPS分别为0.23元、0.42元和0.52元，上调至“推荐”的投资评级。

主要风险因素：（1）煤炭价格上涨；（2）项目进度低于预期。",,银河证券,推荐,[None],2013-01-29,上调评级,增持,562629,"pdf_downloads/2013/2013-01-29/000830-鲁西化工(000830)：坚持园区一体化模式,业绩拐点渐现.pdf",000830,鲁西化工,"鲁西化工(000830)：坚持园区一体化模式,业绩拐点渐现"
"李璇,燕云","控股股东鲁化集团增持公司股份98万股,并计划未来增持不超过2%的股份(2900万股)。大股东增持显示对鲁西化工未来发展的信心。看好上市公司持续稳定发展和园区化建设运作模式的前景。
    公告事件:2012年10月16日公司大股东鲁化集团通过二级市场增持了98万股公司股份,增持后集团持有总股本的30.44%。同时,集团计划6个月内根据有关规定以及市场情况,增持不超过公司总股本2%的股份(约2900万股)。
    2012年盈利同比持平略降,化工不足抵消化肥增长。公司上半年收入60亿,同比增长20%,净利润1.92亿,同比增长5.9%,EPS0.13元。由于化工品盈利能力同比大幅下降抵消了氮肥的盈利增长。我们预计下半年由于化工品盈利改善空间有限,化肥价格的下行将导致公司整体盈利环比下降,但2季度投产的三个化工项目盈利能力较强,有利于公司综合毛利率保持稳定。
    2013年看化工品复苏的弹性。2012年公司投产1.6万吨四氯乙烯、10万吨甲酸钠与甲酸、2013年预计投产的丁辛醇与己内酰胺项目均具备较强的盈利(毛利率超过30%),化工品收入将超过40亿元占公司整体收入1/3,相对于公司59亿元的市值,化工品价格复苏的弹性将成为未来公司的主要增长极。同时化工产业园一体化规模优势将随化工项目的投产而凸显,公司高速成长仍旧可期。
    预计公司2012-2014年EPS分别为0.27、0.38与0.51元。2013年收入超过120亿元(化工40亿元),相对于目前59亿元的市值,市销率PS为0.5。未来高盈利化工项目的投产与化工品整体复苏将为公司业绩带来更多弹性,我们给予目标价区间4.9~5.4元,对应12xPE为18~20倍,维持“买入”评级。
    风险因素:宏观经济继续下滑;化工品需求萎靡;产品价格大幅下降",,中泰证券,买入,[None],2012-10-18,,买入,755520,pdf_downloads/2012/2012-10-18/000830-鲁西化工(000830)：集团增持彰显信心.pdf,000830,鲁西化工,鲁西化工(000830)：集团增持彰显信心
"李国洪,王强,胡昂,裘孝锋","1．事件

公司发布2012年半年报告，2012年上半年公司实现营业收入60.07亿元，同比增长19.98%，归属于上市公司股东净利润1.92亿元，同比增长6.05%，对应每股收益0.13元。

2．我们的分析与判断

（一）、尿素盈利提升，化工品拖累业绩

公司上半年每股收益为0.13元，低于我们及市场一致预期。

今年上半年，海外尿素价格一路走高，同时由于天气原因，国内春耕有延后，与复合肥采购，6-7月份水稻、玉米追肥旺季衔接叠加，尿素价格持续上行，从2100元/吨一路上涨至2500元/吨。公司尿素毛利率也从去年同期的7.9%大幅提升至15.6%。但公司三厂20万吨尿素产能关停，加上4、5月份尿素装置的相继检修影响了尿素产量，对业绩的提升还不够充分。上半年化工品毛利率下滑了6.3个百分点，是拖累业绩的主要原因。氯甲烷需求疲软，景气度持续下滑，特别是三氯甲烷价格从去年最高的11000元/吨一路下滑至目前的1800元/吨。加上今年氯甲烷的产能扩至24万吨，亏损就更加厉害。由于化工品不景气，当前三聚氰胺、有机硅、DMF装置均未开工。

（二）、航天炉技术引领低成本之路

公司一厂、二厂的尿素产能均是固定床装置，成本较高，影响了产品竞争力。公司引进消化了国内航天炉粉煤加压气化先进技术，能够使用价格较低的烟煤为原料，综合成本较固定床低约200多元。当前航天炉装置运行顺畅，公司也考虑未来新建航天炉装置保证合成气供应的打算。航天炉装置经过一段时间的运行后，合成氨吨耗有所降低，尿素完全成本大约在1790元/吨。如果按照150万吨量来算，能至少节约成本3个亿。",,银河证券,中性,[None],2012-08-09,,中性,753139,"pdf_downloads/2012/2012-08-09/000830-鲁西化工(000830)半年报点评：业绩低于预期,下半年盈利承压.pdf",000830,鲁西化工,"鲁西化工(000830)半年报点评：业绩低于预期,下半年盈利承压"
"王皓宇,张伟保","事件：公司发布半年报，半年报中显示期公司实现营业收入600,749.01万元，同比上升19.98％，实现利润总额25518.98万元，同比上升1.95%，公司实现净利润19,155.15万元，同比上升5.92%，按照最新股本计算，上半年公司实现EPS0.131元，基本符合预期。

点评：

尿素高盈利保证公司上半年业绩增长。公司年俗上半年实现收入21.06亿元，相比去年同期15.72亿元增加了33.97%，今年上半年尿素一直处于高位，尤其二季度的4、5月份公司的尿素出厂价更是达到了2450元/吨的高位，上半年尿素平均价格相比去年同期上涨了10%左右，而原料煤价格相比去年同期有所下降，导致公司尿素盈利大幅提升，尿素毛利率由去年中期的7.91%提升到15.60%，从而使得公司上半年一半的利润来源于尿素，尿素盈利的大幅提升保证了公司上半年业绩的增长。

上半年化工产品价格低迷拖累公司的上半年业绩增长。国内上半年经济增速放缓，导致国内化工产品市场需求萎缩，再加上化工行业产能过剩严重，库存积压严重，国内化工产品价格一路阴跌，整个上半年都处于低位。公司生产的氯化苄、三聚氰胺、甲烷氯化物等化工产品盈利能力也大幅下滑，化工产品综合毛利率由去年同期的15.31%下滑至9.05%，虽然公司凭借较为完整的产业链降低其生产成本，但也难当行业低迷，公司化工产品盈利大幅下滑一定程度上拖累了公司上半年业绩增长的步伐。

公司航天炉的顺利运行以及产业链的逐步完善大幅降低公司主营产品成本，竞争优势明显。公司的航天炉顺利运行，使得公司生产合成氨的原料由原来老装置固定床的无烟煤改为现在的烟煤，合成氨成本每吨下降400元左右，尿素生产成本可下降200多元/吨，生产成本大幅降低。此外，公司投产的甲烷氯化物等精细化工项目原料大部分来自于上游煤化工中合成氨的副产物、氯碱化工中的副产物液氯以及有机硅生产中的中间体等产品，生产成本较低，可以获得超出行业平均毛利率水平10%以上。可见，公司的尿素及化工产品在行业内具有较强的竞争优势。

继续维持“强烈推荐”评级。我们预测公司2012-2014年EPS分别为0.29元、0.37元和0.46元，公司目前股价为4.71元，对应PE分别为16倍、12倍和10倍，公司凭借完整的产业链，以及多样化的产品优势，抵抗行业下滑风险能力较强，而且目前公司化工产品盈利处于底部，未来的业绩弹性较大，我们继续维持“强烈推荐”评级。

风险提示：在建项目投产低于预期、产品价格大幅下滑、原料暴涨等。",,第一创业,强烈推荐,[None],2012-08-02,,买入,752119,pdf_downloads/2012/2012-08-02/000830-鲁西化工(000830)：尿素高盈利保证业绩稳步增长.pdf,000830,鲁西化工,鲁西化工(000830)：尿素高盈利保证业绩稳步增长
李璇,"2012年上半年公司收入与盈利稳定增长。2012年1-6月实现营收60.07亿,同比增长20%,净利润1.92亿,同比增长5.9%,EPS0.13元,同比下降9%,由于增发股本摊薄。公司收入增速快于盈利的主要原因:化工品收入与毛利率同比大幅下降抵消了氮肥的盈利增长,同时销售费用与财务费用大幅增加所致。
    分产品情况:尿素与复合肥业务收入稳定增长,是上半年业绩的稳定器。但复合肥由于原料成本高企毛利率由13.5%下滑至10.5%。氮肥收入21亿(+34%),毛利率15.6%(+7.7%),利润占比51%是上半年盈利增长最大的来源;复合肥收入19亿(+9%),毛利率15.6%(-3%),利润占比30%;化工品销售收入10.6亿元(-34%),毛利率9.05%(-6%),利润占比15%,是盈利大幅下降的主要来源。
    单季度收入稳定提升,净利润环比上升。12年1Q-2Q营收分别为29、31亿,净利润0.91、1.01亿。
    2012年二季度虽然营业收入与净利润环比缓慢增长,但单季度净利润同比下滑的原因主要是化工品盈利大幅下滑所致。
    2012年投产项目保证增长,下半年看化工品弹性。上半年公司1.6万吨四氯乙烯、10万吨甲酸/甲酸钠等项目的投产为下半年业绩提供增量,中性估计共增厚EPS0.14元(年化)。同时2011年底投产的航天炉项目正在为尿素业务提供丰厚的盈利,2012年公司稳定成长仍旧可期。预计下半年随着国内宏观经济见底回升,化工品需求逐步回暖,单季度盈利占比回升至40%,或将成为业绩增长的弹性来源。
    预计公司2012-2014年EPS分别为0.37、0.53与0.72元。2012年预计氮肥板块盈利维持同比大幅回升,化工品盈利回升将带动业绩环比回升的弹性,同时上半年新投产化工装置静态测算年化增厚EPS0.14元。基于业绩增长确定性与化工品回暖弹性的预期,我们给予目标价区间6.7~7.4元,对应12xPE为18~20倍,维持“买入”评级。",,中泰证券,买入,[None],2012-07-26,,买入,751129,"pdf_downloads/2012/2012-07-26/000830-鲁西化工(000830)：业绩稳定增长,关注下半年化工弹性.pdf",000830,鲁西化工,"鲁西化工(000830)：业绩稳定增长,关注下半年化工弹性"
"刘波,张苏予","投资逻辑

国外尿素少有的牛市，国内尿素盈利可期：年初以来，受美国玉米种植面积增加、尿素生产国装置检修的影响，国际尿素价格一路飙升60%，相应拉涨了国内价格。预计此轮上升行情后市有望延续：1）按照新的淡季出口关税政策，国内尿素出口比内销每吨有62元的预期套利空间，随着淡季出口期临近、出口备货增加，将继续推涨国内价格。2）经过产能淘汰，2011年国内尿素有效开工率已超过80%，且今年上半年新投产装置运行不顺，而夏季追肥期即将到来，尿素的供不应求近期将持续。3）今夏电力缺口较大，限电可能成为又一个触尿素涨价的因素。

公司向多元化发展，向新型化肥转型：公司年产尿素180万吨、复合肥150万吨，并围绕煤化工和盐化工发展了一条循环经济产业链，可以根据市场需求的变化灵活调整产品种类和产出，如尿素-三聚氰胺相互调整，获得较好效益。今年是新型肥料获政策支持的关键年，公司在新型肥料领域曾先后与国内科研院所和国外龙头企业巴斯夫合作，研发投产了一批符合农户多方位需求的产品。我们认为公司凭借突出的创新能力和市场敏锐度，将明显受益于新型肥料行业发展的大提速。

公司管理优势突出，品牌营销开始深化。1）规范和人性化是公司管理的两大特色。严格的规章制度处处体现在集团运营和日常工作中，保证了公司始终以高效率运转，资产周转率明显高于同业；良好的培训和激励措施，造就了大批人才，为内生性增长提供源动力。2）借助着新型肥料业务的快速发展，公司的营销理念正由过去的粗放式扩张转向区域精耕细作，通过扶持经销商，使其协同公司一起为农户提供服务，从而保证了渠道的畅通，实现销量和价格的双提升。

盈利预测与估值

根据2012年新投产项目以及明后两年的项目规划，预计2012-2014年收入106.47、116.62、130.61亿元，净利润6.65、8.18、10.21亿元，EPS0.45、0.56、0.70元。给予12年15-16倍PE，目标价6.75-7.20元。

风险

宏观经济波动风险；主要产品市场竞争加剧；新项目进展低于预期。",,国金证券,买入,[None],2012-05-25,,买入,745525,pdf_downloads/2012/2012-05-25/000830-鲁西化工(000830)：向新型化肥转型，品牌营销开始深化.pdf,000830,鲁西化工,鲁西化工(000830)：向新型化肥转型，品牌营销开始深化
