author,content,filename,org_name,original_rating,pdf_link,publish_time,rating_adjust_mark_type,rating_changes,report_id,save_path,stock_code,stock_name,title
张雅容,2026年北美AI基建维持高景气、亚太地区AI发展仍有较大空间。近期，META、谷歌、微软、亚马逊等北美4大云厂商陆续发布财报、披露2026年capex指引。META指引2026年capex1150~1350亿美元、YoY +59~87%；谷歌指引2026年capex1750~1850亿美元、YoY +91~102%；亚马逊指引2026年capex 2000亿美元、YoY +53%；微软2025年自然年capex合计1180亿美元；若假设微软2026年capex同比持平、则4家2026年合计capex有望达6000亿美元以上、同比增长约50%。据中国信通院，亚太地区AI支出预计以28.9%复合增速于2027年达907亿美元。我国十五五规划首次明确“适度超前”进行新基建，据CNNIC，2025年我国建成万卡智算集群42个，智能算力规模超过1590 EFLOPS。新能源业务增长势头强劲，数据中心稳步提升，海外业务有所回升。从行业分类来看，2025年上半年公司新能源、数据中心、智慧电能三大业务板块营收分别为18.52亿元、13.98亿元、4.39亿元，其中新能源业务营收占比从2024年的46.51%提升至49.62%，数据中心业务收入较往年同期有所提高。从业务区域来看，2020-2023年国外主营业务收入呈增长态势，从3.1亿元提升至9.77亿元，2024年虽有所下降，但海外毛利率达39.28%，2025年上半年营收有所回升。坚持产品创新，兆瓦级UPS回应市场需求。科华数据推出MR33系列1.2MWUPS，配合集成化封装设计，实现单机开关管数量减少57%，故障率减少47.2%，为市场提供更可靠的算力基底。同时为应对大模型训练阶段中“脉冲式高过载”现象，科华以高峰均功率比为设计基准，全方位强化过载能力，并且跳出传统场景对动态响应速度提出了更严苛的要求。公司绑定优质客户、积极推进数据中心业务开展。2025年9月，腾讯与科华联合开发的弹性直流一体柜顺利完成1000台交付，该产品已在腾讯多个数据中心投入应用，为高密度算力基础设施提供安全、高效、智能的电力保障。2025年8月，科华数据与壁仞科技、神州数码签署生态合作协议，共同构建“芯片-服务器-数据中心-算力服务”四位一体的产业生态闭环。2025年5月，科华数据与鹏银数据举行战略合作签约仪式，合作重点围绕智能算力基础设施共建、绿色能源创新应用及低碳数据中心解决方案三大方向展开，探索数据中心能效提升路径，重点突破数据中心的能源效率瓶颈。此外，公司也密切关注海外算力市场，尤其是海外大客户及其合作伙伴，并从UPS、HVDC、液冷等核心产品切入，积极推进产品标准认证，加速“出海”战略。投资建议：2026年全球AI基建仍维持高景气、公司坚持产品创新不断开拓优质客户。我们预测公司2025-2027营业收入为92.71/127.03/165.45亿元，归母净利润为5.62/8.30/12.23亿元，对应EPS 1.09/1.61/2.37元。参考可比公司估值给予公司2027年30倍PE估值，给予目标市值366.90亿元，对应目标价71.20元，维持“推荐”评级。风险因素：行业竞争加剧；海外业务开拓不及预期,,华创证券,推荐,[None],2026-02-10,,增持,8410759,pdf_downloads/2026/2026-02-10/002335-科华数据（002335）：跟踪分析报告：算力驱动，数据中心向好发展.pdf,002335,科华数据,科华数据（002335）：跟踪分析报告：算力驱动，数据中心向好发展
"曾朵红,郭亚男","事件：公司25年Q1-3营收57.1亿元，同+5.8%，归母净利润3.4亿元，同+44.7%，扣非净利润3亿元，同+36.9%,毛利率25.1%，同-0.2pct，归母净利率6%，同+1.6pct；其中25年Q3营收19.7亿元，同环比+18.7％/-21.6％，归母净利润1亿元，同环比+711.4%/-42.2％，扣非净利润0.8亿元，同环比+423.4%/-52.9％，毛利率25.3%，同环比-2/+2.7pct，归母净利率5.1%，同环比+4.4/-1.8pct。深度绑定大厂客户、数据中心+智慧电能有望高增。根据我们测算，25年1-9月智慧电能业务营收6.2亿，同比基本持平，毛利率36.6%。智算中心业务营收约23.8亿，占总营收比例41.7%，毛利率约35%。其中1）IDC租赁端：我们预计25年前三季度营收9.4亿元，毛利率20%+；2）产品端：25年前三季度营收14.4亿元，同比+17.37%，毛利率约35%。公司重点服务运营商、互联网大客户、银行金融等客户，其中银行非网点类UPS及其他产品出货量同比增长近一倍、头部互联网大厂业务同比增长80%-90%，公司目标2026年在互联网大厂的收入实现90%-95%的增长。持续加强海外布局、拉动新能源业务逐步复苏。我们预计公司前三季度光储业务收入26.7亿元，同+9.7%，毛利率17.9%，目前公司正加大海外业务拓展，其中美国市场通过ODM方式积极推进；欧洲市场随着欧洲基地完善，出货量同比+100%以上；东南亚生产基地启用，将推动东南亚和中东地区业务的大幅落地，后续将依靠海外增长拉动新能源修复。期间费用稳中有降、合同负债高增后续业绩释放可期。公司25年Q1-3期间费用9.6亿元，同-4%，费用率16.8%，同-1.7pct，其中Q3期间费用3.6亿元，同环比-11.2%/+20.5%，费用率18.2%，同环比-6.1/+6.4pct；25年Q1-3经营性净现金流1.7亿元，同-9.8%，其中Q3经营性净现金流1.9亿元，同环比-38.3%/-417.6%；合同负债4.34亿，较年初增长86.8%，后续业绩释放量级提升。盈利预测与投资评级：考虑到Q3国内大厂数据中心招标因芯片政策波动稍有滞缓，我们下调公司25-27年盈利预测为归母净利润5/9/14(原值为 7/10/14)亿元，同增60%/83%/53%，基于公司仍是国内数据中心核心供应商，海外布局增长可期，维持“买入”评级。风险提示：竞争加剧、数据中心需求不及预期等。",,东吴证券,买入,[None],2025-11-01,,买入,7135216,pdf_downloads/2025/2025-11-01/002335-科华数据（002335）：云基业务未来可期、持续加强出海布局.pdf,002335,科华数据,科华数据（002335）：云基业务未来可期、持续加强出海布局
"陈宁玉,杨雷",备注：股价截止自2025年09月08日收盘价，每股指标按照最新股本数全面摊薄报告摘要公告摘要：（1）公司发布2025年年中报，实现营业收入37.33亿元，同比增长0.06%;归母净利润2.44亿元，同比增长7.94%；扣非归母净利润2.24亿元，同比增长9.22%。2025Q2营收净利环比增长，数据中心产品增长较快。25H1，公司提升运营效率，持续降本增效，实现业务稳健发展。分产品看，IDC服务营收6.13亿元，同比增长0.15%，毛利率20.77%，同比下降5.01个pct。数据中心营收7.84亿元，同比增长34.19%，毛利率36.06%，同比增长0.11个pct。智慧电能业务营收4.39亿元，同比下降22.56%，毛利率36.39%，同比增长1.93个pct。新能源业务营收18.52亿元，同比下降4.22%，毛利率17.51%，同比增长0.63个pct。单季度看，25Q2实现营收25.16亿元，同比下降1.19%，环比增长106.88%。实现归母净利润1.75亿元，同比增长14.82%，环比增长153.26%。25H1，公司销售费率/管理费率/研发费率分别为6.99%/3.17%/5.86%，同比增长0.30/0.15/0.48个pct。AI有望带来数据中心液冷/UPS/HVDC升级换代，公司有望充分受益出海/国产替代机遇。公司持续深化智算业务，紧抓住大型互联网厂商、通信运营商等机遇，实现产品订单快速增长，算力业务不断取得新突破。公司以UPS、HVDC、液冷等为切入点，加速“出海”战略，针对AI场景推出高密度算力POD液冷微模块、数据中心不间断电源UPS产品，并加大关键核心HVDC、SST等研发和新产品应用。液冷方面，公司具备冷板式及浸没式液冷系列产品，算力液冷集装箱已出口海外。WiseCol-LD系列300-600kW液冷CDU，可打造不同应用场景的液冷CDU；适用通算、智算、超算等不同算力需求。此外，公司与沐曦公司推出高密度液冷算力POD，专为高性能GPU服务器集群研发设计。储能需求有望快速增长，公司有望充分受益。公司新能源产品包括光伏逆变器、光伏逆变升压一体机等产品。公司储能产品方案功率范围覆盖3kW-10MW，其新一代460kW液冷簇级管理PCS，可实现“全地域适配、全场景覆盖”，目前公司已服务南方电网、华能等大型央国企或上市公司。海外市场，公司在美国、德国等30多个国家设有营销和服务团队，并助力多个国家工商业储能项目。需求端，国内独立储能有望需求快速增长、海外景气度有望持续高企。EESA预计2025年源网侧储能新增装机量约为132.3GWh，同比增长34%。2025年作为“十四五”规划的收官之年，风光大基地建设有望加速推进，叠加老旧储能电站改造拉动源网侧储能需求同步上涨，因此乐观场景下预计可达到160.2GWh，同比增长62%，公司有望充分受益。投资建议：科华数据是国内UPS龙头厂商，坚持“IDC+新能源”双子星战略，持续发力数据中心、新能源和智慧电能业务。今年上半年因H20缺货等因素，公司业绩或受一定程度影响，但明后年随着国内AI基建加速及储能需求快速增长，公司有望充分受益。我们预计2025-2027年净利润分别为7.27亿/9.79亿/12.68亿元（原25-26年预测值为8.83亿/11.16亿元），EPS分别为1.41元/1.90元/2.46元，维持“买入”评级。风险提示：UPS业务发展不及预期；光伏储能需求不及预期；IDC业务发展不及预期；市场竞争加剧；研报信息更新不及时风险,,中泰证券,买入,[None],2025-09-09,,买入,6412753,pdf_downloads/2025/2025-09-09/002335-科华数据（002335）：Q2业绩符合预期，AIDC电源、液冷取得突破.pdf,002335,科华数据,科华数据（002335）：Q2业绩符合预期，AIDC电源、液冷取得突破
"张建民,邢艺凡",归母净利润同比增长8%，受减值计提不利影响25H1公司实现营收37.33亿元，YOY+0.06%；归母净利润2.44亿元，YOY+7.94%，受计提信用减值损失、资产减值损失合计9800.54万元不利影响；毛利率为25.02%，同比增长0.52pct；销售/管理/研发/财务费用率分别为6.99%/3.17%/5.86%/0.07%，同比分别+0.30pct/+0.15pct/+0.48pct/-0.8pct，财务费用为0.03亿元，同比下降91.84%，主要为可转债利息减少及汇兑收益增加。 其中，25Q2单季营收25.16亿元，YOY-1.19%，归母净利润1.75亿元，YOY+14.81%。数据中心产品快速增长，算力服务有望贡献新弹性25H1公司智算中心行业业务营收13.98亿元，YOY+16.77%，占总营收比重37.44%，毛利率29.35%，同比-1.40pct。其中 IDC 服务和数据中心产品收入分别为6.13/7.84亿元，YOY分别+0.15%/+34.19%，毛利率分别20.77%/36.06%，同比分别-5.01pct/+0.11pct。尽管IDC服务业务毛利率有所下降，但数据中心产品在手订单快速增长，未来智算中心业务有望实现良性发展。数据中心产品加大HVDC、液冷等新技术研发。公司技术产品推陈出新，加大关键核心新技术（HVDC、SST等等）的研发力度及新产品应用；液冷领域与沐曦股份联合推出高密度液冷算力POD，算力液冷集装箱产品已出口海外。数据中心产品连续中标移动、电信、互联网大客户等项目，并持续落地东南亚、中亚、欧洲、北美洲等地区市场。公司将继续大力发展智算业务，依托在电力电子领域的核心技术优势，加大新品研发力度，有望在AI投资浪潮中持续受益。携手国产AI芯片厂商，构建异构算力服务平台。公司积极布局AI、算力、自动驾驶等新兴市场，深化与壁仞科技、燧原科技、沐曦股份、天数智芯、中昊芯英等多家国产头部AI芯片厂商的合作，共同构建异构算力平台。该平台已在高校科研、工业智算、智能驾驶等多个领域实现应用突破，与 “上海教育智算服务平台”、京仪环保提供算力服务，并与小马智行在原有IDC合作基础上拓展新业务。随着算力服务模式的成熟，该业务板块有望为公司开辟新的增长曲线。智慧电能业务稳步增长，盈利能力持续增强25H1公司智慧电能业务实现营收4.39亿元，YOY-22.56%，占总营收比重11.77%；毛利率36.39%，同比提升1.93 pct，盈利能力稳步提升。公司智慧电能业务以高端电源为核心，产品功率范围覆盖0.5kVA-1200kVA，通过打造AI+能源管理解决方案，为交通、工业、金融等行业提供“端到端”的定制化服务。报告期内，公司在“大交通”领域成果显著，成功中标厦门新机场及福州机场二期扩建工程，并为北京、上海等地的29条地铁线路提供服务保障。截至目前，公司已累计护航全国200+条轨交线路、300+条高速公路路段、100+条高铁线路稳定运行。新能源业务收入微降，光储产品创新与全场景应用深化25H1公司新能源业务营收18.52亿元，YOY-4.22%，占总营收比重49.62%；毛利率为17.51%，同比提升0.63 pct。公司持续技术创新，推出了2000V 450kW组串式逆变器和新一代460kW液冷簇级管理PCS等产品，构建了完善的光储产品矩阵。在国内市场，公司构网型储能项目在新疆、宁夏、云南等多地大规模应用，并成功交付了内蒙古阿拉善盟700MW、新疆英吉沙500MW等多个大型光伏项目。在海外，公司依托30多个国家的营销和服务团队，SPI系列光伏逆变器、S³-EStore工商业储能一体机等产品在欧洲、东南亚等市场广受欢迎。,,浙商证券,买入,[None],2025-09-07,,买入,6397591,pdf_downloads/2025/2025-09-07/002335-科华数据（002335）：25年中报点评报告：数据中心产品快速增长，深化出海战略.pdf,002335,科华数据,科华数据（002335）：25年中报点评报告：数据中心产品快速增长，深化出海战略
"赵良毕,曾韬",事件：近日，科华数据发布2025上半年业绩报告，公司实现总营收37.33亿元/+0.06%；实现归母净利润2.44亿元/+7.94%，从2502单季度来看，实现14.81%，环比提升 153.24%。 营收25.16亿元，环比提升 106.88%；实现归母净利润1.75亿元，同比提升三大业务齐发展，算力创新驱动高质量发展，AI+液冷打造智算新生态图。公司以驱动行业数字化、能源低碳化发展为战略目标，推动“智算中心”“智慧电能”“清洁能源”三大业务稳健发展。智算业务方面，E半年收入达13.98亿元/+16.77%，毛利率达29.35%，占公司总收入的37.44%，报告期内，公司推出高密度液冷算力 POD，WiseMDC系列微模块、WiseCol-LD 液冷 CDU等产品，满足AI训练、推理等多样化场景需求。公司数据中心产品连续中标移动、电信等互联网大客户的项目，不仅国内订单不断增加，更持续落地东南亚、中亚、欧洲、北美洲等地区市场，赋能全球用户。在AI大模型领域，公司携手壁仞科技、燧原科技、沐曦股份等多家国内外头部 AI芯片厂商，基于自建智算中心的异构算力平台，实现各类模型在训练及推理侧的高性能、低成本及可用性进一步优化。智慧电能业务方面，上半年智慧电能产品收入4.39亿元，同比下降22.56%，毛利率达36.39%，公司智慧电能业务以高端电源为3核心，在全球榄块化 UPS市场份额居前，可为交通、电力、医疗等行业用户I提供“端到端”和按需定制的全方位解决方案。新能源业务方面，上半年新能源产品收入18.52亿元，毛利率达17.51%，公司持续技术创新，推出了2000V450kW组串式逆变器、460kW液冷簇缓管理 PCS等新能源产品，系统在高海器拔等地区均能保持高效稳定运行，助力行业在降本增效，为用户在高效发电及储能的安全可靠、智慧运维带来优异的价值。目前公司的光伏、储能产品方案功率范围覆盖 3kW-10MW，全面满足各类应用场景的使用需求。总体来说，M公司数据中心行业订单需求向好，新能源光储和智慧能源持续拓展，助力公司未来业绩边际向好。 全力开拓出湃市场，“智算+光储”融合创新，全域生态打造高质量发展。公司发展出海战略提升品牌海外影响力，已在东南亚、中亚、欧洲、北美等地实现数据中心产品交付，推动“AI智慧电能”“液冷”“算力”等业务出海。 算电协同大势所趋，公司已实现数据中心与“光储”的融合，推出数据中心光储解决方案，并通过智慧能源系统，打造“源网荷储”一体化体系。在数智化慧浪潮机遇背景下，高算力需求与高能源消耗紧密相连，公司创新性地提出“绿电+AI+光充储算一体化”理念，通过数据中心和储能双重产品研发、系统集成以及 EPC 全栈式布局等技术优势，巧妙地利用绿电为高耗能的算力提供清洁的能源支持，有望成为全球能源转型与数字经济算力的核心赋能者。 投资建议：伴随着全球算力需求的增长，公司重点发展数据中心在高效、节球能、环保等解决方案方面的技术优势，有望迎来发展新机遇。考虑公司数据中案心产品收入快速增长并取得突破性进展，我们上调公司2025-2027年归母净利润预测值为7.22亿元、10.92 亿元、14.58 亿元，对应EPS为 1.40元、2.12元、2.83元，对应PE为35.70 倍、23.61倍、17.68倍，维持“推荐”评级。 风险提示：IDC行业竞争加剧的风险，业务拓展不及预期的风险，国内外政策波动的风险等。,,银河证券,推荐,[None],2025-09-04,,买入,6395784,pdf_downloads/2025/2025-09-04/002335-科华数据（002335）：算电协同构生态，产品出海拓市场.pdf,002335,科华数据,科华数据（002335）：算电协同构生态，产品出海拓市场
"杨润思,杨凡仪",25Q2业绩超预期，数据中心液冷产品取得突破性进展事件：公司25Q2业绩超预期。公司25H1实现营收37.33亿元，同增0.06%；实现归母净利润2.44亿元，同增7.94%。其中，25Q2单季营收25.16亿元，同增-1.19%，环增106.88%；Q2归母净利润1.75亿元，同增14.81%，环增153.24%。25Q2计提资产减值0.41亿元，信用减值0.47亿元，还原减值影响后25Q2归母净利润约2.63亿元，超预期。数据中心产品收入快速增长，新能源产品收入短期承压。✓ 25H1数据中心行业收入13.98亿元，同比+16.77%，毛利率29.35%，同比-1.4pct。其中，1）数据中心产品收入7.84亿元，同比+34.19%，毛利率36.06%，同比+0.11pct；2）IDC服务收入6.13亿元，同比+0.15%，毛利率20.77%，同比-5.01pct。此外，公司液冷产品取得可观进展，算力液冷集装箱已出口海外，并与沐曦股份联合推出高密度液冷算力POD，预计公司数据中心产品收入持续增长。✓ 25H1智慧电能产品收入4.39亿元，同比-22.56%，毛利率36.39%，同比+1.93pct；25H1新能源产品收入18.52亿元，同比-4.22%，毛利率17.51%，同比+0.63pct。综合毛利率水平结构性提升，期间费率控制良好。✓ 毛利端：25H1公司毛利率同增0.52pct至25.02%，其中25Q2毛利率22.54%，同增1.65pct，环比-7.61pct。高毛利的数据中心产品（25H1毛利率36%）收入快速增长，公司毛利率结构性优化。✓ 费率端：25H1公司销售/管理/研发/财务费率为6.99%/3.17%/5.86%/0.07%，同比+0.3pct/+0.15pct/+0.48pct/-0.8pct。财务费率同比下降主要系转债利息减少及汇兑收益增加。✓ 净利率：25H1公司净利率同比-0.56pct至4.45%，其中25Q2净利率7.04%，同增0.95pct，环比+1.13pct。投资建议：维持“买入”评级。阿里25Q2季度AI+云的资本开支投入达386亿元，同比增幅220%，AIDC建设有望进一步提速。公司Q2业绩超预期，并把出海作为重要发展战略，我们预计科华数据2025-2027年归母净利润分别为7.06/12.00/18.21亿元，同比+124.1%/+70.0%/+51.7%，维持“买入”评级。风险提示：国内数据中心建设需求不及预期、预测偏差和估值风险、海外客户拓展不及预期。,,国盛证券,买入,[None],2025-09-01,,买入,6374235,pdf_downloads/2025/2025-09-01/002335-科华数据（002335）：25Q2业绩超预期，数据中心液冷产品取得突破性进展.pdf,002335,科华数据,科华数据（002335）：25Q2业绩超预期，数据中心液冷产品取得突破性进展
"张建民,邢艺凡",受毛利率下滑及减值计提影响，业绩短期承压24年公司实现营收77.57亿元，YOY-4.71%；归母净利润3.15亿元，YOY-37.90%；毛利率25.20%，同比-2.14pct；计提信用、资产减值损失共计2.58亿元，相比去年同期增加1.16亿元，主要系计提应收账款坏账和存货跌价损失增加；销售/管理/研发/财务费用率分别为7.94%/3.47%/6.51%/0.81%，同比分别-1.13/+0.26/+0.75/-0.09pct，整体费用率稳中有降，同比-0.2pct，研发投入持续加大。截至24年底，公司在建工程4.19亿元，比24年初增长182%，主要为数据中心及厂房建设等投入增加，预计将助力后续公司收入持续增长。25Q1公司实现营收12.16亿元，YOY+2.73%；归母净利润0.69亿元，YOY-6.26%；毛利率为30.14%，同比-2.12pct；销售/管理/研发/财务费用率分别为10.16%/5.06%/9.13%/0.56%，同比分别-0.84/+0.06/+1.11/-0.95pct。数据中心产品快速增长，算力服务有望贡献新弹性24年公司数据中心业务营收31.52亿元，YOY +14.07%，占总营收比重40.63%，同比+6.70pct，毛利率28.77%，同比-1.25 pct；其中 IDC 服务和数据中心产品收入分别为12.31/19.21亿元，YOY分别-4.53%/+30.33%，毛利率分别23.32%/32.25%，同比分别-2.91pct/-1.07pct。数据中心产品及解决方案推陈出新，25年订单快速增长。公司面向AI智算场景，创新性地推出高密度预制化液冷算力POD、300-600KW液冷CDU、功率范围覆盖 300kVA-1200kVA的数据中心UPS、WiseMDC 系列微模块、Wise Power 云动力预制式电力模组等产品及解决方案，连续中标移动、电信等互联网大客户的项目，并持续落地东南亚、中亚、欧洲、北美洲等海外市场。25年至今公司数据中心订单快速增长，随头部互联网大厂25年上半年数据中心招采及建设推进，公司已获取较多订单及份额，预计将于25年下半年完成交付及确收。未来将持续加大智算中心发展力度，聚焦公司在AC/DC、DC/DC电力电子核心技术优势，加大新品研发，有望受益于客户AI投资加大及产品迭代。合作国产头部AI芯片厂商，构建异构算力平台。公司积极布局AI、算力、自动驾驶等新兴市场，携手壁仞科技、燧原科技、沐曦集成、天数智芯、清微智能、希姆计算、墨芯人工智能等多家国产头部AI芯片厂商，基于自建智算中心的异构算力平台，支持适配DeepSeek R1开源大模型。公司已完成北京、上海等多地区算力服务合同的签订，25年3月中标1.5亿元金额的算力项目，配套自研高功率机柜/UPS、液冷POD/微模块等产品，未来算力服务有望成为新业务增长点。智慧电能聚焦大功率产品，毛利率同比提升7pct24年公司智慧电能业务营收9.22亿元， YOY-9.01%，占总营收比重11.88%，毛利率41.06%，同比+6.82 pct，盈利能力显著提升。公司智慧电能业务以高端电源核心，产品功率范围覆盖 0.5kVA-1200kVA，涵盖“大交通”及“大工业”等应用领域，并打造AI+能源管理解决方案，可提供“端到端”和按需定制的全方位解决方案。24年公司在轨交、机场港口、电力、互联网通信、工业、教育及创新等领域均获良好发展，截至25年3月底已累计护航全国200+条轨交线路、300+条高速公路路段、100+条高铁线路稳定运行。新能源稳健发展，海外市场持续突破24年公司新能源业务营收36.08亿元，YOY -15.98%，占总营收比重46.51%，毛利率16.78%，同比-3.94pct。公司推出国内首款1500V 5MW液冷集中式光伏逆变器、S³-EStation 2.0智慧液冷储能系统等创新产品，成功交付全球单体最大的磷酸铁锂构网型储能项目、全球首套原位固态化半固态电池电网侧储能项目、全国单体容量最大的电化学独立储能项目等多个行业标杆项目。,,浙商证券,买入,[None],2025-05-08,,买入,6045751,pdf_downloads/2025/2025-05-08/002335-科华数据（002335）：减值影响业绩，数据中心产品呈现快速增长.pdf,002335,科华数据,科华数据（002335）：减值影响业绩，数据中心产品呈现快速增长
