author,content,filename,org_name,original_rating,pdf_link,publish_time,rating_adjust_mark_type,rating_changes,report_id,save_path,stock_code,stock_name,title
"李平祝,霍辰伊","1.事件:
    公司发布2017年报。2017年公司实现营收23.68亿元,同比增长22.41%;实现归母净利8.21亿元,同比增长5.19%;实现扣非归母净利润7.61亿元,同比增长12.02%。实现EPS0.8825元。10派3。
    我们认为公司归母净利增速低于营收增速主要系疫苗高开、政府补助减少、以及血制品销售费用增加所致。
    其中,2017年第4季度,公司实现营收7.02亿元,同比增长32.85%;实现归母净利2.02亿元,同比增长16.60%;实现扣非归母净利1.91亿元,同比增长26.74%;实现EPS0.2169元。公司第四季度业绩回暖,主要系疫苗进入销售期且去年同期基数较低,以及血制品单季度业绩回暖所致。
    按业务拆分来看,血制品实现营收20.78亿元(+14.52%),其中白蛋白实现营收9.20亿元(+34.99%),静丙实现营收6.77亿元(-7.37%),其他血制品实现营收4.81亿元(+19.59%)。疫苗实现营收2.81亿元,同比增长157.88%。
    财务方面,销售费用同比增加291.13%,新增应收账款同比增加201.22%,主要系血制品营销改革、销售模式调整所致;财务费用同比增加52.87%,主要系利息收入减少所致;研发费用同比增长32.47%,主要系公司推进疫苗和单抗研发所致;营业外收入同比减少83.22%,主要系计入当期损益的政府补助减少所致。
    2.我们的分析与判断
    (一)两票制下血制品全年业绩增速放缓,营销改革持续推进。
    两票制全面推开导致公司血制品全年业绩增速放缓,Q4单季度业绩回暖。由于两票制下流通龙头话语权增强、存货意愿降低,小流通企业库存消化,以及生产企业普遍对终端掌控能力较弱,叠加进口人白和国内企业采浆量提升导致的竞争加剧等原因,报告期内公司血制品业绩增速放缓,全年实现营收20.78亿元(+14.52%),销量同比增长19.17%,生产量同比增长16.23%,库存量同比增长45.82%。拆分来看,人白实现营收9.20亿元,同比增长34.99%;静丙实现营收6.77亿元,同比降低7.37%,我们认为系两票制与学术推广乏力共同导致;八因子、PCC等其他血制品营收4.81亿元,同比增长19.59%。
    公司积极推进血制品营销改革,经营状况持续改善,Q4单季业绩回暖。为应对两票制,公司积极推进血制品营销改革,我们观察到的变化如下:
    (1)销售队伍加快扩充,加强于、三线城市和三甲医院布局。2013至2016年间,公司销售人员始终维持在120-130人,报告期内公司销售团队快速扩张,目前共有销售人员184人(+52%)。通过加大学术推广力度,加强对于、三线城市和三甲医院的销售布局;
    (2)血制品销售费用同环比显著增长。第4季度公司血制品销售费用约3173.86万元,同环比分别增长219.4%和64.7%。
    报告期内公司血制品销售费用约7679.33万元,同比增长241.51%;
    (3)医院终端血制品销售逐步改善。根据PDB数据,报告期内虽然样本医院中公司人白的销售额低于去年,但已展现出逐季好转的趋势,其中第4季度实现营收2045万元,同环比分别增长67%和24.8%。同时,报告期内样本医院中公司静丙实现销售2.37亿元,同比增长25.11%。我们认为样本医院的数据说明公司血制品营销改革已经取得一定的成效;
    (4)应收账款大幅增长。报告期内公司新增应收账款4.89亿元,同比增长201.22%,其中第四季度新增应收账款179.82万元,较去年同期增加1.11亿元,我们判断除疫苗销售导致的应收账款增加外,血制品销售亦对应收账款增加有所贡献:主要系与流通企业结算出现账期(不超过90天),以及加强医院终端开发且其账期较长(不超过9个月)所致。
    血制品日常生产工作稳步推进。
    (1)采浆方面:报告期内公司新获批鲁山县单采血浆站,目前共有24家单采血浆站,均为100%控股,2017年实现采浆约1100吨,而国内企业合计采浆量为8000多吨。
    (2)产能方面:报告期内重庆子公司已取得人免疫球蛋白生产批件并于8月2日通过GMP认证,进一步丰富重庆公司产品线,同时PCC获得临床批件,正开展临床研究。报告期内公司人白批签发235.3万瓶,占国产批签发总量的14%,静丙批签发153.5万瓶,占批签发总量的14%,位居行业前列;八因子、PCC、破免和乙免分别占国内批签发的38%、66%、29%和29%,位居国内行业首位。
    (二)疫苗业务持续开拓国际市场,未来发展前景广阔。
    报告期内疫苗业务继续亏损,主要系连年持续高投入所致。报告期内公司疫苗业务实现营收2.81亿元,同比增长157.88%,主要系高开及去年毒疫苗事件下销售基数较低所致。疫苗子公司实现营收2.85亿元,同比增长148.4%;亏损7688.2万元(-70.4%)。
    我们判断主要系研发持续高投入、以及报告期内存货跌价以及坏账损失所致。从批签发数据来看,公司AC多糖疫苗批签发89.24万人份(-43.8%),流感疫苗(0.5ml规格)批签发499.39万支(+76.3%),流感疫苗(0.25ml规格)批签发231.08万支(+125.6%),乙肝疫苗批签发233.95万支(-33.2%)。
    国际化战略持续推进,未来发展前景广阔。报告期内公司疫苗国际化战略持续推进:
    取得乌克兰的流感疫苗GMP证书和注册证书,取得科特迪瓦流脑疫苗注册证书;共计出口流感疫苗60.7万人份,产品出口至乌克兰、科特迪瓦、柬埔寨(联合国儿童基金会采购)、摩尔多瓦、阿尔巴尼亚和蒙古等多个国家,其中联合国儿童基金会价值3000美元的流感疫苗采购订单,是继2015年6月通过WHO预认证以来联合国相关机构的首次采购。我们认为采购金额虽小,却是对公司疫苗产品质量的肯定,对公司开拓国际市场将起到正面宣传作用。此外,公司疫苗新品研发稳步推进:四价流感疫苗的上市申请进入优先审评名单,有望加快上市;破伤风疫苗已完成临床试验,正处于报产状态;A群C群脑膜炎球菌多糖疫苗已完成生产现场核查和GMP认证工作;H7N9流感疫苗已启动II期临床;冻干AC结合疫苗获批临床。
    (三)单抗研发有序推进。
    报告期内公司共有4个单抗品种进入临床,1个品种申报临床被受理。单抗业务是公司“三轮驱动”发展战略之一。2017年4月底公司公告增资华兰基因,将注册资金有1亿元提升至2亿元,出资比例不变。报告期内华兰基因已完成工商变更登记,我们认为该举措进一步彰显公司发展单抗业务的决心。按研发进度来看,目前曲妥珠单抗、利妥昔单抗、贝伐单抗和阿达木单抗正在有序开展临床研究,德尼单抗于10月申报临床并被受理,帕尼单抗、伊匹单抗正在进行临床前研究,争取尽快申报临床批件。我们看好公司在单抗领域的布局,丰富的在研产品梯队有望贡献业绩弹性。
    3.投资建议。
    作为稳健发展的血液制品龙头企业,公司在行业内具有采浆量领先、吨浆净利润高、产品线完备和管理能力强大等优势。虽然受两票制影响,血制品业绩不及预期,但我们认为业绩增速放缓是行业性的一过性事件。考虑到巨大的需求缺口,销售渠道的逐步疏通以及生产企业对终端掌控能力的加强,行业景气度将逐步恢复,其中龙头企业有望率先恢复高增长。同时,公司的疫苗业务未来将逐渐向好,单抗业务处于加速研发阶段。
    我们预计2018-2020年归母净利润为9.62/11.55/14.23亿元,对应EPS为1.03/1.24/1.53元,对应PE为28/23/18倍。维持“推荐”评级。",,银河证券,推荐,[None],2018-03-30,,买入,2162553,"pdf_downloads/2018/2018-03-30/002007-华兰生物(002007)年报跟踪：Q4业绩回暖,血制品营销改革持续推进.pdf",002007,华兰生物,"华兰生物(002007)年报跟踪：Q4业绩回暖,血制品营销改革持续推进"
"谢长雁,江维娜","17年盈利增速放缓,行业供给端明显滞涨
    公司17年营收23.68亿(+22.41%),归母净利润8.21亿(+5.19%),盈利低于营收增速是由于1)血液制品销售费用率达3.7%(+2.5PCT);2)疫苗低开转高开带来营收大幅增加,但由于销售费用的大幅增加,并未带来利润改善。从批签发来看,17年白蛋白和静丙分别减少7.0%和8.8%,大品种在供给端下滑明显。
    疫苗高开致销售费用大涨,血制品费用亦保持上涨
    17年销售费用为2.68亿(+291%),销售费用率大涨7.8PCT达到11.3%。其中,血制品销售费用率为3.7%(+2.5PCT);疫苗全年销售费用率为67.9%(+25.7%)。故销售费用上升主要由疫苗费用大涨导致,预计18年血制品费用仍会保持上涨势头,但大幅上涨的可能不大。
    四季度业绩回升,存货周转能力持续好转
    我们认为当前消费端高增速与生产端低增速不匹配受渠道库存周期影响,且行业批签发增速断崖式下跌可能加速渠道去库存进程。公司17Q4营收7.02亿,同比增长32.9%,环比增长7.4%;归母净利2.02亿,同比增长16.6%,环比增长7.3%;四季度营收利润均有所回升,且连续两个季度保持增长。另外,公司的存货周转能力Q3和Q4持续好转。另外采浆量增速放缓(+7.3%),预示库存压力减小。
    实控人、证金公司增持显示信心
    实控人17年12月发布1亿元增持计划,现已增持超3000万。另外,年报披露证金公司新进成为公司第五大股东,持股2159万股,占总股本2.32%。实控人和证金公司的增持也显示了他们对公司业绩和股价的信心。
    风险提示
    血制品终端需求受药占比影响、行业安全性事故。
    行业低谷中的血制品龙头,推荐底部“买入”。
    血制品中长期逻辑没有变坏,三大受挫原因均不会持续。未来渠道影响消除后行业整体采浆量增速降低,而龙头将重新回归需求端相对稳健的20%增速中枢。预计华兰生物2018-19年实现净利润10.10/12.72/15.63亿,对应EPS为1.09/1.37/1.68元,对应当前股价PE为26.3/20.9/17.0X。考虑到行业受政策保护且中长期仍属于高增长资源品属性并给予一定确定性溢价,18年31-33X估值,对应合理估值35.3-37.5元,继续推荐底部“买入”。",,国信证券,买入,[None],2018-03-29,,买入,2162818,pdf_downloads/2018/2018-03-29/002007-华兰生物(002007)：冬暖兆春荣.pdf,002007,华兰生物,华兰生物(002007)：冬暖兆春荣
"朱国广,周平","业绩总结:公司2017年实现收入23.7亿(+22%)、归母净利润8.2亿(+5%)、扣非后归母净利润7.6亿(+12%);2017Q4单季度实现收入7.0亿(+33%)、归母净利润2.0亿(+17%)、扣非后归母净利润1.9亿(+27%)。利润分配方案为每10股派发现金红利3元(含税)。
    Q4业绩明显改善,血制品稳定增长。从单季度来看,2017Q4的收入和利润增速有明显提高,经营性现金流为1.4亿达到2017年单季度最高水平。分业务来看,血制品业务实现收入20.8亿(+15%),毛利率提升0.38个百分点。其中白蛋白实现收入9.2亿(+35%)、静丙实现收入6.8亿(-7%)、其他血制品实现收入4.8亿(+20%)。从不同产品的增速来看,血制品由于医生认知程度高能实现快速增长,静丙由于缺少学术推广和医生对其广泛的适应症认识不足,收入出现负增长。疫苗业务实现收入2.8亿(+158%),毛利率提升16.73个百分点,估计与疫苗行业一票制改革高开有关。期间费率提高6.3个百分点至23.17%,主要是销售费率提升幅度较大(提高7.76个百分点至11.30%),主要是因为血制品扩招销售人员,已达到170人左右,推广咨询费提高约4倍至2.3亿,用于加大血制品推广力度。
    血制品医保报销范围扩大,重磅四价流感疫苗有望年内获批上市。2017年版医保目录进一步扩大了血制品的报销范围,白蛋白、静丙、纤原、凝血酶原复合物等产品的使用范围都进一步扩大,如白蛋白报销范围从“限抢救和工伤保险”扩大到“限抢救、重症或因肝硬化、癌症引起胸腹水且白蛋白低于30g/L的患者”。此次医保调整大幅度扩大血制品报销范围,血制品需求或将出现明显增长。且随着血制品企业纷纷启动学术推广,医生对血制品新适应症的认识程度将会扩大,在基层医院的渗透率将逐步提升,促进血制品长期需求增长。公司重磅在研产品四价流感疫苗已进入优先审评,预计下半年能够获批上市,能够对一季度流行的BY毒株实现预防保护,对目前已上市的其他流感疫苗有望形成替代。参照2009年初甲型H1N1全球大流行,Q4华兰疫苗业绩大爆发,我们估计年底四价流感疫苗销量会出现爆发,或将显著增厚公司业绩。
    盈利预测与评级。预计2018-2020年EPS分别为1.06元、1.30元、1.60元,对应PE分别为27倍、22倍、18倍。维持“增持”评级。给予2018年30倍PE,对应目标价31.80元。
    风险提示:血制品行业政策或发生变动的风险;血制品竞争激烈或导致降价的风险;四价流感疫苗获批或销售低于预期的风险。",,西南证券,增持,[None],2018-03-28,,增持,2145422,"pdf_downloads/2018/2018-03-28/002007-华兰生物(002007)：Q4业绩明显改善,四价流感疫苗获批在即.pdf",002007,华兰生物,"华兰生物(002007)：Q4业绩明显改善,四价流感疫苗获批在即"
季序我,"血制品业务调整完毕,销售费用率大幅提高。公司发布2017年报,报告期内共实现营收23.68亿元、同比增长22.41%,扣非后归母净利润7.61亿元、同比增长12.02%,对应EPS0.88元,符合预期;从分季度数据来看,公司第3-4季度分别实现营收6.53亿元和7.02亿元,环比增长37.47%和7.50%。我们认为,公司血液制品业务上半年受到两票制及竞争环境变化的影响,下半年恢复情况良好。费用方面,管理费用率有所降低,下降1.97pp至12.18%;销售费用率受到推广费用增加的影响大幅增加,费用率从3.54%增加至11.30%。
    采浆量保持稳定,血制品业务前景良好。公司17年采浆量达到1100吨左右,同比增长约10%。目前,公司共有24个浆站,其中14-15年新设了9个浆站(包括分站)。随着新设浆站的成熟,未来2-3年采浆量有望稳步提升。公司血制品市占率较高,市场前景较好。报告期内,人血白蛋白占国产批签发量的14%、静注丙球占国内批签发量的14%、人凝血因子Ⅷ和人凝血酶复合物分别占国内批签发量的38%和66%。
    “血制品+单抗+疫苗”布局扎实推进。报告期内,公司疫苗和单抗业务各有进展。疫苗方面,完成了吸附破伤风疫苗和四价流感疫苗的III期临床,H7N9流感疫苗进入II期临床,A群C群脑膜炎球菌多糖结合疫苗获批临床,取得A群C群脑膜炎球菌多糖疫苗生产批件。单抗方面,华兰基因于17年10月收到重组抗RANKL单抗的药品注册申请受理通知书。另外,公司阿达木单抗、曲妥珠单抗、贝伐单抗和利妥昔单抗等4种单抗都已进入临床阶段。
    财务预测与投资建议
    根据公司年报,我们将2018-2020年归母净利润预测调整为9.88/11.65/13.87亿元(原预测18-19年为9.41/10.87亿元),对应EPS1.06/1.25/1.49元,参考可比公司平均估值给予公司18年37倍PE,对应目标价39.22元,维持“买入”评级。
    风险提示
    如果公司血制品销售进展不及预期,将会对公司业绩产生较大影响。",,东方证券,买入,[None],2018-03-28,,买入,2145589,"pdf_downloads/2018/2018-03-28/002007-华兰生物(002007)：血制品业务调整完成,疫苗恢复良好.pdf",002007,华兰生物,"华兰生物(002007)：血制品业务调整完成,疫苗恢复良好"
陈博,"事件：近日，公司公告了 2017 年财报。
投资要点：
 营收保持快速增长，费用增加拖累利润，Q4 业绩好转。2017 年，公
司实现营业收入 23.68 亿元，同比增长 22.41%；实现归母净利润 8.21
亿元，同比增长 5.19；实现扣非归母净利润 7.61亿元，同比增长 12.02%，
EPS 为 0.88 元。公司营收增速与净利润增速差距较大，主要是因为销
售费用大幅增长拖累利润水平。公司销售费用率为 11.3%，同比上升
7.76 个百分点，主要是因为公司血制品业务以及疫苗业务的推广咨询
费大幅上涨。预计 2018 年公司销售费用仍有上升的趋势。2017Q4 公
司营收同比增长 32.85%，归母净利润同比增长 16.60%，相比于前两个
季度，公司业绩呈现回暖态势。
 白蛋白保持快速增长，静丙销量下滑。公司全年采浆量约 1100 吨，同
比增长约 7%，采浆量增速放缓。分产品看，公司人血白蛋白实现收入
9.20 亿元，同比增长 34.99%，毛利率 59.19%，同比上升 0.63 个百分
点；静注丙球实现收入 6.77 亿元，同比下降 7.37%，毛利率 63.48%，
同比上升 1.91 百分点。估算白蛋白销量增长 40%以上，静丙销量下滑，
医院对静丙的认知度不足，还有待提高。其他血液制品（包括人凝血
因子 VIII、人凝血酶原复合物等）4.81 亿元，同比增长 19.59%。目前，
公司人血白蛋白占国内批签发量的 14%、静注人免疫球蛋白占国内批
签发量的 14%、人凝血因子 VIII 占国内批签发量的 38%、人凝血酶原
复合物占国内批签发量的 66%、破伤风人免疫球蛋白占国内批签发量
的 29%、乙型肝炎人免疫球蛋白占国内批签发量的 29%，均居国内同
行业首位。未来，公司将加大学术推广力度，加强销售队伍建设，加
强对二、三线城市和三级甲等医院的销售布局等措施做好血液制品的
销售工作。
 疫苗业务仍亏损，加强疫苗研发，积极开拓国际市场。2017 年，公司
疫苗业务实现收入 2.81 亿元，同比增长 157.88%。收入的大幅增长主
要由于低开转高开所致，公司主打产品流感疫苗销量有较大幅度的增
长，但主要属于山东疫苗事件之后的恢复性增长，还未达到之前的销
量水平，疫苗公司亏损约 7600 万元。2017 年，疫苗公司研制的 A 群
C 群脑膜炎球菌多糖结合疫苗获批开展临床试验；启动 H7N9 流感疫
苗 II 期临床研究；完成了吸附破伤风疫苗和四价流感疫苗的 III 期临床 试验，并提交了申报生产的注册资料。同时，公司加强疫苗出口注册
与销售，积极开拓国际市场：疫苗公司取得乌克兰的流感疫苗 GMP
证书和注册证书，取得科特迪瓦流脑疫苗注册证书；共计出口流感疫
苗 60.7 万人份，产品出口至乌克兰、科特迪瓦、柬埔寨（联合国儿童
基金会采购）、摩尔多瓦、阿尔巴尼亚和蒙古等多个国家。
 盈利预测。预计公司 2018-2019 年 EPS 分别为 1.02 元、1.27 元，对应
目前股价 PE 为 29.36 倍、23.68 倍。我国血液制品行业具有极高的行
业壁垒，2001 年起不再新批血液制品企业，随着行业不断整合及行业
集中度的提升，未来将出现强者恒强的格局，公司作为行业龙头企业，
未来有望扩大市场份额。参考行业可比公司估值水平，给予公司 2018
年 32-34 倍 PE，合理区间为 32.64-34.68 元，维持“谨慎推荐”评级。
 风险提示：血液制品降价风险；进口人血白蛋白市场份额持续加大风
险。",,财信证券,谨慎推荐,[None],2018-03-27,,增持,3627415,pdf_downloads/2018/2018-03-27/002007-华兰生物（002007）：血制品业绩回暖，费用大幅提升.pdf,002007,华兰生物,华兰生物（002007）：血制品业绩回暖，费用大幅提升
江琦,"点评:白蛋白和小制品保持较快增长,静丙略有下滑,采浆量小幅增长,行业底部、静待变化。2017年度公司实现营业收入和归母净利润增速分别为22.41%和5.19%,利润增速慢于销售增速的原因主要是疫苗产品高开和血制品销售投入导致。2017年实现采浆近1100吨,增速大约为6%-7%。分产品看,血制品业务占收入和毛利比重接近90%,其中白蛋白收入9.2亿、增长34.99%,静丙收入6.77亿、下滑7.37%,其他血制品4.81亿、增长19.59%。
    疫苗业务实现收入2.81亿,同比增长157.88%,主要是由于疫苗一票制导致出厂价提高。分季度看,2017年年中是销售最低点,下半年随着销售队伍的建设工作逐步展开及经销商逐步稳定,业绩呈现逐步回暖的态势。华兰2017年下半年已在积极调整销售策略,加大学术推广力度,加强销售队伍建设。
    白蛋白和静丙批签发量略有下降,小制品增长。2017年白蛋白批签发约239.72万瓶,减少约18万瓶,在国产白蛋白中占比约14-15%。静丙批签发153.45万瓶,减少约14.85万瓶,行业占比约14-15%。乙免批签发39.97万支,凝血因子Ⅷ批签发51.21万支,纤原批签发7.05万瓶,凝血酶原复合物批签发65.33万瓶,破免批签发125.61万瓶,狂免批签发46.97万瓶。2017年公司凝血因子Ⅷ和人凝血酶原复合物的市场占有率继续保持行业第一。
    疫苗业务稳定,即将上市的四价流感和狂犬有望快速丰富产品线。公司主要有3种疫苗产品在售,包括三价流感裂解疫苗、ACYW135流脑多糖疫苗和重组乙肝疫苗。2017年三价流感裂解疫苗批签发614.93万支,ACYW135流脑多糖疫苗批签发89.24万瓶,重组乙肝疫苗批签发116.98万瓶。公司在研产品中包括四价流感疫苗、冻干人用狂犬病疫苗(Vero细胞)等多个大品种处于申报生产阶段,预计有望于2018年获批上市,快速丰富公司疫苗产品线。
    基因公司4大单抗品类均进入临床Ⅰ期,更有多个产品处于前期研发中。2017年持股40%的华兰基因工程有限公司研发的曲妥珠单抗、利妥昔单抗、贝伐珠单抗、阿达木单抗均顺利进入临床Ⅰ期,临床试验患者招募有序推进;同时重组抗RANKL全人源单克隆抗体注射液(德尼单抗)顺利取得临床试验批件,帕尼单抗、伊匹单抗的前期研发工作也在加快推进中。我们认为,公司在单抗领域布局曲妥珠等多个大品类研发管线为公司长期发展提供坚实的基础,2020年后公司单抗业务或将进入收获期。
    盈利预测与投资建议:我们预计2018-2020年公司营业收入为28.21、33.81、41.04亿元,同比增长19.16%、19.81%、21.41%,归属母公司净利润9.53、11.69、14.40亿元,同比增长16.14%、22.63%、23.13%,对应EPS为1.02、1.26、1.55元。公司是血制品企业中产品线最为丰富的龙头之一,3年内新开浆站达到9个,采浆量增长的可持续性强,目前已在组建血制品销售队伍;同时在单抗和疫苗领域布局多品种、目前已取得一定进展,打造长期业绩发展基石,维持“增持”评级。
    风险提示:血制品业务销售渠道改革不及预期的风险,采浆量不及预期的风险,疫苗业务品种较为单一的风险,单抗业务研发进度不及预期的风险。",,中泰证券,增持,[None],2018-03-27,,增持,2145076,"pdf_downloads/2018/2018-03-27/002007-华兰生物(002007)：血制品销售稳定,关注后续四价流感疫苗.pdf",002007,华兰生物,"华兰生物(002007)：血制品销售稳定,关注后续四价流感疫苗"
李敬雷,"四季度表现回升:四季度单季度实现收入7.2亿,同比增长33%,实现归母净利润2.0亿元,同比增长16.6%,单季度表现企稳回升,我们认为公司已经逐步适应行业环境在2016-2017年的剧烈变化,企稳恢复趋势有望延续。
    营运周转逐步改善:公司全年经营性现金流净额1.77亿元,相比二三季报有大幅改善,同样印证公司恢复迹象。公司存货和应收账款相比三季度基本持平,结束上升趋势,营运能力改善明显。
    血制品业务依然保持行业前列:公司2017年血制品批签发量继续维持国内前列,人白批签发占国内总量14%,静丙占14%,Ⅷ因子占38%,人凝血酶原复合物占66%,破免占29%,乙免占29%,公司血制品业务总量大、品种全、综合利用率高的优势依然保持。
    毛利稳定但费用上升明显:公司2017年血制品毛利率61.54%,同比上升0.38%,疫苗毛利率69.53%,同比上升16.7%,公司整体毛利率水平稳中略升,但销售费用上升明显,达2.68亿,这一变动系行业整体景气度变化导致,也表明公司在销售和市场端已经做出了大刀阔斧的调整。
    积极投入研发储备未来潜力:2017年全年研发投入达到1.31亿元,公司将进一步加快重组人凝血因子VIII、重组人凝血因子IX等基因工程药物的研发工作以及新一代静注人免疫球蛋白开发,此外疫苗新品种和单抗重磅品种的研发也在不断推进之中。
    盈利预测与投资建议
    我们预计公司将不断修复增长动力,业绩稳定回升,2018-2020年EPS分别为1.05、1.27、1.54元,同比增长21%、20%、22%。
    维持“增持”评级。
    风险提示
    血液制品的周期属性被认识导致行业估值调整;销售费用的增长;血制品价格下行风险;两票制落地范围扩张,对渠道冲击加深。",,国金证券,增持,[None],2018-03-27,,增持,2163065,"pdf_downloads/2018/2018-03-27/002007-华兰生物(002007)：血制品业务恢复,费用有所上升.pdf",002007,华兰生物,"华兰生物(002007)：血制品业务恢复,费用有所上升"
