author,content,filename,org_name,original_rating,pdf_link,publish_time,rating_adjust_mark_type,rating_changes,report_id,save_path,stock_code,stock_name,title
黄星,璞泰来(603659)报告关键要素:根据中国汽车动力电池产业创新联盟统计，1-3月，我国动力电池累计产量130.0GWh，累计同比增长26.3%。公司作为负极材料龙头，23年一季度营收达到36.99亿元，同比增长18.16%；实现归母净利润7.02亿元，同比增长10.26%，盈利能力保持优异。投资要点:锂电需求不断增长，各业务表现亮眼：2022年全年公司实现主营业务收入154.17亿元，比上年同期增长71.82%；实现归属于上市公司股东的净利润31.04亿元，比上年同期上升77.53%；实现归属于上市公司股东的扣非净利润为29.59亿元，比上年同期上升78.25%。公司涂覆隔膜加工量达到43.38亿平，占同期国内湿法隔膜出货量的44.31%，较上年同期提升9.12%，市场占有率继续大幅提升，规模经济性不断呈现。锂电设备实现营业收入24亿，同比增长75.55%。受价格回落影响，产品盈利小幅下滑：4月15日，公司发布2023年第一季度报告，Q1公司营收达到36.99亿元，同比增长18.16%；归母净利润7.02亿元，同比增长10.26%；扣非归母净利润达到6.78亿元，同比增长10.64%；受石墨化加工成本回落和高成本库存影响，2023年Q1公司盈利能力有所下滑，Q1毛利率为34.30%，同比-4.43pct；2023Q1净利率为21.22%，同比-0.75pct。2023年一季度，韩系客户占比和欧洲客户占比较去年有明显回升，鉴于海外客户产品定位毛利率较为稳定，公司负极材料客户格局会继续保持多元化，整体产品以中高端为主，享受技术溢价。产能一体化扩张，推动降本增效：据高工锂电不完全统计，2022年负极材料投扩产项目达到34起。随着产能集中释放，无差异化产品优势、研发技术优势和生产要素成本优势的劣势产能将面临淘汰，未来负极行业仍可能存在有效供给不足的情形。在负极材料方面，公司已经形成年产15万吨以上的负极材料有效产能，其中包括11万吨石墨化加工及10万吨碳化加工配套产能，力争在2025年实现25万吨负极材料有效产能。在基膜涂覆隔膜方面，公司已经形成年产5亿平基膜、2万吨纳米氧化铝及勃姆石、0.6万吨PVDF及60亿平涂覆隔膜加工的有效产能。公司计划总投资20亿元投资复合集流体研发生产基地，年产1.6万吨复合铜箔，预计6-12个月建成投产。盈利预测与投资建议：预计公司23-25年实现营业收入224.01/298.16/360.97亿，净利润42.23/56.11/64.27亿元，EPS分别为3.04/4.03/4.62元/股，基于公司在动力电池高端负极领域的龙头地位，我们维持增持评级。风险因素：新能源汽车销量不及预期；新建产能投产时间不及预期；新产品研发失败风险,,万联证券,增持,[None],2023-04-19,,增持,5179961,pdf_downloads/2023/2023-04-19/603659-璞泰来（603659）点评报告：需求持续增长，负极龙头产能持续扩张.pdf,603659,璞泰来,璞泰来（603659）点评报告：需求持续增长，负极龙头产能持续扩张
王蔚祺,2022年公司盈利31.04亿元，同比增长78%。公司2022年营收154.64亿，同比增长71.9%，归母净利润31.04亿元，同比增长77.5%；全年毛利率为35.7%，同比持平，净利率21.5%，同比增加1.7pct；2022Q4/2023Q1实现营收40.50/36.99亿元，同比+50%/+18.2%，环比-10.4%/-8.7%；2022Q4/2023Q1实现归母净利润8.31/7.02亿元，同比+60.5%/+10.3%，环比-5.3%/-15.5%；2022Q4/2023Q1分别实现毛利率33.6%/34.3%，净利率21.5%/21.2%。负极出货量保持高增。公司22年负极产能达到15万吨以上，累计出货13.95万吨，同比增长43%，我们估计2022年负极(含石墨化)单吨净利约1.1万元；2023Q1负极出货量约3.2万吨，(含石墨化)单吨净利约0.8万元；展望2023全年，我们预计公司全年负极出货约18万吨，负极全年平均（含石墨化）单吨净利有望保持在0.6万元以上。涂覆膜扩产加速，一体化布局持续推进。公司2022年涂覆膜出货43.38亿平，单平净利超过0.2元；2023Q1估计出货约10亿平，单平净利约0.22元；展望2023全年，我们预计公司涂覆膜出货约60亿平。22年底公司已形成5亿平基膜，2万吨纳米氧化铝及勃姆石，0.6万吨PVDF（东阳光）及61亿平涂覆隔膜加工的有效产能，在一体化布局深入推进下，预计公司将持续保持涂覆膜盈利能力，我们预计23年涂覆膜单平净利保持在0.2元以上。多项业务全面开花。锂电设备业务方面，公司截止2022年底尚未履约的在手订单约41.8亿元，2023年全年预计锂电设备收入超过30亿元。同时，公司广泛布局多项业务，预计PAA、铝塑膜、PVDF、光伏设备、复合集流体等将为公司积极贡献盈利。风险提示：下游需求不及预期；投产进度不及预期；原料价格下跌超预期。投资建议：下调盈利预测，维持“增持”评级。基于负极行业供需关系扭转，行业竞争加剧，我们下修原有盈利预测，预计2023-2025年实现归母净利润分别为33.01/37.13/41.10亿元（原预测2023/2024年为42.39/56.95亿元），同比增速分别为6.3%/12.5%/10.7%，摊薄EPS分别为2.38/2.67/2.96元，当前股价对应PE分别为22.3/19.8/17.9倍，维持“增持”评级。,,国信证券,增持,[None],2023-04-17,,增持,5177380,pdf_downloads/2023/2023-04-17/603659-璞泰来（603659）：覆膜一体化布局持续推进，深入打造锂电平台型公司.pdf,603659,璞泰来,璞泰来（603659）：覆膜一体化布局持续推进，深入打造锂电平台型公司
"张文臣,顾华昊",事件：公司发布2023年一季报。2023Q1公司营收36.99亿元、同比增长18.2%、环比下滑8.7%；扣非后归母净利润6.78亿元，同比增长10.6%、环比下滑15.5%。各项财务指标保持优秀。公司23Q1收入和扣非后归母净利润实现双位数增长。截至一季度末，公司货币资金54.81亿元；应收账款和应收票据32.55亿元、同比增长32%、环比下滑24%；合同负债54.70亿元、同比增长97.3%、环比增长14.1%，公司在手订单大幅增加。现金流方面，公司23Q1经营活动产生的现金流净额-4.95亿元，同比下滑258.26%，主要系锂电池行业国内客户付款以银行票据结算为主，若合并计算报告期经营性票据流和经营性现金流，则合并计算的净额为正数，且同口径下同比上升。单季度盈利持续较高水平。23Q1毛利率34.3%，同比下滑4.43pct，环比上升0.68pct；扣非净利润率18.33%，同比下滑1.25pct，环比下滑0.85pct。期间费用率5.94%，同比下滑0.18pct，环比上升1.71pct；研发费用2.02亿元、同比增长16.5%，继续保持较高的研发投入。推进复合集流体业务的研发及相关产业化。公司自2017年开展复合集流体业务的研发布局，目前其复合铜箔的工艺技术方案已获得国内头部客户的认可。今年4月，公司新设江苏卓立，投资建设复合集流体研发生产基地一期年产1.6万吨复合铜箔项目，计划通过自筹资金投资约20亿元，项目建设期6~12个月。负极材料方面持续扩产。22年底公司拥有年产15万吨+有效产能，其中包括11万吨石墨化加工及10万吨碳化加工配套产能。目前，四川紫宸一期10万吨一体化负极项目陆续进入设备安装和调试阶段，预计2023年下半年投产。涂覆材料及粘结剂业务规模快速增长。涂覆加工方面，江苏卓高、宁德卓高22年底完成扩产，广东卓高预计2023年末逐步投产。基膜方面，四川卓勤一期4亿㎡基膜涂覆一体化项目设备安装调试已经完成，其隔膜产品正处于产品认证和逐步批量出货阶段，二期项目已经启动设备采购。涂覆粘结剂方面，新建2万吨PVDF项目正在施工建设，其中一期1万吨PVDF有望在2023Q2建成投产。2022年底公司已形成年产5亿㎡基膜、2万吨纳米氧化铝及勃姆石、0.6万吨PVDF及60亿㎡涂覆隔膜加工的有效产能。投资建议：公司是锂电材料的综合供应商，涵盖了负极、隔膜、铜箔和PVDF等业务，与头部企业保持非常好的合作关系，并加大对新型集流体的投入。公司持续进行一体化投入，提高单位盈利能力。我们预计公司2023-2025年归母净利润分别为40.56亿元、52.69亿元和65.41亿元，对应的PE分别是17.9、13.7、11.1倍，维持“买入-B”评级。风险提示：新能源汽车销量不及预期；上游资源价格继续大幅上涨；公司新建产线投产不及预期等。,,华金证券,买入-B,[None],2023-04-16,,买入,5175887,pdf_downloads/2023/2023-04-16/603659-璞泰来（603659）：财务指标优秀，业绩持续增长.pdf,603659,璞泰来,璞泰来（603659）：财务指标优秀，业绩持续增长
"邓永康,李孝鹏,赵丹,席子屹","事件说明。2023年4月14日，公司发布2023年第一季度报告。营收和净利：公司23年Q1实现营收36.99亿元,同比+18.16%，环比-8.67%，归母净利润为7.02亿元，同比+10.26%，环比-15.54%，扣非后归母净利润为6.78亿元，同比+10.64%，环比-12.72%。毛利率：2023Q1毛利率为34.30%，同比-4.43pcts，环比+0.68pct。净利率：2023Q1净利率为21.22%，同比-0.75pct，环比-0.41pct。费用率：公司2023Q1期间费用率为11.40%，同比-0.26pct，其中销售、管理、研发、财务费用率分别为1.52%、3.59%、5.45%、0.83%，同比变动-0.35 pct、-0.78 pct、-0.08 pct和0.95 pct。聚焦高端市场，负极吨净利超预期。分季度看，2023年Q1公司负极出货3.2-3.4万吨，我们测算吨净利约0.9万/吨，公司吨净利行业领先的主要原因是公司产品定位高端，且海外占比较高，受集采影响较小。看全年，截至2022年底，公司具备负极有效产能15万吨，以及11万吨石墨化和10万吨碳化产能。随公司四川10万吨负极一体化项目建成投产，我们预计23年全年出货20-25万吨，吨净利仍维持高位。基膜自供率提升，打造隔膜涂覆加工生态圈。分季度看，2023年Q1隔膜涂覆出货约10亿平，单平净利约0.2元/平。看全年，我们预计公司涂覆加工出货60-70亿平，基膜出货4-5亿平，基膜自供比例提升有望维持隔膜涂覆单平盈利，预计全年单平盈利保持在0.2元/平，全年利润贡献12-13亿。公司出资2000万元与安徽利科合资设立子公司浙江利科，有助于共同推动生物基芳纶涂布工艺产，布局研发新型芳纶涂覆工艺和产品。复合集流体有望23年中量产，持续创造新的产品布局。公司复合铜箔的工艺技术方案已获得国内头部客户的认可。公司投资20亿设立江苏卓立负责复合铜铝箔集流体材料的研发、量产及相关产业化，预计建成后产能达到年产1.6万吨复合铜箔，有利于公司率先完成复合铜铝箔产品开发、认证、市场推广及产线建设工作。粘合剂产能扩张，锂电设备订单量丰厚。PVDF：公司正推进2万吨+4.5万吨R142b的产能扩建项目，公司预计Q2将有1万吨PVDF及1.8万吨R142b产能建成投产。锂电设备：在手订单充沛，截至2022年底，公司仍有尚未履约订单金额41.8亿元。投资建议：我们预计公司2023-2025年实现营收247.69、338.92、401.31亿元，同比增长60.2%、36.8%、18.4%，归母净利润为40.75、54.68、67.06亿元，同比增长31.3%、34.2%、22.7%，对应4月14日收盘价，PE为18、13、11倍，维持“推荐”评级。风险提示：终端新能源车销量不及预期；竞争加剧影响公司盈利性。",,民生证券,推荐,[None],2023-04-16,,增持,5175869,pdf_downloads/2023/2023-04-16/603659-璞泰来（603659）2023 年一季报点评：业绩符合预期，锂电平台化公司多曲线生长.pdf,603659,璞泰来,璞泰来（603659）2023 年一季报点评：业绩符合预期，锂电平台化公司多曲线生长
"曾朵红,阮巧燕,岳斯瑶",投资要点2023年Q1公司实现归母净利润7.02亿元，同比增长10.26%，符合市场预期。2023年Q1公司实现营收36.99亿元，同比增加18.16％，环比下降8.67%；归母净利润7.02亿元，同比增长10.26%，环比下降15.54％，扣非归母净利润6.78亿元，同比增长10.64%，环比下降12.72%。盈利能力方面，Q1毛利率为34.3%，同比下降4.43pct，环比增长0.68pct；归母净利率18.98%，同比下降1.36pct，环比下降1.54pct；Q1扣非净利率18.33%，同比下降1.25pct，环比下降0.85pct。Q1负极出货环降约30%，整体盈利仍远超行业。我们预计23Q1公司负极出货3万吨+，环降30%左右，我们预计公司23年负极出货20万吨+，同增50%。盈利方面，我们预计23Q1负极单吨净利近0.9万元/吨（含石墨化），环比22Q4微降，受降价及部分高价库存影响。目前石墨化价格基本跌至近底部1.2-1.5万元/吨，负极重新议价，但公司主打高端产品，享受技术溢价，叠加23年石墨化自供比例有望提升至80%+，我们预计单吨净利可维持0.8-0.9万元/吨左右，仍明显好于行业，其中23Q1受高价石墨化库存影响，我们预计盈利触底，低点将现。涂覆膜出货高增长，23年基膜预计开始贡献利润。我们预计23Q1涂覆出货10亿平左右，环降近30%，我们预计23年有望出货60亿平+，同增50%；盈利方面，我们测算23Q1隔膜涂覆单平净利0.2元/平+，环比微增，23年全年单平净利我们预计可维持。此外公司四川卓勤4亿平基涂一体化投产，23年我们预计基膜出货4-5亿平，开始贡献利润。其他业务多点开花，复合集流体预计23年实现量产。公司PVDF业务23Q1我们预计贡献归母净利0.8-0.9亿元左右，我们预计23年PVDF和勃姆石业务将维持稳健增长。我们预计锂电设备业务23Q1贡献约0.8亿元利润，全年预计贡献4-5亿元左右利润，此外，公司铝塑膜、氧化铝等业务23Q1均贡献部分利润。公司研制的复合集流体获得多项发明专利和实用新型专利，中试产品获得客户的认可，我们预计2023年底前实现一定规模的量产。公司广泛与科研单位合作，期间合作的生物基芳纶涂层材料经批量验证可行，正积极推动合作单位进行批量生产。盈利预测与投资评级：考虑到负极行业竞争加剧，我们维持公司23-25年归母净利预期为40.13/52.43/69.47亿元，同增29%/31%/32%，对应PE为18/14/10X，考虑公司为负极行业龙头，给予23年30x，目标价86.7元，维持“买入”评级。风险提示：销量不及预期，盈利水平不及预期,,东吴证券,买入,[None],2023-04-15,,买入,5175053,pdf_downloads/2023/2023-04-15/603659-璞泰来（603659）2023年一季报点评：受降价影响单位盈利下滑，业绩符合市场预期.pdf,603659,璞泰来,璞泰来（603659）2023年一季报点评：受降价影响单位盈利下滑，业绩符合市场预期
"申建国,边文姣","负极外销占比提升，23Q1业绩超预期23Q1公司实现收入36.99亿元，同环比+18.16%/-8.67%，归母净利润7.02亿元，同环比+10.26%/-15.52%，超过我们此前预期的5.79亿元，我们推测主要系高盈利能力的负极外销占比提升，扣非净利润6.78亿元，同环比+10.62%/-12.74%。23Q1受下游去库、价格下降影响，收入同比增速放缓，盈利能力同比下降。考虑负极价格后续仍承压，我们维持盈利预测，预计公司23-25年EPS分别为2.76/3.63/4.58元。参考可比公司23年Wind一致预期平均PE 14倍，考虑公司负极产品偏高端，盈利能力稳定性较强，给予公司23年合理PE 20倍，对应目标价55.14元，维持“增持”评级。23Q1收入与归母同比保持增长，盈利能力同比下降23Q1公司实现收入36.99亿元，同环比+18.16%/-8.67%，归母净利润7.02亿元，同环比+10.26%/-15.52%。23Q1公司实现销售毛利率34.30%，同环比-4.43pct/+0.69pct，扣非净利率18.33%，同环比-1.25pct/-0.86pct。公司收入同比增长放缓，我们推测主要系Q1下游客户去库存导致负极与涂覆隔膜需求较弱；Q1盈利能力同比下降但好于我们此前预期，我们推测主要系国内负极产品降价，但由于外销占比提升减缓盈利能力降幅。Q1期间费用率11.40%，同环比-0.26pct/+0.24pct。投资建设年产1.6万吨复合铜箔项目，完善平台化布局4月3日，公司公告拟通过设立全资子公司江苏卓立,推进复合铜铝箔集流体材料的研发/量产,并投资建设复合集流体研发生产基地，一期复合铜箔项目年产1.6万吨，总投资约20亿元，公司预计6-12个月建成全部投产。公司自17年便逐步开展对复合集流体的研发布局，子公司嘉拓具备自主设计开发核心设备能力，铝塑膜业务积累了复合材料生产经验，公司技术路线新颖，单位投资优势明显。目前公司复合铜箔的工艺技术方案已获得国内头部客户的认可，有望为公司盈利带来新的增量。负极与涂覆隔膜业务加速扩产，基膜、PVDF等新业务贡献增量公司四川邛崃一体化一期10万吨项目我们预计今年下半年投产，我们预计23年负极有望实现出货20万吨以上。隔膜方面，公司深耕涂覆隔膜多年，成本优势明显，我们预计今年出货约60亿平；四川基膜项目共规划20亿平产能，一期4亿平已完成设备安装调试，今年有望实现量产出货，将与涂覆业务形成协同。随着PVDF+配套原料R142b顺利扩产，公司有望实现涂覆加工的产业闭环，预计23年PVDF业务成为公司新的盈利增长点。风险提示：负极材料石墨化价格不及预期，负极材料需求量不及预期；公司项目投产进度不及预期；PVDF与锂电设备业务业绩存在不确定因素。",,华泰证券,增持,[None],2023-04-14,,增持,5175230,pdf_downloads/2023/2023-04-14/603659-璞泰来（603659）：受益于外销比例提升，业绩超预期.pdf,603659,璞泰来,璞泰来（603659）：受益于外销比例提升，业绩超预期
周旭辉,"璞泰来(603659)【事项】2023年4月4日，公司发布公告，拟设立全资子公司江苏卓立，负责复合集流体产业化，并投资20亿元建设复合集流体研发生产基地，产能规模1.6万吨/年复合铜箔，建设周期6-12个月。【评论】复合集流体量产前夜，市场前景广阔。复合集流体性能优良，以复合铜箔为例，复合铜箔较传统铜箔节省材料成本近40%，质量减少60%，能量密度提升5-10%，同时复合集流体刺穿不起火特性能显著提高电池安全性，备受业内关注与欢迎。上游原材料企业（双星新材、康辉新材等基膜厂商）、装备企业（腾胜科技、汇成真空等），中游复合集流体企业（金美新材料、诺德股份等）近几年大力投入，基本打通复合集流体核心工艺，为产业化奠定基础。下游电池厂商也纷纷展开布局，宁德时代、蜂巢能源、国轩高科等已研发复合集流体电子/化学相关装置、滚焊技术及设备等。天能电池两轮车领域的新一代锰铁锂电池TP-MAX也将采用复合集流体。终端车厂方面，广汽埃安宣布采用复合集流体的弹匣电池2.0将搭载于旗下超跑hyper。复合集流体已进入爆发前夜，2023-2024年有望批量商业化应用。根据GGII，2025年国内复合集流体市场规模有望突破290亿元，市场潜力巨大。涂覆隔膜产业化布局已成，技术&amp;客户优势带动新业务发展。公司已形成包括隔膜基膜、PVDF、涂覆加工、涂覆设备等在内的产业闭环，多年的深耕为公司积累了宁德时代、LG新能源、ATL、三星SDI、中创新航、比亚迪等头部客户，有望为公司新业务拓展起到协同作用。硕果已结，打造产品势能志在必行。公司2017年已布局复合集流体领域，21年已取得相关专利。按照6.5μm复合铜箔24.10g/m2的面密度测算，本次扩产1.6万吨复合铜箔折算面积约为6.64亿平方米，单平投资额约3.01元，低于行业水平。公司中试产品已受国内头部客户认可，产能建设稳步推进，最快6个月投产，复合集流体有望成为公司新的增长点。公司业绩稳健，为业务拓展保驾护航。此前，公司发布2022年年报。22年公司实现营收154.64亿元，同比增长71.90%，实现归母净利润31.04亿元,同增77.53%。2022Q4实现营收40.50亿元，同增49.96%，实现归母净利润8.31亿元，同增60.52%，业绩处于快速上升通道，保障复合集流体项目投建稳步推进。【投资建议】公司作为负极材料龙头，近几年不断拓展布局新业务，且已积累深厚的技术壁垒和丰富的客户资源，我们预计公司2023/2024/2025年营业收入分别为220.54/291.48/358.10亿元，同比增速分别为42.62%、32.17%、22.86%，归母净利润为44.72/54.83/61.10亿元，同比增长44.05%、22.61%、11.44%，现价对应PE为16、13、11倍，给予“增持”评级。【风险提示】产能建设进度不及预期；下游需求不及预期；新产品开发进度不及预期",,东方财富证券,增持,[None],2023-04-07,,增持,5167323,pdf_downloads/2023/2023-04-07/603659-璞泰来（603659）动态点评：扩产复合集流体，打造新增长极.pdf,603659,璞泰来,璞泰来（603659）动态点评：扩产复合集流体，打造新增长极
"王磊,虞洁攀",投资要点事件： 璞泰来发布复合集流体扩产公告。投资 20 亿元建设 1.6 万吨复合铜箔。 4 月 3 日，公司公告拟投资 20 亿元建设复合集流体研发生产基地，产能规模一期 1.6 万吨复合铜箔，建设周期 6-12 个月。对应约 70Gwh 电池需求，最早有望 2024 年落地投产。 我们以“1+4.5+1 微米的铜-PET-铜”复合结构为例， 根据金属铜和基材的密度， 我们测算 1.6 万吨约可折算为 7 亿平复合铜箔，约对应 70Gwh 电池需求。 从产能规划量来看，属于行业领先水平，充分体现公司的信心和长期发展目标。从投产节奏来看，我们预计在 2024 年有望落地，为公司带来新的增量。公司具有设备、膜材等技术优势， 工艺方案已获国内头部客户的认可。 如我们此前一直强调的，璞泰来是锂电领域平台型公司，在自研设备、涂覆加工、膜材料等领域具有长期深刻的技术积累，并且下游客户具有良好的一致协同性，兼具技术积累和客户渠道两大天然优势。 在复合集流体方面，公司从 2017 年开始研发，工艺方案已获国内头部客户的认可。复合集流体兼具高能量密度、高安全性、低成本等多种优势，量产应用在即。 复合铜箔是以 PET/PP 等高分子材料为基膜、上下两面电镀沉积铜膜，所形成的具有三明治结构的铜箔材料。目前主流产品为 6-6.5μm 的复合铜膜以代替 6-9μm 的传统铜箔。 近期广汽埃安发布弹匣电池技术 2.0， 其中提到采用了复合集流体材料，在内短路发生时，复合集流体结构坍缩形成断路，防止热失控，起到保险丝的作用。复合集流体产业化量产在即，看好璞泰来的技术优势和先发优势。盈利预测与估值我们预计公司 2023-2025 年营业收入 207.48/272.70/344.80 亿元 ， 同 比 增 长 34.17%/31.44%/26.44% ； 预 计 归 母 净 利 润41.11/58.58/70.43 亿元，同比增长 32.43%/42.48%/20.24%；对应 PE分别为 16.83/11.81/9.82 倍，给予“买入”评级。风险提示下游需求不及预期；市场竞争加剧风险；原材料价格波动影响；公司产能投放不及预期；国内外政策变化风险。,,中邮证券,买入,[None],2023-04-04,,买入,5163708,pdf_downloads/2023/2023-04-04/603659-璞泰来（603659）：扩产1.6万吨复合铜箔，抢滩新技术高点.pdf,603659,璞泰来,璞泰来（603659）：扩产1.6万吨复合铜箔，抢滩新技术高点
