author,content,filename,org_name,original_rating,pdf_link,publish_time,rating_adjust_mark_type,rating_changes,report_id,save_path,stock_code,stock_name,title
"申建国,边文姣",传统精密零部件龙头，正极材料与智能电控带动业绩增长公司22年实现归母净利润6.45亿元，同比+61.7%。考虑行业需求较弱，竞争加剧，我们下修磷酸铁锂单位毛利与23年出货量假设，预计公司23-25年归母净利润3.90/15.85/19.78亿元（23-24年前值14.4/21.0亿元），磷酸铁锂、汽车零部件及配件业务24年净利润分别为10.1/5.7亿元。由于23Q1计提大额存货减值损失对本年盈利扰动较大，参考正极材料与汽车零部件及配件业务可比公司24年Wind一致预期下PE均值9.71x/16.33x，考虑公司汽车零部件中的传统零部件业务增速较低，分别给予两块业务2024年9.71x/11xPE，目标价13.23元（前值23.01元），维持“买入”评级。磷酸铁锂起量驱动22年收入增长，23Q1存货减值拖累公司22年实现营收73.47亿元，同比+176.57%；实现归母净利润6.45亿元，同比+61.67%。公司22年锂电池正极材料/汽车零部件及配件制造营收为48.78/24.69亿元，同比+645.89%/+23.29%，毛利率为14.58%/28.28%，较21年+4.60pct/-4.16pct。公司磷酸铁锂正极材料出货大幅增加，销量达4.4万吨，同比+339%，带动业绩同比增长。23Q1公司实现收入7.25亿元，同比-56.18%，归母净利润-5.22亿元，同比-347.31%，主要因碳酸锂跌价导致计提7亿元存货减值损失，加回后扣非归母环比小幅下降约9%。推动产能落地，完善供应链布局公司加速推进产能建设，射洪一期技改于22年7月完成，射洪二期项目也于22年9月正式投产，目前已有磷酸铁锂产能15.2万吨。射洪一期和二期项目兼容磷酸铁锂和磷酸锰铁锂生产，可满足客户和市场的多元化需求。公司宜春15万吨磷酸铁锂项目推进中，我们预计23年底产能有望提升至30万吨。随着产能持续扩张，规模效应日益凸显，公司成本控制能力进一步提升。1月10日，公司公告与江特电机合资新建年产5万吨磷酸二氢锂一体化项目，其中公司持股51%，有望利用合作方资源和技术优势，实现保供降本。加快智能电控布局，不断深化新能源车企合作依托在传统汽车零部件精密制造累积的技术优势和客户资源，公司加快在新能源车智能电控业务上的布局，目前已经取得比亚迪、长安汽车、奇瑞汽车等客户定点。22年公司智能电控业务营收6.74亿元，同比+181.42%，实现高速增长。我们预计在智能化趋势下，公司智能电控业务有望保持快速增长。风险提示：下游客户集中度较高；上游原材料涨幅超预期。,,华泰证券,买入,[None],2023-04-25,,买入,5188915,pdf_downloads/2023/2023-04-25/300432-富临精工（300432）：磷酸铁锂起量，Q1存货减值扰动.pdf,300432,富临精工,富临精工（300432）：磷酸铁锂起量，Q1存货减值扰动
"陆嘉敏,武浩,曹子杰",2023年02月01日 事件：公司发布2022年度业绩报告，预计全年实现归母净利润6.0-7.2亿元，同比增长50-80%，扣非归母净利润6.3-7.7亿元，同比增长165-224%。点评：Q4业绩承压，全年净利润实现高增。公司预计全年归母净利润6.0-7.2亿元，以中枢6.6亿元计，同比+65%；Q4实现归母净利润0-1.2亿元，以中枢0.6亿元计，同比-63%，环比-76%。业绩大幅增长主要系：1）高压实密度磷酸铁锂正极材料出货同比大幅增长，产能扩张带来的规模效应下，公司成本控制能力进一步提升；2）新能源汽车及混合动力增量零部件业务产品线逐步进入收获期并贡献业绩。产销两旺，汽车精密零部件业务增长可期。产能方面，公司具备变速箱液压控制总成精密零部件34万套、变速箱电磁阀年700万只、电子水泵年 60万台/套、电子油泵年30万台、GDI泵壳年250万只、减速器齿轴40万套、减速器壳体年18万套的产能；车载电驱动减速器年产能达36万套，公司预计2022年底形成66万套产能。订单方面，比亚迪、长安、吉利、广汽、上汽等客户VVT项目已量产；电子水泵系列已在吉利、长城量产；电磁阀获比亚迪定点；增程器获比亚迪、长安、奇瑞、主流新势力定点；智能热管理集成模块新获得纯电新势力项目定点，已定点的增程新势力项目正常交样和转化中，公司预计2023年批量生产；此外，电子油泵、齿轮、智能悬架等产品也获得客户认可，已实现量产或将逐步实现量产。与上下游优质客户紧密合作，铁锂正极材料产销确定性较强。2月宁德时代对江西升华增资1.44亿元，增资完成后公司持股江西升华60%股权，宁德时代持股20%；9月公司与赣锋锂业签署《项目投资合作协议》，双方拟共同投资设立合资公司，新建年产 20 万吨磷酸二氢锂一体化项目；10月公司与江西特种电机股份有限公司签署《战略合作协议》，公司参股江特电机宜丰锂盐项目（持股比例10%），并成立合资公司（持股比例为51%），开展硫酸锂制备磷酸二氢锂的技术研发以及产业投资；公司年产8万吨磷酸铁锂项目已于9月竣工，子公司江西升华拟在宜春基地现有厂区内启动项目一期投建，投资新建年产 15 万吨新型高压实磷酸铁锂及配套主材一体化项目。我们认为草酸法磷酸铁锂作为新一代高压实密度磷酸铁锂材料，具备压实密度高、循环寿命及低温性能较好等优势，得到一线客户认可；公司与上游供应商合作可以增强锂原料供应的稳定性，与下游核心客户合作能提高铁锂正极材料产品销售的确定性，从而助力公司将产能转化为业绩。盈利预测与投资评级：公司是国内领先的汽车精密零部件与铁锂正极材料龙头，有望持续受益于新能源汽车行业高景气度。我们预计公司2022-2024年归母净利润为6.47、11.42、17.79亿元，对应 PE 分别为30、17、11倍。,,信达证券,,[None],2023-02-01,,,5104088,pdf_downloads/2023/2023-02-01/300432-富临精工（300432）：Q4业绩承压，全年净利润实现高增.pdf,300432,富临精工,富临精工（300432）：Q4业绩承压，全年净利润实现高增
"陆嘉敏,武浩,曹子杰","2022年10月31日 事件：公司发布前三季度业绩报告，Q1-Q3 实现营业收入47.24亿元，同比+177.52%，归母净利润6.00亿元，同比+151.35%。点评：新能源汽车行业维持高景气度，Q3业绩大幅提升。公司Q3实现营业收入20.26亿元，同比+220.46%，环比+94.06%,归母净利润2.46亿元，同比+214.27%，环比+72.03%;销售毛利率19.35%，同比-6.55pct，环比-1.16pct，销售净利率12.14%，同比+0.07pct，环比-1.55pct，三费合计4.27%，同比-3.31pct，环比+1.12pct。业绩大幅提升主要系新能源汽车行业维持高景气度，智能热管理、新能源电驱业务等新产品批量交付，磷酸铁锂新增产能全面达产，订单大幅增加，市场占有率提升。产销两旺，汽车精密零部件业务增长可期。产能方面，公司具备变速箱液压控制总成精密零部件34万套、变速箱电磁阀年700万只、电子水泵年 60万台/套、电子油泵年30万台、GDI泵壳年250万只、减速器齿轴40万套、减速器壳体年18万套的产能；车载电驱动减速器年产能达36万套，公司预计2022年底形成66万套产能。订单方面，比亚迪、长安、吉利、广汽、上汽等客户VVT项目已量产；电子水泵系列已在吉利、长城量产；电磁阀获比亚迪定点；增程器获比亚迪、长安、奇瑞、主流新势力定点；智能热管理集成模块新获得纯电新势力项目定点，已定点的增程新势力项目正常交样和转化中，公司预计2023年批量生产；此外，电子油泵、齿轮、智能悬架等产品也获得客户认可，已实现量产或将逐步实现量产。与上下游优质客户紧密合作，铁锂正极材料产销确定性较强。2月宁德时代对江西升华增资1.44亿元，增资完成后公司持股江西升华60%股权，宁德时代持股20%；9月公司与赣锋锂业签署《项目投资合作协议》，双方拟共同投资设立合资公司，新建年产 20 万吨磷酸二氢锂一体化项目；10月公司与江西特种电机股份有限公司签署《战略合作协议》，公司参股江特电机宜丰锂盐项目（持股比例10%），并成立合资公司（持股比例为51%），开展硫酸锂制备磷酸二氢锂的技术研发以及产业投资；公司年产8万吨磷酸铁锂项目已于9月竣工，子公司江西升华拟在宜春基地现有厂区内启动项目一期投建，投资新建年产 15 万吨新型高压实磷酸铁锂及配套主材一体化项目。我们认为草酸法磷酸铁锂作为新一代高压实密度磷酸铁锂材料，具备压实密度高、循环寿命及低温性能较好等优势，得到一线客户认可；公司与上游供应商合作可以增强锂原料供应的稳定性，与下游核心客户合作能提高铁锂正极材料产品销售的确定性，从而助力公司将产能转化为业绩。盈利预测与投资评级：公司是国内领先的汽车精密零部件与铁锂正极材料龙头，有望持续受益于新能源汽车行业高景气度。",,信达证券,,[None],2022-10-31,,,5031956,pdf_downloads/2022/2022-10-31/300432-富临精工（300432）：汽车零部件+正极材料业务齐发力，Q3业绩实现大幅增长.pdf,300432,富临精工,富临精工（300432）：汽车零部件+正极材料业务齐发力，Q3业绩实现大幅增长
"申建国,张志邦",传统精密零部件龙头，正极材料与智能电控带动业绩增长公司22H1实现归母净利润3.54亿元，同比+120.7%。考虑到公司磷酸铁锂产能投建速度与力度加大，我们上调出货假设，预计公司22-24年归母净利润10.40/14.44/21.03（前值8.02 /11.13 /16.37）亿元，磷酸铁锂、汽车零部件及智控业务22年净利润分别为5.33/5.07亿元，可比公司Wind一致性预期 PE均值为24x/42x，考虑到公司磷酸铁锂采取差异化竞争路线，有望获取更高的毛利率水平；传统零部件业务增速低于新能源电控业务，公司智能电控业务占比低于可比公司，分别给予两块业务2022年26x/28xPE，目标价23.01（考虑股本变动后对应前值16.83）元，维持“买入”评级。下游新能源汽车市场快速发展，业绩同比增长公司22H1实现营收26.98亿元，同比+152.2%；实现归母净利润3.54亿元，同比+120.7%。对应22Q2实现营收10.44亿元，同/环比+93.2%/-36.9%，实现归母净利润1.43亿元，同/环比+141.1%/-32.3%。公司22H1锂电池正极材料/电磁驱动零部件/精密液压零部件营收为16.63/4.41/3.60亿元，同比+1195.8%/-11.1%/+9.6%，锂电材料贡献收入主要增长极。22H1虽然国内汽车行业承压较大，但新能源汽车行业仍高歌猛进，自主品牌乘用车市占率大幅提升，驱动业绩同比增长。22H1磷酸铁锂产量2.23万吨（21年全年1.30万吨），受终端车型销量提升带动，订单大幅增加，带动业绩同比增长。重视技术研发，产能建设快速落地公司重视研发，22H1研发费用0.84亿元，同比+ 38.80%，主要系新能源领域研发投入增加导致。经过持续的研发创新，公司磷酸铁锂已具备相对领先的生产技术，持续优化的工艺有效降低生产成本，提高盈利能力，22H1磷酸铁锂毛利率17.46%，同比+14.0pct。公司加速推进产能建设，截止22H1已有磷酸铁锂产能6.2万吨。射洪一期技改已于7月完成，公司预计射洪二期项目将于10月前投产，二期建成后将具有8万吨产能，届时总产能将达到15.2万吨。射洪一/二期兼容磷酸铁锂和磷酸锰铁锂生产；随着产能规模迅速扩大，规模效应有望进一步凸显。智能电控获取诸多项目定点，加速实现量产公司在新能源车智能电控业务上有扎实的技术和布局，22H1智能电控业务营收1.93亿元，同比+117.8%，实现高速增长。智能电控业务目前已获得多个客户项目定点，逐步实现批量生产，同时公司对多条智能电控产线进行了技改和扩产。我们预计在智能化趋势下，公司智能电控业务有望保持快速增长。风险提示：公司项目投产进度不及预期；上游原材料涨幅超预期。,,华泰证券,买入,[None],2022-09-01,,买入,4977074,pdf_downloads/2022/2022-09-01/300432-富临精工（300432）：新能源业务快速拉动，业绩同比增长.pdf,300432,富临精工,富临精工（300432）：新能源业务快速拉动，业绩同比增长
陈传红,业绩简评事件：公司8月29日发布22年半年报：1）1H22，公司营收26.98亿元，同比+152.15%，归母净利润3.54亿元，同比+120.67%，扣非净利润2.76亿元，同比+96.27%。经营分析磷酸铁锂：1)单吨净利：公司铁锂Q2预计出货5000吨，单吨净利8000元/吨以上。2）产能：公司现有产能6.2万吨，公司射洪二期项目达产后，公司将具备 15.2万吨的年产能。3）客户：公司深度绑定宁德时代，目前宁德时代和晨道资本分别持有公司子公司江西升华20%的股份。我们预计公司70%以上铁锂产品供应宁德时代。汽车零部件：1）公司作为老牌汽零企业已有变速箱液压控制总成精密零部件 34 万套/年、变速箱电磁阀年 700 万只、电子水泵年 60 万台/套、电子油泵年 30 万台、GDI 泵壳年 250 万只、减速器齿轴年 40 万套、减速器壳体年 18 万套的产能。2）客户：公司客户涵盖比亚迪、大众、上汽、长安、长城等多家国内、国外龙头车企，其中公司电动VVT已获比亚迪混动发动机和主流新势力增程器等多家车企项目定点，预计未来将增厚企业盈利。智能电控：减速器：1）公司车载电驱动减速器目前产能年36万台/套，预计22年底将形成年66万台/套产能，预计将配合联合电子交付主流增程式新势力；电子水泵：2）公司多品种电子水泵系列已在吉利汽车和长城汽车量产，并新获得比亚迪、主流新势力增程器等多个客户项目定点；3）CDC电磁阀：公司智能悬架 CDC 电磁阀新获取宁江山川和淅减项目定点，终端将供货长安和红旗项目；已经定点的新能源龙头 B 公司项目顺利交样转化中，预计 2022 年批量。盈利预测与投资建议公司铁锂业务深度绑定宁德时代，汽零业务前景广阔，未来随着公司铁锂产能、智能电控产能陆续投产，有望增厚公司利润，微调公司 2022-2024 年公司归母净利润为 7.48、11.72、13.32 亿元，当前股价对应PE分别为28/18/15倍，维持“买入”评级。风险提示行业竞争格局恶化风险，公司产能建设不及预期风险。,,国金证券,买入,[None],2022-08-30,,买入,4974135,pdf_downloads/2022/2022-08-30/300432-富临精工（300432）：业绩符合预期，汽零业务前景广阔.pdf,300432,富临精工,富临精工（300432）：业绩符合预期，汽零业务前景广阔
陈传红,业绩简评1）2021年业绩：公司全年实现营收26.56亿元，同比+44.01%；归母净利润3.99亿元，同比+20.85%；扣非归母净利润2.38亿元，同比-15.28%。2）1Q2022业绩：公司营收16.54亿元，同比+212.24%，环比+73.38%；归母净利润2.11亿元，同比+108.69%，环比+31.88%；扣非归母净利润2.11亿元，同比+154.96%，环比+904.76%。经营分析铁锂：1）单吨净利：公司铁锂正极Q1出货预计1.35万吨，单吨净利润8000元/吨以上，超出市场预期。2）产能：随着公司22H2扩产6万吨项目达产，我们预计公司22、23年铁锂正极有效产能可达7万吨、12.2万吨。3）产品力：公司是目前市面上唯一一家大规模量产使用草酸法制备磷酸铁锂的公司，而草酸法制备铁锂正极拥有压实密度高，能量密度高等特点适配铁锂高端动力电池。4）客户：公司深度绑定宁德时代，目前宁德时代和晨道资本分别持有公司子公司江西升华20%的股份。我们预计公司70%以上铁锂产品供应宁德时代。汽车零部件：产能：公司已有变速箱电磁阀年400万台/套、电子水泵年60万台/套、电子油泵年30万台/套、GDI泵壳年100万台/套、齿轴及壳体13万件/年。客户：公司已有大众、通用、丰田等外资及合资品牌，以及上汽、北汽、长安、吉利及长城等国内自主品牌，形成国内市场为主、国外市场逐步突破的市场格局。智能电控：公司依托联合电子、华为，在车载电驱动减速器持续爬坡增量基础上，形成系统集成优势。目前，公司车载电驱动减速器年产能为33万台/套，其中二期18万台/套产线正批量供应华为。盈利调整与投资建议根据我们对22-23年公司铁锂价格及产量最新预测，微调公司22-23年归母净利润至7.40、11.14亿元，预计2024年归母净利润为13.46亿元，对EPS为0.914、1.376、1.662元，当前股价对应2022年16倍PE，维持 “买入”评级。风险 新能源汽车销量不及预期；市场竞争加剧风险；行业产能过剩的风险。,,国金证券,买入,[None],2022-04-28,,买入,4841221,pdf_downloads/2022/2022-04-28/300432-富临精工（300432）：Q1业绩高增，铁锂产品量价齐升.pdf,300432,富临精工,富临精工（300432）：Q1业绩高增，铁锂产品量价齐升
陈传红,投资逻辑铁锂正极：1.产品力：铁锂逐步从同质化走向产品与成本差异。我们认为公司可凭借草酸法制备（高压实）铁锂正极站稳铁锂高端动力市场。2.上游：公司通过共同出资、战略合作等方式联手四川思特瑞锂业、川恒股份等完成锂源、磷源等上游原材料布局，实现上下游一体化战略。3.下游：公司深度绑定下游优质电池厂商宁德时代，穿越周期能力无忧。4.降本路径清晰：铁锂行业降本路线多样，其中公司通过原材料使用多样性、供应链整合、精选产地等方式有望在未来打开草酸法降本通道。5.产能：预计公司铁锂22、23年年底名义产能或达12.2、22.2万吨。6.价格：价格方面受铁锂上游原材料碳酸锂价格（已涨至50万元/吨）影响，且目前看锂源供给紧张仍将持续，我们预计公司22、23年铁锂正极价格或将维持在13万元/吨以上高位。智能电控：切入华为产业链，打造智能电控产品矩阵，形成集成优势。公司依托联合电子、华为，在车载电驱动减速器持续爬坡增量的基础上，继续打造智能电控产品矩阵，形成系统集成优势，其中一期15万套/年车载电驱动减速器已完成量产，二期18万套/年产能预计将于22年上半年正式量产。我们预计该板块22、23年营收增速为220%、31%。募投项目：公司2022 年 3 月已完成发行的定增募投资金总额不超过 15 亿元，其中 8.6 亿元用于新能源汽车智能电控业务， 2.72 亿元用于投建 5 万吨磷酸铁锂，3.68 亿元补充流动资金，有望助力公司发展。投资建议与估值公司深度绑定电池龙头宁德时代，无惧铁锂周期扰动，未来随着22年新增铁锂产能、智能电控产能陆续投产，预计2021-2023年公司净利润为4.08、7.19、10.97亿元，参考可比公司，给予公司2022年30倍PE，目标市值216亿元，对应目标价29.02元/股，首次覆盖，给予“买入”评级。风险新能源电池技术迭代风险；汽车行业周期波动的风险；新能源锂电正极产能过剩风险；子公司升华科技业绩不及预期风险。,,国金证券,买入,[None],2022-03-23,,买入,4780553,pdf_downloads/2022/2022-03-23/300432-富临精工（300432）：多重产品矩阵完善，产品力铸公司护城河.pdf,300432,富临精工,富临精工（300432）：多重产品矩阵完善，产品力铸公司护城河
白宇,"事件：公司发布21年三季报，2021前三季度实现营收17.02亿元，同比+40.28%，其中21Q3实现营业收入6.32亿，同比+32.85%。前三季度实现归母净利润2.39亿元，同比-5.75%，21Q3实现归母净利润0.78亿元，同比-27.57%。1、 业绩分析：21Q1-Q3实现营收17.02亿元，同比+40.28%，其中21Q3实现营业收入6.32亿，同比和环比分别为+32.85%/+17.02%，主营收入增加主要是江西升华磷酸铁锂正极材料产能逐步恢复、智能电控部分产品实现量产及传统零部件业务稳定增长所致。前三季度实现归母净利润2.39亿元，同比-5.75%；21Q3实现归母净利润0.78亿元，同比和环分别为比-27.57%/+31.99%。公司前三季度毛利率、净利率分别为28.6%、13.91%，同比-7.84pct/-6.91pct；单21Q3公司毛利率为25.9%，同环比分别-10.21pct/-3.04pct。下降主要系智能电控业务、锂电正极材料均在大规模扩产阶段，产能利用率较低，且此类新业务利润率低于传统发动机核心零部件。21Q1-Q3公司销售、管理、研发、财务费用率分别为2.07%/6.34%/5.47%/-0.33%,同比-0.24/-2.63/-1.16/-0.04pct,整体-4.07pct，四项费用率整体降低。2、 居安思危，提前布局新业务：公司传统业务主要产品为发动机内核心零部件，包含可变气门正时系统（VVT）,机油控制电磁阀（OCV），可变凸轮相位器（VCP）,可变气门升程系统（VVL），壁垒高，毛利率均在35%以上，历史上发展最好的情况下加权ROE可达40%。但是公司居安思危，在传统业务发展稳定，盈利能力极强的情况下，考虑到未来新能源的发展和汽车电子的发展，于2015年开始逐渐布局新的“智能化+新能化”产品。自2015年不断试错，通过自主创新推动业务从传统精密加工向智能电控和机电一体化方向升级，根据历年年报，我们发现公司研发过电子水泵，电子真空泵，毫米波雷达，电机控制器，减速器，电磁阀等多种类型产品。在5、6年的积累和试错后，新能源业务有了质的突破，包含新能源汽车主水泵，电磁阀，热管理，以及减速器等产品。其中400W、450W、200W电子水泵系列已在吉利汽车和长城汽车量产，并新获得吉利汽车和长城汽车多个项目定点；电子水泵执行器获得大众汽车定点。智能热管理模块研发已通过客户夏季标定实验。电子油泵供华为系列动力总成，并已通过PPAP，新获得小鹏汽车、博世力士乐的项目定点。车载电驱动减速器获得华为、华人运通项目定点，联合电子（UAES）项目已进入批量生产并持续获得新项目定点，华为项目产线已在调试中。预计未来三年新能源业务将会实现高速增长，有望超过传统业务。",,太平洋证券,增持,[None],2021-10-27,,增持,4651297,pdf_downloads/2021/2021-10-27/300432-富临精工（300432）：双轮驱动高速成长，布局上游谋长期稳定.pdf,300432,富临精工,富临精工（300432）：双轮驱动高速成长，布局上游谋长期稳定
