author,content,filename,org_name,original_rating,pdf_link,publish_time,rating_adjust_mark_type,rating_changes,report_id,save_path,stock_code,stock_name,title
"马宝德,顾泉,虞栋","事件：近日，公司公布了《关于山东20MW农光互补光伏发电项目并网发电的公告》、《关于与深圳市雄韬电源科技股份有限公司签订储能、微网战略合作协议的公告》、《关于广州科云数据中心项目与广东电信、深圳腾讯开展合作的进展公告》、《关于与合普友电科技有限公司签订新能源汽车充电业务战略合作框架协议的公告》和《关于开展融合大数据与量子通信业务进展的公告》。

点评:

新增20MW光伏电站，光伏电站运营再下一城。山东潍坊20MW农光互补发电项目和河南地区40MW项目首期20MW相继并网，有利于增加公司的发电收入。40MW光伏电站将为公司带来年均约4500万电费收入。预计2016年公司实现装机100MW。2015年和2016年一季度公司营收增长，部分由于公司的光伏发电收入增长较快。

与雄韬电源签订微网和储能合作协议，加码能源互联网。公司致力于拓展储能、微网业务，目前已在深圳、张家口等城市及美国、澳大利亚等国家开展相关业务。公司与张家口市政府和智慧星科技签署了《智慧能源管理项目战略合作框架协议》，携手创立张家口可再生能源应用综合创新示范区和共同推进基于“互联网+”智慧能源管理云平台建设，提供相应的互联网云平台服务，打造可再生能源（光伏、风能、地热等）供应侧和需求侧撮合交易平台。雄韬电源产品涵盖密封铅酸、锂离子电池两大品类，是中国产品品类最为齐全的电池品牌之一，在全球100多个国家和地区的通讯、电动交通工具、光伏、风能、电力、UPS、电子及数码设备等领域为客户提供完善的产品应用与技术服务；目前，全球主要合作伙伴有艾默生、伊顿、中国移动、中兴、南方电网等。公司与雄韬电源结为战略合作伙伴关系，发挥各自在电池、储能变流器领域的技术研究、设备研发与制造等方面的优势进一步开拓储能、微网领域的市场。

傍上广东电信和腾讯，IDC业务增长可期。近日，公司控股子公司收到广东电信”《关于广州科云数据中心项目合作的确认函》，同意就广东科云数据中心项目开展为期10年的业务合作，其中，要求科云辰航最迟不晚于2016年9月30日交付2000个机柜给腾讯。广州科云数据中心项目，建筑面积44090.7平方米，位于广州市经济技术开发区，项目建成后，预计机柜数量为6000个，总投资约8.6亿元。广州科云数据中心项目定位为高端客户提供高等级的数据中心产品及服务，此次与广东电信开展业务合作，同时为腾讯提供云计算服务，对公司数据中心规模的扩展和盈利能力的提高奠定了坚实基础，是公司数据中心业务发展战略的关键步骤。

公司数据中心业务从产品销售到数据中心代建再到自建自营。数据中心按北上广深进行规划布局，目前已经在设计建设的有：北京5000柜，上海近4000柜。2016年规划建成15000柜，2017年建成15000个机柜。北京数据中心客户已经确定，包括UCLOUD、去哪网和金山云等。由于数据中心大部分是非标准产品、按需定制，公司的策略一般是确定好客户再开始建设。

拟开展融合大数据与量子通信和充电设备业务。公司致力于打造电力安全、通信安全、数据安全为一体的的高安全绿色数据中心。此次合作备忘录签署后，公司与国盾量子共同拓展量子通信技术的应用，有利于提升公司在高安全数据中心业务的发展。公司致力于拓展新能源汽车充电业务，其产品方案已成功应用于北京、上海、深圳、厦门、宁德、莆田、漳州等地，同时也中标民航“油改电”厦门机场充电桩项目。此次公司和合普友电结为战略合作伙伴关系，发挥各自在新能源汽车电池充电技术上的基础和优势。

高端电源领跑者，在军工领域取得突破。公司在UPS市场以及20kVA以上高端大功率UPS市场排名位列第四，居国产品牌首位（前三位为外资品牌：伊顿、艾默生和APC-MGE），成为中国电源行业的领跑者。公司“高效节能型高压直流不间断电源”项目已被列入“2015年度国家火炬计划”项目。公司获得首批军方订单，规模不大，公司除了直接卖标准产品，还参与了定制产品的研制。公司的生产、制造、研发和管理体系符合“保密资格单位”，“武器装备质量管理体系认证”和“武器装备科研生产许可证”等相关认证要求（“武器装备承制证”正在审查中）。进入军工领域，公司的高端电源业务弹性较大。

定增获批，加码光伏电站运营。公司拟以18.37元/股发行不超过9025.58万股，募集资金总额16.58亿元，投资155.6MW光伏电站，其中农光互补40MW，其余为分布式光伏。115.6MW光伏电站并网发电后，预计给公司带来年均约1.7元电费收入。目前公司已先期运用自有资金投资建设部分电站。定增项目已获证监会核准批文。

首次覆盖，给予“推荐”评级。考虑到公司增发摊薄等因素，15年-2017年，EPS分别为0.66元、0.97元和1.42元，分别对应66.66倍、45.63倍和31.15倍PE，考虑到IDC运营业务稳中有升，高端电源业务毛利率较高，新能源发电、微电网领域弹性较大，首次覆盖，给予“推荐”评级。

风险提示：竞争激烈带来毛利率下降的风险;光伏电站建设不达预期风险；IDC业务不及预期风险。",,国联民生证券,推荐,[None],2016-04-11,,增持,1743322,"pdf_downloads/2016/2016-04-11/002335-科华恒盛(002335)临时公告点评：UPS龙头,重点布局新能源微电网.pdf",002335,科华恒盛,"科华恒盛(002335)临时公告点评：UPS龙头,重点布局新能源微电网"
"张镭,王雪峰,阮巧燕","近日，公司公告与北京云山世纪网络科技网络签订战略合作框架协议，共同开展混合云服务；与科大国盾开展关于融合大数据与量子通信业务。公司在数据中心区域布局和业务结构布局日渐完善，并逐步进入业绩兑换期，看好公司的发展战略和执行力。

投资要点：

借势者智，借力者强。公司致力于打造安全、高效、高端的新型绿色数据中心，乘国内数据中心供需变革之势，在最恰当的试点进入该领域，是为“智”。自进入该领域以来，公司相继与众生网络合作取得数据中心建设的牌照与基础资源；与中经云开展光磁混合安全存储领域的合作；与浪潮云开展云计算、云服务方面的合作；与辰航合作共同开展广州的数据中心项目；与云山世纪合作开展混合云服务；与科大国盾合作开展量子通信业务。公司善于整合多方力量，共谋发展，且成效显著，是为“强“。“智”“强”一体，看好公司的发展战略和执行力。

IaaS2.0时代，解决如何用云问题。在IaaS1.0时代，解决的是如何上云的问题，而在IaaS2.0时代，解决的如何用云问题。云山国际是国内最早专注SDN技术并在云计算领域商业化的团队，在为用户业务提供真正按需构建的融合基础设施服务方面有着丰富的技术、经验和资源的积累。基于目前的布局，公司将于2016年底在北上广完成至少1.5万个机柜的建设，在数据中心的数量上将初具规模，在量提升的同时，公司注重对质的挖掘，积极开展云计算、云服务等方面的探索，此次双方在混合云方面开展合作，有望提升数据中心运营效益。

量子通信逐步进入产业化阶段，公司提前布局。量子通信安全性不依赖于算法的复杂度，它具有无条件安全性，同时能够精准的传递量子信息，是未来通信领域的热点领域。我国在量子通信技术方面已经达到国际一流水准，且在产业化方面领跑全球。科大国盾是依托中国中国科学技术大学，以潘建伟院士为核心构建的量子通信产业化团队，是国际、国内量子通信领域的领军者，与科大国盾的合作，有利于公司打造电力安全、通信安全、数据安全为一体的新型绿色数据中心。

继续给予“强烈推荐”评级。预计公司将于今年实施定增方案，考虑到增发后的影响，预测2015-2017年EPS为0.66/0.90/1.21元，我们认为公司在数据中心建设运营方面的步伐远超市场同行，有望成为国内数据中心运营和云计算的龙头企业，提高公司目标价至60元，对应2015-2017年PE90/66/49倍，继续给予“强烈推荐”评级。

风险提示：高端电源进口替代不达预期；数据中心和光伏运营推进力度不达预期",,中金财富,强烈推荐,[None],2016-04-06,,买入,1741780,"pdf_downloads/2016/2016-04-06/002335-科华恒盛(002335)：好风凭借力,送我入青云.pdf",002335,科华恒盛,"科华恒盛(002335)：好风凭借力,送我入青云"
"张镭,王雪峰,阮巧燕","在北京，公司将于一季建成并运营5000个机柜；在上海，公司控股子公司上海科众租赁上海市市北高新服务业园区约20000平方米的房屋建设高标准云计算数据中心（预计约4000个机柜）；在广州，控股子公司科云辰航拟在广州市经济技术开发区投资建设44090.7平方米的大型数据中心（约6000个机柜），三步走战略稳步推进，一线城市数据中心布局将于年底完成，业绩步入收获期。

投资要点：

供需格局变革。从供给端来看，前期国内数据中心规模多以中小型为主，PUE值多大于2，在节能减排的大背景下，绿色大型数据中心的PUE值正步入1.5以下时代，新模式带来新机会。从需求端来看，互联网+的兴起使得社会存量数据呈指数级增长，根据IDC监测，全球数据量大约每两年翻一番，预计到2020年，全球将总共拥有35ZB的数据量，相较于2010年，数据量将增长近30倍，数据中心的需求也将维持指数增长态势。

生态节能型数据中心领导者。公司已构建起完善的数据中心物理基础架构平台解决方案——云动力生态节能型数据中心解决方案，从供配电系统、制冷系统以及智能管理系统进行详细规划，打造具备绿色节能、智能控制两大特征的生态节能型数据中心。北京禁止新建和扩建数据中心(PUE值在1.5以下的云计算数据中心除外)，公司在北京的持续迈进，从侧面验证公司在绿色数据中心方面的技术实力。

布局一线城市，业绩兑现确定。公司通过租用房屋建设数据中心可以有效缩短建设周期，实现弯道超车；同时公司具备数据中心用UPS、机柜等硬件产品和自主的数据中心解决方案，有利于打造低成本、高整合度的数据中心。在数据中心布局上，公司坚持一线城市先行战略，以便锁定优质客户，提高整体租赁水平。预计公司将于一季度完成北京5000个机柜的建设，年底在北上广共投资建设完成15000个以上机柜，数据中心建设逐步迈入业绩兑现期。公司电子铝箔产能将会从目前的1万吨扩张到2.7万吨。

继续给予“强烈推荐”评级。预计公司将于今年实施定增方案，考虑到增发后的影响，预测2015-2017年EPS为0.66/0.90/1.21元，我们讣为公司在数据中心建设运营方面的步伐远超市场同行，有望成为国内数据中心运营和云计算的龙头企业，提高公司目标价至50元，对应2015-2017年PE76/55/41倍，继续给予“强烈推荐”评级。

风险提示：高端电源进口替代不达预期；数据中心和光伏运营推进力度不达预期",,中金财富,强烈推荐,[None],2016-03-30,,买入,1737168,"pdf_downloads/2016/2016-03-30/002335-科华恒盛(002335)：供需格局变革,数据中心新锐弯道超车.pdf",002335,科华恒盛,"科华恒盛(002335)：供需格局变革,数据中心新锐弯道超车"
谭志勇,"【事件】2016年2月28日晚间,科华恒盛发布了2015年业绩快报以及2016年第一季度业绩预告。2015年公司实现:营业收入约16.71亿元,同比增长12.45%,归母净利润净利润1.48亿元,同比增长16.50%,与我们之前的预测基本吻合。2016年第1季度,公司经营业绩实现了开门红,归属于上市公司股东的净利润比上年同期增长100%-150%,达到了2038.96万元-2548.7万元。
    随着公司在数据中心运营以及光伏发电领域的业务不断拓展,一方面将使得公司传统业务保持稳定的增长,例如UPS、数据中心解决方案以及新能源产品等,另一方面也会给公司的业务收入和净利润带来新的增长点。建议积极关注。
    数据中心运营业务助力公司净利润弹性增长:按照公司目前公布的机架资源来看,全部投产后,考虑少数股东损益,按照单机架5000元/月的ARPU值计算,每年可以给公司带来6亿-8亿的收入。对比同行业的净利润情况,预计净利润约1.2亿-1.6亿。相当于公司2014年经审计的净利润水平(约1.27亿)。
    光伏电站运营为公司提供稳定的现金流:公司将大力发展光伏电站业务作为公司重要战略方向。随着定增预案的实施,公司建设、运营光伏电站的规模将达到约160MW,将初步完成公司在光伏电站业务板块的战略布局。一方面将在未来给公司带来稳定的现金流,有助于提高公司的盈利水平,实现股东利益最大化;另一方面,将会在一定程度上提高公司光伏产品的销量,有助于增强公司的盈利能力。因此,投资建设光伏电站既促进了现有主营业务发展,又为公司创造新的利润增长点。
    投资建议:我们预测2016年至2017年每股收益分别为0.67和0.89元,为考虑公司增发完成后的摊薄值。给予买入-A评级,6个月目标价60。
    风险提示:1、新能源产品以及智慧能源产品销售不及预期;2、数据中心基础资源以及光伏电站未能按时投产,导致收入不及预期;3、宏观经济发展不及预期。",,华金证券,买入,[None],2016-03-01,,买入,1729404,"pdf_downloads/2016/2016-03-01/002335-科华恒盛(002335)：小荷已露尖尖角,2016年第1季度净利润增长超100%.pdf",002335,科华恒盛,"科华恒盛(002335)：小荷已露尖尖角,2016年第1季度净利润增长超100%"
谭志勇,"科华恒盛股仹有限公司创立二 1988 年，拥有 27 年电源研収制造经验，是“重点
国家火炬计划项目”承担者、“国家重点高新技术企业”、“国家讣定企业技术中心”。
高端电源、新能源、数据中心三大产品斱案体系，广泛应用二金融、工业、交通、通
信、政店、国防、教育、医疗、电力、新能源、数据中心等行业，服务二全球 80 多
个国家和地区、20 多万用户，致力二打造生态型能源于联网企业。
随着公司在数据中心运营以及光伏収电颀域癿业务丌断拓展，一斱面将使得公司
传统业务保持稳定癿增长，例如 UPS、数据中心解冠斱案以及新能源产品等，另一斱
面也会给公司癿业务收入和净利润带杢新癿增长点。我们建议积枀关注。数据中心运营业务助力公司净利润弹性增长： 按照公司目前公布癿机架资源杢看，
全部投产后，考虑少数股东损益，按照单机架 5000 元/月癿 ARPU 值计算，每年
可以给公司带杢 6 亿-8 亿癿收入。对比同行业癿净利润情冡，顿计净利润约 1.2 亿
-1.6 亿。相弼二公司 2014 年经审计癿净利润水平（约 1.27 亿）。光伏电站运营为公司提供稳定的现金流：公司将大力収展光伏电站业务作为公司重
要戓略斱向。随着定增顿案癿实斲，公司建设、运营光伏电站癿觃模将达到约
160MW，将初步完成公司在光伏电站业务板块癿戓略布局。一斱面将在未杢给公
司带杢稳定癿现金流，有劣二提高公司癿盈利水平，实现股东利益最大化；另一斱
面，将会在一定程度上提高公司光伏产品癿销量，有劣二增强公司癿盈利能力。因
此，投资建设光伏电站既促迚了现有主营业务収展，又为公司创造新癿利润增长点，
有劣二公司实现未杢収展戓略目标。投资建议：我们顿测 2015 年至 2017 年每股收益分别为 0.63、0.60 和 0.95 元，
2016 年和 2017 年癿 EPS 为考虑公司增収完成后癿摊薄值。给予买入-A 评级，6
个月目标价 60。风险提示： 1、新能源产品以及智慧能源产品销售丌及顿期；2、数据中心基础资
源以及光伏电站未能按时投产，导致收入丌及顿期；3、宏观经济収展丌及顿期。",,华金证券,买入-A,[None],2016-01-04,,买入,4009427,pdf_downloads/2016/2016-01-04/002335-科华恒盛（002335）：雄关漫道真如铁，而今迈步从头越.pdf,002335,科华恒盛,科华恒盛（002335）：雄关漫道真如铁，而今迈步从头越
刘宾,"投资要点:
    稳健经营的国内UPS 龙头企业。科华恒盛专注UPS 领域27 年,销售额连续多年名列本土品牌第一,是国内UPS 品牌龙头。上市后公司经营稳健,净资产收益率(ROE)维持在10%以上,投入资本回报率(ROIC)维持在9%之上。目前公司正积极转型,从产品制造商跨越为整体解决方案提供商,建立“技术+资本”为核心的商业模式。
    积极布局能源互联网,打造生态型能源互联网企业。公司以传统的电力电子技术为基础,发挥自主创新优势、产品优势、服务优势和人才优势,在光伏电站建设运营、绿色数据中心建设运营及智慧电能产业积极布局扩张。公司与张家口市政府携手建立“可再生能源应用综合创新示范区”,共同推进基于“互联网+”智慧能源管理云平台建设发展;公司与中国低碳产业投资中心建立战略合作伙伴关系,并设立“智慧电能产业投资联盟”,参与低碳经济顶层设计。公司整体战略发展规划志存高远,布局稳健。
    首次关注,增持评级。鉴于公司过去长期的稳健经营风格,及目前在能源互联网布局的领先地位,我们看好公司在国内能源互联网领域的发展。假设公司非公开发行顺利实施,我们预测公司15-16 年的EPS 分别为0.796、0.834、1.119。首次关注,并给予增持评级。",,长城国瑞证券,增持,[None],2015-11-23,,增持,1706063,pdf_downloads/2015/2015-11-23/002335-科华恒盛(002335)点评：国内UPS龙头能源互联网布局已现雏形.pdf,002335,科华恒盛,科华恒盛(002335)点评：国内UPS龙头能源互联网布局已现雏形
刘宾,"投资要点:
    稳健经营的国内UPS龙头企业。科华恒盛专注UPS领域27年,销售额连续多年名列本土品牌第一,是国内UPS品牌龙头。上市后公司经营稳健,净资产收益率(ROE)维持在10%以上,投入资本回报率(ROIC)维持在9%之上。目前公司正积极转型,从产品制造商跨越为整体解决方案提供商,建立“技术+资本”为核心的商业模式。
    积极布局能源互联网,打造生态型能源互联网企业。公司以传统的电力电子技术为基础,发挥自主创新优势、产品优势、服务优势和人才优势,在光伏电站建设运营、绿色数据中心建设运营及智慧电能产业积极布局扩张。公司与张家口市政府携手建立“可再生能源应用综合创新示范区”,共同推进基于“互联网+”智慧能源管理云平台建设发展;公司与中国低碳产业投资中心建立战略合作伙伴关系,并设立“智慧电能产业投资联盟”,参与低碳经济顶层设计。公司整体战略发展规划志存高远,布局稳健。
    首次关注,增持评级。鉴于公司过去长期的稳健经营风格,及目前在能源互联网布局的领先地位,我们看好公司在国内能源互联网领域的发展。假设公司非公开发行顺利实施,我们预测公司15-16年的EPS分别为0.796、0.834、1.119。首次关注,并给予增持评级。",,长城国瑞证券,增持,[None],2015-11-16,,增持,1705831,pdf_downloads/2015/2015-11-16/002335-科华恒盛(002335)：国内UPS龙头能源互联网布局已现雏形.pdf,002335,科华恒盛,科华恒盛(002335)：国内UPS龙头能源互联网布局已现雏形
谭志勇,"2015年10月28日,科华恒盛发布2015年第三季度报告, 2015年前3季度:实现营业收入9.4亿元,同比增长20.2%,其中第3季度完成约4.3亿元;实现归属上市公司股东的净利润约7319万元,同比增长4.56%,其中第3季度完成5673万元。相比半年报11.43%的营业收入增长率以及-66.71%的归属上市公司股东的净利润增长率,公司的经营状况大为改观,建议积极关注。
    2015年,公司在高端电源、数据中心和新能源三大业务领域持续发力,逐步形成三大业务价值链良好的局面,全力打造生态型能源互联网企业。
    高端电源:据赛迪数据显示,2014年公司在UPS市场的收入占比为13%,在国产品牌中排名第一。2015年,公司在传统业务板块继续保持领先优势,轨道交通领域业务有效推进,军工领域也取得新的突破。随着各行业信息化建设的推进,我们认为公司在这一块业务领域仍将保持增长态势。
    数据中心:公司已陆续推出云动力生态节能型数据中心、模块化数据中心、微型数据中心等行业级整体解决方案。同时,公司通过战略合作推进,加快数据中心在北京、上海等地的快速布局。目前,数据中心解决方案已成为公司战略转型下业务新增长的强劲推动力。其数据中心方案广泛应用于教育、金融、通信、政府、文化、公安、税务、传媒、IDC、互联网等众多行业。据公司披露的2015年中报,2015年上半年数据中心产品:收入达到了3054万元,同比增长34.08%,毛利率41.53%,同比提升4.5%。
    新能源:公司紧跟新能源不互联网融合的趋势,在光伏风电新能源产品方案、光伏并网电站、分布式发电、风光互补并离网应用等领域均取得良好进展,光伏电站投资运营迈入实质性阶段。
    投资建议:我们预测2015年至2017年每股收益分别为0.61、1.09和1.28元,给予买入-A建议,6个月目标价为40元。
    风险提示:公司转型业务增长不及预期。",,华金证券,买入,[None],2015-11-02,,买入,1705599,"pdf_downloads/2015/2015-11-02/002335-科华恒盛(002335)：净利润增速转正,公司迎来业务发展拐点.pdf",002335,科华恒盛,"科华恒盛(002335)：净利润增速转正,公司迎来业务发展拐点"
"张镭,王雪峰","公司昨日发布2015年度第三季度报告，公司前三季度实现营业收入9.41亿元，同比增长20.20%；归属二上市公司股东净利润0.73亿元，同比增长4.56%，扣除非经常性损益后归属二上市公司股东的净利润0.62亿元，同比增长3.45%。其中，第三季度公司实现营业收入4.26亿元，同比增长32.83%，归属二母公司股东的净利润0.57亿元，同比增长175.87%。

投资要点：

期间费用率环比好转，毛利率创五年新高。公司前三季度毛利率为37.09%，为近五年以来最高水平。期间费用率为28.07%，虽然仌高二去年同期26.15%水平，但较上半年32.4%已有较大改善，我们判断这主要是因为公司上半年对光伏项目投资的准备工作已经较充分，足以满足近期的开发需求，光伏项目开发导致管理费用和销售费用增加在三季度有较大幅度的收窄。

数据中心与新能源业务推进步伐加快。公司固定资产和在建工程合计7.18亿元，较之年中增加2.27亿元（其中固定资产增加近2亿元），丌考虑折旧因素，已经高二前两个季度的增量之和1.3亿元，这表明公司在数据中心和新能源业务方面的进展在加速推进中。

数据中心：未雨绸缪，优质客户开发顺利。公司的数据中心发展模式明确，通过建设高标准数据中心吸引高端客户以增强客户黏性，提高盈利的水平和稳定性，公司三季度不三家优质伙伴签订数据中心租用意向合作协议7.16亿元，成果显著。三步走戓略已初见成效：第一期是打通商业模式，建设1000个机柜（已完成）；第事期是做大规模，将机柜数量做大到5000个左右（部分客户已入驻，将二年底完成）；第三期推进区域性布局，在全国重要中心城市建立起数个大型数据中心。

继续给予“强烈推荐”评级，考虑到今年光伏投资带来的费用增加以及预计将二明年初实施的定增方案，下调2015-2017年EPS预测至0.67/0.90/1.21元，给予公司37元目标价，对应2015-2017年PE54/41/30倍，继续给予“强烈推荐”评级。

风险提示：高端电源进口替代丌达预期；数据中心和光伏运营推进力度丌达预期；增发预案未取得审批机关的批准",,中金财富,强烈推荐,[None],2015-10-29,,买入,1362115,pdf_downloads/2015/2015-10-29/002335-科华恒盛：期间费用率环比好转，光伏与数据中心投资进展顺利.pdf,002335,科华恒盛,科华恒盛：期间费用率环比好转，光伏与数据中心投资进展顺利
