author,content,filename,org_name,original_rating,pdf_link,publish_time,rating_adjust_mark_type,rating_changes,report_id,save_path,stock_code,stock_name,title
龙靓,"公司前三季度业绩亮眼。公司2018年前三季度共实现营业收入631.17亿元，同比增长19.39%，实现归母净利润55.83亿元，同比增长103.79%，实现扣非归母净利润51.77亿元，同比增长96.38%。公司Q3单季度实现归母净利润21.54亿元，环比Q2增长7.11%，同比上年Q3增长96.35%，公司单季度盈利水平创2017年以来最好水平。公司前三季度实现经营性现金流量净额80.08亿元，去年同期为26.82亿元，公司现金流状况大幅改善，现金流充足，目前的资产负债率为57.02%，资产负债状况持续好转。
公司第三季度产品产销两旺。2018年第三季度，公司共生产生铁470万吨，粗钢513万吨，钢材490万吨，销售钢材491万吨，其中板材242万吨，长材35.26万吨，轮轴5万吨，板材和长材销量分别较第二季度增长-5.10%、11.42%。2018年Q3，公司的吨钢净利润为499元/吨，较Q2上涨19.09%，板材、长材、轮轴均价分别为4044元/吨、3668元/吨，9111元/吨，较Q2上涨60元/吨、88元/吨，35元/吨。2018年Q3，钢材产品价格呈现长强板弱格局，公司在市场需求变化中能够迅速调整产品结构，实现盈利的最大化，体现了优异的管理能力。
受益于江苏地区钢铁产能结构调整。根据2018年8月江苏省省委办公厅发布的《关于加快全省化工钢铁煤电行业转型升级高质量发展的实施意见》，江苏省要求将钢铁总产能控制在1.15亿吨以下，2020年以前整合关停所有独立炼铁企业，钢铁企业数量减少到10家以下，徐州市的冶炼产能要比2017年下降30%以上，如此严格高标准的产业结构调整，很可能造成江苏局部地区的供给不足。马钢位于安徽省马鞍山市，与徐州的运输距离在350公里左右，在非常理想的运输半径之内，公司将充分受益于江苏省钢铁产业升级的红利。
投资建议：公司经营管理能力较强，产品结构调整迅速，预计2018-2020年将实现营业收入853.32亿元、949.32亿元、990.71亿元，实现归母净利润75.13亿元、78.56亿元、80.57亿元，EPS为0.98元、1.02元、1.05元，对应的PE为4.23倍、4.05倍、3.95倍。行业目前的TTM市盈率中位数为6.66倍，行业龙头的TTM市盈率为7.18倍，给予公司2018年6-7倍PE，合理区间为5.88-6.86元，给予“推荐”评级。",,财信证券,推荐,[None],2018-10-23,,买入,2236106,pdf_downloads/2018/2018-10-23/600808-马钢股份（600808）：长板材切换流畅，公司业绩稳步增长.pdf,600808,马钢股份,马钢股份（600808）：长板材切换流畅，公司业绩稳步增长
"笃慧,赖福洋,邓轲","业绩概要：公司公布2018年前三季度业绩公告，1-9月合计实现营业收入631.17亿元，同比增长19.39%；归属于上市公司股东净利润55.83亿元，同比增长103.79%，折合EPS为0.725元，其中三季度单季收入230.54亿元，同比增长30.42%，归属于上市公司股东净利润21.55亿元，同比增长96.62%，折合EPS为0.285元；
第三季度盈利创上市新高：公司前三季度分别实现归属于上市公司股东净利润14.18亿元、20.11亿元及21.55亿元，三季度环比二季度增长7.16%。以马钢集团经营数据测算，前三季度钢材销量分别为469万吨、480万吨及491万吨，对应吨钢净利为348元、464元及516元，三季度环比二季度增加52元/吨，公司业绩连续改善，第三季度盈利创上市以来新高；
适应市场灵活生产：公司业绩屡创新高，除钢铁行业维持高景气区间外，也离不开自身的主观能动性，不仅生产日趋稳定，资源配置也跟随市场灵活调整。公司三季度钢材产量490万吨，为2016年以来单季度最高产量，重点产线均达到最优状态，且生产资源在二季度优先配置板材（Q2板材产量环比上升7.63%），而三季度则倾向于长材（Q3长材产量环比上升13.02%），资源配置符合市场整体走势。从行业吨钢毛利变化情况来看，二季度螺纹钢及热轧吨钢毛利环比分别上升31.87%和33.26%，而三季度两者吨钢毛利则分别变动9.5%和-14.35%，公司根据市场及政策情况，努力实现生产盈利和环保安全的动态平衡，综合能力和抗风险能力持续提升；
四季度行业高盈利仍可期：我们在417降准后提出今年宏观主要矛盾由之前紧缩已经转向稳定内需，在外部贸易摩擦愈演愈烈的情况下，近期货币政策连续降准对稳定内需起到至关重要的作用。具体来看，需求方面地产投资仍然是目前钢铁消费的主要支撑力量，基建后期预计将逐步企稳，但在政府债务约束下，空间受到限制，两者仍然是一种对冲关系。现在已进入传统“金九银十”旺季，从目前库存去化速度及成交量来看，终端需求较为旺盛，我们预计四季度地产投资依然维持较高水平。而从供给端来看，虽然今年秋冬季错峰限产政策方向较去年“一刀切”更加灵活，但从各地陆续公布的草案来看，供给收缩预期仍然存在，预计四季度钢铁行业盈利仍可维持较高水平；
投资建议：公司作为华东地区的大型钢铁生产企业，企业盈利跟随行业基本面变化，而在宏观经济运行稳健背景下，未来行业盈利有望继续改善。我们预计2018-2020年公司EPS分别为0.95元、0.98元以及1.00元，维持“增持”评级；
风险提示：宏观经济大幅下滑导致需求承压；环保限产不及预期。",,中泰证券,增持,[None],2018-10-19,,增持,2235054,pdf_downloads/2018/2018-10-19/600808-马钢股份（600808）：单季度盈利再创新高.pdf,600808,马钢股份,马钢股份（600808）：单季度盈利再创新高
郑闵钢,"事件：
公司发布2018年半年度业绩公告，报告期内公司实现营业收入400.63亿元，同比增长13.86%；实现归属于上市公司股东的净利润34.3亿元，增幅108.62%；实现基本每股收益0.45元，增幅108.62%。
营收扩大，净利润同比大幅改善。报告期内，本集团共生产生铁917万吨，同比减少1.61%，生产粗钢999万吨、钢材952万吨，同比分别增加0.20%和0.95%（其中：本公司生产生铁730万吨，同比略有减少，生产粗钢793万吨、钢材741万吨，同比分别增长1.15%和1.09%，其中长材448万吨，板材490万吨，轮轴11万吨。本集团营业收入约400.63亿元，同比增加13.86%；归属于母公司股东的净利润约34.29亿元，同比增加108.62%。本集团资产负债率为59.83%，与2017年末相比，下降2.44个百分点。
坚持成本削减以提质增效。铁前系统高炉稳定顺行，钢轧系统在低铁钢比控制的情况下，主要依靠技术指标的进步，有效控制钢铁料消耗。报告期内，高炉炼铁原料矿消耗同比降低10kg/t，转炉炼钢金属料消耗同比下降7.3kg/t，炼钢吨钢综合能耗吨钢同比下降9.15kgce/t。入炉焦比同比下降11kg/t，喷煤比同比增加12.8kg/t，转炉利用系数、每炉产钢量亦有所提升。
持续优化产品结构。报告期内，钢材产品品种比54.5%，同比增加4.6个百分点；热轧产品品种结构调整成效明显，集装箱用钢、海底管线钢、铁路用钢、工程机械用钢等产量同比增加40%左右。高端客户认证获得新进展，汽车板、特钢正逐步进入一些高端客户。汽车板产量达142万吨，同比增加31.5%。
经营活动现金流大幅改善，期间费用同比增加。报告期内，2018年上半年公司经营活动产生的现金流量净额41.8亿元，同比增加186.4%，主要系销售商品收到的现金比上年同期增加所致。公司财务费用为5.75亿元，同比提高8.82%；销售费用为4.65亿元，同比提高12.84%；管理费用为6.99亿元，同比提高6.91%。
盈利预测与投资评级：我们认为下半年基建投资回暖利好长材价格中枢上行，预计公司2018年-2020年实现营业收入分别为765.6亿元、774.6亿元和774.6亿元；归母净利润分别为60.3亿元、64.5亿元和66.6亿元；EPS分别为0.78元、0.84元和0.87元，对应PE分别为4.9X、4.6X和4.5X，首次给予“强烈推荐”评级。
风险提示：
环保限产不及预期；下游需求不及预期。",,东兴证券,强烈推荐,[None],2018-09-04,,买入,2237278,pdf_downloads/2018/2018-09-04/600808-马钢股份（600808）：财报点评：提质增效促经营业绩稳步向好.pdf,600808,马钢股份,马钢股份（600808）：财报点评：提质增效促经营业绩稳步向好
王念春,"二季度单季归母净利润20.11亿元，创上市以来最好业绩
2018年上半年，公司实现营业收入400.63亿元，同比增长13.86%；实现归母净利润34.29亿元，同比增长108.62%；每股收益0.445元/股，同比增长108.92%。二季度单季实现营业收入217.55亿元，环比增长18.83%；归母净利润20.11亿元，环比增长41.79%。
炼钢产能充分释放，产品结构持续优化
集团在淘汰了两座420m3高炉，生铁产量同比下降的背景下，公司炼钢和轧钢系统实现低铁钢比下的钢铁料消耗有效控制，粗钢产量999万吨，同比增加0.20%。产品结构方面，公司灵活调配长材、板材比例，上半年，公司长材、板材、轮轴产量分别为452、490、10万吨。公司热轧产品品种结构调整成效明显，集装箱用钢、海底管线钢、铁路用钢等产量同比增加40%左右。汽车板产量达142万吨，同比增加31.5%，增长迅速。
拟定半年度每10股派息0.5元
中报披露董事会建议派发2018年中期现金股利每股人民币0.05元（含税）。这也是公司上市以来首次采用中期派息。钢铁行业经过供给侧结构性改革，行业盈利大幅改善，而因新增产能受限，投资受限，行业分红比例显著提高。
管理费用持续下降
上半年，公司销售费用、管理费用、财务费用分别为4.65亿元、6.99亿元和5.75亿元，吨钢三费分别为46.5、70.0、57.6元/吨，吨钢三费合计174.1元吨，较2017年小幅下降。其中，管理费用下降明显，吨钢管理费用下降6.3元/吨。
投资建议
预计2018-2020年公司净利润分别为64.1亿元、71.1亿元和78.8亿元。按照目前股价，对应市盈率分别为4.7、4.2和3.8，给予“增持”评级。
风险提示
钢材消费大幅下降。",,国信证券,增持,[None],2018-08-30,,增持,2221809,pdf_downloads/2018/2018-08-30/600808-马钢股份（600808）：2018年半年报点评：业绩创新高，分红提信心.pdf,600808,马钢股份,马钢股份（600808）：2018年半年报点评：业绩创新高，分红提信心
"笃慧,赖福洋,邓轲","业绩概要：公司发布2018年半年度报告，报告期内公司实现营业收入400.63亿元，同比增长13.86%；实现归属于上市公司股东净利润34.29亿元，同比增长108.62%；扣非后归属于上市公司股东净利润30.57亿元，同比增长99.64%；上半年EPS为0.445元，单季度EPS分别为0.18元、0.26元。此外，董事会建议派发2018年中期现金股利每股0.05元（含税），合计3.85亿元（含税）；
吨钢利润：2018年上半年公司淘汰两座420m³高炉情况下，生产经营仍延续去年良好态势。上半年生产生铁730万吨，同比基本持平，生产粗钢793万吨，同比增长1.15%，生产钢材741万吨，同比增长1.09%。结合公司半年报数据折算吨钢售价5407元、吨钢成本4589元、吨钢毛利818元，同比分别上升606元、317元、289元；
财务分析：公司二季度单季实现归母净利润20.11亿元，环比增长41.82%，创公司上市以来单季最高水平；上半年综合毛利率15.13%，同比增长4.10%，主要源于钢材销售价格上涨幅度高于原料端波动；期间费用率4.34%，同比下降0.19%，但对应吨钢三费同比上升17元；净利润率9.63%，同比上升4.21%；资产负债率59.83%，同比下滑3.72%，较年初下降2.44个百分点；
高效益产品增产增效：公司高盈利除行业整体景气度持续回升外，自身也积极加速提升创新竞争力。一方面实时优化资源配置，公司根据上半年板材、长材市场价格分化趋势，对高效益产品增产增效，增加高附加值产品比重；另一方面持续优化产品结构，上半年钢材产品品种比54.5%，同比增加4.6个百分比，热轧产品中集装箱用钢、海底管线钢、铁路用钢、工程机械用钢等产量同比增加40%左右，同时汽车板产量达142万吨，同比增加31.5%，整体产品创新竞争力进一步提升；
主动升级改造环保设备：在今年环保政策愈发严苛背景下，公司上半年主动实施环境综合整治，公司能耗总量、污染物排放总量明显削减，SO2和烟粉尘排放总量同比均下降约4.8%。公司及子公司合肥公司、长江钢铁目前废气废水排放远低于排放许可限值，固体废物均可实现零排放。此外，钢铁、自备电厂、焦化均通过环保机构审核，已取得排污许可证。虽然近期环保整治范围明显有扩张趋势，但预计对公司影响较小；
稳内需持续确认：年初以来我们一直认为今年经济下滑的主要原因在于财政收缩导致的基建下滑，但目前来看，经济仍处于韧性之中。在外部压力或仍将维持较长时间的背景下，近期货币政策进一步微调，虽然行政性政策密集出台对地产进行压制，但货币环境变更下，今年地产预计将进一步超出市场预期，进而对冲基建下滑影响，拉长需求延续的跨度。此外，近期环保限产政策频出，产能端持续受限制，行业高盈利有望延续；
投资建议：公司作为华东地区的大型钢铁生产企业，企业盈利跟随行业基本面变化，而在宏观经济运行稳健背景下，未来行业盈利有望继续改善。我们预计2017-2019年公司EPS分别为1.01元、1.05元以及1.11元，维持“增持”评级；
风险提示：环保限产效果不及预期；宏观经济大幅下滑导致需求承压。",,中泰证券,增持,[None],2018-08-30,,增持,2217950,pdf_downloads/2018/2018-08-30/600808-马钢股份（600808）：二季度盈利创新高，中报派发现金股利.pdf,600808,马钢股份,马钢股份（600808）：二季度盈利创新高，中报派发现金股利
"严鹏,任志强","产品优势：板长对半，型钢占优，高端产品发力。公司板材与长材产能比例为1:1，相较于某种钢材为主的企业拥有天然的轧线切换优势，生产经营灵活性更高。假设单月的可切换的产品产量占月均产量的10%，即15万吨，长板材的盈利平均相差水平为200元，则灵活的轧线切换带来的月均毛利可达到3000万元，年化可达到3-4亿。此外，公司的核心产品H型钢产量全国第三，行业集中度较高，在装配式建筑中使用较多。在国家大力倡导装配式建筑的背景下，H型钢的需求和盈利水平有望大幅上升。公司以汽车板为代表的高端产品也在稳步发展，火车轮轴继续保持优势。
成本优势：焦炭自给率高，焦化利润贡献增厚。拥有焦化产能的钢厂，业绩也可以分为钢厂和焦化厂两个部分；钢厂部分的盈利水平与其他外购焦炭的钢企一致，而焦化部分的盈利则是优于其他钢厂的盈利所在。进入Q3以来，焦炭的平均吨毛利已经达到358元/吨，螺纹钢的平均吨毛利在920元左右，即焦炭可以100%自给的钢厂吨钢毛利可以提升20%，盈利抬升不容小觑。后期焦炭的盈利预计会继续拉大，焦炭自给率高的企业成本优势会愈加凸显。公司的焦炭自给率高达67%，在钢铁行业处于前列。假设Q3焦炭平均吨毛利达到450元/吨，则公司焦化部分贡献的单季毛利就可达到5亿左右，对利润的放大效果非常明显。
去产能接近尾声，效率盈利双提升。今年以内公司的去产能任务望全部完成，500m3以下的高炉全部出清，配备人员也将进一步缩减。公司的人均钢产量料将继续提升，吨钢固定费用全面缩减，成本收缩效率提升。公司淘汰产能的产能置换方案已经经过批准，会在未来置换为260万吨的电炉产能，提前布局电炉产业。在落后产能出清的工作完成后，公司资产减值损失和员工辞退福利等非经常性的项目对利润的干扰将大幅减少，业绩释放料将更加充分。
可抵扣亏损减轻所得税负担，增厚公司利润。公司由于前期亏损较多，产生了大额的未确认为递延所得税资产的可抵扣亏损。2017年公司利用以前年度未确认为递延所得税资产的可抵扣亏损减少了6.5亿元的所得税，实际税率为13%，在行业中处于偏低位置。2017年年末公司未确认为递延所得税资产的可抵扣亏损尚有67亿，即理论上2018年公司67亿以内的利润都可以不产生所得税费用。公司也可以自主决定可抵扣亏损的使用时间。2018Q1公司的所得税率仅为8%，后期税盾的存在料将继续放大公司的盈利，增厚归母净利润。
盈利预测、估值及投资评级：基于三季度业绩预期，我们预测公司2018-2020年的营业收入分别为810.23/837.37/884.91亿元（原预测为691.38/719.57亿元），对应的归母净利润分别为68.47/76.83/89.94亿元（原预测为55.87/67.71/-亿元），对应的EPS分别为0.89/1.00/1.17元，（原预测为0.73/0.88/-元）；对应的PE为5/4/4倍（原为6/5/-倍），由于三季度钢铁焦炭利润双双上升，公司单季业绩大幅上涨的确定性较强，上调公司评级至“强推”。
风险提示：旺季需求不及预期，产生资产减值损失",,华创证券,强推,[None],2018-08-10,上调评级,买入,2209719,pdf_downloads/2018/2018-08-10/600808-马钢股份（600808）：落后产能出清效率全面提升，钢焦一体成本优势明显.pdf,600808,马钢股份,马钢股份（600808）：落后产能出清效率全面提升，钢焦一体成本优势明显
"笃慧,赖福洋,邓轲","产品布局完善：公司目前具备1933万吨铁、2298万吨钢和2127万吨钢材的生产能力。主要钢材产品大致可分为板材、长材和轮轴三大类。其中，板材主要包括薄板和中厚板，长材主要包括型钢、线棒材和特钢，轮轴主要包括火车轮、车轴及环件。轮轴产品、H型钢、家电板、汽车板和硅钢等产品处于业内领先水平，具有较高的市场竞争力；
板材业务后来居上：公司板材产品规模化生产起步晚，但成长迅速。2004年建成具有年产200万吨热轧薄板卷、150万吨冷轧薄板卷和35万吨镀锌板卷的薄板生产线，2007年建成500万吨高档薄板的现代化生产线，用于生产高质量的汽车用板、家电用板、管线钢、造船板等高档板材。目前公司板材类产能合计接近1000万吨，汽车板和家电板是重要看点，品牌研发技术能力不断提升，市占率持续突破；
轮轴产品领先优势持续巩固：“十三五”期间对铁路的中长期规划衍生出巨量的轨交装备市场需求，其中不乏铁轨、火车车轮等，据我们测算“十三五”期间国内外车轮需求约28万吨。此外，公司在2011年和车轴龙头——晋西车轴强强联合布局车轴产品，计划在十三五规划末期形成“轮、轴、架”完整产业链，目前已形成年产货车轮12500套、客车轮轴5500套和动车轮3000套的生产能力。公司在高铁、动车车轮方面具有核心竞争力，随着高速动车核心部件国产化进程的加速，预计高速动车车轮板块会给公司带来更多的盈利弹性；
盈利有望维持高位：年初以来宏观经济下滑的核心原因在于财政收缩导致的基建投资下滑，目前来看需求只是缓慢回落，但经济韧性依然可观。我们从年初即判断今年地产投资不悲观，4月17日突发降准后随即提出，受外部压力影响宏观政策将出现微调，6月24日央行宣布降准，进一步验证我们的观点，货币政策松动地产投资或超预期，从价增量平转变为量价齐升，将对冲基建投资下滑，需求有望重新企稳。在库存、产能周期依然健康的背景下，钢铁行业盈利有望高位运行；
投资建议：公司作为安徽省唯一一家本土钢铁上市公司，产品结构不断转型升级，已形成板材、长材、轮轴三类核心产品，其中汽车板集中定位于高端市场，未来市占率有望继续突破；家电板产销量位列行业第三，正在向高端和环保转型，板材产品整体竞争力不断提升。轮轴方面有望实现进口替代，轨交市场放量将提升公司业绩弹性。在宏观经济需求有望企稳的背景下，公司盈利将维持高位。预计公司2018-2020年EPS为0.82元、0.87元及0.90元，对应PE分别为4.78X、4.48X及4.33X，维持“增持”评级。
风险提示：宏观经济下行风险，环保限产不达预期。",,中泰证券,增持,[None],2018-06-25,,增持,2243682,pdf_downloads/2018/2018-06-25/600808-马钢股份（600808）：华东区域龙头业绩增长可期.pdf,600808,马钢股份,马钢股份（600808）：华东区域龙头业绩增长可期
王念春,"产量略增，长材毛利高于板材，国内毛利高于出口 2017 年，集团生产生铁 1,817 万吨、粗钢 1,971 万吨、钢材 1,860 万吨，同 比分别增加 3.00%、5.80%和 5.14%。长材毛利率为 16.7%，和 2016 年相比 大幅提高了 8.16 个百分点，而板材毛利率为 14.39%，同比下降了 1.71 个百 分点；从不同地区销售毛利率来看，出口的毛利率仅有 9.62%，大大低于国内 销售的平均毛利率，所以公司降低了出口量。  创上市以来最高利润 公司实现营业收入 732.3 亿元，同比增长 51.7%。2017 年上海地区螺纹钢、 热卷和中厚板的均价分别为 3807.4 元/吨、3741.2 元/吨和 3735.6 元/吨，分别 同比增长 57.9%、37.3%和 42.0%。其中，螺纹钢价格涨幅要高于公司营收增 速。营业收入的大幅增长主要得益于钢材价格的大幅上涨。2017 年马钢股份 销售毛利率和销售净利率分别为 13.21%和 6.93%，均创 10 年来新高。同期， 加权 ROE 和 ROA 分别为 18.92%和 7.33%，也位于较高水平。  财务状况有所优化，负债率下降，管理费用下降 马钢偿还了部分短期贷款，短期负债从 2017 年初的 69.4 亿元下降到年末的 46.3 亿元，下降了 23.1 亿元。同时，应付票据、应交税费、一年内到期的流 动负债均有一定程度的增加，导致流动负债增加了 25.7 亿元。另外，长期贷 款从 51.6 亿元增加到 69.8 亿元，增加了 18.1 亿元。同时，长期应付债券 39.9 亿元全部偿还。最终导致长期负债下降 17.8 亿元。企业总负债仍然增加了 7.9 亿元。同时，企业所有者权益也大幅增加了 51.6 亿元。企业负债率下降到 62.27%，下降 4.4 个百分点。 2017 年，马钢股份的销售费用、管理费用、财务费用分别为 8.7 亿元、14.2 亿元和 9.99 亿元，同比增加 24.6%、-20.3%和 25.8%。吨钢三费分别为 46.5、 76.3 和 53.7 元/吨，吨钢三费合计 176.5 元/吨，管理费用有所下降，而销售费 用和财务费用均有所增加。  风险提示 钢材消费大幅下滑。",,国信证券,增持,[None],2018-03-22,,增持,3629166,pdf_downloads/2018/2018-03-22/600808-马钢股份（600808）：生产稳定、利润大增.pdf,600808,马钢股份,马钢股份（600808）：生产稳定、利润大增
