author,content,filename,org_name,original_rating,pdf_link,publish_time,rating_adjust_mark_type,rating_changes,report_id,save_path,stock_code,stock_name,title
"申建国,边文姣,陈爽",公司公告1）与宁德时代深化战略合作，除新能源产业链外，拓展在汽车、智能机器人领域增量零部件及关节的合作；2）铁锂控股子公司江西升华以增资扩股方式引入战投宁德，并新建铁锂产能。公司持续发力铁锂+汽零业务布局，我们继续看好公司双业务并驾齐驱，保障长期业绩增长，维持“买入”评级。机器人积极对接头部企业，新增宁德为合作伙伴公司积极依托汽零业务的经验向人形机器人领域拓展。此次公告与宁德时代合作，为继24年10月公告拟与智元机器人等成立合资公司共同开发人形机器人、25年2月公告拟在绵阳市涪城区投资建设机器人智能电关节模组研发及生产基地项目后，在人形机器人领域的又一进程。公司目前主要布局机器人电关节总成，积极与行业头部机器人公司建立合资和共创机制，以打开产品应用场景。建议持续关注公司向国内外头部企业合作进展。增资扩股铁锂子公司估值提升，高压密产能加速布局公司公告铁锂控股子公司江西升华以增资扩股方式引入宁德时代作为战略投资者，以4亿元获得18.74%股权，对应估值21.3亿元，相较上一轮估值明显提升（以1.64亿元获得20%股权，对应估值8.2亿元）。产能方面，据此次公告，公司拟计划将于不晚于25年4月30日前完成江西基地新建产能的投产，并在不晚于25年7月31日达到并实现该基地新增8万吨/年产能的指标；将于不晚于25年9月30日前完成四川基地新建产能的投产，并在不晚于25年12月31日达到并实现该基地新增20万吨/年产能的指标。我们看好扩产缓解产能紧张情况，有助于提升出货。盈利预测与估值考虑到公司铁锂产品溢价权强、扩产进展顺利，我们上调公司25-26年的铁锂加工费假设，以及26年出货量假设，预测公司24-26年归母净利润为 4.17/13.03/17.22亿元（25-26年前值11.08/14.73亿元，分别上调17.62%、16.89%）。参考铁锂与汽零可比公司25年Wind一致预期下PE均值33.9x/33.5x，给予两块业务25年33.9x/33.5x PE（前值参考可比公司25年Wind一致预期24.4x/36.7x），目标价36.01元（前值26.85元），维持“买入”评级。风险提示：下游需求不及预期；原材料价格波动风险；行业竞争加剧。,,华泰证券,买入,[None],2025-03-11,,买入,5945781,pdf_downloads/2025/2025-03-11/300432-富临精工（300432）：机器人与宁德合作，铁锂增资扩产.pdf,300432,富临精工,富临精工（300432）：机器人与宁德合作，铁锂增资扩产
"杨睿,白宇,李唯嘉",新能源汽车增量零部件放量，带动汽零业务快速增长公司汽零业务主要分为汽车发动机零部件、新能源汽车智能电控系统及增量零部件两大核心板块，客户覆盖包括上汽、比亚迪、华为、理想、蔚来、小鹏、大众、通用、雷诺等全球范围内的传统主机厂以及新势力车企。2019-2023年，汽零业务收入从14.9亿元增长至29.5亿元，复合增速为19%，实现较快增长。随着新能源汽车渗透率快速提升，国内汽零竞争格局发生变化，公司把握市场发展机遇，严格管控产品成本，灵活调整产品布局以及客户结构，业务毛利率虽然有下滑但维持在25%以上的较好水平。铁锂正极技术优势明显，量利有望实现修复公司技术行业领先。公司子公司江西升华是国内磷酸铁锂正极材料草酸亚铁技术路线的开创者，具备独特的技术工艺路线以及行业领先的技术性能指标。凭借优异的产品性能，已经与宁德时代、蜂巢能源、比亚迪等国内知名锂电池生产企业建立了良好的合作关系，产品正在批量供应行业头部客户。公司铁锂量利呈现修复趋势。受新能源锂电行业周期波动、原材料碳酸锂价格出现大幅下跌以及市场供需端调整，前期铁锂价格出现大幅回落，公司铁锂业务收入以及毛利率受到影响。但从2024Q2起，在行业回暖、公司高性能产品出货提升等因素推动下，公司开工率回升，并于2024Q3实现扭亏。 我们认为，公司在技术上具备行业领先优势，在下游需求转好，公司产能扩大、利用率提升叠加产品结构调整等因素加持下，公司铁锂正极盈利能力有望不断提升。发挥精密制造优势，延伸布局机器人领域延伸精密制造工艺经验，携手智元入局机器人领域。汽车减速器和人形机器人减速器在精密机械加工技术工艺和精密齿轴等相关设备方面具有转化通用的基础条件。公司与智元机器人等展开合作，整合减速器、智能控制及电机技术，拓展谐波减速器和行星减速器两个平台的电关节产品。截至2024Q4，公司机器人电关节相关产品研发已经客户验证，已经开始小批量生产逐步开始交付，预计2025年实现批量供应。 我们认为，机器人领域为公司现有成熟业务的纵向延伸，工艺和技术均可借鉴和协同，为公司在机器人电关节模组方面发力累积深厚经验。机器人市场空间广阔，公司较早布局有望抓住先发优势，实现业绩的增厚。投资建议我们认为，公司的核心逻辑为：1）公司汽零持续发展，规模扩大+客户范围优化+产品放量带来业绩的稳中向好；2）铁锂技术行业领先，产品性能契合市场需求，量利进入双升阶段；3）机器人蓝海空间打开，公司率先布局有望获得增益。我们预计公司2024-2026年实现收入分别为76.96、137.19、164.63亿元，同比增长33.6%、78.3%、20.0%；归母净利润分别为4.10、10.06、14.23亿元，同比增长175.5%、145.4%、41.4%；EPS分别为0.34、0.82、1.16元，对应PE为60X、25X、17X（以2025年3月7日收盘价20.30元计算），首次覆盖，给予“增持”评级。风险提示1）行业发展不达预期；2）产能建设、产品放量、客户需求不达预期；3）行业政策、技术路线变化；4）产品、原材料价格大幅波动；5）客户回款不达预期等。,,华西证券,增持,[None],2025-03-10,,增持,5957574,pdf_downloads/2025/2025-03-10/300432-富临精工（300432）：汽零增量零部件+铁锂新技术向好发展，机器人开拓弹性空间.pdf,300432,富临精工,富临精工（300432）：汽零增量零部件+铁锂新技术向好发展，机器人开拓弹性空间
"曾朵红,阮巧燕,岳斯瑶,孙瀚博",投资要点铁锂行业高压实趋势明确，壁垒更高享技术溢价，传统铁锂供需改善涨价在即。随着神行电池等铁锂电池技术迭代，高压实密度铁锂正极具备能量密度优势，放量趋势明确，24年2.6g/cm3及以上压实铁锂13万吨，占行业总需求的5%。25年宁德时代神行占比提升至70%叠加比亚迪二代刀片升级，我们预计高压实铁锂需求达55万吨，同增4倍，占比迅速提升至16%，而行业目前仅湖南裕能、富临精工可满足，行业供给紧缺。25年铁锂正极产能利用率提升至66%，龙头公司满产满销，行业涨价在即，预计低端产品调涨0.2-0.3万/吨，高压实铁锂采用二烧工艺，产能需打60-70%折扣，成本更高，我们预计高端产品加工费可调涨0.1万/吨左右，维持0.1-0.2万元/吨左右盈利溢价，行业盈利弹性明显。公司高压密技术领先竞争对手一代，绑定宁德积极扩产量利双升。公司采用草酸亚铁路线，天生压实密度高，下游客户绑定宁德时代，为宁德时代高压实铁锂绝对主供，出货均为压实密度2.6g/cm3以上的产品，2.7压实产品已进入实验室阶段，产品领先行业一代。公司2024年出货出货11.7万吨，同增159%， 公司产品供不应求，我们预计25年出货25万吨，翻倍以上增长，26年我们预计出货35万吨，同增40%。公司24年受产能利用率及碳酸锂波动影响，全年单吨微亏，25H1公司高端产品有望涨价，叠加公司一体化降本+产能利用率提升，我们预计25年单吨净利有望提升至0.2万元，后续公司与赣锋合作布局磷酸二氢锂，可降本0.2万元/吨，预计25-26年落地，单位盈利有进一步提升空间。汽车零部件业务绑定头部车企，新能源增量部件快速增长。公司为传统发动机零部件细分领域龙头，市占率20%，覆盖大众、奥迪、吉利、长城等自主、合资客户，并开拓电驱总成、热管理模块、CDC电磁阀等新能源增量零部件，抓住爆款车型，主供理想、华为的电驱动总成；热管理模块全行业第一，市占率30%；CDC电磁阀领先实现国产替代。公司24年传统汽零业务预计38亿元，其中传统零部件预计20亿元，新能源零部件预计18亿元，25年我们预计同增60%至28亿元+，25年汽零收入我们预计达50亿元，同增30%，26年仍可维持30%增长。布局机器人电关节产品，卡位头部客户远期空间广阔。公司具备3年+机器人部件研发经验，已有谐波减速器和行星减速器两个平台的电关节产品，并与智元成立合资公司，且依托汽车零部件业务的客户优势，成功卡位头部客户。我们预计2035年人形机器人市场空间500万台/年，按单台关节总成价值量3-5万元计算，对应1500-2500亿元市场空间。盈利预测与投资评级：考虑公司高压密铁锂产品供不应求，盈利稳中有升，增量零部件业务维持稳定增长，我们预计公司2024-2026年归母净利4.1/10.8/15.0亿元，同增176%/162%/39%，对应PE为48/18/13倍。给予公司25年25xPE，目标价22元，首次覆盖，给予“买入”评级。风险提示：项目投产进度不及预期，行业竞争加剧，客户集中度较高。,,东吴证券,买入,[None],2025-01-27,,买入,5908353,pdf_downloads/2025/2025-01-27/300432-富临精工（300432）：高压密铁锂领军者，机器人业务开启新征程.pdf,300432,富临精工,富临精工（300432）：高压密铁锂领军者，机器人业务开启新征程
"申建国,边文姣,陈爽",公司发布2024年度业绩预告：24Q4归母净利润0.59-1.39亿元，同/环比+142.19%~+199.08%/-66.84%~-22.12%，扣非0.41-1.21亿元，同/环比+122.16%~+165.02%/-68.29%~-6.95%。2024年全年归母3.70-4.50亿元，同比+168.17%~+182.91%，业绩中值略低于我们此前预期。24年以来，公司高压密新品出货加速，铁锂材料业务自Q3开始迎来盈利拐点。我们看好公司铁锂+汽零双业务并驾齐驱，保障长期业绩增长，维持“买入”评级。高压密铁锂具备稀缺性，匹配下游需求增长有望量利齐升公司采用固相法+草酸亚铁制作高压密磷酸铁锂，产能具备稀缺性，公司出货量提升速度明显且产品溢价权强，随着未来大客户谈价的落地，25年加工费大概率涨价。我们推测公司Q4出货量超4万吨，确收约3.6万吨，单吨净利润超1000元/吨，我们预测25Q1出货有望达5万吨，单吨净利超1500元/吨。公司获得宁德时代2024年度优秀供应商奖，且与宁德签署25-27年每年至少14万吨的磷酸铁锂订单，为公司出货量提供有力支撑。零部件业务稳定增长，优质客户资源支撑需求公司传统零部件业务近年来稳步增长，19-23年营收CAGR达5.2%，新能源智能电控及增量零部件业务呈现快速增长态势。我们推测零部件业务Q4实现归母净利润约1.1亿。公司在新能源车汽零业务上有扎实的技术和布局，与下游上汽、广汽、比亚迪、华为、吉利、长城、蔚小理等头部客户深度合作，客户资源优质，未来零部件业务稳定增长的可预见性较强。积极布局人形机器人产业，样机方案进入小批量生产公司基于汽零业务的经验向人形机器人领域延伸。24年10月公司公告拟与智元机器人等成立合资公司，共同开发人形机器人。目前公司已拓展谐波减速器和行星减速器平台的电关节产品，样机方案已完成并进行小批量生产。目前公司积极于国内外头部公司执行器和本体公司开展送样合作。盈利预测与估值考虑到碳酸锂跌价带来的存货减值、部分铁锂订单延迟确认、公司扩产进展顺利，我们下调公司24年、上调25与26年的出货量假设，预测公司24-26年归母净利润为 4.17/11.08/14.73亿元（前值4.44/9.62/12.00亿元），其中铁锂/汽零25年净利润分别为6.38/4.70亿元。参考铁锂与汽零可比公司25年Wind一致预期下PE均值24.4x/36.7x，给予两块业务25年24.4x/36.7x PE（前值31.3x/25.5x），目标价26.85元（前值22.10元），维持“买入”评级。风险提示：下游需求不及预期；原材料价格波动风险；行业竞争加剧。,,华泰证券,买入,[None],2025-01-22,,买入,5903220,pdf_downloads/2025/2025-01-22/300432-富临精工（300432）：业绩暂受减值影响，铁锂业务向好.pdf,300432,富临精工,富临精工（300432）：业绩暂受减值影响，铁锂业务向好
张涵,事件富临精工发布《关于以债转股方式对江西升华新材料有限公司增资的公告》：公司拟将所持有的江西升华7.35亿元债权转作对其增资，增资价格为1.13元/注册资本，增加江西升华注册资本6.5亿元。本次增资完成后，江西升华的注册资本将由8.2亿元增加至14.7亿元，公司持有江西升华的股权比例将由96.27%增加至97.92%。投资要点磷酸铁锂：定位高端快充市场，上下游深度合作公司采用独特的草酸亚铁技术路线生产磷酸铁锂正极材料，产品具备高压实密度、高比容量、长循环寿命等特点，有效满足了新能源汽车快充需求，差异化竞争优势凸显。目前，高压实磷酸铁锂产品性能优势已部分转化为溢价，公司加工费行业领先，出货量也同步显著提升。2024Q3公司出货磷酸铁锂3.56万吨，实现满产满销，且均为满足高端快充市场的高压实产品，单吨盈利超1000元，磷酸铁锂业务成功扭亏。随着市场上磷酸铁锂产品的差异化、高端化需求快速增长，预计公司产品将体现出更强的出货和价格弹性。下游客户方面，公司与大客户宁德时代深度合作，双方于2024年8月签署合作协议。根据协议，公司将获宁德时代2025~2027年期间每年至少14万吨磷酸铁锂订单，并获其预付款支持扩产7.5万吨，为公司后续出货提供了有力支撑。一体化布局方面，公司积极布局原料端，合作赣锋锂业设立合资公司（江西升华持股49%），拟在四川达州新建年产10万吨硫酸锂制造磷酸二氢锂项目，旨在保障原料稳定供应并推进降本。汽零：业务稳健增长，经营结构不断优化公司汽车零部件业务保持稳健增长，经营结构不断优化，新能源汽车增量零部件收入占比已超 60%，成为公司收入增长、利润实现较快的板块，电驱动减速系统、热管理系统以及 CDC 电磁阀等产品均已开始规模化放量并贡献业绩，市场占有率稳步提升。公司2024年12月公告，子公司芯智热控拟引入战投（奇瑞汽车旗下产业基金瑞丞芯车、绵阳市政府投资平台公司涪江资本），公司新能源热管理业务竞争力有望进一步提升。机器人：拓展电关节总成产品，打开成长空间公司基于机电一体化的研发和制造能力，向机器人领域延伸，已拓展机器人电关节总成产品，研发已经客户验证，开始小批量生产并逐步交付，预计明年实现批量供应，有望打开公司远期成长空间。另外，公司2024年10月公告，拟与智元机器人等成立合资公司，共同开发人形机器人市场。盈利预测预测公司2024-2026年收入分别为85.00、128.63、157.19亿元，EPS分别为0.38、0.81、1.00元，当前股价对应PE分别为40.1、19.0、15.4倍，给予“买入”投资评级。风险提示锂电需求不及预期风险、汽车零部件需求不及预期风险、机器人业务进度不及预期风险、竞争加剧风险、原材料价格波动风险、汇率波动风险。,,华鑫证券,买入,[None],2025-01-01,,买入,5880570,pdf_downloads/2025/2025-01-01/300432-富临精工（300432）：磷酸铁锂定位快充市场，拓展机器人电关节产品.pdf,300432,富临精工,富临精工（300432）：磷酸铁锂定位快充市场，拓展机器人电关节产品
"申建国,边文姣,陈爽",公司为国内传统精密零部件龙头，同时切入新能源铁锂正极材料与新能源汽车智能电控等零部件赛道。23年公司业绩受到碳酸锂价格大幅下跌影响而承压，24年以来，随着锂价企稳同时公司高压密新品出货加速，铁锂材料业务自Q3开始迎来盈利拐点。我们看好公司铁锂+汽零双业务并驾齐驱，实现双轮驱动，保障长期业绩增长，维持“买入”评级。传统零部件提供利润基本盘，智能电控及增量零部件加速释放公司传统零部件业务19-23年稳步增长，营收CAGR达5.2%。公司积极争取国内主流自主品牌的海外出口传统业务，巩固市场份额，我们预计传统零部件业务未来几年仍将实现稳步增长。公司在新能源车汽零业务上有扎实的技术和布局，与下游上汽、广汽、比亚迪、华为、联合电子、吉利、长城、蔚小理等头部客户深度合作。公司紧跟新能源汽车智能化、电动化转型步伐，新能源智能电控及增量零部件业务有望实现快速增长。铁锂差异化定位中高端市场，上下游深度合作保障业绩增长公司独创采用固相法+草酸亚铁制作磷酸铁锂，产品压实密度高，循环衰减较少；且持续通过研发创新匹配下游中高端需求，顺应新能源汽车行业快充趋势推出磷酸铁锂快充产品，出货量提升速度明显。公司下游与大客户宁德时代深度合作，24年8月公司与宁德签署协议，获25-27年每年至少14万吨的磷酸铁锂材料订单，为公司出货量提供有力支撑。一体化方面，公司积极布局锂、磷等原料端，保障原料端稳定供应以及推进降本。积极布局人形机器人产业，进一步延伸精密智造产业汽车减速器和机器人减速器在精密机械加工技术工艺和精密齿轴等相关设备方面具有转化通用的基础条件，公司基于汽车零部件的生产制造经验，向人形机器人领域延伸，有望打开成长空间。24年10月公司公告拟与智元机器人等成立合资公司，共同开发人形机器人市场应用。公司已拓展谐波减速器和行星减速器平台的电关节产品，样机方案已完成并进行小批量生产。盈利预测与估值 我们预计公司24-26 年归母净利润 4.44/9.62/12.00 亿元，磷酸铁锂、汽车零部件及配件业务 25 年净利润分别为 4.20/5.42 亿元。参考磷酸铁锂材料与汽车零部件及配件业务可比公司 25 年 Wind 一致预期下 PE 均值31.3x/25.5x，分别给予两块业务2025 年31.3x/25.5x PE，目标价22.10 元，维持“买入”评级。  风险提示：下游新能源汽车销量不及预期；原材料价格大幅波动风险；行业竞争加剧导致盈利能力不及预期。,,华泰证券,买入,[None],2024-11-22,,买入,5839654,pdf_downloads/2024/2024-11-22/300432-富临精工（300432）：铁锂业务转好，加码机器人部件.pdf,300432,富临精工,富临精工（300432）：铁锂业务转好，加码机器人部件
张涵,公司主营汽车零部件和新能源锂电正极材料业务公司主要业务为汽车发动机零部件、新能源汽车智能电控、新能源锂电正极材料的研发、生产和销售。2023年前三季度，公司实现营收41.78亿元，同比降低11.54%，实现归母净利润-4.02亿元，同比降低167.04%，业绩同比下滑主要系磷酸铁锂业务板块亏损所致；2023Q3，公司单季度实现营收18.56亿元，同比降低8.37%，环比增长16.20%，实现归母净利润-0.79亿元，同比降低132.14%，环比降低139.72%。加快布局新能源汽车零部件，锚定长期成长性传统发动机零部件龙头。公司长期深耕汽车发动机零部件领域，已成为国内细分领域隐形冠军，首先实现了精密液压零部件和电磁驱动零部件产品的国产替代。加快布局新能源汽车零部件。公司依托精密制造优势，加快布局新能源汽车智能电控及增量零部件，涵盖热管理系统、新能源汽车减速器、智能减震系统等，代表产品为电子水泵、电子油泵、车载减速器总成和可变阻尼减震器电磁阀（CDC)系列产品等，公司与比亚迪、上汽、通用、大众、理想、蔚来、小鹏、博世、联合电子等下游客户的技术研发中心建立长期的产品合作研发关系，以快速响应整车厂或主机厂的技术需求和产品需求。公司与华为的合作主要集中在智能电驱动减速器总成及其零部件产品，相关产品配套问界系列车型。公司在新能源车载电驱动减速器项目持续爬坡增量的情况下，继续导入智能电控系统及关键部件业务，已完成主要国产自主品牌及主流新势力车企的定点，产品线逐步进入收获期并贡献业绩，市场占有率逐步提升。目前公司在手新能源汽车零部件订单充足，产能利用率水平高，未来有望成为公司业绩支撑重要板块。公司将积极把握机器人产业机遇。机器人领域是公司汽车精密制造零部件产品应用领域的延伸，同时，汽车减速器和人形机器人减速器也具有加工工艺和加工设备方面的通用性，公司将积极拓展并把握智能机器人产业的机遇。磷酸铁锂板块对业绩的影响逐渐减小2023 年前三季度，受锂电材料供需关系失衡、原材料价格波动影响，公司磷酸铁锂产能利用率低，叠加大额存货减值影响（前三季度计提存货减值准备6.24亿元），磷酸铁锂营业收入及利润下滑。聚焦Q3来看，当季出货量和市占率较Q2有所提升，但当期加工费、客户结算调整变化对公司磷酸铁锂业绩产生不利影响。从公司目前经营和排产情况看，磷酸铁锂产销量在继续恢复，加工费在企稳，整体市场需求在逐渐恢复，客户合作模式在变化，碳酸锂的客供比例在加大，磷酸铁锂板块对公司业绩的影响在逐渐减小。盈利预测预测公司2023-2025年收入分别为54.69、72.69、91.89亿元，EPS分别为-0.27、0.54、0.79元，当前股价对应PE分别为-46.7、23.2、15.9倍，看好公司新能源汽车零部件业务受益于汽车电动化、智能化发展趋势，首次覆盖，给予“买入”投资评级。风险提示汽车零部件需求不及预期风险、新产品推广进度不及预期风险、原材料价格波动风险、竞争加剧风险。,,华鑫证券,买入,[None],2023-11-30,,买入,5407881,pdf_downloads/2023/2023-11-30/300432-富临精工（300432）公司动态研究报告：加快布局新能源汽车零部件，锚定长期成长性.pdf,300432,富临精工,富临精工（300432）公司动态研究报告：加快布局新能源汽车零部件，锚定长期成长性
