author,content,filename,org_name,original_rating,pdf_link,publish_time,rating_adjust_mark_type,rating_changes,report_id,save_path,stock_code,stock_name,title
张建民,业绩快速增长，费用端持续优化2023年前三季度，公司实现营收55.02亿元，同比+51.04%，实现归母净利润4.45亿元，同比+54.39%，实现扣非归母净利润4.21亿元，同比+56.84%。前三季度毛利率为29.01%，同比-1.57pct。公司费用管控不断优化，销售/管理/研发/财务费用率分别为7.93%/3.12%/5.85%/0.95%，同比分别-1.22/-1.31/-0.26/-0.88pct。分季度看，23Q3公司营收为21.05亿元，同比+47.25%，环比+10.43%，归母净利润为1.23亿元，同比+0.96%，环比-30.74%，扣非归母净利润为1.21亿元，同比+5.09%，环比-28.47%。毛利率为28.56%，同比-1.38pct，环比-0.39pct。净利率为5.98%，同比-2.97pct，环比-3.54pct。销售/管理/研发/财务费用率分别为8.12%/3.06%/5.27%/1.06%，同比分别-0.68/-1.42/-1.18/-0.15pct。根据数据中心经营情况，计提减值准备。公司预计23年前三季度计提减值准备金额共约7146万元，其中信用减值准备和资产减值准备分别2235和4910万元。算力+液冷打开数据中心业务新局面23年10月25日，公司的第十个大型自建数据中心——北京云著数据中心正式发布，是北京市区内首个批复的“工业互联网+AI”数据中心，将采用液冷、模块化电源、微模块、AI 运维等众多节能技术，最大程度降低能耗，PUE 值低于 1.2。公司目前在北上广等一线城市共自建 10 座数据中心，能够为客户提供数据中心建设运营、高电力机柜托管、高效网络连接和组网、公有云+私有云部署、绿色节能解决方案、AI 智慧运维等一站式算力基础设施服务。智慧电能及新能源业务行业地位领先智慧电能方面，公司深耕能源管理领域10余年，为AI+能源管理领导者，不断加强智慧电源产品技术研发。根据FORWARD发布报告，公司UPS位居2022年中国市占率第一。新能源方面，根据 CNESA 数据显示，公司 2022 年全球储能 PCS 出货量排名第二，国内用户侧储能系统出货量排名第一，积累储能项目案例 3000 余个，覆盖电源侧、电网侧、用户侧等全场景，产品于国内外实现批量应用。盈利预测与估值公司基于“科华数据”+“科华数能”的“双子星”战略，有望在AI产业链快速发展及新能源行业高景气下，获得更好的发展机会。预计 23-25 年归母净利润 6.67/8.89/11.48亿元，当前市值（2023 年10月31日收盘价）对应 23-25 年 PE分别为19/15/11倍，维持“买入”评级。风险提示数据中心建设进度不及预期；新能源业务需求不及预期；行业竞争加剧等。,,浙商证券,买入,[None],2023-10-31,,买入,5370490,pdf_downloads/2023/2023-10-31/002335-科华数据（002335）：2023年三季报点评报告：业绩快速增长，算力+液冷数据中心业务新局面.pdf,002335,科华数据,科华数据（002335）：2023年三季报点评报告：业绩快速增长，算力+液冷数据中心业务新局面
"张建民,王逢节",科华数据(002335)投资要点事件：2023年上半年业绩整体高增，Q2单季度盈利能力同比提升2023H1公司实现营业收入33.97亿元，YOY+53.48%；归母净利润3.22亿元，YOY+93.73%；扣非后归母净利润3.00亿元，YOY+95.62%。其中，2023Q2实现营收19.06亿元，YOY+56.31%；归母净利润1.78亿元，YOY+162.13%；扣非后归母净利润1.69亿元，YOY+148.79%；毛利率28.95%，同比/环比-0.85/-0.77pct；净利率9.52%，同比/环比+3.68/-0.37pct。降本增效成果主要得益于管控能力增强，费用端持续改善。2023Q2公司费用率11.30%，同比-4.74pct，环比-1.28pct；销售费用率、管理费用率、财务费用率分别7.70%/2.87%/0.72%，分别环比-0.27/-0.64/-0.37pct，分别同比-2.19/-1.46/-1.09pct。新能源大幅增长，快速拓展海外市场2023H1公司新能源行业业务营收15.85亿元，YOY+283.14%，占总营收比重46.67%，毛利率24.86%，同比-2.14pct，其中储能业务收入占比达70%。“双碳”目标时代背景下，新能源行业景气高增，公司依托成熟的电力电子技术持续发力光储赛道，实现新能源业务大幅增长，包括储能、光伏等可再生能源应用领域。根据CNESA数据显示，公司2022年全球储能PCS出货量排名第二，国内用户侧储能系统出货量排名第一，行业龙头地位凸显。光伏领域，公司与“五大六小”、地方国企等十数家央国企扩大合作领域，逆变器解决方案入围中国华能、中国华电、中核汇能、大唐等大型国央企集采项目，中标十数个单体100MW以上光伏项目。除此之外，公司快速拓展海外市场，与诸多国际知名企业展开合作，有望进一步增厚业绩。数据中心产品持续迭代，拥抱AI新机遇2023H1公司数据中心行业业务营收12.87亿元，YOY-1.94%，占总营收比重37.90%，毛利率31.13%，同比+1.34pct，其中IDC服务和数据中心及集成产品收入分别为6.48/6.39亿元。公司目前拥有9大数据中心，自持机柜3万多个，上架率保持70%以上，客户覆盖三大运营商、腾讯等互联网企业、各大金融机构及政府机关。根据FORWARD发布报告，公司微模块数据中心位居2022年中国市占率第一，且是液冷领域先行者，WiseCooling冷板式液冷系列产品高度适合数据中心现状和需求，成功案例包括广州科云数据中心、厦门大学嘉庚实验室超算数据中心等。公司产品持续迭代升级，发布新一代模块化数据中心产品慧云7.0，引领数据中心建设迈入集智体验新阶段。随着算力需求爆发，公司积极布局算力基础设施建设，拓展人工智能、芯片、自动驾驶和生物医药等新兴行业客户，与腾讯、燧原科技、沐曦、亿铸科技等企业开展积极合作，推出AI裸金属租赁、GPU算力池、云上弹性算力、AI算力服务平台等解决方案，打开新的成长空间。UPS龙头地位稳固，重点拓展AI+智慧电能2023H1公司智慧电能行业业务营收4.92亿元，YOY+8.95%，占总营收比重14.48%，毛利率35.03%，同比+0.67pct。公司深耕能源管理领域10余年，为AI+能源管理领导者，解决方案在机场、数据中心、光伏储能、化工电子等领域均有成熟的垂类模型，已在部分场景落地应用。公司不断加强智慧电源产品技术研发，根据FORWARD发布报告，公司UPS位居2022年中国市占率第一，且内置S3锂电池模的Eon系列UPS顺利进入北美市场，国际竞争力显著提升。盈利预测与估值公司基于“科华数据”+“科华数能”的“双子星”战略，有望在AI产业链快速发展及新能源行业高景气下，获得更好的发展机会。预计23-25年归母净利润6.67/8.89/11.48亿元，当前市值（2023年9月13日收盘价）对应23-25年PE分别为22/16/13倍，维持“买入”评级。风险提示新能源业务需求不及预期风险；数据中心建设进度不及预期风险；海外市场开拓情况不及预期风险；行业竞争加剧风险。,,浙商证券,买入,[None],2023-09-14,,买入,5326311,pdf_downloads/2023/2023-09-14/002335-科华数据（002335）更新报告：新能源驱动高增长，拥抱AI发展新机遇.pdf,002335,科华数据,科华数据（002335）更新报告：新能源驱动高增长，拥抱AI发展新机遇
"韩晨,汪翌雯",事件：公司发布2023年半年报，上半年实现收入34.0亿元，同比+53.5%，实现归母净利润3.2亿元，同比+93.7%；其中单Q2实现收入19.1亿元，环比+28.2%，实现归母净利润1.8亿元，环比+23.6%，业绩符合市场预期。IDC增量需求仍待释放，机柜上架率承压，不改长期下游数据中心、算力需求旺盛。2023H1公司数据中心实现营收12.87亿元，同比-1.98%，其中IDC服务6.48亿元，同比-12.67%，数据中心产品及集成产品6.39亿元，同比+12.02。IDC增量需求仍待释放，公有云客户前期资源池部署充沛，互联网创新业务发展仍需时日，传统行业需求尚未得到释放，根据《2022-2023年中国IDC行业发展研究报告》，当前我国IDC机柜平均上架率在58%左右，上架率短期内出现一定下降。公司今年积极开拓新客户弥补互联网需求低迷，重点发力政企、医疗、金融、教育四大行业客户，有效应对风险。新能源业务增速亮眼，储能成发展重点。2023H1公司新能源业务实现营收15.9亿元，同比+282.9%。国内、海外同步发展，储能业务成发展重点。1）国内-储能系统：公司以储能系统整体为出发点，在大型地面电站侧，公司成功交付了多个百兆瓦级的共享储能示范项目；在工商业侧，公司实现多个项目落地。政策支持+峰谷价差拉大，工商储迎爆发元年，根据GGII，2023年我国工商业储能新增装机规模预计8GWh，同比+300%。公司工商储下游与UPS客户一致性高、较好拓展。2）海外-PCS、光储一体化产品及储能系统：截止2023H1，公司与土耳其Elin、丹麦JGH签署战略合作，成功签约联合国微网项目，发布全新一代250kW组串式逆变器在意大利、越南、波兰及巴西等国取得成功应用，同时推出S³-EStore智能液冷储能系统助力海外工商储。管理能力加强，毛利率、净利率稳步提升，费用率连续两个季度下行。2023H1公司毛利率28.8%，较2022年下降0.7pp；净利率9.4%，较2022年提升5pp。分业务来看，数据中心毛利率31.13%，较2022年提升0.24pp；智慧电能毛利率35.03%，较2022年提升1.39pp；新能源业务毛利率24.86%，较2022年提升1.72pp。从整体费用率情况来看，2023H1公司期间费用率18.23%，较2023Q1、2022年下降0.91pp、2.49pp，其中研发费用率6.26%，销售费用率3.19%，管理费用率7.89%。盈利预测与投资建议。预计2023-2025年EPS分别为1.57元、2.09元、2.86元，对应动态PE分别为20倍、15倍、11倍，看好公司光储业务高速增长、数据中心需求提振，维持“买入”评级。风险提示：市场竞争风险，海外政策风险。,,西南证券,买入,[None],2023-09-02,,买入,5311248,pdf_downloads/2023/2023-09-02/002335-科华数据（002335）：光储增速亮眼，费用管控能力进一步提升.pdf,002335,科华数据,科华数据（002335）：光储增速亮眼，费用管控能力进一步提升
殷晟路,2023年上半年营收利润双增，业绩略超预期科华数据发布2023年半年报，公司2023H1实现营业收入33.97亿元，yoy+53.5%。实现归母净利3.22亿元，yoy+93.7%，实现扣非归母净利3亿元，yoy+95.6%，均位于此前业绩预告中值。其中2023Q2实现营收19.1亿元，QOQ+28.0%，yoy+56.3%，归母净利1.78亿元，QOQ+24.2%，yoy+162.1%。扣非归母净利1.69亿元，yoy+148.8%。2023Q2毛利率/净利率为28.95%/9.52%，分别环比-0.77pct/-0.37pct，销售/管理/研发/财务费用率分别为7.7%/2.9%/5.9%/0.7%，分别环比-0.3/-0.6/-0.7/-0.4pct。其中2023H1实现海外收入6.02亿元，占比17.7%，yoy+126.87%，毛利率为38.87%，yoy+8.86pct。公司数据中心业务在AI加持下有望加快发展以及公司新能源业务持续放量，我们上调公司2023-2024年盈利预测，预计公司2023-2024年归母净利润为7.82/10.98亿元（原7.45/9.23亿元），新增2025年盈利预测为14.65亿元，EPS为1.69/2.38/3.17元，对应当前股价PE为18.9/13.4/10.1倍，维持“买入”评级。新能源业务快速增长，出海规划稳步推进公司新能源业务2023H1实现营收15.85亿元， yoy+283.14%，毛利率为24.86%，yoy-2.14pct。公司负责新能源业务的子公司科华数能2023H1实现营收11.28亿元，净利润1.13亿元，净利率10.0%。公司积极拓展新能源业务出海，在2023H1同土耳其 Elin、丹麦 JGH 签署战略合作，并在美国、波兰、法国、巴西等多国设立营销和服务团队，实现包括光伏逆变器、户储及大储产品的积极出海。数据中心、智慧电能业务有所回暖，AI有望带动业绩增量数据中心产品及集成业务2023H1实现营收6.39亿元，yoy+12.02%，毛利率为37.57%，yoy+2.67pct。IDC服务2023H1实现营收6.48亿元，yoy-12.67%，毛利率为24.77%，yoy-1.08pct。公司智慧电能业务2023H1实现营收4.92亿元，yoy+8.95%，毛利率为35.03%，yoy+0.67pct。数据中心产品及智能电能同比2022H1有所回暖，随着AI的大规模应用，公司作为“AI+能源管理”专家有望充分受益行业进步与技术革新。风险提示：IGBT模块供应紧张影响公司出货；行业竞争加剧风险。,,开源证券,买入,[None],2023-09-01,,买入,5310645,pdf_downloads/2023/2023-09-01/002335-科华数据（002335）公司信息更新报告：2023H1业绩超预期，“AI+新能源”战略稳步推进.pdf,002335,科华数据,科华数据（002335）公司信息更新报告：2023H1业绩超预期，“AI+新能源”战略稳步推进
"杨润思,杨凡仪",事件：公司发布2023年半年报。公司2023H1实现营收33.97亿元，同增53.48%；实现归母净利润3.22亿元，同增93.73%。其中，23Q2单季营收为19.06亿元，同增56.31%；归母净利润为1.78亿元，同增162.13%。IDC发展稳健，新能源收入高增。分产品看：2023年上半年1）数据中心行业：IDC服务收入6.48亿元，同降12.67%，毛利率24.77%（-1.08pct）；数据中心产品及集成收入6.39亿元，同增12.02%，毛利率37.57%（+2.67pct）；2）智慧电能产品收入4.92亿元，同增8.95%，毛利率35.03%（+0.67pct）。3）新能源产品收入15.85亿元，同增283.14%，毛利率24.86%（-2.14pct）。分地区看：23H1公司国内收入同增44.44%至27.62亿元，毛利率26.54%（-3.69pct）；国外收入同增126.87%至6.02亿元，毛利率38.87%（+8.86pct）。期间费率同比降低，公司23Q2盈利能力同比改善。毛利端：公司23Q2毛利率为28.95%，同比-0.85pct。费率端：公司23Q2期间费率17.21%，同、环比-4.59pct/-1.93pct，其中销售、管理、财务费率同比-2.19pct/1.46pct/-1.09pct。净利端：23Q2净利率同比+3.67pct至9.52%。展望2023年：IDC+储能业务双轮驱动，重视科华2023年业绩端弹性。1）数据中心：AI发展催化算力需求，IDC进入新一轮增长周期。近期公司深度合作客户腾讯云发布大模型算力集群，并与沐曦签署战略合作协议，基于以AIGC为代表的AI领域打造算力新业态。公司目前公司在北、上、广等地拥有9大数据中心，运营机柜数量约3万余个，有望充分享受赛道发展红利。考虑到公司2022年数据中心业务低基数效应，预计2023年业务增速有望达到15%或以上。2）新能源：国内中标大储项目+海外户储表现亮眼，新能源业务预计持续高增。国内：公司先后中标多个百MWh独立储能项目，此外公司推出数据中心储能解决方案，未来有望快速增长。海外：户储业务有望迅速形成规模，贡献业绩弹性。目前iStoragE系列光储一体机海外反响良好。2022年9月公司与美国Juniper签订年供货1万套iStoragE系列户储系统协议（对应约200MWh规模）。盈利预测与投资建议。预计公司2023-25年归母净利8.12/10.75/14.19亿元，同增227.0%/32.3%/32.0%，维持“买入”评级。风险提示：数据中心行业增速不及预期、新产品落地或交付不及预期、新能源相关政策变动风险、宏观经济疲软。,,国盛证券,买入,[None],2023-09-01,,买入,5310345,pdf_downloads/2023/2023-09-01/002335-科华数据（002335）：IDC稳健、储能高增，Q2单季盈利能力同比改善.pdf,002335,科华数据,科华数据（002335）：IDC稳健、储能高增，Q2单季盈利能力同比改善
"王磊,杨帅波",数据中心为基，光储业务高增，强化海外拓展投资要点事件：公司发布2023年半年报。2023H1公司营收34.0亿元，同比+53.5%；归母净利润3.2亿元，同比+93.7%；其中2023Q2公司营收19.1亿元，同环比分别+56.3%/+27.9%，归母净利润1.8亿，同环比分别+162.1%/24.2%。收入端：新能源是公司业绩高增的引擎。2023H1公司新能源产品、数据中心、IDC服务、智慧电能产品营收分别为15.9/6.4/6.5/4.9亿元；同比分别为+283.1%/+12.0%/-12.7%/9.0%。利润端：费用管理优化，盈利改善。2023H1公司毛利率、净利率分别29.3%/9.7%，同比分别-1.7pcts/+1.9pcts。2023H1公司主要费用中，销售费用率（9.3%）、管理费用率（7.8%）和财务费用率（0.9%）下降明显，研发费用率（6.2%）有所上升，四项费用率总体下降3.83pcts，有效提升公司的盈利能力。新能源产品不断丰富，储能项目不断落地，积极拓展海外。公司核心产品涵盖3kW-9MW光伏逆变器、3kW-6.9MW储能变流器、1500VS³液冷储能系统、EMS智慧管理平台等，推出S³-EStore一体式智能液冷储能系统面向海外工商业储能。2023H1公司成功交付多个大储、工商业储能示范项目。海外方面，与土耳其Elin、丹麦JGH签署战略合作。数据中心产品持续迭代，业务稳定增长。公司目前有9大数据中心，自持机柜3万多个，在全国运营20多个数据中心。公司高度重视数据中心产品技术的研发，是行业内液冷领域的先行者，WiseCooling液冷解决方案专门针对高密度服务器而设计。产品持续迭代升级，公司发布新一代模块化数据中心产品——慧云7.0。产品力的持续提升将有助于业绩的稳步提升。公司是国内UPS龙头企业之一，募投扩产抓住国内UPS行业景气度。公司1988年成立起就从事UPS产销，是国内UPS的龙头企业之一，公司发行可转债拟募资不超过14.9亿用于UPS扩产等，第3-5年产能利用率分别为15%、70%、100%，满产中小功率电源11.2万台，大功率电源3.48万台，项目达产后预计可实现营收（不含税）为16.1亿元/年，净利润1.5亿元/年。根据赛迪顾问，我国UPS市场规模CAGR为19.7%，2024年市场规模145.4亿，UPS电源市场容量稳步增长。盈利预测与投资评级：我们预测公司2023-2025年营收分别为79.2/112.3/157.2亿元，归母净利润分别为7.7/10.5/14.1亿元，对应PE分别为19/14/11倍，首次覆盖，给予“买入”评级。,,中邮证券,买入,[None],2023-09-01,,买入,5311548,pdf_downloads/2023/2023-09-01/002335-科华数据（002335）：数据中心为基，光储业务高增，强化海外拓展.pdf,002335,科华数据,科华数据（002335）：数据中心为基，光储业务高增，强化海外拓展
"贺朝晖,梁丰铄",事件：公司发布2023年半年报，23H1实现营收33.97亿元，同比+53.48%；实现归母净利润3.22亿元，同比+93.73%。其中23Q2实现营收19.06亿元，同比+56.31%，环比+27.95%；实现归母净利润1.78亿元，同比+162.13%，环比+24.17%。新能源业务高速增长，带动整体业绩大幅提升23H1数据中心/智慧电能/新能源业务分别实现营收12.87/4.92/15.85亿元，分别同比-1.94%/+8.95%/+283.14%，新能源业务推动公司整体业绩高增。23H1公司销售净利率9.68%，同比+1.86pct，主要系利息支出减少，财务费用率降低所致。储能示范项目落地助力业绩释放，强化海外市场开拓23H1公司成功交付了多个百兆瓦级的共享储能示范项目，同时落地多个工商储示范项目。公司海外市场拓展顺利，上半年境外营收6.02亿元，同比+126.87%；2023年6月，公司与Elin达成战略合作，将为土耳其市场提供高效的电力转换和光储解决方案；与JGH就南美洲和非洲的多个微网系统及中大型储能项目进行合作签约。公司拟在马来西亚设立全资子公司，布局海外产能建设。公司持续发力高毛利率海外市场，有望推动业绩长期快速增长。数据中心产品升级迭代，长期发展空间广阔公司数据中心业务保持稳定增长，数据中心运营管理能力进一步提升，与三大运营商、腾讯等大型互联网企业、各大金融机构、政府机关等深入合作。公司不断迭代升级产品技术和解决方案，发布了新一代模块化数据中心产品——慧云7.0。当前科华云集团服务用户超过了2000家，计划继续拓展人工智能、芯片、自动驾驶和生物医药等新兴行业的客户。公司凭借其技术及客户资源优势，数据中心业务长期发展空间广阔。盈利预测、估值与评级我们预计公司2023-2025年收入分别为84.20/110.24/142.12亿元，分别同比增长49.07%/30.93%/28.91%，归母净利润分别为7.23/9.66/12.43亿元，分别同比增长190.97%/33.64%/28.67%，三年CAGR为71.04%，EPS分别为1.57/2.09/2.69元/股，对应PE分别为20/15/12倍。参照可比公司估值，我们给予公司24年20倍PE，目标价41.8元，维持“买入”评级。风险提示：市场开拓不及预期；海外政策风险；行业竞争加剧等。,,国联民生证券,买入,[None],2023-08-31,,买入,5308075,pdf_downloads/2023/2023-08-31/002335-科华数据（002335）：新能源业务推动业绩高增，强化海外市场开拓.pdf,002335,科华数据,科华数据（002335）：新能源业务推动业绩高增，强化海外市场开拓
马成龙,深耕电力电子技术，“双子星”战略驱动成长。公司长期深耕电力电子技术，目前主要布局数据中心、UPS等电源产品和新能源（PCS、储能系统、户储等产品）三大业务领域。公司推进科华数据与科华数能的“双子星”战略布局，分别聚焦传统业务（智慧电源、数据中心）和新能源业务，聚焦资源开拓不同业务市场。公司传统业务表现稳健，新能源业务快速成长，推动持续稳健增长，2013-2022年公司收入复合增速达到21%，归母净利润复合增速为9%。科华数据：深耕UPS领域，数据中心稳步发展。公司长期深耕UPS（不间断电源）业务，2022年智慧电源业务实现收入9.96亿元，市场份额位居国内前列。UPS市场伴随应用领域扩张，市场空间稳健增长，据赛迪顾问，预计2024年国内市场规模可达145亿元。数据中心方面，公司提供数据中心产品与数据中心运营服务，2022年数据中心行业实现收入28.2亿元。受益于“东数西算”建设、运营商加大新兴业务投入以及AI驱动，IDC行业需求有望回暖；供给侧，政策考核趋严下，存量逐步出清，供需关系有望进一步改善。公司于北上广等一线城市布局并运营3万余机柜，客户包括运营商与腾讯等，有望推动后续稳定增长。科华数能：立足PCS，光伏与储能驱动成长。公司基于UPS积累的电力电子技术，较早布局PCS（逆变器、变流器）产品，并拓展大储、户储业务，实现快速成长。2022年新能源业务收入达17.7亿元，同比增长167%。光伏侧，公司光伏逆变器布局较为全面，并拓展光伏电站解决方案，将受益光伏装机规模提升。据Frost&amp;Sullivan数据，预计2027年全球光伏装机规模有望达314.5GW，22-27年复合增速为23%。储能业务方面，2022年公司储能变流器出货量位居国内前二，份额突出。基于PCS能力，公司布局储能系统、户储一体机等产品。据CNESA数据，2022年公司用户侧储能系统出货量位居全国首位；公司积极建设海外渠道，iStoragE系列产品已斩获多个海外订单，海外户储业务有望实现逐步增长。风险提示：新能源需求不及预期；市场竞争加剧风险；数据中心建设不及预期；原材料短缺及涨价风险；政策变动风险。投资建议：预计2023-2025年分别实现收入76.8/102.2/133.3亿元，同比+36%/33%/31%；归母净利润分别为5.8/7.5/10.0亿元，同比+133%/29%/34%；每股收益分别为1.25/1.62/2.17元，当前股价对应PE分别为28/22/16倍。公司长期深耕电力电子行业，UPS积淀深厚，并布局数据中心与新能源行业，驱动长期成长，首次覆盖，给予“增持”评级。,,国信证券,增持,[None],2023-08-08,,增持,5280697,pdf_downloads/2023/2023-08-08/002335-科华数据（002335）：深耕电力电子技术，新能源与数据中心双轮驱动.pdf,002335,科华数据,科华数据（002335）：深耕电力电子技术，新能源与数据中心双轮驱动
