author,content,filename,org_name,original_rating,pdf_link,publish_time,rating_adjust_mark_type,rating_changes,report_id,save_path,stock_code,stock_name,title
"马婷婷,倪安峰",+12.0%），归母净利润32.8亿（同比+19.6%），不良率0.75%，环比9月末持平，与业绩快报一致。业绩：收入继续保持双位数增长，利润增速近20%。全年营收增速12.0%，较Q3略降0.5pc，Q4单季度营收同比增速为10.5%，环比下降2.4pc。全年利润增速19.6%，增速较Q3下降1.5pc，但仍保持较高水平。全年ROE为13.69%，同比提升0.63pc。拆分来看：1、利息净收入同比+11.7%，息差调整有一定拖累。2023全年净息差为2.86%，环比下降9bps。主要是贷款利率较中报下降27bps至5.81%，一方面是因为贷款需求不足叠加竞争激烈，新发贷款收益率有所下降，另一方面预计也与按揭贷款利率下调影响一次性计提有关。负债端则表现较为稳定，付息负债成本率（2.30%）较中报下降2bps，存款成本率（2.28%）较中报持平。展望今年，常熟银行息差有望保持相对稳定、优于同业：1）资产端：按揭贷款占比低（仅5.9%）且影响基本已一次性计提。业务端持续做小、做散、做信用，有望对收益率形成支撑。2）负债端：A、个人定期存款占总存款61%，更受益于存款挂牌利率调降。B、存款结构仍有优化空间，2023年受定期化影响，粗略计算全行存款增量中，1年期以上占比超过90%1，2024年在外部定期化缓解+银行主动调整吸储策略的情况下，存款成本改善空间较大。2、非息收入：实现非息收入13.7亿（占营收比例14%左右），同比增14.3%。除手续费净收入外其他非息收入13.4亿，同比增32.5%，主要是22Q4低基数支撑。3、成本收入比（36.9%）同比下降1.7pc，主要是办公费用（占业务及管理费的22%）在收入端稳步增长的同时同比下降1.85%，降本增效成果显著。业务：异地机构贡献主要小微增量，结构上持续做小、做散、做信用。1）资产端：12月末资产达到3345亿（环比+1.8%），贷款2224亿，Q4单季度净增39亿（环比+1.8%），其中，对公贷款减少8亿元，零售贷款增加17亿元，票据增加30亿，显示Q4外部环境需求表现仍偏弱。进一步拆分来看，下半年零售贷款增长47亿，个人经营贷增长53亿，消费贷增长10亿元，按揭和信用卡规模分别净减少5亿和11亿。小微业务方面：A、下半年经营贷53亿增量中，常熟市外分支机构和村镇银行合计贡献75%。B、年末经营贷户均规模31.3万元，较半年报继续下降2千元，信用类占比达到38.8%，较半年报也提升2.5pc。2）负债端：12月末，存款达到2479亿，环比略增1.9%，全年增长16%。全年来看存款增量贡献前部来自于定期存款，对公活期、个人活期存款均净减少，活期存款占比下降5pc（对挂牌利率调降效果有一定冲抵）。资产质量：部分指标略有波动，但整体保持稳定。1 按银行在流动性风险情况中披露的距离到期日口径计算得到，与实际的存款期限有一定差别，此处仅为粗略计算。 1、静态来看，12月末不良率0.75%，环比持平。逾期率1.23%，较中报提升0.21pc。分类别来看，主要是对公制造业贷款，以及个人信用卡贷款指标有一定波动：1）对公不良率较中报提升0.08pc至0.83%，主要是制造业不良率提升0.21pc至1.12%。2）零售不良率下降0.02pc至0.78%，其中信用卡不良率提升0.49pc至1.40%（但占总贷款仅2.2%），而消费贷、按揭贷、经营贷不良率则分别下降0.17pc、0.03pc、0.02pc至0.79%、0.49%、0.78%。2、动态来看，全年不良生成率0.85%2，较中报提升0.13pc，公司在外部环境偏弱的情况下，加大核销及转出力度，全年核销16.7亿元，较2022年的7.1亿提升明显。3、拨备覆盖率达到538%，拨贷比达到4.04%，环比均基本持平。分红比例：2023年度计划每股派发股利0.25元，合计分红6.9亿，占利润的21%，对应24E股息率3.6%。投资建议：常熟银行2023业绩表现优异，2024年来看，常熟银行受存量按揭下调、城投化债影响较小，业绩有望继续保持稳定。未来若经济进一步企稳好转，小微需求稳步恢复，公司业绩仍有一定弹性。根据常熟银行年报，其2024年业绩目标为收入增长10%左右，利润增长18%左右，ROE保持14%。预计2024-2026年归母净利润分别为39.11亿、46.83亿、56.23亿，维持“买入”评级。风险提示：宏观经济下行；小微业务竞争超预期；消费复苏不及预期。,,国盛证券,买入,[None],2024-03-22,,买入,5553620,pdf_downloads/2024/2024-03-22/601128-常熟银行（601128）：业绩保持高增长，小微业务持续下沉.pdf,601128,常熟银行,常熟银行（601128）：业绩保持高增长，小微业务持续下沉
"廖紫苑,张晓辉,王舫朝","事件：3月21日,常熟银行披露2023年报：全年归母净利润同比+19.60%（前三季度+21.10%）；营业收入同比+12.05%（前三季度+12.55%）；全年年化加权ROE 13.69%，同比+0.63pct。点评：营收和利润保持双位数增长，业绩表现优于行业平均水平。2023年常熟银行营收同比增速较前三季度小幅下降50bp至12.05%；归母净利润同比增速较前三季度小幅下降1.50pct至19.60%，明显高于商业银行3.24%和农商行14.78%的整体增速，且已连续11个季度保持双位数水平。公司业绩增速亮眼，主要得益于规模快速扩张和拨备反哺。年末集团总资产、总负债分别同比增长16.18%、16.51%，规模体量再创新高。业绩增速边际放缓，主要源自拨备计提力度减轻和手续费拖累，而成本费用和汇兑损益拖累则有所减轻。净息差环比下行，但同业优势仍然显著。2023年常熟银行净息差2.86%，较前三季度下降9bp，同比下降16bp，其中个人贷款利率下行带动生息资产收益率下行或为主要原因。负债成本管控较好，但存款定期化趋势犹存，2023年末存款活期率较Q3末环比下降2.25pct至20.47%。相较同业，公司息差优势仍十分突出，明显高于同期商业银行1.69%、农商行1.90%的净息差水平。不良率环比持平，抵御风险能力提升。2023年末常熟银行不良率环比持平于0.75%，关注类贷款占比环比上升12bp至1.17%，但整体仍处于上市银行偏低水平，优势稳固；拨备覆盖率环比提升92bp至537.88%，拨贷比环比提升1bp至4.04%，抵御风险能力较强，反哺利润空间较大。村镇银行提速前进，核心指标全面开花。2023年末常熟银行村镇银行总资产、总贷款、总存款分别同比增长18.87%、17.19%、23.61%，增速分别高于集团整体水平2.69pct、2.19pct、7.45pct。村镇银行不良率0.97%，同比-1bp；拨备覆盖率339.72%，同比+27.10pct。资本较为充裕，转债评级调升。2023年末核心一级资本充足率环比上升18bp至10.42%，处于较为充裕水平；公司约60亿元可转债尚未转股。2023年末评级机构中诚信将常熟银行主体评级和常银转债的信用评级由AA+上调至AAA，有助于增强投资者信心，助力公司发展经营。盈利预测：常熟银行作为具备区位优势的普惠小微标杆银行之一，始终坚持“三农两小”市场定位，以特色化、差异化的微贷模式推进服务下沉，在保持资产质量领先的同时，实现规模较快扩张。我们看好公司未来的发展前景，预计公司2024-2026年归母净利润同比增速分别为19.55%、18.39%、17.52%。风险因素：经济超预期下行，政策出台不及预期，资产质量显著恶化等",,信达证券,,[None],2024-03-22,,,5552785,pdf_downloads/2024/2024-03-22/601128-常熟银行（601128）：业绩亮眼优势突出，村镇银行提速前进.pdf,601128,常熟银行,常熟银行（601128）：业绩亮眼优势突出，村镇银行提速前进
"梁凤洁,徐安妮",预计常熟银行2024年业绩高增具有强确定性，同时分红送股释放积极信号。数据概览常熟银行2023A营收同比增长12.1%，增速环比2023Q1-3下降0.5pc；归母净利润同比增长19.6%，增速环比2023Q1-3下降1.5pc。2023年末不良率0.75%，环比持平于2023Q3末；拨备覆盖率538%，环比2023Q3末提升1pc。营收利润保持高增常熟银行2023A营收同比增长12.1%，归母净利润同比增长19.6%，营收增速为已披露年报及快报银行中最高的。常熟银行2023A营收增速小幅放缓，主要受贷款增速放缓以及息差收窄共同影响；此外其他非息由于低基数作用，其他非息收入增速环比回升，对冲中收增速放缓的影响。常熟银行2023年年报披露，2024年经营计划为“营收增速10%左右；归母净利润增速18%左右；加权平均净资产收益率（ROE）14%”。常熟银行有望成为2024年业绩确定性最好的上市银行之一。息差面临下行压力测算常熟银行23Q4净息差（期初期末口径，下同）较23Q3下降27bp，息差收窄受资产两端共同拖累。①资产端，测算23Q4资产收益率较23Q3下降24bp，判断主要受贷款收益率下行影响，各类贷款价格仍面临下行压力以及23Q4存量按揭降息等因素影响；②负债端，测算23Q4负债成本率较23Q3上升5bp，判断主要受存款定期化影响，23Q4活期存款、定期存款、存款总额分别环比-8.2%、+3.5%、+1.9%。展望24Q1预计息差仍有压力，主要考虑Q1投放一般以对公为主以及新发贷款价格仍在小幅下降；预计后续季度息差放缓幅度有望收窄。关注和逾期率波动23Q4末常熟银行不良率、关注率分别环比持平、+12bp，逾期率较23Q2末上升21bp。关注率和逾期率小幅波动，可能受小微资产质量波动影响；此外，金融资产分类新规对于2023H1以前发生的业务，设置过渡期，判断其村镇银行资产在过渡期内逐步按照新规进行重分类，可能对资产质量指标带来一定扰动。23Q4末拨备覆盖率为538%，环比提升1pc，拨备覆盖率保持在上市行靠前水平。现金分红叠加送股常熟银行2023年分红方案金额与2022年基本持平，可能是受监管机构对资本充足率的要求影响；此外常熟银行2023年分红方案提出，以资本公积向全体股东每10股转增1股，增厚股本。盈利预测与估值预计常熟银行2024-2026年归母净利润同比增长18.1%/16.1%/16.5%，对应BPS 10.15/11.50/13.07元/股。现价对应2024-2026年PB估值0.68/0.60/0.53倍。目标价为10.18元/股，对应24年PB 1.00倍，现价空间47%，维持“买入”评级。风险提示：宏观经济失速，不良大幅爆发。,,浙商证券,买入,[None],2024-03-22,,买入,5552661,pdf_downloads/2024/2024-03-22/601128-常熟银行（601128）：2023年年报点评：业绩高增确定性强.pdf,601128,常熟银行,常熟银行（601128）：2023年年报点评：业绩高增确定性强
沈娟,异地扩张提速，存款成本优化常熟银行23年归母净利润、营业收入分别同比+19.61%、+12.05%，增速较1-9月-1.49pct、-0.50pct。公司23年ROA、ROE分别为1.13%、13.69%，分别同比提升0.03pct、0.63pct。我们预测2024-2026年EPS分别为1.30/1.56/1.89元，24年BVPS预测值9.25元，对应PB0.75倍。可比公司24年Wind一致预测PB均值0.54倍，公司小微护城河优势稳固，成长潜力突出，应享受一定估值溢价，我们给24年目标PB0.90倍，目标价8.33元，维持“买入”评级。资产增长提速，负债成本优化可期2023年末常熟银行总资产、贷款、存款增速分别为+16.2%、+15.0%、+16.2%，较9月末+0.6pct、-1.7pct、-1.4pct。23Q4新增贷款中对公、零售、票据分别占比44%、-19%、75%。23年净息差2.86%，较1-9月-9bp，主要因资产端拖累。受存量按揭调降一次性会计处理的影响，23年公司生息资产收益率、贷款收益率分别较1-6月-18bp、-27bp至5.00%、5.81%。负债端成本较为稳定，23年存款成本率较1-6月持平于2.28%。公司三年期及以上储蓄定期在总存款占比达40%，23年平均成本率3.51%，较22年-15bp，随中长期存款陆续到期置换，预计负债端成本有一定改善空间。异地扩张提速，经营效率优化2023年新增贷款中常熟地区、异地分支和村镇银行分别贡献27%、51%、21%，其中新增经营贷中常熟地区、异地分支、村镇银行分别贡献7%、65%、29%。异地扩张已成为公司规模增长的重要抓手，各分支机构当地市占率仍处于较低水平，有进一步增长空间。23年末常熟地区、省内异地机构（含省内村镇银行）、省外村镇银行不良率较6月末-2bp、+2bp、+1bp至0.70%、0.72%、1.02%。公司经营效率不断提升，23年全行、村镇银行成本收入比分别同比-1.7pct、-4.5pct至36.9%、45.0%。不良率维持低位，资本充足率提升2023年末常熟银行不良贷款率0.75%，较9月末持平；拨备覆盖率538%，较9月末+1pct。23年末关注率1.17%，较9月末提升12bp；23Q4年化不良生成率1.12%，较Q3提升0.42pct。关注率提升主要因金融资产分类新规后分类规则趋严。23Q4年化信用成本1.40%，同比提升19bp。公司23年末资本充足率、核心一级资本充足率分别为13.86%、10.42%，较9月末+0.16pct、+0.18pct。23年公司拟每股派息0.25元，每10股转增1股，现金分红比例为20.88%(22年：24.97%），股息率3.6%（2024/03/21)。风险提示：经济修复力度不及预期，资产质量恶化超预期。,,华泰证券,买入,[None],2024-03-22,,买入,5552656,pdf_downloads/2024/2024-03-22/601128-常熟银行（601128）：异地扩张提速，存款成本优化.pdf,601128,常熟银行,常熟银行（601128）：异地扩张提速，存款成本优化
"Jiali Lin,Nicole Zhou",投资要点：常熟银行发布2023年业绩快报，2023年全年公司营收预计同比增长12.04%，归母净利润预计同比增长19.61%，我们认为公司在优质区域坚持做小做散，取得了领先行业的业绩增速和风控成果，维持公司“优于大市”评级。营收增速预计稳居前列。23Q4单季度常熟银行营收预计较23Q4增长10.5%，归母净利润预计较23Q4增长14.9%，较23年前三季度略有下降，或受拨备提升影响。2023年全年营收增速保持在两位数，预计在上市银行中名列前茅。公司总资产收益率较2022年提升3bps至1.13%，加权平均净资产收益率2022年提升63bps至13.69%。资产增速环比加快。2023年公司总资产较2022年同比增长16.2%，较2023年前三季度（15.6%）有所提速，贷款较2022年同比增长15.0%，存款较2022年同比增长16.2%。不良率维持在0.75%，拨备覆盖率环比略升。2023年末公司不良率为0.75%，与2023年前三季度持平，预计在上市银行中仍处于第一梯队。拨备覆盖率为537.88%，较23Q3环比提升0.92pct。投资建议。我们预测2023-2025年EPS为1.20、1.41、1.62元，归母净利润增速为19.48%、17.80%、15.17%。我们根据DDM模型（见表2）得到合理价值为11.03元；根据PB-ROE模型给予公司2023E PB估值为1.00倍（可比公司为0.54倍），对应合理价值为8.92元。因此给予目标价11.03元（对应2023年PE为9.22倍，同业公司对应PE为4.94倍），维持“优于大市”评级。风险提示：企业偿债能力下降，资产质量大幅恶化；金融监管政策出现重大变化。,,海通国际证券,优于大市,[None],2024-03-06,,买入,5534639,pdf_downloads/2024/2024-03-06/601128-常熟银行（601128）2023年度业绩快报点评：营收增速预计稳居前列，拨备覆盖率环比略升.pdf,601128,常熟银行,常熟银行（601128）2023年度业绩快报点评：营收增速预计稳居前列，拨备覆盖率环比略升
"马婷婷,倪安峰",事件：常熟银行发布2023年业绩快报，全年实现营业收入98.70亿（同比+12.04%），归母净利润32.82亿（同比+19.61%），年末不良率0.75%，环比持平。业绩：保持稳定优异，收入增速12%，利润增速20%。2023年常熟银行全年营收增长12.0%，较前三季度基本持平，利润增长19.6%，较前三季度略降1.5pc，但仍处较高水平。展望2024年，银行业受LPR下调、存量按揭利率调整、城投化债等因素影响，息差同比仍有较大下行压力，是业绩的主要拖累项。而常熟银行息差表现有望好于行业整体，带动2024年业绩继续保持行业较优水平：1）资产端收益率下行压力小于同业：按揭贷款占比较低（23H占总贷款仅6.3%），且下调影响已在23Q3一次性计提（息差环比收窄5bps），城投业务也相对较少。2）负债端更受益于存款挂牌利率调降：23H个人存款占比接近68%，个人定期存款占比超过58%。个人存款相对于对公存款利率更容易压降，且定期存款下调幅度更大，常熟银行有望充分受益，支撑息差表现。业务：存贷规模稳步扩张。2023年末总资产达到3345亿（同比+16.2%），贷款2224亿（较年初+15.0%），其中Q4单季度贷款增长39亿，同比少增22亿（主要是22Q4需求有所回暖叠加年末加大营销力度，单季度增长61亿，基数较高），23Q4贷款环比来看仍稳步增1.8%。2023年末存款达到2479亿，较Q3稳步增长47亿（+1.9%）。资产质量：继续保持优良水平。年末不良率0.75%，环比持平，拨备覆盖率538%，环比略增1pc，拨贷比4.03%，环比持平。投资建议：常熟银行2023业绩表现同业较优，2024年来看，常熟银行受存量按揭下调、城投化债影响较小，业绩有望继续保持稳定，未来若经济进一步企稳好转，小微需求稳步恢复，公司业绩仍有一定弹性，预计2024-2025年归母净利润分别为38.78亿、45.39亿，维持“买入”评级。风险提示：宏观经济复苏不及预期；小微竞争压力超预期；消费需求复苏不及预期。,,国盛证券,买入,[None],2024-03-05,,买入,5533311,pdf_downloads/2024/2024-03-05/601128-常熟银行（601128）：2023业绩快报：业绩稳定优异，利润增速接近20%.pdf,601128,常熟银行,常熟银行（601128）：2023业绩快报：业绩稳定优异，利润增速接近20%
"戴志锋,邓美君,马志豪",1、常熟银行2023年营收同比增12.0%，预计受四季度信贷需求偏弱、以及按揭调降息差收窄影响，营收增速较前三季度12.5%的水平边际略放缓（去年同期营收基数也低，因此放缓幅度不大）。资产质量维持较好水平；归母净利润同比增速19.6%，较前三季度21.1%基本持平，总体营收和业绩增长均符合预期，公司业绩稳健性强。我们用单季营收/平均总资产对息差进行近似测算，常熟银行4季度单季年化类息差为2.84%，环比3季度下行39bp，预计受按揭调降的影响。2、4季度单季加回ABS出表信贷之后的表内外信贷总额增长66亿，相较去年同期少增了19.7亿，四季度信贷需求偏弱、且四季度非小微业务投放旺季，常熟银行信贷增长有所放缓。3季度揽储高峰后，4季度负债端存款增速略有下行。2023年总负债同比增16.5%，总存款同比增16.2%，4季度存款单季新增46.8亿，较2022年同期少增18.1亿。3、资产质量稳定。公司账面不良率维持0.75%的较好水平。2023年末拨备覆盖率537.88%，环比提升0.92pct；拨贷比维持在4.03%的水平。投资建议：公司2023E、2024E、2025E PB 0.77X/0.69X/0.61X。公司专注个人经营贷投放，风控优秀并不断下沉渠道拓宽市场，商业模式专注，客户结构持续做小做散，资产质量保持在优异水平。2024年，看好小微贷款助力下息差抗压性，以及人均产能提升带动营收增长，建议积极关注。注：根据常熟银行2023业绩快报，我们调整盈利预测，预计2023-2025年归母净利润为32.8亿、36.1亿和39.5亿（前值为33.2亿、38.1亿和43.0亿）。风险提示：宏观经济面临下行压力，公司存款竞争面临压力，业绩经营不及预期。,,中泰证券,增持,[None],2024-03-05,,增持,5532931,pdf_downloads/2024/2024-03-05/601128-常熟银行（601128）：2023业绩快报：业绩高增长韧性强，资产质量保持稳健.pdf,601128,常熟银行,常熟银行（601128）：2023业绩快报：业绩高增长韧性强，资产质量保持稳健
"梁凤洁,徐安妮",预计常熟银行2023年、2024年营收和利润增速处于上市行较高区间。数据概览常熟银行2023年初步核算营收同比增长12.0%，增速环比2023Q1-3下降0.5pc；归母净利润同比增长19.6%，增速环比2023Q1-3下降1.5pc。2023年末不良率0.75%，环比持平于2023Q3末；拨备覆盖率538%，环比2023Q3末提升1pc。营收利润保持高增常熟银行2023年初步核算营收同比增长12.0%，增速环比2023Q1-3下降0.5pc；归母净利润同比增长19.6%，增速环比2023Q1-3下降1.5pc。业绩表现符合市场预期，营收增速为已披露快报11家银行中最高的，利润增速仅次于杭州银行。驱动因素方面，营收和利润增速小幅回落，判断是受利息收入增速放缓影响。我们判断贷款增速放缓以及息差收窄共同拖累利息收入增速表现。展望2024年，预计常熟银行两位数的营收增速和接近20%的利润增速仍有望保持，主要考虑常熟银行息差绝对值高以及资产质量稳定。贷款增速小幅放缓常熟银行2023年末贷款总额同比增长15%，较23Q3末下降1.7pc。常熟银行贷款增速放缓，背后原因判断是常熟银行综合考虑经济形势、平衡贷款投放的量价险问题，主动控制投放速度。资产质量保持稳定资产质量整体稳定。常熟银行2023年末初步核算不良率0.75%，环比持平于2023Q3末；2023年末初步核算拨备覆盖率538%，环比2023Q3末上升1pc，处在上市行较高水平。高管增持彰显信心2024年1月8日-2024年1月12日，基于对银行发展前景的信心和长期投资价值的认可，常熟银行13名董监高人员共计增持公司股票69万股，增持金额为444万元。此外，常熟银行估值处在低位，截至2024年3月4日，常熟银行PB（lf）为0.80x，PB估值处在近5年4%低分位数。盈利预测与估值预计常熟银行2023-2025年归母净利润同比增长19.6%/19.2%/17.2%，对应BPS 8.96/10.09/11.40元/股。现价对应2023-2025年PB估值0.77/0.69/0.61倍。目标价为10.18元/股，对应24年PB 1.01倍，现价空间47%，维持“买入”评级。风险提示：宏观经济失速，不良大幅爆发。,,浙商证券,买入,[None],2024-03-05,,买入,5532237,pdf_downloads/2024/2024-03-05/601128-常熟银行（601128）：2023年快报点评：高增长农商行龙头.pdf,601128,常熟银行,常熟银行（601128）：2023年快报点评：高增长农商行龙头
