author,content,filename,org_name,original_rating,pdf_link,publish_time,rating_adjust_mark_type,rating_changes,report_id,save_path,stock_code,stock_name,title
"岳阳,熊翊宇",公司 2025 前三季度实现营业收入 110.83 亿元( YoY+22.08%);归母净利润 9.48亿元(YoY+4.83%);扣非净利润 7.76 亿元(YoY-6.36%)。2503 实现营业收入 39.87 亿元(YoY+24.19%，000+6.28%);归母净利润2.99亿元(YoY+20.44%，000-8.06%);扣非净利润2.38 亿元(YoY+0.25%，Q00-22.06%)。评论:主业经营稳健，汇兑及税费拖累短期业绩，Q3营收同环比均有所增长，毛利率为 21.96%，环比基本持平。扣非利润环比下滑，我们推测主要系汇兑和税费影响，Q3 汇兑损失约 3200万元(ws Q2 汇兑收益约 550 万元 );Q3 所得税为 7300万元(vs Q2 4600 万元 )，或系公司可转债赎回后，税务基准一次性修正补缴税款所致，别除汇兑及税费影响，公司经营依旧较为稳健。战略聚焦 AI+，高端市场发展提速。AI服务器:公司在 AI服务器领域的量产提速，高密度高阶 HDI 能力提升顺利，配合国际领先客户的先期开发，相关方案/产品性能均满足客户的标准要求。光模块:800G光模块出货量增加，已经为多家光模块头部客户稳定批量供货，并在1.6T 光模块上取得重大技术突破，汽车电子:公司积累了大量优质汽车客户，覆盖全球头部 Ticrl厂商以及国内领先的主机厂和智驾解决方案供应商，据Prismark 统计，2024 年公司已成为全球第一大汽车 PCB 供应商，未来随着汽车电动化智能化持续渗透，预计汽车业务未来仍有广阔的成长空间。AI服务器/光模块需求旺盛，加码 AI产能投资。受益于 AI 服务器、高端光模块等领域的订单批量出货，公司加紧开展对现有珠海金湾基地HLC、SLP工厂进行技术改造升级，在珠海金湾追加50亿投资将用于3个方面:(1)在高多层工厂针对性的技术改造补齐瓶颈工序产能、在 HDI工厂新增 AI服务器高阶 HDI 产线，计划于 2025 年下半年实施完成并投入使用;(2)投资新建高阶 HDI 工厂，计划于 2025年下半年动工建设、2026 年中投产;(3)利用储备用地增加投资强化关键工序产能，计划于2027年初建设、2027年内投产。投资建议:汽车基本盘稳中有升，AI产品有望打开第二成长曲线，成长动能充足有望推动公司价值重估。考虑公司高端产能充裕，汽车和AI相关业务未来几年有望维持高增长以及前三季度经营情况，我们调整公司25-27 年盈利预测为 13.94/25.18130.42 亿元(前值为 15.45/19.84/25.07 亿元)，公司产品迭代有望提升 ASP 和盈利能力，当前向下有估值保护，高经营杠杆下盈利弹性有望超预期，AI应用创新有望带动板块估值提升，参考可比公司胜宏科技、世运电路和生益电子估值及其历史估值中枢，给予26年35X目标估值，目标价为 89.6 元，维持“强推”评级。风险提示:AI算力需求不及预期，关税影响超预期，汇率波动，竞争加剧，,,华创证券,强推,[None],2025-11-12,,买入,7649403,pdf_downloads/2025/2025-11-12/603228-景旺电子（603228）：2025年三季报点评：高端产能蓄势待发，经营拐点可期.pdf,603228,景旺电子,景旺电子（603228）：2025年三季报点评：高端产能蓄势待发，经营拐点可期
"陈耀波,李元晨","景旺电子发布 2025 年第三季度报告2025 年三季报正式披露，营业总收入110.83亿元，同比去年增长22.08%，归母净利润为 9.48 亿元，同比去年增长 4.83%，基本 EPS 为1.03 元，平均 ROE 为7.88%。公司战略聚焦 Al，高端市场发展提速数据中心领域，全球云厂商资本开支继续保持高增，Al服务器及相关领域多种创新方案涌现，百花齐放，使得高速材料、高端HD1、HLC 等产品供不应求。公司在 Al 服务器领域的量产提速，高密度高阶HDI 能力提升顺利，积极跟踪市场趋势及技术前沿，配合国际领先客户的先期开发，探索更优的解决方案，相关方案1产品性能均满足客户的高标准要求:800G 光模块出货量增加，已为多家光模块头部客户稳定批量供货，并提前布局未来可能出现的产品与技术，抢占市场先机。在产能布局方面，受益于 AI服务器、高端光模块等领域的订单批量出货，公司加紧开展对现有珠海金湾基地 HLC、SLP 工厂进行技术改造升级，并启动高阶 HDI 工厂建设,进一步提升可用于 A|服务器及数据中心等领域的高端 HDI 产能，同时加速推进泰国生产基地建设，以高端产能为公司产品结构改善、盈利能力提升打下坚实基础。新兴领域公司持续推进 PCB 的应用Al 端侧应用推动人形机器人、低空飞行器发展，公司利用汽车电子领域先发优势进一步延伸业务布局，为未来规模化生产和业务增长培育新动能。汽车电动化、智能化可为人形机器人在感知、决策、执行三大核心环节提供重要技术借鉴，也可与低空飞行器在研发体系、制造工艺应用场景等方面双向赋能，因此，人形机器人、低空飞行器等新兴赛道与汽车制造在技术研发、供应链等维度高度重合，头部汽车产业链厂商近年来加速布局上述新兴赛道，推动产业化进程提速。作为全球第一大汽车 PCB 供应商，公司在产品可靠性、交付及时性、技术积累和下游客户储备等方面具备先发优势和潜在能力，积极关注上述新兴领域的业务机会，为汽车电子产品打造新增长极。投资建议我们预计公司 20251202612027年分别实现营业收入151亿元、179亿元和 211.06 亿元，维持前值预期:预计归母净利润20251202612027 年分别实现 15.88 亿元、19.73 亿元和 23.99 亿元，对比前值预期净利润2026-2027年的19.59亿元和23.85亿元有所提升。对应20251202612027年PE分别为48X139X132X。维持“买入”评级。风险提示Al需求不及预期，公司研发不及预期，PCB行业竞争激烈，PCB核心上游材料成本高企。",,华安证券,买入,[None],2025-11-03,,买入,7328844,pdf_downloads/2025/2025-11-03/603228-景旺电子（603228）：AI领域和新兴领域持续拓展，助力公司行稳致远.pdf,603228,景旺电子,景旺电子（603228）：AI领域和新兴领域持续拓展，助力公司行稳致远
何鹏程,事件景旺电子发布2025年半年度报告：2025年上半年实现营业收入70.95亿元，同比增长20.93%；归属母公司股东的净利润为6.50亿元，同比下降1.06%；扣除非经常性损益后的净利润为5.37亿元，同比下降9.02%。投资要点AIPCB布局深化，驱动业绩结构性增长公司积极拥抱AI浪潮带来的机遇与挑战，在多个下游应用领域取得了丰硕成果。数据中心领域，全球云厂商资本开支继续保持高增，AI服务器及相关领域多种创新方案涌现，使得高速材料、高端HDI、HLC等产品供不应求。2025年上半年，公司在AI服务器领域的量产提速，高密度高阶HDI能力提升顺利。800G光模块出货量增加，已为多家光模块头部客户稳定批量供货。受益于AI服务器、高端光模块等领域的订单批量出货，公司加紧开展对现有珠海金湾基地HLC、SLP工厂进行技术改造升级。2024年公司已成为全球第一大汽车PCB供应商。随着高级别智能驾驶的加速落地，AI应用在车端的渗透率不断提升，公司在全球生产基地布局的产能有序释放，预计汽车业务未来仍有广阔的增长空间。AIPCB核心供应商，扩充高端PCB产能适配下游AI需求公司是AI服务器用PCB的核心供应商之一，竞争优势主要体现在：（1）高端PCB量产能力：2025 年上半年，公司可应用于数据中心、AI 服务器、HPC、高速光模块的高阶 HDI、PTFE 软硬结合板、高速 FPC、多层 PTFE 板，112G 交换机高多层高速板等产品实现量产。此外，应用于在服务器的互联背板、1.6T 光模块PCB等产品取得重大技术突破，同时开展了服务器OKS平台、224G 交换机等下一代产品技术预研。（2）认证壁垒与订单：公司与全球各领域的头部客户建立长期战略合作，近几年在AI服务器、光模块、高速交换机、AR/VR 等高附加值领域的认证布局和客户积累逐步转化为实质性订单。（3）高端产能储备充足：公司持续发力以 HLC、HDI 为代表的 PCB 和 FPC 高端产能多年，规划总投资近百亿元，随着公司在全球生产基地布局的高端产能有序释放，预计 AI 服务器业务将为公司打开业绩增长新空间。此外，公司在珠海金湾追加50亿投资建设高端产能，资金将用于三方面：1）公司在高多层工厂针对性的技术改造补齐瓶颈工序产能、在 HDI 工厂新增AI服务器高阶HDI产线，计划于2025年下半年实施完成并投入使用；2）公司投资新建高阶HDI工厂，计划于2025年下半年动工建设、2026 年中投产；3）公司利用储备用地增加投资强化关键工序产能，计划于2027年初建设、2027年内投产。盈利预测预测公司2025-2027年收入分别为149.81、177.05、208.93亿元，EPS分别为1.57、2.04、2.56元，当前股价对应PE分别为40.4、31.0、24.7倍，我们认为公司在AIPCB领域有较为深厚的积累，扩充高端产能有望受益于下游AI算力景气度持续上行，首次覆盖，给予“买入”投资评级。风险提示宏观经济扰动，下游AI算力建设景气度下降，高端PCB行业竞争加剧，扩充产能建设不及预期。,,华鑫证券,买入,[None],2025-09-29,,买入,6487667,pdf_downloads/2025/2025-09-29/603228-景旺电子（603228）：公司事件点评报告：AIPCB布局深化，扩充高端PCB产能顺应下游AI高景气度.pdf,603228,景旺电子,景旺电子（603228）：公司事件点评报告：AIPCB布局深化，扩充高端PCB产能顺应下游AI高景气度
"胡剑,胡慧,叶子,张大为,詹浏洋,李书颖,连欣然",以汽车电子优势为基，聚焦AI打造新增长曲线。1H25公司实现营收70.95亿元(YoY+20.93%)，归母净利润6.50亿元(YoY-1.06%)，毛利率21.40%(YoY-2.60pct)，净利率9.21%(YoY-1.90pct)。2Q25公司营收37.52亿元(YoY+20.08%，QoQ+12.22%），归母净利润3.25亿元(YoY-4.11%，QoQ-0.03%)，毛利率21.95%(YoY-1.53pct，QoQ+1.17pct)，净利率8.62%(YoY-2.10pct，QoQ-1.25pct)。1H25受上游原材料涨价、高端产能战略投入、江西信丰基地新厂产能爬坡等因素影响，公司毛利率承压，但逐季度改善，随着产品结构升级、稼动率提升，公司盈利能力将逐步回升。珠海金湾基地扩产，迎接AI浪潮下全球科技产业机遇。为加速在AI算力、高速网络通讯、汽车智驾、AI端侧应用等领域的高端产品布局，公司拟使用自有资金或自筹资金人民币50亿元对珠海金湾基地进行扩产投资，主要用于现有工厂的技术改造升级及产能提升、新工厂的建设，提升高阶HDI、HLC、SLP的产能和技术水平。本次投资建设项目周期为2025年至2027年。数通领域多项产品技术突破，产品升级打开成长空间。通讯领域，1H25公司在AI服务器领域的量产提速，高阶HDI能力提升顺利，配合国际领先客户的先期开发，相关产品性能均满足客户的高标准要求。800G光模块出货量增加，已为多家光模块头部客户稳定批量供货。此外，公司高频高速类的高阶HDI、PTFE软硬结合板、高速FPC、多层PTFE板等产品均已实现量产，服务器超高层Z向互联PCB、1.6T光模块PCB等产品取得重大技术突破。汽车智能化推进高端产品。汽车智能驾驶成为人工智能落地的最佳场景。公司积累了大量优质汽车客户，覆盖全球头部Tier1厂商以及国内领先的主机厂和智驾解决方案供应商，据Prismark统计，2024年公司已成为全球第一大汽车PCB供应商。随着高级别智能驾驶的加速落地、AI应用在车端的渗透率不断提升，公司在全球生产基地布局的产能有序释放，预计汽车业务未来仍有广阔的增长空间。投资建议：上调盈利预测，维持“优于大市”评级。由于公司公布了新的扩产规划，在全球高端PCB缺货背景下，我们上调盈利预测，预计25-27年归母净利润为15.0/21.2/28.4亿元（前值为14.9/18.3/22.1亿元），同比增速27.9%/41.5%/34.3%，当前股价对应PE34/24/18x，维持“优于大市”评级。风险提示：产能扩张不及预期；下游需求不及预期；新品拓展不及预期。,,国信证券,优于大市,[None],2025-09-08,,买入,6403875,pdf_downloads/2025/2025-09-08/603228-景旺电子（603228）：新增50亿扩产规划，汽车与数通双轮驱动长期成长.pdf,603228,景旺电子,景旺电子（603228）：新增50亿扩产规划，汽车与数通双轮驱动长期成长
"陈耀波,李元晨","景旺电子发布 2025 年半年报公司 2025 年上半年实现营业收入 70.95 亿元，同比 2024 年上半年营业收入的 58.67 亿元增长 20.93%:公司 2025 年上半年实现归母净利润 6.50 亿元,同比 2024 年上半年归母净利润的 6.57 亿元减少 1.06%。公司战略聚焦 Al，高端市场发展提速数据中心领域，全球云厂商资本开支继续保持高增，Al服务器及相关领域多种创新方案涌现，百花齐放，使得高速材料、高端 HD1、HLC 等产品供不应求。2025年上半年，公司在A1服务器领域的量产提速，高密度高阶 HD| 能力提升顺利，积极跟踪市场趋势及技术前沿，配合国际领先客户的先期开发，探索更优的解决方案，相关方案1产品性能均满足客户的高标准要求:800G 光模块出货量增加，已为多家光模块头部客户稳定批量供货，并提前布局未来可能出现的产品与技术，抢占市场先机。在产能布局方面，受益于AI服务器、高端光模块等领域的订单批量出货，公司加紧开展对现有珠海金湾基地 HLC、SLP 工厂进行技术改造升级，并启动高阶 HDI 工厂建设，进一步提升可用于 A|服务器及数据中心等领域的高端 HD| 产能，同时加速推进泰国生产基地建设，以高端产能为公司产品结构改善、盈利能力提升打下坚实基础。公司持续巩固全球第一大汽车 PCB 供应商地位汽车电子领域，随着 A| 大模型、端到端算法的不断进阶与突破，汽车智能驾驶成为人工智能落地的最佳场景。公司积累了大量优质汽车客户，覆盖全球头部 Tier1 厂商以及国内领先的主机厂和智驾解决方案供应商，据 Prismark 统计，2024年公司已成为全球第一大汽车 PCB 供应商。2025 年上半年，公司不断挖潜现有客户需求，引入新产品、新料号，同时持续拓展新客户，导入新定点项目，巩固优势地位并不断拉大领先差距。随着高级别智能驾驶的加速落地、A1 应用在车端的渗透率不断提升，公司在全球生产基地布局的产能有序释放，预计汽车业务未来仍有广阔的增长空间。新兴领域公司持续推进 PCB的应用Al 端侧应用推动人形机器人、低空飞行器发展，公司利用汽车电子领域先发优势进一步延伸业务布局，为未来规模化生产和业务增长培育新动能。汽车电动化、智能化可为人形机器人在感知、决策、执行三大核心环节提供重要技术借鉴，也可与低空飞行器在研发体系、制造工艺应用场景等方面双向赋能，因此，人形机器人、低空飞行器等新兴赛道与汽车制造在技术研发、供应链等维度高度重合，头部汽车产业链厂商近年来加速布局上述新兴赛道，推动产业化进程提速。作为全球第一大汽车 PCB 供应商，公司在产品可靠性、交付及时性、技术积累和下游客户储备等方面具备先发优势和潜在能力，积极关注上述新兴领域的业务机会，为汽车电子产品打造新增长极。投资建议我们预计公司 20251202612027 年分别实现营业收入151 亿元、179亿元和 211.06 亿元,对比前值预期 20251202612027 年营业收入的 149 亿元、174.58 亿元和 203.08 亿元有所提升;预计归母净利润20251202612027 年分别实现15.88 亿元、19.59 亿元和 23.85 亿元，对比前值预期 20251202612027 年分别实现15.86 亿元、19.34 亿元和23.25亿元有所提升。对应20251202612027年PE分别为38X131X125X维持“买入”评级。风险提示Al需求不及预期，公司研发不及预期，PCB行业竞争激烈，PCB 核心上游材料成本高企",,华安证券,买入,[None],2025-08-31,,买入,6371248,pdf_downloads/2025/2025-08-31/603228-景旺电子（603228）：以汽车市场为基础，向AI服务器应用领域持续拓展.pdf,603228,景旺电子,景旺电子（603228）：以汽车市场为基础，向AI服务器应用领域持续拓展
"耿琛,岳阳,熊翊宇",汽车基本盘稳中有升，AI产品有望打开第二成长曲线。公司深耕PCB行业多年，拥有硬板、软板和金属基板三大产品线，覆盖了汽车、消费电子、数据中心、通信等领域。近年来，公司积极开拓高端领域，在产能上，公司稳步推进珠海金湾HLC和HDI两大工厂产能爬坡，致力于打造高技术、高附加值产品的灯塔工厂，对公司长远发展具有里程碑式的重要意义；在技术上，公司在AI服务器、高速通信等领域上均取得重大突破。未来随着公司AI服务器、智能驾驶等高端产品放量，有望推动公司开启新一轮成长。AI掀起新一轮科技浪潮，推动PCB产业开启新一轮成长。伴随着Scalinglaw法则不断涌现新生，AI模型的能力不断得到提升，AI赋能效果日益凸显，DeepSeek低成本高性能模式加速了AI应用落地，杰文斯悖论逐步开始显现。AI成为中外必争之地，科技巨头纷纷加码资本开支，AI产业有望迎来加速发展期，泛AI应用（汽车、智能终端）等兴起，新一轮科技浪潮已经来临。PCB作为电子之母，广泛应用于AI服务器、交换机、自动驾驶、智能终端等领域，伴随着产业终端升级迭代，PCB产业有望迎来新一轮成长。汽车电动化智能化接续发力，公司汽车板业务有望稳步增长。汽车上半场是电动化，电动化方兴未艾，全球电动车渗透率仍处于低位，未来有望逐步提升；下半场是智能化，随着AI技术不断取得突破，智能驾驶方案日益成熟，中外车企巨头纷纷发布了智能化战略，汽车智能化有望加速普及。未来随着汽车行业电气化、智能化和网联化等技术升级迭代和渗透率提升，将为多层、高阶HDI、高频高速、耐高压、耐高温、高集成等PCB方向的汽车板细分市场提供长期增长机会。公司深耕汽车板领域多年，在客户和技术上积累深厚，有望深度受益于汽车电动化和智能化的发展浪潮。深度布局AI服务器领域，打造第二成长引擎。随着全球AI技术加速演进，人工智能训练和推理需求持续扩大，对AI服务器和高速网络系统的旺盛需求推动对高速高多层PCB、高阶HDI的需求，其高负载工作环境也对PCB的规格、品质提出了更高的要求。在AI服务器领域，公司部分产品已批量出货，在高速FPC、超高层PTFE等产品的新兴应用领域拥有前沿优势。高速通信领域，公司实现800G光模块批量出货，具备1.6T光模块的量产能力，持续为多家光模块头部客户批量供货；开展了224G交换机技术预研。此外，公司拥有高端HLC和HDI产能，在高端PCB供应紧张的背景下，有望加快其导入新客户、新产品量产的进度，推动公司业绩快速增长。投资建议：汽车基本盘稳中有升，AI产品有望打开第二成长曲线，成长动能充足有望推动公司价值重估。考虑公司高端产能充裕，汽车和AI相关业务未来几年有望维持高增长，我们预计公司25-27年归母净利润为15.45/19.84/25.07亿元。公司产品迭代有望提升ASP和盈利能力，当前向下有估值保护，高经营杠杆下盈利弹性有望超预期，AI应用创新有望带动板块估值提升，参考可比公司胜宏科技、世运电路和生益电子估值及其历史估值中枢，给予25年25X目标估值，目标价为42元，首次覆盖，给予“强推”评级。风险提示：AI、汽车智能化发展不及预期、客户导入不及预期、产能爬坡不及预期、原材料价格大幅上涨、行业竞争加剧，全球贸易冲突加剧等。,,华创证券,强推,[None],2025-05-10,,买入,6048546,pdf_downloads/2025/2025-05-10/603228-景旺电子（603228）：深度研究报告：AI和汽车双擎驱动，有望开启新一轮成长.pdf,603228,景旺电子,景旺电子（603228）：深度研究报告：AI和汽车双擎驱动，有望开启新一轮成长
"胡剑,胡慧,叶子,张大为,詹浏洋,李书颖",2024年归母净利润同比增长25%，新增产能爬坡影响短期毛利率。2024年，公司实现营收126.59亿元(YoY+17.68%)，归母净利润11.69亿元(YoY+24.86%)，其中股权支付费用影响利润0.87亿元，毛利率22.73%(YoY-0.44pct)，净利率9.16%(YoY+0.69pct)。1Q25公司营收33.43亿元(YoY+21.90%，QoQ-6.65%），归母净利润3.25亿元(YoY+2.18%，QoQ+22.76%)，毛利率20.78%(YoY-3.83pct，QoQ+0.67pct)，净利率9.87%(YoY-1.7pct，QoQ+2.5pct)。2024年下半年，受原材料价格上涨、研发成本、新厂产能爬坡等因素影响，公司毛利率短期承压。1Q25新增产能爬坡顺利和高端产品占比提升都对公司毛利率产生了积极贡献，未来毛利率有望持续提升。数通领域多项产品技术突破，产品升级打开成长空间。通讯领域，公司可应用于AIDC及EGS/Genoa服务器平台的IO接口卡、CPU主板、交换机主板、800G光模块等高速PCB产品已实现量产，在高阶HDI、高速软硬结合板、高速FPC及超高层PTFE板、Birchstream平台高速PCB、1.6T光模块PCB等产品取得重大技术突破，同时开展了224G交换机、服务器OKS平台技术预研。2024年，公司顺利通过多个头部服务器客户的审核。产能有序扩张，高端产品良率提升推动公司盈利能力。目前，公司在国内拥有广东深圳、广东龙川、江西吉水、珠海金湾、珠海富山五大生产基地共12个工厂。珠海景旺是HLC、HDI（含SLP）两个项目的实施主体，是公司高技术、高附加值产品的灯塔工厂，定位AI服务器、光模块汽车智驾、高端消费等领域的高阶产品，目前AI服务器和高端光模块领域订单已批量出货，3Q24以来大幅扭亏，盈利能力改善迅速；泰国生产基地建设项目进入主体厂房框架阶段，即将封顶，主要面向海外汽车电子、算力客户，目前订单储备丰富，未来将根据订单指引分期建设。投资建议：微调盈利预测，维持“优于大市”评级。由于年报更新，我们微调盈利预测，预计25-27年归母净利润为14.9/18.3/22.1亿元（25-26年前值为15.1/17.7亿元），同比增速27.4%/22.6%/21.0%，当前股价对应PE18/15/12x。我们看好公司汽车领域的卡位优势和数通高端产品放量潜力，维持“优于大市”评级。风险提示：产能扩张不及预期；下游需求不及预期；新品拓展不及预期。,,国信证券,优于大市,[None],2025-05-09,,买入,6047412,pdf_downloads/2025/2025-05-09/603228-景旺电子（603228）：新增产能投产影响短期盈利，汽车与数通双轮驱动长期成长.pdf,603228,景旺电子,景旺电子（603228）：新增产能投产影响短期盈利，汽车与数通双轮驱动长期成长
