author,content,filename,org_name,original_rating,pdf_link,publish_time,rating_adjust_mark_type,rating_changes,report_id,save_path,stock_code,stock_name,title
"夏芈卬,王子钦",事件：江苏金租发布2024年年报及2025年一季报。2024年公司实现营业收入52.78亿元，同比+10.26%；实现归母净利润29.43亿元，同比+10.63%。2025Q1公司实现营业收入15.44亿元，同比+20.47%；实现归母净利润77.18亿元，同比+8.41%。2024年ROE（加权）为14.72%，同比-1.09pct；2025Q1未年化ROE（加权）为3.15%，同比-0.72pct。资产投放加速，负债结构优化。截至2024年末，公司融资租赁资产余额1278.03亿元，同比+12.00%。一季度开门红期间公司资产投放表现出色，截至2025Q1末，公司融资租赁资产余额达1427.19亿元，较上年末+11.67%。截至2025Q1末，公司计息负债规模达1188.58亿元，较上年末+11.51%。负债结构持续优化，加大直融来源，降低借款占比；截至2025Q1末，拆入资金、应付债券、借款占比分别为82.08%、10.19%、7.73%，较上年末分别+0.09pct、+0.69pct、-0.78pct。盈利能力强劲，利差显著扩张。2024年公司利息净收入为79.59%，同比+7.09%；净息差保持稳定，同比+1bp至3.62%。受益于租赁资产投放加速和净利差显著扩张，2025Q1公司利息净收入同比+23.68%至15.57亿元。2025Q1净利差为3.91%，同比+28bp；资产端收益率降幅有限，生息资产收益率（测算）同比-33bp至6.41%，付息成本大幅下行，计息负债成本率（测算）同比-78bp至2.31%。2025Q1成本收入比为9.48%，同比+10bp，预计与加大新科技投入有关，但成本控制能力居行业前列。资产质量优异，拨备覆盖充足。截至2025Q1末，公司不良融资租赁资产率为0.91%，较上年末持平；关注率为2.33%，较上年末-42bp，资产质量保持优异水平；拨备覆盖率为407.95%，较上年末-22.32pct，风险抵补能力充足。公司依托多元化布局、三位一体风险防控体系及科技深度赋能，不断加强风控能力，风控矩阵灵活稳健。投资建议：公司持续推进“零售+科技”战略，聚焦清洁能源、高端制造等国家战略领域，盈利能力强劲。预计2025-2027年公司营业收入为60.00、65.57、70.73亿元，归母净利润为32.94、36.16、39.28亿元，EPS为0.57、0.62、0.68元，对应7月3日收盘价的PE估值为10.99、10.01、9.22倍。维持“买入”评级。风险提示：宏观经济波动、利率下行超预期、资产质量恶化,,太平洋证券,买入,[None],2025-07-06,,买入,6208513,pdf_downloads/2025/2025-07-06/600901-江苏金租（600901）：2024年年报及2025年一季报点评：资产投放提速，盈利显著扩张.pdf,600901,江苏金租,江苏金租（600901）：2024年年报及2025年一季报点评：资产投放提速，盈利显著扩张
"舒思勤,洪希柠,夏昌盛",核心内容行业概况：渗透率提升空间广阔，监管优化助力高质量发展。我国整体租赁行业渗透率约12%，显著低于发达国家水平。作为全球第二大租赁市场，行业在监管趋严背景下加速出清，头部企业有望受益于市场集中度提升与合规化转型机遇。政策端聚焦强化准入标准及引导产业转型，推动行业向直租、中小微及产业租赁等方向升级，为合规能力强、资产结构优的头部公司打开增长空间。公司核心优势：量价双轮驱动构筑护城河。1）量能扩张：公司通过“厂商+区域”双线战略实现规模稳健增长。截至2024年末，公司应收租赁款余额达1273亿元，同比增长11.80%，2017-2024年投放规模增长CAGR为14.54%。厂商租赁模式构建独特生态，依托5800余家厂商/经销商网络，形成&quot;设备厂商-租赁公司-终端客户&quot;三方协同体系，通过设备回购担保、风险共担等机制实现高效获客与风险缓释。区域深耕方面，通过属地化团队下沉县区（江苏省内收入占比30%，增速8%高于整体），以资金优势置换区域客户资源，形成差异化竞争力。2）价差韧性： 净利差维持3.6%+高位，资产端收益率显著优于同业。得益于小微客群议价优势及多元化融资渠道创新（金融债、ABS等），负债成本率持续下降，驱动净息差稳中有升。预计随市场利率下行及负债结构优化，利差空间有望进一步释放。3）风控体系：三位一体筑牢安全边际。公司不良率持续低于1%（25Q1末为0.91%），拨备覆盖率408%（25Q1末）远超监管要求。核心风控能力源于，一是行业分散， “3+N”布局覆盖清洁能源、交运、工业装备等10大行业，通过跨周期配置平抑风险；二是物控体系，构建&quot;租赁物监控+厂商协同+数字风控&quot;三位一体机制，依托厂商设备锁机、回收网络实现资产闭环管理；三是科技赋能，全流程线上化系统实现智能拓客、实时风险预警与资产动态监控。盈利预测、估值和评级我们预计公司2025/2026/2027年营业收入分别为58.26/64.28/71.06亿元，同比分别增长10.4%/10.3%/10.6%；归母净利润分别为32.68/36.13/40.03亿元，同比分别增长11.0%/10.6%/10.8%。参考可比公司估值以及公司作为金融租赁稀缺标的、资产质量在可比公司中表现优异、高股息特质显著，给予25年1.62x PB，目标价7.23元，首次覆盖给予“买入”评级。风险提示1）融资租赁资产质量下降的风险；2）利率波动影响公司盈利水平的风险；3）期限错配产生的流动性风险；4）汇率波动影响公司盈利水平的风险。,,国金证券,买入,[None],2025-06-12,,买入,6161233,pdf_downloads/2025/2025-06-12/600901-江苏金租（600901）：聚焦小微零售，量价双驱+三位一体风控构筑护城河.pdf,600901,江苏金租,江苏金租（600901）：聚焦小微零售，量价双驱+三位一体风控构筑护城河
"沈娟,汪煜",江苏金租发布年报及一季报，2024年实现营收52.78亿元（yoy+10.26%），归母净利29.43亿元（yoy+10.63%），略高于我们的预期（归母净利29.19亿元）。25Q1实现营收15.44亿元（yoy+20.47%），归母净利7.72亿元（yoy+8.41%），营收增长较快主要系新增投放力度较大、叠加负债成本同比下行。2024年度分红率同比提升1.6pct至53%。公司小微转型持续、利润增长稳健、分红比例提升，维持买入评级。业务规模稳步扩张，25Q1增长势头强劲截至2024年末，公司融资租赁资产余额1278.03亿元，比上年末增加 136.94亿元，同比增长12.00%，业务规模稳步增长。按照业务板块分类看，清洁能源作为第一大板块，资产余额同比增长39.93%至326.37亿元，是资产增值的核心贡献，交通运输、工业装备分别同比增长12.70%、11.24%。25Q1末应收租赁款相较年初增长12.01%，呈现较为强劲的增长势头。公司业务以服务中小微客户为主，资产端议价能力强，未来业务规模和盈利能力有望保持良好发展态势。资产质量保持优异，拨备率有所下滑截至2024年末，公司不良融资租赁资产率 0.91%，与上年末持平，公司依托多层级风险防控矩阵、多层级客户群体组合，充分发挥业务互补支撑与风险分散效能。年末拨备覆盖率430.27%、同比下滑18.12pct；拨备率3.93%、同比下滑0.15pct。25Q1末不良率0.91%、与年初持平。拨备覆盖率407.95%、较年初下滑22.32pct；拨备率3.72%、较年初下滑0.21pct。小微布局持续深化，厂商+区域模式升级公司创新采用“厂商租赁 + 区域直销”双线展业模式，与超5800家厂商经销商建立深度战略合作关系，围绕省内小微企业集聚区域、厂商经销商密集地区、战略客户集中城市，建立独立部门、属地团队，提供综合服务。同时锻造专业强劲的科技引擎，形成支持年投放10万单量级的业务处理能力。盈利预测与估值考虑到公司25Q1资产规模增长较快，我们适当提高应收融资租赁款等假设，预计公司2025-2027年EPS分别为0.56、0.61、0.67元（前值2025-2026年0.55、0.59元，上调2%、3%），2025年BPS为4.67元。可比公司2025年Wind一致预期PB均值为0.8倍，考虑公司利润增长稳健、分红比例提升、资产质量优异，给予公司2025年1.3倍PB，目标价6.07元（前值6.06元，对应2025年PB1.3倍），维持“买入”评级。风险提示：利率波动和不良率上升风险、市场需求下降风险。,,华泰证券,买入,[None],2025-04-27,,买入,6026191,pdf_downloads/2025/2025-04-27/600901-江苏金租（600901）：利润增长稳健，分红比例提升.pdf,600901,江苏金租,江苏金租（600901）：利润增长稳健，分红比例提升
"刘雨辰,陈昌涛",事件江苏金租发布2024年年报与2025年一季报，公司2024年与2025Q1分别实现营收52.78/15.44亿元，同比+10.26%/+20.47%，归母净利润29.43/7.72亿元，同比+10.63%/+8.41%。经营业绩表现亮眼，2025Q1营收增速20+%2024年公司营收、归母净利润分别同比+10.26%、+10.63%，增速较2024年前三季度分别+1.51pct、+1.51pct。2025Q1公司营收、归母净利润分别同比+20.47%、+8.41%，增速较2024年分别+10.20pct、-2.22pct。2025Q1公司营收增速明显提升，主要系公司利息净收入增速明显提升，2025Q1公司利息净收入同比+23.68%，增速较2024年+15.18pct。归母净利润增速放缓，主要系公司信用成本明显提升。2025Q1公司信用成本率为1.03%，较2024年+43bp。规模快速增长，租赁净利差明显走扩2024年及2025Q1公司分别实现利息净收入52.08、15.57亿元，同比分别+8.50%、+23.68%。从量来看，2024年及2025Q1末公司融资租赁资产规模分别为1278.03、1427.19亿元，同比分别+12.24%、+17.70%，资产投放提速。从2024年投向来看，全年租赁资产规模净新增136.94亿元，其中交通运输、农业装备领域分别净新增27.03、31.93亿元。从价来看，2024年及2025Q1公司租赁业务净利差分别为3.62%、3.91%，2025Q1租赁净利差边际提升29bp。租赁净利差大幅走扩，主要系负债端成本改善显著。根据我们的测算，2025Q1公司负债平均成本率为2.31%，较2024年-54bp，同比-78bp。负债成本显著改善一方面受益于转债转股后公司注册资本提升，进一步支撑公司拆入资金占比提升。2025Q1末公司拆入资金占总负债的78.57%，较2024年末+1.01pct、同比+5.65pct。另一方面，“适度宽松”货币政策导向下资金拆借成本走低，2025Q1 6M-同业拆借利率均值为2.08%，环比-12.10bp。关注率明显改善，拨备覆盖率维持较高水平截至2025Q1末，公司不良率、关注率分别为0.91%、2.33%，较2024年末分别-0bp、-42bp。其中2025Q1末公司不良租赁款余额为13.01亿元，同比+17.62%，增速与租赁资产增速基本一致，整体资产质量较为稳健。关注率明显改善，预计主要系2024Q4以来一揽子政策快速落地，股市楼市企稳，经济稳中向好，承租人偿债能力或有所改善。拨备方面，2025Q1末公司拨备覆盖率为407.95%，较2024年末-22.32pct，同时2025Q1信用减值损失为3.47亿元，同比+74.80%。信用减值损失明显提升但拨备覆盖率下行，我们预计主要系不良资产内部分资产由次级类向可疑、损失类迁徙。整体来看，公司在“三位一体”风控体系及金融科技赋能下，整体风控能力依旧十分优异。维持江苏金租“买入”评级考虑到公司利差走扩，我们预计公司2025-2027年营业收入分别为59/66/72亿元，同比分别+11.20%/+11.83%/+10.28%，3年CAGR为+11.10%；归母净利润分别为32/36/40亿元，同比增速分别为+9.77%/+12.33%/+10.41%，3年CAGR为+10.83%。考虑到公司经营稳健，股息优势明显，当前公司股息率TTM达到4.63%，我们维持公司“买入”评级。风险提示：稳增长不及预期，资产质量恶化，监管政策转向。,,国联民生证券,买入,[None],2025-04-27,,买入,6664550,pdf_downloads/2025/2025-04-27/600901-江苏金租（600901）：2025Q1营收增速20+%，租赁净利差明显走扩.pdf,600901,江苏金租,江苏金租（600901）：2025Q1营收增速20+%，租赁净利差明显走扩
"孙婷,曹锟",投资要点【事件】江苏金租发布2024全年及2025Q1业绩：1）2024年实现营业收入52.8亿元，同比+10.3%；归母净利润29.4亿元，同比+10.6%，对应ROE 14.7%。Q4单季营收13.2亿元，同比+15.0%；归母净利润7.2亿元，同比+15.6%。2）2024年末归母净资产241亿元，较年初+35.2%，主要受转债转股影响，较Q3末+3.4%。3）2025Q1单季营业收入15.4亿元，同比+20.5%；归母净利润7.7亿元，同比+8.4%。归母净资产249亿元，较年初+3.2%。2024年业绩：融资租赁三大核心板块收入保持较快增长。1）2024年营收同比+10.3%，其中利息净收入同比+8.5%。2）融资租赁业务收入同比+7.1%，前三大板块清洁能源/交通运输/工业装备分别占比20%/19%/15%，分别同比+20%/+10%/+21%。农业装备同比+47%，增速最高，民生保障和工程装备分别同比-38%和-30%，降幅较大。投放资产规模稳步增长，净利差及不良水平均表现稳定。1）2024年末融资租赁资产规模1278亿元，较年初+12%。新增投放829亿元，同比+14.5%。2）2024年租赁业务净利差为3.62%，同比+0.01pct。不良率为0.91%，同比持平。坚持厂商+区域双线展业模式，零售属性持续显著。1）2024年末合作厂商数量5847家，同比+62%，区域小微投放规模超过20亿元。直租投放金额同比+22%，直租占比达47%。2）零售特征持续显著，存量客户数超过11万，其中中小微客户数（含个人）占比超99%，存量单笔合同金额105万元，年内投放合同数量6.2万单，单笔小于100万的合同占比92%。分红率稳中有升。2024年每股股息0.27元，分红比例53%（23年为51%），对应股息率约5.2%。2025Q1业绩：净利差扩大，不良率保持稳定。1）2025Q1营收同比+20.5%，其中利息净收入同比+23.7%，经营租赁业务收入同比+2.9%。营业支出同比+54.1%，其中信用减值损失同比+74.8%，预计主要是投放规模增加所致。2）2025Q1租赁业务净利差3.91%，同比+0.28pct。不良率0.91%，同比持平。盈利预测与投资评级：结合公司2024年及2025Q1经营情况，我们预计2025-2027年公司归母净利润为32.4/36.0/39.8亿元，当前市值对应2025E PB 1.2x。我们认为，公司作为A股唯一上市金租企业具有稀缺性，历史业绩与分红表现稳定，首次覆盖给予“买入”评级。风险提示：宏观经济增长不及预期；社会信用风险水平大幅提升。,,东吴证券,买入,[None],2025-04-26,,买入,6025226,pdf_downloads/2025/2025-04-26/600901-江苏金租（600901）：2024年年报及2025年一季报点评：不良率保持稳定，2025Q1净利差走阔.pdf,600901,江苏金租,江苏金租（600901）：2024年年报及2025年一季报点评：不良率保持稳定，2025Q1净利差走阔
"高超,卢崑","一季报营收超预期，利差和规模投放表现亮眼2024年营收/净利润为52.8/29.4亿元，同比+10%/+11%，年报符合我们预期。2025Q1营收/净利润为15.4/7.7亿元，同比+20%/+8%，一季度拨备前利润同比+20%，营收超预期，减值高增抑制净利润。2024/2025Q1年化加权平均ROE为14.7%/12.6%，同比-1/-3pct，权益乘数为5.6/5.9倍，同比-1.1/-0.8倍，主因转债转股带来的摊薄影响。考虑市场竞争加剧，我们下修2025-2026年净利润预测至33/37亿元（调前34/39），新增2027年净利润预测41亿，同比+12%/+13%/+10%，EPS为0.6/0.6/0.7元，当前股价对应PB为1.2/1.1/1.0倍。2024年公司分红率提升0.6pct至53.1%，当前股价对应股息率5.2%。公司资产规模稳健增长，净利差表现亮眼，资产质量优秀，基本面持续向好,维持“买入”评级。一季报资产规模增速超预期，零售特征突出（1）2024年末/2025Q1末应收融资租赁款余额1278/1427亿元，同比+12%/+18%，2025Q1环比增长149亿元，环比+12%，一季度规模增长好于我们预期，公司资产端能力优秀。业务零售特征突出，2024年存量单均规模105万，存量客户超11万，中小微客户数（含个人）占比超99%。直租占比提升，2024年直接租赁投放同比+22%，直租占比47%（2023年为46%）。公司“厂商租赁+ 区域直销”双线展业模式高效，营销获客能力持续增强，2024年末合作厂商（经销商）数量5847家，同比+62%，区域直销持续深耕。（2）结构来看，3+N布局服务实体经济，2024年末清洁能源、交通运输、工业装备规模326/240/178亿元，占比26%/19%/14%，增速来看，农业装备/清洁能源/节能环保同比+42%/+40%/+25%。净利差表现亮眼，资产质量稳健，减值计提增加或因规模高增（1）公司披露2024年/2025Q1净利差3.62%/3.91%，同比+1/+28bp，2025Q1净利差扩张明显，主因负债端成本下降，降幅超预期。我们测算2024年/2025Q1生息资产收益率6.46%/6.37%，同比-0.2/-0.45百分点；付息债务成本率2.77%/2.31%，同比-0.23/-0.79百分点；净利差3.69%/4.07%，同比+0.03/+0.34百分点，趋势和披露值一致。2025Q1付息债务规模同比+16%，利息支出同比-14%。（2）2024/2025Q1不良率0.91%/0.91%，表现稳健，2024年不良生成率为0.46%，同比持平，资产质量稳健。2024/2025Q1关注率为2.75%/2.33%（2023年为3.50%），有所下降；拨备率为3.93%/3.72%（2023年为4.08%），拨备覆盖率为430%/408%（2023年为448%），有所下降。2025Q1计提信用减值损失3.5亿，同比+75%，抑制净利润，预计与新投放高增有关。风险提示：竞争加剧造成业务规模、利差承压；期限错配产生的流动性风险。",,开源证券,买入,[None],2025-04-26,,买入,6024920,pdf_downloads/2025/2025-04-26/600901-江苏金租（600901）：2024年报及2025一季报点评：一季报营收超预期，利差和规模投放表现亮眼.pdf,600901,江苏金租,江苏金租（600901）：2024年报及2025一季报点评：一季报营收超预期，利差和规模投放表现亮眼
"夏芈卬,王子钦",事件：江苏金租发布2024年三季报，报告期内公司实现营业收入39.59亿元，同比+8.76%；实现归母净利润22.27亿元，同比+9.12%；ROE（加权）为11.87%，同比-0.4pct。资产规模持续扩张，负债结构有所调整。截至报告期末，公司资产总额1345.21亿元，较上年末+12.18%；其中应收租赁款1237.41亿元，较上年度末+12.35%，第一、二、三季度应收租赁款环比增速分别为6.34%、4.84%、0.78%，公司核心业务持续扩张，Q3扩张动力放缓。截至报告期末，公司计息负债1021.99亿元，较上年末+8.07%；其中短期借款、拆入资金、长期借款、应付债券分别较上年末-31.85%、+11.16%、+43.72%、-16.86%，公司长期借款明显增加。盈利能力表现良好，利差维持稳定。2024年前三季度公司利息净收入38.95亿元，同比+6.79%，增速较年中+0.09pct；净利差3.67%，同比-2bp，较年中-1bp，利差维持稳定。公司经营租赁收入同比+180.78%至0.86亿元，经营租赁业务实现高增。公司成本收入比9.66%，同比+0.35pct，成本控制能力小幅下滑。资产质量平稳提升，拨备仍处高位。截至报告期末，公司不良融资租赁资产率0.92%，较上年末略增1bp，不良资产率维持稳定；关注类资产占比3.04%，较上年末-46bp，环比-34bp，三季度资产质量有效提升。拨备覆盖率426.01%，较上年末-22.38pct，环比-5.21pct；拨备覆盖率有所降低，但仍旧维持较高水平。公司可转债摘牌，资本充足率提升。公司将“苏租转债”余额全部赎回，于2024年10月18日发放赎回款并且进行可转债摘牌。截至2024年10月17日，累计共有49.98亿元“苏租转债”转换为公司股份，占“苏租转债”转股前公司已发行股份总额的53.40%。可转债转股增强资本实力，截至报告期末公司核心一级资本充足率17.44%，较年中+3.38pct。投资建议：公司持续推进“零售+科技”战略部署，秉持“厂商+区域”双线展业方式拓展业务，为中小微企业提供金融服务。预计2024-2026年公司营业收入为52.59、57.81、63.76亿元，归母净利润为29.30、32.33、36.02亿元，EPS为0.51、0.56、0.62元，对应11月11日收盘价的PE估值为10.46、9.48、8.51倍。维持“买入”评级。风险提示：宏观经济波动、利率下行超预期、资产质量大幅下滑。,,太平洋证券,买入,[None],2024-11-17,,买入,5833650,pdf_downloads/2024/2024-11-17/600901-江苏金租（600901）：2024年三季报点评：核心业务持续扩张，资产质量保持平稳.pdf,600901,江苏金租,江苏金租（600901）：2024年三季报点评：核心业务持续扩张，资产质量保持平稳
"Ting Sun,Wangjie OU,Nicole Zhou",事件 江苏金租发布2024年三季报：1）前三季度实现营业收入39.6亿元，同比+8.8%，Q3单季为13.4亿元，同比+9.3%。2）归母净利润22.3亿元，同比+9.1%，Q3单季为7.9亿元，同比+9.7%。3）归母净资产233亿元，较年初+30.8%，较中期+27.6%，主要是由于公司可转债转股和赎回等因素导致股本和资本公积增加。4）对应ROE 11.87%，同比-0.4pct，主要是由于净资产变动的影响。应收租赁款规模增速放缓，净利差基本稳定。1）应收租赁款规模增速较上半年放缓。截至Q3末公司应收租赁款余额为1237亿元，较年初+12.3%，较中期+0.8%。2）利息净收入稳健增长，净利差基本稳定。前三季度利息净收入为38.9亿元，同比+6.8%， Q3单季为13.3亿元，同比+7.0%。前三季度公司租赁业务净利差为3.67%，同比微降0.02pct，基本保持稳定。3）手续费及佣金净收入亏幅收窄。前三季度手续费及佣金净收入为-0.5亿元，上年同期为-0.7亿元。4）经营租赁业务持续快速发展。前三季度经营租赁收入为8581万元，同比+181%，Q3单季为2772万元，同比+174%。业务运营稳健，不良率仍维持低位。1）前三季度公司业务及管理费同比+11.8%，占总营收比重9.6%，同比小幅+0.3pct。2）公司资产质量保持较优水平，Q3末不良率为0.92%，较年初+0.01pct，较年中+0.02pct。3）付息债务规模为1022亿元，较年初+8.1%，较年中-5.3%。其中短期借款/拆入资金/长期借款/应付债券分别较年初-32%、+11%、+44%、-17%。看好公司长期发展空间，“优于大市”评级。我们认为江苏金租作为A股稀缺的金融租赁标的，坚定实施零售战略，金融科技赋能业务发展，特色“厂商租赁”模式兼顾客户拓展与风险防控，近年来业绩增长表现稳健，看好公司未来长期发展空间与经营优势。同时近年来公司分红率均在40%以上，2023年股息率达6.6%。参考可比公司，我们给予公司1.5x 2024E PB，得到目标价6.28元，当前股价对应1.2x 2024E PB，维持“优于大市”评级。风险提示：宏观经济增长不及预期；社会信用风险水平大幅提升。,,海通国际证券,优于大市,[None],2024-11-01,,买入,5813026,pdf_downloads/2024/2024-11-01/600901-江苏金租（600901）：Q3营收与净利润稳中向好，净利差与不良率基本稳定.pdf,600901,江苏金租,江苏金租（600901）：Q3营收与净利润稳中向好，净利差与不良率基本稳定
