author,content,filename,org_name,original_rating,pdf_link,publish_time,rating_adjust_mark_type,rating_changes,report_id,save_path,stock_code,stock_name,title
林媛媛,常熟银行(601128)常熟银行中报表现量增质优，业务积极拨备审慎。第一，中报归母净利润同比增长20.0%，贡献主要来自净利息收入快速增长，拆分来看，源于规模快速增长和净息差的同比改善。第二，公司2季度资产质量相对1季度基本平稳，存量拨备保持高位，减值损失计提审慎，增量拨备增速超过盈利和收入。常熟银行区位优势突出，小微优势强化，经营管理优秀。随着村镇银行改革化险推进，公司在村镇银行的收并购或有望提速。前期转债获批有利于公司规模和业绩持续较快增长。公司2022年PB估值0.94X，重申看好，重点推荐。支撑评级的要点净利息收入贡献净利润较快增长，2季度增速回落仍保持高位。常熟银行中报业绩同比增长20.0%，2季度增速有所回落仍保持高位，带动中报ROE同比提升0.82个百分点。收入贡献主要来净利息收入，上半年营收同比增长18.9%，其中净利息收入占比86%，同比增长20.8%，源自规模快速增长和净息差同比上升共同贡献。2季度净利息收入18.0%，增速回落仍保持高位。其他非息收入增长较快，同比增长64.7%。2季度息差平稳或略降，规模延续快增。公告中报净息差3.09%与1季度持平，测算2季度净息差略降。2季度，贷款环比1季度增长7.0%，其中，个人贷款增长7.5%，对公增长6.3%。风险资产增速仍快于ROE，核心一级资本充足率9.86%，同比下降31bp。存款环比增长1.6%，增速回落源于季节性。资产质量较为平稳，拨备计提审慎。中报资产质量相对1季度平稳。2季度相对1季度，不良率0.80%、关注贷款占比0.88%，均较1季度小幅下行。相对年初：逾期贷款占比0.94%，较年初上升4bp，90天以内逾期贷款较年初增长19.1%；个人和异地村镇资产质量边际走弱，个人贷款不良率0.85%、异地村镇银行不良率1.07%，分别较年初上升8bp和10bp。在外部环境不确定情况下，存量拨备覆盖率535.83%，拨贷比4.3%，保持高位。增量拨备增长快于收入，资产减值损失同比增长22.4%，贷款和非贷款减值损失均较快增长。估值我们维持公司2022/2023年EPS为0.97/1.15元的预测，目前股价对应2022/2023年PB为0.94x/0.81x，维持增持评级。评级面临的主要风险疫情反复，出口需求减弱、经济超预期下行；监管管控超预期。,,中银国际,增持,[None],2022-08-16,,增持,4954209,pdf_downloads/2022/2022-08-16/601128-常熟银行（601128）：量增质优，重申推荐.pdf,601128,常熟银行,常熟银行（601128）：量增质优，重申推荐
"林加力,Nicole Zhou",营收利润持续高增长。常熟银行22H1营收同比增长18.9%，归母净利润同比增长20.0%。22Q2营收同比增长18.4%，归母净利润同比增长16.0%。ROE同比增长0.82pct至11.72%。净息差环比持平，净利差环比扩大。22H1净息差较22Q1持平为3.09%，净利差较22Q1上升1bp至2.97%，保持上市银行中领先水平，我们认为主要得益于高比例的个人经营贷款，22Q2占比为38.37%。净息差和净利差与2021年相比也均有提升，主要因为资产端收益率的上升幅度相较负债端成本率的上升幅度更大。信贷投放力度不减，个贷为主对公发力。信贷需求较弱的背景下，22Q2常熟银行贷款占总资产比例依然环比提升3pct至67.4%，贷款总额较上年末增长13.8%。22H1个人贷款贡献新增贷款48.3%，其中经营贷款贡献增量的27.7%，依然为信贷投放的主力。与21H2不同的是，对公贷款投放发力，贡献新增贷款的40.0%，其中租赁商务服务业、制造业、批零、贸易融资投放力度较大。资产质量持续改善。不良率2018年以来低于1%，连续3季度（21Q3-22Q1）录得0.81%之后，22Q2环比下降1bp至0.80%。其中100万元以上以及江苏省内的贷款，不良率较上年末均有改善。22Q2拨备覆盖率环比提升3.1pct至535.83%，继续保持超过500%的水平。投资建议。我们预测2022-2024年EPS为0.96、1.12、1.31元，归母净利润增速为19.66%、17.10%、17.24%，原2022-2024年EPS为0.99、1.16、1.37元。我们根据DDM模型（见表2）得到合理价值为10.33元；根据可比公司估值法给予公司2022E PB估值为1.20倍（可比公司为0.63倍），对应合理价值为9.57元考虑到DDM模型更能反映公司长期价值，我们目标价为10.33元（对应2022年PE10.81倍，同业公司对应PE为5.89倍），原目标价为10.80元，维持“优于大市”评级。风险提示：企业偿债能力下降，资产质量大幅恶化；金融监管政策出现重大变化。,,海通国际证券,优于大市,[None],2022-08-16,,买入,4954220,pdf_downloads/2022/2022-08-16/601128-常熟银行（601128）22H1点评：盈利高增长，信贷投放力度不减.pdf,601128,常熟银行,常熟银行（601128）22H1点评：盈利高增长，信贷投放力度不减
"林瑾璐,田馨宇",事件：8月15日，常熟银行公布2022年半年报（此前已披露业绩快报），实现营收/拨备前利润/归母净利润43.74、26.55、12.01亿，分别同比增长18.9%/20.6%/20.0%。加权平均ROE 11.85%，同比提升0.82pct。点评如下：规模、净息差共同驱动，业绩保持高速增长。常熟银行1H22营收、拨备前利润、净利润同比分别增18.9%/20.6%/20.0%，业绩保持较高增速。盈利拆解来看，推动上半年盈利高增的主要因素依次为，规模保持快速扩张（+18.1%）、息差保持平稳（+2.7%）及合理的成本管控（+1.7%）；非息增速放缓（-2.0%）和拨备计提增加（-1.4%）是两个主要负面因素。区域信贷需求旺盛，资产保持高速扩张。在较强的信贷投放能力和区域信贷需求较旺盛的背景下，公司信贷资产维持高速扩张。6月末，总资产较年初增长11.48%，同比增18.8%，增速较一季度末提升1.7pct。贷款较年初增长13.8%，同比增速高达22.4%；上半年新增贷款225亿，同比多增28亿。同时，异地扩张战略成效进一步显现，上半年异地市场（常熟以外）贷款、营收、净利润贡献已提升至68.2%、74.6%、81.0%。展望后续，随着经济温和复苏、区域内潜在信贷需求旺盛，叠加公司普惠金融试验区的推进，有望持续带来增量需求，推动净利息收入的较快增长。净息差环比持平，主要得益于生息资产收益率提升。常熟银行1H22净息差为3.09%，环比1Q22持平、较2021年提升3BP。（1）资产端：差异化定位实现高定价、资产结构持续优化，推动生息资产收益率逆势提升。上半年生息资产收益率为5.31%，较2021年提升6BP。其中，贷款收益率6.32%，较2021年提升8BP。在上半年银行新发放贷款利率总体下降的背景下，常熟银行生息资产收益率逆势上升。一方面，得益于公司的小微客群定位，不断向金融供给相对不充分的地区下沉、与大行错位竞争，实现了高于可比同业的贷款定价；并在长期服务下形成较强客户粘性，对客户的议价能力较强。另一方面，公司持续优化资产结构，加大贷款、特别是零售贷款的投放力度；6月末贷款占生息资产的比重为67.33%，环比提升2.95pct；个人贷款占总贷款的比重为59.48%，环比提升0.29pct。（2）负债端：成本小幅提升。上半年计息负债成本率较2021年提升4BP至2.34%。展望后续，在“零售银行”转型和“做小做散”策略下，预计常熟银行净息差有望保持同业较优水平，成为营收增长的重要支撑之一。资产质量保持优异，拨备充足、盈利释放可期。截至6月末，常熟银行不良贷款率0.80%，环比下降1BP，资产质量保持优异。从前瞻性指标来看，关注贷款率0.88%，环比下降6BP；潜在不良压力降低。拨备覆盖率535.8%，环比提升3.1pct。常熟银行优异的资产质量是其成熟小微模式和优秀风控能力的体现，预计公司资产质量将保持稳中向好趋势。在此基础上，拨备覆盖率进一步提升的必要性下降；未来信用成本有望下行，有助于潜在盈利释放和ROE中枢的提升。投资建议：常熟银行坚持走特色化、差异化的小微发展道路，已形成“IPC 技术+信贷工厂”的小微模式，兼具小微定价优势和成熟风控技术。公司深耕本地市场，同时通过异地分支机构、村镇银行、普惠金额试验区等拓展业务空间，信贷规模有望保持较快增长。小微业务特色鲜明、模式成熟，下沉客群、做小做散，具备较强的贷款议价能力，净息差在可比农商行中处于领先地位。资产质量保持优异，拨备充足，反补利润空间较大。预计2022-2024年净利润增速22.6%、20.3%、19.1%。对应BVPS分别为8.21、9.40、10.81元/股。2022年8月15日收盘价7.62元/股，对应0.93倍22年PB。考虑到公司经营区域优势、小微战略定位优势以及异地扩张潜力带来的高成长属性，维持“强烈推荐”评级。风险提示：经济失速下行导致资产质量恶化；监管政策预期外变动等。,,东兴证券,强烈推荐,[None],2022-08-16,,买入,4954081,pdf_downloads/2022/2022-08-16/601128-常熟银行（601128）：小微业务领跑者，持续高成长.pdf,601128,常熟银行,常熟银行（601128）：小微业务领跑者，持续高成长
"田维韦,王剑,陈俊良",业绩维持高增。公司已披露业绩快报，上半年实现营收43.74亿元（+18.9%），归母净利润12.01亿元（+20.0%）。其中二季度单季实现营收22.46亿元（+18.4%），归母净利润5.41亿元（+16.0%）。小微下沉和异地扩展战略成效明显，净息差环比持平。6月末贷款余额1853亿元，较年初增长13.8%，贷款维持高增。其中个人经营性贷款711亿元，较年初增长9.6%，占贷款总额的38.4%。个人经营性贷款中信用类贷款比例为29.5%，较年初提升4.1个百分点，信保类贷款合计达43.4%，较年初提升了3.2个百分点。个人经营性贷款中30万（含以下）贷款比例为29.2%，较年初提升1.2个百分点，公司做小做散战略成效明显，小微业务竞争力持续强化。区域分布上，个人经营性贷款中常熟以外地区比重达89.8%，较年初提升了1.3个百分点。受益于小微下沉战略的深化，2022年上半年公司净息差3.09%，环比一季度持平，同比上行7bps，拉动净利息收入同比增长20.8%，营收同比增长18.9%。受疫情冲击不良生成率略有反弹但仍处于低位，公司加大核销和拨备计提力度，不良率和拨备覆盖率指标均小幅优化。测算的上半年年化不良生成率0.45%，较2021年0.33%的水平略有反弹，但仍处于低位。不良先行指标也表现较好，期末关注率0.88%，较年初下降1bp，逾期贷款率0.94%，较年初提升4bps。公司加大了核销力度，上半年累计核销2.1亿元，较去年同期多核销了1.0亿元，期末不良率0.80%，较年初下降了1bp。公司进一步加大信用减值损失计提力度，上半年年化信用成本为1.29%，较2021年提升15bps。期末拨备覆盖率达536%，较3月末提升了3.1个百分点。另外，公司加大非信贷资产减值损失计提，上半年合计计提1.41亿元，同比提升137%，构筑了足够厚的安全垫。投资建议：维持“买入”评级伴随小微下沉战略持续深化，公司规模维持较快增长，净息差企稳反弹，加上风控管理优异，看好公司在小微赛道长期扩张能力。我们维持2022-2024年净利润26.55/32.62/38.10亿元，对应21.3%/22.9%/16.8%的增速，对应摊薄EPS为0.97/1.19/1.39元，当前股价对应动态PB为0.95x/0.85x/0.76x，维持“买入”评级。风险提示：疫情反复，稳增长政策不及预期带来经济复苏不及预期；,,国信证券,买入,[None],2022-08-16,,买入,4953709,pdf_downloads/2022/2022-08-16/601128-常熟银行（601128）2022半年报点评：微业务竞争力持续强化，业绩维持高增.pdf,601128,常熟银行,常熟银行（601128）2022半年报点评：微业务竞争力持续强化，业绩维持高增
"余金鑫,于博文",事件：8月15日，常熟银行发布22H1报告，营收43.7亿元，YoY+18.9%；归母净利润12.0亿元，YoY+20.0%；不良率0.80%，拨备覆盖率536%。业绩维持高增，其他非息表现亮眼。22H1公司营收、归母净利润同比增速环比均小幅下滑，但仍维持较高增速，主要由规模增长及息差企稳驱动。在二季度疫情扰动下，22H1净利息收入仍实现同比+20.8%，筑牢营收增长基础；其他非息收入表现亮眼，同比+64.7%，助力营收维持高增速。净息差企稳，规模稳步扩张，共同驱动净利息收入增长。净息差逐季向好，22H1净息差为3.1%，维持住21H1以来逐季企稳回升态势，主要由生息资产收益率提升贡献。资产端，22H1总资产、贷款分别同比增长18.8%、22.4%，贷款同比增速高于总资产，资产结构优化；同时Q2新增零售贷款占比达64%，支撑整体贷款收益率水平提升。负债端，22H1总负债及总存款分别同比增长19.4%、14.2%。结构上，新增存款中储蓄存款占比较高，导致负债端成本较年初+4BP，但后续随着存款定价机制改革效果逐渐显现，负债成本有望回落。资产质量稳健。截至22H1，不良贷款率环比-1BP，达到上市以来的最佳水平；拨备覆盖率在高位基础上继续较22Q1提升3.1pct，拨备持续增厚提升利润反哺能力。村镇银行健康发展，22H1兴福村镇银行不良率 0.99%，拨备覆盖率296%。资本充足率略有下降，可转债落地进一步将打开成长空间。截至22H1，核心一级资本充足率为9.86%，环比-15BP，主要是规模增长对资本消耗较多。目前60亿元可转债已获批，后续转股成功，可为高质量扩表进一步拓展空间。聚焦经营贷细分市场，结构优化提振贷款收益率。常熟银行坚持做小做散做长尾定位，22H1个人经营性贷款、100万元以下贷款在总贷款中占比分别达到38.4%、41.5%；个人经营性贷款户均规模进一步缩小，环比22Q1下降0.3万元。同时，通过“向小、向农、向信用”策略，一方面拓展长尾客群市场空间；另一方面提升风险定价，22H1总贷款及经营贷中信用类贷款占比分别+3.9pct、+4.1pct至25.3%、29.6%，对小微贷款综合定价的企稳回升起到提振作用。投资建议：净息差企稳向好，业绩维持高增速净息差呈现逐季向好态势，叠加信贷投放高增速，支撑净利息收入高增；其他非息收入亮眼，亦助力营收增速维持高水平；资产质量持续改善，可转债获批可补充资本。提出“向小、向农、向信用”策略，不断优化贷款结构有望支撑净息差持续坚挺。预计22-24年EPS分别为0.95元、1.16元和1.36元，2022年8月15日收盘价对应1.0倍22年PB，维持“推荐”评级。风险提示：宏观经济增速下行；疫情风险频发；信用风险暴露。,,民生证券,推荐,[None],2022-08-16,,增持,4953284,pdf_downloads/2022/2022-08-16/601128-常熟银行（601128）2022年中报点评：净息差坚挺，助业绩高增.pdf,601128,常熟银行,常熟银行（601128）2022年中报点评：净息差坚挺，助业绩高增
"刘志平,李晴阳",事件概述常熟银行发布2022年中报：2022H1实现营业收入43.74亿元(+18.86%，YoY)，营业利润15.30亿元(+19.20%，YoY)，归母净利润12.01亿元(+19.96%，YoY)；中期总资产2748.94亿元(+18.77%，YoY；+2.31%，QoQ)，存款2074.22亿元(+14.24%，YoY；+1.55%，QoQ)，贷款1852.63亿元(+22.37%，YoY；+7.01%，QoQ)。净息差3.09%(+7bp，YoY)；不良贷款率0.80%(-1bp，QoQ)，拨备覆盖率535.83%(+3.10pct，QoQ)，拨贷比4.30%(-0.02pct，QoQ)；资本充足率11.58%(-0.87pct，QoQ)；年化ROE11.72%(+0.82pct，YoY)。分析判断:►  价稳量升驱动业绩稳健增长常熟银行上半年累计实现营收、PPOP、归母净利润分别同比+18.86%/+20.55%/+19.96%，较一季度增速略有回落，仍保持较高水平。其中非息收入承压下（主要是手续费净收入受理财收入确认时点扰动），核心收息业务实现了20%以上的较快增长，主要得益于一方面22H1净息差环比持平Q1于3.09%，同比提升7BP（较Q1涨幅略降5BP），在利率下行、行业息差普遍承压的背景下显现较强韧性；另一方面上半年信贷快增，同比增幅22.4%形成较强支撑。营收强劲驱动，同时减值计提的低基数消退下、上半年同比多提幅度略有缩窄，业绩延续稳健。单二季度来看，营收和归母净利润分别同比+18.4%/+16%，分别较Q1降0.9和7.4个百分点，利息净收入同比稳健增长18%、环比降6pct的同时，交易类非息收入有较明显的提升。►  零售投放恢复，微贷领域继续做小做散息差的支撑因素，从价格方面来看，上半年贷款收益率6.32%，同比和较2021A分别提升10BP和8BP，叠加资产结构的改善，带动资产端收益率同比提升14BP至5.31%，超过存款和付息负债分别4BP和7BP的增幅。其中对公和零售贷款利率分别同比提升2BP和1BP，主要是票据同比企稳回升33BP改善幅度较大。从信贷投放规模和结构上来看，二季度信贷投放强劲的同时，零售贷款占比提升。Q2贷款规模同比+22.4%，高于总资产增速3.6pct；季度环比看，Q2总资产较年初+2.3%，低于Q1增幅，而贷款季度扩增7%，较Q1进一步提升0.7pct，资产结构进一步向贷款倾斜。中期对公、票据和零售贷款分别较年初扩增15.5%、46.9%、10.9%，Q2季度环比分别为4.6%、21.4%、7.5%，二季度零售贷款投放季节性回升。增量结构来看，上半年贷款增量225亿元，同比多增14%，已达去年全年的72%。其中Q2贷款新增121亿元，零售占比63.6%，较Q1季节性回升33.3pct。零售贷款中，个人经营贷较年初+9.6%实现稳健增长，贡献了零售贷款增量的57%，同时信用卡贷款低基数下实现较年初+36.7%的高增幅。高收益零售贷款的投放是支撑息差稳健的主要因素。客群来看，微贷战略执行下，贷款投放继续做小做散，上半年单户授信100万以下客群户数增量占总体增量的91%，30万以下经营贷客户数增量占总经营贷客户增量的82%，集中度较上年显著提高。相应的，经营贷中30万以下客群经营贷占比较年初进一步提升1.2pct至29.2%。,,华西证券,买入,[None],2022-08-16,,增持,4953086,pdf_downloads/2022/2022-08-16/601128-常熟银行（601128）：高投放驱动营收快增，坚守小微战略市场优势.pdf,601128,常熟银行,常熟银行（601128）：高投放驱动营收快增，坚守小微战略市场优势
"戴志锋,邓美君,贾靖",投资要点中报亮点：1、营收和拨备前利润增速总体保持高位稳定。上半年常熟银行整体净利息收入保持不弱增长、同时非息收入同比增速由负转正，带动营收同比总体保持高位平稳；由于费用支出增速有一定走阔，拨备前利润增速有一定放缓、仍保持21%的高增。2、信贷需求不弱，上半年新增225亿，零售信贷占比总资产提升至40%的历史高位。Q2信贷单季新增121亿，其中一般对公新增29.7亿，零售新增77亿，票据新增14.5亿，总体保持旺盛的信贷需求。对公和零售信贷占比均环比提升，其中零售信贷占比总生息资产比例环比提升2个百分点至40%的历史高位。3、贷款内部结构优化明显。100万以下贷款金额占比环比提升至41.6%，贷款做小做散趋势持续。同时信用类贷款增长明显，1H22公司信用类贷款占比总贷款提升至25.2%，占比较年初提升4个百分点、较2018年提升12个百分点。4、净非息收入由负转正，主要是其他非息支撑。净其他非息收入同比增65%，主要是投资收益和汇兑损益保持较高增长。受到理财手续费收入确认频次的影响，上半年中收同比有较大幅度压降；但我们对理财业务收入全年增速并不悲观，预计全年中收仍将保持同比正增。5、资产质量稳健优异。不良率低位继续环比下行至0.80%，累积年化不良稳定低位，未来不良压力环比小幅下行。风险抵补能力高位继续夯实。2季度拨备覆盖率536%，环比提升3个百分点。中报不足：1、Q2单季息差环比小幅下行，但下降幅度较1季度已经明显收窄。同时生息资产环比增2.3%，带动净利息收入在1季度整体不弱的基数下继续环比增4.5%。其中资产端收益率环比下行6bp，同时负债端付息率环比下行2bp正向贡献息差。2、零售新增贷款占比较去年同期偏弱，主要是按揭贷款投放有拖累，同时经营贷占比投放也有小幅放缓。个人经营贷上半年新增62亿（21年上半年64亿），占比全年贷款增量28%。2季度个人经营贷单季新增44亿，存量占比总贷款小幅下行至38.4%。,,中泰证券,增持,[None],2022-08-16,,增持,4952480,pdf_downloads/2022/2022-08-16/601128-常熟银行（601128）2022年中报：信贷内部结构优化明显，营收保持高位稳定.pdf,601128,常熟银行,常熟银行（601128）2022年中报：信贷内部结构优化明显，营收保持高位稳定
"马婷婷,陈功",事件：常熟银行公布2022H半年报，整体表现亮眼：实现营收、归母利润分别同比增长18.9%、20.0%；不良率0.80%，较Q1下降1bp。业绩：营收、利润均保持近20%快速增长。2022H常熟银行营收、利润同比增速分别为18.9%、20.0%，年化ROE同比提升0.82pc至11.72%，盈利能力稳步提升。具体来看：1）规模高增+息差保持稳定，驱动利息收入快速增长。上半年利息净收入同比增长20.8%，主要得益于规模快速扩张（贷款较年初增长13.8%）。全行业息差下行压力加大的情况下，其22H净息差为3.09%，环比Q1持平，较2021年提升3bps。拆分来看：A、资产端：22H贷款收益率6.32%，较2021年提升8bps，带动生息资产收益率提高6bps至5.31%。其中对公贷款利率略降1bp至4.91%，个人贷款提高5bps至7.39%，当前微贷竞争环境相对成熟，预计其各产品贷款利率也已基本稳定。此外，上半年票据利率波动较大的情况下，常熟银行抓住波段机会，22H票据贴现利率提升30bps至3.89%，也对息差形成了支撑。B、负债端：虽然市场化机制改革帮助定期存款利率有所增加，但存款竞争压力仍较大，定期存款占比提升，存款综合成本率略升1bp至2.28%。2）手续费及佣金净收入：受理财收入确认时点扰动，未来有望增厚营收。22H手续费及佣金净收入仅0.02亿，主要是去年净值化转型结束，新产品的收入确认有一定迟滞，下半年有望逐步确认。3）其他非息收入：投资、汇兑收益等表现较好。上半年其他非息收入同比高增64.7%，除了传统的债券投资收益之外，今年抓住了外汇及衍生品的投资机会，上半年汇兑收益达到1.45亿（去年同期为负）。业务：微贷稳步扩张，继续“做小、做散、做下沉”，与大行错位竞争。1）资产端： 6月末总资产2749亿，较年初增长11.5%，贷款较年初增长13.8%，Q2单季度环比增长7.0%，增速环比Q1继续提升0.7pc。其中个人经营贷较上半年增长9.6%，虽然3-4月受疫情影响，但5-6月恢复较好，上半年个人经营贷增长62亿，与去年同期基本相当；经营贷+消费贷同比多增了10亿。下半年一般为微贷投放旺季，微贷有望继续保持高增长态势。此外，6月末个人经营贷信用类贷款占比29.6%，较上年末继续提高4.1pc，户均规模33.3万元，较3月末继续下降0.3万元，“做小、做散、做信用”战略持续推进，有利于常熟银行与大行错位竞争，保持自身息差优势。2）负债端：6月末存款规模为2074亿，较年初增长13.5%，主要是个人存款增长较快（较年初增长14.7%），对公存款上半年净减少7.1亿，且整体活期存款占比较年初下降2.9pc，竞争压力仍较大。资产质量：各项指标维持稳中向好，不良生成率仅0.46%1）6月末不良率0.80%，环比Q1下降1bp，关注类占比0.88%，环比下降6bps。逾期率0.94%，较上年末提升略升4bps，预计主要是受疫情影响，省外村镇银行逾期率有所提升。2）分类别来看，对公贷款不良率较年初下降13bps至0.83%，改善明显。个人贷款不良率较年初提高8bps至0.85%，主要是疫情影响下消费贷款不良率上升24bps至0.87%。3）动态来看，上半年不良生成率0.46%，继续处于较低水平。4）6月末拨备覆盖率536%，较Q1稳步提升3.1pc，拨贷比4.30%，相比 Q1基本稳定。,,国盛证券,买入,[None],2022-08-15,,买入,4952310,pdf_downloads/2022/2022-08-15/601128-常熟银行（601128）：22H业绩亮眼，息差稳定，微贷战略稳步推进.pdf,601128,常熟银行,常熟银行（601128）：22H业绩亮眼，息差稳定，微贷战略稳步推进
