author,content,filename,org_name,original_rating,pdf_link,publish_time,rating_adjust_mark_type,rating_changes,report_id,save_path,stock_code,stock_name,title
"笃慧,郭皓,赖福洋","投资要点

业绩概要：马钢股份公布2016年上半年预盈公告，报告期内公司实现归属于母公司股东的净利润约4.5亿元，基本每股收益约0.06元，其中一季度净利为-3.93亿元、EPS为-0.05元，二季度净利为8.43亿元、EPS为0.11元。去年同期公司实现属于母公司股东的净利润-12.37亿元，每股收益-0.16元；

二季度业绩增长明显：公司二季度业绩表现亮眼，单季度实现净利8.43亿元，EPS为0.11元，盈利大幅度改善。从2015年四季度至今公司单季EPS表现分别为-0.29元、-0.05元以及0.11元，业绩触底反弹趋势明显，二季度盈利更是创2009年以来公司单季业绩最佳。无独有偶，从已经公告业绩表现的鞍钢以及韶钢来看，今年二季度的业绩表现都出现了大幅度的改善，因此我们认为行业基本面的复苏是其业绩改善的最大动因；

行业盈利持续回暖：自去年12月份以来，淡季之下去库筑成的需求底和情绪底使行业的盈利开始走向稳步复苏之路。而到了今年二季度需求端的扩张尤其是房地产投资领域的显著拉动，造成钢厂订单快速回暖，行业利润出现大级别反弹，虽然期间五月份钢价快速下跌导致行业盈利呈现收缩，但六月份止跌企稳致使行业盈利重回升势。经我们测算，自去年四季度以来螺纹钢单季吨钢毛利分别为-3.5元、93.29元以及182.59元，热轧板单季吨钢毛利分别为-94.53元、51.59元以及322.86元，中厚板单季吨钢毛利分别为-310.2元、-46.96元以及53.53元，行业各品种毛利都呈现逐步改善迹象；

需求复苏趋势短期不改：从之前的统计局数据来看，5月的固定资产投资增速似乎有环比走弱倾向，但我们认为这主要与辽宁省换届导致数据水分挤出有关。剔除辽宁数据影响，我们测算5月份固定资产投资增速较4月仅降低0.1个百分点、房地产投资增速环比加快0.3个百分点，显示固定资产投资平稳，而地产投资甚至仍在加速。配合其他数据印证，5月份发电量同比增速与4月份持平、工业增加值加快0.1个百分点、水泥产量增速加快0.5个百分点，均显示经济复苏趋势仍在延续，钢铁需求目前仍有支撑。虽然地产周期长期来看仍难乐观，但在短周期尚未走完情况下，叠加极低的钢材社会库存，钢价总体呈现易涨难跌状态，行业盈利格局有望延续；

投资建议：公司作为华东地区的大型钢铁生产企业，根据公司2016年计划粗钢产量近1900万吨，在下半年行业盈利趋势总体呈现向好背景下，公司业绩有望获得持续改善，预计2016-2018年公司EPS分别为0.21元、0.05元以及0.02元，维持“增持”评级。",,中泰证券,增持,[None],2016-07-14,,增持,1789510,pdf_downloads/2016/2016-07-14/600808-马钢股份(600808)：二季度业绩大增助力公司半年报扭亏.pdf,600808,马钢股份,马钢股份(600808)：二季度业绩大增助力公司半年报扭亏
"陈雳,邱瀚萱","投资要点：

2016年03月30日晚间公司披露2015年年报，主要分析如下：

公司全年亏损严重。公司全年实现营业收入约451.09亿元，同比下降24.59%；归属于母公司净利润-48.04亿元，同比下降50.45亿元；基本每股收益-0.62元，同比下降0.65元；加权平均净资产收益率-23.01%，比上年下降23.96个百分点。四季度业绩继续亏损。第4季度实现营业收入约103.83亿元，环比下降7.95%、同比下降32.53%；归属于母公司净利润-22.29亿元，环比下降-8.90亿元、同比下降27.76亿元，对应基本每股收益-0.29元，环比下降0.12元、同比下降0.36元。

国内钢铁市场低迷，公司净利大幅下滑。2015年，国内经济增速回落，钢铁下游需求萎靡，价格下行是公司营业收入下降的主要原因。由于原燃料价格跌幅小于产品价格跌幅，公司产品毛利亏损3.77亿元。此外，公司根据市场行情判断存货出现减值现象，公司计提资产减值16.19亿元，同比增加8.49亿元。

调整产品结构，强化市场经营创效。公司提高高附加值产品比重，汽车板产销量突破150万吨，W470以上高牌号硅钢同比增加200%；发挥APQP小组作用，大力开发新产品，镀锌DP800等高强汽车用钢实现批量生产，取向硅钢热轧原料、镀锡板基料、轨道交通用车轴钢实现批量供货，并且在低噪音车轮研发、国产化标准动车组车轮研制、高牌号硅钢以及高强汽车板的研发上取得突破。此外，公司进一步发展销售系统创新营销模式，全年新开发直供用户321家，板带直供比55%；拓展海外市场和现货电商销售渠道，全年出口钢材120万吨、电商平台销售钢材40万吨。

维持“增持”评级。公司的火车轮、高速动车组车轮、大功率机车轮、车轴钢等产品在国内处于技术龙头地位。目前国家不断加大对高铁、轨交投入，高端火车轮产能及业绩有望在未来放量；公司与法国ASCOINDUSTRIES共同投资设立埃斯科特钢有限公司，公司持有75%股权，该特钢公司主要生产用于汽车行业的钢线棒材以及精加工的钢铁产品，未来有望贡献业绩增量；故维持“增持”评级。预计16-18年EPS为0.01、0.03、0.06元/股，PE分别为290、81、43倍。

风险提示：经济形势变化；高铁、轨交建设进度；下游需求变化及价格波动；公司经营治理等。",,华泰证券,增持,[None],2016-03-31,,增持,1739468,pdf_downloads/2016/2016-03-31/600808-马钢股份：市场低迷拖累业绩.pdf,600808,马钢股份,马钢股份：市场低迷拖累业绩
"陈雳,邱瀚萱","投资要点：

2015年10月27日晚间公司披露2015年三季度季报，主要分析如下：

前三季度营收、利润双降。公司前三季度实现营业收入约17.97亿元，同比下降31.99%；归属于母公司净利润0.15亿元，同比下降95.60%；基本每股收益0.0087元，同比下降95.59%；加权平均净资产收益率0.26%，比上年下降5.72个百分点。第三季度出现亏损。公司三季度实现营业收入约6.05亿元，环比上升8.62%、同比下降29.15%；归属于母公司净利润-0.15亿元，环比下降135.68%、同比下降119.56%，对应基本每股收益-0.0087元，环比下降0.033元、同比下降0.053元。

国内钢铁市场低迷，公司亏损扩大。前三季度，公司生产生铁1,349万吨、粗钢1,412万吨、钢材1,374万吨，同比分别增加0.71%、0.70%和1.51%。价格上，9月末国际钢材价格指数128.7点，同比下降17.94%；国内钢材价格指数61.19点，同比下降29.14%。由于年初以来铁矿石价格窄幅震荡，焦煤价格缓慢下降，幅度均远小于钢价降幅，公司前三季度销售毛利率仅为1.15%，同比下降4.37个百分点，并且产量增幅不及价格跌幅，以上导致公司亏损扩大。

布局高端火车轮，期待高铁、轨交建设进程加快。2014年6月，公司收购法国著名车轮企业瓦顿公司，以获得高铁车轮技术，拓展国际化销售渠道。2015年5月，公司收购了马钢晋西轨道交通装备有限公司50%股权，使之成为自己的全资子公司，以便延伸车轮产业链，打造轨道交通装备制造平台。公司还加大了车轮用钢的冶炼和车轮产品制造相关技术的研发力度，成为相关领域国内技术龙头。然而年初以来高铁和各地轨道交通建设低于预期，公司火车轮方面业务受到影响。从长远来看，高铁、轨交建设大发展的趋势仍未改变，公司有望在未来该领域市场回暖时实现利润放量。

维持“增持”评级。虽然目前钢铁行业受下游影响较为艰难，但考虑到公司在高铁市场地位稳固，且国家不断加大对高铁、轨交投入，高端火车轮产能及业绩有望在未来放量；公司近期与法国ASCOINDUSTRIES共同投资设立埃斯科特钢有限公司，公司出资2400万欧元持有75%股权，该特钢公司主要经营开发、制造、贸易和进出口用于汽车行业的钢线棒材以及精加工的钢铁产品，提供售后服务及相关技术服务，未来有望贡献业绩增量；故维持“增持”评级。预计15-17年EPS为-0.4、0.01、0.04元/股，对应PB为1.16倍。

风险提示：经济形势变化；高铁、轨交建设进度；下游需求变化及价格波动；公司经营治理等。",,华泰证券,增持,[None],2015-11-02,,增持,1699778,pdf_downloads/2015/2015-11-02/600808-马钢股份：三季度亏损扩大，长远看好高铁、轨交发展.pdf,600808,马钢股份,马钢股份：三季度亏损扩大，长远看好高铁、轨交发展
"陈雳,邱瀚萱","投资要点：

2015年8月25日晚间公司披露2015年中报，主要分析如下：

公司上半年营收、净利双下滑。公司前半年实现营收约234.48亿元，同比下降18.77%；归属于母公司净利润-12.37亿元，同比下降69.33%；基本每股收益-0.16元，同比下降0.06元；加权平均净资产收益率-5.46%，同比下降2.25个百分点。二季度业绩环比基本持平。公司二季度实现营收117.00亿元，环比基本持平、同比下降23.13%；归属于母公司净利-6.91亿元，环比下降3.30%、同比下降142.48%，对应基本每股收益-0.08元，环比持平，同比下降0.04元。

钢价大跌和费用上升拖累上半年业绩。公司前6月销售钢材876万吨，同比增加10万吨，然而受累于钢价下跌幅度更大，公司上半年营收大幅下降。公司产品毛利率达到3.26%，同比上升1.49个百分点，但由于公司期间费用大幅上升，公司销售毛利率降至3.51%，同比下降0.1个百分点。三项费用中，管理费用同比上升37.6%，主因土地使用税税率较上年同期上升所致；销售费用同比上升29.6%，主要由于上半年出口产品大幅增加带来了大量运输费和码头装卸费。公司上半年出口收入达到21.47亿元，同比增长48.68%，显示公司在国际市场开拓方面有一定成效。

布局高端火车轮，期待高铁、轨道交通市场回暖。公司近年来瞄准高铁、城市轨道交通等领域，进行了大量布局。2014年6月，公司收购法国著名车轮企业瓦顿公司，以获得高铁车轮技术，拓展国际化销售渠道。2015年5月，公司收购了马钢晋西轨道交通装备有限公司50%股权，使之成为自己的全资子公司，以便延伸车轮产业链，打造轨道交通装备制造平台。公司还加大了车轮用钢的冶炼和车轮产品制造相关技术的研发力度，目前在这些方面处于国内技术龙头地位。然而上半年，由于高铁和各地轨道交通建设未达预期，公司火车轮方面业务受到影响，营业收入下降40%，而毛利率仍增加了1.16个百分点至19.57%。从长远来看，高铁、轨交建设大发展的趋势仍未改变，公司有望在未来该领域市场回暖时实现利润放量。

维持“增持”评级。虽然目前钢铁行业受下游影响较为艰难，但考虑到公司市场地位稳固，高端火车轮产能有望在未来放量，故维持评级。预计15-17年EPS预测-0.20、0.01、0.04元/股，对应PB为1.08倍。

风险提示：经济形势变化；高铁、轨交建设进度；下游需求变化及价格波动；公司经营治理。",,华泰证券,增持,[None],2015-08-28,上调评级,增持,1346052,pdf_downloads/2015/2015-08-28/600808-马钢股份：中期业绩下滑，期待高铁、轨道交通大发展.pdf,600808,马钢股份,马钢股份：中期业绩下滑，期待高铁、轨道交通大发展
"笃慧,郭皓","投资要点
    主要事件:马钢股份公布2015年上半年业绩公告,报告期内公司实现营业收入234.48亿元,同比下降18.8%;实现归属于母公司股东的净利润-12.37亿元,同比下降69.3%。上半年EPS 为-0.161元,去年同期为-0.095元,今年前两个季度 EPS 分别为-0.08元、-0.081元;
    吨钢数据:报告期内,本集团共生产生铁868万吨、粗钢915万吨、钢材891万吨,同比分别增加0.36%、1.10%和2.67%。结合半年报数据折算吨钢售价2424元/吨,吨钢成本2342元/吨,吨钢毛利82元/吨,同比分别变动-554元/吨、-585元/吨和30元/吨;
    公司表现略好于行业运行情况:上半年我国宏观经济不断寻底,固定资产投资与房地产开工面积持续低位徘徊。受此影响,钢铁行业下游需求极度低迷,社会库存去化速度缓慢,吨钢毛利走低。我们测算的数据显示,热轧板、冷轧板以及螺纹钢吨钢毛利分别同比下降149元/吨、134元/吨以及155元/吨。在行业低迷大背景下,上半年公司吨钢毛利逆市同比增加30元/吨,毛利率提升1.63%,业绩表现优于行业走势,这主要是受益于公司挖潜增效和聚焦核心业务,实现板材、型材、火车轮及环件毛利率增加2.05%、0.22%和1.16%。但与此同时,由于运输、装卸费用以及土地使用税大幅攀升,公司上半年销售及管理费用同比增加29.6%与37.6%,三项费用增幅明显恶化公司净利表现,同比下降69.3%;
    收购马晋公司,打造世界高端车轮领先企业:2015年5月29日公司宣布以1.74亿元收购收购晋西车轴持有的马晋公司(马钢与晋西车轴五五合资公司)50%股权,完成收购后,公司持有马晋公司的股权比重将由50%增至100%。马晋公司经营范围为铁路用各类车轮轴的研发、制造与贸易,公司通过此次收购行动,不仅可以与公司现有的车轮业务产生良好的协同效应,而且可以快速切入火车车轮下游产业链,进一步打造轨道交通装备制造平台。同时,公司前期成功收购法国瓦顿公司,增强了其在车轮及相关铁路产品的技术力量,在国内高铁市场蓬勃发展与高铁不断“走出去”背景下,有助于公司抢占高铁车轮产业链高地,打造世界高端车轮领先企业;
    高速车轮技术认证仍需等待:目前,发改委已梳理提出68个2015年-2017年拟新开工建设的重大城市轨道交通建设项目,预计2015年轨道交通总投资将超过去年水平。同时在国家不断加大对铁路以及轨道交通投资力度背景下,近期车辆装备购置频出大单。8月4日中国铁路总公司招标一批铁路列车项目,中标的总数达1143辆,预计中标资金超过600亿元。公司作为国内领先的高速火车轮及环件制造企业,引入法国瓦顿助力高速轮对技术认证进度,但短期而言其对公司业绩的提升仍需等待;
    投资建议:随着陆续完成收购法国瓦顿公司与马晋公司,公司在打造轨道交通装备制造平台领域又迈出了坚实的一步。在我国对铁路与轨道交通投资力度持续加大背景下,依托于高速车轮业务的先发优势地位,未来公司在高速火车车轮产业链的表现值得期待。若下半年我国经济得以企稳,需求回升叠加库存周期,公司业绩有望持续改善,预计2015-2017公司EPS 分别为-0.24元、-0.03元以及0.04元,中长期给予“增持”评级。",,中泰证券,增持,[None],2015-08-27,上调评级,增持,1344612,pdf_downloads/2015/2015-08-27/600808-马钢股份(600808)：高速车轮业务短期仍需等待.pdf,600808,马钢股份,马钢股份(600808)：高速车轮业务短期仍需等待
"杨件,倪文祎","事件

公司发布收购公告，与晋西车轴股份有限公司在北京产权交易所的组织下，签署《产权交易合同》，公司正式收购晋西车轴持有的马晋公司50%股权。

评论

扩张车轮产业链。本次收购完成后，公司将进一步增强车轮及相关铁路产品的技术力量。特别是在中国高铁“走出去”步伐加快的背景下，对公司打造轨道交通装备制造平台具有重要意义。

马晋公司主要从事国内外铁路需要的各类货车轮轴、客车轮轴、城市轨道交通用轮轴、高速动车组轮轴和机车轮轴等全谱系轮轴，以及转向架等轨道交通装备的研发、制造和维修。

根据公开挂牌结果，晋西车轴将马晋公司50%股权以人民币17,421.1万元的价格转让给公司，完成收购后，公司持有马晋公司的股权比重将由50%增至100%。

进一步转型轮对系统供应商。公司战略目标即为打造世界级车轮及相关铁路产品品牌，成为世界高端车轮领先企业。作为一系列转型/合作措施，除本次收购外，公司已完成对法国瓦顿公司的收购。未来有望进一步向高端轮对市场进军，实现产品结构升级进而打开国际市场。

法国瓦顿公司与日本新日铁住金、德国BVV公司、意大利卢奇尼公司并称为世界四大高速轮轴制造企业，主要产品为车轮、车轴及轮对系统等。瓦顿高铁车轮创造过世界最高试验时速574.8公里/小时，其在高铁车轮、车轴和轮对方面拥有全球领先的核心技术。

通过此次收购，全盘接收世界知名厂商高铁轮轴系列技术专利，打破国外长期技术垄断局面；并借助瓦顿原有在世界40多个国家和地区的销售网络以及各个国际铁路组织中的地位，大力推动中国高铁技术及产品走出去。因此，本次收购对公司甚至于对中国高铁“走出去”战略而言意义重大。

动车、高铁车轮空间广阔、业绩弹性大，是未来重要看点

根据公司年报信息，目前公司大功率机车轮通过CRCC（中铁检验认证中心）认证并实现批量使用，250km/h动车组车轮装车试运行，350km/h高速动车组车轮试制达到技术标准。我们认为，虽然公司上述产品尚未批量供货，但公司已具备领先技术实力、有政策支持、研发推进可期。

高铁车轮、车轴及轮对系统作为典型的高附加值、高利润产品，其盈利能力相当可观。据了解，动车组车轮价格比普通产品贵1-2倍（普通车轮售价在8000-9000元/吨，动车车轮为约2万元/吨；高铁车轮则达到6万元/吨，进口产品约在10万/吨），其毛利率水平30%左右，吨盈利较普钢高出数十倍乃至百倍。

我们测算未来高铁、动车车轮的国内外年均总需求超过80万吨，市场空间广阔。根据售价及毛利率测算，动车、高铁车轮对马钢业绩弹性为0.019元/万吨，假设其在国内、出口市场市占率均达到50%，则对应的年EPS空间为1.03元，故公司业绩进而股价均具备较大提升空间。

    投资建议

预计15、16年EPS分别为0.01元、0.02元，维持“买入”评级。",,国金证券,买入,[None],2015-06-01,,买入,846278,pdf_downloads/2015/2015-06-01/600808-马钢股份：高铁／动车车轮做大做强.pdf,600808,马钢股份,马钢股份：高铁／动车车轮做大做强
严浩军,"1、行业1-2年发展趋势。
    2014年,我国经济增速放缓,GDP 同比增长7.4%,增速同比回落0.3个百分点;同时,经济增长对钢材需求的强度也持续下降。据中钢协消息,2014年,粗钢表观消费量同比下降3.4%,钢材消费进入平台区的特征十分明显。而钢铁行业产能过剩、供大于求的基本格局并无改观,行业盈利水平低下。据工信部统计,2014年重点统计钢铁企业销售利润率只有0.9%,仍处于工业行业最低水平。
    展望未来,中国经济进入增长速度换挡期、结构调整阵痛期、前期刺激政策消化期“三期叠加”,呈现出“从高速增长转为中高速增长、经济结构不断优化升级、从要素驱动转向创新驱动”的新常态。钢铁行业产能过剩,需求缓中趋降,企业经营形势依然艰难。
    2、公司基本情况及主要业务简介。
    公司主营业务为钢铁产品的生产和销售,是中国最大钢铁生产和销售商之一,生产过程主要有炼铁、炼钢、轧钢等。公司主要产品是钢材,大致可分为板材、型钢、线棒、车轮和特钢五大类。
    2014年,公司在开局不利的逆境中,大力稳定生产秩序,优化产线分工和组产模式,高效调配资源,快速推进结构调整,经营绩效持续改善。全年开发新产品150万吨,大功率机车轮通过CRCC(中铁检验认证中心)认证并实现批量使用,250km/h 动车组车轮装车试运行,350km/h 高速动车组车轮试制达到技术标准,HRB500DW 低温钢筋填补国内空白。2014年,公司生产生铁1,797万吨,同比减少0.83%;生产粗钢1,887万吨、钢材1,838万吨,同比分别增加0.43%和1.38%。
    截止2014年12月31日,公司拥有有效专利632项,特许权8项,有效技术秘密513项。专利技术、技术秘密、技术诀窍构成了公司的核心技术体系。公司在车轮(特别是高速动车组车轮)、大功率机车轮、高强汽车板、高效节约型建筑用钢、海洋工程用H 型钢、热轧高等级管线钢、高效电工钢等关键产品方面形成自己的核心技术,与同类企业相比,具有竞争优势。特别是在高效节约型建筑用钢、车轮、高速动车组车轮、大功率机车轮产品在国内处于技术龙头地位。",,国元证券,持有,[None],2015-05-14,,中性,845138,pdf_downloads/2015/2015-05-14/600808-马钢股份(600808)：依托核心技术、推进结构调整.pdf,600808,马钢股份,马钢股份(600808)：依托核心技术、推进结构调整
"杨件,倪文祎","业绩简评

公司公布一季报，报告期内实现营收117.48亿元，同比降13.90%；实行归属上市公司股东净利润-5.95亿元，去年同期亏损4.46亿元；EPS为-0.08元。

经营分析

Q1亏损同比扩大。报告期内生产生铁425万吨、粗钢450万吨、钢材434万吨，同比分别增加5.59%、7.49%、8.80%，而营收出现一定下滑，主要为Q1钢价下跌幅度较大所致。虽然矿石有所下跌，但公司Q1综合毛利率同比下降0.86个百分点。此外，缴纳土地使用税、新增瓦顿公司销售费用等原因导致三费等同比增加较快，期间费用率同比增加2.1个百分点至近几年来最高7.77%。

减亏或扭亏仍有希望。受益行业供给收缩、成本红利两条中长期逻辑，行业中长期盈利得到持续改善，公司亦不例外。同时，公司也将加强内部管理，针对外部市场变化、柔性组织内部生产、采购方面执行低库存战略、继续提高直供比例并加快新产品开发，未来主业减亏或扭亏的希望仍然较大。

动车/高铁车轮是重要看点。公司是我国最大的车轮研发制造基地，具有40多年的车轮生产经验。目前，其研制的250km/h动车组车轮装车试运行中，350km/h高速动车组车轮试制已达到技术标准。虽然上述产品尚未批量供货，但未来市场空间广阔。根据我们的测算，未来高铁、动车车轮的国内外年均总需求超过80万吨，动车、高铁车轮对应公司业绩弹性为0.019元/万吨，假设其在国内、出口市场市占率均达到50%，则对应的年EPS空间为1.03元，弹性巨大。

未来的轮对系统供应商。公司正开展与晋西车轴合作、收购法国瓦顿等一系列转型/合作措施。目前已完成对世界高铁轮轴名企瓦顿公司的收购，并全盘接收世界知名厂商高铁轮轴系列技术专利，有望打破国外长期技术垄断局面并进一步向高端轮对市场进军。

高铁产业链及一带一路标的。通过车轮等系列产品，公司成为高铁产业链上游，且产品弹性较大（单价高、市占率高），同时受益于一带一路。近期南、北车股价上涨为高铁产业链打开估值提升空间，公司股价也有望受益。

投资建议

预计15-17年EPS分别为0.03、0.04、0.05元，维持“买入”评级。",,国金证券,买入,[None],2015-04-30,,买入,843672,pdf_downloads/2015/2015-04-30/600808-马钢股份：继续期待动车／高铁车轮.pdf,600808,马钢股份,马钢股份：继续期待动车／高铁车轮
