author,content,filename,org_name,original_rating,pdf_link,publish_time,rating_adjust_mark_type,rating_changes,report_id,save_path,stock_code,stock_name,title
刘强,"事件：公司发布2023年年报,盈利水平显著改善1）2023年实现收入66.7亿元，同比+40.5%；实现归母净利润5.04亿元，同比+78.2%；实现扣非净利润2.8亿元，同比+104.9%；毛利率22.81%，同比+2.52pct；净利率7.53%，同比+1.56pct； 2）对应Q4收入18.9亿元，同比+21.6%，环比+0.8%；归母净利润1.7亿元，同比+48.8%，环比+20.6%；扣非净利润1.6亿元，同比+129.7%，环比+17.5%；毛利率24.45%，同比+2.09pct，环比+1.67pct；净利率8.96%，同比+1.57pct，环比+1.45pct。按产品来看：变压器与成套业务基础夯实，储能业务实现突破2）成套收入17.7亿元，同比+59.8%，毛利率17.74%，同比+0.89pct；3）储能收入4.1亿元，同比+546.9%，毛利率12.46%，同比-0.91pct；4）数字化解决方案收入0.7亿元，同比-47.9%，毛利率20.05%，同比-2.42pct；5）光伏电站收入1.6亿元，同比+267.0%，毛利率9.08%，同比-8.41pct；6）安装工程收入1.2亿元，同比+34.3%，毛利率10.27%，同比-0.45pct；按下游应用行业看：新能源行业快速增长1）新能源行业收入37.2亿元，同比+68.2%；其中，光伏占51%，收入同比+88.9%；风电30%；储能17%，收入同比+302.6%；其他2%； 2）非系能源行业收入28.3亿元，同比+20.1%；其中，工业企业配套占42%，收入同比+40.1%；基础设施19%、节能环保13%、高端装备/发电/新型基础设施各6%、民用住宅5%、其他3%。按国内外收入看：海外业务实现快速增长1）国内收入54.5亿元，同比34.5%；2）国外收入11.8亿元，同比79.5%，海外收入实现快速增长。订单情况：新签订单强势增长1）2023年整体销售订单78.32亿，同比+35.1%；其中外销订单19.91亿，同比119.2%；随着海外市场需求快速增长及海外渠道优势日益凸显，外销业务实现强势增长； 2）近日，新签数字化整体解决方案业务2.29亿订单；截至报告披露日，数字化整体解决方案订单累计已超6亿，客户的高度认可为公司数字化整体解决方案新业务的发展奠定了坚实的基础；3）2023年储能订单6.41亿，同比+144.9%。投资建议：我们预计2024-2026年公司营收分别为89.83亿元、113.71亿元、136.31亿元，同比+34.73%、+26.58%、+19.87%；归母净利分别为7.54亿元、10.28亿元、12.78亿元，同比+49.40%、+36.30%、+24.32%；EPS分别为1.76/2.20/2.99元，当前股价对应PE分别为24/17/14倍，首次覆盖，给予“买入”评级。风险提示：新能源行业发展不及预期、海外市场开拓不及预期、行业竞争格局恶化等",,太平洋证券,买入,[None],2024-03-24,,买入,5555453,pdf_downloads/2024/2024-03-24/688676-金盘科技（688676）：盈利水平显著改善，海外业务快速增长.pdf,688676,金盘科技,金盘科技（688676）：盈利水平显著改善，海外业务快速增长
"武浩,曾一赟",公司发布2023年年报， 2023年营收66.68亿元，同比增长40.50%；归母净利润5.05亿元，同比增长78.15%；扣非净利4.81亿元，同比增长104.92%。其中2023Q4归母净利润1.71亿元，同比增长48.76%；扣非归母净利润1.59亿元，同比增长129.74%。点评：把握新能源及海外市场机遇，公司业绩实现高速增长。分业务板块来看，公司23年干式变压器收入为40.93亿（YOY+25.23%）；成套系列为17.70亿（YOY+59.81%）；储能为4.14亿（YOY+546.95%）。分地区来看，公司海外收入为11.77亿元（YOY+79.54%），国内收入为54.49亿（YOY+34.5%）。分收入领域看，新能源行业销售收入同比增长 68.21%，其中储能领域行业销售收入同比增长 302.58%，光伏领域销售收入同比增长 88.95%。订单来看，公司23年订单为78.32 亿（不含税，YOY+35.14%），其中2023 年公司海外订单 19.91 亿元（YOY+ 119.18%）。公司抓住新能源和海外市场机遇，带动公司23年业绩快速增长。积极推进工业数字化转型，公司盈利水平进一步提高。2023年公司整体毛利率为22.81%(YOY+2.52pct)，净利率为7.53%（YOY+1.56pct）。其中公司Q4毛利率为24.45%（QOQ+1.67pct），净利率为8.96%（QOQ+1.45pct），公司的盈利能力继续改善。分板块来看，公司的毛利率改善主要贡献来自干式变压器及成套电器等公司的主要业务，2023年干变毛利率为26.98%（YOY+5.25pct），成套电器毛利率为17.74%（YOY+0.89pct）。公司拥抱新技术，持续数字化转型，23年已完成海口、桂林及武汉数字化工厂的建设。随着数字化工厂的投入运营，数字化制造能力进一步提升，运营成本得到有效控制，加上材料价格下降，优质客户占比提升，销售毛利率上升，管理费用占销售比有所下降，进一步提升公司的盈利水平及经营业绩。公司数字化工厂带动行业数字化转型，公司数字化业务大有可为。公司以自身数字化工厂为模范，积极承接数字化解决方案。公司23年新签数字化整体解决方案业务订单，总金额合计 2.29 亿元（含税），累计承接数字化工厂整体解决方案业务订单金额已超 6 亿元。数字化业务有望带动行业转型发展，也有望成为公司新的业绩增长点。积极拓展至储能/氢能等新业务方向，打造新能源数字制造设备供应商。储能方面，公司一方面生产配套电力设备，另一方面建造金盘储能数字化工厂，开发了高功率密度的大储 PCS、模块化 PCS 和智能型高压SVG 等电力电子产品，自主研发了工商业储能产品、金易充（CSP）充电桩平台和 Smart 户用储能一体机。公司2023 年新承接的储能系统订单达到了 6.41 亿元（不含税），同比增长144.87%。氢能方面，公司布局电解水制氢整流变压器，十四五到十五五期间公司致力成为以制氢和氢能应用为主轴的氢能源产业数字化技术为核心的氢能源产业优势企业。盈利预测与投资评级：我们预计公司2024-2026年营收分别是95、123、150亿元，同比增长43%、29%、22%；归母净利润分别是8、11、14亿元，同比增长60%、39%、26%。维持“买入”评级风险因素：原材料价格波动风险，高压级联方案渗透率不及预期，市场竞争加剧。,,信达证券,买入,[None],2024-03-23,,买入,5554396,pdf_downloads/2024/2024-03-23/688676-金盘科技（688676）：23年业绩高速增长，紧抓新能源及工业数字化发展机遇.pdf,688676,金盘科技,金盘科技（688676）：23年业绩高速增长，紧抓新能源及工业数字化发展机遇
"杨斌,余小龙",2023归母净利润增速达78.15%，业绩符合市场预期。2023年公司实现营收66.68亿元，同比增长40.50%；实现归母净利润5.05亿元，同比增长78.15%；实现扣非净利润4.81亿元，同比增长104.92%，单季度来看，2023Q4实现营收18.95亿元，同比增加21.59%，实现归母净利润为1.71亿元，同比增加48.76%。2023公司综合毛利率为22.81%，同比增加2.52pcts；净利率为7.53%，同比增加1.56pcts，业绩符合市场预期。受益于全球能源转型加速，海外布局打开成长空间。公司国内销售网点58个，产品外销6大洲，86个国家，2023年公司海外收入11.8亿元，同比增加79.54%，占比17.77%；新增订单78.32亿元（不含税），同比增长35.14%，其中海外订单19.91亿元，同比增长达119.18%，年内新增拓展近百家海外客户，同时海外业务在发电机供电、工业企业电气配套、新基建等众多领域销售均实现较快增长。公司1999年在墨西哥建厂生产变压器出口美国市场，持续获得先发优势。数字化战略赋能生产管理，降本增效开辟新增长极。公司运用数字化的技术，通过资源配置的改善和优化，各基地数字化工厂的产能、人均产值、库存周转率等较转型前有大幅度提升，降本增效明显，2023年综合毛利率提升2.52pct。对外公司数字化团队已成功实施完成包括干式变压器、成套、储能、油浸式变压器 4 大产品类别数字化工厂整体解决方案，至 2023 年预计将累计完成 9 座数字化工厂解决方案并实施落地，累计承接超 6亿元数字化工厂整体解决方案业务订单，获得客户高度认可。强化变压器主营业务，储能业务引领公司“十四五”发展。公司是干式变压器龙头，目前能够生产145KV及一下电压等级60MVA及以下容量的合成酯、天然酯及油浸式变压器，满足新能源、高端装备等需求，2023年公司变压器业务营收占比为61.3%。储能方面，公司推出用于发电侧、电网侧和工商业用户侧等全应用场景的中高压直挂（级联）储能系统、低压储能系统等储能全系列产品，2023年储能销售增速达302.58%，有望成为公司第二成长曲线。盈利预测与投资建议：根据公司新增订单情况，我们预计公司2024-2026年公司营业收入分别为91/120.4/151.4亿元（2024-25年原预测为115.5/162.1 亿元），对应归母净利润分别为7.8/10.5/13.5亿元（2024-25年原预测为8.93/13.95 亿元）。基于电网投资的高景气度，我们将永续增长率从2.5% 提升至3%，将目标价从43.22元/股提升至48.71元/股，维持 “优大于市”评级。风险提示：1、相关政策、电网投资不及预期；2、新能源和储能装机不及预期；3、原材料价格大幅上涨；4、贸易摩擦。,,海通国际证券,优于大市,[None],2024-03-22,,买入,5554227,pdf_downloads/2024/2024-03-22/688676-金盘科技（688676）：业绩符合市场预期，海外市场订单增速亮眼.pdf,688676,金盘科技,金盘科技（688676）：业绩符合市场预期，海外市场订单增速亮眼
"曾朵红,谢哲栋",23年营收同比+41%、归母净利润同比+78%，业绩符合预期。公司23年实现营收66.7亿元，同增41%；实现归母净利润5.0亿元，同增78%；扣非归母净利润4.8亿元，同比+105%。23Q4营收19.0亿元，同增22%，归母净利润1.7亿元，同增49%。23年毛利率22.8%，同比+2.5pct，归母净利率7.5%，同比+1.6pct，主要系：1）硅钢单边价格下跌，调价滞后；2）高毛利的海外业务占比提升。海内外双轮驱动，业绩符合预期。23年基本兑现战略布局，海内外共振，数字+能源“仍需等待”但“不会太久”。1）23年是海外放量元年、24年预期仍较高。23年海外收入12亿，同比+80%，海外市场由风电延伸至光储、IDC、电网、基建等百家客户。国内收入55亿，同比+35%。23年新增海外订单20亿（同比+119%），预计有望支撑24年收入继续同比翻倍高增。2）新能源和工业企业配套仍是国内主驱力。新能源收入同比+68%，其中光伏/储能分别同比+89%/+303%；工业企业配套收入同比+40%，涵盖冶金、石化、海洋平台、矿山等多行业。24年新能源增速放缓，但火电、数据中心、工业企业预计仍有支撑。3）“数字+能源”业务“初见成效”。23年储能收入4.1亿、新增订单6.4亿，同比+145%。展望24-25年，储能供给侧出清仍不确定，但金盘有望凭借海外渠道推介高压级联方案，储能出海也值得期待。23年实现数字化解决方案收入0.7亿，截至12月31日累计承接订单金额超6亿。此外，数字化工厂在报表端的反应最直观的是人效，人均创收从20年133万元，提至23年302万元，CAGR=31%。重新讨论金盘的“数字能源”战略思路&执行，窥视金盘中长期成长路径。公司围绕能源革命及产业数字化背景，制定了“新能源（风光储氢）+数字化智能制造”发展战略，通过“全产业链+全球市场+产业升级”实现战略路径，1）全产业链：研发新品+新工艺+新材料（海风液浸变、高电压等级干变、数字化变压器&中压柜、智能一体式电源等；“十五五”步入氢能领域）；2）全球市场：做深美国市场（从新能源走向算力中心等“未来科技”），延伸欧洲等市场，从“卖干变”到解决方案。3）产业升级：践行新质生产力理念，基于数字化团队和工厂，推动数据要素资产平台，运用工厂海量数据训练金盘AI大模型，推动其在工厂端的落地（数据驱动研发效率、物流效率的提高）。因此，2024年起我们可以期待超预期的点有： 24年新品类收入开始贡献增量（如油变、开关柜等）、海外欧洲市场“锦上添花”、数字化订单超预期、人效进一步提升。盈利预测与投资评级：我们维持公司2024-2025年归母净利润分别为7.91/11.35亿元，预计2026年归母净利润14.18亿元，同比+57%/+43%/+25%，对应PE为22倍/15倍/12倍，给予24年30倍PE，对应目标价55.5元，维持“买入”评级。风险提示：海外市场拓展不及预期、竞争加剧、原材料涨价超预期等。,,东吴证券,买入,[None],2024-03-22,,买入,5553757,pdf_downloads/2024/2024-03-22/688676-金盘科技（688676）：2023年年报点评：出海首战告捷，数字化又下一城.pdf,688676,金盘科技,金盘科技（688676）：2023年年报点评：出海首战告捷，数字化又下一城
"王蔚祺,王晓声",全年业绩符合预期，归母净利润增长78%。公司2023年实现营收66.68亿元（同比+40.50%），归母净利润5.05亿元（同比+78.15%），扣非净利润4.81亿元（同比+104.92%），销售毛利率22.81%（同比+2.52pct.），扣非销售净利率7.21%（同比+2.27pct.）。四季度业绩创历史新高，盈利能力持续提升。公司2023年四季度实现营收18.95亿元（同比+21.59%，环比+0.79%），归母净利润1.71亿元（同比+48.76%，环比+20.56%），销售毛利率24.45%（同比+2.1pct.，环比+1.67pct.），销售净利率8.96%（同比+1.57pct.，环比+1.45pct.）。新增订单保持高增速，海外新增订单接近20亿元。2023年公司实现海外订单收入19.91亿元，同比增长119.18%。2023年公司新增订单78.32亿元（不含税），同比+35.14%，其中海外新增订单19.91亿元，同比+119.18%。23年新增拓展近百家海外客户，在发电及供电、工业企业电气配套、新基建等领域快速增长。公司紧抓全球电力设备需求景气周期，海外业务表现突出。数字化助力内部降本增效，持续斩获外部订单。公司自2019年开始推进数字化转型建设，目前武汉基地各数字化工厂已全面投产，公司基于自主研发的工业互联网平台JSTDFPlat3.0及企业服务总线平台Vportal，已实现各系统间的无缝连接和信息流的自动化，生产效率显著提升。公司累计承接数字化解决方案订单超6亿元，公司数字化解决方案产品已得到市场普遍认可。持续深耕打磨优势产品，高端液浸式变压器成功线下。目前公司可提供72.5kV及以下的干式变压器和电压等级为145kV及以下、容量60MVA及以下的液浸式变压器。公司72.5kV产品成功应用于海上和陆上风电，“17MVA/66kV海上风电液浸式变压器”已成功下线。公司率先研发成功业内首台陆地10MW机组配套的35kV升压干式变压器并成功并网。风险提示：上游原材料大幅涨价；市场竞争加剧；海外市场开拓不及预期。投资建议：下调盈利预测，维持“买入”评级。考虑到储能行业竞争情况和公司数字化解决方案产品交付节奏，小幅下调24年盈利预测。预计2024-2026年实现归母净利润7.54/10.68/13.48亿元（24-25年原预测值为8.01/10.24亿元），当前股价对应PE分别为23/16/13倍，维持“买入”评级。,,国信证券,买入,[None],2024-03-22,,买入,5553647,pdf_downloads/2024/2024-03-22/688676-金盘科技（688676）：干变龙头持续打磨内功，海外业务引领行业.pdf,688676,金盘科技,金盘科技（688676）：干变龙头持续打磨内功，海外业务引领行业
"韩晨,李昂",事件：公司2023年实现营业收入66.7亿元，同比增长40.5%；实现归母净利润5亿元，同比增长78.2%；扣非归母净利润4.8亿元，同比增长104.9%。2023年第四季度公司实现营收18.9亿元，同比增长21.6%；实现归母净利润1.7亿元，同比增长48.8%；扣非归母净利润1.6亿元，同比增长129.7%。盈利能力持续提升，研发投入维持高位。盈利端：2023年公司销售毛利率/净利率分别为22.8%/7.5%，同比增长2.5/1.6pp；单Q4毛利率/净利率分别为24.5%/9%，分别环比提升1.7/1.5pp。费用端：公司2023年销售/管理（不含研发）/财务费用率分别为3.3%/4.2%/0.6%，分别同比-0.04pp/-0.7pp/+0.7pp。此外，公司2023年研发费用率为5.3%，同比提升0.06pp，其中主要涉及多行业、多品种变压器，高研发投入稳固竞争优势。欧美变压器市场供需失衡，公司出海进程加快，龙头优势稳固。伴随新能源大规模并网接入以及欧美电网设备老旧、本土企业产能供给不足，导致欧美变压器进口呈现量价齐升态势。公司深耕海外市场数十载，具备完善的渠道客户资源及墨西哥工厂产能，2023年公司整体变压器系列实现营收40.9亿元，同比增长25.3%，毛利率为27%，同比增长5.3pp，主要系数字化生产、规模效应降本及海外高毛利产品占比提升。此外，终端需求提升亦带动成套设备快速增长，2023年公司成套系列收入17.7亿元，同比增长59.8%。我们认为，公司先发布局海外市场，具备产能及订单领先优势，尽管国内同行积极布局海外生产基地，但从选址到最终投产存在1-2年时间周期，公司充分受益海外高需求。储能系统迎来爆发增长，数字化业务打开长期发展空间。伴随桂林、武汉储能数字化工厂陆续投产，公司构建了涵盖发电侧、电网侧和工商业用户侧的全应用场景高中低压储能系统，2023年公司储能业务实现收入4.1亿元，同比增长547%，新承接的储能系统订单达到了6.4亿元（不含税），同比增长144.9%。此外，伴随AI技术的发展，数据中心建设有望驱动产业链能源装备需求增长，公司具备完善的产品布局（变压器、箱变、储能系统），多业务协同发展。未来，AI大模型有望赋能数字化工厂，公司前瞻布局数字化智能产线研发项目，已达国内领先水平，有望迎发展新机遇。盈利预测与投资建议。预计公司2024-2026年营收分别为97.6亿元、135.7亿元、172亿元，未来三年归母净利润增速分别为62.7%/40.9%/28.3%。公司加速进行数字化转型升级、积极拓展储能业务市场，业绩有望稳定增长，维持“持有”评级。风险提示：新能源装机不及预期风险；原材料价格上涨风险；汇率波动影响公司海外业务营收的风险；储能及数字化业务建设及产能释放不及预期风险。,,西南证券,持有,[None],2024-03-22,,增持,5553296,pdf_downloads/2024/2024-03-22/688676-金盘科技（688676）：变压器出海驱动量利双升，“储能+数字化”提振增长.pdf,688676,金盘科技,金盘科技（688676）：变压器出海驱动量利双升，“储能+数字化”提振增长
"贺朝晖,梁丰铄",公司发布2023年年报，2023年实现营业收入66.68亿元，同比+40.50%；实现归母净利润5.05亿元，同比+78.15%。其中23Q4公司实现营业收入18.95亿元，同比+21.59%，环比+0.79%；实现归母净利润1.71亿元，同比+48.76%，环比+20.56%。需求旺盛叠加降本增效，公司业绩大幅提升2023年，公司新能源相关销售收入同比增长68.21%，其中光伏相关收入同比增长88.95%，储能相关收入同比增长302.58%；在非新能源业务中，工业企业电气配套销售收入同比增长40.06%。随着公司不断精进数字化制造能力降本增效，2023年公司销售毛利率同比提升2.52pct至22.81%；变压器产品毛利率同比提升5.25pct至26.98%。2023年底，公司武汉数字化工厂全面投产，我们预计规模化效应有望进一步显现。海外开拓成效显著，借景气东风深化全球布局公司依托欧美市场的品牌知名度、精益制造、全球渠道布局等优势，在2023年内新增拓展近百家海外客户，海外业务在发电、工业企业配套、新基建等众多领域均实现快速增长。2023年公司实现海外销售收入11.77亿元，同比增长79.54%；全年获取外销订单19.91亿元，同比增长119.18%。我们预计公司有望继续受益于海外变压器旺盛需求，进一步深化全球化布局。强化研发投入迭代新产品，数字化产业蓄势新增长2023年公司研发投入同比增长42.06%，研发费用率为5.27%。公司不断研发高电压产品满足市场需求，新推出72.5kV干式变压器和60MVA/145kV液浸式变压器。公司数字化工厂解决方案业务持续推进，新签2.29亿元订单，累计订单金额超6亿元。公司数据中心领域变压器产品具备性能优势，已广泛应用于百度、华为、阿里巴巴、三大运营商等百余个数据中心项目。盈利预测、估值与评级由于储能价格下滑较大，我们调整盈利预测，预计公司24-26年营收分别为95.64/126.89/158.92亿元，同比增速分别为43.44%/32.67%/25.24%，归母净利润分别为8.04/11.76/16.00亿元，同比增速分别为59.35%/46.22%/36.03%，EPS分别为1.88/2.75/3.74元/股，3年CAGR为46.89%。鉴于公司在欧美市场的品牌和渠道优势显著，参照可比公司估值，我们给予公司2024年25倍PE，目标价47元，给予“增持”评级。风险提示：行业竞争加剧；原材料价格大幅波动；海外政策风险。,,国联民生证券,增持,[None],2024-03-22,下调评级,增持,5553123,pdf_downloads/2024/2024-03-22/688676-金盘科技（688676）：变压器盈利能力高增，海外布局持续深化.pdf,688676,金盘科技,金盘科技（688676）：变压器盈利能力高增，海外布局持续深化
"邓永康,李佳,朱碧野,王一如,李孝鹏,许浚哲",事件：2024年3月20日，公司发布2023年年报。23年公司实现营业总收入66.68亿，同比增长40.50%；实现归母净利润5.05亿，同比增长78.15%；实现扣非归母净利润4.81亿，同比增长104.92%。分业务来看，变压器系列及输配电实现收入61.41亿元，同比增速36.26%；储能系列实现收入4.14亿元，同比增长546.95%；数字化整体解决方案实现收入0.78亿元，同比下降47.91%。分下游结构来看，新能源领域实现收入37.23亿元，同比增长68.21%；非新能源领域实现收入28.33亿元，同比增长20.14亿元。盈利动能不断积蓄，费用管控良好。公司23年实现毛利率/净利率为22.81%/7.53%，同比分别提升2.52pcts/1.56pcts。费用方面，公司23年期间费用率为13.36%，同比提升0.04pct，其中销售费用同比增长38.82%，主要系扩大销售，员工薪酬激励、市场开拓、业务宣传投入增加等；研发费用同比增长42.06%，主要系公司加大海外市场、新能源及高效节能等领域产品的研发所致。在手订单充足，海外收入高增。2023年集团整体销售订单78.32亿（不含税），同比增长35.14%，其中随着海外市场的需求快速增长及海外渠道优势的日益凸显，外销业务实现强势增长，2023年公司外销订单19.91亿元，同比增长119.18%（23年海外收入11.77亿元，同比增长79.54%）。数字化整体解决方案方面，截至23年年报披露，公司累计承接数字化工厂整体解决方案业务订单金额已超6亿元；此外，储能市场开拓初见成效，公司23年新承接储能系统订单达到6.41亿元，同比增长144.87%。新能源、工业企业电气配套等下游领域增长明显。公司23年新能源行业销售收入同比增长68.21%，其中新能源-储能销售收入同比增长302.58%，新能源-光伏销售收入同比增长88.95%；非新能源中工业企业电气配套销售收入同比增长40.06%。投资建议：公司立足变压器，出海打开成长空间，同时布局储能、数字化工厂等新业务，具备增长潜力。我们预计公司24-26年营收分别为90.90、123.07、167.10亿元，对应增速分别为36.3%、35.4%、35.8%；归母净利润分别为8.02、11.67、17.25亿元，对应增速分别为58.9%、45.6%、47.8%，以3月21日收盘价作为基准，对应24-26年PE为22X、15X、10X。维持“推荐”评级。风险提示：上游原材料波动风险，行业竞争加剧风险。,,民生证券,推荐,[None],2024-03-21,,增持,5552425,pdf_downloads/2024/2024-03-21/688676-金盘科技（688676）：2023年年报点评：在手订单充足，盈利动能不断积蓄.pdf,688676,金盘科技,金盘科技（688676）：2023年年报点评：在手订单充足，盈利动能不断积蓄
