author,content,filename,org_name,original_rating,pdf_link,publish_time,rating_adjust_mark_type,rating_changes,report_id,save_path,stock_code,stock_name,title
"于特,崔琰","一、事件概述

公司发布2013年7月销量数据：7月汽车销量4.1万辆，同比增长0.8%，环比下滑18.6%；发动机销量1.3万辆，同比增长15.9%，环比下滑15.8%。

二、分析与判断

7月销量同比增长0.8%

公司7月汽车销量4.1万辆，同比增长0.8%，环比下滑18.6%；累计前7月销量同比增长4.2%至38.9万辆。7月销量小幅增长主要由于：1）中重卡销量稳定增长（同比增速28.9%），轻客销量增长53.4%。预估公司销量增长15.8%至72.3万辆（含中重卡）。

中重卡销量增速略超行业增速达28.9%

公司7月中重卡销量0.8万辆，同比增长28.9%，环比下滑36.8%；累计前7月中重卡销量同比增长34.9%至7.2万辆。预估其中欧曼重卡销量约0.7万辆，增速略超行业（7月重卡行业增速25.7%）。重卡库存扰动后销量进入复苏通道，加上基期较低，同时受到国Ⅳ排放标准实施前部分提前购买影响，重卡同比增速尚佳，环比下滑明显。福田戴姆勒市占率有望提升，预估2013年公司中重卡销量为11.5万辆，同比增长20.4%。

轻微卡销量持续下滑中高端轻卡表现尚佳

公司7月轻微卡销量3.1万辆，同比下滑6.8%，环比下滑13.6%；累计前7月轻微卡销量同比下滑2.7%至29.3万辆。我们判断高端轻卡欧马可与中端轻卡奥铃销量增速将超行业，中高端轻卡占比提升，产品结构有所改善。预估2013年公司轻微卡销量为57.2万辆，同比增速15%。

康明斯发动机销量增长确定

公司7月发动机销量1.3万辆，同比增长15.9%，环比下滑15.8%；累计前7月发动机销量10.7万辆，同比增长25.8%。其中康明斯发动机7月销量0.7万辆，同比增长45.1%；奥铃发动机7月销量0.5万辆，同比下滑9.2%。福田康明斯发动机增长确定，2013年销量目标为11万台，增长主要源于出口增长，将成为公司核心竞争力，其2012年利润扭亏并有所增长，2013年贡献还将有所上升。

三、盈利预测与投资建议

长期看好福田与戴姆勒、康明斯合资将提升竞争力，预估2013、2014年EPS为0.46、0.58元，对应PE为12、9倍，PB为1.0、0.9倍，维持“强烈推荐”评级。

四、风险提示

中重卡行业复苏慢于预期；行业竞争加剧；投资低迷影响重卡复苏。",,民生证券,强烈推荐,[None],2013-08-14,,买入,598978,pdf_downloads/2013/2013-08-14/600166-福田汽车(600166)点评：中重卡增速略超行业轻微卡销量小幅下滑.pdf,600166,福田汽车,福田汽车(600166)点评：中重卡增速略超行业轻微卡销量小幅下滑
马春霞,"投资要点

2013年1-6月公司核心产品超越行业增长

公司重卡产品销量增速远超行业。2013年上半年，公司中重卡产品同比增长35.6%，远超行业个位数的增长。销量增速逐月加快。长期看，公司通过与戴姆勒合作实现技术升级、提升产品质量，引入高附加价值产品，提升盈利能力。轻卡业务产品结构持续改善：2013年上半年，公司在轻卡行业龙头地位稳固，产品结构持续改善，中高端产品占比提升。公司轻卡产品进一步扩大了斯里兰卡市场，有助于福田轻卡在海外市场的推广。

新能源客车业务取得突破。公司与北京公共交通控股集团及其下属子公司签订了共计3012辆福田欧辉LNG（液化天然气）公交车产品的销售合同，有助于公司新能源产品在国内外市场的进一步推广。

福田康明斯发动机业务成为新的利润增长点。2013年上半年福田康明斯发动机销量5.2万辆，同比增长37.2%，随着国内、国际排放标准的愈加严格，福田康明斯在国内外技术优势将得到进一步发挥，市场需求和福田本身的自配需求也将进一步释放，预计13年有望达到10万台以上，同比增长36%。

盈利预测及估值

预计公司13-14年EPS为0.42/0.51元，动态市盈率为15/12倍,公司重卡业务持续回暖，轻卡产品结构上移，公司业绩向上弹性大，维持“增持”评级。",,浙商证券,增持,[None],2013-07-26,,增持,566300,pdf_downloads/2013/2013-07-26/600166-福田汽车(600166)年报点评报告：13年上半年核心产品超越行业增长，业绩弹性大.pdf,600166,福田汽车,福田汽车(600166)年报点评报告：13年上半年核心产品超越行业增长，业绩弹性大
"于特,崔琰","一、事件概述

公司发布2013年6月销量数据：6月汽车销量5.1万辆，同比增长9.6%，环比下滑9.7%；发动机销量1.5万辆，同比增长33.3%，环比下滑12.1%。

二、分析与判断

6月销量同比增长9.6%公司6月汽车销量5.1万辆，同比增长9.6%，环比下滑9.7%；累计前6月销量同比增长4.7%至34.7万辆。我们认为6月销量增长主要由于中重卡销量快速增长（同比增速74.3%），轻客销量增增长39.4%。预估公司销量增长15.8%至72.3万辆（含中重卡）。

中重卡销量增速再超行业增速达74.3%公司6月中重卡销量1.2万辆，同比增长74.3%，环比下滑1.4%；累计前6月中重卡销量同比增长35.6%至6.5万辆。预估其中欧曼销量约1.1万辆，增速再超行业（6月重卡行业增速50.8%）。重卡库存扰动后销量进入复苏通道，加上基期较低，重卡呈现“淡季不淡”特征，重卡销量数据持续超预期。福田戴姆勒市占率有望提升，预估2013年公司中重卡销量为11.5万辆，同比增长20.4%。

轻微卡销量同比下滑中高端轻卡表现尚佳公司6月轻微卡销量3.6万辆，同比下滑3.7%，环比下滑18.6%；累计前6月轻微卡销量同比下滑2.1%至26.2万辆。我们判断高端轻卡欧马可与中端轻卡奥铃销量增速将超行业，中高端轻卡占比提升，产品结构有所改善。预估2013年公司轻微卡销量为57.2万辆，同比增速15%。

康明斯发动机销量增速较快公司6月发动机销量1.5万辆，同比增长33.3%，环比下滑12.1%；累计前6月发动机销量9.5万辆，同比增长27.2%。其中康明斯发动机6月销量0.9万辆，同比增长21.4%；奥铃发动机6月销量0.7万辆，同比增长53.5%。福田康明斯发动机增长确定，2013年销量目标为11万台，增长主要源于出口增长，将成为公司核心竞争力，其2012年利润扭亏并有所增长，2013年贡献还将有所上升。

三、盈利预测与投资建议

预估公司2013、2014年EPS至0.46、0.58元，对应PE为11、9倍，PB为1.0、0.9倍，维持“强烈推荐”评级。

四、风险提示

中重卡行业复苏慢于预期；行业竞争加剧；投资低迷影响重卡复苏。",,民生证券,强烈推荐,[None],2013-07-15,,买入,772705,pdf_downloads/2013/2013-07-15/600166-福田汽车(600166)2013年6月销量点评：中重卡销量增速再超行业.pdf,600166,福田汽车,福田汽车(600166)2013年6月销量点评：中重卡销量增速再超行业
"于特,崔琰","一、事件概述

公司发布2013年4月销量数据：4月汽车销量6.7万辆，同比增长14.3%，环比下滑19.7%；发动机销量1.8万辆，同比增长38.5%，超市场预期。

二、分析与判断

4月销量同比增长14.3%

公司4月汽车销量6.7万辆，同比增长14.3%，环比下滑19.7%；累计前4月销量同比增长2.2%至5.9万辆。我们认为4月销量增长主要由于中重卡销量增长明显，轻卡亦小幅增长。与戴姆勒合资公司已步入正轨，戴姆勒2H12已着手提升重卡产品质量，竞争力将逐步提升。预估公司销量增长15.8%至72.3万辆（含中重卡）。

中重卡销量增速超行业持续超预期

公司4月中重卡销量1.3万辆，同比增长50.4%，环比下滑11.2%；累计前4月中重卡销量同比增长19.5%至4.1万辆。预计其中欧曼销量约1.2万辆，增速超行业（4月重卡行业增速30.3%），持续超预期。重卡库存扰动后销量进入复苏通道，加上基期较低，5月重卡销量仍有望较快增长。福田戴姆勒市占率有望提升，预估2013年公司中重卡销量为11.5万辆，同比增长20.4%。

轻微卡销量小幅增长中高端轻卡表现亮眼

公司4月轻微卡销量5.0万辆，同比增长5.7%，环比下滑23.0%；累计前4月轻微卡销量同比下滑2.1%至18.6万辆。我们判断高端轻卡欧马可与中端轻卡奥铃表现亮眼，带动公司轻微卡销量稳定增长。预估2013年公司轻微卡销量为57.2万辆，同比增速15%。

康明斯发动机增长快

公司4月发动机销量1.8万辆，同比增长38.5%，环比增长0.2%；累计前4月发动机销量6.2万辆，同比增长23.2%。其中康明斯4月销量0.9万辆，同比增长29.9%；；奥铃发动机4月销量增长48.9%至0.9万辆，我们判断主要由于公司奥铃轻卡需求旺盛所致。福田康明斯发动机增长确定2013年销量目标为11万台，增长主要源于出口增长，将成为公司核心竞争力，其2012年利润扭亏并有所增长，2013年贡献还将有所上升。

三、盈利预测与投资建议

预估公司2013、2014年EPS至0.59、0.70元，对应PE为12、10倍，PB为1.0、0.9倍，维持“强烈推荐”评级。

四、风险提示

中重卡行业复苏慢于预期；行业竞争加剧。",,民生证券,强烈推荐,[None],2013-05-20,,买入,595808,"pdf_downloads/2013/2013-05-20/600166-福田汽车(600166)2013年4月销量点评：中重卡销量增速超行业,康明斯发动机增长快.pdf",600166,福田汽车,"福田汽车(600166)2013年4月销量点评：中重卡销量增速超行业,康明斯发动机增长快"
杨华超,"重卡业务继续扩张，充分受益于行业需求反弹。我们认为重卡销量将呈现逐步回暖的趋势，预计2013年重卡行业增长8%。春节后受各地需求陆续释放、社会低库存和国四切换的影响，去年没发生的“冬储”有望形成今年的“春储”行情，二季度重卡弹性值得期待。公司重卡销量预计13年同比增长10%，对业绩弹性大，将受益于行业转好。

轻卡业务上，低端产品销量回暖、中高端产品销量占比提升，原材料及零部件价格处于低位，业绩弹性较大。公司在轻卡行业龙头地位稳固，在该领域有绝对竞争优势，受益于城镇化进程加速，产品结构持续改善。预计2013年轻卡同比增长6%。

客车业务将稳步增长，新能源客车业务的突破值得期待。公司在国内最早实现新能源汽车的产业化，欧辉新能源客车是国内最早进入市场运营的新能源客车，是北京公交首选产品。北京是治理PM2.5各城市中的重中之重，若出台相应新能源汽车更新政策，福田将充分受益。预计公司大中客销量13年同比增长5%以上。

我们长期看好公司通过与戴姆勒和康明斯合资带来的竞争力提升，并通过战略转型实现多项业务向国外扩张。预计2013-2014年公司的EPS为0.45元、0.49元，给予2013年18-20倍估值，给予“推荐”的投资评级。

短期催化剂是：（1）重卡、轻卡销量持续向好超预期；（2）新能源客车订单增量；（3）公司高附加价值产品需求释放。

主要风险因素：（1）宏观经济持续低迷；（2）原材料价格上涨。",,银河证券,推荐,[None],2013-05-17,上调评级,增持,769451,pdf_downloads/2013/2013-05-17/600166-福田汽车(600166)：需求回暖可期，规模推动业绩增长.pdf,600166,福田汽车,福田汽车(600166)：需求回暖可期，规模推动业绩增长
"胡文洲,王玉笙","最新情况:
    根据公司披露数据,1-4月,福田汽车(600166.CH/人民币6.82,持有)中重卡销量达到40,769台,同比增长19.5%;其中4月当月实现中重卡销售13,332台,同比增长50.4%。根据中国汽车工业协会产销快讯数据,前4个月,欧曼重卡同比增速达到9.3%,而同期重卡行业下滑5.8%,公司是前五大厂商中唯一实现正增长的企业,市场份额由去年同期的12.6%提升至14.7%。另一方面,前4个月公司中卡销售近4,000台,是去年同期的8.7倍,中卡已逐步成为公司业务中较重要的组成部分。我们认为,较强的产品竞争力以及优秀的渠道营销能力是公司持续超越行业表现的重要因素,我们预计全年中重卡销量有望达到11万台,同比增长17%。
    我们认为,在销量增长的带动下,2013年福田戴姆勒合资公司有望扭亏为盈。
    轻卡业务:
    1-4月,公司轻(微)卡销售18.6万台,同比下滑2.1%。同期,轻(微)卡市场实现小幅增长,公司市场份额略有下降。前4个月,公司中高端轻卡仍继续保持快速增长态势,预计2013年中高端轻卡销量有望达到10-11万台。公司轻卡产品结构继续优化,盈利能力有望进一步加强。
    发动机业务:受益于中高端轻卡销量的快速增加,前4个月公司奥铃和康明斯发动机销量分别达到3万台、3.2万台,同比分别增长14.9%、32.1%。我们认为,在公司内部和海外市场均稳步提升的带动下,福田康明斯全年销量有望达到10万台以上,盈利有望实现大幅增长。
    乘用车业务:未来公司有望进一步加大对乘用车业务的重视程度和投入力度。
    维持公司持有评级:我们认为,福田汽车主营业务盈利最低迷的时期已经过去,未来公司有望受益于重卡市场的持续回暖以及在中高端轻卡(及轻型柴油机)市场的拓展,经常性盈利有望持续改善。同时未来几年中,公司每年资产增值确认为营业外收入规模将达3-5亿元不等,这将增厚公司业绩。考虑到公司主营业务层面盈利改善,我们维持公司2013-14年每股收益预测0.38元、0.43元,维持公司目标价6.84元,维持公司持有评级。",,中银国际,中性,[None],2013-05-17,,中性,769486,pdf_downloads/2013/2013-05-17/600166-福田汽车(600166)：最新情况.pdf,600166,福田汽车,福田汽车(600166)：最新情况
马春霞,"2013年一季度经营状况明显改善2013年一季度，公司实现营收入84亿元，同比降37.9%；实现净利润1.90亿元，同比降86.8%，环比大幅扭亏。EPS0.07元，略高于预期。毛利率13%，同比和环比分别增1.9和2.1个百分点，公司经营状况有所好转。公司盈利公司营收下滑公司欧曼业务剥离合并范围发生变化所致。

2013年一季度公司核心产品超越行业增长

2013年第一季度，公司销售汽车17.3万辆，市场占用率有所提升，在商用车行业中排名第一。其中：核心产品中重卡实现销量27437辆，同比增长8.7%，行业同比下滑11.8%，竞争能力有所提升，市场占有率达到11.3%，较去年同期上升2.1%。

公司产品结构不断优化，中高端车型比例不断提升。

和低端轻卡比，中高端车型具有故障率低、出勤率和省油率高、低污染以及乘坐舒适等优势，随着个体收入逐步提高，城市排放法规趋严和城镇物流的高速发展，未来中高端轻卡或许会对低端市场形成一定的替代作用，我们看好公司在中高端轻卡奥铃、欧马可等的前景。

盈利预测及估值

预计公司2013-2014年EPS为0.52/0.67元，动态市盈率分别为14/11倍,在2013年下国内基建投资回升、公司重卡业务有望回暖，公司轻卡产品结构上移，盈利能力有提升空间，维持“增持”评级。",,浙商证券,增持,[None],2013-04-27,,增持,767107,pdf_downloads/2013/2013-04-27/600166-福田汽车(600166)2013年一季报点评报告：一季度经营情况明显改善.pdf,600166,福田汽车,福田汽车(600166)2013年一季报点评报告：一季度经营情况明显改善
"胡文洲,王玉笙","1季度整车销量（扣除中重卡）环比提升11.8%，而销售收入仅环比提升8.1%，主要是由于单价较高的大中客产品销量环比下滑39.5%。

1季度毛利率达到13%，同比、环比分别提升1.7、2.1个百分点。公司毛利率提升主要是由于毛利率较高的中高端轻卡收入及技术许可费收入占比提升。

1季度公司期间费用规模同比基本持平，但较此前3个季度出现显著下降，公司期间费用率快速攀升势头得到遏制。我们认为，1季度公司管理费用提升较快，主要是由于管理人员工资薪酬费用提升所致。1季度公司债务净偿付约16亿元，有息负债占比大幅降低，公司财务费用大幅降低。

1季度非经常性损益对公司净利润的影响额达到1.14亿元，其中约0.85亿元为政府补助形成。我们认为未来3个季度，公司资产增值有望确认约5亿元营业外收入。

评级面临的主要风险

中国宏观经济增速进一步放缓，商用车市场持续低迷。

公司期间费用无法得到有效控制。

估值

我们小幅上调公司2013-14年每股收益预测至0.38元、0.43元，维持公司持有评级，公司目标价由6.68元上调至6.84元，目标价相当于18倍2013年预期市盈率。",,中银国际,持有,[None],2013-04-27,,中性,767137,pdf_downloads/2013/2013-04-27/600166-福田汽车(600166)：经常性盈利有望持续改善.pdf,600166,福田汽车,福田汽车(600166)：经常性盈利有望持续改善
吴文钊,"投资逻辑

重卡市场份额持续提升，可显著受益行业复苏：公司2012年重卡销量达8.74万辆，市场份额达13.7%。今年一季度，公司重卡销量增速继续超越行业整体水平，市场份额进一步提升至16.3%。与戴姆勒合资后，公司产品性能有望提升，竞争力有望进一步加强。欧曼重卡资产转让给合资公司后将通过投资收益贡献业绩，评估增值、转让收益等非经常性损益也颇为可观，这一块预计2012年为20-22亿元，2013-2014年约为7-9亿元。

轻卡龙头地位依旧稳固，中高端销量占比提升：福田是轻卡领域无可争议的龙头，2012年销量38.6万辆，市场份额为21%，是第二名与第三名的份额之和。公司2012年中高端轻卡销量约13万辆，同比逆势增长9.2%，占公司轻卡销量比例已达31.8%，结构改善将带来公司盈利能力的提高。

福田康明斯2012年已扭亏为盈，前景值得期待：福田康明斯产品为康明斯ISF2.8L和3.8L柴油机，项目总规划产能40万台，2012年销量已近7万台，同比逆势增长30%，净利润达6,829万元，成功实现扭亏为盈。当前ISF70%产品出口海外，随着轻型柴油车国IV标准实施在即，康明斯产品在国内的性价比优势也将更为明显，届时不仅康明斯自身盈利可显著提升，福田轻卡的竞争优势也将由此得以继续提升。

盈利预测

预测公司2013-2015年归属母公司股东净利润分别为11.75、13.15与14.1亿元，同比增速为下滑13.2%、增长11.96%与7.18%，对应EPS分别为0.42、0.47与0.50元。

估值与投资建议

公司当前股价对应2013年PE为15倍，PB则为1.23倍。现阶段重卡需求已开始复苏，二季度更有望快速增长，福田由于自身竞争力较强，增速有望继续超越行业整体水平，业绩向上弹性更为显著。我们认为现阶段重卡类公司的PE估值水平参考意义不强，而行业需求的发展趋势更为重要。我们上调公司投资评级至“增持”，建议适当增加配置。",,国金证券,增持,[None],2013-04-15,,增持,582898,pdf_downloads/2013/2013-04-15/600166-福田汽车(600166)：重卡份额持续提升，可充分受益行业复苏.pdf,600166,福田汽车,福田汽车(600166)：重卡份额持续提升，可充分受益行业复苏
"于特,崔琰","一、事件概述

公司发布2013年3月销量数据：3月汽车销量8.3万辆，同比增长5.7%，环比增长104.5%；发动机销量1.8万辆，同比增长17.8%，超市场预期。

二、分析与判断

3月销量同比增长5.7%环比大增104.5%

公司3月汽车销量8.3万辆，同比增长5.7%，环比增长104.5%；累计1Q13销量同比下滑1.9%至17.3万辆。我们认为3月销量增长主要由于中重卡销量增长明显，轻卡亦小幅增长。与戴姆勒合资公司已步入正轨，戴姆勒2H12已着手提升重卡产品质量，竞争力将逐步提升。预估公司销量增长15.8%至72.3万辆（含中重卡）。

中重卡销量超预期重卡需求出现旺季效应

公司3月中重卡销量1.5万辆，同比增长25.8%，环比增长156.9%；累计前3月中重卡销量同比增长8.7%至2.7万辆。我们认为3月中重卡销量超预期，重卡需求出现旺季效应。考虑到3-4月基建投资发力，房地产以及物流市场有望回暖，库存扰动后销量进入复苏通道，4月重卡销量有望超市场预期。福田戴姆勒市占率有望提升，预估2013年公司中重卡销量为11.5万辆，同比增长20.4%。

轻微卡销量小幅增长

公司3月轻微卡销量6.4万辆，同比增长1.6%，环比增长94.3%；累计前3月轻微卡销量同比下滑4.7%至13.6万辆。轻卡主要是自买自用，复苏早于重卡行业，4Q12轻卡销量增速已经达到10%，春节前后复苏有衰弱现象。预估2013年公司轻微卡销量为57.2万辆，同比增速15%。

发动机增速快康明斯发动机增长确定

公司3月发动机销量1.8万辆，同比增长21.3%；累计前3月发动机销量4.4万辆，同比增长17.8%。其中康明斯3月销量0.9万辆，同比增长52.4%；累计前3月康明斯销量2.3万辆，同比增长33.0%。福田康明斯发动机增长确定2013年销量目标为11万台，增长主要源于出口增长，将成为公司核心竞争力，其2012年利润扭亏并有所增长，2013年贡献还将有所上升。

三、盈利预测与投资建议

预估公司2013、2014年EPS至0.59、0.70元，对应PE为11、9倍，PB为1.0、0.9倍，维持“强烈推荐”评级。

四、风险提示

中重卡行业复苏慢于预期；行业竞争加剧。",,民生证券,强烈推荐,[None],2013-04-15,,买入,582814,"pdf_downloads/2013/2013-04-15/600166-福田汽车(600166)3月销量点评：中重卡销量超预期,4月有望持续增长.pdf",600166,福田汽车,"福田汽车(600166)3月销量点评：中重卡销量超预期,4月有望持续增长"
"杨华超,戴卡娜","投资要点：2012年年报1、事件

公司披露了2012年年报，2012年实现收入409.7亿元，同比下降20.66%，包含福田戴姆勒合资公司后，销售收入为483.62亿元。净利润13.5亿元，同比增长17.43%；EPS0.48元。

2、我们的判断与分析

（1）公司中重卡业务扩张，盈利能力提升

2012年中重卡市场整体下滑27.8%，公司销量9.6万辆，同比下滑12.6%，表现好于市场平均水平。中重卡市场份额提升，由8.11%上升至9.32%。预计13年中重卡有望实现10%增长，市场地位继续维持第四位。中重卡业务产品改善明显，使得竞争力和盈利能力增强，12年中重卡毛利率由6.45%增至6.75%。

（2）公司中高端轻卡占比提升，与城镇化进程加快契合

公司轻卡龙头地位继续保持，12年共销量49万辆，收入同比增长16.98%，市场份额达21.8%，同比基本持平。12年轻卡产品结构上移，低端产品销量下滑，中高端产品占比大幅提升。轻卡毛利率由10%提升至11.21%，随着城镇化进程加快，预计13年轻卡同比增长6%左右，毛利率将维持增长趋势。

（3）康明斯发动机占比逐步提升，利润增长可期

2012年全年发动机销量15万辆，实现收入2.7亿元，同比增长85%。其中康明斯发动机销量达7.5万辆，同比增长47.4%。随着公司产品逐步高端化，福田装配福田康明斯发动机占比将明显增长，有利于提升公司的盈利能力。预计13年有望达到10万辆，利润增长可期。

（4）毛利率稳步提升,营业和管理费用有所增加

公司综合毛利率10.74%，同比增加1.65个百分点，主要原因是公司产品结构上移，中高端产品占比提高。销售费同比增长46.85%，主要原因是售后费用增长。管理费用同比增长39.31%，原因是人力成本提升和投入研发支出大幅增加。公司12年净利率3.3%，同比增加1.1个百分点。

3、投资建议

预计公司13/14/15年EPS分别为0.48/0.51/0.59元，对应目前股价PE分别为13.6/12.27/10.71倍。公司商用车龙头地位不断巩固，重卡、轻卡盈利能力稳步提升，业绩增长可期。给予“谨慎推荐”评级。

4、风险提示

宏观经济持续低迷，汽车销量低于预期风险。",,银河证券,谨慎推荐,[None],2013-04-03,,增持,581794,pdf_downloads/2013/2013-04-03/600166-福田汽车(600166)：待下游需求回暖，盈利将向好.pdf,600166,福田汽车,福田汽车(600166)：待下游需求回暖，盈利将向好
