author,content,filename,org_name,original_rating,pdf_link,publish_time,rating_adjust_mark_type,rating_changes,report_id,save_path,stock_code,stock_name,title
"肖群稀,章诚","2017年盈利增85%符合预期,2018年增长有望持续
    公司发布2017年年报,全年实现收入21.77亿元/yoy +102%,归母净利润5.37亿元/yoy +85%,业绩符合预期。2017年公司的锂电设备收入大幅增长,泰坦新动力并表且超额完成业绩承诺。公司预告2018年一季度盈利1.63~1.91亿元/yoy +80%~110%。2018年补贴政策落地,我们预计电芯扩产将好转。公司是锂电设备行业龙头,订单充足推动业绩增长,预计2018-2020年EPS分别为2.54、3.68、4.86元,2018年合理PE估值为30~35倍,上调目标价至76.2~88.9元,维持“买入”评级。
    2017年锂电设备收入大幅增长,泰坦新动力超额完成业绩承诺
    公司2017年业绩实现大幅增长,主要得益于两个方面:1)2017年锂电设备市场的快速增长,公司锂电设备业务收入达到18.23亿元/yoy +149%,毛利率为39.45%,同比保持稳定;2)珠海泰坦新动力完成并表,且超额完成业绩承诺,实际扣非净利润1.21亿元,高出承诺数15.7%,增厚公司整体业绩。
    预收和存货加速上升,充足订单推动业绩增长
    截至2017年末,公司预收款为16.74亿元,相比2016年末增加约9亿元,根据设备行业销售模式判断,公司在手订单依然充足。同期存货为25.59亿元,其中有19亿元为发出商品,等待客户验收,若能在2018年确认收入,将大幅推动业绩增长。我们认为,公司与CATL等国内大客户深度绑定,客户需求明确,公司订单充足,未来有望突破松下、LG等外资电池大厂,2018年业绩增速有望保持在较高的水平。
    2018年补贴政策落地,促进行业由质向量提升
    新能源汽车2018年新版补贴政策落地,进一步推动动力电池向高能量密度、低能耗发展,我们认为,动力电池行业将由量向质提升。2017Q4以来电芯龙头企业启动扩产招标,我们预计设备需求有望好转。伴随2018-2019年新能源补贴退坡,成本压力预计将向上传导,扩产设备投资将更加注重降本增效。
    锂电设备行业龙头地位巩固,上调盈利预测
    公司为锂电设备行业龙头,客户优质订单充足,未来有望跟随客户共成长,行业地位更加巩固。上调盈利预测,我们预计2018-2020年收入46.17、65.37、83.95亿元,归母净利润11.17(前值10.08)、16.21(前值14.18)、21.39亿元,EPS分别为2.54(前值2.29)、3.68(前值3.22)、4.86元,PE分别为27.8、19.2、14.5倍。锂电设备行业2018年PE估值水平预计为27倍左右,我们认为公司龙头地位显著,有望享受一定的估值溢价,2018年合理PE估值在30~35倍,上调2018年目标价至76.2~88.9元,维持“买入”评级。
    风险提示:下游锂电池扩产不及预期。",,华泰证券,买入,[None],2018-03-09,,买入,2133235,"pdf_downloads/2018/2018-03-09/300450-先导智能(300450)：在手订单充足,18年有望持续增长.pdf",300450,先导智能,"先导智能(300450)：在手订单充足,18年有望持续增长"
"贺泽安,季国峰","2017年业绩符合预期,盈利能力略有下滑
    公司发布2017年年度报告,全年营收21.77亿元, 同比+101.8%;归母净利润5.37亿,同比+84.9%。同时,公司发布2018年一季度业绩预告,预计2018Q1实现归母净利润1.63-1.90亿,同比增长80%-110%。根据年报,2017年锂电池设备收入18.2亿元,同比+149%,营收占比83.7%,是公司的核心业务,并保持高速增长;光伏设备2.3亿元,同比-20%;电容器设备4241万元,同比+49%。公司盈利能力略有下滑,销售毛利率为41.1%,同比-1.4pct,下滑原因为原材料和制造费用增速超过收入增速,销售净利率为24.7%,同比-2.3pct,下滑原因为销售费用和资产减值损失增长较多。
    内生+外延并举,打造锂电自动化整线供应商
    报告期内公司完成泰坦新动力的并购, 从中段设备切入后段设备,公司产品覆盖整线价值量的比例从约30%提升至约60%,打开了公司的成长空间。泰坦新动力从8月并表,对公司净利润贡献约3300万元,全年实现净利润1.22亿元,超额完成业绩承诺(2017年承诺不低于1.05亿元)。此外,公司持续加大研发力度,2017年研发投入1.23亿(占收入5.7%),同比+134.5%。目前公司正在研发涂布机等前段核心设备,进一步拓展公司的生产线,打造全品类覆盖的锂电设备供应商。
    在手订单充足,股权激励方案彰显管理层信心
    2017年末公司预收账款为16.7亿元,据此推测公司目前在手订单约50亿元,有效保障公司2018年收入的高增长。2月6日,公司发布限制性股票激励计划草案,拟向核心管理及技术骨干218人授予限制性股票200.25万股,解锁条件为以 2017年净利润为基数,2018-2021年净利润分别不低于 50%、100%、150%、200%,即未来4年的复合增速为31.6%。我们认为,该方案彰显了公司对未来中长期经营发展的信心。
    盈利预测与投资评级
    预计公司2018-2020年实现归母净利润分别为9.15/12.59/15.85亿元,对应的EPS 为2.08/2.86/3.60元,当前股价对应的PE 分别为32.9/23.9/19X,给予“增持”评级。",,国信证券,增持,[None],2018-03-09,,增持,2133269,"pdf_downloads/2018/2018-03-09/300450-先导智能(300450)2017年年报点评：年报业绩符合预期,2018年有望持续高增长.pdf",300450,先导智能,"先导智能(300450)2017年年报点评：年报业绩符合预期,2018年有望持续高增长"
黄秀瑜,"事件:公司于2018年3月7日晚发布2017年年报、2018年一季度业绩预告及2017 年度利润分配预案。公司预计2018年一季度实现净利润同比增长80%~110%, 年报中给出2018年8~11亿元利润的业绩指引,且公司拟每10股派发2.3元(含税)现金股利,以资本公积金向全体股东每10股转增10股。
    点评:
    2017年归母净利润(扣非)同比+79.45%,符合预期;公司2017年实现营收21.77亿元(泰坦贡献2.66亿元),同比+101.75%(扣除泰坦后+77.12%), 归母净利润5.37亿元(泰坦贡献0.41亿元),同比+70.85%(扣除泰坦后+70.85%),非经常性损益0.24亿元,扣非后同比+79.45%。1)从产品结构上来看,锂电设备业务维系高增长;锂电池设备业务、光伏设备、电容器设备及其他分别占比83.72%、10.65%、5.63%,分别同比+149.29%(扣泰坦后同比约+113%)、-19.52%、+103.33%,锂电设备业务维持高增长。2)盈利能力方面,基本维系稳定;公司综合毛利率为41.14%,同比下滑1.42个百分点;其中锂电池设备业务毛利率维稳,为39.45%,同比微微下滑0.10%,光伏设备毛利率为45.87%,同比下滑2.89%。3)现金流方面, 经营性现金流净额保持正数;公司经营活动现金流净额同比下降70.59%, 主要系本期收款以承兑汇票方式结算的较多,以及有大量发出的设备未验收导致存货大量增加所致。4)期间费用控制良好,销售费用率有所增长, 研发持续高投入;公司销售费用率为3.86%,较同期增加1.02%;财务费用率为-0.27%,较同期增加0.06%;管理费用率为11.54%,较同期减少1.65%;研发投入1.23亿元,占营收比例为5.65%,较同期提升0.79%;研发人员数量达662人,占比为18.76%,较同期提升5.20%。2017年公司新增EV动力锂电池卷绕装备研发及产业化、高速双面串联挤压式涂布装备研发及产业化等多个研发项目。
    分季度来看,营收、归母净利润同环比都维系高增长;Q4确认收入为11.29 亿元,同(环)比+132.25%(+165.65%),实现归母净利润2.59亿元,同(环)比+88.12%(+159%),主要原因是公司2017年7月31日合并泰坦新动力及公司锂电池设备业务维系高增长。预收款环比有所下降,发出商品19亿元,占存货74.25%;公司Q4账面预收款项为16.74亿元,环比下滑1.78%;Q4存货占总资产38.48%,其中发出商品19亿元,占存货74.25%。参考行业一般“3331”或“361”结算方式,预计在手订单约50亿元。
    公司预计Q1归母净利润同比增长80%~110%,给出全年8~11亿元的业绩指引;公司发布一季度业绩预告,预计实现归母净利润1.63~1.9亿元,同比增长80%~110%,其中非经常性损益预计90万元。此外,公司在年报中给出2018年全年30~40亿元营业收入,8~11亿元净利润的业绩指引。
    投资建议:公司技术领先,在手订单充足,全年业绩高增长无忧,预计2018年、2019年分别实现EPS为2.24、3.00元(不考虑增发等稀释),对应PE为31.48倍、23.55倍,考虑到目前估值情况,下调评级至“谨慎推荐”。
    风险提示:新能源汽车产销不及预期;动力电池扩厂不及预期;订单确认收入不及预期;商誉减值风险;2018年5月首发解禁总股本的54.31%。",,东莞证券,谨慎推荐,[None],2018-03-09,,增持,2133216,"pdf_downloads/2018/2018-03-09/300450-先导智能(300450)年报点评：预收款项环比略有下滑,在手订单充足.pdf",300450,先导智能,"先导智能(300450)年报点评：预收款项环比略有下滑,在手订单充足"
沈赟,"锂电设备业务继续推动公司业绩快速增长:先导智能2017年度业绩延续高增长的主要原因为锂电池设备业务的持续快速增长和收购珠海泰坦新动力的并表。公司锂电池设备业务的持续快速增长得益于下游锂电池生产企业(尤其是国内、国际高端锂电池生产企业)投资速度加快和规模持续扩大,公司近4年业绩的持续高增长同步于国内新能源汽车产业和动力锂电池行业的快速增长。收购的珠海泰坦新动力于2017年8月份开始并表,2017年其对公司的净利润影响为4091.75万元,目前泰坦新动力作为公司的全资子公司,其是一家专业研发、制造能量回收型化成、分容、分选、自动化仓储物流、锂电池电芯及模组测试设备的专业厂家,技术优势在于采用“能量回馈”技术的锂电池化成分容充放电电源模块。公司的锂电池前端、中端生产设备制造业务和泰坦新动力的锂电池后端生产设备制造业务形成同产业链的业务协同,同时有利于为公司开拓新客户和提高原有客户业务占比提供客户基础。泰坦新动力原股东承诺的2017至2019年净利润分别为1.05亿、1.25亿和1.45亿元,2017年度其实际业绩为1.22亿元,大于承诺业绩。财报中值得注意的是,2017年经营活动产生的现金流量净额较2016年同比下降70.59%至3093.84万元,主要是2017年第四季度出现了3.23亿元的经营活动现金净流出,主要原因是客户收款以承兑汇票方式结算的较多,且有大量发出的设备在客户现场未验收导致存货大量增加。2018年第一季度的业绩延续高增长,主要原因依旧是受益于国家对新能源产业的支持,锂电池行业继续快速持续发展,锂电池设备业务也实现了持续快速的增长;在稳定原有客户的基础上,积极开拓新客户,锂电池相关设备的生产销售业绩同比有显著提升;合并报表范围新增全资子公司珠海泰坦新动力电子有限公司净利润。
    新的锂电设备基地已建成并部分投产,同时加快开发成套锂电池设备:位于公司总部附近新洲路18号的生产基地(动力锂电池设备生产基地建设项目一期)已建成并部分投产,其建设进度符合预期,该基地释放的锂电设备产能将在今年形成销售收入。该基地投资约3亿元,全部投产后预计能增加15至20亿元的产能。同时,公司开发的卷绕机、极片分切机、焊接卷绕一体机、软包叠片机、组装机、四合一成型机、化成柜系统、分容柜系统等多种锂电池设备已日趋成熟,未来公司会继续开发电极涂布机、多功能组合机等其他锂电池设备,壮大锂电池设备制造业务,提高锂电池设备市场占有率。
    公司研发投入全部费用化,收入确认原则减少了我们对其存货增长的担忧:2017年度公司通过科技局备案了包含EV动力锂电池卷绕装备研发及产业化、高速双面串联挤压式涂布装备研发及产业化等4个研发项目,公司累计获得了各种专利260项,其中发明专利42项、实用新型专利203项,外观设计专利15项。2017年末公司研发人员达到662人,较2016年末的252人增长1.63倍,占公司总人数的18.76%。2017年度公司的研发整体投入12,308.93万元,占本年度收入的5.65%,资本化研发支出占研发投入为0,历年研发投入全部费用化的财务处理值得肯定。目前公司的研发实力有利于公司技术的持续创新和提升公司核心竞争力。公司成套设备销售的收入确认原则是获得经过买方确认的验收证明后确认收入,从发货到确认收入大约需要1年左右的时间。2017年末公司有25.59亿元的存货,占总资产比例为38.48%,主要是订单业务增加使得在产品和发出商品增加导致存货增加以及泰坦新动力纳入合并范围。不过存货中发出商品有19.00亿元,占期末存货金额的74.25%,系已交付给买方但尚未验收的产品,这样的收入确认原则和发出商品占多数的存货结构减少了我们对公司存货规模及其增长的担忧。
    盈利预测与投资建议:我们预计先导智能2018年和2019年的EPS分别为2.03元和2.83元,对应3月8日收盘价的PE为33.70倍和24.17倍。鉴于对公司业绩继续快速增长的预期,以及静态68.41倍的市盈率和静态10.82倍的市净率估值,我们维持先导智能的“增持”评级。
    风险因素:Pre-IPO股东减持股份造成的短期股价波动风险;国家新能源汽车支持政策逐步退坡的风险。",,万联证券,增持,[None],2018-03-09,,增持,2133276,"pdf_downloads/2018/2018-03-09/300450-先导智能(300450)年报点评：内生外延稳步发展,业绩高增长延续.pdf",300450,先导智能,"先导智能(300450)年报点评：内生外延稳步发展,业绩高增长延续"
"任天辉,樊艳阳","事件：公司公布 2017 年年度报告，2017 年公司实现营业收入 21.77 亿元，
同比增长 101.75%；实现归母净利润 5.37 亿元，同比增长 84.93%。公司
公布 2018 年一季度业绩预告，预计 2018 年 1-3 月公司实现归母净利润
1.63-1.90 亿元，同比增长 80-110%。收入符合预期，应收账款计提减值摊薄利润。公司 2017 年 10-12 月营业
收入为 11.29 亿元，全年收入为 21.77 亿元（同比+101.75%）。分产品，
公司锂电设备销售收入为 18.23 亿元（同比+149.29%），毛利率为 39.45%
（同比-0.10ppt）；光伏设备销售收入为 2.32 亿元（同比-19.52%），毛利
率为 45.87%（同比-2.89ppt）。锂电设备占收入比例为 67.76%，为公司主
要利润来源，报告期内公司并购了泰坦新动力进一步驱动了锂电设备的增
长。公司销售毛利率略微下滑至 41.14%（同比-1.42ppt），应收账款为 8.97
亿，比三季报增加 5.51 亿，主要由于下游电池企业现金流压力造成了公
司回款低于预期，同时应收账款的积压使得公司产生了坏账减值损失 4034
万元，摊薄了公司利润，使得净利率下滑至 24.69%（同比-2.35ppt）。在手订单充盈确保业绩高增长，股权激励彰显经营信心。公司 2017 年末
预收款项为 16.74 亿元，存货为 25.59 亿元，基本于三季报持平。根据公
司订单的排产和收入确认方式，我们估算公司截至 2017 年底在手订单约
为 45-50 亿元，根据公司长期的利润水平，我们预计公司在手订单有望锁
定未来一年半左右约 11.3-12.5 亿元业绩，公司一季度业绩预计增长
80-110%，表明了公司仍处于高速增长通道。2018 年 2 月 6 日，公司发布
限制性股票激励计划草案，方案中首次授予的限制性股票解锁的业绩考核
标准为以 2017 年业绩为技术，2018-2021 年净利润增速不低于
50%/100%/150%/200%，即未来 4 年的复合增速超过 31.6%。我们认为该方
案彰显了公司对未来中长期经营发展的信心。电池库存消解，补贴新政落地，产业高端化利好设备龙头。2017 年 11 月、
12 月和 2018 年 1 月国内新能源汽车销量分别为 11.9 万、17.2 万和 3.8
万，分别同比增长 83.1%、54.9%和 430.0%。销量高增长使得电池企业库
存消解，带来扩产动力。2018 年 2 月 14 日，新的新能源汽车补贴政策落
地，其中过渡期截止 2018 年 6 月 11 日比预期延长，使得整车产销量增长
有望延续，同时补贴标准大幅度抬高了对动力电池密度的要求，将促使产
业高端化升级。我们认为目前国内高端产能仍有大量需求，公司作为锂电
设备龙头将充分受益于高端化趋势，同时公司涂布机等新产品投入销售以
及松下、LG 等海外客户拓展将进一步扩大公司营业体量。盈利预测与投资评级：我们预计公司 2018-2020 年实现营业收入分别为
43.33 亿元、61.69 亿元和 85.25 亿元，实现归母净利润分别为 10.58 亿
元、14.43 亿元和 19.34 亿元， EPS 分别为 2.40 元、3.28 元和 4.39 元，
对应 PE 分别为 29.3X、21.5X 和 16.1X。维持“强烈推荐”评级。风险提示：新能源汽车销量低于预期，锂电池企业扩产不达预期。",,东兴证券,强烈推荐,[None],2018-03-08,,买入,3568249,pdf_downloads/2018/2018-03-08/300450-先导智能（300450）2017年年度报告点评：业绩符合预期，公司将持续受益于锂电产业高端化.pdf,300450,先导智能,先导智能（300450）2017年年度报告点评：业绩符合预期，公司将持续受益于锂电产业高端化
"陈显帆,周尔双","2017年业绩符合预期,预收+存货锁定订单+收入高增长
    1)分业务分析:锂电池设备收入18.2亿,同比+149%,占营收84%;光伏设备2.3亿,同比-20%,占营收11%;电容器设备4241万,同比+49%,占营收2%。可见先导作为具备全球竞争力的锂电设备龙头,受益于全球电动化大浪潮,锂电设备收入大幅增长且占营业收入的比例在大幅提高。
    2)预收同比+117%。2017年末预收账款为16.7亿,同比+117%,说明2017年公司业务发展迅速,在手订单大增,预收款随之增长。按照预收款约占新接订单30%的比例推算,预计公司目前在手订单约为56亿元。
    3)存货同比+149%。期末存货金额为25.6亿,同比+149%。存货分为发出商品和在产品,其中发出商品金额为19亿,占存货总额的74.3%。公司预计2018年Q1实现归母净利润1.6亿-1.9亿,按照25%的平均净利率水平推算,预计Q1的收入将达到6.5-7.6亿,即到一季度末还有11.4-12.5亿在2017年发出的商品未确认收入。根据先导“以销定产,验收确收”的商业模式和3-6个月的设备验证周期,我们认为Q2收入预计达到12亿。
    4)现金流良好,经营性现金流净额持续为正。2017年整个锂电池厂商的现金流都有一定的压力,先导智能在整个产业链的公司中,现金流已经属于非常好的,但相比过去年份,净额部分有所减少(相比2016年减少7400万元)。此外,受到CATL上市影响,先导作为其招股书中披露的最大供应商,现金流有一定影响,但是我们认为在CATL上市融资后整个上下游产业链的现金流都有一定改善。我们预计随着补贴的下放和行业的回暖,现金流净额将会持续上升。
    5)2018年业绩指引区间(8-11亿元)。根据Q1归母净利润的中位数1.75亿,我们预计先导本部为1.3亿,泰坦为0.45亿;再按本部往年Q1占全年净利润的平均比例10%推算,2018年全年本部净利润有望达13亿。而公司在年报中公布的2018年收入目标为30亿-40亿,利润总额目标为8亿-11亿;若目标达成,按区间中位数估算,收入将同比+61%,利润总额将同比+53%。根据信息披露的谨慎性原则和以往情况(公司实际净利润总是靠上限),我们认为公司的目标略偏保守,但业绩有望高增长!
    盈利能力继续维持高位,毛利率略下滑主要源于生产性折旧摊销
    综合毛利率41.1%,同比-1.4pct;净利润率24.69%,整体继续维持高位。分业务看,锂电设备毛利率39.5%,同比-0.1pct;光伏设备毛利率45.9%,同比-2.9pct。从营业成本的具体明细来看,以收入的增长率(101.8%)为基准,原材料和制造费用的增速均超过收入的增速,其中制造费用增速高达165.3%,可见公司毛利率小幅下降主要源于制造费用的增加。我们认为,主要由于部分新厂房的投入导致生产相关的折旧和摊销增加。
    期间费用控制良好,销售力度加大,松下订单有望落地
    2017年公司期间费率控制良好,合计15.1%,同比-0.6pct。其中,销售费率为3.9%,同比+1pct;管理费率为11.5%,同比-1.7pct;财务费率为-0.3%,同比+0.1pct。我们认为,销售费率的增长是由于公司加大销售力度,全年新增客户高达75家。此外,我们认为公司在美国设立全资子公司,正是为了更好地给松下-特斯拉超级工厂提供设备,这意味着先导和松下的合作经过小批量试供应后将正式落地,根据特斯拉超级工厂的扩产计划,到2020年电池产能将达150GWh,对应的卷绕机设备需求超300亿!
    研发投入大增,产品线拓展降低周期波动
    2017年研发整体投入1.2亿(占收入5.7%),同比+134.5%。研发人员年末达到662人,占总人数18.8%,该比例同比2016年上升5.2pct。此外,2017年公司新增4个研发项目,包括EV动力锂电池卷绕装备、高速双面串联挤压式涂布装备等,这将进一步拓展公司的产品线,降低由行业周期性波动所带来的风险。
    盈利预测与投资建议:预计2018-2020年净利润复合增长率约为65%以上,在手订单继续锁定2018年业绩高增长。预计2018/2019/2020年的净利润是11.30/17.33/24.25亿,EPS2.56/3.94/5.51元,PE为28/18/13X。考虑到公司自身的高成长性和泰坦业绩有望超预期,维持“买入”评级。
    风险提示:新能源车销量低于预期,收购泰坦协同效应不及预期。",,东吴证券,买入,[None],2018-03-08,,买入,2132447,"pdf_downloads/2018/2018-03-08/300450-先导智能(300450)：年报业绩符合预期,Q1业绩预增80%~100%超预期.pdf",300450,先导智能,"先导智能(300450)：年报业绩符合预期,Q1业绩预增80%~100%超预期"
