author,content,filename,org_name,original_rating,pdf_link,publish_time,rating_adjust_mark_type,rating_changes,report_id,save_path,stock_code,stock_name,title
"黄细里,孟璐",公告要点：公司发布2023年Q3季度业绩，2023Q3公司营业总收入为28.81亿元，同环比分别为-22.68%/-20.56%；实现归母净利润2.50亿元，同环比分别为-5.45%/-26.73%；实现扣非归母净利润为2.47亿元，同环比分别-31.41%/-23.71%。Q3业绩表现略低于预期，Q4有望得到改善。1）营收方面：四轮业务方面环比下滑，主要原因为美国市场承压，影响公司Q3车型零售及新款车型批发节奏；行业竞争较为激烈背景下公司两轮业务内销表现良好。2）盈利方面：公司Q3毛利率为33.67%，同环比分别+7.28/+2.33pct，主要原因为两轮中大排销量占比提升；四轮非美地区毛利率水平相对平稳。3）费用率方面：费用率方面，期间费用率为22.85%，同环比分别+9.8/+5.2pct。其中销售费用率/管理费用率/研发费用率分别为11.27%/5.02%/8.49%，同比分别+2.82/+1.49/+1.57pct，环比分别+0.30/+0.87/+2.80pct。4）最终公司实现归母净利润2.50亿元，同环比分别为-5.45%/-26.73%。展望Q4：两轮外销/四轮美国外销量增可期，公司整体营收/盈利能力有望得到改善。盈利预测与投资评级：摩托车业务依托出色的产品力+品牌力成功把握国内消费升级新趋势，借全地形车经验及渠道，出海重启；研发+产品+渠道三轮驱动全地形车全球市占率逐年攀升。四季度海外批售节奏预计将好于三季度，因此我们维持公司业绩预期，预计公司2023-2025年营业总收入135/170/213亿元，归属母公司净利润10/13/20亿元，同比+41%/+35%/+52%，对应PE为18/13/9倍。鉴于公司摩托车业务布局完善+品牌力强劲，全地形车业务研发+渠道优势赋能产品，我们维持“买入”评级。风险提示：全球贸易环境不稳定风险；新车型上量不及预期风险；运价/汇率等波动风险等。,,东吴证券,买入,[None],2023-10-22,,买入,5352975,pdf_downloads/2023/2023-10-22/603129-春风动力（603129）2023年三季度业绩点评：Q3业绩承压，静待Q4批售改善.pdf,603129,春风动力,春风动力（603129）2023年三季度业绩点评：Q3业绩承压，静待Q4批售改善
秦一超,事项：公司发布23年三季报，实现营业收入93.9亿元，同比+8.8%；实现归母净利8亿元，同比+40.6%；其中，23Q3实现营业收入28.8亿元，同比-22.7%；实现归母净利2.5亿元，同比-5.5%。评论：23Q3收入端短暂承压，主要系四轮出口业务下滑。23Q3公司实现营业收入28.8亿元，同比-22.7%，环比-20.7%，单Q3规模端下滑承压，我们判断主要系四轮全地形车出口业务下滑影响。23Q3分产品类型来看：1）我们预计，四轮全地形车北美出口业务短暂承压，Q3处于公司北美四轮新老产品切换节点，公司主动管理老品库存及新品提货进度、短期影响四轮产品北美出货：伴随24年新款产品在Q4陆续上市，以及U/Z系列中高端产品占比提升，Q4有望重回增长趋势。2）两轮摩托车国内需求仍然疲软，据摩托车商会，23年前三季度250cc以上休娱摩托销量40.9万辆，同比下降10.6%；报告期内公司在国内相继推出450SR、450CL-C等爆款新品，我们预计公司两轮业务国内表现优于行业；公司海外两轮业务产品谱系逐渐补全，未来有望伴随渠道扩张继续贡献增长势能。23Q3毛利率同比改善，销售费用率维持高位。23Q3公司实现归母净利2.5亿元，同比-5.5%，实现毛利率33.6%，同比+7.3pct，主要系产品结构优化、原材料及海运价格下降。23Q3销售、管理、研发、财务费用率同比分别+2.8、+1.5、+1.6、+3.9pct，销售费用率增加主要系公司加大国内两轮及北美四轮等新品推广力度，同时公司加大研发投入、研发三缸等新品，研发费用率同比增加；财务费用率主要系汇兑收益影响，期间费用率合计+9.8pct。综合影响下，23Q3公司实现归母净利率8.7%、同比+1.6pct，我们预计后续季度盈利能力将持续改善。四轮全地形车出口龙头低位稳固，牵手雅马哈成立株洲春风雅马哈有限公司。公司四轮全地形车出口基本盘稳健，份额优势下、未来将逐渐拓展中高端新品、驱动盈利能力提升。报告期内公司与日本雅马哈成立株洲春风雅马哈有限公司，未来有望拓展踏板摩托产品，构建全新增长曲线。公司作为动力运动装备行业龙头，其竞争优势与壁垒正在兑现。投资建议：公司为动力运动装备行业龙头，自主研发及自建渠道能力构建优质自主品牌α，三大增量驱动公司持续成长。但海外需求短期不确定性较大，我们调整公司23-25年归母净利润预测分别为10.5/13.6/16.5亿元（前值13/16/21亿元），增速为50.3%/29.1%/20.9%，对应PE为17/13/11倍。公司现金流稳定，采用DCF法估值，调整目标价为150元，对应23年21.4倍PE。公司长期增长动力充足，维持“推荐”评级。风险提示：国内消费型摩托市场竞争加剧，海外全地形车市场需求下滑，海运费大幅波动，美国关税政策趋严。,,华创证券,推荐,[None],2023-10-21,,增持,5352806,pdf_downloads/2023/2023-10-21/603129-春风动力（603129）：Q3收入短暂承压，盈利能力同比提升.pdf,603129,春风动力,春风动力（603129）：Q3收入短暂承压，盈利能力同比提升
"佘炜超,邢重阳,孟欣",事件：公司发布2023年前三季度报，2023Q1-Q3营业总收入达93.86亿元，同期+8.77%；归母净利润8.02亿元，同比+40.58%；扣非归母净利润7.68亿元，同比+10.41%。单季度看，2023Q3营业总收入实现28.81亿元，同比-22.68%；归母净利润2.5亿元，同比-5.45%；扣非归母净利润2.47亿元，同比-31.41%。盈利能力保持高位。2023Q3公司销售毛利率达33.67%，环比+2.33pct，主要系两轮车中大排量占比提升，以及销售以美元计价所致；实现销售净利率9.10%，环比-0.82pct。产品矩阵丰富、高研发投入及智能化布局，助力竞争力稳步提升。公司XO狒狒、800NK晋升今年爆款，北京摩展发布新品450NK、首款复古巡航新品450CLC，改款车型休闲摩旅车1250TR-G（2023款）、450SR S等相继上市销售，助力中大排销量持续增长；2023H1公司研发投入 3.77 亿元，占营业收入 5.80%，同比+27.70%，新增 19 项发明专利，有效授权专利达1211项；公司深化智能化布局，提供包括整车OTA、手机钥匙、MotoPlay/CarPlay、智能防盗、地图导航、在线娱乐、智能语音、盲区检测、碰撞预警等功能。投资建议：预计公司2023-2025年实现营业收入128.90/163.01/194.73亿元，归母净利润10.78 /13.53/16.77亿元，对应PE为18.2/14.5/11.7倍，维持“增持”评级。风险提示：汇率、原材料价格波动及人力成本上涨风险，禁限摩政策收紧导致国内摩托车需求下滑，外资品牌导致市场竞争加剧，海外需求不及预期等。,,财通证券,增持,[None],2023-10-19,,增持,5350811,pdf_downloads/2023/2023-10-19/603129-春风动力（603129）：23Q3业绩承压，期待四季度景气度提振.pdf,603129,春风动力,春风动力（603129）：23Q3业绩承压，期待四季度景气度提振
宋亭亭,23Q3归母净利润同比下滑5.5%春风动力发布23年三季报，23Q3实现营收28.81亿元，环比下滑20.56%，同比下滑22.68%；归母净利润2.50亿元，同比-5.45%，环比-26.73%。考虑到美国市场消费需求阶段性走弱，我们将23/24年公司营收下调至126/171亿元（前值140/178亿元），归母净利润分别下调至10.1/14.1亿元（前值11.0/14.4亿元），25年维持20.2亿元归母净利润预测。可比公司24年Wind一致预期PE均值为17.6x，我们基于17.6x 2024E PE，给予目标价165.09元（前值175.92元），维持“买入”评级。Q3北美市场需求暂受挫，Q4收入环比或重拾增长公司Q3营收环比下滑20.6%，我们认为主要系：1）摩托车Q3出口销量受海外订单周期影响表现有所回落，据摩托车商会数据，Q3公司150cc以上摩托车销量累计约3.4万辆，环比下降约11%；2）北美地区受通胀加息等因素影响，消费意愿走弱，对公司当地全地形车销售形成一定压制。我们预期随着四季度24款车型上新，24年SSV、UTV等品类全地形车，及摩托新车型陆续发布上市，公司海外业务有望重拾增长。摩托产品结构改善，驱动盈利能力同比上行23Q3公司毛利率为33.67%，同比+7.28pct，环比+2.33pct。我们认为Q3毛利率环比增长主要系：1）摩托车产品结构改善，450cc、800cc等高排量段产品市场反响热烈，销售占比提升带动品类利润率向上；2）23Q3出口业务仍获正向汇兑收益。期间费用方面，公司继续强化品牌库存管理，23Q3销售费率维持较高位，环比+0.3pct，同比+2.82pct至11.27%；管理费率5.02%，环比+0.87pct，同比+1.49pct；公司积极开发新品，逐步扩充产品序列，研发费率较高，Q3环比+2.8pct，同比+1.57pct至8.49%。Q3公司净利率实现9.10%，同比增长1.66pct，环比下滑0.81pct。产品谱系扩张步履不停，打造多元增长动力公司全地形车业务支柱地位牢固，22年全球市占率达约18%，比肩庞巴迪、北极星等国际一线品牌。公司正着力加强UTV、SSV品类布局，切入北美四轮核心市场，进一步提升份额的同时，有望持续优化产品结构，高附加值车型推动价利双升；摩托业务产品力亮眼，坚定扩张产品矩阵，9月春风日再推国产首款三缸跑车675SR、四缸仿赛500SR以及全新150SC踏板车型。新品加持叠加海外渠道建设推进，公司的摩托业务有望持续展现可观成长性。风险提示：新品销量不及预期，汇率与海运费波动的风险。,,华泰证券,买入,[None],2023-10-18,,买入,5350584,pdf_downloads/2023/2023-10-18/603129-春风动力（603129）：Q3出口暂承压，产品结构持续优化.pdf,603129,春风动力,春风动力（603129）：Q3出口暂承压，产品结构持续优化
"谢丽媛,贺虹萍,宋雨桐",公司发布2023年三季报，2023年前三季度实现收入93.86亿元，同比+8.77%，归母净利润8.02亿元，同比增长40.58%，扣非后归母净利润7.68亿元，同比增长10.41%。对应2023Q3实现收入28.81亿元，同比-22.68%，归母净利润2.50亿元，同比-5.45%，扣非后归母净利润2.47亿元，同比-31.41%。燃油两轮车：450CLC等新款热度较高，预计内销表现平稳，受订单节奏影响，预计外销有所放缓。根据摩托车商会，7-8月行业250以上大排量摩托销量约10万辆，同比-27%，Q3行业需求有所放缓，今年以来公司陆续发布XO狒狒、800NK、450NK、首款复古巡航车450CLC等新品，三季度450NK、450CLC正式上市，热度较高，预计两轮内销有望延续平稳表现。受订单节奏影响，海外两轮增速或有放缓，未来渠道拓展+新品发力，两轮出口有望实现改善。全地形车：海外去库存影响新款切换，预计Q3全地形车同比下滑。上半年公司在海外市场持续去库存，导致销售费用率提升，上半年销售费用率同比+6.4pct，根据公司半年报测算，上半年美国市场促销费占收入比重同比+3.4pct，Q3公司销售费用率为11.27%，同比+2.81pct，环比+0.29pct，Q3销售费用率保持高位，预计系海外市场仍在去库存，影响公司新款产品切换，随着海外旧款产品库存消化结束、新款产品切换发货，全地形车业务有望恢复稳健增长。结构优化+降本增效+美元汇率升值+海运费回落，盈利能力持续改善。公司持续进行产品结构优化、降本增效，叠加美元汇率升值、海运费大幅回落，毛利率持续改善，Q3公司毛利率为33.67%，同比+7.28pct，环比+2.33pct，预计毛利率同比改善主要系：1）产品结构调优、高附加值U/Z系列占比提升；2）海外建厂节约关税、海运费；3）海运费同比大幅下降；4）美元汇率升值。费用端来看，Q3公司销售/管理/研发/财务费用率同比分别+2.8pct/+1.5pct/+1.6pct/+3.9pct，合计+9.8pct，销售费用率提升预计主要系海外促销费用增加，财务费用率提升预计主要系汇兑收益同比减少。综合来看，Q3公司销售净利率为9.10%，同比+1.65pct，Q3扣非净利率为8.59%，同比-1.09pct。投资建议：预计2023-2025年公司归母净利润为10.54、13.96、16.70亿元，同比分别+50.2%、+32.5%、+19.7%，对应EPS分别为7.00、9.28、11.10元，基于2023年10月17日收盘价131.2元，对应2023-2025年PE分别为19x、14x、12x，维持“买入”评级。风险提示：宏观经济波动、贸易政策发生不利变化、汇率波动、市场竞争加剧,,德邦证券,买入,[None],2023-10-18,,买入,5350444,pdf_downloads/2023/2023-10-18/603129-春风动力（603129）：海外去库存影响Q3新品切换，静待库存拐点.pdf,603129,春风动力,春风动力（603129）：海外去库存影响Q3新品切换，静待库存拐点
"邱世梁,王华君,何家恺",2023年前三季度业绩同比增长41%，Q3归母净利润同比小幅下滑5%根据公司2023年三季报，2023年前三季度公司实现营收93.9亿元，同比增长8.7%；实现归母净利润8亿元，同比增长40.6%；实现扣非归母净利润7.7亿元，同比增长10.4%；拆分来看：2023年Q3公司实现营收28.8亿元，同比下降23%，环比下降21%；2023年Q3实现归母净利润2.5亿元，同比下降5.5%，环比下降27%。我们预计主要原因为美国利率持续走高背景下，北美四轮车行业终端消费有所承压，公司四轮车新旧款切换等因素导致收入有所下滑。预计2023前三季度公司业绩增长主要原因为：1）公司市占率提升，规模效益凸显；2）产品结构优化，高附加值产品销售占比提升；3）强化生产效率和成本管理，费用端持续改善；4）人民币贬值叠加海运费持续下降，成本端改善明显，利润空间进一步释放。Q3单季度毛利率 / 净利率同比提升7.3/1.7pcts，盈利能力有所提升盈利能力：公司2023年前三季度毛利率32.9%，同比+9.3pcts，净利率8.9%，同比+2pcts；公司2023Q3毛利率33.7%，同比+7.3pcts，环比+2.3pcts；净利率9.1%，同比+1.7pcts。2023年公司盈利能力持续修复，我们判断主要为公司产品结构升级及国际海运费持续下降所致，影响公司盈利端的压制因素持续改善。成本端：2022年受原材料价格及海运费逐渐回落影响，盈利拐点已至。公司2022年主营业务成本为82.2亿元，同比增长37%，增幅小于收入增长。其中原材料成本64亿元，占总成本的 79.7%。国内运费为1.3亿元，国际运费6.9亿元，美国进口关税为3.2亿元，三者合计11.4亿元，占2022年总成本的比重的14%。四轮车产品升级+两轮车国际化、高端化，国内外市占率持续提升四轮车：2023年上半年公司全地形车累计实现销量7.9万辆，实现销售收入35.9亿元，同比增长22.4%，全地形车出口额占同类产品比例73.1%。上半年高附加值U/Z系列产品持续提升带来产品结构优化，盈利能力不断提升，欧洲市占率持续保持第一，美国市场新增渠道31家，累计585家，网点持续铺开带来强劲增长力，业绩领跑行业。两轮车：①燃油两轮车：上半年累计销售9.9万辆，实现销售收入22.9亿元，同比增长58.9%，海外新增渠道275家，累计经销商网络1445家，通过渠道扩张、新品上市共同发力，出口延续了较快增长，两轮外销5.1万台，营业收入实现12.4亿元，同比增长132.4%。②电动摩托车：渠道+产品全面布局构建第三成长曲线。渠道方面，上半年新增门店15家，累计渠道总量202家；大力布局全球网络，截止报告期末，已在欧洲、南美、东南亚等20余个国家出货。产品方面，“ZEEHO”发布第二款电摩产品 AE6，造型轻巧、灵活、年轻化，凭借时尚的外观设计及行业领先的性能配置，获得市场广泛关注和好评盈利预测及估值：未来三年净利润CAGR为26%，维持“买入”评级预计2023-2025年归母净利润为10.4、12.1、14.0亿元，同比增长48%、16%、16%，PE为19、16、14倍。2022~2025年归母净利润CAGR为26%。基于公司四轮车和两轮车市占率逐步提升、对消费者深度理解并且擅长打造爆款车型的基因，维持买入评级。风险提示：海外开拓不达预期；国内竞争加剧；原材料、海运费、汇率波动风险,,浙商证券,买入,[None],2023-10-18,,买入,5349963,pdf_downloads/2023/2023-10-18/603129-春风动力（603129）点评报告：三季报业绩同比增长41%，产品升级带动盈利能力提升.pdf,603129,春风动力,春风动力（603129）点评报告：三季报业绩同比增长41%，产品升级带动盈利能力提升
"秦一超,张程航",从耐用消费代表的电动两轮车，到可选消费的电动滑板车，本篇为我们短交通篇章可选消费又一拓展。春风动力作为动力运动装备行业龙头，其竞争优势与壁垒正在兑现，投资价值增量边际加强：动力运动装备行业：小而美的可选消费赛道。1）全地形车：结构性升级趋势凸显。22年全球销量93万辆、自05年达峰135万辆后恢复性增长，但中高端UTV占比持续提升，22年达61%、较07年+39%。2）消费型摩托：国内渗透初期，高成长性。22年&gt;250cc销量55.3万辆、18-22年CAGR达51.2%，但占油摩整体仅4%；与日本每万人销量峰值11.9辆相比，中国22年仅3.9，仍有3倍空间。3）需求：量增速与GDP增速趋势一致、韧性更强，凸显冒险、玩乐、个性。公司壁垒：全价值链自主能力。1）自主研发，掌握大排水冷核心技术。坚持自研，获工信部等多项国家荣誉，CF650G入选国宾护卫队，参与制定全地形车行业标准。2）坚持打造自主品牌。全地形车：初建出海国牌份额优势（22年全球销量份额18%、欧洲市场第一、国内出口份额74%）。消费型摩托：顶级赛事扩大品牌影响。16年曼岛TT赛春风650NK获第四、23年Moto3获意大利及荷兰站排位赛第二，均创国牌厂商最好成绩。3）海外自建线下渠道。产品力及品牌力形成对渠道强话语权，主导渠道利润分配、下游资金挤占，掌握对线下消费者的触达能力。增量一：全地形车拓展北美，结构优化提升盈利。产品推新以增加细分群体覆盖，补齐与北极星竞争劣势（23年官网价格低33%、UTV SKU少62%），差距构建成长空间。结构优化趋势下，22年公司出厂ASP 4.1万、较18年95%，驱动毛利率提升至44.1%（还原关税运费后）、较18年+9.7pct。增量二：消费型摩托国内赛道高成长性，爆品策略拓展份额。国内赛道高增预期下，公司作为龙二（21年份额12%）有望优先受益。20年推新的250SR成国潮现象级爆款，至23M5累计销售15万辆，单品贡献约30亿收入；23年再造爆款XO狒狒，重新定义消费型摩托≠中大排量，小排MINI向下覆盖入门级玩家，持续拓展市场份额。增量三：复用全地形车海外渠道，消费型摩托出海扩张。北美全地形车渠道构建摩托车扩张基础，22年时隔10年重新进入北美、在300家以上全地形车渠道销售；23H1摩托车海外收入12.4亿元、占比54%，持续拓展出海新增量。投资建议：公司为动力运动装备行业龙头，自主研发及自建渠道能力构建优质自主品牌α，三大增量驱动公司持续成长。我们给予公司23-25年归母净利润预测分别为13/16/21亿元，增速为79%/31%/29%，对应PE为17/13/10倍。公司现金流稳定，采用DCF法估值，给予目标价180元，对应23年14倍PE。公司长期增长动力充足，首次覆盖给予“推荐”评级。风险提示：国内消费型摩托市场竞争加剧，海外全地形车市场需求下滑，海运费大幅波动，美国关税政策趋严。,,华创证券,推荐,[None],2023-09-05,,增持,5316797,pdf_downloads/2023/2023-09-05/603129-春风动力（603129）：春风得意，国牌出海启航.pdf,603129,春风动力,春风动力（603129）：春风得意，国牌出海启航
"谢丽媛,贺虹萍,邓颖,宋雨桐",公司发布2023年半年报，半年度业绩基本处于预告中值。2023上半年公司实现营收65.06亿元，同比+32.67%，实现归母净利润5.52亿元，同比+80.41%，实现扣非归母净利润5.20亿元，同比+55.47%；单季度来看，Q2营收36.26亿元，同比+37.27%，实现归母净利润3.41亿元，同比+70.33%，实现扣非归母净利润3.24亿元，同比+30.21%。燃油两轮车：出海持续放量，内销稳健增长，两轮出口占比超过内销。上半年公司燃油两轮车实现收入22.88亿元，同比+58.87%，销量9.87万辆，同比+52%，均价为2.32万元，同比+4%。分地区来看，内销实现收入10.46亿元，同比+14%，内销量为4.79万辆，内销均价为2.18万元，外销实现收入12.42亿元，同比+132%，外销量为5.08万辆，外销均价为2.44万元，外销表现亮眼主要系渠道扩张+新品上市，上半年燃油两轮车出口收入占比约54%，超过内销占比，实现内外销双轮驱动。产品端，今年以来公司陆续发布XO狒狒、800NK、450NK、首款复古巡航车450CLC等新品，其中XO狒狒、800NK晋升今年爆款，三季度450NK、450CLC正式上市，有望延续此前250SR、450SR爆款热度。渠道端，国内采取渠道下沉策略，报告期末国内经销商门店数量超650家，线下提升门店形象、运营及服务能力，线上协同公司营销措施，完善多平台线上渠道体系，从而发挥引流、获客作用；公司大力拓展海外两轮渠道，海外新增渠道275家，累计经销商网络1445家，未来渠道拓展+新品继续发力，两轮出口有望延续高增。全地形车：上半年稳健增长，产品结构持续调优，增速领跑行业。上半年公司全地形车实现收入35.88亿元，同比+22.37%，销量为7.93万辆，同比持平，均价为4.52万元，同比+22%，均价上涨主要系产品结构调优、高附加值U/Z系列占比提升。分地区来看，美国市场凭借拓展渠道、完善产品矩阵，增速领跑行业，欧洲市场稳居龙头。下半年在新品+渠道驱动下，公司四轮车业务预计延续产品结构调优，收入端有望保持稳健增长。电摩：渠道、产品加速布局，全力构建第三条曲线。电摩品牌“ZEEHO”发布第二款电摩产品AE6及新产品系列C!TY，获得市场广泛关注和好评；强化市场拓展，国内聚焦于核心城市，上半年新增门店15家，累计渠道总量202家；同时以高性能电摩大力布局海外市场，截至报告期末，公司电摩已在欧洲、南美、东南亚等20余个国家出货，有望构建第三成长曲线。结构优化+降本增效+汇率贬值+海运费回落，盈利能力持续改善。公司持续进行产品结构优化、降本增效，叠加美元汇率升值、海运费大幅回落，毛利率持续改善，上半年公司毛利率为32.58%，同比+11.08pct，预计毛利率同比改善主要系：1）产品结构调优、高附加值U/Z系列占比提升；2）海外建厂节约关税、海运费；3）海运费同比大幅下降；4）人民币汇率贬值。费用端来看，上半年公司销售/管理/研发/财务费用率同比分别+6.4pct/+0.4pct/-0.2pct/+1.9pct，合计+8.4pct，销售费用率提升主要系促销费用增加，据我们测算，美国市场促销费占收入比重同比+3.4pct，经销商+消费者贴息费用占收入比重同比+1.66pct，广告费占收入比重同比+0.86pct，财务费用率提升主要系汇兑收益同比减少。,,德邦证券,买入,[None],2023-08-18,,买入,5290175,pdf_downloads/2023/2023-08-18/603129-春风动力（603129）：Q2延续亮眼表现，看好下半年新品催化.pdf,603129,春风动力,春风动力（603129）：Q2延续亮眼表现，看好下半年新品催化
