author,content,filename,org_name,original_rating,pdf_link,publish_time,rating_adjust_mark_type,rating_changes,report_id,save_path,stock_code,stock_name,title
邵宽,"事件：公司于7月27日发布公告，公司持股 71.67%的控股子公司宁波南大光电拟通过增资扩股方式引入战略投资者国家集成电路产业投资基金二期。大基金二期拟以合计人民币18,330万元的价格认购宁波南大光电的新增注册资本6,733.19万元。增资完成后公司的持股比例由71.67%降至58.53%。投资要点：引入战略投资利于产业协同，加速公司光刻胶业务发展子公司宁波南大光电是公司ArF光刻胶产品开发与产业化项目的实施主体单位。公司ArF光刻胶已于去年12月与今年5月31日公告通过50nm闪存平台认证和55nm逻辑电路平台认证，成为国内通过产品验证的第一只国产ArF光刻胶。公司目前已完成两条光刻胶生产线的建设，光刻胶年产能将达25吨（干式5吨和浸没式20吨）。此次引入战略投资者大基金二期，不仅可以扩充资金实力，也有利于增强公司与国内半导体设备、芯片制造头部企业的协同，从而加速公司光刻胶业务的发展。日本光刻胶停产断供，国产替代需求迫在眉睫供给端由于日本福岛7.3级地震导致光刻胶龙头信越化学停止供货部分晶圆厂光刻胶，在产线受到影响和晶圆厂扩产等多方因素下，光刻胶供给出现紧缺局面。需求方面国内中芯国际、华虹宏力、广州粤芯等多家国内晶圆厂也在积极扩产，国内光刻胶需求量远大于国产产量且差额连年增长，尤其在ArF、高端KrF等半导体光刻胶方面， 光刻胶作为“卡脖子”产品国产替代需求迫切。盈利预测维持公司21-23年净利预测1.42、1.59、1.75亿元，维持“增持”评级。风险提示公司研发与量产进度不及预期，下游客户需求不达预期。",,国联民生证券,增持,[None],2021-07-28,,增持,4573669,pdf_downloads/2021/2021-07-28/300346-南大光电（300346）：子公司获大基金二期增资，助力光刻胶业务加速发展.pdf,300346,南大光电,南大光电（300346）：子公司获大基金二期增资，助力光刻胶业务加速发展
周策,南大光电(300346)多维度布局半导体材料，三大板块协同效应日益凸显。 公司深耕半导体材料， 不断扩宽业务范围， 改变原有的单一 MO 源业务结构，将MO 源和 ALD、 CVD 前驱体业务整合成先进前驱体业务， 并与电子特气、 光刻胶及配套材料业务形成公司业务三大板块。 MO 源、电子特气、 ALD/CVD 前驱体和光刻胶及配套材料都属于高纯电子材料，在下游应用、 安全管理、生产工艺、分析测试和客户群体等方面均有一定的相似性，三大板块业务的协同效应日益凸显，多轮驱动也将助力公司飞速发展。ArF 光刻胶两次通过客户认证， 国产化大背景下公司成长空间巨大。ArF 光刻胶材料是集成电路制造领域的重要关键材料，被广泛应用于90nm-14nm 甚至 7nm 的高端芯片制造。目前全球的 ArF 光刻胶产品中，日本厂商占据了 93%的市场份额， 且由于 ArF 光刻胶自身技术壁垒高和保存时间短的特性，容易成为“卡脖子”的材料，国产化替代刻不容缓。公司成功自主研发出国内首支通过客户认证的 ArF 光刻胶产品， 实现了国内 ArF 光刻胶从零到一的重大突破，公司目前已经建成 25 吨生产线（ 5 吨干式和 20 吨湿式），在光刻胶国产化的大趋势下，光刻胶业务将带动公司业绩迈入新的成长空间。收购飞源气体进军含氟气体， 电子特气种类不断丰富，业绩增长确定性强。 公司电子特气板块主要包括氢类电子特气产品和含氟电子特气产品，其中氢类电子特气产品主要包括磷烷、砷烷等，含氟气体主要包括三氟化氮和六氟化硫。 磷烷、砷烷作为电子特气中技术壁垒最高的两种，公司成功实现突破并且纯度能够达到 6N 级别，达到世界先进水平，不仅在 LED 行业市场份额持续增长，在集成电路行业也快速实现了产品进口替代，得到了广大客户的高度认可，目前占据国内市场份额达 75%以上。 同时，公司在 2019 年收购飞源气体 57.97%股权，成功进军含氟气体领域，公司电子特气种类不断丰富，业绩增长确定性强。盈利预测： 我们预计，公司 2021-2023 年实现归母净利润 1.29、 1.30和 1.53 亿元， EPS 为 0.32、 0.32 和 0.38 元，考虑到光刻胶及电子特气行业国产化带动下的巨大成长性叠加公司是国产 ArF 光刻胶和磷烷、砷烷的龙头公司，我们给予公司 2024 年 MO 源业务 20 倍 PE，给予电子特气业务 60 倍 PE，给予光刻胶业务 15 倍 PS，公司 2024 年合理市值为 211.26 亿元， 按 10%折现率计算， 2021 年给予 158.73 亿目标市值，预计下半年光刻胶国产化将加速，行业估值有望进一步上行， 给与公司 2021 年 112-127 倍 PE， 对应目标股价 39.11-44.35 元， 首次覆盖给予“推荐”评级。风险提示： 市场竞争加剧， 项目投产不及预期，光刻胶研发、认证不及预期，原材料波动等。,,财信证券,推荐,[None],2021-07-01,,买入,4546786,pdf_downloads/2021/2021-07-01/300346-南大光电（300346）：ArF光刻胶两次通过客户认证，半导体材料多维布局形成.pdf,300346,南大光电,南大光电（300346）：ArF光刻胶两次通过客户认证，半导体材料多维布局形成
邵宽,南大光电(300346)事件：公司于5月31日晚间发布公告，控股子公司宁波南大光电自主研发的ArF光刻胶继2020年12月在一家存储芯片制造企业的50nm闪存平台上通过认证后，近日又在逻辑芯片制造企业55nm技术节点的产品上取得了认证突破，表明公司光刻胶产品已具备55nm平台后段金属布线层的工艺要求。投资要点：ArF光刻胶再获认证，关键半导体材料实现突破半导体光刻胶目前国内自给率极低，供给端基本被日美企业垄断，行业前五市占率达87%。其中g线/i线光刻胶自给率约为20%，KrF光刻胶自给率不足5%，而ArF光刻胶完全依赖进口，对我国芯片制造形成“卡脖子”风险。公司继去年12月通过50nm闪存平台认证通过后，近日又再次获得55nm逻辑电路平台认证，成为国内通过产品验证的第一只国产ArF光刻胶，打破了国内先进光刻胶受制于人的局面。公司目前已完成两条光刻胶生产线的建设，预计未来光刻胶年产能达25吨（干式5吨和浸没式20吨）。日本光刻胶停产断供，国产替代需求迫在眉睫供给端近日日本福岛7.3级地震导致光刻胶龙头信越化学停止供货部分晶圆厂光刻胶，在产线受到影响和晶圆厂扩产等多方因素下，信越化学已向中国大陆多家一线晶圆厂限制供货光刻胶，且已通知更小规模晶圆厂停止供货光刻胶。需求方面国内中芯国际、华虹宏力、广州粤芯等多家国内晶圆厂也在积极扩产，国内光刻胶需求量远大于国产产量且差额连年增长，尤其在ArF、高端KrF等半导体光刻胶方面，国产替代需求迫切。盈利预测维持公司21-23年净利预测1.42、1.59、1.75亿元，维持“增持”评级。风险提示公司研发与量产进度不及预期，下游客户需求不达预期。,,国联民生证券,增持,[None],2021-06-01,,增持,4522735,pdf_downloads/2021/2021-06-01/300346-南大光电（300346）：ArF光刻胶再获客户认证，国产替代助力公司持续成长.pdf,300346,南大光电,南大光电（300346）：ArF光刻胶再获客户认证，国产替代助力公司持续成长
马群星,投资要点：公司ArF光刻胶验证通过，国产替代缺口下静待公司量产突破。高端ArF光刻胶目前还未有国内公司量产，国内ArF光刻胶市场需求达2.5亿美元，亟需国产替代。公司于客户50nm闪存技术平台验证通过，证明代表性工艺节点突破，成功实现从零到一的突破。公司量产计划于2019年底在宁波建成光刻胶生产线，并于2021年底实现年产25吨（干式5吨/浸没式20吨）产能规模，性能满足90nm-14nm IC制造要求。公司收购飞源气体后与公司现有磷烷、砷烷电子特气整合优化，成为业务新增长点。公司收购完成国内前三含氟电子特气供应商飞源气体，布局含氟特气市场。目前NF3市场需求处于紧平衡，飞源NF3气体相比国外SK、KDK等厂商具有原料和运输成本优势。同时，磷烷与砷烷属于高纯特气中技术门槛和开发难度最高的两种，公司经多年攻关后已开始量产6N级以上高纯气体，占据国内75%市场份额，并进入世界一流公司供应名单。公司三大业务板块协同效应明显，整合后公司边际效应有望改善。公司原有MO源业务与ALD前驱体整合为先进前驱体材料板块，与电子特气、光刻胶形成公司三大板块。三板块同时需求高纯度、低杂质、稳定的质量管控以及相近的客户群体，公司整合后有望取长补短，补齐各业务板块不足，改善边际效应，追赶国际领先同行。盈利预测预计公司2020-2022年公司2020-2022年营业收入分别为5.11亿元、6.69亿元、7.40亿元，归母净利润1.10亿元、1.42亿元、1.59亿元，对应EPS为0.27元、0.35元、0.39元，对应P/E为133倍，103倍、92倍。考虑公司现有ArF光刻胶业务稳步发展且已通过客户验证，市场前景广阔，乐观看待公司后续量产情况。首次覆盖给予推荐评级。风险提示：公司研发/量产进度不及预期，下游客户需求不达预期。,,国联民生证券,推荐,[None],2020-12-18,,增持,4406057,pdf_downloads/2020/2020-12-18/300346-南大光电（300346）：ArF光刻胶认证通过，国产材料持续推进.pdf,300346,南大光电,南大光电（300346）：ArF光刻胶认证通过，国产材料持续推进
"杨钟,王凌涛","事件：2020年12月17日，南大光电发布公告称，子公司宁波南大光电自主研发的ArF光刻胶产品近日成功通过客户的使用认证，成为国内通过产品验证的第一款国产ArF光刻胶，为全面完成02专项目标奠定了坚实的基础。制程的关键，光刻胶性能决定了工艺所能达到的高度。根据全球半导体行业协会SEMI最新数据，2020年全球半导体材料市场将达到529.4亿美元，且2021年将增长至563.6亿美元，同比增长6%。而在众多半导体材料体系中，制备难度和技术重要性首屈一指的，非光刻胶莫属。作为IC光刻工艺中，光刻胶扮演着电路图案载体的重要角色，其品质好坏直接决定着光刻制程的成败，此外，光刻胶分辨率所能达到的极限指标，便是光刻工艺的极限领域。在工艺节点随摩尔定律演化至今的过程中，光刻胶发展分别经历了G/I线光刻胶（非化学放大）、KrF光刻胶（化学放大）、ArF光刻胶（化学放大）、ArFi光刻胶（化学放大）、EUV光刻胶等品类。本次南大光电验证通过的光刻胶属于仅次于EUV光刻胶的ArF光刻胶，线制程工艺可以满足45nm-90nm光刻需求，孔制程工艺可满足65nm-90nm光刻需求。南大光电是国内首家通过关键客户产品验证的ArF光刻胶生产厂商，虽然离全面替代尚需时日，但这是一个非常好的开始，再次验证了南大管理层与技术团队的领先技术水平，以及扎实审慎的工作推进能力。光刻胶作为核心战略性材料，工艺制程壁垒极高。与高端核心光刻机一样，我国IC产业界在高端光刻胶领域同样面临着受制于人的“卡脖子”困境。究其原因有如下几点：首先是技术壁垒，虽然光刻胶的本质是“照相底片”原理，但其所承载的电路图案几何尺寸仅有纳米级别，其图案“分辨率”、“边缘粗糙度”、“化学放大敏感度”有着近乎严苛的要求；其次是仓储物流，不同于其他半导体材料可以批量采购囤货以备不测，光刻胶必须保存于低温避光场所，对环境温度、湿度及光照度极为敏感，且保质期短，难以长期存储；再次是地缘政治，目前全球光刻胶主流供应商皆源于日本美国，中美贸易科技争端已然不必多言，而2019年日本对韩禁运光刻胶令韩系面板及存储、芯片制程受到非常严重的影响。在当今复杂多变的国际形势下，高端光刻胶的突破不仅具备重要的经济价值，更为重要的是其对产业链安全的战略价值。需要看到，南大光电所推进的光刻胶自主自制，关键原材料同样受到
日美竞争对手的遏制，用于前道制程的酚醛树脂以及很多中间体材料
必须自主研制开发，决定光刻性能的诸多关键数据也只能靠自身不断
摸索与积累，这是近乎于从无到有的挑战。能够通过下游客户的使用
与认证，不仅仅是公司在光刻胶这一单一产品上的成功，更是从上游
原材到中间制程的全面进化。光刻胶与前驱体、特气、MO 源协同共进，半导体材料多点开花。作为
一家从 MO 源起家的电子级材料供应商，南大光电的半导体材料版图除
光刻胶以外，亦有 MO 源、ALD 前驱体、磷烷、砷烷、含氟特气等多种
IC 核心材料，且诸多产品均已打入中芯国际、长江存储、台积电等国
内外一线晶圆厂，此外在 LED、面板及光伏领域亦有诸多建树。此番
ArF 光刻胶产品认证通过，进一步完善了公司在半导体前端材料领域
的全体系业务拼图，对于下游晶圆厂业务的推广与深入具有非常重要
的意义。盈利预测和投资评级：维持买入评级。由于年初疫情和中美贸易战的
多重叠加，上半年公司主业 MO 源的下游销售与出海受到了相当的影
响，对公司整体的业绩成长带来一定拖累，但下半年开始逐渐好转。
随着中美贸易战的升级，以及美国对华为、中芯等科技企业的技术封
锁层层加码，以光刻胶为代表的半导体关键技术的自主可控已经不是
一个单纯的是否赚钱的经济问题，而是关乎产业生死存亡的战略要务。
南大光电 ArF 光刻胶顺利通过客户验证，对企业发展来说，仅仅是一
小步，但对半导体核心技术国产化来说，却是一大步，意义鲜明。预
计公司 2020-2022 年实现归母净利润 1.23、1.81、2.92 亿元，当前
市值对应 PE 分别为 109.91、74.71、46.35 倍,维持公司买入评级。风险提示：1）市场拓展不及预期；2）半导体景气度持续的不确定性；3）LED 及
光伏需求不及预期；4）新产品研发推广进度不及预期。",,太平洋证券,买入,[None],2020-12-18,,买入,4401967,pdf_downloads/2020/2020-12-18/300346-南大光电（300346）：ArF光刻胶认证通过，国产替代龙头进阶在即.pdf,300346,南大光电,南大光电（300346）：ArF光刻胶认证通过，国产替代龙头进阶在即
"刘宇卓,罗四维",南大光电主要业务包括MO源、电子特气，同时公司正在推进光刻胶及配套材料业务、ALD前驱体产品业务。电子特气业务已成为公司盈利新增长点。公司主要产品为高纯磷烷、砷烷，纯度达到6N级别，已在LED行业取得主要市场份额，并在IC行业快速实现了进口替代，已成为公司新的利润增长点。目前公司在IC领域的电子特气销售额占比约40%。此外，公司于2019年11月收购山东飞源气体57.97%股权，飞源气体是国内三氟化氮、六氟化硫主要生产企业之一。公司是光刻胶领域的新进入者，目标产品为中高端的半导体用ArF光刻胶。公司于2017年开始研发“193nm光刻胶项目”，已获得国家“02专项”的相关项目立项，公司计划通过3年的建设、投产及实现销售，达到年产25吨193nm（ArF干式和浸没式）光刻胶产品的生产规模，产品将满足集成电路行业需求标准。公司盈利预测及投资评级：我们预测公司2019~2021年净利润分别为0.6亿元、0.85亿元、1.24亿元，EPS分别为0.15元、0.21元、0.30元。目前股价对应P/E分别为121倍、85倍、58倍。首次覆盖给予“强烈推荐”评级。风险提示：市场竞争加剧；项目建设进度不及预期；下游客户认证进度不及预期；新技术的研发风险；原材料价格波动风险。,,东兴证券,强烈推荐,[None],2020-01-14,,买入,4140300,pdf_downloads/2020/2020-01-14/300346-南大光电（300346）电子化工材料（ECM）进口替代实质性突破系列报告：电子特气业务已成为新增长点，光刻胶项目进展顺利.pdf,300346,南大光电,南大光电（300346）电子化工材料（ECM）进口替代实质性突破系列报告：电子特气业务已成为新增长点，光刻胶项目进展顺利
王凌涛,"南大光电(300346)事件：公司于 11 月 29 日发布公告： 按照公司先前发布的《 关于采用现金收购及增资方式取得山东飞源气体有限公司 57.97%股权的公告》的流程，公司近期已将本次交易第二部分的增资款中剩余的 10%尾款即 2,100 万元支付给飞源气体，增资款按照《投资协议》的约定已全部履行支付。飞源气体的收购是公司特气领域持续布局的重要依托。 公司自八月初发布对飞源气体的控股收购预案，至近期完成全部收购，推进快速有效，当前市场对于公司在光刻胶领域的布局非常重视，对于特气等产品理解相对有限， 特气的市场分类与应用太细致，确实不如光刻胶那般“深入人心”，而这正是预期差所在。对飞源气体的控股收购进一步佐证了我们对于南大光电将来向平台型公司演进的判断：飞源气体主要产品为 NF3、SF6 等含氟电子特种气体，目前已经是台积电、中芯国际、京东方等一线大厂的主要供应商，公司计划未来在不断提升 NF3、 SF6 产能、品质的同时，推出六氟化钨等含氟电子特气产品，逐步成为在含氟电子特种气体方面具有国际竞争力的供应商。飞源气体是国内排名前三的电子级氟化工供应厂商，同时也是国内 NF3 等供应商之中唯一的民企，与南大的成长路径较为契合，与南大的高纯磷烷、砷烷类电子特气上下游渠道共享与协同优势明显，而且自 2016 年主要产品投产以来，经历了 2017-2018 年的产品导入期， 2019 年已经进入快速成长期，是实现扭亏为盈的重要拐点。我们看好飞源与南大的整合前景，含氟电子特气将成为公司成长体系的全新驱动源。收入端： 前三季度利润下滑仍是受上游 LED 行业景气度下滑影响，静待电子特气在 IC 领域的增长兑现。 2019 年前三季度， LED 行业下滑非常明显，行业芯片库存高企，价格竞争进入红海厮杀，停工去库存甚至于小厂的直接关闭成为业内常态。公司作为供应链上游，受此影响传导， MO 源等产品销售价格继续下降。 高纯磷烷和砷烷等电子特气类产品虽有成长，但难以完全弥补前述下滑缺口，因此整体利润仍出现些许同比下滑。值得注意的是，目前公司正在布局实施的“年产 170 吨 MO 源和高 K三甲基铝生产项目”正是为解决 MO 源受限 LED 行业困局的重要部署，既能实现 MO 源的前道原材料自制，同时也能为半导体行业客户提供高K 三甲基铝， MO 源领域这些年的持续下滑为公司带来的影响有望得到改善和解决。电子特气类产品上半年营业收入仅比去年同期增长 12.12%，这一量级略低于预期，主要由于 IC 领域的下游市场放量不及预期，但客观地来看半导体客户的导入节奏，这也是情理之中，毕竟 Fab 厂耗材产品的导入相对 LED 等行业要谨慎得多，而且目前国内的很多晶圆厂自身尚处于产能爬坡的过程中，推进需要时间，但这一块的落地会迟到却绝不会缺席， 四季度或者明年的逐期落地，是接下来公司的重要看点。投入端：光刻胶与 ALD 前驱体继续不断投入。 报告期内，为提升公司后续的发展能力，公司加大了对 193nm 光刻胶和前驱体的研发投入力度，公司研发费用投入比去年同期增加一倍多，达到 2673.7 万元，在公司营业收入中的占比达到 19.18%，是这两年的投入新高。在日常的路演交流中我们感受到，市场对光刻胶的推进进度非常关注，但对 ALD前驱体却关注甚少，或者说本质是对这个产品知之甚少。比较而言，前驱体的总体布局相对成熟，并且与电子特气等产品供应渠道与应用类似，开发门槛亦非常高，而且公司推动的 TDMAT 等产品已经明确在中芯国际等厂家认证通过，从产品的正常导入节奏来看，前驱体类产品率先实现批量供应的可能性更高，如此看来， 2019-2020 年这一阶段中应对前驱体的成长予以更多重视。光刻机被誉为半导体工业皇冠上的明珠，明珠难容微瑕，光刻胶的研发与制造所面临的未知困难、 know how、专利壁垒等因素注定了产品由投入到导入到盈利需要数年的磨炼，并不简单。公司从气体产品进入光刻胶领域，并且能够拿到我国 02 专项“ 193nm 光刻胶及配套材料关键技术研究项目”和“ ArF 光刻胶开发和产业化项目”的资质，自身基础与水平毋庸置疑，许总所领导的开发小组在国内毫无疑问是一线团队，公司在光刻胶领域会有很好的成长未来。盈利预测和评级：首次覆盖，给予买入评级。 通过这些年的内生成长和体外布局，公司已经逐渐完成了从 MO 源（三甲基镓、三甲基铟、三甲基铝等）、高纯磷烷、砷烷、多种 ALD 前驱体、含氟电子特气、 193nm光刻胶的整体布局，平台型综合半导体辅材的框架已经基本搭建完成，预计公司 2019-2021 年的净利润分别为 0.66、 1.24 和 1.77 亿，当前股价对应 PE 73.77、 39.13 和 28.39 倍。公司前三季度虽然在下游 LED行业的影响下盈利出现些微下滑，但公司在半导体前道辅材领域的平台布局已经初具雏形，近年来随着我国半导体国产化步伐的逐渐加快，下游供应一旦打开， 公司所面对的进阶空间和供给格局都将放大，给予公司买入评级。风险提示： 1） MO 源需求不及预期； 2） MO 源价格超预期下跌； 3）电子特种气体市场推广不及预期； 4） ALD 前驱体客户认证不及预期； 5）光刻胶开发与推进进度不及预期。 6）飞源气体客户销售不及预期。",,太平洋证券,买入,[None],2019-12-02,,买入,4030823,pdf_downloads/2019/2019-12-02/300346-南大光电（300346）：整合飞源完善平台布局，国产化替代需求持续成长.pdf,300346,南大光电,南大光电（300346）：整合飞源完善平台布局，国产化替代需求持续成长
