author,content,filename,org_name,original_rating,pdf_link,publish_time,rating_adjust_mark_type,rating_changes,report_id,save_path,stock_code,stock_name,title
孙灿,事件8月27日晚间，公司发布2021年半年度报告。报告期内公司实现营业收入10.70亿元，同比增长45.08%；实现归属于上市公司股东的净利润1.60亿元，同比增长10.48%；实现归属于上市公司股东的扣除非经常性损益的净利润1.40亿元，同比增长10.55%，基本每股收益0.22元。点评零部件业务稳健，存货增加使二季度业绩承压公司精密液压零部件和电磁驱动零部件业务营业收入分别为3.28亿元和4.95亿元，同比分别+11.75%和+21.24%，保持稳定增长；毛利率分别为32.37%和39.00%，同比分别下滑0.48pct和0.62pct，我们认为毛利率下降主要受上游原材料价格上涨影响。二季度净利润为5926.45万元，同比-4.93%，环比-41.41%，净利润下滑主要是由于原材料储备增加，2021上半年存货较一季度增加8090万元，原材料和库存商品较去年同期分别增加4904万元和5070万元，我们认为这主要是磷酸铁锂原材料储备增加为下半年产能释放做准备。锂电材料产能释放在即，业绩放量可期上半年公司锂电正极材料业务营业收入1.28亿元，同比+946.83%，毛利率3.13%，同比提升15.63pct。公司现有磷酸铁锂正极材料产能1.2万吨，射洪基地5万吨产能即将进入量产阶段，年内开始供货；7月规划新增25万吨产能，一期6万吨将于9月开始建设。年底产能将达到6.2万吨，明年预计超12万吨，规模化投产后毛利率有望回升至20%左右水平，未来业绩放量可期。业务条线扩张，积极布局新能源汽车领域公司电动VVT获得广汽定点，是国产零部件企业的首发应用；变速箱电磁阀、EA888摇臂、喷嘴、喷嘴电磁阀、油泵挺柱项目获得客户定点。新能源汽车领域，400W、450W、200W电子水泵量产供货吉利和长城；电子水泵执行器获大众定点，电子油泵供应华为，获得小鹏、博世世力乐定点；电驱减速器获得华为、华人运通定点。公司积极拓展新业务，汽车零部件业务增量十足。盈利预测我们预计2021-2023年公司营业收入分别为27.8、47.2、63.1亿元，归属于母公司股东的净利润分别为4.29/6.49/8.43亿元，EPS分别为0.56、0.85、1.10元/股，对应PE分别为70.41/46.51/35.81倍。予以“增持”评级。风险提示：政策大幅不及预期；安全事故频发；原材料大幅波动等。,,川财证券,增持,[None],2021-08-31,,增持,4603159,pdf_downloads/2021/2021-08-31/300432-富临精工（300432）：传统业务稳健，新能源放量在即.pdf,300432,富临精工,富临精工（300432）：传统业务稳健，新能源放量在即
黄博,"事件7月20日晚间，公司发布公告称子公司江西升华新材料有限公司拟规划新增投资建设年产25万吨磷酸铁锂正极材料项目，预计总投资400,000万元；其中一期先行建设年产6万吨磷酸铁锂正极材料项目，预计总投资106,000万元。点评产能扩张超预期，剑指磷酸铁锂正极材料领军企业。公司子公司江西升华科技目前有磷酸铁锂正极材料产能1.2万吨，在射洪市新建的5万吨产能预计2021年Q3开始投产供货，产能逐步爬坡。本次扩建的一期6万吨磷酸铁锂正极材料产能预计于2022年年中投产，届时公司产能合计达到12.2万吨，从一万吨产能到十万吨级产能仅耗时一年半，产能扩张速度超市场预期。从远期规划来看，公司目前规划产能投产后将达到年产31.2万吨产能，产能与行业头部规划企业靠拢，且公司产品性能出众，公司也有望借此成为磷酸铁锂正极材料领军企业。单吨净利润提升，盈利能力增强。根据公告披露，本次规划新增的6万吨产能的单吨净利润在4430元/吨左右，较此前我们预计的2500元/吨的净利润有大幅提高。我们认为单吨净利润提高主要来源于：1）工艺优化带来单吨成本下降；2）规模化效应降低成本；3）磷酸铁锂正极材料价格维持高位。预计随着公司新产能的投建，以及与上游锂矿企业深度绑定合作，公司成本仍有一定的下降空间，进一步提升盈利水平。产能高速增长，静待业绩放量。公司磷酸铁锂正极材料业务在今年Q3有5万吨产能投产，但预计产能爬坡需要持续到年末；本次新增6万吨产能预计明年年中投产，我们预计公司2021-2023年有效产能为2.4万吨、7.7万吨、12.2万吨，明后两年产能快速提升，2022年和2023年业绩放量可期。盈利预测我们预计2021-2023年公司营业收入分别为27.8、47.2、63.1亿元，归属于母公司股东的净利润分别为4.29/6.49/8.43亿元，EPS分别为0.56、0.85、1.10元/股，对应PE分别为29/19/15倍。公司传统业务提供安全边际，新能源汽车零部件及铁锂正极提供溢价空间，铁锂正极预期盈利能力提升，予以“增持”评级。风险提示：政策风险；销量不及预期；原材料价格波动风险。",,川财证券,增持,[None],2021-07-21,,增持,4569211,pdf_downloads/2021/2021-07-21/300432-富临精工（300432）动态点评：产能扩建超预期，盈利能力大幅提升.pdf,300432,富临精工,富临精工（300432）动态点评：产能扩建超预期，盈利能力大幅提升
"张天楠,黄博",事件公司拟向特定投资者发行股票，募集资金不超过15亿元，其中8.6亿元用于新能源汽车智能电控产业项目、2.72亿元用于年产5万吨新能源锂电正极材料项目、3.68亿元用于补充流动资金。点评顺应电动化、智能化潮流，产业转型升级加速汽车行业“新四化”成为未来的发展趋势，传统汽车零部件企业将会受到一定的冲击，公司积极布局电动化与智能化领域，电子驱动、新能源车载电驱动等产品及系统正在加快产业化和规模化经营，已经进入华为、联合电子（UAES）智能汽车配系并成为关键部件供应商。本次定增中8.6亿元用于新能源汽车智能电控产业项目，公司产业转型升级将会加速，顺应行业发展趋势，为公司业绩带来新的增长点。积极扩张产能，抢占市场份额新能源汽车销量已经连续11个月创月度新高，动力电池需求十足；磷酸铁锂电池产量在5月份首次超过三元电池，占动力电池总产量的63.6%；装车量方面，磷酸铁锂电池市占率也稳步提升至40%以上的水平。定增资金用于5万吨产能扩建有助于公司在满足下游客户激增的需求的同时抢占市场份额，充分享受行业发展红利。大股东参与定增彰显信心，公司未来发展前景良好控股股东富临集团拟认购本次增发股票的比例不低于10%，且至少18个月不能转让，彰显控股股东对公司未来发展前景的信心。参考公司股权激励行权目标来看，2021-2023年营业收入不低于26/46/68亿元，且每年净利润增长率不低于20%，公司未来业绩有望高速增长，传统汽车零部件业务、新能源汽车智能电控业务、磷酸铁锂正极材料业务将成为驱动公司业绩增长的主要动力。盈利预测我们预计2021-2023年公司营业收入分别为27.8、46.7、63.1亿元，归属于母公司股东的净利润分别为4.29/5.75/7.12亿元，EPS分别为0.56、0.75、0.93元/股，对应PE分别为23/17/14倍。公司传统业务提供安全边际，新能源汽车零部件及铁锂正极提供溢价空间，维持“增持”评级。风险提示：政策大幅不及预期；安全事故频发；原材料大幅波动等。,,川财证券,增持,[None],2021-06-21,,增持,4535550,pdf_downloads/2021/2021-06-21/300432-富临精工（300432）：顺应行业发展趋势，定增以抢占市场份额.pdf,300432,富临精工,富临精工（300432）：顺应行业发展趋势，定增以抢占市场份额
"张天楠,黄博",事件公司发布2020年年度报告，报告期内公司实现营业收入18.45亿元，同比增长22.02%；实现归属于上市公司股东的净利润3.30亿元，同比下滑35.77%；实现归属于上市公司股东的扣除非经常性损益的净利润2.81亿元，同比下滑40.93%，基本每股收益0.4468元。2021年第一季度，公司实现营业收入5.30亿元，同比增长55.20%；实现归属于上市公司股东的净利润1.01亿元，同比增长22.07%；实现归属于上市公司股东的扣除非经常性损益的净利润8292.23万元，同比增长27.07%，基本每股收益0.1369元。点评下半年营业收入放量，实际净利润正增长2020年上半年公司实现营业收入7.38亿元，下半年受益于汽车行业加速回暖，公司业绩相较于2019年下半年增长超30%，2020年全年实现营业收入18.45亿元，同比增长20.02%，毛利率为35.45%，较2019年提升1.03Pct。公司2020年净利润3.30亿元，同比下降35.77%，主要是2019年同期公司对未弥补的亏损确认递延所得税资产导致所得税费用为-26601.56万元，若扣除该等所得税费用影响，2020年公司净利润比上年同期增长35.24%，公司业绩实际处于高增长态势，盈利能力恢复且稳步增长。期间费用率下降，营运能力增强2020年公司期间费用率相较于2019年下降2.16pct，主要系公司在管理费用上的优化，管理费用率较去年同期下降2.22pct。虽然2020年受疫情影响，但公司产品收到下游客户欢迎，营业周期、存货周转天数、净营业周期较2019年分别下降37天、11天、17天，营运能力显著增强；应收账款周转天数下降27天，回款速度提升；公司流动比率、速冻比率现金流量利息保障倍数分别为2.25、1.84、286.68，相较于2019年大幅提升，财务风险大幅降低。业务线扩张，提供业务增量公司减速器业务在建产能18万套/年，正在建设和调试中，预计建成后，公司车载电驱动减速器年产能将达到33万台/套。公司目前有磷酸铁锂正极材料产能1.2万吨，在建的四川射洪工厂产能5万吨，预计今年三季度开始供货，年底达到满产状态。减速器业务与华为达成合作，扩产以保障稳定供货给华为；磷酸铁锂正极材料产能扩建项目达产后将优先供货给宁德时代。公司在新能源汽车领域绑定优质客户，提前布局产能扩建，为业绩放量提供保障。此外，公司油泵挺柱获得欧洲奥迪项目定点；中置二代VVT获得上汽通用项目定点；驻车电磁阀获得长城汽车、邦奇项目定点并已向长城汽车批量供货；400W电子水泵获得吉利汽车和长城汽车项目定点并已向吉利汽车批量供货。公司积极拓展新业务，业绩放量可期。技术水平领先，战略规划清晰公司在细分行业技术领域，整体技术水平国内领先，引领行业技术的发展，在汽车零部件行业连续多年领军企业；公司积极参与国际竞争，是国内同行企业中唯一可为通用、PSA、大众、奥迪等国际一流整车厂同步开发新技术的全球供应商。公司战略规划清晰，公司致力于成为以技术为驱动、具有国际竞争力的新能源锂电正极材料及汽车智能电控解决方案综合供应商。公司顺应汽车行业变动趋势，积极向汽车电动化、智能化方向转型，电子驱动、新能源车载电驱动等产品及系统正在加快产业化和规模化经营，已经进入华为、联合电子（UAES）智能汽车配系并成为关键部件供应商。公司同时提出加快智能热管理系统及智能电控悬挂系统的产业化。我们认为随着汽车电动化、智能化趋势加深，公司有望充分享受行业技术变更带来的红利。股权激励计划出台，彰显公司信心公司提出向董事、高管、中层管理干部以及核心骨干人员等154人授予1500万股的股权激励计划，首次授予的价格为4.64元/股，业绩考核目标为：2021-2023年营业收入不低于26/46/68亿元，且每年净利润增长率不低于20%；或者2021-2023年连续任意20个交易日市值算数平均达到120/160/200亿元。本次股权激励明确提出了业绩和市值增长的目标，彰显公司信心，且通过此次股权激励，管理团队和核心骨干的利益得以绑定，看好公司未来快速发展。盈利预测我们预计2021-2023年公司营业收入分别为27.8、46.7、63.1亿元，归属于母公司股东的净利润分别为4.29/5.75/7.12亿元，EPS分别为0.56、0.75、0.93元/股，对应PE分别为16、12、10倍。公司传统业务提供安全边际，新能源汽车零部件及铁锂正极提供溢价空间，予以“增持”评级。风险提示：政策大幅不及预期；安全事故频发；原材料大幅波动等。,,川财证券,增持,[None],2021-04-27,,增持,4498294,pdf_downloads/2021/2021-04-27/300432-富临精工（300432）：积极顺应行业技术变革，业务扩张迎新增长点.pdf,300432,富临精工,富临精工（300432）：积极顺应行业技术变革，业务扩张迎新增长点
"张天楠,黄博",富临精工(300432)深耕发动机行业多年，勇挑国产替代重担公司主营发动机核心零部件，包括可变气门系统、摇臂、张紧器等，相关营收从2011年2.82亿增长至2020年的18.33亿，CAGR为23.1%。细分领域罕有国内竞争对手，客户包括通用、PSA、大众、奥迪、比亚迪、吉利等国际国内一线整车和Tier1的零部件集团，其中可变气门系统2020H1营收占比提升至52.83%，据行业调研数据，市占率超过20%，与伊纳、博格华纳、椿本、伊维斯、伊顿等合资或外资企业相比，公司在成本控制、管理效率等方面具备相对优势，国产替代持续深化。业务线持续扩张，把握汽车产业变革机遇公司在持续投入可变气门系统研发的同时，也不断扩展产品线，包括电子水泵、可变悬挂电磁阀、变速箱电磁阀、减速器系统等，未来均有望成为业绩的增长点。公司被确定为华为新能源车载减速器及相关零部件产品的供应商。车载减速器单车价值在2000元左右，根据国内2025年新能源汽车市场600万辆测算，假设华为配套车型占有率15%，公司对应的市场空间在有望达到18亿元。电动化趋势磅礴，铁锂放量增厚业绩磷酸铁锂在使用寿命、安全性、成本等方面具备明显优势，在广义储能市场（风光系统、基站UPS以及汽车动力）有广阔的市场空间。我们预测到2022年铁锂在风光电并网储能系统、5G基站UPS、电动车领域需求分别达到31GWh/21GWh/100GWh，全球铁锂总需求将达到152GWh，市场空间将超一万亿元。公司铁锂产品压实密度与克容量均为行业领先水平，品质优异。公司与宁德时代深度合作，目前有1.2万吨铁锂产能，2021年新建5万吨产能达产，预计2021/2022年有效产能为2.2/6.2万吨，为公司带来0.55/1.55亿元净利润，增厚业绩。首次覆盖予以“增持”评级我们预计2020-2022年公司EPS分别为0.45/0.57/0.73，对应P/E为22/18/14。公司传统业务提供安全边际，新能源汽车零部件及铁锂正极提供溢价空间，因此首次覆盖，予以“增持”评级。风险提示：新增产能扩建进展不及预期、锂电成本下降不及预期、华为新能源汽车领域渗透率不及预期。,,川财证券,增持,[None],2021-02-24,,增持,4444759,pdf_downloads/2021/2021-02-24/300432-富临精工（300432）深度报告：享细分赛道红利，迎电车发展机遇.pdf,300432,富临精工,富临精工（300432）深度报告：享细分赛道红利，迎电车发展机遇
"何晨,李文瀚","投资要点：

公司2017年前三季度收入同比增长95.93%，扣非归母净利润同比增长92.45%，业绩增长略超预期。2017年前三季度公司实现营业收入16.3亿元，同比增长101.05%；扣非后归母净利润3.05亿元，同比增长92.45%。公司Q3单季度实现营收5.3亿元，同比增长103.6%；实现扣非归母净利润1.00亿元，同比增长107.2%。公司本年度业绩增速加快的原因有：（1）可变气门系统销量较去年同期大幅增长；（2）收购锂电池公司升华科技业绩并表。

VVT业务接棒精密件制造，发动机国产化大有可为。公司作为汽车发动机精密件制造龙头，其中发动机挺柱市占率超过50%，业绩增长有赖于行业扩容，空间有限。公司未来在传统汽油发动机业务增长主要依托VVT（可变气门系统）业务的发展。公司2017H1的挺柱营收同比下滑了9.68%，而VVT营收同比增加49.97%，毛利率达到了34.95%，高于挺柱的29.61%，提升了公司的整体毛利率水平。随着双积分政策的进一步推进和国产发动机的研发能力提升，将有越来越多的发动机将搭载VVT技术降低油耗和减少排放，预计渗透率将继续提升至80%以上，市场空间超过65亿元。

切入锂电池制造领域，双轮驱动发展逻辑初显。公司2016年定增收购锂电池正极材料供应商湖南升华科技，实现了由配套传统燃油车向新能源汽车的转型，化解了未来汽车电气化导致的燃油发动技术淘汰的风险。升华科技2016年、2017年、2018年的业绩承诺分别为1.52亿元、2亿元和2.61亿元，公司H1共实现净利0.95亿元，较去年同期增长59.95%。根据我们测算，公司在江西的22000万磷酸铁锂产能在H1的达产率约为25%，业绩承诺的利润完成率达到了50%，即便未来磷酸铁锂价格继续下跌，公司也有较大把握完成本年度业绩承诺。而随着明年产能继续放量，磷酸铁锂材料业务的增长有望超过30%。

锂电池、VVT业务双轮驱动，予以“谨慎推荐”评级。公司收购升华科技切入新能源汽车产业链，使得供给侧改革带来的原材料价格上涨被公司原材料生产业务充分对冲，业绩在整个汽车板块普遍下滑的Q3季度实现了超预期增长。结合升华科技2018年的业绩承诺，预计公司2017-2018年营业收入为24亿和31亿元，归母净利润为4.7亿和5.9亿元，目前股价对应2017-2018年估值为24.8倍和19.8倍，考虑国内外汽车变速箱生产商的估值水平以及国内市场未来的发展空间，给予公司2017年底25-28倍PE，对应的合理估值区间为23.0-25.8元，首次覆盖给予“谨慎推荐”评级。

风险提示：汽车销量不达预期；磷酸铁锂价格下滑",,财信证券,谨慎推荐,[None],2017-11-03,,增持,2076686,"pdf_downloads/2017/2017-11-03/300432-富临精工(300432)：锂电池、VVT双轮驱动,不惧行业技术切换.pdf",300432,富临精工,"富临精工(300432)：锂电池、VVT双轮驱动,不惧行业技术切换"
徐鹏,"富临精工(300432)
公司发布2017年三季报，前三季度公司实现营业收入16.33亿元，同比增长101.05%；营业利润3.69亿元，同比增长100.38%，归属母公司净利润3.15亿元，同比增长95.93%；折合EPS为0.62元/股；公司同时预计，2017年公司净利润同比将有较大增长。
受益于并表升华科技，业绩增长符合预期。三季度公司实现营收5.34亿元，同比增长103.57%，实现归母净利润1.03亿元，同比增长109.80%，三季度公司业绩大幅增长主要由于并表升华科技与传统业务收入增长所致。2016年公司收购升华科技，正式布局锂电池正极材料领域，目前已形成发动机精密零部件+新能源锂电池正极材料的业务发展格局。上半年，公司正极材料磷酸铁锂业务实现营收4.20亿元，成为公司业绩新的稳定增长点。传统业务方面，受益于新客户的开发及需求的增长，上半年公司VVT业务实现营收2.74亿元，同比增长49.97%；三季度受客户东安三菱产销下滑影响，公司VVT产品增速或有所下滑，但我们预计整体影响有限。前三季度公司毛利率为34.41%，较上半年提升0.20个百分点，保持平稳；期间费用率为10.59%，较上半年上升0.58个百分点，主要是研发投入增加、新增重大资产重组无形资产评估增值摊销以及升华科技纳入合并报表导致管理费用大幅上升所致。
公司传统业务空间广阔，正极材料有望持续放量。公司是国内VVT行业龙头企业，当前主要客户是上汽、广汽、航天三菱、长城等自主品牌和少数合资品牌。过去几年，在国内汽车产销量的持续增长、双VVT逐渐普及以及零部件国产替代趋势的推动下，公司VVT业务增长迅速。目前公司VVT年产能为250万套左右，远远低于国内市场需求，未来市场空间广阔。同时，公司储备的VVL、自动变速器电磁阀等产品已经完成研发，随着国产自动变速箱产能的释放，未来储备产品有望成为公司新的业绩增长点。在正极材料方面，公司目前以磷酸铁锂正极材料为主，2017年已成功实现扩产，全年产能有望达到2.2万吨，可有效缓解前期产能不足的问题。同时公司具备三元材料研发生产能力，未来随着新能源汽车市场的放量，公司正极材料业务有望持续受益。
盈利预测与投资评级：我们预计公司2017-2019年营业收入分别为24.60、31.04和37.65亿元，归属母公司所有者净利润分别为5.21、6.29和7.88亿元，折合EPS分别为1.02、1.23和1.55元，对应于10月26日收盘价24.32元计算，市盈率分别为24、20和16倍。鉴于公司目前主营业务市场空间广阔，未来发展可期；正极材料产品产能逐渐释放，为公司带来稳定业绩支撑，我们维持公司“审慎推荐”的投资评级。
风险提示：（1）汽车市场持续低迷；（2）新能源汽车销量不达预期等。",,华鑫证券,审慎推荐,[None],2017-10-27,,增持,3991440,pdf_downloads/2017/2017-10-27/300432-富临精工（300432）：业绩增速符合预期，看好公司未来发展.pdf,300432,富临精工,富临精工（300432）：业绩增速符合预期，看好公司未来发展
"高翔,石川","投资要点

事件：公司发布2017三季报，实现营业收入16.3亿元，（yoy+101.1%），归母净利润3.2亿元，（yoy+95.9%）。

毛利率相对稳定，零部件主业承压。公司前三季度毛利率为34.4%，同比增长0.46pp，2017Q3毛利率为34.8%，环比下降0.76pp。汽车整车行业进入洗牌周期，零部件行业承压压制毛利率。公司VVT产品上半年销量增速超过50%，虽然三季度东安三菱等客户发动机产销下滑导致公司VVT增速有所放缓，但公司VVT产品业内口碑良好，仍为公司业务发力的亮点。

磷酸铁锂正极材料业务正常运转，积极拓展三元材料。随着江西宜春扩产项目正式投用，升华科技已经形成年产2.2万吨磷酸铁锂的产能。各新能源客车厂二季度后排产较满，下半年进入集中上量周期，将持续拉动磷酸铁锂需求，下半年磷酸铁锂价格稳中有升，利好升华科技业绩释放。升华科技已于9月份设立株洲升华科技有限公司，我们预计公司未来正极材料重心将会逐渐向三元材料转移，产品和客户将持续优化。

精密制造实力突出，产品线布局值得期待。公司拥有液压挺柱、机械挺柱、液压张紧器件、摇臂、喷嘴、发动机可变气门系统VVT、GDI高压油泵挺柱及泵壳等成熟产品。其中VVT业务成长迅速，受益于节能减排行业趋势未来有望继续爆发。客户方面，公司已拓展上汽通用五菱、东安三菱、航天三菱、广汽等核心客户，产品实力体现。我们预计2017年公司VVT产品方面将进一步攻城略地，获取更多优质客户。公司目前在电子水泵、电子真空泵、电动式VVT、VVL和电机电控方面持续投入研发，我们看好公司未来产品线的延伸。

盈利预测与投资建议。由于公司零部件产品下游客户需求放缓，产品年降压力压制整体毛利率，我们调整公司2017-2019年EPS分别为0.96元（1.10元）、1.24元（1.40元）、1.36元（1.61元），对应PE分别为25倍、20倍、18倍，我们给予公司2017年30倍估值，调整目标价至28.8元，维持“买入”评级。

风险提示：汽车行业增速放缓；新能源车发展不及预期；磷酸铁锂正极材料价格下降；并购企业业绩实现或不及承诺。",,西南证券,买入,[None],2017-10-27,,买入,2169248,"pdf_downloads/2017/2017-10-27/300432-富临精工(300432)：零部件业务承压,三元材料值得期待.pdf",300432,富临精工,"富临精工(300432)：零部件业务承压,三元材料值得期待"
