author,content,filename,org_name,original_rating,pdf_link,publish_time,rating_adjust_mark_type,rating_changes,report_id,save_path,stock_code,stock_name,title
"刘国清,曾博文","中集集团(000039)报告摘要量价齐升，集运迎来复苏大周期。公司是全球领先的物流及能源行业设备及解决方案供应商，目前主要从事集装箱、道路运输车辆、能源/化工及液态食品装备、海洋工程装备、空港/消防及自动化物流装备的制造及服务业务，公司各个产品线均为全球领先，公司的标准干货集装箱、冷藏箱产销量保持全球第一；据国际罐式集装箱协会调查统计，罐式集装箱的产销量保持全球第一；是全球销量第一的半挂车生产制造商；登机桥业务综合竞争力位居全球领导者地位，为全球三大旅客登机桥制造商之一，中国市场份额连续四年占比95%以上；亦是中国领先的高端海洋工程装备企业之一。根据行业需求量来看，近期集装箱行业非常火爆，随着欧美逐渐复工解禁，港口集运贸易呈逐步复苏的态势，加上疫情期间世界各地港口不能正常运转，散落在全球各地的集装箱回流不畅，逐步出现了一箱难求的情况，客户下半年购箱意愿明显增多，同比去年下半年需求增长强劲，公司占据集装箱制造市场50%的份额，获益显著。从价格来看，近两年由于供给侧逐步出清改善，集装箱价格明显提升，我们预计未来价格将维持较为稳定得状态。总体来看，集装箱业务将迎来量价齐升，有望迎来一轮明显复苏。业绩有望不断改善。公司2020H1实现394亿元，同比减少7.7%，归母净利润达到-1.83亿元，同比减少126.9%，公司2020年Q2实现236亿元，同比减少0.16%，归母净利润达到4.59亿元，同比增长67.3%。分项来看：集装箱板块收入84.5亿元/同比-25.45%，净利润2.3亿元/同比+535.78%，第二季度箱价环比和同比均有显著提升;道路运输车辆收入112亿元/同比-11.98%，净利润7亿元/同比-17.37%,海外零部件供应链受到冲击明显，北美、欧洲及其他市场零部件业务受到影响，收益有所下降;能源化工（中集安瑞科）收入58亿元/同比-19.27%，净利润1.57亿元/同比-56.84%,本集团能源、化工及液态食品装备业务受新冠肺炎疫情影响，生产活动受到延误；客户的业务营运暂停，使得现场施工工作（尤其是海外项目）也受到了不同程度的延误;物流服务收入44.5亿元/同比+3.3%，净利润2.3亿元/同比+155.68%,主要是向单元载具业务转让部分子公司股权产生的收益影响;中集天达收入22亿元/同比-6.9%，净利润0.78亿元/同比+6.1%,;重卡收入8.8亿元/同比-21%，净利润-1.38亿元,受新冠肺炎疫情等因素影响，联合重工销量同比下降幅度较大;金融收入11.35亿元/同比+20.67%，净利润1.79亿元/同比-10.21%;海洋工程收入25.28亿元/同比+49.8%，净利润-8.9亿元;产城收入12.62亿元/同比+124%，净利润1.36亿元/同比73.51%。整体来看，车辆、能源化工、空港、物流等未来均保持稳健增长。第一大股东变更深圳市资本运营集团，更多资源有望导入。2020年8月25日，中远海发之全资子公司中远集装箱工业有限公司及LongHonour Investments Limited、与Broad Ride Limited和PromotorHoldings Limited一起作为四个股东方（以下简称“转让方”）与深圳市资本运营集团有限公司签署了《关于中国国际海运集装箱（集团）股份有限公司之股份转让意向书》，四个股东方同意向深圳市资本运营集团有限公司及其指定的全资子公司协议转让其各自所持本公司的部分或全部股份，本次交易的每股转让价格应按照本公司2019年度经审计的归属于母公司普通股股东的每股净资产值（人民币9.83元/股）确定。转让后，深圳市资本运营集团持有350,000,000股A股和719,089,532股H股，合计占截止2020年7月31日本公司总股本的29.81%，将成为本公司第一大股东，深圳市资本运营集团为深圳市人民政府国有资产监督管理委员会100%控股，后续有望为公司导入更多的资源，为公司发展助力。盈利性预测与估值。预计公司20-22年归属于母公司股东净利润分别为8、20亿、32亿，对应估值40、16、10倍，维持增持评级。风险提示：宏观经济风险，竞争格局恶化风险",,太平洋证券,增持,[None],2020-10-29,,增持,4362342,pdf_downloads/2020/2020-10-29/000039-中集集团（000039）：集装箱行业周期复苏，公司有望开启新一轮成长.pdf,000039,中集集团,中集集团（000039）：集装箱行业周期复苏，公司有望开启新一轮成长
"刘国清,曾博文","中集集团(000039)事件公司近期公布半年度报告，公司 2020H1 实现 394 亿元，同比减少7.7%， 归母净利润达到-1.83 亿元，同比减少 126.9%， 公司 2020 年Q2 实现 236 亿元，同比减少 0.16%， 归母净利润达到 4.59 亿元，同比增长 67.3%。报告摘要二季度业绩符合预期。 公司是全球领先的物流及能源行业设备及解决方案供应商，目前主要从事集装箱、道路运输 车辆、能源/化工及液态食品装备、海洋工程装备、空港/消防及自动化物流装备的制造及服务业务，公司各个产品线均为全球领先，公司的标准干货集装箱、冷藏箱产销量保持全球第一；据国际罐式集装箱协会调查统计，罐式集装箱的产销量保持全球第一；是全球销量第一的半挂车生产制造商；登机桥业务综合竞争力位居全球领导者地位，为全球三大旅客登机桥制造商之一，中国市场份额连续四 年占比 95%以上；亦是中国领先的高端海洋工程装备企业之一。分项来看：集装箱板块收入 84.5 亿元/同比-25.45%，净利润 2.3亿元/同比+535.78%， 第二季度箱价环比和同比均有显著提升;道路运输车辆收入 112 亿元/同比-11.98%， 净利润 7 亿元/同比-17.37%,海外零部件供应链受到冲击明显，北美、欧洲 及其他市场零部件业务受到影响，收益有所下降;能源化工（中集安瑞科）收入 58 亿元/同比-19.27%， 净利润 1.57 亿元/同比-56.84%,本集团能源、化工及液态食品装备业务受新冠肺炎疫情影响，生产活动受到延误；客户的业务营运暂停，使得现场施工工作（尤其是海外项目）也受到了不同程度的延误;物流服务收入 44.5 亿元/同比+3.3%， 净利润 2.3 亿元/同比+155.68%,主要是向单元载具业务转让部分子公司股权产生的收益影响;中集天达收入 22 亿元/同比-6.9%，净利润 0.78 亿元/同比+6.1%,;重卡收入 8.8 亿元/同比-21%，净利润-1.38 亿元, 受新冠肺炎疫情等因素影响，联合重工销量同比下降幅度较大;金融收入 11.35 亿元/同比+20.67%，净利润 1.79 亿元/同比-10.21%;海洋工程收入 25.28 亿元/同比+49.8%， 净利润-8.9 亿元;产城收入 12.62 亿元/同比+124%，净利润 1.36 亿元/同比 73.51%。期待行业周期反转。 据行业权威分析机构克拉克森（CLARKSON）最新预测，在 2020 年全球集装箱贸易量下跌见底后将出现拐点，至2021 年，贸易增速将反弹回升至 7.4%。受疫情在全球持续发酵的影响，今年上半年集运业需求出现较大幅度减少，客户普遍加强了对成本及现金流的管控，购箱意愿相对平淡。随着欧美逐渐复工解禁，集运贸易呈逐步复苏的态势，同时叠加集运业上半年盈利超预期和三季度市场季节性走旺等因素，客户下半年购箱意愿明显增多。国际航运研究及 咨询机构德路里（Drewry）集装箱运价指数自 7 月以来快速回升，已创今年以来新高。预计今年下 半年集装箱需求相比上半年会有明显好转，全年需求相比去年略有下滑，但明年需求将大概率迎来反弹。第一大股东变更深圳市资本运营集团，更多资源有望导入。 2020年 8 月 25 日，中远海发之全资子公司中远集装箱工业有限公司及 LongHonour Investments Limited、与 Broad Ride Limited 和 PromotorHoldings Limited 一起作为四个股东方（以下简称“转让方”）与深圳市资本运营集团有限公司签署了《关于中国国际海运集装箱（集团）股份有限公司之股份转让意向书》，四个股东方同意向深圳市资本运营集团有限公司及其指定的全资子公司协议转让其各自所持本公司的部分或全部股份， 本次交易的每股转让价格应按照本公司 2019 年度经审计的归属于母公司普通股股东的每股净资产值（人民币 9.83 元/股）确定。 转让后， 深圳市资本运营集团持有 350,000,000 股 A 股和719,089,532 股 H 股，合计占截止 2020 年 7 月 31 日本公司总股本的29.81%，将成为本公司第一大股东， 深圳市资本运营集团为深圳市人民政府国有资产监督管理委员会 100%控股，后续有望为公司导入更多的资源。盈利性预测与估值。 预计公司 20-22 年归属于母公司股东净利润分别为 8、 20 亿、 32 亿，对应估值 40、 16、 10 倍，维持增持评级。风险提示： 宏观经济风险， 竞争格局恶化风险",,太平洋证券,增持,[None],2020-09-02,,增持,4326127,pdf_downloads/2020/2020-09-02/000039-中集集团（000039）：业绩受疫情影响较大，下半年有望逐步复苏.pdf,000039,中集集团,中集集团（000039）：业绩受疫情影响较大，下半年有望逐步复苏
倪正洋,中集集团(000039)投资要点业绩总结：公司发布2020年半年报，实现营收394.3亿元（-7.7%），归母净利润-1.8亿元（-126.9%），扣非归母净利润-2.4亿元（-152.5%）。其中，Q2营收235.8亿元（-0.2%），归母净利润4.6亿元（+67.3%），扣非归母净利润3亿元（+155.2%）。受新冠肺炎疫情全球蔓延以及国际经济与贸易波动等影响，公司主要生产制造业务均受到不同程度冲击，集团上半年业绩整体承压。随着经济的逐步复苏重启，Q2业绩已显著回暖。受疫情冲击，公司业绩整体承压：2020H1，公司综合毛利率为12.9%，同比-0.7pp。分板块来看，集装箱板块营收84.5亿，同比-25.5%，毛利率达10.2%，同比+2.5pp；道路运输车辆板块营收111.9亿，同比-12.0%，毛利率达12.7%，同比-1.2pp；能化装备板块营业收58亿，同比-19.3%，毛利率达14.4%，同比-2.1pp；海工板块营收25.3亿，同比+49.8%，毛利率达0.32%，同比+1.1pp；空港板块营收21.9亿，同比-6.9%，毛利率达21.8%，同比+2.1pp。我们认为目前受疫情冲击，公司上半年业绩显著承压。未来在公司精细化管理持续推进下有望体现自身的盈利韧性，宏观经济企稳后公司业绩预计将有效修复。集装箱箱价显著回升，道路运输车辆有望受益于冷藏厢式车等新市场：2020H1受疫情对国际经济与贸易波动冲击，集装箱需求有所下滑。上半年公司普通干货箱销量35.8TEU，同比-37.5%。但受益于行业健康可持续发展行动，集装箱箱价同比较去年显著回升，集装箱板块实现净利润2.4亿元，同比+535.8%。道路运输板块新冠肺炎疫情使消费者更多的利用电商模式采购消费品，带动了冷藏厢式车市场的加速增长，为公司车辆板块提供新的边际增量。目前公司大力推进智能制造转型升级，例如集装箱的龙腾计划、车辆“超级麦哲伦计划”等，以降低生产成本提升运营效率，改善公司盈利能力。海工板块有序推进，能化装备受益清洁能源产业发展：海工板块新接订单陆续进入建造期，板块营收疫情冲击下仍取得正增长。上半年，中集来福士新增生效订单1.63亿美元，累计持有在手订单价值7.65亿美元。其中非油气订单占比约70%，呈持续增长态势。新增生效订单包括油气模块项目5个，海上风电项目4个，渔业项目1个，传统钻井和特种船业务线和修船各1个。能化装备板块受益国内清洁能源产业持续发展，板块未来有望进一步受益于国内天然气运输等场景的装备需求。盈利预测与投资建议：预计2020-2022年公司归母净利润分别为10、14、20.6亿元，对应PE32、23、16倍，首次覆盖，给予“持有”评级。风险提示：宏观经济低迷；全球疫情防控不及预期。,,西南证券,持有,[None],2020-09-01,,增持,4324859,pdf_downloads/2020/2020-09-01/000039-中集集团（000039）：20H1业绩整体承压，Q2单季度回暖显著.pdf,000039,中集集团,中集集团（000039）：20H1业绩整体承压，Q2单季度回暖显著
"王昆,马宝德",事件：公司发布2019年半年度报告，2019H1公司营业总收入427.18亿元，同比下滑1.93%；归母净利润6.80亿元，同比下滑29.58%；扣非归母净利润4.50亿元，同比下滑37.47%；基本每股收益0.16元。投资要点：集装箱、重卡、金融业务收入下滑，海工业务继续亏损上半年，全球经济增长放缓叠加贸易摩擦影响，集运增速大幅放缓，去年贸易摩擦导致的抢出口也透支了今年出口货量。上半年公司集装箱业务收入113.33亿元，同比下滑29.59%；净利润0.38亿元，同比下滑82.4%。上半年国内重卡市场行情低迷，重卡收入11.11亿元，同比下滑31.4%，净亏损0.44亿元。金融业务收入9.40亿元，同比下滑10.36%，净利润1.99亿元，同比下滑34.99%；SSCV平台租约到期、融资成本上升等导致收入及净利润同比下降。随着海工新接订单陆续进入建造期，海工业务收入16.87亿元，同比增长114.04%，净亏损7.03亿元，和去年同期亏损额度基本持平。道路运输车、能源化工液态食品装备、空港装备、物流服务保持增长道路运输车辆业务收入127.14亿元，同比增长10.27%，净利润8.45亿元，同比增长34.95%；我国专用车需求旺盛以及北美干厢和冷藏半挂车业务增长带动收入和利润提升。能源、化工及液态食品装备收入71.82亿元，同比增长16.1%，净利润3.63亿元，同比增长21.69%。空港装备收入23.54亿元，同比增长34.55%，净利润0.74亿元，同比下降13.46%；收入增长主要是并购了上海金盾和沈阳捷通。物流服务收入43.1亿元，同比增长6.1%，净利润0.91亿元，同比增长8.69%；贸易摩擦、经济下行导致物流企业承压。维持“推荐”评级我们预计公司2019/2020/2021年归母净利润分别为25.47亿元/32.33亿元/36.90亿元，EPS分别为0.71元/0.90元/1.03元，对应当前股价的P/E估值水平分别为14X/11X/10X，当前公司估值处于较低水平，维持“推荐”评级。风险提示：全球贸易摩擦升级；海工装备业务亏损超预期。,,国联民生证券,推荐,[None],2019-08-30,,增持,3892359,pdf_downloads/2019/2019-08-30/000039-中集集团（000039）：多项主业保持增长，集装箱收入下滑.pdf,000039,中集集团,中集集团（000039）：多项主业保持增长，集装箱收入下滑
贺泽安,2019H1业绩同比下滑30%公司2019H1实现营收427.18亿元，同比-1.93%；归母净利润6.80亿元，同比-29.58%，主要系主要系全球经济放缓、中美贸易摩擦持续紧张的背景下公司集装箱制造业务出现较大幅度下滑所致。公司盈利能力保持稳健，毛利率/净利率13.51%/2.58%，同比下降0.28/0.44个pct。公司期间费用控制良好，管理（含研发）/销售/财务费用率为6.38%/2.23%/1.31%，同比变动0.87/-0.94/0.41个pct。道路运输车辆/能化装备业务稳中有升，集装箱业务大幅下滑1）集装箱业务：19H1实现营收113.33亿元（yoy-29.59%），净利润0.38亿元（yoy-82.40%），营收业绩大幅下降主要系全球经济放缓、中美贸易摩擦持续紧张的背景下，集装箱业务需求放缓，且去年受贸易摩擦影响导致的抢出口透支了今年的出口货量，这也在一定程度上加剧了今年集运需求的放缓速度，不过公司集装箱产销量仍保持全球行业第一；2）道路运输车辆业务：受益于中国市场专用车上装需求旺盛以及北美市场干厢和冷藏半挂车业务增长，实现营收127.14亿元（yoy+10.27%），净利润8.45亿元（yoy+34.95%），净利率提升1.22个pct；3）能源、化工及液态食品装备业务受惠市场需求增长，实现营收71.82亿元（yoy+16.10%），净利润3.63亿元（yoy+21.69%），主要系中国步入天然气发展的黄金周期，天然气需求量维持较快增长，带动相应设备需求保持旺盛；4）海洋工程实现营收16.87亿元（yoy+114.04%），净亏损7.03亿元，同比基本持平，；5）空港业务实现营收23.54亿元（yoy+34.55%），净利润0.74亿元（yoy-13.46%），收入显著增长主要系公司空港设备业务收入增长及并购上海金盾、沈阳捷通影响所致。预计2019年下半年集装箱需求将持续回落，道路运输车辆和能化食品装备业务仍将保持稳健增长。盈利预测与投资建议：预计公司2019-2021年归母净利润分别为25.90/27.03/35.30亿元，对应EPS为0.72/0.75/0.99元，当前股价对应PE为14/13/10倍。维持“买入”评级。,,国信证券,买入,[None],2019-08-28,,买入,3888767,pdf_downloads/2019/2019-08-28/000039-中集集团（000039）：集装箱业务周期向下，道路车辆业务发力保障业绩稳健.pdf,000039,中集集团,中集集团（000039）：集装箱业务周期向下，道路车辆业务发力保障业绩稳健
范益民,"中集车辆港交所上市临近，将成中集集团第四个上市平台：中集集团控股子公司中
集车辆预计 7 月 11 日在港交所正式挂牌交易，发售价格为 6.38-8.08 港元，拟全
球发售 2.65 亿股，其中香港发售占比 10%，国际配售占比 90%，另有不超过 15%超
配权，募资额最高将超 20 亿港元。中集车辆上市后预计市值为 113-143 亿港元，
对应 2018 年净利润 12.3 亿人民币，静态市盈率为 8-10 倍。若不考虑超配权，上
市后中集集团将直接及通过中集香港间接控股中集车辆 53.8%股权，将成中集旗下
继中集集团、中集安瑞科、中集天达后第四个独立上市平台。    中集车辆为全球最大的半挂车制造商：中集集团半挂车和专用车上装制造业务起步
于 2002 年，并于 2005 年变更为中集车辆有限公司，2014 年设立“灯塔”工厂，2015
年先后并购美国 Vanguard 和比利时 LAG，2016 年收购英国 SDC。中集车辆在
2016-2018 年收入分别为 146/194/242 亿元，年复合增速为 28.9%；实现净利润分
别为 7.5/10.1/12.3 亿元，年复合增速分别为 27.9%，保持了较快速增长，为公司
较为稳定的第二大业务。据弗若斯特沙利文，全球半挂车销量由 2013 年的 90.2 万
辆增长至 2017 年的 118.0 万辆，年复合增速达 7%。其中中集车辆 2017 年销量为
12.2 万辆，全球市占率 10.3%，为全球半挂车龙头，显著高于排名第二的德国施密
茨 5.2%市占率。    受益我国安全技术标准升级和治超力度加大，半挂车需求仍将保持稳定：我国正持
续提升半挂车的安全技术标准，并于 2016 年实施新国标，逐步淘汰在尺寸、轴荷
及技术要求方面不合格半挂车；我国于 2017 年 9 月颁布新国标《机动车运行安全
技术条件》，其中指明半挂车安装碟式制动盘和空气悬挂系统的新技术规定，并将
于 2020 年 1 月生效。新技术标准的实施将加速淘汰不合格半挂车，提升车辆更新
带来的需求。另一方面， 2019 年以来各地方治超力度有增无减，交通部通知要求
严格执行全国超载超限认定标准，叠加排放标准提升及基建投资加大，预计我国半
挂车市场仍将保持稳定增长态势。    加速全球扩张，车辆业务在欧洲市占率提升潜力大：根据 2017 年半挂车销量数据，
公司在国内稳居第一（15.7%），北美地区排名第三（11.4%），欧洲市场排名第五
（3.6%）。海外市场特别是欧洲及新兴市场的市占率仍有较大的提升空间。中集车
辆上市后将加快全球扩张步伐，公司计划将募资额的 70%用于美国及欧洲开设新产
线及组装厂、10%的资金用于新产品开发、20%的资金用于偿还银行借款和增加运营
资金。公司有望借助上市契机，进一步提升生产流程数字化，加大新产品开发力度，
提升在欧美细分领域的市占率。     集装箱需求高位回落，毛利率料将稳定：全球集装箱需求在经历 2017-2018 年快
速增长后，2019 年以来呈现疲态，尤其是在中美贸易争端二季度出现升级势头下，
加速了我国集装箱出口的下滑。根据海关总署数据，我国前五个月集装箱出口量和
总金额均已回落至 2017 年的同期水平，今年前五个月出口数量同比增速为-18.3%，
出口金额同比增速-28.6%。考虑到今年以来钢材价格同比 2018 年均值有 5%左右的

回落，预计公司今年集装箱收入将有所下滑，而毛利率将维持去年水平。    投资建议：车辆业务独立上市，将提升集团管理和运营效率，提高融资能力和资本
运作便利性，并加快在欧美地区的产能扩张和技术升级。考虑到今年以来全球集装
箱市场呈现的疲态，我们下调公司未来三年营收预测，下调幅度分别为
6.8%/3.9%/2.7%，预计公司 2019-2021 年营业收入分别为 1002 亿元、1182 亿元、
1350 亿元；归母净利润下调幅度分别为 4.3%/3.8%/3.7%，预计分别为 34.82 亿元、
41.36 亿元、48.06 亿元；按当前股价及盈利预测，2019 年 PE 为 11 倍，仍处历史
较低水平，维持“买入-A”评级。   风险提示：我国推进“公转铁”将影响公路运输车辆的市场需求；中美贸易摩擦加
剧将影响全球贸易活动并减少集装箱需求；原材料价格上涨将减弱公司盈利能力；
土地整备及海工出表进度不及预期等。",,华金证券,买入-A,[None],2019-07-02,,买入,3794256,pdf_downloads/2019/2019-07-02/000039-中集集团（000039）：中集车辆上市临近，全球扩张步伐加快.pdf,000039,中集集团,中集集团（000039）：中集车辆上市临近，全球扩张步伐加快
