author,content,filename,org_name,original_rating,pdf_link,publish_time,rating_adjust_mark_type,rating_changes,report_id,save_path,stock_code,stock_name,title
周旭辉,【投资要点】近日，公司发布2024年三季报，整体利润端增速高于收入端，表现亮眼。报告期内，实现营业收入47.99亿元，同比+0.53%，实现归母净利润4.04亿元，同比+21.17%，实现扣非后归母净利润3.83亿元，同比+18.89%；单Q3来看，实现营业收入18.82亿元，同比+0.15%，环比+16.82%，实现归母净利润1.81亿元，同比+27.54%，环比+41.86%；扣非后归母净利润1.71亿元，同比+26.69%，环比+54.13%。利润率提升明显，销售毛利率为24.21%，同比+2.27pcts。主要原因是：（1）公司优质订单比例增加，导致销售毛利率较上年同期有所递增；（2）持续加大对应收账款和存货管理，信用减值损失和资产减值损失较上年同期有所下降，及受益于进项税额加计等因素。费用率方面，总体保持平稳。报告期内，销售费用率/管理费用率/研发费用率/财务费用率分别为3.99%/5.20%/4.60%/0.96%，同比变动分别为+0.69/+0.97/-0.14/+0.57pcts。收入结构进一步优化，外销占比提升，公司海外产能稳步推进。主营业务按照内销外销划分：内销收入34.02亿元，营收占比71.36%，外销收入13.66亿元，营收占比28.64%；单Q3来看，外销收入占比达到30%。海外产能布局持续推进，以应对外销需求。公司已扩大在墨西哥的产能，并在墨西哥、美国做好全线产品产能扩产准备，欧洲已完成波兰工厂、销售及售后服务总部布局，波兰工厂预计Q4产能就位。未来数据中心、基础设施领域等为公司带来增量。公司在数据中心领域的布局成效已凸显，2024年前三季度，国内数据中心订单量同比+102%。数据中心领域对变压器的稳定性要求极高，公司凭借低损耗、低温升、强过载、高可靠等优势，能够满足国内外数据中心需求，产品已得到广泛应用，目前已应用于包括百度、华为、阿里巴巴、中国移动、中国电信、中国联通等数据中心项目。【投资建议】考虑到公司外销订单高速增长，国内外输配电行业景气度持续，我们维持此前收入预测，调整了费用端的预测。预计2024-2026年，公司实现营业收入79.00/95.17/111.16亿元，同比增长分别为18.49%/20.47%/16.80%；对应归母净利润分别为6.69/9.03/11.11亿元，同比增长分别为32.53%/35.09%/22.93%；对应EPS分别为1.46/1.98/2.43元，现价对应PE分别为24/18/15倍，维持“增持”评级。,,东方财富证券,增持,[None],2024-10-31,,增持,5810922,pdf_downloads/2024/2024-10-31/688676-金盘科技（688676）：2024年三季报点评：利润端表现亮眼，外销持续支撑业绩.pdf,688676,金盘科技,金盘科技（688676）：2024年三季报点评：利润端表现亮眼，外销持续支撑业绩
杨润思,事件：公司发布2024年三季报。 公司2024年Q1-Q3实现营业收入47.99亿，同比+0.53%；归母净利润4.04亿，同比+21.17%；扣非归母净利润3.83亿，同比+18.89%。其中，2024Q3公司实现营业收入18.82亿元，同比+0.15%；实现归母净利润1.81亿元，同比+27.54%。公司业绩符合预期。收入划分：海外市场逐步兑现。收入结构方面，2024年前三季度公司实现国内收入34.02亿元，占比71%，实现海外收入13.66亿元，占比29%。盈利性：毛净利率齐升，随着海外订单逐步交付，有望带动公司盈利攀升。公司前三季度毛利率为24.21%，同比+2.27pcts，其中2024Q3毛利率为25.53%，同比+2.75pcts，环比+3.82pcts，净利率9.57%，同比+2.06pcts，环比+1.70pcts。主要原因是：①公司以海外为主的优质订单比例增加，导致销售毛利率较上年同期有所递增，2024年公司前三季度海外销售占比为29%，而2023年全年为18%，随后续海外订单销售占比提升，公司盈利有望持续改善；②持续加大对应收账款和存货管理，信用减值损失和资产减值损失较上年同期有所下降，及受益于进项税额加计等因素。后续展望：看好AI及欧美新能源、欧美电网升级与改造的发展，海外变压器需求持续高增，公司海外产能进展加速AI订单高增，后续重点布局数据中心变压器：2024 年 1-9 月，公司国内数据中心订单量同比增长102%。公司变压器系列产品品凭借优于国标，低损耗、低温升、强过载、高可靠等优势，能够很好的满足国内外数据中心需求，产品已经广泛应用于 IDC 数据中心领域，目前已广泛应用于百度、华为、阿里巴巴、中国移动、中国电信、中国联通等数据中心项目。国内外产能进展：海外产能布局方面，公司已扩大公司在墨西哥的产能，并在墨西哥及美国做好全线产品产能扩产准备，同时欧洲已完成波兰工厂和欧洲销售及售后服务总部的布局，预计2024Q4公司在波兰准备好产能，为公司进一步拓展市场奠定基础。国内产能布局方面，桐乡新能源基地于 2024年 10 月正式开工，基地达产后可为国内外市场服务。盈利预测：考虑到海外订单交付节奏整体偏慢，我们对公司业绩预期进行下调，我们预计公司2024-2026年归母净利润为6.21/8.51/10.44亿元，对应2024-2026年PE为26.3/19.2/15.6倍，维持“增持”评级。风险提示：海外新能源建设不及预期，海外电网投资不及预期，变压器需求不及预期。,,国盛证券,增持,[None],2024-10-28,,增持,5801865,pdf_downloads/2024/2024-10-28/688676-金盘科技（688676）：海外订单逐步兑现，公司盈利性受益结构改善.pdf,688676,金盘科技,金盘科技（688676）：海外订单逐步兑现，公司盈利性受益结构改善
"刘强,万伟","事件：公司发布2024年三季报，利润实现较快增长。1）2024年前三季度收入47.99亿，同比+0.53%；归母净利润4.04亿，同比+21.17%；扣非净利润3.83亿，同比+18.89%； 2）2024Q3收入18.82亿，同比+0.15%，环比+16.82%；归母净利润1.81亿，同比+27.54%，环比+41.86%；扣非净利润1.71亿，同比+26.69%，环比+54.13%。海外收入占比增加，盈利水平显著提升。1）2024年前三季度国内收入34.02亿，占70.90%；Q3国内收入12.93亿，占68.67%； 2）2024年前三季度海外收入13.66亿，占28.46%；Q3海外收入5.75亿，占30.54%（环比+5.56pct），三季度海外收入占比显著增加。3）2024年前三季度整体毛利率24.21%，同比+2.05pct；净利率8.34%，同比+1.38pct； 4）2024Q3毛利率25.53%，同比+2.74pct，环比+3.81pct；净利率9.57%，同比+2.06pct，环比+1.70pct。公司毛利率&amp;净利率提升明显，主要系：（1）公司海外优质订单交付比例增加；（2）持续加大对应收账款和存货管理，信用减值损失和资产减值损失较上年同期有所下降，及受益于进项税额加计等因素。持续稳定投入，费用率小幅增加。1）2024年前三季度期间费用率14.75%，同比+2.05pct；销售/管理/研发/财务费用率分别为3.99%/5.20%/4.60%/0.96%，分别同比+0.69pct/+0.96pct/-0.14pct/+0.54pct； 2）2024Q3期间费用率13.84%，同比+0.98pct，环比-0.47pct；销售/管理/研发/财务费用率分别为3.55%/5.03%/4.06%/1.20%，同比分别+0.24pct/+1.14pct/-0.49pct/+0.09pct，环比分别-0.27pct/+0.09pct/-1.10pct/+0.81pct。新产品研发结硕果，数字中心订单大幅增长。2024年8月，公司自主研发配套18.XMW漂浮式海上风力发电机组的干式升压变压器成功下线，该变压器额定电压为69kV/1.14kV,额定容量为20.6MVA，是目前世界上应用于漂浮式海上风力发电机组机舱内部的电压等级最高、容量最大的干式变压器。近期，该干式升压变压器将应用于某漂浮式海上风电示范项目的建设。公司加大新产品研发，将为其业绩增长持续注入新的动力。当下数字化浪潮汹涌澎湃，数据中心作为数字经济的基石，正以前所未有的速度重塑各行各业。公司抓住数据中心发展机遇，提供优质变压器产品以及电能供应解决方案，获得市场广泛认可。2024年1-9月，公司国内数据中心订单量同比增长102%，其中9月份单月订单量就达1.2亿元(含税)。投资建议：目前国内外电力设备需求持续向好，随着公司进一步深耕海外市场和加大新产品开发力度，有望带动其业绩继续增长。我们维持此前盈利预测，预计2024-2026年公司营收分别为75.90亿元、95.19亿元、115.17亿元，同比增速分别为+13.83%、+25.43%、+20.98%；归母净利润分别为6.67亿元、9.02亿元、11.40亿元，同比增速分别为+32.19%、+35.26%、+26.36%；EPS分别为1.46/1.97/2.49元，当前股价对应PE分别为24/18/14倍，维持“买入”评级。风险提示：新能源行业发展不及预期、海外市场开拓不及预期、行业竞争格局恶化等。",,太平洋证券,买入,[None],2024-10-28,,买入,5803902,pdf_downloads/2024/2024-10-28/688676-金盘科技（688676）：2024年三季报点评：海外持续兑现，盈利水平显著提升.pdf,688676,金盘科技,金盘科技（688676）：2024年三季报点评：海外持续兑现，盈利水平显著提升
张涵,Q3环比快速增长，利润率表现亮眼2024前三季度公司实现营业收入47.99亿元，同比持平；实现归母净利润4.04亿元，同比增长21.17%；毛利率为24.21%，同比提升2.05pct；净利率为8.34%，同比提升1.38pct。其中，24Q3公司实现营业收入18.82亿元，同比持平，环比增长16.82%；实现归母净利润1.81亿元，同比增长27.54%，环比增长41.86%；毛利率和净利率分别达25.53%和9.57%，为上市以来最好单季度水平，相比上半年分别提升2.17pct和2.02pct。此外，公司实控人、董事长提议2024年度以现金方式分配的利润应超过当年实现的可供分配利润的40%。外销占比提升，内销降幅收窄2024前三季度，公司主营业务外销收入13.66亿元，占主营收入的28.64%，其中24Q3外销收入5.75亿元，占当季主营收入的30.79%，相比上半年水平提高3.52pct。我们判断，上半年公司海外订单确收受下游节奏影响，但Q3海外确收已呈加速趋势，带动公司整体毛利率水平提升。随着公司在美洲、欧洲及中东地区的数据中心、电网、风光储和工业基础设施等领域订单持续增长，公司整体盈利能力有望随海外收入占比的增加同步提升。2024前三季度，公司主营业务内销收入34.02亿元，占主营收入的71.36%，其中24Q3内销收入12.93亿元，占当季主营收入的69.21%。上半年，公司国内新能源收入受光伏硅料扩产降速影响同比下滑，随硅料订单占比下降，同时非新能源领域加速贡献增量订单（前三季度公司国内数据中心订单量同比增长102%），公司国内端压力逐季减弱，预计全年公司国内收入降幅将相比上半年的同比降幅10.02%收窄。推进海内外产能布局海外方面，公司已扩大墨西哥产能，并在墨西哥及美国做好全线产品产能扩产准备，同时欧洲已完成波兰工厂和欧洲销售及售后服务总部的布局，预计Q4公司在波兰准备好产能，为进一步拓展市场奠定基础。国内方面，公司桐乡项目于10月正式开工，达产后预计将新增各类变压器系列产品产能。盈利预测考虑到今年公司国内新能源业务收入有所下滑，我们下调公司盈利预测，预测公司2024-2026年收入分别为77.34、96.77、120.18亿元，EPS分别为1.37、1.80、2.43元，当前股价对应PE分别为26.1、19.8、14.7倍，鉴于公司海外订单快速增长，同时外销占比提升有望带来盈利能力继续改善，给予“买入”投资评级。风险提示海内外变压器需求不及预期风险、行业竞争加剧风险、原材料价格波动风险、海外经营风险及汇兑损益风险、大盘系统性风险。,,华鑫证券,买入,[None],2024-10-26,,买入,5799884,pdf_downloads/2024/2024-10-26/688676-金盘科技（688676）：公司事件点评报告：利润率表现亮眼，外销占比再提升.pdf,688676,金盘科技,金盘科技（688676）：公司事件点评报告：利润率表现亮眼，外销占比再提升
"杨阳,许紫荆",10月21日，公司发布2024年三季报：2024年前三季度，公司实现营业收入47.99亿元，同比+0.53%；实现归母净利润4.04亿元，同比+21.17%。2024年第三季度，公司实现营业收入18.82亿元，同比+0.15%；实现归母净利润1.81亿元，同比+27.54%。观点：净利润增速大于营收增速，盈利能力显著提升。2024年Q3公司营收同比微增0.15%，净利润同比+27.54%，盈利能力显著提升。一方面，公司优质订单比例增加，Q3实现毛利率25.53%，同比+2.75pct；另一方面，公司持续加大对应收账款和存货管理，信用减值损失和资产减值损失较上年同期有所下降，此外还受益于进项税额加计等因素。海外业务持续开拓，国内订单结构有望优化。2024年前三季度，公司内销业务实现收入34.02亿元，收入占比71%，国内未来有望受益于数据中心等新基建项目以及数字化工厂整体解决方案项目等非新能源领域收入扩张；外销业务实现收入13.66亿元，收入占比28%，截至2024年H1，公司外销订单在手28.49亿元，同比+180.16%，海外订单饱满，未来业绩有望持续受益于海外市场的快速拓展及海外订单的快速增长。重视股东回报，2024年分红比例预计超40%。公司发布董事长提议增强股东分红回报暨落实“提质增效重回报”行动方案的公告，指出将进一步加大投资者回报力度，与投资者共享经营发展成果，公司2024年度以现金方式分配的利润应超过当年实现的可供分配利润的40%。盈利预测及投资评级：公司是变压器出海领先企业，有望受益于全球变压器需求增长和国内订单结构优化。预计公司2024-2026年归母净利润分别为6.24/8.46/10.34亿元，当前股价对应2024-2026年PE分别为24.8/18.3/15.0倍。我们选取伊戈尔、明阳电气、思源电气作为可比公司，金盘科技估值低于可比公司平均估值，首次覆盖，我们给予公司“增持”评级。风险提示：行业政策变动风险；境外渠道建设不及预期风险；出口政策风险；原材料价格波动风险；确认收入节奏不及预期的风险。,,华龙证券,增持,[None],2024-10-25,,增持,5799519,pdf_downloads/2024/2024-10-25/688676-金盘科技（688676）：2024年三季报点评报告：盈利能力显著提升，外销收入持续增长.pdf,688676,金盘科技,金盘科技（688676）：2024年三季报点评报告：盈利能力显著提升，外销收入持续增长
"王蔚祺,王晓声",净利润稳健增长，盈利能力持续提升。前三季度公司实现营收47.99亿元，同比+0.53%；归母净利润4.04亿元，同比+21.17%；扣非净利润3.83亿元，同比+18.89%。前三季度销售毛利率24.21%，同比+2.05pct；净利率8.34%，同比+1.38pct。三季度业绩环比大幅提升，出口占比提升提振毛利率。三季度公司实现营收18.82亿元，同比+0.15%，环比+16.82%；归母净利润1.81亿元，同比+27.54%，环比+41.86%。三季度公司销售毛利率25.53%，同比+2.75pct，环比+3.82pct，净利率9.57%，同比+2.06pct，环比+1.70pct。出口收入占比达28%，外销订单占比超40%。公司前三季度实现内销收入34.02亿元，实现外销收入13.66亿元，出口收入占比28%。截至上半年，公司在手订单65.62亿元（不含税），同比+29.88%，其中内销37.13亿元，同比-7.98%，外销28.49亿元，同比+180.16%，公司外销在手订单占比高达43.4%。持续深化海外业务，积极推进墨西哥、美国、波兰产能布局。为了进一步深化公司全球布局，公司已扩大公司在墨西哥的产能，并在墨西哥及美国做好全线产品产能扩产准备，同时欧洲已完成波兰工厂和欧洲销售及售后服务总部的布局，预计今年第四季度公司在波兰准备好产能。公司积极推进行业开拓，数据中心新增订单同比+102%。2024年以来，公司积极开拓数据中心、新基建等行业应对新能源需求增速放缓。公司凭借变压器领域突出的技术优势，产品已广泛应用于百度、华为、阿里、中国移动、中国电信、中国联通等百余个数据中心项目。前三季度公司国内数据中心新增订单同比+102%，其中9月单月订单量达1.2亿元（含税）。风险提示：海外市场开拓不及预期；原材料价格大幅上涨；行业竞争加剧。投资建议：下调盈利预测，维持“优大于市”评级。考虑到国内新能源装机增速下降、行业竞争加剧和海外市场开拓节奏，下调盈利预测。我们预计公司2024-2026年实现归母净利润6.17/8.33/10.90亿元（原预测值为6.55/10.08/13.17亿元），当前股价对应PE分别为25/19/14倍，维持“优大于市”评级。,,国信证券,优于大市,[None],2024-10-25,,买入,5799283,pdf_downloads/2024/2024-10-25/688676-金盘科技（688676）：海外业务提振盈利能力，数据中心订单大幅增长.pdf,688676,金盘科技,金盘科技（688676）：海外业务提振盈利能力，数据中心订单大幅增长
"贺朝晖,梁丰铄",公司发布2024年三季报，前三季度实现营收47.99亿元，同比+0.53%；实现归母净利润4.04亿元，同比+21.17%。Q3单季度，公司实现营收18.82亿元，同比+0.15%，环比+16.82%；实现归母净利润1.81亿元，同比+27.54%，环比+41.86%。订单结构优化推动盈利能力提升2024Q3单季度，公司销售毛利率为25.53%，同比提升2.75pct，环比提升3.82pct；公司销售净利率为9.57%，同比提升2.06pct，环比提升1.70pct。公司盈利能力提升，主要有两方面原因：1）公司优质订单比例增加，第三季度外销收入占比约31%；2）持续加大对应收账款和存货的管理，信用减值损失和资产减值损失较上年同期下降，并受益于进项税额加计等因素。持续加大全球化产能布局公司进一步扩大墨西哥产能，并为美国产能扩产做好准备；在欧洲市场已完成波兰工厂和欧洲销售及售后服务总部的布局，公司预计2024Q4准备好波兰产能，为公司进一步拓展海外市场，降低单一市场依赖奠定基础。数据中心产品有望开启新增长在数据中心领域，公司的变压器产品已广泛应用于百度、华为、阿里巴巴、中国移动、中国电信、中国联通等百余个数据中心项目。2024年1-9月，公司国内数据订单量实现了102%的同比增长，其中9月单月订单量达1.2亿元（含税）。海内外数据中心建设有望加速，或开启公司新的增长点。盈利预测、估值与评级公司国内新能源业务收入下滑，我们下调盈利预测，预计公司2024-2026年营业收入分别为71.94/88.70/106.78亿元，同比增速分别7.89%/23.31%/20.38%；归母净利润分别为6.18/8.27/10.93亿元，同比增速分别为22.38%/33.87%/32.24%；EPS分别为1.35/1.81/2.39元，3年CAGR为29.40%。鉴于公司海外订单快速增长，盈利能力有望提升，公司全球化布局有望降低对单一市场的依赖，维持“买入”评级。风险提示：1）海外政策变化影响国产电力设备出口；2）行业竞争加剧；3）原材料价格大幅波动；4）海外建厂的风险。,,国联民生证券,买入,[None],2024-10-23,,买入,5796877,pdf_downloads/2024/2024-10-23/688676-金盘科技（688676）：2024Q3订单结构持续优化，利润率明显提升.pdf,688676,金盘科技,金盘科技（688676）：2024Q3订单结构持续优化，利润率明显提升
"韩晨,李昂",事件：2024年第三季度，公司实现营业收入18.8亿元，同比增长0.2%；实现归母净利润1.8亿元，同比增长27.5%；扣非归母净利润1.7亿元，同比增长26.7%。2024年1-9月，公司累计实现营业收入48亿元，同比增长0.5%；实现归母净利润4亿元，同比增长21.2%；扣非归母净利润3.8亿元，同比增长18.9%。盈毛利率与净利率进一步提升，费用率略有增长。盈利端：2024前三季度公司销售毛利率/净利率分别为24.2%/8.3%，同比+2.0pp/+1.4pp；24Q3毛利率/净利率分别为25.5%/9.6%，分别同比+2.7pp/+2.1pp，主要系公司优质订单比例增加，同时公司持续加大对应收账款和存货管理，信用减值损失和资产减值损失同比下降，并且进项税额端受益。费用端：公司2024前三季度销售/管理（不含研发）/财务费用率分别为4.0%/5.2%/1.0%，分别同比+0.7pp/+1pp/+0.5pp。此外，因公司优质客户和订单比例提升，前三季度公司经营活动净现金流-0.9亿元，同比增长1.5亿元，现金流有所改善。高度重视股东回报、增强现金分红。公司公告增强股东分红“提质增效重回报”行动方案，在保证公司正常经营和长远发展的前提下，公司2024年度以现金方式分配的利润应超过当年实现的可供分配利润的40%，将进一步推动公司高质量发展和投资价值提升。海外变压器需求高景气、公司加速放量。前三季度公司外销收入13.7亿元，收入占比28.6%，相较半年报的27%进一步提升。目前海外尤其欧美变压器需求具备可持续性，公司作为干式变压器龙头，持续实现产品的横纵扩张，海外除风电外，光伏、数据中心、配电等变压器处于加速起量阶段。公司已扩大公司在墨西哥的产能，并在墨西哥及美国做好全线产品产能扩产准备，同时欧洲波兰工厂预计将于2024年四季度投产，有望充分受益欧美新能源等建设需求。此外，公司变压器系列产品已广泛应用于百度、华为等IDC项目，前三季度公司国内数据中心订单量同比增长102%。盈利预测与投资建议。预计公司2024-2026年营收分别为71.8亿元、90.6亿元、107.7亿元，未来三年归母净利润增速分别为22.4%/39.1%/18.9%。公司加速进行数字化转型升级、积极拓展储能业务市场，业绩有望稳定增长，维持“持有”评级。风险提示：新能源装机不及预期的风险；原材料价格上涨风险；汇率波动影响公司海外业务营收的风险；储能及数字化业务建设及产能释放不及预期的风险。,,西南证券,持有,[None],2024-10-23,,增持,5796415,pdf_downloads/2024/2024-10-23/688676-金盘科技（688676）：盈利能力同环比增长，外销占比进一步提升.pdf,688676,金盘科技,金盘科技（688676）：盈利能力同环比增长，外销占比进一步提升
