author,content,filename,org_name,original_rating,pdf_link,publish_time,rating_adjust_mark_type,rating_changes,report_id,save_path,stock_code,stock_name,title
"邓健全,徐国铨",事件：公司发布2024年业绩预增公告，公司预计2024年归母净利润为14.2亿元~15.6亿元，同比+40.9%~+54.8%，预计扣非净利润为13.9亿元~15.3亿元，同比+43.4%~+57.4%。点评：2024年业绩实现高增。公司预计2024年归母净利润为14.2亿元~15.6亿元，同比+40.9%~+54.8%，预计扣非净利润为13.9亿元~15.3亿元，同比+43.4%~+57.4%。据我们测算，预计公司24Q4实现归母净利润3.4亿元~4.8亿元，同比+64.6%~+132.5%；实现扣非归母净利润3.4亿元~5.1亿元，同比+68.5%~+135.5%。公司四季度及全年业绩实现高增，主要因公司稳步推动全球化战略部署，积极开拓新市场，不断扩大产品市占率，规模效益得到进一步提升。中大排摩托加速渗透，春风动力市占率领先。根据中国摩托车商会数据，2024年全行业完成燃油摩托车产销1656.5万辆和1645.6万辆，同比增长13.9%和13.0%，其中大排量休闲娱乐摩托车（排量250cc以上，不含250cc）产销77.4万辆和75.7万辆，同比增长49.7%和43.0%。根据中汽数据中心数据，春风动力2024年>250cc两轮燃油车实现销量8.3万辆，在200cc以上的跨骑和踏板车市场中，春风动力以11.4万辆上牌数量位列首位。全地形车出海步伐加速。截至2024年9月，春风动力已经覆盖了全球100多个国家和地区，拥有超过4000家经销商网点；2024年10月春风动力迎来第100万辆全地形车下线。在海外，春风动力连续10年以上蝉联欧洲主要市场全地形车占有率第一；在美国的市占率逐年提升。2024年上半年，公司全地形出口额占国内产品出口额71.75%。2024年11月，全地形终极旗舰ZFORCE Z10、全地形概念车CFORCE VISION GEN4亮相EICMA展会，我们看好公司全地形车矩阵进一步扩充带来海外需求向好。盈利预测：公司中大排摩托市占率稳步提升，全地形车海外供需两旺，我们看好公司出口与高端化双轮驱动带来的量价齐升机遇。我们预计公司2024-2026年归母净利润分别为16亿元、19亿元和22亿元，对应EPS分别为10.3、12.5、14.6元，对应PE分别19倍、16倍、13倍。风险因素：原材料价格波动、新能源客户销量不及预期、新业务拓展不及预期。,,信达证券,,[None],2025-01-25,,,5906343,pdf_downloads/2025/2025-01-25/603129-春风动力（603129）：中大排摩托市占率领先，全地形车高端化提速.pdf,603129,春风动力,春风动力（603129）：中大排摩托市占率领先，全地形车高端化提速
"宋亭亭,陈诗慧","公司发布24年业绩预增公告：24年归母净利14.2~15.6亿元，同比+40.9%~54.8%；扣非净利13.9~15.3亿元，同比+43.4%~57.4%。业绩表现超出我们此前预期的13.6亿元，或因出口盈利释放、汇兑/政府补贴增厚净利。我们继续看好公司两轮、四轮车新品发力，内销、出口共同成长，维持“买入”评级。Q4内销稳健出口快增，汇兑及政府补贴或增厚净利公司24Q4实现归母净利3.4~4.8亿元，同比+64.6%~132.6%，环比-9.1%~28.5%，我们认为业绩亮眼表现或系：1）营收端，Q4摩托内销稳健，海外补库需求推动出口快增。公司摩托Q4总销量同环比分别-9%/ +101%，出口销量同环比+73%/76%，尤其250cc+大排量出口同环比+122% /57%；2）利润端，大排量摩托占比进一步提高，以及全地形车新品开始贡献增量后拉动盈利结构优化；3）Q4汇兑损益及政府补贴增厚净利。25年两轮产品大年，大排、通路、电自齐发力24年春风大排量摩托产品矩阵不断扩张，接连发布四缸500VOOM、三缸675SR等新品，450等强势平台持续发力，带动公司份额向上——全年250cc+摩托批销份额达19.8%，同比+4.6pct，升至行业第一。25年公司或继续加大250cc+大排量新品投放，包括ADV车型700MT、800MT-X，多缸街车675NK等,有望进一步巩固、扩大国内外市场占有率。同时公司还将在通路车和踏板领域积极推新，并加快电动车子品牌极核的渠道建设，高端电自有望成为公司又一增长点。看好全地形车新品增量，全球产能应对关税风险24年公司全地形车销量（摩托车商会口径）同比+28.8%至17.5万辆，并于8月在美国发布U10 PRO/ Z10新品，新品配置升级，性能、实用性均显著增强，较北美品牌竞品具备价格及配置优势。产能方面，公司四轮业务全球布局，中国、墨西哥、泰国三地工厂使公司应对关税风险拥有灵活腾挪空间。我们看好新品25年全年交付后贡献可观增量，高端UZ系列拉动四轮业务盈利向好。盈利预测与估值考虑到公司摩托、全地形车、电自新品周期均强，出海和高端化进程有望提速，我们上调公司24-26年归母净利9.3%/10.5%/12.8%至14.9/18.8/23.6亿元（前值13.6/17.0/20.9亿元）。可比公司25年Wind一致预期PE均值为21.7x（前值18.1x），我们给予公司25年21.7xPE，目标价268.86元（前值202.90元，目标价上调主因盈利预期调整及可比估值提升），维持“买入”。风险提示：新品销量不及预期，汇率与海运费波动的风险。",,华泰证券,买入,[None],2025-01-24,,买入,5906026,pdf_downloads/2025/2025-01-24/603129-春风动力（603129）：Q4业绩超预期，内销出口共振向上.pdf,603129,春风动力,春风动力（603129）：Q4业绩超预期，内销出口共振向上
"崔琰,姜煦洲","春风动力(603129)事件概述：公司披露2024年度业绩预告，公司预计2024年全年实现归母净利润14.2~15.6亿元，同比+40.9%~+54.8%，扣非净利润为13.9~15.3亿元，同比+43.4%~+57.4%2024Q4业绩同比翻倍摩托车与全地形车共振向上超市场预期。公司预计2024Q4归母净利润为3.4~4.8亿元，中枢为4.1亿元，同比+98.7%，环比+9.8%；扣非净利润为3.4~4.8亿元，中枢为4.1亿元，同比+102.3%，环比13.0%。主要原因为：1）摩托车业务：内外销共振向上，2024Q4单季度销量为8.1万辆，同比+100.6%，产品结构持续优化，中大排量摩托车（＞250cc，不含250cc，下同）销量占比为65%，同比+17pcts，环比+6pcts；2）全地形车：高端化新品于2024年8月发布，产品矩阵扩充带动公司全地形车2024年11/12月度销量突破2万辆，并创历史新高，贡献可观业绩增量；3）汇兑：2024Q4美元升值，美元/人民币指数涨幅约为4.0%，考虑到公司北美业务占比约为4成（2023年），我们认为将产生一定汇兑收益增厚利润。中大排摩托车发展提速全地形车新品周期强劲。1）中大排摩托车：据中国摩托车商会数据，公司2024年中大排摩托车销量15.0万辆，同比+88.4%，市场份额（批发口径）提升至19.8%，较2023年全年+4.6pcts，位居国内中大排行业头名；此外，公司摩托车出口表现亮眼，2024年实现外销12.6万辆，同比+66.6%，发展提速。公司凭借出色的外观设计能力、优异的产品性能，在海外市场不断开辟新空间，推动业务稳步扩展。2）全地形车：全地形车海外需求持续回暖，2024年公司全地形车累计销量17.5万辆，同比+28.8%；2024H2公司针对北美市场推出U10/Z10系列高性能高端新品，产品矩阵扩充带动公司全地形车2024年末月度销量创历史新高，看好公司依靠产品线扩充、性价比优势持续提升市场份额，打开成长空间。股权激励绑定核心人才保障公司长远发展。2024Q3公司发布2024年股票期权激励计划（草案）：拟授予激励对象的股票期权数量为355.0万份，首次授予激励对象共计1,310人，主要包括核心管理及技术人员。公司层面业绩考核要求为2024年营收不低于140亿元；2024-2025年累计营收不低于305亿元；2024-2026年累计营收不低于505亿元。我们认为公司此举有助于吸引和留住优秀人才，充分调动核心人员积极性，保障公司长期发展。投资建议：长期看好公司摩托车车出口和全地形车高端化布局，调整盈利预测，我们预计公司2024-2026年营收152.8/191.1/231.9亿元，归母净利润14.8/18.8/23.2亿元，EPS为9.78/12.40/15.35元。对应2025年1月23日187.70元/股收盘价，PE分别19/15/12倍，维持“推荐”评级。风险提示：公司核心产品销量不及预期；摩托车市场竞争加剧；汇率波动等。",,民生证券,推荐,[None],2025-01-24,,增持,5905519,pdf_downloads/2025/2025-01-24/603129-春风动力（603129）：系列点评七：2024年业绩超预期，两轮出海+四轮高端化共振.pdf,603129,春风动力,春风动力（603129）：系列点评七：2024年业绩超预期，两轮出海+四轮高端化共振
"何俊艺,刘欣畅,毛䶮玄,白臻哲","公司盈利预测及估值指标2022A2023A2024E2025E2026E营业收入（百万元）11,37812,11014,50017,37820,322增长率yoy%45%6%20%20%17%归母净利润（百万元）7011,0081,3791,6571,942增长率yoy%70%44%37%20%17%每股收益（元）4.636.659.1110.9412.82每股现金流量11.219.1412.0215.0416.65净资产收益率18%22%21%20%19%P/E35.224.517.914.912.7P/B5.94.93.83.12.5备注：股价截止自2024年11月01日收盘价，每股指标按照最新股本数全面摊薄报告摘要事件。公司发布24Q3季报，24Q3实现营收39.2亿，同环比+36.1%/-12.2%，归母净利润3.73亿，同环比+49.0%/-13.6%，扣非归母净利润3.63亿，同环比+46.6%/-12.6%。下游需求推动营收稳步增长，促盈利持续超预期。公司发布24Q3季报，24Q3实现营收39.2亿，同环比+36.1%/-12.2%，归母净利润3.73亿，同环比+49.0%/-13.6%，扣非归母净利润3.63亿，同环比+46.6%/-12.6%，毛利率31.57%，环比+0.75pct，下游需求推动营收稳步增长，促进盈利持续超预期。国际赛事获誉不断，巩固两轮车行业龙头地位。公司积极投身国际顶尖赛事，以赛事拉动品牌建设，2022年正式征战世界最顶级摩托车赛事，成为登陆MOTOGPMoto3250CC级别比赛首家中国厂商，2024年上半年卡塔尔站首站夺冠，赢得MotoGP这一顶级摩托车系列赛75年历史上，第一座属于中国制造商的冠军奖杯，2024年上半年MOTOGPMoto3春风动力捷报迭传，九战六冠；打造以春风为代表的特色机车运动文化。全地形车已连续多年位居国产品牌出口额第一，2024年上半年全地形车出口额占国内同类产品出口额71.75%；美国市场占有率持续提升，欧洲市场市占率位列第一；摩托车专注于250CC及以上中大排量车型，>250CC跨骑式摩托车销量稳居行业前列，巩固行业龙头地位。盈利预测：我们预计24-26年公司营收分别为145/174/203亿元，同比增速分别+20%/+20%/+17%；基于公司下游需求持续推动盈利能力提升，我们将24-26年归母净利润预测由12.7/15.7/19.4亿元调整为13.8/16.6/19.4亿元，同比增速分别+37%/+20%/+17%；维持“买入”评级。风险提示：汇率、运费等海外扰动因素导致盈利不及预期，海外需求不及预期，海外工厂产能爬坡或经营不及预期，研究报告中使用的公开资料可能存在信息滞后或更新不及时的风险等。",,中泰证券,买入,[None],2024-11-04,,买入,5817893,pdf_downloads/2024/2024-11-04/603129-春风动力（603129）：两轮车内外需求推动营收稳步增长，促进盈利持续超预期.pdf,603129,春风动力,春风动力（603129）：两轮车内外需求推动营收稳步增长，促进盈利持续超预期
"秦一超,杨家琛",公司发布2024年三季报，24Q3实现营收39.2亿元，同比+36.1%；实现归母净利润3.7亿元，同比+48.95%；实现扣非归母净利润3.6亿元，同比+46.6%；利润端超出市场预期。评论：24Q3营收增速环比继续提升，预计主要系两轮收入高增。公司24Q1、24Q2营收增速分别为6.3%、23.2%，24Q3营收增速环比继续保持提升趋势，同比增长36.1%，我们预计主要系两轮车在Q3旺季有亮眼表现。根据摩托车商会数据，24年7-8月，公司两轮合计出货5.5万辆、同比高增94%，其中内销出货4.1万辆、同比高增156%，出口出货1.4万辆、同比增长12%；内销方面，Q3国内销售旺季及渠道库存基数较低，公司新品表现亮眼，极核电动业务预计快速放量，拉动内销出货高增；Q3两轮出口增速略有回落，我们预计主要系欧5+法规切换进度影响，后续认证完成后两轮出口增速有望环比回升。四轮车方面，预计Q3收入增速环比Q2继续提升，8月底公司在美国推新四轮车新品，预计将在Q4有亮眼出货表现。24Q3毛利率环比提升，销售管理研发费用率压缩利润高增。公司24Q3实现归母净利润3.7亿元，同比增长48.95%，利润端表现超出此前市场预期，主要系毛利率环比提升及费用端压缩。毛利率方面，公司24Q3毛利率为31.6%，环比提升0.8pct，我们预计主要系产品结构影响，Q3毛利率较高的四轮车占比提升。费用率方面，24Q3公司销售、管理、研发、财务费用率同比分别-2.8、-1.7、-1.5、+2.5pct，最终实现归母净利率9.5%、同比+0.8pct，销售费用率同比大幅收窄主要系北美促销费下降，管理及研发费用率同比下降主要系公司优化费用利用效率。展望后续，我们预计公司四轮车新品将驱动产品结构改善，盈利能力有望保持提升趋势。四轮新品打开高增空间，极核电动加速扩张。8月底公司在美国发布U10/U10Pro等四轮车新品，预计将在后续有亮眼出货表现，持续拓展中高端市场份额。极核在推出AE2、AE4系列产品后，Q3预计加速成长；电动两轮产品新规发布后，我们预计极核电动国内产品及渠道将加速拓展，海外市场也将贡献新成长增量。投资建议：公司为动力运动装备行业龙头，自主研发及自建渠道能力构建优质自主品牌α，三大增量驱动公司持续成长。两轮出口维持高景气度，四轮新品有望打开中高端市场空间。我们调整公司24/25/26归母净利润预测为13.0/16.8/22.7亿元（前值12.9/16.8/22.7亿元），24-26年对应PE分别为19/15/11倍。采用DCF估值法，调整目标价为204元，对应25年估值为18.4倍，维持“推荐”评级。风险提示：贸易政策风险、新品效果不及预期、终端需求不及预期。,,华创证券,推荐,[None],2024-11-03,,增持,5815169,pdf_downloads/2024/2024-11-03/603129-春风动力（603129）：2024年三季报点评：24Q3营收增长加速，利润超预期.pdf,603129,春风动力,春风动力（603129）：2024年三季报点评：24Q3营收增长加速，利润超预期
"黄细里,孟璐",公告要点：2024Q3公司营业总收入为39.21亿元，同环比分别+36.1%/-12.2%；实现归母净利润3.73亿元，同环比分别+48.9%/-13.6%；实现扣非归母净利润为3.63亿元，同环比分别+46.6%/-12.6%。春风动力Q3业绩超预期：1）营收端：Q3公司营收实现同比实现大幅增长，主要原因为公司四轮新品周期强劲&两轮内外销同比增长。2）毛利率：公司Q3毛利率为31.57%，同环比分别-2.1/+0.8pct，环比提升主要来自四轮业务贡献。3）费用端：Q3公司销售/管理/研发费用率分别为8.53%/3.27%/6.95%，同比分别为-2.7/-1.7/-1.5pct，环比分别-0.7/-1.4/+0.9pct。同比下滑明显，其中由于对市场促销费进行整体控制，同时Q3促销重心逐步转向24款车型，力度降低，因此销售费用率同环比改善明显。财务费用方面，由于Q3人民币升值公司产生汇兑损失。4）最终公司Q3实现3.73亿归母净利润，同环比分别+48.9%/-13.6%。销售净利率为9.74%，同环比分别+0.6/-0.4pct。盈利预测与投资评级：公司Q3业绩超预期，新品有望持续放量，我们上调公司2024/2025/2026年归母净利润预期至13.6/16.8/19.5亿元（原为11.9/15.4/19.3亿元），对应PE为17/14/12倍。鉴于公司摩托车业务依托出色的产品力+品牌力成功把握国内消费升级新趋势，借全地形车经验及渠道，出海进展顺利；研发+产品+渠道三轮驱动全地形车全球市占率稳步攀升。我们仍然维持“买入”评级。风险提示：全球贸易环境不稳定风险；新车型上量不及预期风险；运价/汇率等波动风险等。,,东吴证券,买入,[None],2024-10-23,,买入,5796097,pdf_downloads/2024/2024-10-23/603129-春风动力（603129）：2024年三季报点评：业绩超预期，费用率同比改善明显.pdf,603129,春风动力,春风动力（603129）：2024年三季报点评：业绩超预期，费用率同比改善明显
"唐旭霞,唐英韬",摩托车业务快速增长，全地形车业务保持稳健，2024Q3收入同比增长36%。春风动力2024Q3年实现营收39.2亿元，同比增长36.1%，环比下降12.2%，归母净利润3.7亿元，同比增长48.9%，环比下降13.6%。2024H1公司全地形车累计销售8.14万台，实现销售收入35.32亿元，同比下降1.55%，行业下行背景下公司保持稳健发展。2024H1公司实现两轮摩托内销6.8万台，营业收入14.46亿元，同比增长38.25%，公司通过精准的市场定位和有效的营销策略，市场表现优于行业水平；2024H1公司实现两轮摩托外销8.58万台，营业收入18.02亿元，同比增长45.07%，公司在海外市场不断开辟新空间。四轮车库存水平下降，叠加内部降本增效，促进公司2024Q3盈利能力提升。公司盈利能力提升得益于公司的费用率下降，公司从2023年开始促销去库存，四轮车库存水平下降至相对合理位置，销售费用率环比持续改善；此外公司内部也在积极推进降本增效，管理费用率有所下降。2024Q3公司毛利率达到31.6%，同比-2.1pct，环比+0.8pct，销售净利率达到9.7%，同比+0.6pct，环比-0.3pct。高端新品上市，开启全地形车新时代。2024年公司迎来产品大年，根据公司北美官网，2024年年初公司推出三款新品，分别是CFORCE800TOURING、CFORCE1000TOURING、ZFORCE950Sport4，增强在ATV领域的竞争力，拓展SSV产品线。2024H2U10PRO/U10XLPRO/Z10/Z10-4等多款重磅新品上市，开启全地形车新时代，新品较原有产品的动力性大幅提升，丰富产品矩阵，较头部竞争对手进一步缩小性能差距，公司有望凭借新品在高端领域实现向上突破。进入两轮摩托新品周期，有望持续推出爆款产品。公司具备打造爆款的丰富经验，拥有强大销售网络及知名度，建立起两轮摩托车领域深厚的护城河。近年来公司两轮摩托新品上市节奏提速，2024年推出150SC/450MT/500SRVOOM/675SR-R等产品，有望拉动国内市占率提升。积极拓展摩托车出口，打开长期成长空间。公司摩托车出口主要集中于欧洲、北美等地，公司持续在海外各国导入摩托车产品，在美国、欧洲等市场进行了相应的产品布局，在美国官网上推出街车、仿赛、ADV、mini、巡航太子等众多车型。公司摩托车产品在海外市场上较竞争对手具备较高性价比优势，摩托车外销有望迎来较快发展。盈利预测与估值：上调盈利预测，维持“优于大市”评级。公司摩托车及全地形车业务均具备较高成长性，预期24/25/26年归母净利润为13.71/16.99/21.02亿元（原24/25/26年13.08/16.35/20.43亿元），8.64/10.80/13.49元），对应PE分别为17/13/11倍，维持“优于大市”评级。风险提示：新车上市节奏及销量不及预期；汇率、运费等外部环境波动；中美贸易环境变化；库存水平过高。,,国信证券,优于大市,[None],2024-10-19,,买入,5792243,pdf_downloads/2024/2024-10-19/603129-春风动力（603129）：三季度净利率同比提升，出海、高端化引领新成长.pdf,603129,春风动力,春风动力（603129）：三季度净利率同比提升，出海、高端化引领新成长
"佘炜超,孟欣",事件：2024年10月17日，公司发布2024年三季报。前三季度公司实现营业收入114.5亿元，同比+21.98%，归母净利润10.81亿元，同比+34.87%；扣非归母净利润10.5亿元，同比+36.74%。单季度看，3Q2024，公司实现营业收入39.21亿元，同比+36.11%，归母净利润3.73亿元，同比+48.95%；扣非归母净利润3.63亿元，同比+46.62%。销售净利率位于历史高位区间，在手订单饱满。3Q2024公司销售毛利率和净利率分别为31.57%和9.74%，同比变动-2.1pct和+0.64pct，环比分别+0.75pct和-0.34pct。公司利润率位于历史高位区间，我们预计主要系费用管控合理、产品结构持续优化所致。在手订单方面，截至2024年Q3，合同负债2.43亿元，同比+56.20%，在手订单饱满，夯实业绩增长基础。全地形车结构优化，高价值产品U/Z占比持续提升。2023年全球销量95.5万辆，同比+1.1%，主要集中于北美（占比84.3%），且产品结构逐步优化，高价值量U/Z系列产品占比逐渐提升（由2018年的59%至2023年的65%）。历史上行业由外资寡头垄断，2018年行业CR5=80%+，公司在疫情影响海外产能之际，快速铺开产品实现破局。2024年去库周期基本结束，公司经营周期拐点已至。展望未来，公司持续推出新品，拓展产品谱系，有望搭乘北美行业迎来周期拐点东风，在海外产能加速落地条件下加速渗透率提升。盈利预测：我们预计 2024-2026 年公司实现归母净利润分别为 13.62/16.97 /21.13亿元，对应PE分别为17/14/11x，维持“增持”评级。风险提示：摩托车市场竞争加剧；公司新品销量不及预期；海运费波动；汇率波动等。,,财通证券,增持,[None],2024-10-18,,增持,5791751,pdf_downloads/2024/2024-10-18/603129-春风动力（603129）：业绩超预期，期待后续四轮车发力.pdf,603129,春风动力,春风动力（603129）：业绩超预期，期待后续四轮车发力
"宋亭亭,陈诗慧",24Q3归母净利3.7亿元，同比+49%公司发布三季报，前三季度累计实现营业收入114.5亿元，同比+22%；归母净利润10.8亿元，同比+34.9%；Q3实现营收39.2亿元，同比+36%，环比-12.2%，实现归母净利3.7亿元，同比+48.9%，环比-13.6%，超出我们预期（2024.10.11发布的《Q3前瞻：景气向上，交叉产业链弹性足》)。我们持续看好公司两轮、四轮车新品发力，内销、出口共同成长。维持“买入”评级。Q3营收同比高增，期待Q4两轮/四轮出口转好公司7-8月共销售摩托5.5万辆，同比增长93%；250cc+大排量摩托销量2.5万辆，同比+58%，其中出口1.0万辆，同比+29.5%；内销1.5万辆，同比增长88%。对应地，公司Q3实现营收39.2亿元，同比+36.1%。营收环比下滑12.2%，主要系季节性波动、欧洲排放标准切换等因素影响。向后展望，随着产品欧5+认证逐步完成，Q4两轮出口业务有望转好。此外公司8月末发布的U/Z系列全地形车新品产品力优势足，Q4开启交付后有望助力公司进一步提高市场份额，贡献利润增量。销售/管理费用率环比改善，推动净利表现超预期24Q3公司毛利率环比+0.8pct至31.6%，主要系四轮/两轮车产品结构调整所致，随大排量新品的丰富，盈利结构有望持续优化。费用端，公司Q3 销售费率8.5%，同环比-2.8/-0.7pct，或系市场促销投放力度有所控制；管理费率优化，同环比分别-1.7/-1.4pct 至3.3%；同时公司持续投入新平台开发，Q3研发费率6.95%，同环比-1.5/+0.9pct。财务费率则同环比+2.6/2.4pct，主要系汇兑波动影响。最终公司Q3实现归母净利3.7亿元，同比+48.9%。发布新一轮股权激励计划，充分调动员工积极性24年9月2日，公司发布2024年股权激励计划（草案），计划拟授予激励对象的股票期权数量355万份，行权价格为106元。计划首次授予激励对象包括核心管理及技术人员1310人。分别对三个行权期设立营收考核目标，计划2024年营收不低于140亿元；2024-2025年累计营收不低于305亿元；2024-2026年累计营收不低于505亿元。本次股权激励计划彰显公司持续发展信心，有助于公司充分调动员工积极性，完成经营目标的实现。维持“买入”评级，目标价202.90元维持前次预测，预计公司24-26年归母净利分别为13.6/17.0/20.9亿元，可比公司25年Wind一致预期PE均值为18.1倍，我们给予公司25年18.1倍PE，目标价202.90元（前值192.39元），维持“买入”。风险提示：新品销量不及预期，汇率与海运费波动的风险。,,华泰证券,买入,[None],2024-10-18,,买入,5791305,pdf_downloads/2024/2024-10-18/603129-春风动力（603129）：Q3净利超预期，出海成长势能延续.pdf,603129,春风动力,春风动力（603129）：Q3净利超预期，出海成长势能延续
