author,content,filename,org_name,original_rating,pdf_link,publish_time,rating_adjust_mark_type,rating_changes,report_id,save_path,stock_code,stock_name,title
"杨森,郑武","上半年业绩略低于预期

2012年1~6月公司主营收入273.64亿，同比下降24.98%；归属上市公司股东净利润9.34亿，同比下降66.74%。EPS为0.35元/股，略低于我们的预期。

集装箱业务将季节性下行

由于欧洲经济持续衰退，上半年我国出口集装箱运价指数从5月18日的年内最高点1336点下行至8月14日的1257点。上海和深圳两个集装箱大港7月份吞吐量同比分别下滑1.7%和2.3%。集运行业在3季度未表现出明显的旺季特征。我们判断集装箱制造行业订单和箱价也将在3季度中后期进入季节性下降。

海工业务显著减亏，订单、研发和生产进入良性轨道

上半年海工业务营业收入同比大增440.93%至12.45亿元，亏损大减74.75%至1.47亿元。目前公司年产能为自升式和半潜式平台各3座，在手订单包括半潜式平台2座和自升式平台5座，合16.8亿美元，产能利用率较充分。公司产品已逐步获得国际主流市场认可，批量化制造的模式有助于未来大幅提升毛利率。我国南海和欧洲北海将为公司提供广阔的市场空间。

长期受益于天然气消费增长，LNG重卡产业链成型

公司上半年能源（天然气）装备业务实现营业收入24.36亿元，同比增21.05%。公司目前已形成包含LNG车载瓶、LNG/CNG加气站和LNG重卡整车在内的完整LNG重卡产业链布局，且在各环节均处于业内领先地位，料将长期取得高于行业的增速。

风险提示

国内外经济增速低于预期将对集装箱和车辆业务产生较大影响。

战略规划积极进取，未来业绩有望快速提升，维持“推荐”评级

公司初步规划至2017年实现营业收入1500亿，净利润100亿元，相当于业绩年复合增速达38%。我们调整12~14年EPS预测为0.76（-20%）、0.89（-35%）和1.30元/股，对应PE为13.8、11.8和8倍。公司集装箱业务旺季盈利向上弹性大，能化和海工等新业务稳健快速发展，公司当前股价具备长期投资价值，维持“推荐”评级。",,国信证券,推荐,[None],2012-08-28,,增持,578501,pdf_downloads/2012/2012-08-28/000039-中集集团(000039)2012年中报点评：海工显著改善，LNG重卡产业链成型.pdf,000039,中集集团,中集集团(000039)2012年中报点评：海工显著改善，LNG重卡产业链成型
"肖群稀,徐才华","收入利润同比大幅下滑。上半年公司实现营业收入273.64亿元，同比下降24.98%；归属于母公司股东的净利润9.34亿元，同比下降66.74%，EPS为0.35元。

集装箱业务将长期处于底部。上半年集装箱业务实现营业收入136.71亿元，同比下降37.65%。净利润8亿元人民币，同比下降72.57%。第一季度集装箱市场需求疲弱，第二季度进入相对旺季，干货箱箱价触底回升，6月底接近2600美元/标准箱。但由于去年第二季度基数偏高，同比仍大幅下降。受欧债危机持续和全球主要经济体复苏放缓的影响，集装箱业务短期内难以走出低迷，但上半年集运业的配箱系数已到相对较低水平，未来进一步恶化可能性不大。

车辆业务筑底。受到国内经济增速减缓的影响，车辆业务销售收入68.21亿元，同比下降29.62%；净利润8602万元，同比下降75.03%。上半年国内市场需求放缓，海外市场，特别是北美市场复苏强劲。预计下半年国内市场需求将逐渐筑底，海外市场将继续回升，公司在海外的市场份额有望继续提升。

对能化装备业务前景保持乐观态度。上半年收入45.21亿元，同比增长21.14%。其中天然气装备收入24.36亿元，同比增长21.05%。受益于天然气气源供应及消耗的快速增长，国内天然气储运装备及工程、低温装备、罐式集装箱需求旺盛。上半年中集安瑞科进一步扩大能源装备产能，在石家庄兴建轻量化缠绕瓶生产线，扩充张家港LNG装备及荆门LPG装备生产能力。下半年，石家庄、廊坊及安徽蚌埠新生产线将逐步投产。未来将重点发展低温储罐、加气站项目、中小型液化、石化气体储存、气体处理项目，化工球罐及核能特种容器。

海工业务大幅减亏，在手订单充足。上半年，海工业务实现收入12.45亿元，同比增长441%，亏损1.47亿元，同比减少74.75%。实现减亏的主要原因是：上半年实现了自建的自升式平台的销售，为中海油服欧洲钻井公司建造的第3座深水半潜式钻井平台交付。目前中集来福士在手订单超过16.8亿美元，其中包括半潜式钻井平台2座、自升式平台5座、半潜运输船2艘。随着订单的逐渐交付，2014年海工业务实现转亏为盈的概率较大。

机场设备业务交付推迟导致收入确认少。上半年机场设备业务收入同比下滑51%，主要原因是大量产品完成生产后，尚未完成现场安装和交付，收入确认较少。上半年取得的登机桥订单主要来自海外市场。机场行李系统、民用物流货库、立体停车库及登船桥方面也获得较多国内订单。随着国外航空业持续复苏和国内航空业的持续增长，预计下半年订单的安装和交付，预计全年机场设备业务将有一定幅度的增长。

维持“中性”投资评级。我们认同中集的发展战略，看好能源和海工业务的发展前景，但短期受累于集装箱和车辆业务。预计公司2012~2014年EPS为0.8、1.04和1.41元，2012~2014年动态PE为13.2、10和7.4倍。",,华泰证券,中性,[None],2012-08-28,,中性,578551,pdf_downloads/2012/2012-08-28/000039-中集集团(000039)2012年中报点评：受累于传统业务，看好能源、海工装备.pdf,000039,中集集团,中集集团(000039)2012年中报点评：受累于传统业务，看好能源、海工装备
"罗立波,董亚光","业绩简评

中集集团上半年实现营业收入27,364百万元，同比减少24.98%；归属母公司股东的净利润934百万元，同比减少66.74%，EPS为0.35元。据此测算，2季度营业收入同比减少22.70%，净利润同比减少61.47%，EPS为0.21元。公司2季度业绩环比改善，但改善幅度低于预期，主要因为车辆业务受宏观经济环境影响，其需求持续下滑。

经营分析

集装箱业务淡旺季节分明：

干货箱：上半年累计销量55.78万标箱，同比下降42.9%，其中，1-2季度销量分别为16.84万标箱、38.94万标箱，预计3季度销量仍有望达到35万标箱以上，但4季度将明显回落。从季度分布看，今年集装箱的淡旺季分明，旺季的需求集中、价格向好，利润贡献明显。

冷藏箱上半年销售8.15万标箱，比上年同期下降7.9%；特种箱上半年销售3.30万台，比上年同期下降22.5%。冷藏箱和特种箱需求通常波动较小，但随着国内外经济调整幅度加深，2季度也出现明显下滑。

上半年，公司集装箱业务实现营业收入13,671百万元，较去年同期下降37.6%；净利润800百万元，同比下降72.6%。从分季度看，由于钢材价格处于低位，集装箱订造价格回升、生产规模扩大，2季度集装箱业务的利润环比改善明显。

道路运输业车辆：受到国内经济增长放缓影响，公司道路运输车辆上半年累计销售5.35万台，同比下降39.7%；销售收入6,821百万元，同比下降29.6%，净利润为86百万元。同比下降75.0%。从分季度看，由于国内需求疲软，2季度的销量、收入、利润降幅都扩大明显。由于当前经济调整幅度较深，基建、物流、制造业投资形势不佳，下半年需求难有积极变化。

公司持有45%权益的集瑞联合重工上半年实现销售收入超过3亿元，但仍处于亏损阶段，目前主要是利用股东方资源、针对行业大客户，积极推广战略产品LNG重卡（与能源化工业务板块在LNG装备领域的优势结合起来）。

能源、化工、食品装备及服务业务：上半年实现营业收入4,521百万元，同比增长21.1%；净利润257百万元，同比增长3.7%。我们注意到，中集安瑞科上半年的营业收入为3,829百万元，净利润达到373百万元，这表明该业务板块除去安瑞科的其他子公司（TGE、大连重化、南通大罐等）合计为亏损状况。为了应对天然气装备需求的持续增长，中集安瑞科加快产能建设，下半年，石家庄、廊坊及安徽蚌埠新厂房的生产线将逐步投入运营，进一步巩固在天然气装备全产业链的优势地位。

海洋工程业务：上半年实现收入12.45亿元，同比增长超过4倍；亏损额为1.47亿元，同比减少74.8%。中集来福士目前在手订单金额超过16.8亿美元，其中包括半潜式钻井平台2座、SuperM2自升式钻井平台3座，JU2000E自升式钻井平台2座、半潜运输船2艘，此外还有部分意向性订单。由于中集来福士前期交付产品的运行状况良好，并积累了大量的建造经验，市场竞争力得到了初步确认，下半年其订单进展值得期待。除前述订单以外，公司目前还在建有两座半潜式起重平台，其单座价值在3亿美元左右，今明两年将陆续完工交付，其交付确认对于来福士的营业收入、利润状况将影响明显。

盈利预测和投资建议

根据各项业务情况，我们小幅调整公司的盈利预测：2012-2014年营业收入分别为55,951，65,046和73,248百万元，净利润分别为2,141，2,984和3,768百万元，EPS分别为0.804，1.121和1.415元。与前次预测相比，2012-2013年净利润预测分别下调6.5%和9.4%。

由于集装箱业务逐渐进入淡季，其利润弹性变小，而车辆业务取决于国内宏观经济形势的变化，下半年主要关注海工业务的订单进展。当前股价相当于2012年13.0倍PE，我们维持“增持”的投资评级

风险提示

公司集装箱业务的量价波动较大，尤其是价格对利润的影响非常直接。由于全球经济的不明朗，集装箱的需求以及价格存在较大的不确定性。我们此次更新的盈利预测基于2012年干货箱销量为110万标箱、平均价格为$2500/TEU，并且冷藏箱和特种箱销售收入下降13%的假设。

公司海工业务的自升式钻井平台、半潜式起重平台是采取建成后销售的方式，其单体价值量大，因此其收入确认时间对于当期的利润影响较大。",,国金证券,增持,[None],2012-08-28,,增持,578348,pdf_downloads/2012/2012-08-28/000039-中集集团(000039)：集装箱淡旺季节分明，车辆业务需求持续下滑.pdf,000039,中集集团,中集集团(000039)：集装箱淡旺季节分明，车辆业务需求持续下滑
"邱世梁,邹润芳","1．事件

中集集团昨晚公告，拟将已发行的B股转换上市地以介绍方式在香港联交所主板上市及挂牌交易，变更为境外上市外资股。中集集团本次不发行新股。

本次方案中原持有B股股份的投资者可选择行使现金选择权而向公司安排的第三方提出收购其股份的要求，也可选择继续持有，但股票上市地变更为香港联交所，股票性质由境内上市外资股变更为境外上市外资股。

2．我们的分析与判断

（一）首例B股转H股，全新探索，利好中集长远

中集公告称，B股交投极不活跃，随着融资能力的逐步丧失及成交量的日渐萎缩，解决B股问题势在必行，此次B股转H股方案推出，对B股改革又是个全新的模式探索。

此次方案对中集长远发展是利好，有利于拓展海外融资平台以及国际化，中集客户遍布全球，通过实施本方案后实现在香港上市流通，有利于提升公司的知名度，加强拓展公司的国际化业务，建设和完善公司的境内外营销网络及服务体系和支持体系，从而加速推进公司的国际化进程；同时，境外资本市场可为公司提供更加广阔的融资平台和价值实现平台，有利于公司参与境外资本运作，充分利用境外资本资源及市场激励来进一步加强核心竞争力，促进产业结构向高级化方向发展。

（二）保护投资者利益，但B转H股估值可能下移

为了保护公司投资者尤其是公司B股投资者的利益，中集集团将向除招商局国际、COSCO及其关联企业LongHonour之外的全体B股股东提供现金选择权，价格将高出5%，即9.83港币/股。原持有B股股份的投资者可选择行使现金选择权，即向公司安排的第三方提出收购其股份的要求。投资者可以选择B转H股或者现金选择权。

我们比较了一下港股同行业公司和中集B的估值水平，发现港股同业公司估值水平相对较低，B转H股后可能带来中集H股估值体系的下移，参照附录1。

（三）价值取决基本面，集装箱景气度底部徘徊

我们认为此次B转H股方案对A股影响很小，中集的价值取决于基本面变化，特别是作为集团业务收入占比80%的集装箱和车辆经营情况。今年全球需求不足，外贸发展受抑制，全球航运市场低迷。一季度公司干货箱累计销量为16.84万TEU，比上年同期下降66.19%，箱价在2400$附近波动。以马士基、中海集运为代表的航运公司通过提升运费等手段，调整运力等手段以应对。随着淡季调整之后，客户需求触底回升，二季度箱量和价格都有一定的回升，但是去年基数太高，我们认为对于强周期的集装箱行业来说，全年最坏的时候已经过去，但是因为海外复苏不佳，进出口贸易业务量也是萎缩，集装箱的量和价格始终在相对清淡的区域徘徊，而且可能长期处于底部区域。

（四）能源化工装备景气度高，海工业务争取扭亏

2012年，集团以安瑞科为平台继续整合能源化工业务。一季度，天然气装备市场需求延续了去年的景气局面，化工装备产业保持快速发展，一季度实现营业收入19.91亿元，同比继续增长。二季度根据我们最新调研情况，景气度很高，罐箱增长超出预期，订单也很饱满，全年实现30%以上的增长概率很大。

海工业务是中集转型的重点领域，2012年第一季度，公司海工实现营业收入10.14亿元，同比增长3341.62%。其中交付一座自升式钻井平台，一座深水半潜式平台试航完成，待二季度交付。目前从订单接单和交付情况看，海工市场新订单的拓展顺利，目前公司半潜式产品赢得国际主流市场的认可，公司全年目标是争取海工业务扭亏为盈。

3．投资建议

此次A+B转A+H股开了国内B股改革的先例，而且此次中集方案对投资者利益充分保护，B股目前在国内基本丧失了其融资功能，中集B股转H股一方面为中集重新打开了海外融资渠道，另一方面对中集这种定位全球化的企业业务开展大为有利；但是短期来说，市场可能担心中集H股的估值体系会被同业上市公司拉低。

中集B转H股若成功，B股改革的新模式有望由此展开，这是解决B股历史问题的有益尝试。

我们认为对A股投资者来说，中集价值还是关注基本面变化，目前集装箱和车辆业务在底部区域徘徊，能源化工业务景气度较高但占比太小，海工业务今年争取扭亏为盈。我们小幅下调公司12-14年盈利预测为0.85元、1.0元和1.4元，鉴于公司处于转型的核心阶段，行业低点显现，未来等待缓慢回升，短期估值稍偏高，给予“推荐”评级。",,银河证券,推荐,[None],2012-08-19,,增持,754429,"pdf_downloads/2012/2012-08-19/000039-中集集团(000039)：首推B股转H股方案,中长期利于公司发展.pdf",000039,中集集团,"中集集团(000039)：首推B股转H股方案,中长期利于公司发展"
"罗立波,董亚光","事件

事件1：7月14日公司发布公告，预计2012年上半年实现净利润702~1,263百万元，较去年同期下降55-75%，对应的基本每股收益为0.264-0.475元。事件2：在经历一个多月的停牌后，公司董事会通过决议，提出将公司境内上市外资股（即B股）转换上市地以介绍方式在香港联合交易所主板上市及挂牌交易（H股）的议案，并提交公司股东大会对相关议案进行表决。

评论

业绩点评：按照预告区间的中间值计算，公司上半年EPS为0.37元左右，对应2季度的EPS为0.23元，较1季度的0.14元环比改善，但略低于预期。分项业务情况：（1）集装箱今年淡旺季分明，2月底订单量价回暖，干货箱销量从5万标箱/月，升至年中的15万标箱/月，价格从$2300/TEU，最高升至$2700-2750/TEU。而进入8月，需求开始逐渐回落，预计9月产量将降至10万标箱以下，价格可能逐渐回调至$2300-2500。由于2-3季度需求集中、价格向好，干货箱的贡献与我们年初“$2500/TEU均价、120万标箱销量”的假设差别不大。（2）由于国内经济减速明显，包括工程机械类、物流类的重卡需求都受到较大影响，预计公司道路运输车辆业务的下滑幅度较我们此前预测要高；（3）受益于天然气装备的旺盛需求，能源化工装备业务将保持良好的需求，整体可望保持良好增长，但其中部分产品如低温工业气体槽车等也受到宏观经济环境的影响；（4）海工装备业务上半年交付了自升式钻井平台、半潜式钻井平台各一座，随着历史包袱的甩清，上半年有望实现明显的减亏，而下半年的主要关注点仍在新签订单能否继续有所突破。

B股转换为H股的议案点评：

（1）现状：公司目前总股本为26.62亿股，其中A股为12.32亿股，B股为14.30亿股。目前，B股整体成交不活跃，今年以来其日均换手率为0.12%，而A股达到1.03%。停牌前，B股股价为9.36元港币，考虑汇率换算，相当于A股价格（13.10元人民币）的58.5%。

（2）方案：公司拟将已发行的B股转换上市地以介绍方式在香港联交所主板上市及挂牌交易，即转换为H股。原持有B股股份的投资者也可以选择行使现金选择权而向公司安排的第三方提出收购其股份的要求，现金选择权对应的支付价格为9.83元（较停牌前收益价溢价5%）。此方案尚需通过8月30日的临时股东大会审议，需获得全体股东和H股股东2/3以上的表决通过，并获得中国证监会、香港联交所等批准或同意。

（3）影响：这是一种创新性的方案，公司登陆境外资本市场，也可以更好地利用香港的融资平台，对公司的长远发展战略有利。由于方案不直接涉及A股，对A股的直接影响较小。如果上述议案得到实施，H股上市后，H股的股价波动可能会对A股股价形成一定的影响（尽管由于市场的分割，其估值水平会有较大差异）。目前，全球第二大集装箱制造企业—胜狮货柜在H股的股价对应着3.8倍2011年PE，按2012年净利润下降40-50%计算（参考对中集集团的集装箱业务2012年毛利下降40%的预测），对应对着6.4-7.7倍2012年PE。而中集集团B股停牌前9.36元港币的股价对应着5.53倍2011年PE，对应着8.9倍2012年PE。考虑到中集集团作为行业龙头、业务更多元化理应享有一定的估值溢价，因此B股转换为H股后，其股价应有良好的支撑。

投资建议

根据目前的需求形势，我们小幅调整公司的盈利预测（主要是下调道路运输车辆业务的收入和利润率预测），预计公司2012-2014年营业收入分别为60,177，71,592和83,127百万元，净利润分别为2,290，3,295和4,010百万元，EPS分别为0.860，1.238和1.506元，净利润预测下调幅度均为5%左右。公司目前股价相当于2012年15.23倍PE，考虑到集装箱逐渐进入淡季，利润弹性减弱，我们给予公司“增持”的投资评级。",,国金证券,增持,[None],2012-08-15,,增持,753812,pdf_downloads/2012/2012-08-15/000039-中集集团(000039)：拟将B股转换成H股.pdf,000039,中集集团,中集集团(000039)：拟将B股转换成H股
"肖群稀,徐才华","事件：我们近期调研了中集集团能源和海工装备生产基地：圣达因、安瑞科和莱福士。我们对这两块业务的前景持乐观态度。

天燃气装备市场刚刚启动，公司能化板块未来三年年均增速有望达25%左右。中集能化板块2011年收入85亿，占集团收入的14.5%。公司规划到2015年，收入达到170~200亿元，其中天然气相关业务65亿元。中集天然气业务涵盖了开采—储运—终端全产业链。中集安瑞科是LNG和CNG储运设备龙头企业，中国天然气装备市场刚刚启动，公司大量扩充产能，将充分受益于行业需求的爆发。

海工订单好转，2012年有望大幅减亏。莱佛士是国内第一、国际较领先的船舶海工企业。随着南海开发的推进和深海勘探趋势的确立，我们看好莱福士未来的发展前景。目前公司在手订单15亿美金，其中8.8亿为新增订单，公司计划全年实现新增订单15亿美金。随着公司时间和成本控制能力的提升以及订单的好转，预计2012年海工业务将大幅减亏，13年实现盈利仍有难度，14年盈利概率较大。

集装箱、车辆业务受全球经济低迷的影响大幅下滑。占公司收入80%的集装箱和车辆业务一季度出现大幅下滑，虽然进入二季度旺季后有所改善，干箱价格回升至$2700/TUE，但我们判断全球贸易将长期处于低位，集装箱需求回暖难以持续，因此我们认为二季度箱价的回升可能是一个短期的现象，箱价还将长期处于下行的通道中。

维持“中性”的投资评级。我们认同中集的发展战略，看好能源和海工业务的发展前景，但短期受累于集装箱和车辆业务，预计2012~2014年EPS为0.8、1.04和1.41元，同比增长-50%，31%和35%，2012年动态PE为16.8倍，估值水平偏高，维持“中性”的投资评级。",,华泰证券,中性,[None],2012-07-13,,中性,749557,pdf_downloads/2012/2012-07-13/000039-中集集团(000039)：长期看好能源、海工业务，短期受累于传统业务.pdf,000039,中集集团,中集集团(000039)：长期看好能源、海工业务，短期受累于传统业务
许民乐,"公司1季度实现营业收入123.52亿元，同比下降27.58%，实现归属于母公司所有者净利润3.75亿元，比去年同期下降72.37%。毛利率和净利润率纷纷下滑至15.56%和3.04%。主要由于1季度集装箱交付量不高，海工业务持续亏损所致。

每年2、3季度是集装箱需求的高峰期，今年进入2季度以来公司集装箱业务出现量价齐升的情况，售价及销量逐月提高。但目前全球经济处于底部徘徊时期，未来的航运需求仍存疑问，船公司控量保价意味浓厚。因此行业的淡旺季转换对这次集装箱销量的增长影响更为直接，全年来看销量增长压力很大。

目前干货箱需求乏力，冷藏箱等专用箱则增速较快，公司1季度干货集装箱累计销量16.84万TEU，同比下降66.19%，冷藏箱累计销量4.77万TEU，同比增长9%，特种箱累计销量1.53万TEU，同比下降12.57%。

公司海工业务1季度实现收入10.14亿元，主要由于交付了陈旧订单。新接2个订单目前进展顺利，由于原有订单4月份交付完毕，短期难有订单交付，今年预计仍将亏损。但公司目前的制造能力得到认可，且有成熟船型可以批量生产，对公司远期业绩贡献较大。

评级面临的主要风险

全球经济低迷对航运业的影响加大。

公司海工业务仍处于调整阶段，订单的交付周期可能会被拉长，影响业绩。

估值

目前公司处于周期的底部，海工业务仍处于亏损状态，道路车辆需求不足，公司今年业绩下滑明显。但年初以来集装箱价格的上行，为公司盈利能力的恢复作出贡献。我们下调公司2012、2013年盈利预测至1.07、1.01元，根据2012年A股16倍及B股10倍市盈率，我们将A股、B股目标价格分别从21.17元、18.60港币下调至17.12元、13.14港币。维持买入评级。",,中银国际,买入,[None],2012-06-01,,买入,746308,pdf_downloads/2012/2012-06-01/000039-中集集团(000039)：集装箱价格上涨，海工业务或仍亏损.pdf,000039,中集集团,中集集团(000039)：集装箱价格上涨，海工业务或仍亏损
