author,content,filename,org_name,original_rating,pdf_link,publish_time,rating_adjust_mark_type,rating_changes,report_id,save_path,stock_code,stock_name,title
"范海波,王伟","本期【卓越推】南钢股份（600282）。

南钢股份（600282）（2016-5-27收盘价2.34元）

核心推荐理由：

南京江北新区正式开工。2015年2月18日，南京市江北新区集中开工典礼在江北新区中心区综合管廊二期示范段项目现场举行。南京市国家级新区---江北新区建设正式开工。

37个项目集中动工，市委领导莅临开工现场。此次江北新区共集中开工37个重大项目，计划总投资1101.7亿元，当年投资209.5亿元，其中涉及省、市重大项目19个，总投资656亿元，当年投资110亿元。省委常委、市委书记黄莉新出席并宣布重大项目集中开工，市长缪瑞林讲话。市领导刘以安、罗群、林克勤参加活动。

高新产业园、创业园、CBD一应俱全，打造城市副中心。根据2015年7月20日《国家发展改革委关于印发南京江北新区总体方案的通知》未来十年江北新区将建设成为“一带六区三走廊”的城市副中心模式。此次37个集中开工项目中，CBD地下空间一期、综合管廊二期、江水源热泵等基础设施类项目5个，当年投资61.7亿元；新一代荣威550PLUG-IN混合动力新能源汽车、越博新能源汽车产业基地、海尔(南京)虚实网服务园、创客大厦等产业类项目24个，当年投资85.4亿元；南医大第四附属医院等民生工程类项目8个，当年投资62.4亿元。

绿色生态与高科技城市副中心倒逼南钢转型。随着37个项目的集中动工，南京江北新区的建设逐步有序推进。按照南京市长缪瑞林在开工典礼上的讲话，希望江北新区“早日建设成为全南京发展的新龙头、现代化国际性人文绿都的标志区”。因此，我们判断在未来3-5年的集中建设期内，新区内高污染、高能耗的重工业企业将逐步被剥离、搬迁。同时，随着各项配套设施的完善，以及未来对于高科技、生物医药、高端制造业企业的招商引资，会使得公司厂区所在土地逐步升值。届时，公司或将依靠以土地出资的方式与高新企业进行合作完成转型。

战略清晰，公司转型发展可期。公司提升钢铁业务竞争力的同时，持续推进转型升级，拟整合现有的多元产业资源和对外投资平台，以发展节能环保、智能制造、互联网+等新兴产业为重点，积极对接南京江北新区发展规划。2015年公司投资成立金凯节能环保投资控股有限公司，并将公司内部现有的节能环保业务整合纳入到金凯节能环保平台，为公司节能环保产业发展提供了基础。公司下一步拟通过合作引进+自主集成方式，聚焦固废处理、污水处理和余热发电等领域，尽快实现节能环保项目的落地。

盈利预测及评级：暂不考虑公司未来的新业务拓展，我们预计南钢股份16-18年的每股收益分别为0.02元、0.01元和0.01元，维持公司“持有”评级。

风险因素：国内钢铁行业下游需求进一步下滑；南京江北新区建设进度不达预期；钢材产品价格进一步下降；企业环保转型不达预期。

相关研究：《20160219南钢股份（600282）南京江北新区37个建设项目正式开工，公司土地预期增值》；《20160418南钢股份（600282）主业亏损，转型发展战略清晰》。",,信达证券,持有,[None],2016-05-31,,中性,1769986,pdf_downloads/2016/2016-05-31/600282-南钢股份(600282)：钢铁行业.pdf,600282,南钢股份,南钢股份(600282)：钢铁行业
"范海波,王伟","核心推荐理由：

南京江北新区正式开工。2015年2月18日，南京市江北新区集中开工典礼在江北新区中心区综合管廊二期示范段项目现场举行。南京市国家级新区---江北新区建设正式开工。

37个项目集中动工，市委领导莅临开工现场。此次江北新区共集中开工37个重大项目，计划总投资1101.7亿元，当年投资209.5亿元，其中涉及省、市重大项目19个，总投资656亿元，当年投资110亿元。省委常委、市委书记黄莉新出席并宣布重大项目集中开工，市长缪瑞林讲话。市领导刘以安、罗群、林克勤参加活动。

高新产业园、创业园、CBD一应俱全，打造城市副中心。根据2015年7月20日《国家发展改革委关于印发南京江北新区总体方案的通知》未来十年江北新区将建设成为“一带六区三走廊”的城市副中心模式。此次37个集中开工项目中，CBD地下空间一期、综合管廊二期、江水源热泵等基础设施类项目5个，当年投资61.7亿元；新一代荣威550PLUG-IN混合动力新能源汽车、越博新能源汽车产业基地、海尔(南京)虚实网服务园、创客大厦等产业类项目24个，当年投资85.4亿元；南医大第四附属医院等民生工程类项目8个，当年投资62.4亿元。

绿色生态与高科技城市副中心倒逼南钢转型。随着37个项目的集中动工，南京江北新区的建设逐步有序推进。按照南京市长缪瑞林在开工典礼上的讲话，希望江北新区“早日建设成为全南京发展的新龙头、现代化国际性人文绿都的标志区”。因此，我们判断在未来3-5年的集中建设期内，新区内高污染、高能耗的重工业企业将逐步被剥离、搬迁。同时，随着各项配套设施的完善，以及未来对于高科技、生物医药、高端制造业企业的招商引资，会使得公司厂区所在土地逐步升值。届时，公司或将依靠以土地出资的方式与高新企业进行合作完成转型。

战略清晰，公司转型发展可期。公司提升钢铁业务竞争力的同时，持续推进转型升级，拟整合现有的多元产业资源和对外投资平台，以发展节能环保、智能制造、互联网+等新兴产业为重点，积极对接南京江北新区发展规划。2015年公司投资成立金凯节能环保投资控股有限公司，并将公司内部现有的节能环保业务整合纳入到金凯节能环保平台，为公司节能环保产业发展提供了基础。公司下一步拟通过合作引进+自主集成方式，聚焦固废处理、污水处理和余热发电等领域，尽快实现节能环保项目的落地。

盈利预测及评级：暂不考虑公司未来的新业务拓展，我们预计南钢股份16-18年的每股收益分别为0.02元、0.01元和0.01元，维持公司“持有”评级。

风险因素：国内钢铁行业下游需求进一步下滑；南京江北新区建设进度不达预期；钢材产品价格进一步下降；企业环保转型不达预期。

相关研究：《20160219南钢股份（600282）南京江北新区37个建设项目正式开工，公司土地预期增值》；《20160418南钢股份（600282）主业亏损，转型发展战略清晰》。",,信达证券,持有,[None],2016-05-17,,中性,1757379,pdf_downloads/2016/2016-05-17/600282-南钢股份(600282)：钢铁行业.pdf,600282,南钢股份,南钢股份(600282)：钢铁行业
"范海波,王伟","本期【卓越推】南钢股份(600282)。
    南钢股份(600282) (2016-4-22收盘价2.75元)
    核心推荐理由:南京江北新区正式开工。2015年2月18日,南京市江北新区集中开工典礼在江北新区中心区综合管廊二期示范段项目现场举行。南京市国家级新区---江北新区建设正式开工。
    37个项目集中动工,市委领导莅临开工现场。 此次江北新区共集中开工37个重大项目,计划总投资1101.7亿元,当年投资209.5亿元,其中涉及省、市重大项目19个,总投资656亿元,当年投资110亿元。省委常委、市委书记黄莉新出席并宣布重大项目集中开工,市长缪瑞林讲话。市领导刘以安、罗群、林克勤参加活动。
    高新产业园、创业园、CBD一应俱全,打造城市副中心。根据2015年7月20日《国家发展改革委关于印发南京江北新区总体方案的通知》未来十年江北新区将建设成为“一带六区三走廊”的城市副中心模式。此次37个集中开工项目中,CBD地下空间一期、综合管廊二期、江水源热泵等基础设施类项目5个,当年投资61.7亿元;新一代荣威550 PLUG-IN混合动力新能源汽车、越博新能源汽车产业基地、海尔(南京)虚实网服务园、创客大厦等产业类项目24个,当年投资85.4亿元;南医大第四附属医院等民生工程类项目8个,当年投资62.4亿元。
    绿色生态与高科技城市副中心倒逼南钢转型。随着37个项目的集中动工,南京江北新区的建设逐步有序推进。按照南京市长缪瑞林在开工典礼上的讲话,希望江北新区“早日建设成为全南京发展的新龙头、现代化国际性人文绿都的标志区”。因此,我们判断在未来3-5年的集中建设期内,新区内高污染、高能耗的重工业企业将逐步被剥离、搬迁。同时,随着各项配套设施的完善,以及未来对于高科技、生物医药、高端制造业企业的招商引资,会使得公司厂区所在土地逐步升值。届时,公司或将依靠以土地出资的方式与高新企业进行合作完成转型。
    战略清晰,公司转型发展可期。公司提升钢铁业务竞争力的同时,持续推进转型升级,拟整合现有的多元产业资源和对外投资平台,以发展节能环保、智能制造、互联网+等新兴产业为重点,积极对接南京江北新区发展规划。2015年公司投资成立金凯节能环保投资控股有限公司,并将公司内部现有的节能环保业务整合纳入到金凯节能环保平台,为公司节能环保产业发展提供了基础。公司下一步拟通过合作引进+自主集成方式,聚焦固废处理、污水处理和余热发电等领域,尽快实现节能环保项目的落地。
    盈利预测及评级:暂不考虑公司未来的新业务拓展,我们预计南钢股份16-18年的每股收益分别为0.02元、0.01元和0.01元,维持公司“持有”评级。
    风险因素:国内钢铁行业下游需求进一步下滑;南京江北新区建设进度不达预期;钢材产品价格进一步下降;企业环保转型不达预期。
    相关研究: 《20160219南钢股份(600282)南京江北新区37个建设项目正式开工,公司土地预期增值》; 《20160418南钢股份(600282)主业亏损,转型发展战略清晰》。",,信达证券,,[None],2016-04-25,,,1750718,pdf_downloads/2016/2016-04-25/600282-南钢股份(600282)：钢铁行业.pdf,600282,南钢股份,南钢股份(600282)：钢铁行业
"笃慧,郭皓","投资要点
业绩概要：2015 年公司实现营业收入222.52 亿元，同比下降20.20%；归属上市公司股东净利润-24.32亿元，2014 年为2.92 亿元，同比下降933.23%。全年EPS 为-0.63 元，单季度 EPS 分别为0.02 元、-0.01 元、-0.13 元、 -0.49 元；
吨钢数据：2015 年公司生产铁842.94 万吨，同比增加3.12%；钢859.04 万吨，同比增加6.83%；钢材792.06 万吨，同比增加8.09%；销售钢材793.04 万吨，同比增加10.28％。结合年报数据折算吨钢售价2291 元/吨，吨钢成本2227 元/吨，吨钢毛利64 元/吨，同比下降601 元/吨、367 元/吨和233 元/吨；
    产销增加难抵行业下行：报告期内公司钢铁产品产销量上升，但仍然难抵行业整体景气度下行，钢企盈利空间受到大幅压缩。以占据公司营收半壁江山的中板为例，根据吨钢盈利测算2015 年中板毛利同比下降342 元/吨，毛利率同比下滑16.64%。公司板材产品超半数供给造船业，而受全球经济复苏趋缓、国际油价持续低迷、运力过剩等因素影响，造船行业产能过剩严重、需求疲软。未来看造船业发展依然不容乐观，对应的中板需求预计将持续走低。而年初以来经济数据企稳，钢铁主要下游需求行业基建和房地产复苏明显，带动钢价大幅反弹，一季度公司业绩有望同步改善。此外公司净利润大幅下滑除营收下降外还要归于两方面原因，一是由于计提存货减值准备导致资产减值损失上升245.96%，另外由于公司根据谨慎性原则核销未弥补亏损形成的部分递延所得税资产，使得所得税费用大幅上升314.71%；
    增资电商平台加速主业转型：公司对全资子公司金贸钢宝增资1000 万，进一步增强其资本实力，有利于做大做强其旗下管理运营的互联网钢材交易平台——“金陵钢铁网”。2015 年12 月14 日，命名“钢宝股份”正式在新三板挂牌公开转让，资产证券化将进一步放大该平台的盈利性和价值。钢铁电商作为公司未来转型的方向之一，电商化将推动公司由传统制造业向现代服务业转型；
    环保转型战略持续推进：公司15 年通过收购境外环保资源与增资全资子公司金凯节能环保已经确立了“钢铁+节能环保”的转型发展战略，今年1 月公布非公开发行预案，其中拟募集13.26 亿元用于高效利用煤气发电项目，可以最大限度地实现资源的综合利用，减少煤气放散对环境造成的污染，同时提高自发电比例，减少外购电量，有利于公司降低生产成本，提升盈利能力，是对公司前期节能环保发展战略的进一步推进。
此外公司子公司金凯节能环保投资1 亿设立江苏金荟再生资源有限公司 ，将涉足危废处理、水污染空气处理等相关环保业务，显示了公司转型环保的决心和行动力；
    投资建议：公司钢铁主业中长期将受造船业所带来的需求下滑影响，但公司转型信念坚定、落实性强，在节能环保、钢铁电商等领域的布局将未来公司未来的业绩增长带来新的盈利增长点，伴随钢铁行业整体复苏趋势，公司业绩有望逐步改善。预计公司2016、2017 年EPS 分别为0.12 元、0.19 元，维持“增持”评级。",,中泰证券,增持,[None],2016-04-18,,增持,1746680,pdf_downloads/2016/2016-04-18/600282-南钢股份(600282)点评：转型发展增强公司业绩稳定性.pdf,600282,南钢股份,南钢股份(600282)点评：转型发展增强公司业绩稳定性
"陈雳,邱瀚萱","2015年年报：公司全年业绩下滑，亏损集中于四季度

公司全年实现营业收入约222.52亿元，同比下降20.20%；归属于母公司净利润-24.32亿元，同比下降27.24亿元；基本每股收益-0.63元，同比下降0.75元；加权平均净资产收益率-33.16%，比上年下降36.63个百分点。第4季度实现营收约49.27亿元，环比下降9.71%、同比下降32.48%；归属于母公司净利润-19.58亿元，环比下降14.49亿元、同比下降20.48亿元，对应基本每股收益-0.49元，环比下降0.37元、同比下降0.52元。

钢价下跌拖累公司营收、利润

2015年受需求疲软等影响，钢价大幅下挫。同期，公司销量同比上升10.28%，但受钢材综合平均售价下降及贸易等其他收入下降幅度较大影响，公司营收同比下降。由于钢价下降幅度大于原燃料价格下降幅度，营收跌幅超过成本跌幅，导致产品毛利率同比下降6.47个百分点。

此外，资产减值损失、投资收益和税收费用的不利影响也是导致净利大幅降低的原因。其中，资产减值损失同比增长2.64亿元，主要因钢价下降导致存货减值准备增加；投资收益同比下降5.30亿元，主要因上年大规模减持交易性金融资产，及公司转让复星创富和复星创泓股权所致；所得税费用较上年上升2.61亿元，主要由报告期公司根据谨慎性原则核销未弥补亏损形成的部分递延所得税资产所致。

公司拟进行非公开发行，节能环保与智能产业双轮驱动

公司在2016年1月11日公布非公开发行预案，拟募资不超过45.29亿元，目前已获得证监会受理。募资净额拟用于高效利用煤气发电项目、板材全流程智能定制配送项目、新材料研究及研发能力提升项目和偿还银行贷款。

煤气发电项目一方面着眼于环保，另外一方面有利于提高发电自给占比，降低生产成本。板材全流程智能定制配送项目有助于公司打造智能制造运营服务模式，创造新利润增长点，同时实现降本增效。新材料研究及研发能力提升项目不直接产生经济效益，但有利于增强公司科研能力和创新效率，培育未来产品制高点。偿还银行贷款13.5亿元有助于降低公司资产负债率和利息支出费用，按目前4.35%贷款利率计算，可节省利息支出年5872万元。

公司将继续以钢铁制造为基础、以节能环保为驱动，维持“增持”评级

在钢铁主业上，公司将保持Ni系超低温容器钢、特殊管线钢、石油储罐用钢、钻具钢、合金管坯钢、合金焊丝用钢等传统优势产品的市场占有率。并且，公司将继续优化品种结构，瞄准国家“十三五”重点投资和基建方向，进行有针对性地品种研发，实现效益最大化。

在环保方面，公司将通过合作引进+自主集成方式，聚焦固废处理、污水处理和余热发电等领域，加快节能环保项目落地。钢宝股份将利用新三板挂牌契机，扩大贸易量，拓展延伸加工，加强电商对钢铁主业的支撑作用。推进延伸加工与定制配送、物流、电商的深度融合，加强产业链协同，构建产业链竞争优势。积极对接南京江北新区规划，不断拓宽发展空间。故维持“增持”评级，预计2016~2018年EPS分别为0.05、0.12、0.21元/股。

风险提示:经济形势变化；原料成本及产品价格波动；公司经营治理等；项目推进等",,华泰证券,增持,[None],2016-04-18,,增持,1746754,pdf_downloads/2016/2016-04-18/600282-南钢股份：加强钢铁品种升级、环保投资转型.pdf,600282,南钢股份,南钢股份：加强钢铁品种升级、环保投资转型
"范海波,吴漪,丁士涛,王伟,李沁","事件：2016年4月16日，南钢股份发布了2015年年报。公司15年实现营业收入222.52亿元，同比减少20.20%；实现归属母公司股东净利润-24.32亿元，基本每股收益-0.6276元。

点评：

粗钢表观消费量下降，行业整体亏损。2015年我国钢材消费强度下降明显。国家统计局数据显示，2015年国内粗钢产量8.04亿吨，同比下降2.3%，自1981年以来首次年度下降；粗钢表观消费量为7.01亿吨，同比下降5.45%。虽然2015年铁矿石、煤炭等原材料价格有所下跌，但是原材料价格的下跌远不能抵消钢材价格的下跌。钢铁行业产能过剩、供大于求的矛盾突出，钢铁行业整体亏损。据中钢协统计，2015年101家大中型钢铁企业实现利润-645.3亿元，亏损面达到50.5%，亏损企业同比增加34家，亏损额817.2亿元，同比增亏615.2亿元。

公司产线满负荷生产，拓展互联网+营销模式。2015年公司各产线基本保持了满负荷生产。在市场需求严重萎缩的情况下，营销人员积极开拓市场，全年销售钢材793.84万吨，产销率超过100%。公司强化船板定制配送业务，全年定制配送订单达47.7万吨。公司“基于互联网思维和JIT（准时制生产）模式的船板配送商业模式创新经验”名列国家工信部2015年33项全国“质量标杆”之一，也是钢铁行业唯一获评的成果。

战略清晰，公司转型发展可期。公司提升钢铁业务竞争力的同时，持续推进转型升级，拟整合现有的多元产业资源和对外投资平台，以发展节能环保、智能制造、互联网+等新兴产业为重点，积极对接南京江北新区发展规划。2015年公司投资成立金凯节能环保投资控股有限公司，并将公司内部现有的节能环保业务整合纳入到金凯节能环保平台，为公司节能环保产业发展提供了基础。公司下一步拟通过合作引进+自主集成方式，聚焦固废处理、污水处理和余热发电等领域，尽快实现节能环保项目的落地。

盈利预测及评级：暂不考虑公司未来的新业务拓展，我们预计南钢股份16-18年的每股收益分别为0.02元、0.01元和0.01元，维持公司“持有”评级。

风险因素：国内钢铁行业下游需求进一步下滑；南京江北新区建设进度不达预期；钢材产品价格进一步下降；企业环保转型不达预期。",,信达证券,持有,[None],2016-04-18,,中性,1746813,"pdf_downloads/2016/2016-04-18/600282-南钢股份(600282)：主业亏损,转型发展战略清晰.pdf",600282,南钢股份,"南钢股份(600282)：主业亏损,转型发展战略清晰"
"范海波,王伟","本期【卓越推】南钢股份（600282）。

南钢股份（600282）（2016-4-15收盘价2.79元）

核心推荐理由：

南京江北新区正式开工。2015年2月18日，南京市江北新区集中开工典礼在江北新区中心区综合管廊二期示范段项目现场举行。南京市国家级新区---江北新区建设正式开工。

37个项目集中动工，市委领导莅临开工现场。此次江北新区共集中开工37个重大项目，计划总投资1101.7亿元，当年投资209.5亿元，其中涉及省、市重大项目19个，总投资656亿元，当年投资110亿元。省委常委、市委书记黄莉新出席并宣布重大项目集中开工，市长缪瑞林讲话。市领导刘以安、罗群、林克勤参加活动。

高新产业园、创业园、CBD一应俱全，打造城市副中心。根据2015年7月20日《国家发展改革委关于印发南京江北新区总体方案的通知》未来十年江北新区将建设成为“一带六区三走廊”的城市副中心模式。此次37个集中开工项目中，CBD地下空间一期、综合管廊二期、江水源热泵等基础设施类项目5个，当年投资61.7亿元；新一代荣威550PLUG-IN混合动力新能源汽车、越博新能源汽车产业基地、海尔(南京)虚实网服务园、创客大厦等产业类项目24个，当年投资85.4亿元；南医大第四附属医院等民生工程类项目8个，当年投资62.4亿元。

绿色生态与高科技城市副中心倒逼南钢转型。随着37个项目的集中动工，南京江北新区的建设逐步有序推进。按照南京市长缪瑞林在开工典礼上的讲话，希望江北新区“早日建设成为全南京发展的新龙头、现代化国际性人文绿都的标志区”。因此，我们判断在未来3-5年的集中建设期内，新区内高污染、高能耗的重工业企业将逐步被剥离、搬迁。同时，随着各项配套设施的完善，以及未来对于高科技、生物医药、高端制造业企业的招商引资，会使得公司厂区所在土地逐步升值。届时，公司或将依靠以土地出资的方式与高新企业进行合作完成转型。

战略清晰，公司转型发展可期。公司提升钢铁业务竞争力的同时，持续推进转型升级，拟整合现有的多元产业资源和对外投资平台，以发展节能环保、智能制造、互联网+等新兴产业为重点，积极对接南京江北新区发展规划。2015年公司投资成立金凯节能环保投资控股有限公司，并将公司内部现有的节能环保业务整合纳入到金凯节能环保平台，为公司节能环保产业发展提供了基础。公司下一步拟通过合作引进+自主集成方式，聚焦固废处理、污水处理和余热发电等领域，尽快实现节能环保项目的落地。

盈利预测及评级：暂不考虑公司未来的新业务拓展，我们预计南钢股份16-18年的每股收益分别为0.02元、0.01元和0.01元，维持公司“持有”评级。

风险因素：国内钢铁行业下游需求进一步下滑；南京江北新区建设进度不达预期；钢材产品价格进一步下降；企业环保转型不达预期。

相关研究：《20160219南钢股份（600282）南京江北新区37个建设项目正式开工，公司土地预期增值》；《20160418南钢股份（600282）主业亏损，转型发展战略清晰》。",,信达证券,持有,[None],2016-04-18,,中性,1747407,pdf_downloads/2016/2016-04-18/600282-南钢股份(600282)：钢铁行业.pdf,600282,南钢股份,南钢股份(600282)：钢铁行业
