author,content,filename,org_name,original_rating,pdf_link,publish_time,rating_adjust_mark_type,rating_changes,report_id,save_path,stock_code,stock_name,title
王华君,"公司拟将德利国际(空港业务)注入中国消防(0445.HK),并控股中国消防
    公司于2018年1月24日发布港股公告,公司拟将旗下主要从事空港业务的德利国际(Pteris)的全部股份出售注入联营公司中国消防(CFE),德利国际78.15%股份交易对价为约30亿元。交易完成后,公司对中国消防的持股比例将由原来的30%提升至50%以上的绝对控股。目前香港联交所已同意重组方案,公司董事会已决议不建议进行保证配额。
    空港设备前景看好,本次交易估值较为合理;独立融资平台提供更好发展机遇  2017年我国民航业持续较高增速,预计2017年完成运输总周转量、旅客运输量同比分别增长12.5%、12.6%。“十三五”期间庞大的机场建设规划有望带动空港设备的需求,空港设备市场空间广阔。公司作为空港装备全球领先企业有望充分受益,前景看好。
    根据德利国际审计报告,德利净利润由2014年的约人民币6500万元迅速增长至2016年的1.12亿元(收入15.2亿元),复合增长率高达31%,预计未来几年有望保持大幅增长势头。本次交易对应德利国际估值约为38亿元人民币,考虑到空港设备行业未来较高景气度(详见我们正文第二章详细分析)以及公司所处行业地位与未来前景,以及同行相关上市公司(JBT、威海广泰)的估值水平,我们认为本次交易估值较为合理。 更加独立的融资平台将给中集空港业务和消防车业务提供更好的发展机遇。
    消防车辆需求缺口大,公司消防车业务成长空间广阔根据消防车配备标准统计,国内消防车应有数量为4.2万-5.9万辆,目前消防车缺口约为1.2万-2.9万辆,按每辆100万的单价计算,国内消防车缺口市场空间达120-290亿元。中国消防为国内消防车龙头企业,与公司旗下齐格勒强强联合、优势互补,成长空间广阔。
    预计公司产业聚集、战略整合将提速本交易是中集集团对机场设施设备业务及特种车辆业务等附属业务分部进行内部重组、整固及强化的重要步骤。我们预计公司产业聚集、战略整合将提速。
    看好公司业绩增长持续性,2019年有望创历史新高  我们持续看好公司2019年业绩有望创历史新高!随着贸易复苏,集装箱景气度保持向上;道路运输车辆业务受益于国内治超治执行力度趋严、国外市场扩张;天然气需求持续增长,而国内储运装备明显不足,储运装备迎来发展机遇;海工装备风险逐步释放,业绩弹性较大。
    投资建议:考虑到今年出售中集电商4亿元和太子湾土地搬迁补偿4.95亿元,预计2017-2019年归母净利润为29.4/35.4/40.5亿元,EPS为0.99/1.19/1.36元,PE为22/19/16倍。受益一带一路、粤港澳大湾区等主题投资;土地价值潜力较大,上市公司价值有望重估;维持“买入”评级。
    风险提示:重组整合不达预期;集装箱反弹持续性风险;海工装备业务低迷风险。",,中泰证券,买入,[None],2018-01-26,,买入,2116297,"pdf_downloads/2018/2018-01-26/000039-中集集团(000039)：空港业务新平台,业务整合携手共赢.pdf",000039,中集集团,"中集集团(000039)：空港业务新平台,业务整合携手共赢"
"贺泽安,季国峰","空港独立平台成立,将进一步提升企业价值通过此次业务整合,中集旗下空港业务和消防车业务将形成独立上市平台,更加独立的平台更有利于业务的发展。中集集团旗下业务众多:(1)集装箱制造业务;(2)道路运输车辆业务;(3)能源、化工及液态食品装备业务;(4)海洋工程业务;(5)物流服务业务;(6)重型卡车业务;(7)空港装备业务;(8)房地产开发业务;(9)金融业务;(10)其他业务。十大业务板块一方面展现了中集集团的宽阔的业务面,但是另一反面也增加了公司管理难度,同时也不利于体现公司价值。此次空港+消防车业务平台的“独立”,是集团提升企业价值的重要一步。交易完成之后的中国消防将由消防车及消防设备业务扩展到以德利国际、中集天达、德国齐格勒及中国消防为主体的空港业务装备公司,业务涵盖登机桥、自动化物流、地面支持设备(GSE)、消防及救援车辆及智能停车业务。
    空港业务发展势头好,未来有望更上一层楼中集空港业务主要有五大板块:登机桥、消防与救援、自动化物流、地面支持设备(GSE)、立体停车库,由三个主体运营:德利国际(除消防以外的所有空港业务)、德国齐格勒集团和中国消防(运营消防业务)。中集空港业务近几年发展良好,2016年年报显示中集空港业务实现营收32亿元,同比增长14%,净利润同比增长110%。德利国际是全球最大的登机桥供货商之一,也是全球领先的物流自动化供应商(包括机场物流系统、行李处理及物料处理及地勤支持设备)。德利国际2016年收入15.2亿元,过去三年CAGR14.8%;2016年实现净利润1.1亿元,过去三年CAGR32.1%。此次交易完成后,中国消防与德利国际预期可实现较好的协同效应:鉴于德利国际的业务和目标客户与中国消防相似,中国消防将通过与德利国际分享技术知识、供货商群、研究及开发资源、营销渠道以及销售网络,实现潜在协同效应,从而协助中国消防扩大市场覆盖面及降低营运成本。此外,长远而言,借着德利国际与中国及全球众多机场营运商之间的密切关系,中国消防将可扩大其于中国以及合适海外市场的业务营运。
    盈利预测与投资建议:
    全球经济复苏,公司作为集装箱龙头将充分受益;此外随着油价复苏,公司的海工业务有望减亏;道路车辆、能化及重卡发展势头持续向好。预计2017-2019年公司净利润为24.63/34.12/43.26亿元,同比增长356%/38%/26%,对应PE27/19/15倍。给予“买入”评级。",,国信证券,买入,[None],2018-01-25,,买入,2116216,"pdf_downloads/2018/2018-01-25/000039-中集集团(000039)：空港业务整合迈出关键一步,企业价值有望提升.pdf",000039,中集集团,"中集集团(000039)：空港业务整合迈出关键一步,企业价值有望提升"
"任天辉,樊艳阳",报告摘要：公司继承蛇口精神，受益周期复苏。中集集团是我国改革开放后成立的第一批制造业企业，随着2017年周期反转，公司除海工板块外，各权重板块业绩均有不错业绩表现。集装箱业务大幅回暖，道路车辆业务增速明显。随着SOE减值拨备计提完毕，以及原材料涨价因素压制减弱，我们认为公司2018-2019年将迎来较大业绩弹性。集装箱将迎来臵换高峰，看好未来2-3年高景气度持续。2016年下半年以来集运市场触底反弹，主要经济体商品贸易步入上行通道，供需结构持续改善。以马士基为代表的班轮公司和Triton为代表的租箱公司2017年以来盈利性显著好转，集装箱利用率显著回升。2017年四季度作为淡季闲臵运力仅为2%，显示下游具备强劲需求。随着需求回暖和旧箱价格回升，我们认为2017年-2019年将是班轮公司和租箱公司处臵超期服役集装箱的窗口期。根据我们测算，目前主流租箱公司箱龄超过15年的干货箱比重约为15%。按此推算，全球将有超过500万TEU的集装箱亟待更换，未来2-3年的集装箱市场具备强支撑。能化装备成本及费用压制减弱，业绩弹性巨大。优化能源结构、提升天然气在一次能源结构中的占比是长期趋势，近期气荒彰显了我国天然气储运能力的短板。中集安瑞科作为国内能源装备龙头，可以为客户提供天然气和液化石油气全产业链的整体解决方案，有望显著受益行业复苏。SOE减值拨备和原材料上涨一定程度压制了公司能化板块2016年-2017年的业绩表现，随着非经常损益因素减弱，以及原材料价格涨幅趋缓，终端产品定价机制理顺，中集安瑞科2018年将迎来较大业绩弹性。公司盈利预测及投资评级：我们预计公司2017年-2019年实现营业收入分别为719.74亿元、823.13亿元和900.70亿元；归母净利润分别为24.57亿元、33.28亿元和39.67亿元；EPS分别为0.82元、1.12元和1.33元，对应PE分别为20.10X、14.84X和12.45X。我们按照2018年集装箱、道路车辆及能化装备板块分别15X、20X、20X分部估值，对应目标市值达到616亿元，仍有23%左右上涨空间。对应A股目标价27.10元，H股目标价19.29港币。若考虑集团土地增值保守估计200亿元，公司市值仍有63%增长空间。首次覆盖给予“强烈推荐”评级。风险提示：1、原材料及能源价格大幅波动；2、全球贸易及海运需求复苏不及预期；3、贸易保护主义抬头；4、海工业务不及预期。,,东兴证券,强烈推荐,[None],2018-01-19,,买入,3568569,pdf_downloads/2018/2018-01-19/000039-中集集团（000039）深度报告：继承蛇口精神砥砺前行，看好权重板块业绩弹性.pdf,000039,中集集团,中集集团（000039）深度报告：继承蛇口精神砥砺前行，看好权重板块业绩弹性
"王华君,许忠海","投资要点

中集天达完成全球首款无人驾驶智能登机桥的研发，预计2019年底首批产品将在荷兰机场大规模使用

根据中集集团官方微信公众号，今年10月份，中集集团旗下中集天达空港设备有限公司与荷兰阿姆斯特丹机场签署了一份无人驾驶智能登机桥的研发合同。近日，这款产品的首台样桥在深圳中集空港基地检测成功。目前双方正商讨商用进程，预计2019年底首批无人驾驶登机桥将在阿姆斯特丹机场实现大规模使用。

智能装备助力空港业务再上新台阶，公司空港设备业务前景看好

无人驾驶智能登机桥代表着目前登机桥智能化的最高水平，智能化装备的成功研发助力公司空港业务站上新台阶。除了登机桥之外，公司空港业务几乎涵盖了空港地面设备的各种类型，如包含在大品类GSE（地面支持设备）里面的摆渡车、食品车、升降平台车等，机场行李运输系统，机场的自动化物流仓储装备，机场消防车等。

公司空港设备业务收入连年增长，2011-2016年营收复合增速超过40%。2017年1-9月，空港装备业务实现销售收入人民币19.28亿元，同比增长11%。

空港装备业务注入港股“中国消防”，预计公司产业聚集、战略整合将提速

12月6日，公司发布公告，拟将旗下主要从事空港业务的德利国际（Pteris）的全部股份出售注入联营公司中国消防。交易完成后，对中国消防的持股比例将由原来的30%提升至50%以上。本交易是中集集团对机场设施设备业务及特种车辆业务等附属业务分部进行内部重组、整固及强化的重要步骤。我们预计公司产业聚集、战略整合将提速。

中集空港板块已成为全球最大、技术实力最强的登机桥生产商，占有全球登机桥40%以上的市场份额，在中国市场更是具有较大优势。更加独立的融资平台将给中集空港业务和消防车业务提供更好的发展机遇。

看好公司业绩增长持续性，2019年有望创历史新高！

随着贸易复苏，集装箱景气度保持向上；道路运输车辆业务受益于国内治超治执行力度趋严、国外市场扩张；天然气需求持续增长，而国内储运装备明显不足，储运装备迎来发展机遇；海工装备风险逐步释放，业绩弹性较大。我们持续看好公司2019年业绩有望创历史新高！

投资建议：考虑到今年出售中集电商4亿元和太子湾土地搬迁补偿4.95亿元，预计2017-2019年归母净利润为29.4/35.4/40.5亿元，EPS为0.99/1.19/1.36元，PE为22/18/16倍。受益一带一路、粤港澳大湾区等主题投资；土地价值潜力较大，上市公司价值有望重估；维持“买入”评级。

风险提示：集装箱反弹持续性风险；海工装备业务低迷风险。",,中泰证券,买入,[None],2017-12-29,,买入,2103085,"pdf_downloads/2017/2017-12-29/000039-中集集团(000039)：全球首创无人驾驶智能登机桥研制成功,2019年业绩有望创历史新高.pdf",000039,中集集团,"中集集团(000039)：全球首创无人驾驶智能登机桥研制成功,2019年业绩有望创历史新高"
闵琳佳,"伴随环保趋严下天然气消费量的快速增加,“煤改气”的推进以及自北方供暖季以来“气荒”、LNG价格创历史新高等一系列问题,消费需求的增加与天然气基础设施建设不足的矛盾再次凸显,作为市场唯一一家能够提供天然气储运全产业链设备与服务的企业,中集集团(000039.CH/人民币22.10元,未有评级)旗下能源装备受益天然气供应保障建设明显,建议关注。",,中银国际,,[None],2017-12-27,,,2101834,pdf_downloads/2017/2017-12-27/000039-中集集团(000039)：能化装备板块暨中集安瑞科调研纪要.pdf,000039,中集集团,中集集团(000039)：能化装备板块暨中集安瑞科调研纪要
陈显帆,"中集车辆再获平安增资,收购SDC强化欧洲市场布局
    平安资本以8.18亿元的出资,完成受让中集车辆集团10.77%的股份。中集车辆在平安增资完成后,利用所获资金收购英国半挂车生厂SDC。SDC是目前英国最大的半挂车厂商,占英国市场38%份额。2016年6月,中集曾以约合8亿人民币的价格完成对SDC母公司Retla的收购,使中集在欧洲市场排名升至第三位。公司此次对SDC的收购再次扩增了在欧洲市场的开拓范围,预计将增厚未来公司业绩。
    平安曾于2015年11月向中集车辆集团增资10.9亿元人民币,获得中集车辆集团16.8%股权。两次投资后,平安资本合计持有中集车辆集团约27.6%股权,成为中集车辆集团的第二大股东。
    全球道路运输车辆龙头企业,国内外市场齐头并进
    2017年H1公司半挂车全球销量8.15万台,同比+40%,保持高增长态势。国内方面,受益于GB1589新政推行,2016年国内销量同比有较大增长,其中液罐车销量同期增长接近90%。在2017年国内半挂车市场销量5万辆(同比+20%)的
    基础上,预计2018年销量仍有望稳步提升,同时,公司综合市占率突破20%,同样稳中有升。
    北美是公司最大的海外市场,2016年公司跻身美国半挂车市场占有率第四位,销量达4万辆。随着CIMC VaguardⅡ号工厂的投产,预计18年在美国供不应求的市场背景下,该厂1万台的产能可全部转化为销量。
    欧洲市场尚处于开拓阶段,公司的基数较小,我们预计仍存在40-50亿美元市场容量。2016年6月,公司曾以约合8亿人民币的价格完成对英国Retla集团的全资收购。Retla的加入贡献9000台左右的销量,使得公司在欧洲市场排名升至第三位。据Clear的报告分析,2015年西欧的半挂车销量同比增长约13.4%;而英国市场的增长达到了25%,几乎是欧洲平均增长率的2倍。高景气度市场结合优秀公司,在相继收购Retla、SDC后,公司有望以英国市场为契机,逐步确立在欧洲道路运输车辆市场的优势地位。
    全球经济回暖,集装箱龙头率先受益
    中集集团是全球集装箱与道路运输车辆龙头企业,去年受全球贸易紧缩影响,集装箱板块的低迷导致总体营收与净利润均产生大幅滑坡。2017年经济总体向好,公司业绩触底反弹。2017年H1总计营收334亿,同比+42%;归母净利润8亿,同比大幅扭亏。下半年在经济复苏得趋势下,公司业绩有望进一步提升。
    盈利预测与投资建议
    公司获平安的增资后收购英国最大半挂车厂SDC,将有效促进其在欧洲市场的布局。因目前公司在欧洲市场尚处于开拓阶段,未来市场空间广阔,有望成为新的业绩增长点。预计公司2017-2019年EPS 0.98、1.00、1.20元。对应PE分别为22、22、18X,维持“买入”评级。
    风险提示:欧洲市场不及预期,全球贸易低迷。",,东吴证券,买入,[None],2017-12-25,,买入,2100017,"pdf_downloads/2017/2017-12-25/000039-中集集团(000039)：车辆板块再获平安增资,收购SDC强化欧洲布局.pdf",000039,中集集团,"中集集团(000039)：车辆板块再获平安增资,收购SDC强化欧洲布局"
王华君,"事件:证监会恢复审查公司非公开发行A股股票申请。
    公司公告于12月18日收到中国证监会出具的《中国证监会行政许可申请恢复审查通知书》,决定对公司非公开发行A股申请恢复审查。
    2016年提出定增方案;定增价格不低于15.31元。
    本次定增方案可追溯至2016年4月,公司发布公告拟非公开发行募集资金总额不超过人民币60亿元,募集资金用于中集融资租赁、物流装备等项目。本次发行的发行价格不低于人民币15.31元/股。公司于2016年9月30日向中国证监会提交了非公开发行A股股票申请文件,并于2016年10月14日及11月21日收到中国证监会出具的《中国证监会行政许可申请受理通知书》及《中国证监会行政许可项目审查反馈意见通知书》。因反馈意见中部分事项还需核查与落实,公司于2017年1月申请中止审查。历经近一年时间,本次重新恢复审查定增申请。我们认为,本次A股定增有利于改善公司资本结构,为公司后续发展注入新的活力。
    定增有利于改善公司资本结构,助力中长期发展。
    公司目前资产负债率偏高。根据财报,公司自2015年起资产负债率逐渐增高,2017年三季报公司资产负债率为69.5%。2016年公司不含资本化部分的利息支出达到人民币9亿元,占公司2016年利润总额的53.0%。改善财务结构、降低财务费用已成为公司发展的重要举措之一。我们认为,如果本次定增顺利完成,有望降低资产负债率,改善资本结构,为公司后续长远发展注入新活力。
    募投项目契合公司“金融+服务+制造”战略。
    根据公司定增预案,本次募资60亿元,20亿元用于中集融资租赁有限公司增资项目;5.93亿元用于中集凤岗物流装备制造一期项目;1.17亿元用于青岛中集冷藏设备公司搬迁项目一期;7800万用于成立多式联运公司;约14.1亿元用于东莞松山湖智谷与松山湖智荟园项目;18亿元为补充流动资金。我们认为,公司作为全球领先的物流与能源行业设备及解决方案供应商,本次募投项目紧紧围绕公司主营业务,涵盖金融、物流装备、物流服务与地产等,有望发挥公司“金融+服务+制造”的战略协同效应。
    看好公司业绩增长持续性,2019年有望创历史新高。
    我们看好公司2019年业绩有望创历史新高!随着贸易复苏,集装箱景气度保持向上;道路运输车辆业务受益于国内治超治执行力度趋严、国外市场扩张;天然气需求持续增长,而国内储运装备明显不足,储运装备迎来发展机遇;海工装备风险逐步释放,业绩弹性较大。
    投资建议:考虑到今年出售中集电商4亿元和太子湾土地搬迁补偿4.95亿元,预计2017-2019年归母净利润为29.4/35.4/40.5亿元,不考虑定增,EPS为0.99/1.19/1.36元,PE为19/16/14倍。受益一带一路、粤港澳大湾区等主题投资;土地价值潜力较大,上市公司价值有望重估;维持“买入”评级。",,中泰证券,买入,[None],2017-12-20,,买入,2097993,"pdf_downloads/2017/2017-12-20/000039-中集集团(000039)：60亿元A股定增申请恢复审查,2019年业绩有望创历史新高.pdf",000039,中集集团,"中集集团(000039)：60亿元A股定增申请恢复审查,2019年业绩有望创历史新高"
"王华君,许忠海","投资要点

事件：公司与深圳燃气签署战略合作协议，共同探索“一带一路”建设

根据深圳国资委官方网站：深圳市燃气集团与中集集团于12月14日签署战略合作框架协议，双方正式建立合作伙伴关系，共同谋划在“一带一路”沿途国家范围内，探索开拓液化天然气接收站、城市燃气及综合供能等海外项目的市场投资机会。

点评：携手深圳燃气，优势互补，发挥良好协同效益

深圳燃气集团以城市管道燃气、燃气投资业务为主，立足深圳本地，积极拓展国内外市场，取得了跨越式发展，目前燃气业务已覆盖国内40多个城市。未来将继续积极在海内外拓展燃气版图，做大做强集团业务。

公司能源装备板块主要由旗下中集安瑞科开展。中集安瑞科业务覆盖预处理、液化、储运、再汽化、管输到终端应用的天然气上、中、下游全产业链，在燃气能源CNG、LNG、LPG三大能源储运装备领域均颇有建树。公司液罐箱、高压运输车产销量全球第一，LNG接收站大型储罐、LNG拖车业务国内市场占有率均为全国第一。

公司与深圳燃气集团签署战略合作协议，双方有望发挥各自领域专业优势，加快开拓国外城市燃气、综合供能等领域市场，积极参与中外合作产业园区和“一带一路”经济特区建设，提升国内外辐射力和影响力。

天然气产业链前景看好，装备龙头有望受益

2017年1-9月全国天然气消费量同比增长16%左右，维持较高增长。国家《能源发展“十三五”规划》，提出“十三五”时期天然气消费比重力争达到10%，2016年为6.4%，天然气市场空间广阔，产业链前景看好。

北方冬季“煤改气”供暖引起的天然气价格上涨与“气荒”暴露出我国天然气储运设施的短板。天然气缺口扩大将带动天然气储运装备需求旺盛，装备领域龙头企业有望受益。

看好公司业绩增长持续性，2019年有望创历史新高

我们持续看好公司2019年业绩有望创历史新高！随着贸易复苏，集装箱景气度保持向上；道路运输车辆业务受益于国内治超治执行力度趋严、国外市场扩张；天然气需求持续增长，而国内储运装备明显不足，储运装备迎来发展机遇；海工装备风险逐步释放，业绩弹性较大。

投资建议：考虑到今年出售中集电商4亿元和太子湾土地搬迁补偿4.95亿元，预计2017-2019年归母净利润为29.4/35.4/40.5亿元，EPS为0.99/1.19/1.36元，PE为21/17/15倍。受益一带一路、粤港澳大湾区等主题投资；土地价值潜力较大，上市公司价值有望重估；维持“买入”评级。

风险提示：集装箱反弹持续性风险；海工装备业务低迷风险。",,中泰证券,买入,[None],2017-12-19,,买入,2097349,pdf_downloads/2017/2017-12-19/000039-中集集团(000039)：携手深圳燃气积极探索开拓LNG接收站等海外项目.pdf,000039,中集集团,中集集团(000039)：携手深圳燃气积极探索开拓LNG接收站等海外项目
