author,content,filename,org_name,original_rating,pdf_link,publish_time,rating_adjust_mark_type,rating_changes,report_id,save_path,stock_code,stock_name,title
"高超,卢崑",分红率超预期，直租模式受益于设备更新2023年公司营收/净利润为47.9/26.6亿元，同比+10%/+10%，2024Q1营收/净利润为12.8/7.1亿元，同比+6%/+5%，业绩基本符合我们预期。2023年/2024Q1年化加权平均ROE 15.8%/15.5%，同比-0.1/-1.2pct，权益乘数为6.7/6.7倍，同比-2%/-2%。考虑宏观经济环境和竞争加剧对规模和净利差影响，我们下调2024、2025年归母净利润预测至29/33亿元（调前31/35），新增2026年预测37亿元，同比+11%/+11%/+12%，EPS为0.7/0.8/0.9元，当前股价对应PB为1.2/1.1/1.0倍。推动大规模设备更新相关政策有望提振实体经济需求，融资租赁业务可以发挥“融资+融物”的特色优势服务实体企业，公司坚定推进“零售+科技”双领先战略，以设备为核心的专业能力行业领先，有望充分受益。2023年公司股利支付率达51.1%(2022年为43.4%)，超我们预期，当前股息率5.9%，维持“买入”评级。2023年8月19日公司公告1年内不赎回转债，关注后续可转债事项。规模稳健增长，合作厂商数及业务人员数量增加，投放结构进一步优化（1）2023年末/2024Q1末应收融资租赁款余额1141/1213亿元，同比+9.7%/+9.6%，环比+0.2%/+6.3%，符合预期。2023年新投放规模722亿元，同比+15%，直接租赁投放同比+22%，直租占比46%，持续提升。获客渠道进一步拓宽：厂商线2023年末合作厂商（经销商）数量3613家，同比+53%；区域线整合苏州、苏中团队，设立小企业金融部，公司员工人数528人，同比+18%，其中业务人员312人，同比+27%；建立战略大客户、小微客户、厂商经销商专属直销团队，各团队网格化分工开展名单制电话营销。（2）结构来看，3+N布局更加清晰，清洁能源、道路运输、工业装备规模234/160/149亿元，占比20%/14%/13%。增速来看，农业装备、工业装备、清洁能源同比+60%/+49%/+29%，基础设施、道路运输同比-35%/-8%。利差表现略低于我们预期，资产质量稳健，不良生成率小幅抬升（1）我们估算2023年/2024Q1生息资产收益率6.66%/6.82%，同比-0.17/-0.01个百分点；估算付息债务成本率3.00%/3.10%，同比-0.17+0.14个百分点；估算净利差3.66%/3.72%，同比+0.01/-0.16百分点，趋势与公司披露净利差一致，公司披露净利差为3.61%/3.63%，同比+0.09/-0.13百分点。预计全年付息债务成本进一步下降，2024Q1公司新发2笔3年期15亿的债券，发行利率分别为2.76%/2.50%；2024年以来银行间拆借利率有所下降。（2）2023/2024Q1不良率0.91%/0.91%，表现稳健（2022年为0.91%），2023年不良生成率为0.46%，同比+0.14pct；关注率为3.50%/3.25%（2022年为3.45%）。拨备率为4.08%/4.03%（2022年为4.17%），拨备覆盖率为448%/442%（2022年为457%）。风险提示：竞争加剧造成业务规模、利差承压。,,开源证券,买入,[None],2024-04-27,,买入,5604758,pdf_downloads/2024/2024-04-27/600901-江苏金租（600901）：2023年报及2024一季报点评：分红率超预期，直租模式受益于设备更新.pdf,600901,江苏金租,江苏金租（600901）：2023年报及2024一季报点评：分红率超预期，直租模式受益于设备更新
"刘雨辰,曾广荣",管理层未减持彰显公司发展信心 事件：2023年11月30日，江苏金租发布董事长集中竞价减持股份结果公告。公司管理层对于公司发展前景信心充足2023年5月11日，公司发布董事长集中竞价减持股份计划公告。公告称公司董事长熊先根先生因个人资金需求，拟在2023/6/1-2023/11/30期间通过集中竞价减持不超过20万股。2023年11月30日，江苏金租公告称减持计划届满，董事长熊先根先生未通过任何方式减持公司股份。截至2023年11月30日，董事长熊先根先生共持有252万股公司股份，占公司总股本的0.0594%。除此之外，2023年7月13日，公司公告称公司副总经理、董事江勇先生以及市场总监刘明先生减持计划届满，江勇先生与刘明先生也未通过任何方式减持公司股票。公司多位高管在减持计划内均未通过任何方式减持公司股份，表明公司管理层对于公司未来发展前景信心充足。基本面优异，高股息特性预计可持续公司作为A股唯一一家上市的金融租赁公司，业绩表现优异。公司前三季度实现营业收入36.40亿元，同比+12.01%；归母净利润20.41亿元，同比+11.79%。截至23Q3末，江苏金租租赁资产余额达到1139.21亿元，较期初+9.53%，租赁资产规模稳步扩张。前三季度净利差3.69%，较上半年-2BP，在今年环境下，净利差呈现强韧性。江苏金租净利差韧性主要受益于负债端优势，而负债端又主要受益于金融租赁牌照优势。展望后续，在当前稳增长诉求较为强烈的背景下，未来货币政策预计将会保持宽松，我们预计2024年还有较大概率降准。整体流动性保持充裕的背景下，江苏金租有望充分发挥金融租赁牌照优势，负债端的优势将得到保持。此外，公司有能力也有意愿保持股息率的稳定。一方面，公司业绩保持稳健增长，为发放稳定股息提供保障；另一方面，公司前期不强制赎回转债，原因之一便是希望保持每股分红水平的稳定，避免强赎导致转股稀释每股分红。截至2023年12月1日，江苏金租股息率为7.01%，未来高股息特性有望保持。盈利预测、估值与评级我们预计公司2023-2025年营业收入分别为48.85、54.87、61.42亿元，同比增速分别为12.41%、12.30%、11.94%；归母净利润分别为26.93、30.74、34.43亿元，同比增速分别为11.67%、14.16%、11.98%，3年CAGR为12.60%。BVPS分别为4.21、4.65、5.14元/股。鉴于公司业务开拓能力强大，科技有效赋能风控，资产质量整体优异。参照可比公司估值，我们给予公司2024年1.30倍PB，目标价6.05元，维持为“买入”评级。风险提示：不良率上升，资金错配导致流动性风险，市场竞争加剧,,国联民生证券,买入,[None],2023-12-01,,买入,5411615,pdf_downloads/2023/2023-12-01/600901-江苏金租（600901）：管理层未减持彰显公司发展信心.pdf,600901,江苏金租,江苏金租（600901）：管理层未减持彰显公司发展信心
夏芈卬,事件：公司近日发布23Q3季报，23Q1-3实现营业收入36.40亿元，同比增长12.01%；归母净利润20.41亿元，同比增长11.79%。其中，23Q3实现营业收入12.28亿元，同比增长11.33%；归母净利润7.23亿元，同比增长12.40%。多因素驱动业绩稳健增长。23Q1-3利息净收入、手续费及佣金净收入、经营租赁收入、其他收入分别为36.47、-0.71、0.31、0.33亿元，同比+17.91%、转负、+102.67%、转正。其中：1）利息净收入同比提升及手续费净收入同比下降，主要系公司响应监管，调整对小微企业等客户的收费方式；2）经营租赁收入提升，预计主要系租赁业务快速发展；3）其他收入扭亏为盈，主要系汇率波动下，实现汇兑净收益0.27亿元。量上看：资产规模增速放缓，质量保持优异。23Q3末融资租赁资产余额1139.21亿元，同比增长9.22%，增速同比下降3.08pct。9月PMI复苏，预计随着未来需求好转，资产投放有望增长。23Q3末，公司不良率为0.94%，较年中保持不变。拨备覆盖率435.12%，较年中提升11.89pct；拨贷比4.08%，较年中提升0.10pct，拨备充分。价上看：净利差维持高位，负债结构优化。23Q1-3净利差为3.69%，同比增长0.13pct，预计主要受益于负债端：1）23Q3末拆入资金占负债总额比例为71.03%，较22年末提升2.04pct；2）2022年以来银行间拆入资金利率呈下降趋势，预计公司负债端成本下降。盈利预测与投资建议：公司资产规模稳健增长，叠加利息差稳中向好，我们预计公司2023-2025年营业收入分别为48.46、54.45、62.05亿元，同比增速分别为11.50%、12.37%、13.96%。归母净利润分别至27.22、30.97、35.26亿元，同比增速分别为12.88%、13.76%、13.85%。EPS分别为0.64、0.73、0.83元/股。参照可比公司，给予公司2023年9.55倍PE，维持“买入”评级。风险提示：行业竞争加剧、户用光伏景气度下行、宏观经济下行,,太平洋证券,买入,[None],2023-11-06,,买入,5379459,pdf_downloads/2023/2023-11-06/600901-江苏金租（600901）Q3点评：业绩维持两位数增长，资产质量稳健向好.pdf,600901,江苏金租,江苏金租（600901）Q3点评：业绩维持两位数增长，资产质量稳健向好
Ting Sun,【事件】江苏金租发布2023年三季报：1）前三季度实现营业收入36.4亿元，同比+12.0%，Q3单季为12.3亿元，同比+11.3%。2）归母净利润20.4亿元，同比+11.8%，Q3单季为7.2亿元，同比+12.4%。3）归母净资产172亿元，较年初+7.8%，较中期+4.6%。4）对应ROE 12.27%，同比+0.12pct。应收租赁款规模增速放缓，净利差同比扩大。1）应收租赁款规模增速较上半年放缓。截至Q3末公司应收租赁款余额为1103亿元，较年初+9.8%，较中期基本持平。2）利息净收入稳定增长，净利差同比走阔。前三季度利息净收入为36.5亿元，同比+17.9%，Q3单季为12.4亿元，同比+19.3%。前三季度公司租赁业务净利差为3.69%，同比+0.13pct，较上半年-0.02pct。我们认为利差空间同比扩大主要受益于融资成本降低。3）手续费及佣金净收入转负。前三季度手续费及佣金净收入为-0.7亿元，上年同期为1.6亿元。我们预计主要是公司响应号召减费让利，手续费收入规模同比减少所致。4）经营租赁业务快速发展。前三季度经营租赁收入为3056万元，同比+103%，Q3单季为1011万元，同比+77%。业务运营稳健，不良率维持低位。1）前三季度公司业务及管理费同比+15.7%，占总营收比重为9.3%，同比小幅+0.3pct，较上半年基本持平。2）公司资产质量保持较优水平，Q3末不良率为0.94%，较年初+0.03pct，较年中持平。3）付息债务规模为917亿元，较年初+7.3%，较年中-1.1%。其中短期借款/拆入资金/长期借款/应付债券分别较年初-16%、+12%、+9%、-8%。看好公司长期发展空间，“优于大市”评级。我们认为江苏金租作为A股稀缺的金融租赁标的，坚定实施零售战略，金融科技赋能业务发展，特色“厂商租赁”模式兼顾客户拓展与风险防控，看好公司未来发展空间与净利差优势。同时上市以来公司分红率均在40%以上，2022年股息率达6.4%。参考可比公司，我们给予公司1.4x 2023E PB（原为1.3x），得到目标价5.79元（+8%），当前股价对应1.1x 2023E PB，维持“优于大市”评级。风险提示：宏观经济增长不及预期；社会信用风险水平大幅提升。,,海通国际证券,优于大市,[None],2023-11-05,,买入,5378030,pdf_downloads/2023/2023-11-05/600901-江苏金租（600901）公司季报点评：净利差同比扩大，不良率维持低位.pdf,600901,江苏金租,江苏金租（600901）公司季报点评：净利差同比扩大，不良率维持低位
高超,业绩符合预期，净利差保持高位2023前3季度公司营业收入/归母净利润为36.4/20.4亿，同比+12.0%/+11.8%，前3季度年化ROE 16.4%，较2022年+0.6pct，业绩符合我们预期。2023Q3营业总收入/归母净利润为12.3/7.2亿元，环比+2.3%/+13.2%，同比+11.3%/+12.4%。资产规模增速稳健增长，生息资产收益率有所上升，付息债务成本环比增长，净利差环比小幅收窄，同比仍保持扩张，不良率环比持平。考虑资产端规模增速略低预期，我们小幅下修公司2023-2025年归母净利润预测至27.5/30.9/34.9亿（调前27.5/31.3/35.3），同比+14%/+13%/+13%，ROE为16.3%/16.6%/16.9%，EPS为0.65/0.73/0.82元。3季度主动权益基金明显加仓公司，公司资产端能力突出，有可持续的高ROA和低不良率是其估值溢价来源。当前股价对应股息率5.2%，对应2023-2025年PB 1.1/1.0/0.9倍，维持“买入”评级。租赁资产规模微增，生息资产收益率提升，净利差保持高位（1）2023Q3末公司应收融资租赁款余额1139亿，同比+9.2%，环比+0.1%，应收融资租赁款余额环比净增加0.9亿元，略低于预期。2023年9月PMI重返50%以上，需求有所好转，四季度资产端投放环比有望增长。（2）我们测算2023年前3季度公司年化生息资产收益率为6.75%，较2023H1提升0.02pct，较2022年-0.07pct，好于预期。我们测算前3季度年化付息债务成本率3.00%，较2023H1提升0.05pct，2022年以来银行间拆入资金利率呈下降趋势，驱动公司负债端成本下降，目前保持较低水平。我们测算前3季度公司净利差为3.75%，较2023H1下降0.03pct，与2022年的3.65%相比有所扩张并保持高位。资产质量稳健，计提信用减值损失环比下降2023Q3末公司不良率为0.94%，环比持平，较年初+0.03pct，关注率3.28%，环比+0.21pct，较年初-0.17pct。期末公司拨备覆盖率为435%，环比+12pct，拨贷比4.08%，环比+0.10pct，整体拨备仍保持充足水平。前3季度公司计提信用减值损失5.6亿，同比+10%，2023Q3计提1.4亿，环比-38%，同比-1%。风险提示：竞争加剧造成利差收窄；资产规模投放不及预期。,,开源证券,买入,[None],2023-10-30,,买入,5368058,pdf_downloads/2023/2023-10-30/600901-江苏金租（600901）2023三季报点评：业绩符合预期，净利差保持高位.pdf,600901,江苏金租,江苏金租（600901）2023三季报点评：业绩符合预期，净利差保持高位
"沈娟,汪煜",盈利增长保持稳健，资产质量优异公司发布2023年三季报：公司23Q1-3营业收入36.40亿元，同比+12.01%；归母净利润20.41亿元，同比+11.79%；ROE12.27%（未年化），同比+0.12pct。23Q3单季度营业收入12.28亿元，同比+11.33%，环比+2.3%；归母净利润7.23亿元，同比+12.40%，环比+13.18%。预计公司2023-2025年归母净利润为26.9/30.2/33.2亿元，2024年BPS为4.69元，可比公司2024年PB朝阳永续一致预期为0.79倍，考虑到公司经营表现整体向好，小微转型逐步深化，资产质量保持优异，给予2024年PB估值溢价至1.2倍，对应目标价5.63元，维持买入评级。净利差同比上升，资产规模稳健增长公司23Q3末租赁资产余额1139亿元，较22年末增长9.53%。23Q1-3租赁业务净利差3.69%，同比+0.13pct，盈利能力持续增强。从收入结构看，23Q1-3经营租赁收入3056.27亿元，同比+102.67%，实现大幅抬升。23Q3应付债券规模127.40亿元，较22年末-8.08%，有所压降。23Q3末杠杆率14.45%，较22年末-0.15pct，有所下滑。资产质量保持优异，资本储备较为充足23Q3末不良融资租赁资产率0.94%，较22年末+0.03pct，有小幅提升但稳定在1%以内，整体保持优良；关注率3.28%，较22年末-0.17pct；拨备覆盖率435.12%，较22年末-21.98pct；拨备率4.08%，较22年末-0.09pct。资金端方面，23年10月，公司获准在全国银行间债券市场发行不超过 45 亿元人民币的绿色金融债券。截至23Q3末，公司核心一级资本充足率14.34%，资本充足率为15.50%，较22年末有小幅下滑，但仍高于监管标准，资本储备较为充足。坚持“零售+科技”战略，厂商区域双线并进公司坚持“零售+科技”战略，“3+N”业务板块稳健发展，租赁资产规模稳步增长，专注于能源环保、交通运输、高端装备三大重点板块，医疗、旅游、科技等多个细分行业。坚持“厂商+区域”双线并进，与数千个国内外龙头厂商、经销商建立合作关系。公司不断提高信息安全自主可控水平，打造“天地人网”概念，采用卫星方式监控独立厂区的数据，推动实现业务线上化、自动化，如电子签约、收付款等功能，金融科技实力领先。风险提示：市场景气度下行、创新业务开展不及预期。,,华泰证券,买入,[None],2023-10-29,,买入,5363168,pdf_downloads/2023/2023-10-29/600901-江苏金租（600901）：利润增长稳健，资产质量优异.pdf,600901,江苏金租,江苏金租（600901）：利润增长稳健，资产质量优异
"刘雨辰,曾广荣",业绩表现亮眼，不良实现双降 事件：江苏金租发布2023年三季报，前三季度实现营业收入36.40亿元，同比+12.01%，增速较上半年-0.35PCT；归母净利润20.41亿元，同比+11.79%，增速较上半年+0.33PCT。整体业绩维持双位数增长从单季度来看，江苏金租23Q3实现营收、归母净利润分别为12.28、7.23亿元，同比分别+11.33%、+12.40%，同比增速较二季度分别-0.39PCT、-0.22PCT。拆分收入来看，23Q3利息净收入、手续费及佣金净收入、其他非息净收入分别同比+19.30%、-170.36%、+56.64%，同比增速较二季度分别+3.82PCT、-30.19PCT、+228.22PCT。利息净收入同比增速环比提升以及手续费净收入同比大幅下降，主要系公司响应监管要求，主动调整了对小微客户等特殊群体的收费方式，将手续费收入纳入了利息收入。其他非息净收入同比增速大幅提升，主要系：1）由于三季度人民币贬值压力偏大，公司外币资产升值，三季度实现汇兑净收益996.69万，同比+59.09%；2）公司三季度实现经营租赁收入1010.57万元，同比+77.07%。预计主要系经营租赁业务快速发展，船舶等领域经营性租赁规模快速增长。规模增速边际放缓，利差继续维持高韧性规模方面，截至23Q3末，江苏金租应收租赁款余额为1139.21亿元，同比+9.22%，增速较上半年-0.45PCT。价方面，前三季度江苏金租累计租赁业务净利差为3.69%，较上半年小幅-2BP。净利差韧性较强，预计主要受益于负债端。1）负债端结构持续优化。截至23Q3末，江苏金租拆入资金占付息债务的比为78.13%，占比较23Q2末+0.20PCT；2）公司拆入资金成本预计有所下滑。23Q3银行间同业拆借利率有所下行，3月期与6月期平均拆借利率水平分别为2.63%、2.70%，环比分别-29.09、-14.32BP。资产端预计实际收益率有所下滑。根据我们当前的测算，江苏金租23Q3单季度租赁收益率为6.86%，同比+39.36BP，主要系公司部分手续费收入纳入利息收入。从实际情况来看，公司以资产质量为底线，加大了对战略客户、行业龙头客户以及国有客户等的投放，或对资产端收益率形成一定冲击。总体来看，公司当前业绩在当前环境下表现较好。展望后续，公司业务开拓能力依旧强大，预计应收租赁款余额全年增速将达到两位数。后续随着经济复苏，资产端可继续下沉以对冲资产端收益率下行，净利差有望企稳。不良实现双降，资产质量优异截至23Q3末，江苏金租不良租赁款余额10.69亿元，较期初+12.56%，增速较上半年-0.23PCT；不良率为0.91%，较年中-3BP，预计主要系公司主动上浮客群。三季度信用成本率为0.65%，环比-0.11PCT。拨备计提充足，风险抵补能力较强。截至23Q3末，公司拨备覆盖率为435.12%，较年中+11.89PCT。盈利预测、估值与评级考虑到公司业务收费模式调整以及当前利率持续下行等背景，我们预计公司2023-2025年营业收入分别为48.85、54.87、61.42亿元（原值为50.38、56.70、64.10亿元），同比增速分别为12.41%、12.30%、11.94%，3年CAGR为12.22%；归母净利润分别为26.93、30.74、34.43亿元（原值为27.97、32.00、36.25亿元），同比增速分别为11.67%、14.16%、11.98%，3年CAGR为12.60%。BVPS分别为4.21、4.65、5.14元/股。鉴于公司业务开拓能力强大，科技有效赋能风控，资产质量整体优异。参照可比公司估值，我们给予公司2024年1.30倍PB，目标价6.05元，维持为“买入”评级。风险提示：不良率上升，资金错配导致流动性风险，市场竞争加剧,,国联民生证券,买入,[None],2023-10-28,,买入,5362561,pdf_downloads/2023/2023-10-28/600901-江苏金租（600901）：业绩表现亮眼，不良实现双降.pdf,600901,江苏金租,江苏金租（600901）：业绩表现亮眼，不良实现双降
"刘雨辰,曾广荣",公司作为高股息绩优标的有望持续实现估值提升事件：公司近期市场表现优异，估值持续修复。年初至今，江苏金租、沪深300分别累计+27.03%、-4.06%，江苏金租实现超额收益31.08%。权益市场整体波动背景下高股息标的投资性价比提升2023年以来，我国经济整体处于弱复苏过程，整体复苏动能偏弱，叠加海外利率维持高位，导致我国权益市场整体波动较大。2023年初至今，上证指数、深证成指、沪深300以及科创板累计收益率分别为0.85%、-8.13%、-4.06%、-14.55%，年化波动率分别为11.27%、11.61%、14.18%、18.78%，权益市场整体表现呈现低收益高波动特征。相较之下，高股息股票由于具备相对稳定的股息收入，且业绩波动通常也相对更小，得到了市场资金的青睐，以股息龙头全收益指数（921373）为例，一方面，该指数2022年股息率达到5.73%；另一方面，该指数2023年年初至今累计涨幅为13.09%，年化波动率为13.77%。可以看到高股息股票今年的表现明显优于整体权益市场表现，投资性价比凸显。江苏金租股息率处于高位，外资增持对股价构成支撑近年来，江苏金租股息率稳步提升。2022年江苏金租股息率高达7.46%，与2021年基本持平，较2018年提升超3PCT。从A股来看，2022年江苏金租股息率在全体A股中排名67位，排名较2021年提升38名。若假定公司2023年股利支付率为近五年平均水平，按照2023年9月25日收盘价计算的公司2023年股息率为6.59%，依旧维持在较高水平。受益于江苏金租较高的股息率，外资也持续买入江苏金租。年内来看3/13-5/19、7/12-8/10、8/24-9/22期间陆股通分别累计净买入15010、3492、2807万元，期间江苏金租分别累计上涨19.78%、15.09%、7.00%。受益于外资的持续流入，截至2023年9月22日，陆股通持有江苏金租股份数量占自由流通股本的4.58%，较年初提升4.57PCT；持有市值占流通A股的1.63%，较年初提升1.63PCT，对公司股价构成了明显支撑。公司基本面优异，转债强赎助推公司股价表现的同时补充了核心资本 公司深耕租赁领域多年，当前已经形成“厂商+区域”双线并进的营销渠道，具备强大的业务开拓能力。截至23H1末，公司总资产达到1169.52亿元，较期初+7.30%。其中租赁资产余额为1138.31亿元，较期初+9.45%，增速高于整体扩表速度。强大业务开拓能力有望支撑公司提前实现2026-2027年资产规模达到1800亿左右的目标。受益于资产端的快速扩张，23H1公司实现营收24.12亿元，同比+12.35%；归母净利润13.18亿元，同比+11.45%，预计2023年公司营收与归母净利润均有望实现15%+的增速。此外，2022年公司制定“零售+科技”双领先战略后，江苏金租在科技方面成效显著，江苏金租智管万物平台可以实时监测租赁物的运作状态，帮助公司及时发现、处置风险，从而帮助公司有效控制零售业务下沉时期的风险。截至23H1末，公司融资租赁资产不良率与关注率分别为0.94%、3.06%，较一季度末分别+2BP、-34BP。强大的风控能力使得公司未来有能力下沉客群以对冲当前利率下行对公司业绩带来的负面影响。2023年8月11日，公司公告称苏租转债触发强赎条件，对江苏金租短期股价表现有所推动，尽管后续公司称1年内不强赎苏租转债，后续苏租转债转股有望补充公司核心资本，助力公司业务发展。盈利预测、估值与评级鉴于公司优异的基本面、强大业务能力与风控能力，公司2023-2025年营业收入分别为50.38、56.70、64.10亿元，同比增速分别为15.92%、12.56%、13.04%，3年CAGR为13.83%。归母净利润分别为27.97、32.00、36.25亿元，同比增速分别为15.98%、14.40%、13.31%，3年CAGR为14.56%。BVPS分别为4.23、4.69、5.20元/股。鉴于公司优异基本面与强大的发展潜力，我们给予公司2023年1.35倍PB，目标价5.71元，维持为“买入”评级。风险提示：不良率上升，资金错配导致流动性风险，市场竞争加剧,,国联民生证券,买入,[None],2023-09-25,,买入,5336624,pdf_downloads/2023/2023-09-25/600901-江苏金租（600901）：公司作为高股息绩优标的有望持续实现估值提升.pdf,600901,江苏金租,江苏金租（600901）：公司作为高股息绩优标的有望持续实现估值提升
