author,content,filename,org_name,original_rating,pdf_link,publish_time,rating_adjust_mark_type,rating_changes,report_id,save_path,stock_code,stock_name,title
李斌,2025年8月30日│中国内地/中国香港 钢铁 马钢股份发布半年报，2025年H1实现营收380.76亿元（yoy-11.47%），归母净利-7478.03万元（yoy+93.47%），扣非净利-1.08亿元（yoy+91.25%）。其中Q2实现营收186.51亿元（yoy-17.53%，qoq-3.99%），归母净利6930.01万元（yoy+108.31%，qoq+148.10%），归母净利扭亏为盈主因钢材产量增加、控本有效。公司盈利向好趋势已经确立；后续若钢铁反内卷政策落地，或进一步改善行业和公司利润，维持“持有”评级。25H1钢材产量增加并积极控制成本，Q2业绩转正25H1公司钢铁产品产量和销量分别为963万吨（yoy +8.0%）和966万吨（yoy +9.2%）。25H1继续优化产品结构，重点品种钢结算277万吨，同比增长22%。此外，公司通过产供联动、品种替代，积极降低炉料采购成本，1-6月份港口铁矿现货采购均价累计跑赢指数4.58美元/吨；1-6月份炼焦煤采购成本1267元/吨，较行业平均成本低10.67元/吨。25H1公司销售毛利率4.81%（yoy +3.59 pct）；25H1期间费用合计约13.7亿元（yoy -2.6%）。25Q1归母净利润-1.44亿元，同环比均大幅减亏；25Q2资产减值损失3.37亿，但实现归母0.69亿元；我们认为公司盈利向好趋势确立。24Q3钢铁行业景气探底，25年反内卷迫切性与战略性进入博弈期进入2025年，我们认为反内卷的短期迫切性和长期战略性进入博弈阶段。2024Q3至2025H1行业景气通过自发性减产得以改善，247家钢铁企业盈利率回升至25H1的59%，降低了反内卷的短期迫切性。据Wind，25H1 日均铁水产量约为235.5万吨，较24H1同比增3.4%，反内卷减产尚未进入实质执行阶段。未来减产能否落地或更多取决于政府对于钢铁行业反内卷的战略性定位。反内卷政策若落地触发粗钢减产，或进一步改善行业利润。维持“持有”评级我们维持盈利预测，测算公司25-27年归母净利分别为0.85、11.37、17.08亿元；BVPS为3.02、3.17、3.34元，公司近五年PB均值0.85X，我们上调溢价50%反映公司盈利向好趋势确立，后续若钢铁反内卷政策落地，或进一步改善行业和公司利润，25年PB取1.30X；并基于人民币与港元汇率0.91、A/H溢价率66%（25-8-29），A/H目标价3.93元/2.61港元（前值3.22元/1.93港元，基于25年PB 1.06X），维持“持有”评级。风险提示：大宗商品价格波动、国内钢铁反内卷政策落地情况。,,华泰证券,持有,[None],2025-08-31,,中性,6371294,pdf_downloads/2025/2025-08-31/600808-马钢股份（600808）：降本增产，Q2业绩转正.pdf,600808,马钢股份,马钢股份（600808）：降本增产，Q2业绩转正
"许勇其,黄玺",马钢股份(600808)主要观点：中国宝武控股，安徽头部钢企马钢股份由央企中国宝武集团控股，目前形成马钢本部、长江钢铁、合肥公司、法国瓦顿公司四大生产基地，具备2300万吨钢配套产能。公司构建了以特钢、轮轴、长材、板材四大系列为核心的多元化产品结构，2024年公司长材和板材业务贡献收入分别为41%/44%。公司在轮轴板块具备优势，是CR450动车组高速车轮核心供应商，2024年轮轴产品毛利率16.85%(同比+2.76pcts）。2022年以来由于房地产开发投资下降影响钢铁需求，钢铁行业整体下行，公司2022-2024年归母净利润为负。但随着吨钢成本优化，公司25H1特钢连续4个月实现正毛利、长材产品连续5个月实现正毛利，Q2归母净利预期转正。钢铁行业供需格局优化，成本压力缓解利润回升近年来国内相关单位频繁对钢铁供给端进行产业结构指导，严控钢铁产能，产能置换全面收紧，低效及高能耗产能有望逐步出清，产能布局逐步优化，2025年6月粗钢/生铁产量同比分别-9.2%/-3.5%。需求端，2025年新开工面积降幅收窄，地产需求逐步企稳，出口、基建和制造业等需求维持上升抵消了地产端的拖累，钢铁行业需求结构优化。成本端，2025年7月铁矿石/焦炭价格较上年同期分别-9.0%/-39.8%，主要原材料价格下行，钢企利润有望释放。灵活调整产品结构，重点品种销量提升马钢股份立足华东，利用区位优势占据安徽省内汽车、家电等重点用钢市场份额。同时，公司将定价权、接单权、用户渠道开拓权下沉至营销子公司提升市场敏捷反应能力，“研产销”一体化调整品类结构，推动优势产品放量，如2024年根据下游需求变化减少了建筑长材的产销，增加了汽车板等需求、价格和效益较好的产品的产销量，全年实现重点品种销售482万吨（同比+130万吨），其中汽车板销量315万吨，同比增长10.5%。投资建议公司是安徽省头部钢企，轮轴板块具备优势，随着钢铁行业结构优化，长板材具备盈利修复机会。我们预计公司2025-2027年归母净利润分别为0.79/9.47/19.79亿元，对应PE分别为378/32/15倍，首次覆盖给予“买入”评级。风险提示铁矿石、焦炭等原材料价格大幅波动；下游需求不及预期；安全生产及环保风险等,,华安证券,买入,[None],2025-08-15,,买入,6310784,pdf_downloads/2025/2025-08-15/600808-马钢股份（600808）：安徽头部钢企，业绩修复可期.pdf,600808,马钢股份,马钢股份（600808）：安徽头部钢企，业绩修复可期
"李鹏飞,魏雨迪,王宏玉",本报告导读：钢铁需求持续偏弱，公司业绩短期承压，2024Q4业绩不及预期。但展望来看，我们持续看好行业需求改善与供给重塑，公司盈利仍有望逐步修复。投资要点：维持“增持”评级。2024年公司营收818.17亿元，同比降17.30%；归母净利润-46.59亿元，同比降33.32亿元。其中，2024年第四季度营收203.03亿元，同比降18.86%，环比增9.71%；归母净利润-21.24亿元，同比降23.95亿元，环比降7.34亿元，第四季度业绩略不及预期，我们认为一方面系钢铁需求持续偏弱，行业盈利继续承压；另一方面系公司四季度资产减值损失和资产处置收益合计为-9.26亿元，而三季度合计损益为1.98万元，环比亏损额大幅提升。我们维持对公司2025-2026年的归母净利润预测为1.20/1.77亿元，新增2027年归母净利润预测为2.69亿元，对应EPS为0.02/0.02/0.03元。参考可比公司，给予公司2025年1.15倍PB估值，上调目标价为3.48元，维持“增持”评级。优化产品结构，建筑长材产销量显著下降。2024年公司钢材总销量1830万吨，同比降230万吨；其中板材、长材、轮轴销量为981、824、25万吨，同比分别降22、205、3万吨。2024年公司综合吨钢毛利-42.34元/吨，同比降121.47元/吨；其中板材、长材、轮轴吨毛利为30.47、-176.98、1904元/吨，同比分别降99.71、降112.70、增257.57元/吨。受地产持续下行影响，公司长材亏损，2024年公司减少螺纹、H型钢等建筑长材产销量，同时增加特钢、汽车板等效益较好的产品产销量，以优化自身产品结构，抵抗部分行业下行压力。将本部钢铁主业资产等，以增资方式转入全资子公司马钢有限。公司2025年1月25日公告，拟将本部钢铁主业资产、负债、人员、业务，所持15家全资及控股子公司股权及所持3家参股公司股权整体增资转入马钢有限，本次增资不会导致公司合并报表范围变动。持续看好行业供需格局改善，盈利有望修复。近年来，随着地产下行，地产端用钢需求占比下降，我们认为未来地产对需求的负向拖拽效应有望逐步减弱，钢铁需求有望逐步企稳。供给端来看，国家发改委提出：“2025年持续实施粗钢产量调控，推动钢铁产业减量重组”。随着行业加快并购重组，集中度提升将带来盈利的长期修复。风险提示：钢铁需求大幅下降，钢铁供给端收缩不及预期。,,国泰海通,增持,[None],2025-04-17,,买入,6666786,pdf_downloads/2025/2025-04-17/600808-马钢股份（600808）：2024年度报告业绩点评：公司业绩短期承压，未来仍有望逐步修复.pdf,600808,马钢股份,马钢股份（600808）：2024年度报告业绩点评：公司业绩短期承压，未来仍有望逐步修复
李斌,2025年4月01日│中国内地/中国香港 普钢  马钢股份发布年报，2024年实现营收818.17亿元（yoy-17.30%），归母净利-46.59亿元（yoy-251.06%）。其中Q4实现营收203.04亿元（yoy-18.85%，qoq+9.72%），归母净利-21.24亿元（yoy-884.82%，qoq-52.82%），低于我们的预期主因年末公司计提资产减值5.8亿元、资产处置收益亏损3.4亿元。供给侧优化重启或渐进，2025年公司业绩有望触底反弹，维持“持有”评级。2024年钢铁行业低迷致业绩承压2024年钢铁行业景气度低迷，需求量、价格及行业利润均下行。据Wind，2024年中国钢材价格指数平均值为102.47点，同比-8.39%；同期进口铁矿石均价106.93 美元/吨，同比-7.08%，降幅小于钢价降幅。2024年公司生产生铁1808万吨、粗钢1983万吨、钢材1836万吨，同比分别-5.99%、-5.41%及-10.92%；公司毛利率同比下降2.36pct至-0.94%。同时，公司全年计提资产减值损失9.3亿元、其中Q4为5.8亿元；资产处置收益亏损2.7亿元，其中Q4亏损3.4亿元。因此最终2024年公司归母净利亏损幅度大幅扩大至46.59亿元。钢铁行业景气度处于近10年低位，供给侧优化迫在眉睫2024年钢铁行业依旧处于调整阶段，传统用钢行业下行压力仍在、原燃料价格仍处高位，钢铁行业运行持续呈现高产量、高成本、高出口、低需求、低价格、低效益的“三高三低”局面，“减量发展、存量优化”阶段的特征日益明显。2024年我国粗钢产量为10.05亿吨，国内折合粗钢表观消费量8.92亿吨，供给较过剩；中钢协重点统计企业实现利润总额429亿元，同比下降50.3%；平均销售利润率0.71%，同比-0.63pct。针对持续下行的行业景气，2024年以来政府多方积极发声，强调严控钢铁产量，防止“内卷”式恶性竞争，进一步预示供给侧优化重启或渐近。维持“持有”评级供给侧优化重启或渐进，25年公司业绩有望触底反弹。24年公司钢材销量低于我们先前的预期，我们下调25-26年钢材销量，测算公司25-27年归母净利分别为0.85、11.37、17.08亿元（前值25-26年0.93、11.79亿元）；BVPS为3.02、3.17、3.34元，公司近五年PB均值0.85X，给予溢价25%反映25年业绩或受益于行业利润改善而扭亏，25年PB取1.06X；并基于人民币与港元汇率0.92273、A/H溢价率81%（25年以来公司股价上涨较好后A/H溢价率收窄较多，取25/3/31溢价率），A/H目标价3.22元/1.93港元（前值3.02元/1.48港元，基于25年PB 0.94X），维持“持有”评级。风险提示：大宗商品价格波动、国内政策落地情况。,,华泰证券,持有,[None],2025-04-03,,中性,5975712,pdf_downloads/2025/2025-04-03/600808-马钢股份（600808）：2024年钢铁行业低迷致业绩承压.pdf,600808,马钢股份,马钢股份（600808）：2024年钢铁行业低迷致业绩承压
李斌,公司目前定位为钢铁央企-中国宝武“优特长材核心力量、板带材重要力量”。24年以来国内钢材需求拖累钢材价格下行，且降幅多于原料价格降幅，行业利润承压。公司24Q1-3合计亏损25.35亿元。行业利润是公司业绩扭转的关键因素，我们认为25-26年行业利润有望改善，关注国内供需两端政策落地情况。我们对公司维持“持有”评级。定位宝武“优特长材核心力量、板带材重要力量”公司19年并入央企“宝武系”，目前定位为集团“优特长材核心力量、板带材重要力量”，截至23年底总产能2050万吨。长材方面，公司主要产品包括型钢和线棒材，23年/24Q1-3产量1030/575万吨，螺纹钢生产主体长江钢铁24H1净亏损5.8亿元。板材方面，公司主要产品包括热轧薄板、冷轧薄板、镀锌板及彩涂板，23年/24Q1-3产量942/736万吨。24H1毛利率0.8%，同比+4.6pct。轮轴方面，公司主要产品包括火车轮、车轴及环件，23A/ 24Q1-3产量28/20万吨。公司近十年来积极推进国产化高速车轮推广应用，期待该类产品放量后优化轮轴产品结构、进一步增厚利润。特钢方面，公司新特钢项目产品受制于长认证周期仍处于爬坡期，目前该产品整体盈利能力仍较弱但逐步改善中，24H1该产品整体毛利率-4.02%，同比+9.98pct。静待行业盈利回暖，关注国内供需两端政策落地情况24年以来国内钢材需求拖累钢材价格下行，降幅多于原料价格降幅，行业利润承压。据My Steel，中国主要钢材品种行业平均毛利全年基本处于亏损状态。公司24Q1-3合计亏损25.35亿元。展望未来，行业利润是公司业绩扭转的关键因素。据华泰金属《2025年中正平和，静待新周期》（24-11-6），钢铁行业或进入减量发展、存量优化阶段。24年8月工信部已暂停钢铁产能置换工作；中钢协将尽快建立已有产能退出机制。若该些政策有效落地、出台更多供给侧限制政策，以及国内积极经济政策有效刺激需求，我们认为25-26年钢材价格有望跌速变缓。同时25-26年铁矿石仍有供给增量，我们判断铁矿石价格降幅或多于钢材价格，行业利润有望改善。给予A/H目标价3.02元/1.48港元我们测算公司 24-26 年归母净利为-28.97亿元、0.93亿元和 11.79 亿元，对应 EPS 为 -0.37、0.01、0.15元；BVPS为3.21、3.22、3.37元。维持公司A/H 的“持有”评级，目标价3.02元（近三年PB均值0.75X，溢价25%反映2025年业绩或受益于行业利润改善而扭亏，取PB为0.94）和1.48港元（近一年A/H溢价率120%）。风险提示：大宗商品价格波动、国内政策落地情况。,,华泰证券,持有,[None],2024-12-26,,中性,5874923,pdf_downloads/2024/2024-12-26/600808-马钢股份（600808）：业绩承压，静待行业盈利回暖.pdf,600808,马钢股份,马钢股份（600808）：业绩承压，静待行业盈利回暖
王帅,"马钢股份(600808)1H23净利同比转亏，行业走出底部仍待需求推动马钢股份1H23归母净利润录得亏损22.4亿元，同比转亏（去年同期归母净利润14.3亿元）；其中2Q23亏损环比扩大12.2亿元至17.3亿元。亏损主因市场下游需求承压，钢材平均价格下行，且下行幅度大于原材料端的成本下降，使得利润承压同比转亏。二季度钢材交易从强预期转向弱复苏，价格快速下行，使得公司亏损环比进一步扩大。在强力的产量平控政策缺失的情况下，下游需求的反弹幅度将是决定行业及公司下半年利润表现的关键因素。维持马钢股份A/H的“持有”评级，目标价2.4元（0.62x2023EBVPS3.8元,较2008年以来历史均值折价40%以反映业绩承压）和1.4港元（较A股折价48%，与当前最新折价水平一致）。2023-2025年预测EPS为0.06/0.08/0.16元。下行周期利润承压，轮轴产品毛利逆势扩大1H23公司钢材产销量同比小幅下滑，实现产/销量1,013/1,021万吨，分别同比减少5.3%/4.6%，销量减少部分抵消了原材料价格下行对成本端的贡献，单吨成本基本保持稳定，而单位均价受市场下行影响同比减少675元/吨（-14.3%yoy），使得单吨毛利下滑717元/吨转亏至-238元/吨。相对钢材产品整体的利润转亏，公司轮轴产品高端溢价体现，单吨均价仅下滑5.5%，毛利率同比逆势扩大4pct至14.1%。公司持续投入品种质量提升项目优化产品结构，型钢改造2#连铸机工程项目及新特钢项目一期工程在1H23建成投产，新特钢高端产品未来有望助力公司形成新的盈利增长点。需求复苏力度是行业利润扭转关键因素我们认为下半年的钢铁行业需要关注三个核心变量，出口的持续性、产量平控的落地以及旺季需求的改善。1H23同比大幅提升的钢材出口量部分抵消了下游需求弱复苏的缺失，而随着国内外钢材价差的缩小，下半年出口对需求端的支撑或将减弱。同时，目前仍然缺少强有力的产能平控政策的实施，若仅靠利润下行被动压缩供给端或较难对供需弱平衡产生有效影响。国内下游行业能否在近期刺激政策不断出台中带动旺季需求回暖是决定行业利润表现的关键因素，尤其是地产行业的复苏力度将是决定行业是否可以实现底部反转的重要驱动力。风险提示：地产销售弱于预期；产量管控弱于预期。",,华泰证券,持有,[None],2023-09-01,,中性,5309658,pdf_downloads/2023/2023-09-01/600808-马钢股份（600808）：行业基本面承压，季度亏损环比扩大.pdf,600808,马钢股份,马钢股份（600808）：行业基本面承压，季度亏损环比扩大
王帅,"1Q23盈利环比虽改善但仍录得亏损马钢股份1Q23归母净利润录得亏损5.09亿元，环比4Q22的15.2亿元的亏损有所改善。钢材产品季度销量环比增加4.6%，叠加单位生产成本环比降低22.6%，抵消了14.4%的钢材价格环比下降带来的负面影响，吨钢毛利环比显著改善约520元/吨。我们预计2023年中国钢铁行业基本面较难有反转，供给端缺乏生产纪律性是制约利润反弹的主要因素。维持马钢股份A/H的“持有”评级，目标价3.0元（0.78x 2023E BVPS 3.8元,较历史均值折价25%以反映业绩承压）和1.9港元（较A股折价44%，与当前最新折价水平一致）。2023-2025年预测EPS为0.06/0.08/0.16元。产销量环比复苏，2Q23盈利仍将承压1Q23实现钢材产量482万吨，环/同比增幅4%/-7%。实现销量481万吨，环/同比增幅4.6%/-6%，产销量环比均有所改善，但仍未恢复到去年同期。其中长材和板材销量环比出现分化，环比分别增长-7.5%和19.5%，或受下游不同行业景气度影响，板材销量受制造业相对复苏较好带动，而长材销量受地产投资影响较大。公司在经历3Q/4Q净亏损7.6亿/15.2亿后，1Q23盈利小幅改善，亏损幅度收窄至5.09亿元，毛利率环比改善10.8个百分点至-0.3%。1Q23公司实现板材/长材/轮轴平均售价4,299/3,872/11,420元/吨，同比变化-12.5%/-14.2%/2.2%，同期营业收入下降14.5%，在钢材价格转入交易弱现实背景下，公司2Q23盈利或仍将承压。2023钢铁行业难现逆转变量，阶段性波动或是主基调我们预计2023年中国钢铁行业仍将承压运行并且难现逆转变量，阶段性的供需调整或造成行业的窄幅波动。行业缺乏生产纪律性仍然是制约供需改善和利润大幅提升的主要因素。我们预计2023年中国钢铁表观消费同比增长2%，但2H23钢铁出口或弱于1Q23的强劲表现。4月份以来，随着铁水/粗钢产量的持续攀升以及表观消费的环比滞涨，行业去库速度慢于往年导致钢铁价格从强预期支撑切换到反应弱预期，目前各钢铁品种即时盈利已经跌至年内最低水平并且亏损幅度迅速扩大。行业潜在的产量平控或有利于缓解供需矛盾，但在弱需求背景下或无法构成逆转性变量。风险提示：地产销售弱于预期；产量管控弱于预期。",,华泰证券,持有,[None],2023-05-01,,中性,5198955,pdf_downloads/2023/2023-05-01/600808-马钢股份（600808）：1Q23盈利环比虽改善但仍录得亏损.pdf,600808,马钢股份,马钢股份（600808）：1Q23盈利环比虽改善但仍录得亏损
王帅,"钢价下行利润承压，22年录得净亏损马钢股份2022年受钢价下行影响录得净亏损8.6亿元（2021年净利润53.3亿元）。公司亏损额跟随钢价自2Q22起的大幅下行而逐季扩大，3Q/4Q22净亏损分别为7.6/15.2亿元。2022年公司主要钢材产品毛利在钢价回落以及原料成本高企的影响下同比收缩。我们预计2023年钢铁总体需求在稳地产稳经济的基调下将有小幅改善，而行业基本面改善程度将主要取决于供应端的政策调控力度以及钢企生产纪律性，在供应缺乏稳定持续的缩减之下，钢铁行业短期仍面临一定压力。维持马钢股份A/H的“持有”评级，目标价3.0元（0.78x 2023E BVPS 3.8元,较历史均值折价25%以反映业绩承压）和1.9港元（较A股折价44%，与当前最新折价水平一致）。2023-2025年预测EPS为0.06/0.08/0.16元。成本售价两端挤压致钢材毛利下滑受粗钢产能环保压减工作影响，22年公司粗钢产能利用率同比下滑4.5个百分点至93.46%，粗钢产量减少97万吨。钢材销量同比减少64万吨至1,988万吨，其中长材销量同比基本持平（1,022.7万吨），板材销量同比下滑11%至941万吨。轮轴销量同比提升12.6%至23.6万吨。我们测算公司板材/长材/轮轴全年单吨均价同比-7.4%/-2.5%/+4.2%，平均单吨成本同比+3.5%/+1.1%/+3.6%。受价格及成本两端挤压影响，长材及板材毛利同比下滑57.6%/82.5%，毛利率同比下滑3.47和10.3个百分点至2.65%及2.4%；轮轴毛利同比增长20.6%，毛利率同比提升0.44个百分点至15.1%。供应压减力度及行业生产纪律性决定基本面改善程度我们认为2023年钢铁行业在经济复苏的背景下将有所改善，但行业总体需求弹性较供应而言仍相对偏弱，我们预计23年钢铁需求增速小幅改善至0.5%。考虑到地产投资复苏的滞后、行业生产纪律性的缺乏、钢铁直接/间接出口的下降，行业利润实现反转仍较困难。尽管钢材价格在以稳地产促经济的预期下有所反弹，但铁矿石价格同步上涨挤压了大部分钢材利润改善空间。2023年行业供应端政策性压减力度以及行业自身生产纪律性仍是改善供需关系的核心变量，在供应缺乏稳定持续的缩减下，钢铁行业短期仍面临一定压力。风险提示：美联储加息超预期导致铜金价承压；下游需求不及预期。",,华泰证券,持有,[None],2023-03-31,,中性,5159601,pdf_downloads/2023/2023-03-31/600808-马钢股份（600808）：22年行业低谷，23年或小幅改善.pdf,600808,马钢股份,马钢股份（600808）：22年行业低谷，23年或小幅改善
王帅,"马钢股份(600808)2Q22利润环比大幅下滑，行业供需错配驱动钢价承压下行马钢股份（马钢）1H22在行业供需错配承压下利润同比大幅下降69.3%至14.3亿元。季度环比来看，2Q22净利润降至1.74亿元，环比1Q22的12.5亿元利润大幅下滑86.1%。行业2季度需求未能旺季复苏且铁水产量持续攀升，钢铁价格从4月起下降并从6月份加速下跌，钢铁行业出现较高比例产能的亏损。钢价下行下，马钢2Q22吨钢毛利环比1Q22下降46元/吨至411元/吨，毛利率也从1Q22的9.5%下降至2Q22的8.8%。基于更低的钢价预测，我们下调马钢22/23/24年净利润预测至25.0/29.4/32.0亿元（前值：44.8/46.9/47.5亿元），并下调A/H股目标价至3.2元（较H股溢价43%）/2.6港币（0.52x22EPB）。基于行业已经处于底部区域且产量压减或驱动阶段性的钢价反弹，维持“持有”。生产稳量提效，产品结构进一步提升，研发投入保持高强度1H22公司生产粗钢和钢材1,098万吨和1,070万吨，同比小幅减少2.1%和0.5%，稳产的同时进一步提升生产效率，铁水日产、转炉日产、轧钢产量等生产指标都进一步改善。同时，公司持续推进产品结构优化和差异化竞争力提升，销售战略性、独家、领先产品212万吨，同比增长12%；车轮销售26.4万件，同比增长40.7%；重型H型钢、特钢产品、风电轴承用圆坯、汽车钢等产品进一步扩量和提升市场份额。1H22研发费用保持在20.6亿元的高位，投资强度优于大多数钢铁上市公司，将为公司未来进一步提升产品结构和享受高端产品利润溢价奠定基础。行业盈利已处底部区域，产量压减或驱动钢价阶段性反弹1H22钢铁行业生产纪律性缺失下，铁水产量从3月采暖季限产之后持续攀升并在6月中旬触及243万吨/天的高位。然而2季度传统的旺季需求在疫情和地产疲弱的影响下缺席，导致旺季去库不力且钢价更多反映弱现实而非强预期。6月份钢价加速下行致行业亏损产能比例大幅增加。4月份发改委明确2022年继续进行产量压减，上周唐山地区开始明确压减指标，我们认为后续产量压减的落地执行将改善目前的供需失衡，通过政府主动调节供给端来改善行业供需关系，从而驱动钢价阶段性反弹。2023年钢价将取决于产量压减是否持续以及中国经济的复苏力度。风险提示：早于和强于预期的海外衰退；中国钢铁直接/间接出口下降。",,华泰证券,持有,[None],2022-09-01,,中性,4977858,pdf_downloads/2022/2022-09-01/600808-马钢股份（600808）：行业基本面承压下利润大幅下降.pdf,600808,马钢股份,马钢股份（600808）：行业基本面承压下利润大幅下降
