author,content,filename,org_name,original_rating,pdf_link,publish_time,rating_adjust_mark_type,rating_changes,report_id,save_path,stock_code,stock_name,title
刘昭亮,"投资要点。
    公司发布2015年三季报:2015年1~9月实现营业收入57.72亿元,同比下降18.77%,归属于母公司股东的净利润为5.13亿元,折合EPS0.25元,同比下滑11.89%。主要原因是液化石油气销售价格持续下跌导致亏损并拖累公司整体业绩,同时天然气销量有所增长但增速放缓。从天然气销售结构来看,其业务拓展形势良好,电厂用气销量下滑但工商业用气增速较好。随着公司大力发展工商业用户以及市场范围迅速扩大,天然气销售量达到11.13亿立方米,较上年同期11.28亿立方米下降1.33%,(其中电厂天然气销售量为2.50亿立方米,较上年同期3.28亿立方米下降23.78%;非电厂天然气销售量8.63亿立方米,较上年同期8亿立方米增长7.88%)。此外,液化石油气批发销售收入为8.93亿元,上年同期21.58亿元大幅下降58.59%,主要是液化石油气批发报告期价格持续下跌,前期购入液化石油气的成本较高所造成的亏损。
    公司将受益于天然气价格体制改革,需求将触底回升。能源体制改革箭在弦上,十三五规划亦即将出台,推进天然气价格的市场化改革,促进天然气消费是大势所趋。2015年前三季度由于天然气调价滞后,相对于石油和煤炭明显处于比价劣势,导致天然气整体消费大幅放缓。市场预计年底天然气价格即将下调,天然气消费增速有望触底回升。由于四季度是天然气的消费旺季,为了保障市场供应,短期内价格可能不会调整,我们预计年底或明年年初很可能迎来天然气价格下调,上游价格下调幅度在0.4~0.8区间。
    到时将改善下游天然气需求增长疲软状态,若工业天然气价格下调,将重新启动工业天然气需求的增长预期,从而带动公司毛利率的企稳回升。
    公司作为深圳市国资企业,受益于国企改革,资产重组及对外扩展有望加速。近期国企改革概念逐渐成为市场的热点,表现相对活跃。公司在引进战略投资者和经营层面均走在同行的前列,盈利水平和公司治理结构表现较为优秀。同时公司具有灵活的机制,能适应政策变化调整自身应对战略,在省外的业务拓展迅速,逐渐成为新的利润来源。另外,公司与深圳远致富海燃气产业投资企业达成《合作协议》,有望受益于国企改革下的资产重组或并购,有助于培养公司新的业务增长点。
    我们预测公司2015~2017年归属于母公司股东的净利润分别为6.75亿元、7.84亿元和10.02亿元,对应EPS分别为0.31元、0.36元和0.46元。公司业绩增速加快的主要原因是公司受益于国企改革环境下的价格改革政策,需求预期有望增加,另外异地项目的超预期扩张也为业绩向好提供有力支持。我们认为,政府对天然气价格下调对公司形成利好,且公司存在异地外延式持续扩张和并购预期,维持“买入”评级,目标价:10.86元-11.58元。
    风险提示:天然气消费需求受宏观经济增速放缓的影响;政策带来的管道燃气销量增速下滑的风险;异地市场扩张存在不确定性。",,中泰证券,买入,[None],2015-11-04,,买入,1701310,"pdf_downloads/2015/2015-11-04/601139-深圳燃气(601139)：受益于价格改革,需求将触底回升.pdf",601139,深圳燃气,"深圳燃气(601139)：受益于价格改革,需求将触底回升"
刘昭亮,"公司发布2015年三季报:2015年1~9月实现营业收入57.72亿元,同比下降18.77%,归属于母公司股东的净利润为5.13亿元,折合EPS0.25元,同比下滑11.89%。主要原因是液化石油气销售价格持续下跌导致亏损并拖累公司整体业绩,同时天然气销量有所增长但增速放缓。从天然气销售结构来看,其业务拓展形势良好,电厂用气销量下滑但工商业用气增速较好。随着公司大力发展工商业用户以及市场范围迅速扩大,天然气销售量达到11.13亿立方米,较上年同期11.28亿立方米下降1.33%,(其中电厂天然气销售量为2.50亿立方米,较上年同期3.28亿立方米下降23.78%;非电厂天然气销售量8.63亿立方米,较上年同期8亿立方米增长7.88%)。此外,液化石油气批发销售收入为8.93亿元,上年同期21.58亿元大幅下降58.59%,主要是液化石油气批发报告期价格持续下跌,前期购入液化石油气的成本较高所造成的亏损。
    公司将受益于天然气价格体制改革,需求将触底回升。能源体制改革箭在弦上,十三五规划亦即将出台,推进天然气价格的市场化改革,促进天然气消费是大势所趋。2015年前三季度由于天然气调价滞后,相对于石油和煤炭明显处于比价劣势,导致天然气整体消费大幅放缓。市场预计年底天然气价格即将下调,天然气消费增速有望触底回升。由于四季度是天然气的消费旺季,为了保障市场供应,短期内价格可能不会调整,我们预计年底或明年年初很可能迎来天然气价格下调,上游价格下调幅度在0.4~0.8区间。到时将改善下游天然气需求增长疲软状态,若工业天然气价格下调,将重新启动工业天然气需求的增长预期,从而带动公司毛利率的企稳回升。
    公司作为深圳市国资企业,受益于国企改革,资产重组及对外扩展有望加速。近期国企改革概念逐渐成为市场的热点,表现相对活跃。公司在引进战略投资者和经营层面均走在同行的前列,盈利水平和公司治理结构表现较为优秀。同时公司具有灵活的机制,能适应政策变化调整自身应对战略,在省外的业务拓展迅速,逐渐成为新的利润来源。另外,公司与深圳远致富海燃气产业投资企业达成《合作协议》,有望受益于国企改革下的资产重组或并购,有助于培养公司新的业务增长点。
    我们预测公司2015~2017年归属于母公司股东的净利润分别为6.75亿元、7.84亿元和10.02亿元,对应EPS分别为0.31元、0.36元和0.46元。公司业绩增速加快的主要原因是公司受益于国企改革环境下的价格改革政策,需求预期有望增加,另外异地项目的超预期扩张也为业绩向好提供有力支持。我们认为,政府对天然气价格下调对公司形成利好,且公司存在异地外延式持续扩张和并购预期,维持“买入”评级,目标价:10.86元-11.58元。
    风险提示:天然气消费需求受宏观经济增速放缓的影响;政策带来的管道燃气销量增速下滑的风险;异地市场扩张存在不确定性。",,中泰证券,买入,[None],2015-11-04,,买入,1701101,pdf_downloads/2015/2015-11-04/601139-深圳燃气(601139)季报点评：受益于价格改革 需求将触底回升.pdf,601139,深圳燃气,深圳燃气(601139)季报点评：受益于价格改革 需求将触底回升
"刘昭亮,李超","公司于3月28日发布2014年报:报告期内,公司实现营业收入95.31亿元,同比增长11.15%;归属母公司股东净利润7.21亿元,折合EPS0.36元,同比增长2%;销售毛利率19.28%,同比下滑0.78个百分点;净资产收益率13.28%,同比下滑0.92个百分点。2014年公司收入、利润和销气量虽继续增长,但增速已大幅放缓,主要受宏观经济减速,天然气价上调、原油价格暴跌后比价优势大幅降低的影响。目前随着天然气价格的下调和稳增长政策的陆续出台,经济探底回升后公司业绩将恢复2位数增长。
    天然气价上调和原油价格暴跌压制需求,公司加大增量电厂营销力度。随着公司大力发展工商业用户以及市场范围迅速扩大,天然气销售量达到15.22亿立方米,较上年同期增长10.13%,主要原因是公司发展的工商业增量用户所致——增加向深圳钰湖电力和深圳大唐宝昌燃气发电公司的天然气供应。但受经济下行、天然气调价和原油暴跌等因素的影响,天然气需求量受到一定影响。我们判断,随着增量气和存量气价格并轨过程中的气价下调,2015年天然气需求将有好转,预计全年销气量增速在15%~20%。
    西气东输二线保证气源供应,未来增量看电厂和异地扩张带来管道燃气的增长,以及LNG加气站销量的快速提升。西二线达产后,公司拥有40亿立方米的合同供气量,为下游客户拓展提供了充足的气源保障。环保政策明确深圳地区将不再新建燃煤电厂,天然气电厂将填补燃煤电厂停建带来的能源缺口,增量空间较大。目前公司积极拓展电厂、工商业、车船用LNG和异地市场扩张,推动管道燃气销量稳步增长。
    投资策略:预计公司2015~2017年归属母公司股东的净利润为7.80亿元、8.41亿元和9.09亿元,对应EPS为0.39元、0.42元和0.46元。公司业绩增速放缓的主要原因除需求放缓之外,还有上游气源采购成本上调影响,同时没有考虑到异地超预期扩张。我们认为在存量气和增量气并轨过程中的气价下调对公司形成利好,且公司存在异地外延式扩张的增长预期,维持“增持”评级,目标价:11.90~12.98元。
    风险提示:天然气消费需求受宏观经济增速放缓的影响;政策带来的管道燃气销量增速下滑的风险;异地市场扩张存在不确定性。",,中泰证券,增持,[None],2015-03-30,,增持,839123,"pdf_downloads/2015/2015-03-30/601139-深圳燃气(601139)：公司销气量有望回升,业绩拐点将显现.pdf",601139,深圳燃气,"深圳燃气(601139)：公司销气量有望回升,业绩拐点将显现"
"邹序元,周然","核心观点:

公司是国内燃气行业领先企业，立足深圳，辐射全国。公司总资产超过120亿元人民币，年营业收入达到95亿元人民币。公司运用市场化手段成功获得江西、安徽、山东、江苏、广西、广东、内蒙古等五省二区共20个城市的管道天然气特许经营权，拥有管道天然气客户超过180万户，覆盖人口达1000万人，运营管线超过7500公里。

公司构建以管道燃气为主导，液化石油气批发、液化石油气零售为两翼的产业结构。公司重视拓展海外气源市场，积极合理组织气源调配，主力气源为来自澳大利亚的广东大鹏天然气和来自土库曼斯坦的中国西气东输二线天然气，并通过中国液化天然气市场采购槽车LNG保障天然气供应。公司大力拓展天然气电厂及工商客户，深化卓越绩效管理，实现从城市燃气运营商向城市清洁能源运营商的战略转型。

燃气行业重大发展机遇：天然气价格拐点出现，终端需求释放在即。2014年10月开始，国际原油价格、液化天然气价格大幅下降，为我国天然气价格改革创造了难得的宽松氛围。以“国际原油+液化气”价格变化趋势分析，我们预计2015年上半年，国内天然气增量气门站价格将下调，存量气门站价小幅上调（比之前预期涨幅低），两气价格完成并轨。如果原油价格维持在50-80美元的价格区间，则预期2015年下半年国内天然气门站价格整体下调。天然气价格下降将激发终端需求，中国天然气气化率提升。

燃气分销环节盈利改善。燃气分销环节面临两大机遇。第一，需求端释放，销气量增长。随着价格拐点出现，天然气需求将逐步释放，分销公司业务拓展进度加快。尤其是在增量气价格下调的预期下，新的区域扩张将加速。第二，成本端改善，存量业绩拐点出现。2015年上半年存量气门站价与增量气价并轨，但存量气价涨幅将低于之前的市场预期，燃气公司存量业务的经营压力减轻。如果原油价格维持在50-80美元区间，则2015年下半年天然气门站价将呈下降趋势，燃气分销公司的成本改善，盈利能力提升。

乘燃气行业发展东风，公司业绩拐点将出现。公司上游成本端改善，下游客户开拓有进展，业绩拐点显现。降息提升公司业绩和估值。催化剂是国内天然气价格改革。我们预计公司2014-2016年EPS为0.36元、0.42元和0.55元，对应市盈率为24x、20x和16x。我们给予公司“推荐”评级。",,银河证券,推荐,[None],2015-02-04,,增持,1801045,pdf_downloads/2015/2015-02-04/601139-深圳燃气：乘燃气行业发展东风，公司业绩拐点将出现.pdf,601139,深圳燃气,深圳燃气：乘燃气行业发展东风，公司业绩拐点将出现
,"投资要点：

净利润同比减少2.12%。2014年1-9月，公司实现营业收入71.05亿元，同比增长14.31%；归属于上市公司股东净利润达到5.83亿元，同比减少2.12%，扣非后净利润同比增长16.42%，实现基本每股收益0.29元。公司营业收入增长的原因主要是天然气和液化石油气批发销售量增加所致，其中天然气销售收入为369,903万元，同比增长8.96%；液化石油气批发销售收入为215,772万元，同比增长25.23%，异地公司销售收入8.70亿元，同比增长32.02%，

天然气销售增长不显著。2014年1-9月，公司天然气销售量为11.28亿立方米，同比增长9.20%，其中电厂天然气销售量为3.28亿立方米，同比增长14.29%，异地公司天然气销售2.77亿立方米，同比增长31.90%。公司天然气销售量增长并不显著的原因在于工业、商业及电厂用户用气需求增速放缓所致，根本原因还是经济增速放缓所致。而从全国天然气需求情况来看，1～6月，我国天然气消费增速放缓，表观消费量905亿立方米，同比增长10%，而去年同期达到14.5%。

第四次“低速增长”时代到来，天然气需求高增长预期难实现。改革开放以来的大部分时间里，GDP增速都在10%上。正是在强劲增速的支撑下，能源需求快速增长，35年里，GDP增长只有过三次连续2-3年低于8%，第一次是1979-1981年，第二次是1989-1990年，第三次是1998-1999年，而第四次正在出现。前三季GDP增长分别为：7.4%、7.5%，7.3%。我们认为经济增长放缓，对于能源需求的影响是深远，此前，市场普遍预期的天然气需求高增长估计将大打折扣，电厂用气不达预期将尤为显著。此外，存量气调价将对公司客户销售及推广也将带来一定压力。

评级：增持。我们维持对公司销气量持续成长的判断，未来3年气量增长将主要依靠深圳本地工业和电厂用气的逐渐释放，异地天然气项目迎来持续3-5年的量价齐升期。维持公司“增持”评级。我们预测公司2014～2016年每股收益分别为0.38、0.5、0.64元。维持“增持”评级。目标价7～7.5元。

风险提示：天然气需求低迷。",,华泰证券,增持,[None],2014-10-23,,增持,823080,pdf_downloads/2014/2014-10-23/601139-深圳燃气：经济低速增长，气量增长难显著.pdf,601139,深圳燃气,深圳燃气：经济低速增长，气量增长难显著
黄秀瑜,"投资要点：

事件：深圳燃气（601139）公布的2014年三季报显示，公司实现营业收入71.05亿元，同比增长14.31%，实现归属于上市公司股东的净利润5.83亿元，同比下降2.12%，实现EPS为0.29元。

点评：

主营业务平稳增长，非经常性损益影响业绩增长。前三季度，公司营业收入的增长主要是天然气和液化石油气批发销售量增加所致，其中天然气销售收入为36.99亿元，占比52%，同比增长8.96%；液化石油气批发销售收入为21.58亿元，同比增长25.23%，主要系因为公司加大保税出口拓展力度。成本费用控制良好。前三季度，综合毛利率为20%，较去年同期略微下降0.59个百分点。销售费用因业务销售量增长相应增长，而管理费用和财务费用有所下降，最终期间费用率为10.85%，同比略微下降0.39个百分点。归属于上市公司股东的净利润同比下降2.12%，主要原因是公司去年同期确认处置喜年中心等二处房产收益9255万元。而公司扣非后净利润为5.79亿元，同比增长16.42%。

三季度天然气销售量同比增速小幅回升。公司大力发展工商业用户，天然气销售量持续增长。前三季度，天然气销售量为11.28亿立方米，完成年度计划15.5亿立方米的72.77%，同比增长9.20%，三季度气销量增速小幅回升。其中电厂天然气销售量为3.28亿立方米，占比29.08%，同比增长14.29%，三季度电厂气销量增速也上升。

异地公司天然气销售保持快速增长。公司已在江西、安徽、广西等20个异地城市开展管道燃气业务。前三季度，异地公司天然气销售2.77亿立方米，同比增长31.9%；实现销售收入8.7亿元，同比增长32.02%，其中安徽深燃实现收入2.94亿元，占比34%，同比增长72.94%。异地燃气公司已基本落实未来年采购管输天然气总量约8亿立方米，较目前年气销量有2.2倍的增长空间。预计未来3年异地公司的天然气销量将有持续快速的增长。

多因素影响下预计公司的市场拓展短期内仍有一定压力。广东地区自9月份起已上调非居民用存量气门站价格0.12元/立方米，随之而来的是，公司西二线管道天然气供应燃气电厂最高销售价格也上调0.12元/立方米。我们认为，国内经济增速下滑，加之今年南方雨水充足，西电东送供应广东电量增加。在此背景下，上游气价上调对公司大力拓展工商业用户、扩大天然气市场销售带来一定压力。

投资建议：维持谨慎推荐的投资评级。预计公司2014-2016年EPS分别为0.37元、0.43元、0.50元，对应PE分别为20倍、17倍、15倍。公司业绩平稳增长，长期看天然气销售业务有望量价齐升，维持“谨慎推荐”的投资评级。

风险提示。天然气销售增速下滑，门站价继续上涨。",,东莞证券,谨慎推荐,[None],2014-10-22,,增持,822729,pdf_downloads/2014/2014-10-22/601139-深圳燃气(601139)2014年三季报点评：主营业务平稳增长，业绩符合预期.pdf,601139,深圳燃气,深圳燃气(601139)2014年三季报点评：主营业务平稳增长，业绩符合预期
"刘昭亮,李超","公司于10月21日发布2014年三季报:2014年1~9月实现营业收入71.05亿元,同比增长14.31%,归属于母公司股东的净利润为5.83亿元,折合EPS0.29元,同比下滑3.33%。而扣非后净利润同比增长16.4%。主要原因是2013年同期存在处置房产收益0.93亿元所致,扣除去年的房产收益,2014年前三季度净利润实际同比增长16%。增长的主要原因是天然气和液化石油气销量均实现增长。
    天然气销量继续稳步增长,特别是异地市场成长速度较快。随着公司大力发展工商业用户以及市场范围迅速扩大,天然气销售量达到11.28亿立方米,较上年同期10.33亿立方米增长9.20%,(其中电厂天然气销售量为3.28亿立方米,较上年同期2.87亿立方米增长14.29%;异地公司天然气销售2.77亿立方米,同比增长31.90%)。但由于经济下行和天然气调价等因素导致需求增速下滑——与去年前三季度23.86%的增长相比,同比增速下滑了14.66个百分点,而公司通过下游市场深度拓展和横向扩张仍实现销量稳健增长。此外,液化石油气批发销售收入为21.6亿元,上年同期17.2亿元增长25.23%。
    西气东输二线保证气源供应,未来增量看电厂和异地扩张带来管道燃气的增长,以及LNG加气站销量的快速提升。西二线达产后,公司拥有40亿立方米的合同供气量,为下游客户拓展提供了充足的气源保障。环保政策明确深圳地区将不再新建燃煤电厂,天然气电厂将填补燃煤电厂停建带来的能源缺口,增量空间较大。目前公司积极拓展电厂、工商业、车船用LNG和异地市场扩张,推动管道燃气销量稳步增长。
    需求仍然旺盛,价格调整将顺势传导。公司的气源主要来源于三部分:一是大鹏气源,价格为1.7元/方,目前价格不会上涨;西二线气源,发改委于9月1日上调居民用气0.4元/方;三是现货气随行就市。2014年存量气价格上调之后,将使公司管道燃气销量增速承压,预计下游居民用气将顺势调整,其他工商企业等市场化用户基本消化完毕。预计公司毛利率将基本保持稳定。
    我们预测公司2014~2016年归属于母公司股东的净利润分别为7.67亿元、8.06亿元和8.67亿元,对应EPS分别为0.39元、0.41元和0.44元。公司业绩增速放缓的主要原因除需求放缓之外,主要考虑到上游气源采购成本上调的影响,同时没有考虑到异地项目超预期扩张。我们认为,发改委对存量气调价幅度低于预期且不涉及民用气,对公司形成利好,且公司存在异地外延式扩张的增长预期,维持“增持”评级,目标价:7.92元~8.66元。
    风险提示:天然气消费需求受宏观经济增速放缓的影响;政策带来的管道燃气销量增速下滑的风险;异地市场扩张存在不确定性。",,中泰证券,增持,[None],2014-10-22,,增持,822687,"pdf_downloads/2014/2014-10-22/601139-深圳燃气(601139)：燃气需求增速放缓,亮点在异地市场扩张.pdf",601139,深圳燃气,"深圳燃气(601139)：燃气需求增速放缓,亮点在异地市场扩张"
,"动态事项

公司发布2014年半年度报告。上半年，公司实现营业收入46.24亿元，同比增长13.59%；归属于上市公司股东的净利润4.43亿元，同比下降11.88%；，归属于上市公司股东的扣除非经常性损益的净利润4.41亿元，同比增长8.82%；基本每股收益0.22元。

主要观点

管道天然气和液化石油气增长带来业绩提升

上半年，公司实现营业收入46.24亿元，同比增长13.59%；净利润4.43亿元，同比下降11.88%。业绩增长主要源于管道天然气和液化石油气批发业务量增加，上半年，公司天然气销售量为7.19亿立方米，较上年同期增长7.63%。

从分项业务来看：管道燃气销量6.84亿立方米，增长5.88%，其中电厂天然气销售量为1.75亿立方米，增长8.02%。该项业务实现收入22.78亿元，同比增长6.15%；由于毛利率较低的电厂天然气销售占比上升，管道天然气业务毛利率同比下降4.66个百分点至25.75%。同时，管道燃气用户总数达到182.24万户，净增加14.44万户，在新增用户中，用气量较大的工商用户增长速度很快，其中商业用户增加1457户，工业用户增加276户。

公司液化石油气业务批发量为24.11万吨，同比增长20.55%；实现销售收入14.04亿元，增长24.99%，液化石油气批发业务毛利率2.47%，同比上升0.37个百分点。

天然气批发销量3664万立方米，同比增加1244万立方米，增长51.40%，公司乌审旗和宣城两座天然气液化工厂拥有年处理天然气近2亿立方米的产能，公司大力拓展天然气批发业务，上半年实现收入1.25亿元，同比增长66.40%；上游天然气涨价，采购成本增加使得该项业务毛利率水平下降0.96个百分点至5.23%。

上半年瓶装石油气销售4.69万吨，同比增长0.64%，主要是受到管道天然气的替代冲击；瓶装石油气用户总数107.84万户，增长2.78%。实现收入3.54亿元，同比增长3.25%；由于采购成本有所上升，毛利率下降0.19个百分点至20.77%。

营业外收入减少使得净利润下降

上半年，公司实现归属于上市公司股东的净利润4.43亿元，较上年同期下降11.88%，主要原因是上年同期公司确认处置房产收益9,255万元，而2014年上半年无此类收益，使得净利润下降。扣非后归属于上市公司股东的净利润为4.41亿元，较上年同期增长8.82%。

天然气价格上调，销售压力加大

2014年8月12日国家发改委发布《国家发展改革委关于调整非居民用存量天然气价格的通知》，上调非居民用存量天然气价格最高门站价格400元/千立方米。这是继2013年6月28日国家发改委区分存量气和增量气调整了到各省、市、区天然气门站价格后，国家分步理顺存量天然气价格的第二步，目的是利用价格杠杆促进天然气资源开发和引进，提高天然气供应能力，引导资源合理配置。

此次非居民用存量天然气门站价格上调，将给公司拓展工商客户、扩大市场销售带来一定压力。

投资建议：

未来六个月内，维持“谨慎增持”评级。

我们预测2014-2015年公司营业收入增长分别为14.41%和13.15%，归于母公司的净利润将实现年递增5.11%和13.42%，相应的稀释后每股收益为0.38元和0.43元，对应的动态市盈率为19.11倍和16.85倍，公司估值略低于行业平均水平。我们认为，深圳地区天然气需求将较快发展，公司异地市场增长快速，维持公司“谨慎增持”评级。",,上海证券,谨慎增持,[None],2014-08-19,,增持,810741,pdf_downloads/2014/2014-08-19/601139-深圳燃气：营业外收入减少致使业绩下降.pdf,601139,深圳燃气,深圳燃气：营业外收入减少致使业绩下降
