author,content,filename,org_name,original_rating,pdf_link,publish_time,rating_adjust_mark_type,rating_changes,report_id,save_path,stock_code,stock_name,title
"杨绍辉,陈祥",据宝马公司官方网站信息，宝马集团与宁德时代签订73亿欧元（约569亿元人民币）的长期框架订单协议。其中宝马中国采购28亿欧元，宝马集团采购45亿欧元。宁德时代占此宝马供货合同份额超70%。全球汽车电动化趋势未变，动力电池厂商二次扩产潮预期在加强。宁德时代获大客户超预期框架协议订单，有望加大和加速欧洲工厂的扩产，先导智能作为设备龙头公司，或将率先受益。我们维持此前盈利预测，预计2019/20年的利润预测分别为9.6亿元和13.3亿元，对应PE估值为32/23倍，维持买入评级。支撑评级的要点CATL获宝马超预期框架订单，提振全球动力电池行业景气度。CATL与宝马签订长期采购框架协议，协议超预期包括三个方面：1）签订协议额，在2018年40亿欧元基础上提升至73亿欧元；2）签订供货日期，从2021年至2031年长期供货协议，未来10年长远锁定；3）CATL获宝马大客户订单比例超过70%，大幅超过三星SDI（29亿欧元）协议订单。宝马2018年电动车销量14万辆，电池需求2-3GWh，此前海外市场三星SDI主供，中国市场CATL独供。此次CATL协议合同份额远超三星，我们测算平均每年58亿元左右订单，对应7GWh动力电池。CATL欧洲工厂扩产力度有望加大。2018年CATL公告拟出资2.4亿欧元新建德国埃尔富特（Efurt）工厂，设计产能14GW；2019年上半年CATL公告加大投资力度，拟增加到18亿欧元扩建，对应产能30GWh左右；此后据CATL欧洲区总经理宣布，CATL远期规划将在德国埃尔富特建设世界上单体最大电池生产基地，规划产能目标100GWh。此次长期框架协议有望加大CATL欧洲工厂的扩建力度，和加快扩产节奏。动力电池设备厂商有望率先受益。设备龙头地位无可撼动，订单有望持续落地。先导智能作为国内动力电池设备龙头，具备全球竞争优势，市场地位无可撼动。公司此前正加大整线研发力度，或将充分受益CATL欧洲工厂的资本开支的增加。我们认为公司有望以整线形式供应获得宁德时代埃尔富特工厂的扩产订单，叠加瑞典Northvolt公司扩产在稳步推进，我们认为2020年欧洲区域扩产或将成为公司业绩主要增长点，同时测算订单有望达到20-30亿元。估值我们维持此前盈利预测，预计2019/20/21年净利润分别为9.6亿元/13.3亿元/16.4亿元，对应PE估值为32/23/19倍，维持买入评级。评级面临的主要风险新能源汽车销量不及预期，海外动力电池扩产不及预期。,,中银国际,买入,[None],2019-11-22,,买入,4024054,pdf_downloads/2019/2019-11-22/300450-先导智能（300450）：动力电池景气度触底回升，设备龙头率先受益.pdf,300450,先导智能,先导智能（300450）：动力电池景气度触底回升，设备龙头率先受益
"谭菁,陈瑶",业绩总结：先导智能2019年前三季度实现营收32.2亿元，实现扣非后归母净利润6.2亿元，同比增速14.7%。Q3单季度实现营收13.6亿元，同比增速7.9%；实现扣非后归母净利润2.4亿元，同比增速10.16%。前三季度毛利率为41.3%，其中Q3单季度毛利率为38.8%，环比下降2.5pct。存货周转天数减少，现金流改善明显。存货周转天数降低，从389天降低到346天。经营性现金流由负转正，体现了公司从2017年开始持续改善资产结构做出的努力已经有了明显效果。公司客户结构优异，海外客户有望大幅度提升。公司拥有众多优质的国内外客户，目前全球前十大锂电巨头均是公司客户，涵盖中国、日本、韩国、欧洲等全球多个国家和地区。公司一直都是宁德最优质的设备供应商，同时也是LG和特斯拉的合作伙伴。2018年公司已经获得特斯拉美国的订单，随着特斯拉国产进度的加快，预计特斯拉的订单能很快落地。2019年，公司与NOSVOLT签订战略合作协议，NOSVOLT是大众控股的动力电池厂商，预计这部分订单也将迅速落地。2020年，公司海外订单的占比会迅速提升。横向拓展其他战略新兴行业，取得不错的进展。公司不仅仅是锂电行业全球最优质的供应商，其优质的基因使得公司屡次跨行成功。先导智能在薄膜电容器和光伏领域已经验证了自己优秀的装备制造能力，并且进一步开拓了3C检测行业。随着A客户订单的落地，预计2020年公司在3C领域的订单会保持高速增长。盈利预测与投资建议。预测未来三年公司归母净利润复合增速40%。先导设备龙头并且在各个领域都实现突破，我们给予公司2020年25倍估值，对应目标价41.5元，维持“买入”评级。风险提示：新能源补贴政策大幅度退坡的风险；产能爬坡不及预期的风险。,,西南证券,买入,[None],2019-11-04,,买入,3966857,pdf_downloads/2019/2019-11-04/300450-先导智能（300450）：海外占比进一步提升，资产质量改善明显.pdf,300450,先导智能,先导智能（300450）：海外占比进一步提升，资产质量改善明显
"刘兰程,吴佩苇,范想想",1．事件公司发布2019年三季报，前三季度公司实现营收32.17亿元，同比增长19.31%；实现归母净利润6.35亿元，同比增长16.14%。2．我们的分析与判断收入增长趋势放缓，有待新一轮产能扩张周期到来。Q3单季度公司实现收入13.56亿元，同比增长8%，增速下滑较为明显。一方面，由于去年三季度泰坦新能源确认了大额的格力智能订单导致同比基数较高；另一方面，我们认为随着上一轮国内电池厂扩张逐步完成，欧洲产能尚未落地，下游扩产放缓一定程度影响了收入确认节奏。预收账款环比基本稳定，预计新签订单节奏与上季度相同。截至2019年Q3末，公司预收账款为12.5亿元，与Q1、Q2期末基本保持一致。根据公司公告，截至3月底公司在手订单54.8亿元。考虑到订单与预收账款的比率基本稳定，我们预计目前在手订单也保持不变(约55亿元)，测算Q1-Q3新接订单约38亿元。设立瑞典子公司，关注2020年海外需求。Northvolt的瑞典工厂于今年8月开工，公司已设立瑞典子公司，我们预计订单（已签订战略协议）将于2020年正式确认；10月18日宁德时代欧洲工厂开工，计划到2022年实现14GWh的电池产能，预计相关订单也将于明年落地。此外，公司与特斯拉中国工厂的电池供应商LG化学保持重要合作关系，未来有望受益于电池销量增加带来的设备需求。综合毛利率略有下滑，但整体处于正常水平。前三季度公司整体毛利率41.3%，环比下降了1.8个百分点；分季度看，Q1/Q2/Q3公司毛利率分别43.4%/41.3%/38.8%，呈下降趋势。我们认为，其可能主要由于毛利率较低的光伏业务收入占比继续提升影响，但整体仍处于合理的波动范围。远期来看，考虑到公司在电池中端设备的行业领先地位，打造的前中后端业务协同效应逐步显现，以及高毛利率的3C业务拓展加速，我们预计未来公司可以保持较好的盈利能力。,,银河证券,推荐,[None],2019-10-30,,买入,3962085,pdf_downloads/2019/2019-10-30/300450-先导智能（300450）：Q3业绩增速略有放缓，关注2020年海外需求.pdf,300450,先导智能,先导智能（300450）：Q3业绩增速略有放缓，关注2020年海外需求
"关东奇来,李倩倩,章诚,黄波",短期业绩或探底，研发投入加大公司发布2019年三季报，1-9月实现营收32.16亿元/+19.3%，归母净利润6.35亿元/+16.1%，扣非后6.21亿元/+14.7%，业绩符合预期。短期业绩或继续探底，利润率与经营现金流改善。在手订单较为充足，但新订单增速趋缓。看好新能源汽车全球化发展趋势，高端设备供应商具备中长期发展空间。考虑到锂电池产业链进入调整期以及公司加大研发投入，调整盈利预测，预计19-21年EPS为1.08/1.46/1.69元，PE为31.0/22.9/19.8x。给予20年PE估值25x~27x，对应目标价36.53~39.45元，维持“买入”评级。Q3收入低速增长，利润率与经营现金流改善公司在19Q3单季度实现营收13.55亿元/+7.9%，收入增速接近18Q4的低点。结合19年6月末待验收订单（即发出商品）与验收周期判断，我们预计Q4单季度收入增速或仍将低位徘徊。1-9月，公司毛利率为41.3%，同比提升4.2pct，公司对产品质量和成本均有较好的把控能力；公司经营性现金净流入3.32亿元，同比大幅改善，得益于年初在手的商业承兑汇票陆续兑付。在手订单较为充足，但新订单增速趋缓19年6月末，公司在手订单合计54亿元，考虑到Q3验收进度，我们预计公司在手订单仍较为充足。但19年新能源车需求低迷，导致动力电池行业招标趋缓，公司新订单增速亦有所下行。19年9月末，公司存货和预收款分别为24.23亿元和12.51亿元，自18年末以来连续4个季度期末值变化较小。进入海外开拓关键期，加大研发与产能投入公司处于海外订单开拓关键期，已进入特斯拉全球供应体系和锁定欧洲市场关键客户Northvolt。19年1-9月公司研发费用达到3.56亿元/+102%，占收入比例为11%/+4.52pct，研发投向包括锂电池制造（涂布/叠片/整线）、光伏叠瓦与燃料电池产线。公司拟募投9.54亿元扩大产能和提升高精度零部件生产能力，未来或减少外协，匹配高端客户的定制化与保密需求。调整盈利预测，维持“买入”评级考虑到锂电池产业链进入调整期以及公司加大研发投入，调整19-21年盈利预测：预计19-21年营业收入为46.0/60.0/66.0亿元，归母净利润为9.50/12.88/14.87亿元，对应EPS为1.08/1.46/1.69元（下调10%/8%/7%），PE为31.0/22.9/19.8x。我们看好新能源汽车全球化发展趋势，高端设备供应商具备中长期空间。公司短期业绩承压，中长期成长逻辑未变。公司作为设备领域龙头公司，产品质量与市场份额领先，仍有望保持估值溢价。可比公司20年PE均值为18.8x，给予公司20年PE估值25x~27x，对应目标价36.53~39.45元。维持“买入”评级。风险提示：动力电池扩产不及预期；订单中标体量不及预期；订单验收进度严重滞后；应收账款回收不及时导致坏账。,,华泰证券,买入,[None],2019-10-30,,买入,3960757,pdf_downloads/2019/2019-10-30/300450-先导智能（300450）：业绩增速探底，研发投入加大.pdf,300450,先导智能,先导智能（300450）：业绩增速探底，研发投入加大
"苏晨,邹玲玲",投资要点事件：公司发布2019年三季报，实现营收32.17亿元，同增19.31%；归母净利润6.35亿元，同增16.14%；其中，3Q19实现营收13.55亿元，同增7.93%；归母净利润2.43亿元，同增10.16%；EPS0.28元/股，整体符合预期。事件：公司设立瑞典全资子公司，注册资本暂定为500万瑞典克朗。盈利能力基本持平，期间费用率环比略降：3Q19公司毛利率和净利率分别为41.28%/19.75%，同比分别+2.2pct/-0.45pct，环比分别-2.83pct/-1.35pct。期间费用率20.55%，同比+5.17%，环比-2.81%。期间费用率同比上升主要系研发及财务费用增多所致。截止3Q19，研发费用3.56亿元，同增101.82%，主要因为研发项目、人员增加；财务费用2463.5万元，同增194.66%，主要因为发行可转债手续费及利息支出增加。规模扩大，应收款相应增多。截止3Q19，公司应收票据10.22亿元，同比-41.03%，主要系格力智能商业承兑陆续到期兑付所致；应收账款14.97亿元，同比+110.91%，主要因为收入订单增加、保证金新增较多。公司预收款12.51亿元，同增4.16%，环比+0.5%；存货24.23亿元，同增3.95%，环比+0.04%。整线服务经济性更高，提升客户产值绑定合作。公司通过收购泰坦新动力，完成锂电设备前、中、后段闭环，相继推出一体机产品及整线服务，提升了稳定性、一致性、客户产品良品率，帮助客户实现单GWh更高的产值，具有更高的经济效益。从收入对比看，下游头部企业愿意为增强的技术+服务能力支付溢价，放大规模效应，与设备供应商长期稳定合作。切入海外供应体系，打造全球设备龙头。公司与众多优质客户深度绑定，2019年1月与Northvolt签订战略合作框架协议，就锂电池设备业务建立战略合作关系，约定在未来进行约19.39亿元的业务合作。本次在瑞典设立子公司是为了进一步拓展海外市场，满足公司战略发展的需要。投资建议：在全球电动化浪潮下，公司作为国内锂电池专用设备龙头企业，已成功进入国际供应链体系，预计未来盈利将充分受益于下游锂电池企业的大幅扩产。同时，公司打造高端装备研发平台，新产品以及新应用不断带来新的增长。我们预计公司2019-2021年净利润为9.40/12.63/15.64亿元，EPS分为为1.07/1.43/1.77元/股，对应PE为31.4/23.3/18.8倍，维持增持评级。风险提示：新能源汽车补贴政策不及预期、新能源汽车销量不及预期、电池产能过剩引起扩产放缓的风险。,,中泰证券,增持,[None],2019-10-29,,增持,3959027,pdf_downloads/2019/2019-10-29/300450-先导智能（300450）：业绩符合预期，切入海外供应体系.pdf,300450,先导智能,先导智能（300450）：业绩符合预期，切入海外供应体系
"王华君,赵玥炜",业绩简评公司前三季度实现营业收入 32.16 亿元，同比增长 19.31%；归母净利润 6.35 亿元，同比增长 16.14%。业绩符合预期，经营性现金流改善，期待四 季度收入确认与订单加速。经营分析业绩符合预期，经营性现金流大幅改善，期待四季度到明年一季度表现1）得益于下游锂电池持续发展、公司积极开拓新客户，锂电设备业务实现 持续快速增长，公司业绩实现 16%的稳步增长。经营质量提升显著，经营性 现金流大幅改善，前三季度 3.3 亿元，同比转正（去年同期-5.0 亿元）。2）根据我们预测的订单情况以及设备确认周期（9-12 个月），我们预计公司 四季度至明年一季度至少约有 26 亿元收入待确认（订单预测见后文）。全球锂电设备龙头，预计 2020 年行业重回高增长轨道，国际竞争优势显著1）我们预计锂电设备行业 2020 年显现高增长拐点，未来需求空间广。中性 假设下，2019-2025 年全球动力电池需求对应累计 2547 亿元设备投资，现 有扩产计划对应 2019-2025 年 1981 亿元设备投资。2020 年电池扩产项目 推动有望加快，未来五年全球设备投资 CAGR 为 25%2）公司是全球锂电设备龙头，中、后段设备处于国际领先水平，深度绑定 宁德时代、比亚迪等龙头电池厂。我们测算，未来三年，仅 CATL、BYD 与 Northvolt 三家客户将为公司贡献累计超 140 亿元订单，提供向上动力。3）目前，宁德时代欧洲工厂已正式动工，计划分别于 2021 年、2022 年投 产 4GWh、10GWh 动力电池产能，我们预计招标工作将于年内落地平台型公司价值确立，以“深度+广度”战略构建“能力圈”，打造新增长极公司从深度与广度两个层面拓展业务线，有节奏、有规划地构建资源“能力 圈”，在锂电、光伏、3C 等领域进入技术、设备、客户共拓的良性循环。盈利调整与投资建议维持公司盈利预测 与目标价： 1 ） 预 计 2019-2021 年归母净利润 9.4/12.7/18.2 亿元，同比增长 26%/35%/44%，三年复合增速 39%；给予公 司 2020 年合理市值 396 亿元，6-12 个月目标价 45 元，“买入”评级。风险提示电池扩产项目进程不及预期；新能源汽车退补带来短期需求阵痛；动力电池 产能过剩风险；竞争加剧；其他战略业务拓展不及预期；解禁风险（0613）,,国金证券,买入,[None],2019-10-29,,买入,3957021,pdf_downloads/2019/2019-10-29/300450-先导智能（300450）：业绩符合预期，现金流大幅改善，期待明年全球电动化大年、公司业绩提速.pdf,300450,先导智能,先导智能（300450）：业绩符合预期，现金流大幅改善，期待明年全球电动化大年、公司业绩提速
"罗政,彭元立,姚健",三季度业绩略低于预期，主要系去年确认银隆收入基数较高。公司2019年前三季度实现营收32.16亿元，同比增长19.3%；实现归母净利润6.35亿元，同比增长16.1%。Q3单季度实现营收13.55亿元，同比增长7.9%；实现归母净利润2.43亿元，同比增长10.2%。Q3单季度毛利率为38.7%，同比提升3.7pct，环比下滑2.6pct，主要系光伏业务毛利率下降所致。考虑到去年同期由于确认了大量珠海银隆订单的收入（2018Q3营收+195%、利润+121%）导致基数较高，今年Q3能够实现两位数正增长表明公司较强的盈利能力。销售回款良好，现金流明显好转。报告期内，销售商品收到现金33.6亿元，较去年同期15.7亿元大幅增加；经营性现金流净额为3.3亿元，较去年同期-3.9亿元大幅转好，主要系报告期内回款良好所致。应收票据由年初的17.32亿元下降至10.2亿元。现金充裕的情况下，公司还款力度加大，短期借款下降明显。研发费用增加较多，八大事业部齐头并进。2019年前三季度研发费用同比增加102%，主要系研发项目、人员增加所致。9月17日，公司与BTW签订了1.2亿元燃料电池设备采购意向合同，后续落地可期。我们认为，先导智能具备成长为平台型公司的潜力，中长期核心竞争力无忧，业绩具备持续增长动能。实施股权激励计划，激发员工动力。8月底，公司公告实施2019年股票期权激励计划，激励对象总人数为242人，包括中高层管理人员及核心技术人员。业绩考核目标较低，2019-2021年业绩考核目标为：以2018年为基数，营收同比增长20%、40%、60%，或当年加权平均净资产收益率不低于20%。通过激励计划中设置的较低的授予价格和较易达成的行权条件可以看出，此次股权激励计划有助于降低公司留人成本、激发员工动力。公司在瑞典设立全资子公司，进一步拓展海外市场。公司今年1月曾公告和瑞典Northvolt签订了19.39亿元的战略合作框架协议，我们认为，公司此次设立瑞典全资子公司，有助于进一步加强和海外客户的联系、拓展海外市场。随着宁德、Northvolt等客户欧洲项目的启动，预计欧洲市场将成为公司未来业务的重要发力点，提请关注欧洲项目的进展。维持“增持”评级。预计公司2019-2021年净利润分别为9.6、13.1、17.95亿元，对应EPS分别为1.1、1.5、2.0元/股，对应PE分别为30.8、22.5、16.4倍。风险提示：补贴退坡导致新能源汽车销量减少，电池厂扩产不及预期。,,国盛证券,增持,[None],2019-10-29,,增持,3956672,pdf_downloads/2019/2019-10-29/300450-先导智能（300450）：Q3业绩略低于预期，关注欧洲市场开拓.pdf,300450,先导智能,先导智能（300450）：Q3业绩略低于预期，关注欧洲市场开拓
"郑连声,陈兰芳",事件：公司发布2019年三季报：2019年前三季度实现营收32.17亿元，同比增长19.33%；实现归母净利润6.35亿元，同比增长16.14%；实现扣非后归母净利润6.21亿元，同比增长14.71%；对应EPS为0.72元/股。业绩符合预期，创单季最高营收1）2019Q3公司营收13.56亿元，同比增长7.99%，创历史最高单季营收，我们认为锂电设备仍然贡献主要收入，主要受益于下游锂电池行业发展以及公司积极开拓新客户。其中2019年前三季度母公司分别实现营收/净利润25.62/4.76亿元，分别同比增长30.15%/20.51%；预计泰坦新动力前三季度分别实现营收/净利润约6.5/1.6亿元。2）前三季度公司综合毛利率41.28%，同比/环比分别变动+4.23/-1.83个百分点，其中Q3的毛利率为38.76%，同比/环比分别变动+3.73/-2.49个百分点，同比增长的原因是消除了珠海银隆合同影响，而环比在正常范围内波动，仍保持较高的盈利能力。提升核心竞争力，研发投入大幅增加前三季度公司研发费用为3.56亿元，同比增长101.82%，其中Q3为1.44亿元，同比增长69.96%，主要投向锂电设备领域，通过不断提高产品竞争力以提升公司核心竞争力，增强获取订单的能力。2019前三季度公司净利率为19.75%，较去年同期下降0.54个百分点，主要受研发费用大幅增长影响，我们认为，伴随着公司锂电设备技术的提高，在锂电设备上的研发投入会减少，转向其他新业务，未来研发费用率将有所下降，公司净利率将提升。现金流情况继续改善前三季度公司经营性现金流量净额继续扩大至3.32亿元，同比增长184.63%，其中Q3为1.48亿元，现金流大幅改善，主要是报告期内公司销售回款较好，前三季度销售商品、提供劳务收到的现金同比增长113.65%。公司应收账款及应收票据涨幅略低于营收增速，同比增长16.65%，环比二季度小幅增长，也表明公司回款能力较好。深度绑定动力电池龙头，在手订单充沛尽管今年新能源汽车销量增速放缓，但我们认为新能源汽车长期向好的发展趋势不变，国内有双积分政策和消费刺激政策的推动，欧洲有严格的碳排放标准的推动，各大国内外车企都加大了投资布局。今年动力电池厂商的扩产有所放缓，但扩产意愿不变，锂电设备厂商将受益于动力电池扩产。先导智能是国内龙头锂电设备企业，深度绑定宁德时代/Northvolt/LG化学等大客户，将率先受益于国内和欧洲的动力电池扩产。根据公司可转债回复的公告，截至2019H1公司在手订单54.01亿元，其中泰坦新动力有13.47亿元，公司现有生产基地已满负荷生产，在手订单充沛。而宁德时代欧洲工厂已正式动工，公司成立瑞典子公司以拓展海外市场，未来海外订单有望快速增长。盈利预测，维持“增持”评级综上分析，我们预计公司2019~2021年EPS分别为1.03/1.40/1.70元/股，PE为33/24/20倍，维持“增持”评级。风险提示：新能源汽车增速低于预期；动力电池产能扩张进程不及预期；锂电池材料降价幅度超出预期；公司研发进展和客户开拓低于预期。,,渤海证券,增持,[None],2019-10-29,,增持,3961096,pdf_downloads/2019/2019-10-29/300450-先导智能（300450）三季报点评：Q3单季营收创历史新高，在手订单充沛.pdf,300450,先导智能,先导智能（300450）三季报点评：Q3单季营收创历史新高，在手订单充沛
