author,content,filename,org_name,original_rating,pdf_link,publish_time,rating_adjust_mark_type,rating_changes,report_id,save_path,stock_code,stock_name,title
"欧阳仕华,唐泓翼","公司拟收购立讯精密持有的珠海双赢51%股权。
公司公告拟以现金方式收购立讯精密持有的珠海双赢51%股权，交易价格2.90亿元，立讯精密仍持有珠海双赢49%股权。珠海双赢成立于2004年4月19日，主营柔性线路板、电子元器件及其零配件的生产及销售，产品主要应用于手机领域。截至2018H1，珠海双赢经审计后的总资产为6.96亿元，净资产为5.68亿元，2018H1实现营收1.06亿元，净利润-0.55亿元。
优势管理匹配国际客户资源，珠海双赢及景旺电子协同效应明显。
公司与珠海双赢协同优势明显。公司拥有fpc领域成熟技术及丰富精益管理经验，能够助力珠海双赢提升fpc生产效率及精益管理能力。同时由于立讯精密仍然持有珠海双赢49%股权，且立讯精密是国际A客户的供应商，景旺电子能依托珠海双赢及立讯精密进一步拓展国际大客户。此次收购，是以优势管理匹配客户资源，可谓一举多得。交易完成后，珠海双赢将被纳入公司合并报表范围，将进一步提升公司的资产总额及营收，提高公司的综合竞争能力。
持续布局深圳、江西、龙川、珠海四大生产基地。
公司目前已有深圳景旺、龙川景旺、江西景旺3大生产基地，主要产品分为刚性板及柔性板两大类。2017年公司刚性板产能达到331万平方米，柔性板产能达到75万平方米。未来公司一方面继续江西二期产能建设，目标产能实现240万平方米/年，同时公司在珠海布局生产基地，计划分为三期，一期将建设80万平方米柔性板，二期及三期将共建设300万HDI板及120万柔性线路板，目前已获得环评批复。此次公司收购珠海双赢也将与公司珠海项目形成产业链配套协同。
稳步迈向“521”目标，给予“买入”评级。
公司精益管理持续收效，人均产出、ROE、净利率等行业领冠，2018年Q2净利润增长43%再超预期。同时公司进行股权激励激发管理层核心动力，未来稳步迈向“521”目标，即5年内，实现FPC+PCB的“2”个“1”百亿营收目标。我们预计公司2018-2020净利润818/1017/1253百万元，对应PE28/23/19倍，给予买入评级。
风险提示：PCB产业链需求不及预期。",,国信证券,买入,[None],2018-09-21,,买入,2237019,pdf_downloads/2018/2018-09-21/603228-景旺电子（603228）：收购珠海双赢，加码FPC高端客户.pdf,603228,景旺电子,景旺电子（603228）：收购珠海双赢，加码FPC高端客户
郑震湘,"刚柔并济全品类覆盖，精益管理能力卓越。公司行业龙头地位稳固，17年产值排名第10，在内资厂商中排名第2，利润水平排名第1。产品全品类覆盖，是国内少数覆盖刚性电路板、柔性电路板和金属基电路板的厂商。同时，公司的产品结构不断优化，精益求精铸造高附加值产品；全面规范各级管理程序，提升管理水平，降低生产及管理成本，实现效益最大化——毛利率、净利率等盈利指标业内领先。经营者战略眼光深远、管理能力卓越，在硬板、软板两个事业群分别以刘羽、邓利为核心，均有深厚的人才积累，梯队建设完善。技术和管理两条线，公司均具备多厂区、多产品向外布局延申的实力。股权激励将公司发展与个人利益进一步绑定，展现公司广阔视野和对未来成长的强大信心。
智能制造成为未来之匙，生产效率提升明显。在PCB制造领域，国内领先的制造商开始寻求部分工艺的自动化甚至整厂的自动化。我们反复强调，智慧工厂不仅是单个环节的机械化、自动化，更是整条产线、整个工厂的全面升级，是线路板的技术革命。通过整个工艺流程的改良与升级，硬件和软件同步提升以实现生产流程更加柔性和高效。其中，ERP系统和MES系统是智能制造的“神经”和“肌肉”，实现从系统到产线的全方位智能化。公司二期智能化工厂的目标产值规模比一期工厂增长近一倍，而工人数量却只占一期用工的2/3，堪称高端印制电路板智能化示范工厂。
目前前两条产线已成功投产，成功经验有望复制，向即将投产的二期3、4、5号新产线和深圳老产线全方位渗透，拉动新老产线全方位立体式进阶，放大整体效益。
FPC加速前行，汽车电子稳健布局。智能手机等移动电子产品的火爆带动FPC板的需求量上升，尤其是苹果技术革新给FPC带来新增量，同时苹果的示范效应将引导其他智能手机企业跟进技术创新。新款苹果旗舰手机中使用了约20块FPC，华米OV等国产手机厂商也趋势性提升高端机中FPC用量，整条FPC产业链将在消费电子需求拉动下加速成长。FPC产业链国产化程度相对较低，多年来一直被日台巨头垄断，国内FPC龙头未来将具有广阔的上升弹性和替代空间。公司软板业务发展迅猛，未来空间广阔：龙川工厂提升FPC产线品质水平，一站式服务打造精品、提升效率。
珠海新厂投产产能将逐步释放，质优产品助力公司争取更多客户。受益汽车电子需求风口，前瞻性布局迎来收获期。汽车电子化大势所趋，拉动汽车PCB高速增长，车用PCB需求面积将会逐步增长，单车价值不断提升，新能源车对PCB的需求潜力同样较大。公司前瞻性布局汽车电子客户，现有客户包括法雷奥、麦格纳、博世电子、海拉，并且成功开拓德尔福、柯斯达等国际汽车电子知名供应商。除了LED车灯（MPCB）和车载信息娱乐系统等场景，公司也进入点火、刹车、转向等安全系统，预计未来汽车电子占比将进一步提升。“数据库+产品溯源”提升产品品质，公司汽车电子产线运用了二维码追溯系统，“严苛”的追溯工序或将成为汽车电子产线准入敲门砖。
环保监管促使集中度提升，公司严格标准布局长远。PCB生产制造过程涉及多种化学和电化学反应，存在一定的环保风险。公司是为数不多在广东省内取得环保绿牌的企业（绿牌>蓝牌>黄牌>红牌），2017年公司及子公司所在地方环境保护局季度监督性取样和废水在线监控第三方取样的各指标达标率为100%。公司通过不断增加环保设备、改造环保工程，以小规模投入赢取长效政策红利，有望脱颖而出。
投资建议：PCB全球产能整体向陆资转移的趋势明确，叠加汽车电子+FPC带来的确定性机会，公司有望凭借全品类覆盖、卓越的精益管理能力、智能制造高效率以及环保资质等优势加码产品竞争力进一步扩大市场份额；公司稳步规划产能扩张，江西、龙川基地提供未来可靠产能保障。我们预计公司2018/2019/2020年实现归母净利润8.3/11.4/14.8亿元，目前对应PE26x/19x/15x。考虑公司在行业内较强的精益管理能力和团队储备，维持“买入”评级。
风险提示：环保政策影响产能布局；消费电子竞争格局恶化",,中泰证券,买入,[None],2018-09-17,,买入,2224636,pdf_downloads/2018/2018-09-17/603228-景旺电子（603228）：智能制造扬帆起航，“团队+管理”铸就宽广护城河.pdf,603228,景旺电子,景旺电子（603228）：智能制造扬帆起航，“团队+管理”铸就宽广护城河
"张涛,袁威津","公司动态事项
公司8月29日发布半年报，上半年实现营收22.75亿元，同比增长15.47%；归母净利润3.91亿元，同比增长23.82%；扣非归母净利润3.67亿元，同比增长15.62%。
事项点评
公司产能逐步释放盈利质量提升
公司主营产品包括刚性电路板、柔性电路板、金属基电路板。公司业绩提升主要受益于江西景旺二期240万m2/年PCB项目投产，目前PCB产能较去年310万㎡/年的产能基础上大幅提升。同时公司在三季度将迎来珠海项目建设，包含200万m2/年的FPC产线和300万m2/年PCB产线建设。从盈利质量来看，报告期内ROE为11.29%，较去年同期+0.81pct；综合毛利率为32.63%，较去年同期+0.59pct；综合净利率17.19%，较去年同期+1.16pct。公司盈利质量稳步提升。运营能力来看，报告期内经营现金流净额2.95亿，同比微增。公司应收账周转天数111.87，同比微增。存货周转天数62.42，较去年同比增长23.24%，主要系扩产导致原材料和库存产品增长。
大陆承接产能转移环保政策加速行业洗牌
近年来，中国大陆PCB行业产值占比逐年提升，从2008年31.18%逐步提升至2016年50.04%，大陆承接全球产能趋势明显。同时，环保限产、覆铜板材价格上涨、环保税征收等因素导致行业集中度提升。我们认为，景旺电子作为行业龙头将充分受益于市场空间提升以及行业集中度提升的双重利好。
盈利预测与估值
我们预期公司在2018-2020年将实现营业收入53.47亿元、67.73亿元、84.44亿元，同比增长分别为27.55%、26.67%和24.67%；归属于母公司股东净利润为8.73亿元、10.68亿元和12.73亿元，同比增长分别为38.69%、22.38%和19.16%；EPS分别为2.14元、2.62元和3.12元，对应PE为26.62、21.75和18.26。未来六个月内，首次给与“谨慎增持”评级。",,上海证券,谨慎增持,[None],2018-09-04,,增持,2219494,pdf_downloads/2018/2018-09-04/603228-景旺电子（603228）：产能逐步释放，环保政策加速行业洗牌.pdf,603228,景旺电子,景旺电子（603228）：产能逐步释放，环保政策加速行业洗牌
刘翔,"事件：2018年上半年实现营业收入22.74亿元，同比+15.47%；实现归母净利润3.91亿元，同比+23.82%（接近此前预告上限）；扣非净利润3.66亿元，同比+15.62%。
新产能+技改+结构优化，多因素导致Q2营收和净利润创历史新高：Q2实现营收12.89亿元，同比+21%，环比+31%；归母净利润2.35亿元，同比+43%，环比+51%。
2018H1综合毛利率32.63%，同比+0.6个pct，其中Q2毛利率31.89%，同比+0.3个pct，环比-1.05个pct。
2018H1净利率17.19%，同比+1.06个pct，其中Q2净利率18.22%，同比+2.76个pct，环比2.36个pct。
投资建议：预计18-20年净利润分别为8.1/11.0/13.8亿，EPS1.98/2.71/3.39元，当前股价对应PE分别为28.5/21.4/17.1X，给与2018年35X估值，目标价至69.5元，维持“买入”评级。
风险提示：下游需求低于预期；新产能拓展低于预期。",,太平洋证券,买入,[None],2018-09-04,,买入,2218937,pdf_downloads/2018/2018-09-04/603228-景旺电子（603228）：单季新高+股权激励，景旺速度再现江湖.pdf,603228,景旺电子,景旺电子（603228）：单季新高+股权激励，景旺速度再现江湖
"欧阳仕华,唐泓翼","2018H1净利润同比+24%，单Q2净利润同比+43%，好于预期。
公司公告2018H1实现营收22.75亿元，同比+16%，归母净利润3.91亿元，同比+24%，扣非净利润3.67亿，同比+16%。单Q2公司实现营收12.89亿元，同比+21%，归母净利润2.35亿元，同比+43%，2018H1毛利率32.63%，同比+0.59pct，净利率17.19%，同比+1.16pct，单Q2毛利率31.89%，同比+0.30pct，净利率18.22%，同比+2.76pct，环比+2.36pct。公司单2季度利润加速增长，主要系公司管理费用率环比下降2.13pct，以及财务费用下降3.09pct。
公司各地区产能释放稳步推进，营收利润持续增长。
从各子公司情况分析，江西景旺营收同比增长15%，净利润同比基本持平。主要系江西景旺二期建设，已有2条产线逐步投产并释放产能达10万㎡/月，目前公司正进行第三条线的安装和调试工作，预计三季度末投入生产。由于仍处于产能爬坡期，产能稼动率不充分故费用率较高，因此其净利润未同比增长。龙川景旺营收同比增长约19%，净利润同比增长44%。景旺深圳母公司营收同比增长25%，净利润同比增长48%，呈现较快增速。
公司精益管理持续收效，报告期再获客户赞誉，新客户持续拓展。
公司的优秀制造能力和产品品质持续客户高度认可，报告期公司获得博世及海拉“优秀供应商奖”、科世达“最佳配合奖”、vivo“一级FPC品质奖”、天马“全球卓越质量奖”等。依托卓越的产品质量和优秀技术能力，成功引进了汽车电子、新能源、5G应用、OLED显示等应用领域的客户，包括法雷奥、Lumileds、三星SDC、宁德时代、德普特等知名公司，为公司可持续发展打下稳固的基础。
股权激励激发管理层核心动力，给予“买入”评级公司同时公告股权激励计划授予核心高管26人共300万股，授予价格28.56元，为现价约50%，同时公司业绩目标2018-2020相较2017业绩增长率分别为20%/44%/73%。我们预计公司2018-2020净利润818/1017/1253百万元，对应PE28/23/19倍，公司为PCB行业盈利翘首，给予买入评级
风险提示：PCB产业链需求不及预期。",,国信证券,买入,[None],2018-08-31,,买入,2217868,pdf_downloads/2018/2018-08-31/603228-景旺电子（603228）：2018年半年报：新产能稳步释放，Q2加速增长.pdf,603228,景旺电子,景旺电子（603228）：2018年半年报：新产能稳步释放，Q2加速增长
谢恒,"公告：公司公告2018年半年报，上半年营业收入22.75亿元，同比增长15.47%，归母净利润3.91亿元，同比增长23.82%。其中第2季度单季度营业收入同比增长21.03%至12.89亿元，归母净利润2.35亿元，同比增长42.57%。
投资要点
受益江西二期产能开出，业绩快速增长。公司2季度收入增速21%、归母净利润增速42.6%，主要受益于江西二期产能快速开出：一季度末公司江西二期第一条智能化生产线投入生产，二季度投入第二条，随着产能产出快速提升，报告期末已经形成超过10万平米/月的产能。同时，公司上半年计入当期损益的政府补助3745万，进一步增厚了利润。
打造智能化产线，毛利率进一步提升。公司2季度单季毛利率31.89%，同比提升0.3个百分点。由于江西二期项目均为智能化产线，毛利率并没有受到产能爬坡的影响。同时公司对已有工厂的产线改造、提升生产效率、良率，持续优化订单结构，对冲成本上升，对毛利率也产生了积极的影响。我们判断未来随着江西智能化产线全部开出，公司盈利能力还有上升空间。
精细化管理标杆，受益产能有序扩张成长动能充足。
公司作为内资PCB精细化管理的标杆企业，良率、成本控制都是业内最顶尖。产能规划方面，江西二期共规划年产能240万平米，目前第三条线已经进入安装和调试阶段，三季度末将投入生产，今年三条智能化生产线的产能释放有望带动全年业绩快速增长。明年二期剩余产线将系数投入生产，同时珠海景旺已经完成环评申请工作，设计产能硬板年产300万平米、软板200万平米，为新产能的持续扩张奠定基础。客户开拓方面，公司成功引进了法雷奥、德尔福、三星SDC、宁德时代、安费诺、德普特等优质汽车电子、新能源、显示等应用领域客户，为可持续发展打下稳固的客户基础。
同时，公司公告了限制性股票激励计划，以17年净利润为基数，18-21年净利润增速不低于20%、44%、73%、107%，彰显了对未来发展的信心。
盈利预测与投资评级：预计18-20年公司净利润为8.4、11.3、14.1亿元，实现EPS为2.07、2.77、3.46元，对应PE为27.5、20.5、16.4倍，基于公司近两年较快的业绩增长预期，给予“买入”评级！风险提示：PCB产能过剩；产品价格下滑。",,东吴证券,买入,[None],2018-08-31,,买入,2217398,pdf_downloads/2018/2018-08-31/603228-景旺电子（603228）：江西二期产能有序扩张，带动业绩快速增长.pdf,603228,景旺电子,景旺电子（603228）：江西二期产能有序扩张，带动业绩快速增长
刘翔,"新增产能能否顺利消化：总量视角来看，下游增速叠加落后产能退出速度带来的需求缺口约是总量的8%。HDI、FPC等各细分领域新增产能对应产值占预计总产值的比例约为2.9%-8.6%，缺口和增量吻合。未来5年下游集中革新条件下，行业供需是总体平衡的。考虑景旺产能紧缺性、前期储备客户、客均可挖掘订单空间，景旺的新增产能消化比较乐观。
ROE和利润率比同行高的原因：经过拆分测算，ROE高主要是因为净利率高，净利率高主要是因为公司管控直接材料成本能力很强，也很擅长控制制造费用，同时能高效使用人工。公司的固定资产投入回报是最高的，还创新性的解决了PCB生产中固有的7大浪费。
行业集中度将逐步提高，景旺客户集中度将保持平衡：PCB行业的市场集中度提升主要因为自动化生产模式的运用、下游集中度提高倒逼上游、行业准入门槛提高等。景旺未来的客户集中度总体上不会大幅提升，会保持相对分散的状态。原因：历史上做大的硬板厂客户集中度都是相对分散的；硬板的下游相对分散，很难出现像iPhone一样的需要大型PCB供应商配套主力产能，且相互合作才能顺利供货的爆款应用；现有潜在订单空间大的客户众多，不需要去绑定某些大客户。分散有利于降低风险。
环保监管趋严对PCB行业和景旺的影响：环保监管直接出清的产能是不多的，但是环保审批会成为PCB厂商扩张的战略资源。根据分析测算，江西项目在处理能力、回用率、投入、排放量等方面有较大的冗余空间。
投资建议：预计18-20年净利润分别为8.15/11.19/13.86亿，EPS2.00/2.74/3.40元，当前股价对应PE分别为28.5/20.8/16.8X，给与2018年35X估值，目标价70.0元，给予“买入”评级
风险提示：下游需求不及预期、扩产进度不及预期",,太平洋证券,买入,[None],2018-07-19,,买入,2200705,pdf_downloads/2018/2018-07-19/603228-景旺电子（603228）：五问景旺电子，陆资龙头不能说的秘密.pdf,603228,景旺电子,景旺电子（603228）：五问景旺电子，陆资龙头不能说的秘密
耿琛,"软硬兼修铸就多品类PCB优质白马，高效产能稳健扩张锚定100亿+成长空间。公司作为内资线路板龙头长期稳健成长，RPCB/FPC/MPCB产品线全方位布局；公司盈利性出色且财务稳健，毛利率/ROE多项指标业内领先，资产负债率/质押率位居行业较低水平；2018年聚焦优质产能释放＆毛利率上行，中长期关注多品类扩张持续替代周期。
“柔性自动化生产”助力传统制造业质地革新，行业标杆引领大陆线路板产业升级。公司江西一期业内领先，先行试点智能升级，探索内资厂商自动化变革之路。伴随公司二期优质产能加速释放，公司从设备至软件端集自主设计开柔性生产之先河。未来珠海新厂着力FPC＆HDI创新应用领域，多品类有序扩张锚定百亿+产值目标。
大陆延续多层板HDI/FPC持续替代周期，4000亿大空间足够支撑大市值企业。我们再次重申内资PCB产业逻辑：设备/流程设计自主化优势显著，智能柔性生产线催动产业质地上行；陆厂效益指标凸显板块性优势，多层板/HDI/FPC领域加速替代日台；中小厂商EMS区域优势日趋弱化，环保高压迫使低效产能加速出清；供给释放节奏有序需求稳定增长，定制化生产保障高毛利水平稳定。
电子产品轻薄化需求催生新应用，海外厂商收缩大陆有望承接优质订单转移。FPC作为线路板增速最快细分子领域，汽车/消费电子不断催生创新应用；考虑日台厂市场份额及竞争策略持续收缩，大陆有望承接优质订单转移。
盈利预测、估值及投资评级：公司江西二期首条线顺利满产，老厂技改提效，硬板产值增量可观。Q1龙川SMT产线调试完毕，Q2订单持续饱满，全年综合良率仍具提升空间。珠海规划产值预计可达70亿+，有望顺利实现百亿产值目标。我们预计公司18/19/20年归母净利润为8.42/11.38/15.16亿元，当前股价对应PE25.8/19.1/14.3倍，考虑大陆PCB产业正处于从多层板材到HDI/FPC等高端板材的较长内资替代周期，行业大空间有望支撑大市值企业，我们看好景旺电子的中短期业绩弹性及长期龙头潜力，给予2018年35倍估值，维持“强推”评级。
风险提示：PCB行业景气度不及预期；公司产能扩张进度不及预期。",,华创证券,强推,[None],2018-07-12,,买入,2197157,pdf_downloads/2018/2018-07-12/603228-景旺电子（603228）：“柔性自动化”标杆引领大陆PCB产业升级，“多品类龙头”稳健扩张锚定百亿+成长空间.pdf,603228,景旺电子,景旺电子（603228）：“柔性自动化”标杆引领大陆PCB产业升级，“多品类龙头”稳健扩张锚定百亿+成长空间
刘翔,"事件：发行9.78亿元可转债，转股价50.01元/股。募集资金投向江西景旺高密度、多层、柔性及金属基电路板产业化二期项目，年产能240万平方米/年。
业绩增长阻力减小：Q1业绩偏弱（营收同比+9%，净利润同比+3%），主要是因为暂无新项目产能投放，软板业务客户下单谨慎，江西二期前期投入以及研发费用增加，财务费用增加所致。实际上公司Q1硬板业务依然保持同比20%+的高增长，软板业务春节过后下游客户开始集中下单，目前产能打满，Q2业绩预计已重回高增长，原有成长阻力已经大幅减小。
江西二期是公司酝酿多年的代表之作：规划年产能240万平的江西二期项目，拟投资9.78亿元，其中建筑及安装工程14163.30万元、设备购置及安装费用82508.28万元、铺底流动资金3328.42万元。预计今年可新增产量约60-90万平（17年底总产能约340万平），估计均价约750-800元/平米，可新增收入约5亿元人民币。该项目总共分为5条产线，每条产线月产能约5万平米，目前第一条产线已经接近盈利，第二条产线正在安装调试阶段，下半年会安装调试第三条产线。
江西二期是公司酝酿多年的代表之作，在智能化产线设计、环保设计、人员配置上都别具匠心，是行业的标杆之作。达产后，我们预计该项目人均年产值可超200万元（目前江西厂人均产值约90万元/年）。
成长轨迹一目了然，陆资龙头跑步向前：产量上，公司18/19年硬板预计产量390/470万平方米；17年软板产量约75万平方米，珠海项目明年投产，一期年产软板80万平米，产值至少约15亿，公司18/19年软板预计产量85/120万平方米。生产模式上，景旺是国内推行智能化工厂较早的企业，15/16/17年人均产值38/44/51万元，江西二期及珠海厂人均产值可超200万元，还有很大提升空间。产品结构上，公司大力开展了高密度多层柔性板、高精度指纹识别柔性板、77G汽车雷达微波板、高频5G天线板、埋嵌铜块技术、双面凸台板、PCB塞孔树脂等技术研发项目，对相关的产品和技术进行了重点开发和攻关，该等产品将使公司始终占据陆资PCB技术高点，保持长期竞争力，为业绩增长提供长期动力。
投资建议：预计18-20年净利润分别为8.1/10.4/13.9亿，EPS1.97/2.56/3.42元，当前股价对应PE分别为25.5/19.7/14.7X，给与2018年35X估值，目标价至64.0元，维持“买入”评级。
风险提示：下游需求低于预期；新产能拓展低于预期。",,太平洋证券,买入,[None],2018-07-05,,买入,2194386,pdf_downloads/2018/2018-07-05/603228-景旺电子（603228）：可转债发行，对公司未来成长信心坚定.pdf,603228,景旺电子,景旺电子（603228）：可转债发行，对公司未来成长信心坚定
