author,content,filename,org_name,original_rating,pdf_link,publish_time,rating_adjust_mark_type,rating_changes,report_id,save_path,stock_code,stock_name,title
杨林,"一、事件概述。
    1月27日,公司发布2017年度业绩预告修正公告,归母净利润范围调整至19亿元~20亿元,同比增长652%~692%,参考万得一致性预测,年度业绩增速大幅超预期。
    二、分析与判断。
    公司业绩高速增长受益于多产品价格大幅上涨。
    根据公司公告预计调整,公司2017年累计归母净利润预计由先前的15~16.2亿元,调整至19~20亿元,调整后的净利润增速同比增长652~692%。公司四季度归母净利润预增8.3~9.3亿元,同比增长1035~1171%,环比三季度增长59~79%。公司业绩大增主要受益于烧碱、己内酰胺和PC等价格的大涨。受氧化铝取暖季限产前大量备货影响,四季度华北地区片碱(99%烧碱)均价为5,164元/吨,同比增长42.4%,环比增长24.0%,区间价格突破三年历史新高的5,500元/吨,公司具备烧碱年产能40万吨。2018年国内烧碱新增产能仅有80~100万吨,但下游氧化铝、粘胶短纤等行业仍处于扩产周期中,同时氯碱不平衡将限制烧碱行业开工率,我们看好烧碱行业在2018年持续高景气度。而己内酰胺四季度山东鲁西化工报价均价16,191元/吨,同比增长23.8%,环比增长13.4%,公司具备己内酰胺年产能10万吨,预计今年将顺利扩产至20万吨年产能。
    PC扩产进度顺利,引领公司向高附加值产品线转型。
    受进口替代和国内供给缺口影响,四季度华东地区(上海拜尔)均价为29,888元/吨,同比增长38.9%,环比增长21.8%,区间价格突破五年历史新高的32,750元/吨。公司现有6.5万吨光气界面缩聚法PC产能,具备成本优势,此外,公司在建13.5万吨PC产能有望于今年一季度开车,产能逐步释放,后续不排除继续扩产的可能。PC行业国内整体供给紧张,进口依赖度高,目前国内年消费量约为170万吨,自给率为约30%。公司PC产能不断扩大是公司向精细化工转型的重要一步,将为公司带来较大的成长空间。
    园区可利用空间大,业务结构不断延伸,园区开发确保公司受益环保监管加强。
    公司现有园区面积7平方公里,并具备11平方公里的土地储备,为公司未来延伸业务、扩大产能打下夯实基础。此外,受益于园区集中开发优势,公司构筑了较高的环保壁垒。今年环保部将以污水监督治理为重点方向,园区外化工企业由于治理分散和不完善,将继续有大批落后产能淘汰,巩固园区内企业市场占有率。公司在完善产品线、打造高附加值性公司的同时,还不断拓展业务形式。例如公司计划外售自主改进的煤气化装置,伴随油价上涨和煤化工景气度的提升,未来两年煤化工工程施工和采买将增加,公司有望受益。
    三、盈利预测与投资建议。
    预计公司17-19年EPS分别为1.34,2.05,2.46元,对应PE为15.6X、10.2X、8.5X,给予“强烈推荐”评级。",,民生证券,强烈推荐,[None],2018-02-01,,买入,2119054,"pdf_downloads/2018/2018-02-01/000830-鲁西化工(000830)2017年度业绩预告修正公告点评：业绩预增652~692%,受益于多产品大幅涨价.pdf",000830,鲁西化工,"鲁西化工(000830)2017年度业绩预告修正公告点评：业绩预增652~692%,受益于多产品大幅涨价"
"商艾华,黄景文","事件:公司发布2017年度业绩预告修正公告,预计2017年实现归属于上市公司股东净利润19.0-20.0亿元,同比增长652%-692%;实现基本每股收益1.21-1.27元/股,同比增长1239%-1314%。
    煤化工盈利能力大幅改善。公司主要的煤化工产品包括90万吨尿素、170万吨复合肥、5万吨三聚氰胺、10万吨甲酸钠、20万吨甲酸和10万吨DMF。2018年公司新增尿素和化肥各100万吨/年,甲酸20万吨/年,公司产能投产于行业景气周期,有望助力业绩大幅增长。(1)尿素、三聚氰胺和复合肥价格中枢有望持续上移:由于4季度天然气用气紧张,从而导致气头尿素等产能开工率大幅下滑,供给端的大幅收缩导致尿素、三聚氰胺价格快速上涨,2017年4季度尿素价格(尿素小颗粒、山东地区市场价)从1743元/吨上涨至2043元/吨,上涨18%;2017年4季度三聚氰胺价格(鲁西化工出厂价)自7600元/吨上涨至9500元/吨,上涨25%,从而使尿素和三聚氰胺的盈利能力大幅提升。(2)4季度甲酸盈利能力强劲。由于阿斯德的搬迁停车,2017年全球有效产能为86万吨,产量为69万吨,需求为72万吨,导致供不应求,价格快速上涨。2017年4季度甲酸价格(国内现货价)自5900元最高上涨至10000元/吨,涨幅高达69%,促使甲酸盈利能力大幅提升。2018年公司有20万吨甲酸新增产能,随着公司和阿斯德的产能释放,甲酸价格有望回归合理,但公司产能的扩张有望“以量补价”,盈利能力有望持续提升。
    烧碱、双氧水和聚碳酸酯盈利能力持续强劲。公司具备40万吨烧碱、36万吨双氧水、6.5万吨聚碳酸酯的产能,2018年公司新增36万吨双氧水产能、13.5万吨聚碳酸酯产能,公司产能得以大幅扩张。2017年第4季度烧碱均价为3748元/吨,环比上涨24%;双氧水均价为1500元/吨,环比上涨92%;聚碳酸酯均价为28871元/吨,环比上涨21%。公司多产品价格上涨,促使产品在今年出现了价差回升的情况,使公司产品盈利能力得到加强。此外,在烧碱、双氧水、聚碳酸酯供需格局良好的态势下,2018年价格中枢有望持续高位,产能的持续投放为公司业绩快速增长提供保障。
    盈利预测与投资建议。由于公司部分产品价格仍处于高位且2018年公司产能持续投放,我们上调公司盈利预测,预计2017-2019年EPS分别为1.32元、1.86元、2.23元,维持“买入”评级。",,西南证券,买入,[None],2018-01-30,,买入,2118040,"pdf_downloads/2018/2018-01-30/000830-鲁西化工(000830)：业绩持续超预期,看好公司高成长属性.pdf",000830,鲁西化工,"鲁西化工(000830)：业绩持续超预期,看好公司高成长属性"
曹令,"1.搬迁入园打造综合大化工,受益主要产品价格高景气
    公司15年开始实施退城入园,目前园区内已形成大化工一体化产业链,生产成本大幅降低,且能够在外部环保压力较大的情况下保证稳定开工,大幅受益主要产品价格上涨。公司四季度主要产品除丁辛醇外,价格均大幅上涨,我们预计双氧水、甲酸、烧碱和尼龙6等品种贡献了公司4季度的主要盈利。
    2.近期大量新产能投产,18年业绩有望继续保持高增长
    公司17年下半年新投产了己内酰胺、尼龙及双氧水产能,18年预计还将新增PC和甲酸产能,这些都将为公司带来增量。受益于油价上涨、行业小产能出清,公司主要产品18年仍有望保持高景气,业绩预计还将高速增长。
    3.投资建议:
    我们上调公司17-19年净利润至19亿元、27亿元、29亿元,对应EPS分别为1.31、1.84、1.99,目前股价对应PE16X、11X、11X,维持推荐评级。
    4.风险提示:
    新产能投放不及预期。",,华创证券,推荐,[None],2018-01-30,,增持,2167905,"pdf_downloads/2018/2018-01-30/000830-鲁西化工(000830)：受益产品高景气及新产能投放,公司增长超预期.pdf",000830,鲁西化工,"鲁西化工(000830)：受益产品高景气及新产能投放,公司增长超预期"
程磊,"主营产品持续涨价,四季度业绩再创新高:
    公司17年分季度业绩分别为2.4亿、3.1亿、5.2亿和约9亿元,季度业绩呈加速上升趋势。其动力主要来自于公司主营化工品的价格上涨。其中(聚碳酸酯)、甲酸、烧碱(32%,离子膜)、双氧水和尿素四季度均价分别为30440元/吨、7980元/吨、1180元/吨、1480元/吨和1800元/吨,较三季度均价分别上涨22.5%、64.2%、26.9%、68.2%和13.2%,有力推动公司四季度业绩再创新高。
    18年量价齐升,业绩再上台阶:
    2018年公司将有多项产能集中释放,其中己内酰胺10万吨和双氧水24万吨已于17年底投产,PC二期13.5万吨和甲酸20万吨产能将于18年一季度投产,尿素及复合肥总计新增200万产能将于18年年中投产。产品价格方面,除甲酸和烧碱在18年初稍有回落,其余产品依旧保持上升趋势,随着公司产能逐渐释放,我们预计公司一季度业绩将再上台阶达到10亿元级别。
    多产业链协同发展,成长白马属性凸显:
    公司是国内建设智能化工园区先行者,已形成了“煤、盐、氟、硅、石化、新材料”的循环产业链条。2018年公司产能主要包括190万吨尿素、万吨复合肥、40万吨烧碱、40万吨甲酸、20万吨己内酰胺、10万吨DMF、20万吨PC和3万吨有机硅DMC,产业链配套的甲烷氯化物、制冷剂等产品,公司根据市场调节各产品生产比例,实现利益最大化,大幅降低周期性波动,实现稳定增长。
    盈利预测及评级:我们预计公司2017年到2019年净利润为19.55亿,35.35亿以及41.12亿,考虑到公司在园区一体化上的独特优势及主营产品量价齐升,首次覆盖,给予“强烈推荐”评级。
    风险提示:新增产能投产不及预期,主要化工品价格大幅下降。",,诚通证券,强烈推荐,[None],2018-01-30,,买入,2167980,"pdf_downloads/2018/2018-01-30/000830-鲁西化工(000830)：业绩再超预期,18年量价起飞再上台阶.pdf",000830,鲁西化工,"鲁西化工(000830)：业绩再超预期,18年量价起飞再上台阶"
杨伟,"事件:公司发布业绩预增公告,预计2017年度实现归母净利润19-20亿元,同比增长652%-692%。
    主要观点:
    1.凤凰涅槃,业绩再创新高
    公司对标巴斯夫化工园区,自2004年打造中国化工新材料(聊城)产业园,如今开花结果,连续多年获得“中国化工园区20强”。根据业绩预告,2017年Q1-Q4,公司分别实现归母净利润2.40亿元、3.11亿元、5.21亿元、8.28-9.28亿元,环比大幅提升,总计约19-20亿元。
    2.产业链完善,熨平周期影响
    公司以煤、盐、芳烃等为原料形成了煤化工、氯碱、氟硅化工、化工新材料的循环产业链,拥有年产能90万吨尿素、140万吨复合肥、40万吨烧碱、22万吨甲烷氯化物、10万吨氯磺酸、8万吨氯化苄、5万吨氯化石蜡、54万吨双氧水、2.5万吨DMC、10万吨DMF、20万吨甲酸钠、20万吨甲酸、20万吨丁醇、17万吨辛醇、10万吨己内酰胺、7万吨尼龙6、6.5万吨PC。东方不亮,西方亮,公司产品品类繁多覆盖多个子行业,一定程度熨平周期影响。
    3.新产能释放,未来业绩持续增长
    公司在建20万吨甲酸、10万吨己内酰胺、13万吨尼龙6、13.5万吨PC预计2018年陆续投产,36万吨双氧水预计2019年投产,公司业绩增长有保障。
    4.盈利预测及评级
    公司园区及环保壁垒高,充分受益化工景气周期,我们预计公司2017-2019年归母净利分别为19.65亿元、26.40亿元和34.94亿元,对应EPS 1.34元、1.80元和2.39元,PE 16X、12X和9X,维持“买入”评级。
    风险提示:产品价格大幅波动,在建项目投产进度不及预期。",,太平洋证券,买入,[None],2018-01-29,,买入,2117460,"pdf_downloads/2018/2018-01-29/000830-鲁西化工(000830)：业绩再创新高,化工新材料龙头持续验证.pdf",000830,鲁西化工,"鲁西化工(000830)：业绩再创新高,化工新材料龙头持续验证"
沈瑞,"一体化奠定竞争优势，园区化发展先行一步
公司目前拥有煤化工、盐化工、氟硅化工和化工新材料几大业务，多条业务线协同发展，以合成气为核心形成了较完整的一体化产业链条，循环经济带来较大的成本优势，在行业中盈利能力排名前列。公司于2004年开始展开化工园区的建设，目前已经形成规划面积18平方公里的产业园区，园区环保投入可观，在环保压力愈发严厉的趋势下，抗压能力较强。公司在园区化发展方面相比竞争对手已经先行一步，为公司的稳定生产奠定了坚实基础。
供给侧改革致供需格局改善，已驶入业绩增长快车道
2016年下半年以来，环保压力逐渐增大，政策密集出台以及环保巡视组多轮核查，化工行业中小产能受到较大影响，关停企业众多，有效产能大幅收缩，供需格局明显改善，多数产品价格快速上涨，龙头企业盈利水平回归较好水平。公司产品覆盖己内酰胺、多元醇、聚碳酸酯、甲烷氯化物、甲酸、氯化石蜡、尼龙6、氯化苄、有机硅、烧碱、DMF、尿素、复合肥等百余种产品，多数产品价差持续扩大，盈利水平持续提升。我们认为，在环保压力已成常态的背景下，短期供需偏紧的格局难以被打破，公司产品多点开花，业绩已经进入快速增长快车道。
进入产能释放关键年，业绩将持续增厚
2018年将是公司产能释放的关键年份：1）园区新建100万吨尿素和100万吨硝基复合肥装置将投产，同时配套60万吨合成氨联产和30万吨甲醇产能；2）20万吨甲酸二期工程在建，有望于下半年投产；3）聚碳酸酯二期13.5万吨项目建设中，有望按时投产；4）10万吨己内酰胺，配套20万吨尼龙6产品也将投产。我们认为，公司上述产能投产将成为公司业绩持续增厚的有效保障
盈利预测与投资建议
预计公司2017～2019年EPS分别为1.12元、1.69元、2.25元，对应PE分别为15.1倍、10.0倍、7.5倍，给予公司“买入”评级。
风险提示:仲裁事项存在一次性减值风险。",,财通证券,买入,[None],2018-01-04,,买入,2245362,pdf_downloads/2018/2018-01-04/000830-鲁西化工（000830）：产品价差持续扩大，业绩或将超预期.pdf,000830,鲁西化工,鲁西化工（000830）：产品价差持续扩大，业绩或将超预期
李梦强,"核心观点

十载打造化工产业园区，多产业纵横拓展协同并进，一体化优势显著。鲁西化工集团股份有限公司是集化工、化肥、装备制造及科技研发于一体的综合性化工企业。公司于2004年开展化工园区建设，建成具有煤化工、盐化工、氟硅化工及新材料等产品线的综合型化工企业。产业链互相耦合，循环经济优势显著，抗市场波动能力强，盈利稳定性突出。园区具有智能在线监测平台，保障企业安全和清洁生产。

聚碳酸酯（PC）产销顺利，二期产能明年有待释放，公司届时将具有20万吨PC产能跻身国际巨头。公司现有一期6.5万吨光气界面缩聚法PC产能。PC行业整体供给偏紧，进口依赖度高，目前全国年消费量170万吨，供给仅60万吨；产能投资门槛较高，未来新增产能投产仍需要一定周期。PC产品自去年底20000元/吨的水平以来一直处于上涨区间。一期PC项目建设并达产以来，公司形成了完备的工艺技术和装备设计积累，产品质量稳定，为二期项目投产打下了坚实基础。此外，公司现有园区面积7平方公里，并具备11平方公里的土地储备，具有较为广阔的延伸空间，未来成长性可期。

传统产业平台亮点颇丰。甲酸方面，阿斯德停产一年预计复产困难，市场供给持续紧张，2017Q4季度均价涨至7000-8000元/吨，公司二期甲酸项目20万吨有望于明年开车，成为国际第一巨头。烧碱方面，受益于下游需求增长及供给侧氯碱失衡和环保关停带来的收缩，烧碱行情高位持续；公司具有完备耗氯下游，烧碱满产时仍具有富余消化能力，液氯可通过外购获得。公司粉煤气化平台成本优势突出，为园区发展奠定稳固基础。

财务预测与投资建议

我们预测公司2017-2019年每股收益分别为1.11、1.62、2.07元，我们认为目前公司的合理估值水平为2018年的14倍市盈率，对应目标价为22.68元，首次给予买入评级！

风险提示

新产能建设及投产不达预期；产品需求不及预期，价格波动风险；环保限产。",,东方证券,买入,[None],2017-12-18,,买入,2096445,"pdf_downloads/2017/2017-12-18/000830-鲁西化工(000830)：园区经济纵横延伸打造一体化壁垒,稳定性叠加成长性增强业绩确定性.pdf",000830,鲁西化工,"鲁西化工(000830)：园区经济纵横延伸打造一体化壁垒,稳定性叠加成长性增强业绩确定性"
"柴沁虎,沈晓源","投资要点

公司由传统煤化工转型精细化工生产企业：鲁西化工是国内领先的煤头尿素生产商，近年来公司通过不断探索，在先进的煤气化平台的基础上，产品不断多元化。当前公司产品可以分为三大板块：以原盐为原料的烧碱、耗氯化学品及含氟化学品，以煤为原料的碳一化学品及其下游衍生物，以苯为原料的芳香族化学品及其衍生物。丰富的产品结构使得公司在产品价格波动周期中可以保持较好的盈利水平。

公司具备环保优势，受益于以环保为抓手的供给侧改革：鲁西化工作为国资背景的市属企业，历年来在环保投入上较为到位，生产设施环保标准领先。在环保趋严的背景下，公司所在产品链的许多产品出现供不应求，纷纷涨价。公司在环保检查中开工受影响较小，充分受益于产品价格上涨，今年利润将有大幅提升。

公司碳一化学品品种全，抗价格波动能力较强：碳一化学品的特点有三个：第一是多为基础化学品，产品同质化较为严重，因此价格竞争比较激烈；二是煤价走势对产品价格影响较大；三是对环保政策较为敏感。相对而言，公司的碳一化学品规模较大，环保管理做得比较好，且产业链覆盖广，原料基本可以实现自给，因此抵抗价格波动的能力较强。在公司的碳一化学品中，甲酸盈利能力较强，当前公司为国内甲酸绝对龙头，具有较高的定价话语权。2018年，公司20万吨甲酸新产能有望投产，届时有望为公司贡献较大的利润增长。

芳香族化学品中，PC为公司带来成长性：未来公司的发展定位将是附加值较高的精细化工品生产商。聚碳酸酯PC具备巨大的进口替代空间，其生产也具备一定的技术壁垒。鲁西的6.5万吨PC成功投产是公司向精细化工转型的重要一步，其原料采用自产光气，具备一定成本优势。我们预计公司13.5万吨的在建PC产能有望在2018年一季度投产，产能将会逐步释放。PC产能释放将为公司带来较大的成长空间。

耗氯产品丰富，破解“氯碱平衡”难题。公司现有40万吨烧碱产能，且自发电成本较低，烧碱的盈利情况良好；此外，在液氯市场低迷的背景下，公司的耗氯化学品种类丰富，可以有效消化液氯产能，抵抗市场风险，化解氯碱平衡的难题。

投资建议

我们预计公司17-19年净利润为16.74、24.71和29.11亿元，EPS为1.14、1.69和1.99元，PE为14X、9X和8X，首次覆盖，给予“买入”评级。

风险提示：仲裁事项或有计提减值可能；产品价格大幅下降；投产不达预期",,东吴证券,买入,[None],2017-12-11,,买入,2094701,"pdf_downloads/2017/2017-12-11/000830-鲁西化工(000830)：依托煤气化平台,成功向精细化工转型.pdf",000830,鲁西化工,"鲁西化工(000830)：依托煤气化平台,成功向精细化工转型"
杨伟,事件：近期至公司实地调研，就公司经营情况进行了交流。观点：智慧园区与产业链一体化优势明显。自1998年上市以来，公司扣非后归母净利润一直徘徊在2-3亿元，顶峰在2011年的3.86亿元。但公司一直保持着较大的固定资产投资，延伸产业链并逐步转型升级，2011年以来固定资产投资规模一直保持在20亿元以上，过去10年累计投资约230亿元。公司2004年开始打造中国化工新材料（聊城）产业园，对标巴斯夫化工园区，如今开花结果，连续多年获得“中国化工园区20强”。公司以煤、盐、芳烃等为原料形成了煤化工、氯碱、氟硅化工、化工新材料的循环产业链，拥有年产能90万吨尿素、140万吨复合肥、40万吨烧碱、22万吨甲烷氯化物、10万吨氯磺酸、8万吨氯化苄、5万吨氯化石蜡、54万吨双氧水、2.5万吨DMC、10万吨DMF、20万吨甲酸钠、20万吨甲酸、20万吨丁醇、17万吨辛醇、10万吨己内酰胺、7万吨尼龙6、6.5万吨PC，一体化优势明显。2017年1-9月份，公司实现归母净利10.72亿元，10月份我们测算在2亿元以上，今年利润预计超过去五年之和。园区及环保壁垒高，受益环保监管升级。虽然公司所处区位不具备交运优势，但公司构筑了极高的园区及环保壁垒，受益15年以来化工行业供给侧改革持续推进。未来山东将持续提高环保及产业标准，大幅降低化工园区数量，淘汰落后产能，倒逼化工产业升级，三年攻坚、两年巩固，公司将充分受益由此带来的化工品供给短缺与价格景气行情。充分受益化工品涨价及扩产，业绩有望持续超预期。公司多个主营产品处于景气周期，如PC、甲酸、烧碱、尼龙6等，预计公司业绩将持续超预期。判断某一化工品的涨价幅度及持续时间很难，但公司产品品类繁多覆盖多个子行业，具有一定熨平周期效应。而且公司在建20万吨甲酸、10万吨己内酰胺、13万吨尼龙6、13.5万吨PC预计2018年投产，有望持续支撑公司业绩增长。盈利预测与投资评级。公司由传统化肥企业转型升级为精细化工和新材料企业，龙头初成。暂不考虑诉讼影响，我们上调盈利预测，预计公司17-19年EPS分别为1.14元、1.69元、2.18元，对应PE14X/9X/7X，维持“买入”评级。风险提示：化工品价格持续下滑的风险，新产能达产延迟导致业绩不达预期的风险。,,太平洋证券,买入,[None],2017-12-04,,买入,3609612,pdf_downloads/2017/2017-12-04/000830-鲁西化工（000830）：凤凰涅盘，化工新材料龙头初成.pdf,000830,鲁西化工,鲁西化工（000830）：凤凰涅盘，化工新材料龙头初成
"商艾华,黄景文,徐文浩,李海勇","投资要点

事件：公司发布三季报，略超过前期业绩修正预告的上限。2017年前三季度，公司实现营业收入110.65亿元，同比增长43.64%，归属于上市公司股东净利润10.72亿元，同比增长497.16%，扣非后净利润10.49亿元，同比增长625.12%，经营活动产生的现金流量净额26.92亿元，同比增长204.98%，EPS0.66元。公司预计2017年全年净利润15-16.2亿元，同比增长494%-541%。

化工品中多个品种的价差回升，带动公司盈利能力大幅回升。2017第三季度，公司尿素价格同比增长30%，复合肥价格同比增长7%，烧碱价格同比增长63%，聚碳酸酯同比增长31%，正丁醇价格同比增长33%，甲酸价格同比增长123%，辛醇价格同比增长42%。公司多产品价格上涨，促使产品在今年出现了价差回升的情况，使公司产品盈利能力得到加强，也使公司营业收入远低于净利润增速。此外，公司的烧碱、聚碳酸酯因产能投放而销量增加，业绩得以大幅增加。

资产负债表得到一定改善。2017年第三季度公司短期借款减少约5亿，截止三季度末，公司的资产负债率从年初的65.52%下降到63.32%，我们预计公司资产负债表的改善还将继续。

未来还看公司产能扩张和一体化。公司在新材料产业园基础上，持续开展化工产品产能新建和扩张。未来公司将会投放的新产能为己内酰胺10万吨/年、聚碳酸酯13.5万吨/年、甲酸20万吨/年、尿素和化肥各100万吨/年。公司的一体化优势将会持续发挥作用，比如合成氨甲醇的联产，就降低了公司的甲醇外购量。

盈利预测与投资建议。由于公司的产品价格在三季度大幅上扬，而且目前部分产品仍有上涨的趋势，我们上调盈利预测，预计2017-2019年EPS分别为1.05元、1.39元、1.57元，未来三年归母净利润复合增速达到108.89%，目前申万行业指数分类标准下，化学制品、化学原料行业整体估值38.99、33.25倍（TTM，整体法），公司估值显著低于行业水平，考虑到公司的发展和行业地位，我们给予公司2018年12倍的估值水平，目标价16.68元，维持“买入”评级。

风险提示：财务杠杆偏高、资本开支短期较大、产品价格波动较大、退城进园项目及在建项目推进及达产或不及预期。",,西南证券,买入,[None],2017-10-27,,买入,2073984,"pdf_downloads/2017/2017-10-27/000830-鲁西化工(000830)：全年预计高增长,看好明年.pdf",000830,鲁西化工,"鲁西化工(000830)：全年预计高增长,看好明年"
